business	Ụtụisi gọọmentị na-achọ ịtọgbu anyị - ụfọdụ ndị bi n'Anambra na-ekwu	"O﻿kwu e ji mara ọchịchị Chukwuma Soludo n'Anambra Steeti bụ ""kwee ka ụtụisi gị rụọrọ gị ọrụ"" mana ụfọdụ ndị bi na steeti ahụ na-ekwu na oke ụtụisi na-achọzi ịtọgbu ha. N'izu ụka gara aga, ngalaba mkpofu ahịhịa nke Anambra steeti bụ 'Anambra State Waste Management Board (ASWAMA) wepụtara ụgwọ ọhụrụ nke ndị bi na steeti ahụ ga na-akwụ iji kpofu ahịhịa ha. Ụ﻿gwọ ọhụrụ a nke a buliri elu malitere ịdị ire n'ụbọchị mbụ nke Ọkụtoba 2022. N﻿dị gwara BBC Igbo okwu kwuru na ego na-abata ha n'aka na-epewanye mpe, gọọmentị abịakwa na-ebuli ụtụisi. C﻿hukwudi Ugwu, onye na-azụ ahịa n'Eke Ọka kwuru sị: ""Ụtụisi niile a akarịala, ọ ga-eme ka ọnụego ihe n'ahịa na-agbali elu ebe ego e ji azụta ihe ndị a na-agbatu."" ""﻿Anyị ma na gọọmentị anaghị enwetazi nnukwu ego ha ji arụ ọrụ, mana okwesịghị ka ọ bụrụ ndị mmadụ nkịtị ka ha ga-ebufere ya."" N'aka nke ya, Oriaku Tonia Chukwuanu kwukwara ihe yiri nke a; ""mbuli ụtụisi a na-abịa n'oge ọjọọ,"" Tonia kwuru. ""﻿Ọtụtụ ndị ahịa na-agabiga nnukwu nhịahụ ugbua n'ihi etu ọnọdụ akụnụba obodo anyị dị. Ọ ga-adị mma ma gọọmentị tulee ihe ndị a tupu ha ebuliwe ụtụisi."" V﻿ivian Okafor, onye na-ere nri, kwuru nke ya hoohaa, ""mbuli ụtụisi a na-atọgbụ ahịa anyị"". I﻿ji maa atụ, Vivian kwuru na ụtụisi gọọmentị nyere ha bụ ndị na-ere nri bụ N48,000 kwa afọ. ""﻿Ndị obere ụlọ ahịa (smale and medium scale business) agaghị ekuteli ume n'ụtụisi niile ndị a,"" ka o kwuru. '﻿Sanitation' rate' nke ndị ASWAMA tinyere malitere ịdị ire n'ụbọchị Ọkụtoba 1. N﻿'ime nke a enwere ngalaba atọ: Ime obodo, obodo ndị mepetụrụ emepe, na obodo ndị mepere emepe nke ọma. N﻿galaba atọ a nwechara ụgwọ dị icheiche ha kwesịrị ịkwụ, lee nkọwa ya na foto dị n'elu. Ụ﻿tụisi ndị ọrụ okporoụzọ N﻿ke a na-abịa dịka ndị ọrụ ụgbọala, ndị keke na ndị na-anya ọgbatumtum ga mere ngagharịiwe maka ego ụtụisi ọhụrụ nke gọọmentị Anambra steeti wepụtara ka ha na-akwụ kwa ọnwa maọbụ kwa afọ. Lee etu ụtụisi nke a si dị: G﻿ọọmentị Anambra kwuru na tupu oge a, ndị ọrụ ụgbọala na-akwụ ụgwọ karịrị nke a n'aka ndị agboro, mana ya bụ ego anaghị abata n'akpa gọọmentị. Y﻿a mere o ji tinyezie usoro ụtụisi nke a ma machie onye nkịtị ọbụla ịnakọ ndị ọrụ okporoụzọ ụtụisi. Ụ﻿tụisi ndị na-ere mmanụ 'petrol' N﻿'ọnwa June kwa, otu jikọrọ ndị na-ere mmanụ ụgbọala, bụ 'Independent Petroleum Marketers Association' kwuru na ha ga-agba abụbụ ọrụ n'ihi na gọọmentị buliri ego ha na-akwụ karịa 40%, site na N100,000 ruo N150,000. Mana h﻿a mechara kagbuo abụbụọrụ ahụ dịka gọọmentị wepụturu obere ego n'ego ahụ ha na-akwụ ka ọ bụrụzie N120,000."	https://www.bbc.com/igbo/articles/c06x4vlrm38o
religion	End Sars: Ihe Fada Mbaka gwara ndị kwuru na ha ga-agba 'Adoration Ministry' ọkụ	Ụkọchukwu ama ama bụ Fada Ejike Mbaka ekwuola na o nweghi onye kachasị akwado ndị ntoroọbịa na Naịjirịa karịa ya Mbaka kwuru nke a mgbe ọ na-akatọ akụkọ pụtara na soshal midia na ndị omekome gbara ụlọ ekpere 'adoration' nọ n'Umuchigbo ọkụ n'ihi ngagharịiwe Endsars. Ọ dọrọ ndị mmadụ aka na ntị ka ha ghara ị na-ekwuto aha ya na soshal midia ma na-atụ asị emegide ya. O kwuru na onweghi enyemaka ọbụla 'adoration ministry' nweterela n'aka Onyeisiala Buhari kamgbe ọ bara ọchịchị. O kwuru na o nweghị 'oil block' ọbụla Onyeisiala Buhari nyere ya nke o ji enwe onye ewere n'ọrụ n'aha ya. Nlegharị anya BBC Igbo legharịrị n'ogige ekpere a gosikwara na ọ bụ eziokwu na o nweghị ọkụ ọbụla a gbara n'adoration' Enugwu.	https://www.bbc.com/igbo/afirika-54706283
health	Lassa Fever Outbreak: Etu e si eme ka garri ghara ibunye mmadụ ọrịa	Garị bụ nri ndị mmadụ na-erikarị na Naịjirịa. Ebe ụfọdụ na-aṅụ ya aṅụ, ụfọdụ na-elo ya ka nri olulo. Aha garị na-ewu ewu ugbua makana ndị mmadụ na-ekwu na iri ya nwereike ịbụ usoro e ji ebute ọrịa Lassa. Ihe mere nke a bụ makana anaghị esi gari a na-aṅụ aṅụ n'ọkụ. Isi nri n'ọkụ so n'ime usoro kachasị e ji egbu nje na-adị na nri. Okwu garị malitere n'etu e si eme ya. Njem garị na-amalite n'ugbo, ebe ọ ga-esi gaa ebe a ga-akwọ ya ma a bachasịa ya. Akwọchaa ya, ọ bụrụzịa ighe ya eghe. E ghechaa ya, a gbaa ya n'akpa ebe a ga-esi na-ewere ya ọ ma a chọọ garị a na-elo elo maọbụ nke a na-awụnye na mmiri ṅụọ. Gịnị jikọrọ garị na ịba Lassa? Ebe ndị mmadụ na-esi ekwute okwu ịba Lassa na garị bụ na a na-eche na oke - bụ anụmanụ na-ebukarị ọrịa Lassa - na-abanyekarị na garị dị n'ụlọ ma ọ bụrụ na egbochighi ya ọfụma. Mana, o nwekwara ndị na-agbasa garị n'anwụ ma ha ghechaa ya. Oke bu nje a nwereike ijiri ohere a garị nọ na mbara/ezi banye n'ime ya, metọchaa ya mgbe ọ rịrị ya elu, ma tinyekwa ya nje ahụ. Mmadụ kporozie ya wụnye na mmiri ṅụọ o kote okwu. Ọ bụrụ na ị goro garị n'ahịa lee ihe i ga-eme ka ọ bụrụ ihe agaghị ebunye gị ọrịa: Ọ bụrụ nke i ji aka gị eme ya: Site n'usoro ndị a, mgbochi ịba Lassa ga-enwe isi. Mana, matakwa na ọ bụghi sọsọ garri ka e si enweta ya bụ ọrịa, onwe etu ahụ sị eme gị biko jiri ọsọ gaa n'ụlọọgwụ. Akụkọ ga-amasị gị:	https://www.bbc.com/igbo/afirika-51222234
sports	Foto Diego Maradona: Nlereanya maka ndụ dike a bụ ọkaibe na bọọlụ	Diego Armando Maradona, onye e ji ịgba bọọlụ mara, nwụrụ n'ụbọchị Wenezde, Nọvemba 25, 2020. Ọ gbara afọ iri isii.	https://www.bbc.com/igbo/afirika-55074817
business	Personal Finance: Uzọ ị ga-esi chekwatụ ego gị maka ọdịnihu- Ọkachamara	Onye nhazi ego (Personal Finance expert) bụ Uche Iheanacho gwara BBC Igbo na ọ ka mma iwepụta otu n'ụzọ iri n'ime ihe onye na-enweta ma chekwa ya.	https://www.bbc.com/igbo/afirika-49485708
sports	Manchester United vs Chelsea: E gosila Man Utd na onyeisi nkwọcha anaghị aga ọgụ okwute	Otu egwuregwu bọọlụ Chelsea ejirila iwe mekpaa ndị Manchester United ahụ oge otu abụọ a zutere onwe ha na mgbede ụbọchị Sọnde. Ọkpụ goolu atọ a satara otu ka ha ji merie ha ma gafee n'agba ikpeazụ nke iko FA. David De Gea bụ okwu a kpụ n'ọnụ n'asọmpi a n'ihi aka mbe o chere ugboro ugboro nke mere e ji merie ndị Man Utd. Olivier Giroud na Mason Mount nyeteere Chelsea goolu ebe Harry Maguire ji aka ya gbakpuo bọọlụ na neetị ndị Man Utd iji mezuo ya ọkpụ atọ. Bruno Fernandez ji penariti nyetere Man Utd otu mkpụrụ goolu nke ha ji gbaa aka ahịa. Ọ bụzị na Chelsea na Arsenal ga-agba asọmpi nke a gbachaa e buru n'iko FA. Cheta na Arsenal nyụrụ Manchester City ịkpakwụ n'ụbọchị Satọde. Ọkpụ abụọ asataghị asata ka Arsenal ji merie Man City.	https://www.bbc.com/igbo/egwuregwu-53467193
religion	Anambra Church Invasion: A mabeghi ndị wakporo ụlọụka n'Aguleri - Uweojii	"Uweojii Anambra Steeti ekwuola na ọ bụ ndị ha na-eche na ha bụ ndị ohi gara n'ụlọụka Anglican dị n'Aguleri merụọ ụkọchukwu na ndị ọzọ ahụ. Ọnụ na-ekwuru ndị uweojii bụ Haruna Mohammed mere ka BBC Igbo mata nke a. Ọ gara n'ihu kwuo na ọ bụghị nwakpo ndị obodo ọzọ mere dịka akụkọ na-efegharị na soshal midia. Kama na nyocha ka na-aga n'ihu ịmata ndị mere arụ a ma chọpụta ihe bụ ebumnobi ha na mwakpo ahụ. Ọ sị; ""Onweghi onye ga-asị na ọ bụ mwakpo ndị obodo ọzọ mere kama nyocha ka na-aga n'ihu ịmata nke bụ eziokwu."" Mana onyeisi obodo bụ Hipo Onwuegbuke gwara ndi ntaakụkọ na mwakpo a akarịala naanị izu ohi. O kwuru na ụdịrị ya emeela na nso nso bụ nke ndị nchekwa obodo gbochiri. Akụkọ pụtara na ngwụcha izuụka na ndị omekaome wakporo ụlọụka St Peters Anglican dị n'Agụleri Anambra Steeti n'ụbọchị 2 ọnwa Julaị. Na mwakpo a, ha merụrụ onye nkuzi ụlọụka bụ Christopher Chukwu, onye ụkọchụkwụ bụ Akachukwu Ikedilo na ọnye ọzọ bụ Mathew Nwude ahụ. Ndị omekaome riri mbọmbọ ọsọ tupu ndị uweojii na ndị nchekwa obodo erute ebe ahụ. Dịka ọ dị ugbua, ndị merụrụ ahụ nọ n'ụlọọgwụ anata ọgwụgwọ."	https://www.bbc.com/igbo/afirika-48912737
entertainment	"""Ịgba egwu Salsa zọrọ ndụ m"" - Emeka Adindu"	"Onye nkuzi egwu Salsa bụ Emeka Adindu agwaala BBC Igbo etu egwu Salsa si zọ ndụ ya. O kwuru na ọ bụ mmetọ n'ụzọ mmekọ ahụ ọ gabigara mgbe ọ bụ nwata mere ka o malite ịche echiche ịgbu onwe ya ka o ji gbakwuru Salsa. ""A chọrọ m ịkọ akụkọ m ka ndị nne na nna anyị were mụta akọ n'ebe ụmụaka ha nọ"" ka o kwuru. Ugbua o kwuru na o ji akara aka a enyere ndị ọzọ obi ha na-ada mba aka. Lee ihe niile o kwuru n'ime ihe onyonyo a. Akụkọ a si n'aka Jessica Nwankwo na Vining Ogu."	https://www.bbc.com/igbo/afirika-51385104
business	Marksman Chinedu Ijiomah: Ejịghị m ego ndị mmadụ mee 'dorime'	"Onyeisi ụlọọrụ Chinmark Group bụ Marksman Chinedu Ijiomah ekwuola na ihe mere ya ji ghara imezu nkwa ịkwụ ndị tinyere ego n'ụlọọrụ ya bụ n'ihi na ngalaba na-ahụ maka itinye ego n'azụmahịa a kpọrọ Security Exchange Commission(Sec) natara ikike gbachie akpaego ya na nke ụlọrụ ya dị n'ụlọakụ. Chinmark na Chinedu Ijiomah na-ewu kemgbe na soshal midia maka etu ndị mmadụ si pụta na-ekwu na o kweghị akwụ ha ụgwọ o ji ha dịka ụfọdụ n'ime ha tinyere ego ha n'ụlọahịa ya iji nweta isi ego na ọmụrụnwa. Ọtụtụ ndị a na-eti mkpu ego ha kwuru na mbọ niile ha gbarala maka nke a dara mmiri dịka Ijiomah gbachiri ekwentị ya ma were ndị agbero wujuo n'ụlọọrụ ya dịga na mpaghara di iche iche na Naijiria nakwa na Dubai. Na mkparịtaụka ya na BBC Igbo nwere, Ijiomah kwuru na ọ bụghị ọsọ ka ya gbara kama na SEC gbachiri akpaego ya, nke nwunye ya na nwa ya. O kwuru na o nweela ndị ya kwụrụ ụgwọ n'ime ihe ruru mmadụ 400 tinyere ego n'ụlọahịa ya. ma kwekwa nkwa na ya ga-anwụ ndị fọrọ afọ ma ọ bụrụ na ha nye ya ohere ọnwa asaa na-abịa. Ngalaba Securities & Exchange Commission (SEC) nke Naịjirịa depụtara n'ọba ozi webụsaiti ha akwụkwọ ozi katọrọ atụmaatụ oji ego achụ ego nke ụlọahịa Chinmark Group. Akwụkwọ ozi ahụ bu deeti December 25, 2021 dọrọ ndị mmadụ aka na nti ka ha mata na Chinmark group nke nọ n'okpuru aha Fin Africa Investment Limited edenyeghị aha azụmahia ya n'akwụkwọ SEC ma na-ekwu na onye ọbụla ya na ha na-emekọ ihe, ihe ọ hụru ya jiri isi ya buru. Ụlọọrụ Chinmark Group dịka ha siri kọwa na websaiti ha bụ ụlọọrụ nwere ọtụtụ alaka nke gụnyere ewumewu ụlọ (Chinmark Homes and Shelter) ọrụugbo ( Chinmark Farms, njem (Chinmark Rides), erimeri(Chinmark Restaurant & Foods services) wdgz. Isiụlọọrụ ahụ dị na 162 Ogui Road, Enugwu. Udiri ihe a ometụla mbụ na Naịjiria? Ihe na-eme n'ụlọ ọrụ Chinmark ugbua yitere atụmaatụ MMM nke a na-akpọ ""Mavrodi Mundial Moneybox"" na bekee. Ndị nwe atụmaatụ a kwuru na ha ji ya enyere ndị mmadụ aka  mana ụlọakụ ukwu (Central Bank of Nigeria) gọọmenti Naịjirịa dọrọ ndị mmadụ aka na ntị ka ha gbara ya bụ atụmaatụ ọsọ. N'ọnwa Aprelu nke afọ 2018 ka ndị nwe ya bụ atụmaatụ gwara ndị mmadụ na ha gbachiri ọnụ ụzọ ha maka onyeisi ha bụ Sergie Mavrodi anwụọla. Ọtụtụ ndị mmadụ si mba Ghana, Kenya nakwa Naijirịa tufuru ọtụtụ ego mgbe aka bidoro gbajiwe atụmaatụ a n'afọ 2016."	https://www.bbc.com/igbo/afirika-60881851
health	Madagascar Coronavirus: Gịnị dị n'ime ọgwụ ọhụrụ a azụtara na Madagascar?	"Dịka gọọmentị Naịjirịa nyere iwu ka a tụbata mgbọrọgwụ nke e mepụtara na mba Madagascar iji gwọọ ọrịa coronavirus, ọ bụrụla akụkọ na-ewu ewu ebe niile. Ụfọdụ mmadụ dịka otu onye Dọkịta bụ McGinger Ibeneme kwuru na ọ ga-adị mma itule ya bụ ọgwụ dịka Minista ahụike bụ Osagie Ehanire si kwuo. O kwuru nke a n'ihi na n'ọnụ ya ""Coronavirus anyụọla mbaụwa niile ịkpakwụ"" ya mere a ga-eji chọọ ọgwụgwọ ọsịsọ. Ngalaba ahụịke bụ World Health Organisation (WHO) na-adọkwa aka na ntị ka e mee ọgwụ ahụ nnyocha mara ma ọ ga-adị mma n'ime ahụ mmadụ tupu e nye ya onye bu ọrịa a. Kedụ ka o si atọ? Lee ihe anyị ma:"	https://www.bbc.com/igbo/afirika-52631191
business	Etu mmachi otu jikọtara ndị keke si emetụta ndị Anambra steeti	"Ndị bi n'Anambra steeti gwara BBC Igbo etu mmachi gọọmentị steeti ahụ machiri keke na bọọsụ si emetụta ha. Ha kwuru na kemgbe a machiri ụgbọala ndị a, na ịgara mkpa ha na-arazị ahụ. Ebe ụfọdụ kwuru na iji naanị ụkwụ agagharị na-egbuzi ha mgbu n'ahụ, ndị ọzọ kwuru na ọ bụ ha bụ ""ụmụogbenye"" na-enweghi ụgbọala nke ha ka ọ kacha emetụta. Ndị na-anya keke ji ohere ahụ gwa gọọmentị ka ha mee ebere ma butuo ego ole gọọmentị na-ana ha n'ụtụisi. Cheta na Gọọmentị Anambra steetị depụtaburu akwụkwọ maka mmachị a na steeti ahụ, ebe ha nọ kọwaa na ihe kpatara ya bụ mmachi bụ maka etu ụfọdụ ndị otu a sị azọ ọkwa onyeisioche ga na-anakọta ego n'ọgbọ (park) ha. Nke a mere ka gọọmentị steetị ahụ machie ha ọnwa isii ruo mgbe gọọmentị ga-enyochacha ihe butere nsogbu n'etiti ha. Gọọmentị kwukwara na ndị otu a na-ebute ọgbaaghara n'obodo, ma kwuo na machi a ga-enyere ndị otu ahụ aka ịhazigharị onwe ha, họpụta ndị isi bụ nke gọomentị ga-amata dịka ndị isi ha. Gọọmentị na ndị otu a kwekọrịtaburu na ha ga-amailte ịna ụtụisi dị icheiche ma hibekwa ụsọrọ enyemaka ga-enyere ndị ọkwọụgbọala aka, ọkachasị n'ahụike ha. Na ya bụ nkwekọrịta, ndị keke ga-amalịte ịkwụ N4,000 n'izuụka maọbụ N15,000 n'ọnwa. Ndị Keke nọ n'okpuruọchịchị asatọ ebe e nwere ọnọdụ onye apụla ezi n'abalị, ga-akwụ N3000 n'izụụka maọbụ N12,000 n'ọnwa. Ndị dị etu a ga-amalitekwa ịkwụ N4000 kwa izuụka nakwa N15,000 kwa ọnwa mgbe e wepuru ọnọdụ onye apụla ezi n'ogbe ha. Ndị bọọsụ ga-akwụwa N5000 kwa izu na N20,000 kwa ọnwa. Ndị bọọsụ ASUU ga-akwụwa N2500 kwa izu maọbụ N10,000 kwa ọnwa rụọ mgbe e mepere ụlọakwụkwọ, bụ mgbe ha ga-amalite ịkwụ N5,000 nakwa N20,000."	https://www.bbc.com/igbo/articles/c840zgpzmd1o
politics	""" Ọ bụ maka mkpachapụ ka ndị Ipob ji azọ nnwereonwe"" – Sheikh Gumi"	"N’ụtụtụ a ka onye nkụzị Alakụba a ma ka Sheikh Ahmad Abubakar Mahmud Gumi wuwere na soshal midia maka ihe ọ dere na facebook ya. Gumi sị na ọ bụ maka mkpachapụ mere ndị agbụrụ dị icheiche jị ekopu isi na gọọmentị Naịjirịa. O bidoro n’iji nkwekọrịta ndị omekome na otu obodo bụ Mada nwere na Zamfara were maa atụ. Ọ sị na ọ bụrụ na Gọọmentị Naịjirịa na ndị omekome kwekọrịta, na udo ga-alọghachite na Naịjirịa. O kwuru na nkopu isi otu Ipob ebelatala n'Ọwụwa anyanwụ maka na Peter Obi pụtara ịzọ ọchịchị Onyeisiala, otu Bola Tinubu siri pụta n’ọdịda anwanwụ. Gumi na-ekwusi ike na ọ bụrụ na gọọmentị mee ihe ndị mmadụ chọrọ, na ha agaghị ekopu isi. Ọ sị na “nkopu isi niile a na-eme na Naịjiria gosiri na Gọọmentị Muhammadu Buhari na-achị ugbua, akpọụla afọ n’ala”. Ọ kelere Chukwu na ha apụwala. Gumi kwenyesiri ike na ọ bụ ka ndị Naịjirịa si ahụta ụwa mere ha ndị omekome      ịnwe mkparịtaụka. Ọ sị  na ndị Igbo agaghị ekweta na gọomentị na ndị omekome ndị ugwu ga-enwe mkparịta ụka maka na ha na ahụta ha ka ndị ajọ mmadụ.. “otu ahụ ka o ga-esi ara onye ugwu ahụ ikweta na gọomentị na ndị Ipob ga-enwe mkparịtaụka”. O kwuru na mkpagbu, nnapụ na mmegbu butere nkopụ isi. Ọ sị na ọ bụ “nwayọ nwayọ ka aga eji rapụta ndị mmadụ n’ihe ha kwenyere”. BBC Juru ya na ndị mmadụ na-eche na ya bụ Sheikh Gumi kwesiri ịnọ na mkpọrọ ugbua maka na ya na ndị omekome na-ayị. Gumi zara, “ndị ahụ amaghị ihe ha na-ekwu. Ha aghọtaghị Naịjirịa”. Ọ sị na ọ bụ enyemaka ka ya na-enye iji mee ka ihe dị mma. O kwuru na ihe na-ese okwu na Naịjirịa bụ okwu agburu. “O bụ ọgụ agburu ka a na-anụ na Naịjirịa. Ndị mmadụ che na ọ bụ gọọmentị ka a na-ebuso agha"". Ọ sị na ya agaghị agba nkiti na-ekiri ka a na-egbucha ndị be ha. O kwuru na ọ bụ aka ka ya na-enye ịzọpụta ndị be ha. Onye ọkaiwu ukwu Naịjirịa bụ Olisa Agbakọba sị na Gumi enweghị ezigbo okwu maka na ya bụ ihe o kwuru bụ ihe ha kwesiri ịma kemgbe. Ọ jụrụ sị, “kedu ihe mere ha jiri mata ya ugbua? Kedu ihe mere ha ejighị mata na ọ bụ oke mkpachapụ mere ndị mmadụ ji ekopu isi na gọọmentị? O kwukwara sị, ọ bụrụ na ha mata na ya ugbua, na taa ka bụ gboo. Joe Igbokwe bụ onye enyemaka Gọvanọ Lagos steeti maka adịmọcha obodo sị na Gumi kpụ nzu ọma ya n’ọnụ, nke pụtara na ihe Sheikh Gumi kwuru bụ eziokwu, ""mmadụ niile a ana egbu bụ maka ndọrọndọrọ ọchịchi""."	https://www.bbc.com/igbo/articles/c6p3kwgdd4jo
politics	Donald Trump sị na ya ga-eme iwu banyere soshal midia dịka ọ na-agbarụrụ Twitter ihu	"Onyeisiala Amerịka bụ Donald Trump ga-ebinye aka n'iwu si ya n'aka ga-emetụta ụlọ ọrụ soshal midia, dịka ụlọ ọrụ ya siri kwuo. Atụmatụ  a na-abịa ka Trump dọrọ aka na ntị na ya ga-agbachi ụlọ ọrụ soshal midia ọ sị na-apichi ọnụ ndị kwenyere na okwukwe ""conservative"". Ekwubeghi etu iwu ọhụrụ Trump a ga-adị. Okwechaghị nghọta ụdịrị ihe Trump nwereike imenwu ma ya bụrụ na ndị Omeiwu ewpụteghi iwu ọhụrụ ga-enye ya ikike. Ndị ụlọ ọrụ Trump enyeghi ozi ọzọ banyere atụmatụ a bụ nke a na-ele anya na o nwereike ịbinye aka na ya n'ụbọchị Tụzde. Trump na-ebo Twitter ebubo mmegide ndị otu ya mana onweghi akaebe o nyere banyere nke a. O mechiri otu ihe o dere na Twitter site na ikwu ""Ugba a ha apụọla ezigbote ara. Na-elekwa!!!"" Okwu na-ere Trump na ụlọ ọrụ soshal midia senyitere isi ọzọ n'ụbọchị Toozde dịka etinyere akara nyocha n'otu ihe o dere na Twitter. Twitter dere na ihe Trump dere banyere mpụ na ntuliaka Amerịka ""enweghi akaebe"" ga-egosi na ọ bụ eziokwu N'ụbọchị Wednesde Trump kwusiri ike na ya ""ga-eji ike hazie"" ma ọ bụ ""gbachie"" ogige soshal midia. Ọ gwara mmadụ nde iri asatọ na-eso ya na Twitter na ndị na-akwado pati Repụblikan ndị chere na ogige soshal midia ""na-akpichi ndị conzavative ọnụ kpam kpam"", na ya agaghi ekwe ka nke a mee. Oneyisi Twitter sara ihe Trump kwuru site n'isi: ""Anyị ga na-egosi ozi akwụghị ọtọ banyere ntuliaka Amerịka n'ụwa dum."" Maazị Trump dekwere otu ihe ahụ o dere na Twitter na Facebook mana onweghi akara nyocha etinyere na ya. Na mkparịtaụka o mere na Fox News ụbọchị Wednesde, onyeisi Facebook bụ Mark Zukerberg sị na ịkpịchị ogige soshal midia ọnụ abụghị ihe o che gọọmentị na-eti mkpu mkpịchị ọnụ kwesiri ime. Twitter jizi aka ike eso akụkọ ụwa ugbua maka nrụtụ aka ndị mmadụ mere banyere etu ha si eme maka ụdịrị akụkọ ahụ."	https://www.bbc.com/igbo/mba-uba-52798585
business	Urazi Palm Oil: Ihe mere mmanụ a ji bụrụ ọpụrụiche na mmanụ nri ndị ọzọ	Mmanụ Urazi bụ mmanụ pụrụiche e si n'osisi nkwụ emepụta na mpaghara Ebonyi Steeti. Etu e si emepụta ya dị iche n'etu e si emepụta mmanụ nri ndị ọzọ. N'ihe onyonyo, a kọwaara usoro e ji emepụta ya nakwa uru ọ baara. Ndị mere akụkọ a bụ Chukwudi Chris Santus Okereke na Chiemela Mgbeahuru	https://www.bbc.com/igbo/afirika-58612060
entertainment	"""Anaghị m ahụ onwe ka onye nwere nkwarụ"" - Ọkpọ ụbọ na-enweghị mkpịsị aka"	"Djagbo Bishop bụ onye oti egwu; ịkpọ ụbọ nke bekee na-akpọ 'bass guitar'. Ihe nke ya ji atụ onye ọbụla n'anya bụ na o nweghị mkpịsị aka, mana onye nwere mkpịsị aka anaghị akpọ ụbọ karịa ya. Ọ bụghị naanị ụbọ ka Djagbo Bishop na-akpọ; ọ na-akụ ịgba, ọ na-akpọ 'keyboard'. Abịa n'ịgụ akwụkwọ, Bishop nwere nzere B.sc nakwa nke 'Masters'. Aka ya abụọ, nke mkpịsịaka na-adịghị, ka o ji dee ule ya niile na Mahadum Delta Steeti dị n'Abaraka, iji nweta nzere ndị a. Na mkparịtaụka ya na BBC Igbo nwere, Djagbo Bishop kwuru na ọ bụ etu ahụ ka nne ya si mụọ ya. Mana ọzụzụ nne na nna ya nyere ya bụ ka ọ ghara ịhụta onwe ya dịka onye nkwarụ, maọbụ onye pụrụ iche n'ebe ụmụnne ya ndị ọzọ nọ. Nke a mere na oge o toruru ịmalite agụmakwụkwọ, nne na nna ya gbara mbọ chọtara ya ụlọakwụkwọ, dịka ọtụtụ ụlọakwụkwọ jụrụ ịnabata ya. Ọ bụ n'ụlọụka ka Bishop si malite njem ys n'iti egwu. ""Oge m hụtara na egwu na-amasị m, abanyere m otu ndị na-agụ egwu n'ụlọụka, wee tinye uche m n'ịmụta 'keyboard',"" Djagbo kwuru. ""Mana otu ụbọchị ka m hụrụ ebe otu nwata nwaanyị na-amụ 'bass guitar', m na-ele ya anya etu aka ya si emegharị na 'guitar' ahụ, m wee kwuo n'obi m na ihe a bụ ihe m ga-emeli."" ""Oge o debere 'guitar' ahụ, agara m bulie ya, malite ịkpọ ihe ahụ m nụrụ ọ na-akpọ. Nke a wee tụọ ndị niile nọ ebe ahụ n'anya."" Bishop kwuru na ịkpọ ụbọ eweterela ya ọtụtụ ihe ọme na ndụ ya, ""mụ na ọtụtụ ndị egwu a ma ama dịka Sinach, Frank Edwards, Buchi, etikọọla egwu""."	https://www.bbc.com/igbo/articles/cxexz2d8kgyo
health	Gịnị mere ụmụ Naijiria na-agbagha ọnụọgụgụ coronavirus NCDC na-ewepụta?	"Kemgbe abalị ole na ole gara aga, mpụtara ngụkọ 'National Centre for Disease Control (NCDC)' ọnụọgụgụ gbalitere n'ụzọ pụrụ iche, ụmụ Naijiria ji enyo ele ụlọọrụ na-ahụ maka mgbochi ọrịa na Naijiria. Nke a bụ n'ihi ngụkọ ha wepụtara n'abalị anọ nke ọnwa Ọgọstụ nke gosiri na mmadụ 11,118 gbakere n'ọrịa coronavirus n'otu abalị dịka o ha kwuru na mmadụ 31851 agbakeela kemgbe ọrịa coronavirus ji bata Naijiria. N'abalị atọ nke ọnwa Ọgọstụ, NCDC wepụtara mmadụ dị 20663 dịka ndị gbakerela n'ọrịa coronavirus. Ya bụ nnukwu mgbanwe gbara ọtụtụ mmadụ baa, ma mee ka ụfọdụ kwuwe na o nwere ike ịbụ ndehie. Mana ka otu abalị gara NCDC na ndị ọrụ ya ekwughị na o nwere ndehie ọbụla ha mere, ụmụ Naijiria bidoro ntamụ, ụfọdụ na-ajụ ebe akatamkpo ọnụọgụgụ ahụ si. Ihe kachasị gbagwojuo ndị mmadụ anya maka ngụkọ ahụ bụ na ọtụtụ ndị ahụ a sị gbakere si na Legọs. Malachy Ani, onye ihe gbasara ngụkọ ego doro anya sị na ""ndekọ ahụ ha na-enye anyị abụghị ezi ya, ọ dịka wayo"". Anị gara n'ihu sị , ""Ndepụta ngụkọ na-ele ya kwa ụbọchị dị iche n'ụzọ pụrụ iche na nke a na-edepụta kemgbe ọrịa coronavirus batara Naijiria."" ka o kwuru ""O nwebeghị ụbọchị iri mmadụ ise gbakere n'otu ụbọchị, kedụ ka mmadụ karịrị puku iri na otu si gbakee n'otu ụbọchị."" ""Ihe o gosiri bụ na ndị na-enye anyị ngụkọ a anaghị etinye anya n'ọrụ."" Ani jụrụ ajụjụ sị, ""Ọ bụrụ eziokwu na ndị ahụ gbakere n'ezie, a sị ha lawa, kedụ ebe ndị ahụ si were la."" Data kwesịrị inye anya aka n'ịtụ alo, mana ụdị ngụkọ onweghị ihe anyị ga-eji eme."" Ọtụtụ ndị mmadụ na-ekwukwa otu ahụ na soshal midia. Ụfodụ na-ebo gọọmenti ebubo ime wuruwuru, o nweghị mgbe ọrịa ji dị na Naijria kama ndị ọrụ gọọmenti ji ụgha a kpara ego. Ndị ọzọ na-ekwu na ọ dịka ego a mapụtara maka ibu agha megide coronavirus agwụla nke mere ka ndị ọrụ gọọmenti ọ dị n'aka ji agwọkọ ngwongwo ha. NCDC kọwara na ọtụtụ ndị ndị gbakare na Legọs bụ ndị a nọ n'ụlọ ha eleta. Onyeisi NCDC bụ Chikwe Ihekweazu kwuru na nsonso dịka ndị mmadụ na-adọrịta ụka ebe 11,1888 si na, NCDC nyere steeti ga-ugboro ha ga-agbaso maka ileta ndị bu ọrịa n'ụlọ ha. Otu n'ime ọnụ na-ekwuruchitere onyeisi NCDC bụ Emeka Oguanuo gwara BBC na ndị ahụ gbakerela sokwa n'ọnụọgụgụ ndị e kwuburu na ha butere nje coronavirus."	https://www.bbc.com/igbo/afirika-53684971
