politics	Governor Andrew Cuomo nke New York agbaala arụkwaghịm n'ebubo ịkpa ụmụnwaanyị aka n'ụbọ	"Gọvanọ New York bụ Andrew Cuomo nọrọ ụbọchị Tuzde tinye akwụkwọ arụkwaghịm dịka gọvanọ New York dịka ebubo ịkpa ụmụnwaanyị aka n'ụbọ eboro ya na-arị elu. N'ozi ọ gbasara n'ihe onyonyo TV ụbọchị Tuzde, Cuomo sịrị, ""Dịka ihe sịrị kwụrụ, ihe kacha mma ka m mee bụ ịkwụrụ na ụsọ, ka ọchịchị gakwa n'aka gọọmentị, ya mere, nke a bụ ihe m ga-eme n'ihi na ọ bụ ụnụ ka m na-arụrụ ọrụ, ime ihe kwesịrị bụ imeere ụnụ ihe kwesịrị."" Cuomo ekweghị asaa ndị ntaakụkọ ajụjụ ka o kwuchara nke a. Ka ọ dị ugbua, Osote ya bụ Kathy Hochul, onye 'Democrat', bụ onye ga-anọzi n'ọkwa Cuomo dịka gọvanọ  malite n'abalị 14 na-abịa bụ oge arụkwaghịm Cuomo ga-amalite dịwe ire. Cheta na nsonso a nnyocha  e mere kwuru na ụmụnwaanyị ruru 11 boro Cuomo ebubo ịkpa ha aka n'ụzọ ekweghịghị ekwesị mana Cuomo gọrọ agụghọ na ọ bụghị eziokwu. Cuomo leburu anya na nnyocha ahụ nke o nyere ọkaiwu steeti ahụ bụ Leticia James ka o mee ga-ekwu n'aka ya dị ọcha mana James mechara nnyocha sị na Cuomo meere ihe e boro ya n'ebubo. Onyeisiala Mba amerịka bụ Joe Biden akpoola gọvanọ New York bụ Andrew Cuoma okpu ka otinye akwụkwọ arụkwaghị maka ebubo ịkpa ụmụnwaanyị aka n'ụbọ. Nke na-eso nnyocha e mere gosiri na Cuomo dara iwu nke gọọmentị etiti nakwa nke steeti,n'ihe gbasaara imekpa ụmụnwaanyị ahụ n'ụlọọrụ site na ịkpa ha aka n'ebe ekwesịghị. Ọ bụghị naanị Joe Biden, ndị ọzọ welitere isi dịka  Chuck Schumer bụ onye ndu Ụlọomeiwu Ukwu mba Amerịka nke Bekee kpọrọ ""US senate majority leader' nakwa Senetọ Kirsten Gillibrand etinyela ọnụ. Ha abụọ bụkwa ndị otu ""Democrats' bụ pati Cuomo nọ na ya katọrọ Cuomo ma kpoo oku ka o tinye akwụkwọ arụkwaghị. Mana Cuomo  gọrọ, kwuo na ebubo ndị a bụ okwu ""ndọrọndọrọ ọchịchị"" nakwa ""ile anya n'ihu ekwu okwu"". Ọkaiwu Steeti New York ekwuola na nnyocha e mere gosiri na gọvanọ steeti ahụ bụ Andrew Cuomo akpaala ọtụtụ ụmụnwaanyị aka n'ụzọ na-ekweghị ekwesị, susuo ụfọdụ ha ọnụ maọbụ gwa ha okwu dịbara aghaa. Letitia James, onye gwara ndị ntaakụkọ nke a ụbọchị Tuzde sịrị na nnyocha emere agbaala n'anwụ mkpagbu nwere ike ịdị n'ebe ndị nwere nnukwu ọkwa nọ. Cheta na n'ọnwa Maachị 2021, Cuomo sịburu 'ndo"" maka ime ụmụnwaanyị ihe mere ha ka ha ghara ịnọkwata mana ọ gọrọ na o nweghị onye ya metụrụaka etu ekweghị. Na nsonso a, ụmụnwaanyị atọ pụtara na-ebo ya ebubo ịkpasa ha agwa dị aghaa. Otu nwaanyị bụ onye enyemaka gọvanọ bụ  Lindsey Boylan, boro ebubo na Cuomo susuru ya ọnụ n'egbugbere ọnụ ma gwakwa ya bịa gbara ọtọ gbara ya egwu na ụgbọelu ya. Onye ọzọ rụburu Cuomo ọrụ bụ Charlotte Bennett, gwara ụlọakụkọ New York Times na gọvanọ na-ajụgasị ya ụdị ajụjụ nke gosiri na ọ chọrọ ka ya na ya dinaa. ""O kwere m ghọta na gọvanọ chọrọ ka mụ na ya dinaa."" Otu nwaanyị onye ose foto bụ Anna Ruch, kwuru na Cuomo metụrụ ya aka n'ihu sị ya susuo ya ọnụ n'otu mmemme agbamakwụkwọ Mana Cuomo onye kwuru na ya agaghị agba arụkwaghịm maka ebubo ndị ahụ, gwaburu ndị mmadụ gbaa jim , ka e mechaa nnyocha tupu ha kpebie. Kedụ ihe Cuomo kwuru n'ozi ịrịọ mgbaghara o wepụtara? Dịka ndị mmadụ na-akpo oku ya tinye akwụkwọ arụkwaghịm, Cuomo sịrị na ịmakụ mmadụ na isusu ha ọnụ bụ ""ụzọ ya si ekelekarị ndị mmadụ"" ya mụtara n'aka nna ya, bụkwa aka chiburu New York bụ Mario Cuomo. O kwuru na n'ezie na ihe agbanweela na ya mụtara akọ n'ihe mere. ""Echiche m adịghị mkpa. Ọ bụ na  ọdịghị ụmụnwaanyị mma, ị mara na ọ dị njọ. Ọ bụrụ na o mejọrọ ha, ana m arịọ mgbaghara."""	https://www.bbc.com/igbo/afirika-58076709
sports	Newcastle vs Man United: E chiela Man United 'E cheta ebewe nke mbụ n'Ịngland'	'Aga m akọrọ onye akwa ụwa m' bụ akwa Manchester United bere mgbe Newcastle United meriri ha n'asọmpi Premier League. Mmeri a bụ ihe mgbawa obi nye Man United n'ihi otu goolu Newcatle nyere ha bịara na ngwụcha oge. Otu egwuregwu bọọlụ abụọ ndị a foro ntụtụ taa n'ime ọkara mbụ n'asọmpi ahụ. Mana goolu a si n'aka Mathew Longstaff dị afọ iri na itoolu nke Newcatle bịara na nkeji 72 n'ime ọkara abụọ. Man United siri ọnwụ etu ha nwere ike iji mere onwe ha aha mana Newcastle kwechiri ruo ngwụcha asọmpi. Nke a na-abụ ugboro atọ a na-emeri Manchester United n'afọ 2019 banye 2020 na Premier League. Otu ọkpụ goolu a e ji merie Man United dosara ha n'ogogo iri na abụọ na tebụlụ asọmpi Premier League. Akụkọ ndị ga-amasị gị:	https://www.bbc.com/igbo/egwuregwu-49954271
entertainment	Lekki Toll Gate: A ga-enyocha ndị uweojii mekpara Mr Macaroni na ndị ọzọ ahụ	"Onyeisi ndị uweojii na Legọs steeti, bụ Hakeem Odumosu, enyela iwu ka e nyochaa ndị uweojii mekpara ndị e jidere na ngagharịiwe Lekki Toll gate ahụ n'ụbọchị Satọde. Olumuyiwa Adejobi, bụ ọnụ na-ekwuru ndị uweojii Legọs kwupụtara nke a n'akwụkwọ ozi o wepụtara n'ụbọchị Sọnde, abalị iri na anọ nke ọnwa Febrụwarị. Cheta na ihe onyonyo pụtara na soshal media nke gosiri ụfọdụ n'ime ndị ahụ anwụchiri ebe ha nọ n'ime otu ụgbọala gbarachaa ahụ nkịtị. Hakeem Odumosu kwuru na ya enyela ikike ka e nyochaa ndị uweojii mere ihe ahụ ma taa ha ahụhụ kwesịrị ha. O kwuru sị: ""Ọ bụ eziokwu na ndị uweojii ga-agba mbọ ịhụ na ndị mmadụ mere ihe iwu kwuru, mana ha agaghị agbachị nkịtị ka ụfọdụ ndị otu ha na-emekpa ndị mmadụ ahụ n'ụzọ ekwesịghị ekwesị."" Odumosu gara n'ihu rịọ ndị bi na Legọs ka onye ọbụla na-agara mkpa ya ma zeere ihe ọbụla nwere ike ibute ọgbaaghara. Ka ndị uweojii tọghapụchara ya, Debo Adebayo, onye e ji Mr Macaroni mara ekwuola na e tiri ma gbaa ya na mnadụ 39 anwụchịkọrọ ya na ha ọtọ na Lekki Toll Gate ụnyahụ. O kwukwara na ọ chọbụghị ipụta n'ebe ahụ mbụ maka oke ụjọ ji ya mana mgbe ọ na-agafee hụ ka ịhe si kwụrụ, ọ ga-akwụnyere ndị ntoroọbịa iri atọ na itoolu ahụ pụtara ime ngaghariwe n'ebe ahụ. O kwuru ka ndị mmadụ jiri nwayọ makana gọọmenti etiti achọghị ịma onye bụ onye, ""ndị a ga-egbu onye ọbụla kwụchịrị ha ụzọ."" Lee okwu mbụ Mrmacaronii kwuru ka ndị uweojii tọghapụchara ya: Cheta na ndị uweojii tọhapụrụ Debo Adebayo, onye e ji Mr Macaroni mara, na mmadụ iri atọ na itoolu ndị ọzọ bụ  ha nwụchiburu na ngagharịiwe e mere na Lekki Toll gate n'ụbọchị Satọde. Omoyele Sowore, onye nwe ụlọ ntaakụkọ Sahara Reporters, kwupụtara nke a n'akara Twitter ya. Onye ọzọ kwukwara na a kwụrụ otu narị puku naịra iji gbapụta Mr Macaroni. Ndị uweojii kwuru na ọ bụ maka na ndị ahụ na-eme ngagharịiwe dara iwu Covid-19 mere e ji nwuchie ha. Muyiwa Adejobi, ọnụ na-ekwuru ndị uweojii Legọs, kwuru na ọ bụ ụlọikpe tọhapụrụ ndị ahụ ha jidere, ma kwukwaa na ha ga-abịakwa ọzọ n'ụlọikpe n'ụbọchị abụọ nke ọnwa March afọ 2021. Ọtụtụ ndị ama ama etinyela ọnụ katọọ aka ike ndị uweojii dịka ndị ntorobịa mere ngagharịiwe ọzọ na Lekki Toll Gate n'ụbọchị Satọde, abalị iri na atọ nke ọnwa Febrụwarị afọ 2021. Folarin Falana, onye oti egwu eji Falz mara, kwuru na ike Naịjirịa agwụla ya: Falz kwukwara na gọọmentị Naịjirịa egosila na ha achọghị udo chaachaa. Charles Oputa, onye e ji Charly Boy mara kwuru na Naịjirịa aghọọla ọgbọ ebe a na-egbu mmadụ. Osote Onyeisiala Naịjirịa n'oge gara aga bụ Abubakar Atiku kwuru na ihe ndịọrụ nchekwa kwesịrị ime bụ inye aka hụ na ndị na-eme ngagharịiwe mere ya n'udo. Atiku dọrọ aka na ntị ka onyeisiala Naịjirịa wepụ aka enwe n'ofe. Onye omeiwu bụ Shehu Sani kwukwara otu ihe ahụ Atiku kwuru. Amnesty International kpọrọ oku ka gọọmentị Naịjirịa chekwaa ndị na-eme ngagharịiwe na-emebighi ihe ọbụla. Otu onye na-eme ejije ụkaọchị bụ Debo Adebayo, onye e ji Mr. Macaroni mara, so na ndị a nwụchịrị n'ụtụtụ Satọde a na Lekki Toll Gate. A hụkwara ya na Twitter ebe ọ na akọwa ihe na-eme n'ime n'ihe onyonyo n'ime ụgbọala ""Black maria"" ebe ọ nọ. Onweghị onye hụrụ mgbe ejidere ya. Ihe ahụrụ bụzị ebe ọ nọ na Twitter na-eme ya bụ ihe onyonyo. Lee ihe onyonyo ọzọ gosiri ebe Mr Macaroni nọ n'ime ụgbọala ebe ndị uweojii debere ya na ndị ọzọ. Ọ kwụsịrị ya bụ ihe onyonyo ọ na-eme mgbe ndị uweojii napụrụ ya ekwentị ya. Onye ntaakụkọ BBC na-akọwa na agbanyeghị ihe karịrị mmadụ iri a nwụchịrị, na ụgbọala na-agbafekwa ebe ahụ were were. Otu nwoke nọ n'ime ""Black Maria ahụ na-eti mgbu na ya na-aga ụlọọrụ ya tupu aka akpara ya. Ọ na-ekwu na ọnweghị ihe ya mere. Ya bụ nwaadị na-ajụ ndị uweojii ""ọ bụ na m enweghị ikike ịgagharị n'ala m?"" Mana ọ nweghị onye tụpụụrụ ya ọnụ. Ya bụ nwaamadị na-ekwu na ọ bụ onye Njinia were ndị mmadụ n'ọrụ, mana ọnweghị onye ghere ya ọnụ. A chọpụtara na ahụ e sichaghị ụgbọala ndị uweojii ji buru ndị ahụ ike dịka akwawara ya aka mana ọ nweghị ike ịnupu. E mechere kpọrọ ndị ahụ banye n'ụgbọala ọzọ were pụwa. Nwaandị sị na aha ya bụ Christopher Udoji bụ ọnye nwetere onwe ya na ụgbọala ndị uweojii ahụ sị na ya na-agafe agafe tupu anwuchie ya. Ụfọdụ ndị anwụchịrkwara kwetakwara na n'ezie, ha pụtara ya bụ ngagharịiwe. Ndị uweojii na ndị agha Naịjria wuchiri n'uju na Lekki Toll Gate ebe ndị ntorobịa siri ọnwụ na ha ga-amaliteri ngagharịwe taa bụ Satụde. Ndị ọrụ BBC nọ ebe ahụ kemgbe elekere isii nke ụtụtụ ịwetere unu ka ịhe sị aga. BBC hụrụ ọtụtụ ndị uweojii na ndị agha Naịjriịa ka ha kposara ebe ahụ. Ha hụkwara ụfọdụ umu ntorobịa pụtara ebe ahụ, ụfọdụ n'ime ha ka anwụchiri tụba n'ụgbọala ndị ụweojii buru pụọ. Dịka ndị BBC nọ ebe ahụ siri kwuo, ""ndị uweoji nwuchiri ụfọdụ ndị pụtara ebe ahụ"". Otu onye okoroobịa a nwụchiri kwuru na ya bịara nleta ihe na-eme na-ebe ahụ, mana ndị uweojii nwụrụ ya tinye a n'ụgbọala Bekee kpọrọ ""Black Maria"". Cheta na-ana atụ anya na ndị ntoroọbịa ga-apụta taa maka ngagharịiwe atụmatụ ọgbakọ na-enyocha mmegide ndị uweojii ka enyeghachie ụlọ ọrụ ""Lekki Concession Company"" (LCC) ogige Toll Gate ahụ ka ha malite tụwa mgbere n'ebe ahụ.Ọ bụ na Lekki Toll Gate ahụ ka anọ mee ngagharịiwe n'Ọktoba 2020 butere ebubo na egburu ndị mmadụ. Ọ bụ ebubo ogbugbu mmadụ butere ngagharịiwe a dịka ụfọdụ mmadụ na-ekwu na ya bụrụ na-afụghị isi ogbugbu ha, ekwesighi imepe ya bụ Toll Gate. Otu onye anwụchịrị ebe ahụ na-akọwa na ọ bụ ya bụ ngagharịiwe ka ya pụtara tupu ndị uweojii akpara ya aka. Ụfọdụ ndị ụmụntorobịa ahụ anwụchịrị ekweghị ekwe o, dịka ha ka na-aba mba na ha nwereikike ịpụta mee ngagharịiwe n'udo. Onye ntaakụkọ BBC na-ekwu na amaghị ihe ọtụtụ so na ndị anwụchịri mere ndị uweojii ji kpara ha aka. Ọ kwuru na ha anwuchiela ihe karịrị mmadụ iri ebe ahụ n'ụtụtụ a. Ọtụtụ ndị ọzọ jukwara ebe ahụ bụkwa ndị ntaakụkọ sị ụlọọrụ ntaakụkọ dị ichie iche."	https://www.bbc.com/igbo/afirika-56052328
health	Coronavirus Tips: Gee ntị na ndụmọdụ si n'ọnụ ụmụntakịrị	Ọrịa coronavirus emeela ụwa niile ahụnanya ekwe. Ma okenye ma nwata, o nweghị ndị ya bụ ọrịa hara. Lee etu ụmụntakịrị si kọwaara BBC Igbo ihe ha ghọtara gbasara ọrịa a nakwa etu a ga-esi zeere ya. Onye mere ya bụ Ebere Ekeopara.	https://www.bbc.com/igbo/afirika-52458112
sports	African Women Cup of Nations 2022: Lee ụmụasa ga-anọchiteanya Naịjirịa n'asọmpi a	Asọmpi Iko Mba Afrịka ụmụnwaanyị nke ugboro iri na anọ ga-ebiri ọkụ na Satọde 2, Julaị 2022 na mba Moroko. Otu egwuregwu bọọlụ ụmụnwaanyị Naịjirịa bụ Super Falcons ga-eso ụmụagbọghọ ibe ha pụta n'ọgbọ. Super Falcons bụ ọkaibe n'Afrika ma a bịa n'asọmpi a dịka ha maburula iko a ugboro iri na otu n’ime iri na atọ a gbarala ya. Na mbido asọmpi a, ha ga-ezute ọgbọ ha ndị dịka Saụt Afrika, Burundi na Botswana. Ụmụagbọghọ iri abụọ na ise na-agba bọọlụ n'otu egwuregwu dị icheiche n'ụwa ga-anọchiteanya Naịjirịa n'asọmpi a. Ndị a gụnyere: Chiamaka Nnadozie Ọ na-eyi uwe e dere akara iri na isii Ọ bụ otu n’ime ndị oche goolu ndị Super Falcons Otu egwuregwu ya bụ Paris FC dị na mba France A mụrụ ya n’ụbọchị asatọ nke ọnwa Disemba, afọ 2000. Tochukwu Oluehi Oluehi na-eyi uwe e dere 1, Ọ na-echere ndị Super Falcons bọọlụ Otu egwuregwu ya bụ Maccabi Kishronot Hadera  dị na mba Isreal A mụrụ ya n’ ubọchị abụọ nke ọnwa Mee afọ 1987. Yewande Balogun Ọ na-echere ndị Super Falcons goolu A mụrụ ya n’ụbọchị asatọ nke ọnwa Ọgọstụ, afọ 1983 Otu egwuregwu ya bụ Coppermine United dị n’Amerịka Onome Ebi Ọ na-eyi uwe e dere akara ise Ọ na-agbara Super Falcons bọọlụ n’ebe azụ a kpọrọ ‘defence’ na Bekee A mụrụ ya n’ụbọchị asatọ nke ọnwa Mee afọ 1983 Otu egwuregwu ya bụ Ev Avant Guingamp dị na France N’afọ 2019 ọ bụ nwafọ Afrịka mbụ gbarala asọmpi Iko Mbaụwa ugboro ise Michelle Alozi Ọ bụkwa Nwafọ Naịjirịa a mụrụ n’Amerịka Ọ na-agbara Super Falcons n’ebe azụ (defender) A mụrụ ya n’ụbọchị iri abụọ na asatọ nke ọnwa Eprelụ afọ 1997 Otu egwuregwu ya bụ Houston Dash dị n’Amerịka Glory Ogbonna Ọ na-eyi uwe akara anọ Ọ na-agbara Super Falcons n’ebe azụ (defender) A mụrụ ya n’ụbọchị iri abụọ na ise nke ọnwa Disemba afọ 1998 Otu egwuregwu ya bụ Santa Teresa FC dị na Spain Osinachi Ohale Ọ na-eyi uwe akara atọ Ọ na-agbara Falcons bọọlụ n’ebe etiti azụ (centre back) A mụrụ ya n’ụbọchị iri abụọ na otu nke ọnwa Disemba, 1991 Otu egwuregwu ya bụ Depotivo Alaves nke mba Spain Ashleigh Plumptre Ọ bụ nwafọ mba Briten mana nna ya bụ onye Naịjirịa (yoruba) si na Legọs steeti Ọ na-agbara Super Falcons n’ebe azụ (defender) Ọ malitere ịgbara ha bọọlụ n’ọnwa Febụwarị afọ 2022. A mụrụ ya n’ụbọchị asatọ nke ọnwa Mee afọ 1998 Otu egwuregwu ya bụ Leicester dị na mba UK Akudo Ogbonna Ọ na-agbara Super Falcons n’ebe azụ (defender) A mụrụ ya n’ụbọchị itoolu nke ọnwa Eprelụ afọ 2000 Otu egwuregwu ya bụ Edo Queens dị na Naịjirịa Nicole Payne Ọ bụ nwafọ Naịjirịa a mụrụ na mba Amerịka Ọ na-agbara Super Falcons bọọlụ n’ebe azụ (defender) A mụrụ ya n’ụbọchị iri na asatọ nke ọnwa Jenụwarị afọ 2001 Otu egwuregwu ya bụ West Virginia University dị na mba Amerịka Ya na nwanne ya nwaanyị bụ Toni Payne bụ ụmụnne abụọ nke mbụ ga-agbara Naịjirịa bọọlụ otu oge. Peace Efih Ọ na-agbara Super Falcons bọọlụ n’ebe etiti (midfielder) A mụrụ ya n’ụbọchị ise nke ọnwa Ọgọstụ afọ 2000. Otu egwuregwu ya bụ Kiryat Gat dị na mba Israel Ngozi Okobi Ọ na-agbara Super Falcons bọọlụ n’ebe etiti (midfielder) A mụrụ ya n’ụbọchị iri na anọ nke ọnwa Disemba afọ 1993. Otu egwuregwu ya bụ Eskilstuna United dị na mba Sweden. Toni Payne Ọ bụ nwafọ Naịjirịa a mụrụ na mba Amerịka Ọ na-agbara Super Falcons bọọlụ n’ebe etiti (midfielder) A mụrụ ya n’ụbọchị iri abụọ na abụọ nke ọnwa Eprelụ afọ 1995 Otu egwuregwu ya bụ Sevilla dị na mba Spain Christy Ucheibe Ọ na-agbara Super Falcons bọọlụ n’ebe etiti (midfielder) A mụrụ ya n’ụbọchị iri abụọ na ise nke ọnwa Disemba afọ 2000 Otu egwuregwu ya bụ SL Benfica nke Portugal Halimatu Ayinde Ọ na-agbara Super Falcons bọọlụ n’ebe etiti (midfielder) A mụrụ ya n’ụbọchị iri na isi nke ọnwa Mee afọ 1995 Otu egwuregwu ya bụ Eskilstuna United dị na mba Sweden  Regina Otu Ọ na-agbara Super Falcons bọọlụ n’ebe etiti (midfielder) A mụrụ ya n’ụbọchị ise nke ọnwa Ọgọstụ afọ 1996 Otu egwuregwu ya bụ Minsk FC dị na Belarus Rasheedat Ajibade Ọ na-agbara Super Falcons bọọlụ n’ebe etiti (midfielder) A mụrụ ya n’ụbọchị asatọ ọnwa Disemba afọ 1999 Otu egwuregwu ya bụ Atletico Madrid mba Spain Francesca Odega Ọ na-agbara Super Falcons bọọlụ n’ebe ihu (forward) A mụrụ ya n’ụbọchị iri na itoolu nke ọnwa Ọktoba 1993 Otu egwuregwu ya bụ CSKA Moscow dị na Russia Uchenna Kanu Ọ na-agbara Super Falcons bọọlụ n’ebe ihu (forward) A mụrụ ya n’ụbọchị iri abụọ nke ọnwa Juun 1997 Otu egwuregwu ya bụ Tigres Femenil nke Mexico Rita Chikwelu Ọ na-agbara Super Falcons bọọlụ n’ebe etiti (midfielder) A mụrụ ya n’ụbọchị isii nke ọnwa Maachị afọ 1998 Otu egwuregwu ya bụ Madrid CFF di na Spain Vivian Ikechukwu Ọ na-agbara Super Falcons bọọlụ n’ebe ihu ( forward) A mụrụ ya n’ụbọchị iri nke ọnwa Julaị afọ 1997 Otu egwuregwu ya bụ WFC Gintra dị na Lithuania. Ifeoma Onumonu Ọ bụ nwafọ Naịjirịa a mụrụ na mba Amerịka Ọ na-agbara Super Falcons bọọlụ n’ebe ihu (forward) A mụrụ ya n’ụbọchị iri abụọ na ise nke ọnwa Febụwarị afọ 1994 Otu egwuregwu ya bụ NY/NJ Gotham FC dị n’Amerịka. Chinonyerem Mcleans Ọ na-agbara Super Falcons bọọlụ n’ebe ihu (forward) A mụrụ ya n’ụbọchị mbụ nke ọnwa Ọktoba 1999 Otu egwuregwu ya bụ GSK Gornik Leezna dị na Poland. Asisat Oshoala Ọ na-agbara Super Falcons bọọlụ n’ebe ihu (forward) A mụrụ ya n’ụbọchị itoolu nke ọnwa Ọktoba afọ 1994 Otu egwuregwu ya bụ FC Barcelona di na Spain. Gift Monday Ọ na-agbara Super Falcons bọọlụ n’ebe ihu (forward) A mụrụ ya n’ụbọchị itoolu nke ọnwa Disemba afọ 2001 Otu egwuregwu ya bụ Bayelsa Queens nke Naịjirịa. Randy Waldrum Randy Waldrum bụ onye nchịkọta otu Super Falcons nke Naịjirịa. Ọ bụ nwafọ mba Amerịka ihe egwuregwu bọọlụ doro anya. A mụrụ ya n’ụbọchị iri abụọ na ise nke ọnwa Sepụtemba, afọ 1956. Ọ bụkwa onye nchịkọta otu egwu bọọlụ ụmụnwaanyị nke mahadum Pittsburgh Panthers.	https://www.bbc.com/igbo/articles/cpvzx365k94o
religion	Notre Dame Cathedral: Ọkụ agbaala nnukwu ụlọụka Notre Dame	"Akụkọ chara akwụ taa: Akụkọ na-eru anyị ntị ugbua bụ na ọkụ amabeghị ihe butere ya enwurula n'ụlọụka Notre Dame Catheral dị na Paris, mba France. Ndị ọrụ gọọmenti na-ekwu na o nwere ike ọ bụrụna ọrụ e ji n'aka ugbua n'ụlọụka ahụ kpatara ọkụ ahụ . N'afọ gara aga, ụka Katọlik kporo oku ego iji were ruzie ụlọụka ahụ nke na-adakpọ adakpọ. Otu ọnụ na-ekwuru ụlọụka ahụ bụ nke Katọlik kwuru na ihe niile na-agba ọkụ, o nweghị ihe ga-afọ."" Dịka ozi si n'ụlọrụ onyeisiala mba Francce pụta siri kwuo, onyeisiala ha bụ Emmanuel Macron agbahapụla ebe o kwesịrị ịga gawa ebe ihe mere. A na-arụzigharị  Notre Dame Cathedral nke nde kwuru nde ndị njem nleta na-aga ahụ kwa afọ kemgbe a chọpụtara na o nwere akụkụ ya gbawara agbawa. Ozubulu massacre:Ụlọikpe atọhapụla mmadụ abụọ so na ndị anwụchiri Ka anyị malite n'Anambara ebe ụlọikpe ukwu dị n'Awka tọhapụrụ mmadụ abụọ eboro ebubo na aka ha dị na ọchụ ahụ e gburu na St. Phillip Catholic Church Ozubulu. Okaikpe ukwu bụ Jọstis Fidelis Aniukwu kwuru na ya ahụghị ihe gosiri na aka Chinedu Akpunonu na Onyebuchi Mbanefo dị na ya ọchụ e gburu na ụbọchị isii nke ọnwa August afọ 2017. Onyeisi ndị uweojii n'Enugu adọọla ndị ọgbatumtum aka na ntị maka ịda iwu etiri gbasara ịgba ọgbatumtum. Ọzọ dịka ibe ya, cheta na mmachị ọgbatumtum ịgba  ga-dị n'Enugwu steeti. Kọmịshọna ndị uweojii na steeti ahụ bụ Sulaiman Balarabe enyela ndị uweojii iwu ka ha nwụchie  ndị na ada iwu ahụ ma kpachie ọgbatumtum ha ma kpụpụ ha ụlọikpe. N'ofesi e, okeide mmiri sitere na oke mmiri zoro ụbọchị ụka na mba Ghana egbuola mmadụ ise ka ya bụ mmiri zochara naanị awa atọ. Seji Saji bụ osote onye isiọrụ National Disaster Management Organisation gwara BBC nke a mgbe anyị gbara ya ajụjụ ọnụ. N'egwuruegwu, Manchester United akpọpụtala aha dike na dimkpa iri abụọ na abụọ bụ ndị ga-eso sọọ mpi Champions League ha na Barcelona ụbọchị Tuzde na-abịa. Cheta na Barcelona ji otu ọkpụ nyụọ Manchester anya mgbe ha gbara nke agba nke mbụ. Nke mere ya iko mbụ na-abata ya aka kemgbe afọ 2008. Onweghị tinye maọbu mwepụ ego n'abịa na mmanụ agbịdị Gọọmentị Naịjirịa sị gị dere juu makana ha ekpebibeghị ịwepụ atụmatụ Bekee kpọrọ fuel subsidy. Gọọmentị sị na onweghị ihe ọbụla na-eme ga-akpata ka ewepụ ya ugbua. Mmadụ iri na abụọ nwụrụ ebe mmadụ iri na isii merụrụ ezigbote ahụ n'ihe mberede a. Ọnụ na-ekwuru ndị uweojii na Gombe bụ Mary Mallum sị na ọ bụ wa wa wa butere ihe mberede okporo ụzọ a. Ndi agha napụrụ Omar al-Bashir ọkwa na mba Sudan amalitela ịnwụchịkọ ndị ya na ya so chịa mba ahụ. Ndị agha Sundan mere nke a ka ha ka na-ekwekwa nkwa na ha agaghị achụpụ ndi na-eme ngaghari iwe na mba ahụ."	https://www.bbc.com/igbo/afirika-47932881
