politics	Enugu LGA Elections: Ihe mere PDP ji zakọrọcha ọkwa na ntuliaka e mere n'Enugwu Steeti	"Ngalaba na-ahụ maka ntuliaka n'Enugwu steeti bụ Enugu State Independent Electorial Commission (ENSIEC) ekwuola na ọ bụ pati People's Democratic Party (PDP) meriri na ntuliaka niile e mere na Satọde bụ ụbọchị 29 nke ọnwa Febụwarị. Agbanyeghi na ntuliaka a gara n'udo dịka BBC hụrụ n'anya, otu n'ime mmadụ abụọ n'azọ ọkwa onyeisi pati All Progressives Congress (APC) na steeti ahụ bụ Okey Ogbodo gwara BBC na pati ha esoghi na ntuliaka ahụ. N'iza ajụjụ maka ndị APC aha ha dị n'akwụkwọ ntuliaka, Maazị Ogbonna sị na ndị a abughị ndị APC. Ọ sị; ""Ndị ahụ bụ ndị APC n'ehihe ma bụrụ PDP n'abalị."" Ogbonna gara n'ihu kwuo na ntuliaka ahụ adabaghị makana ọ bụghị oge e kwesiri ime ya ka e mere ya. N'okwu ya, Ogbonna sị na ọ bụ mgbe oge ndị ọchịchị gwụrụ n'afọ 2019 ka ndi ọhụrụ kwesịrị  irigoro n'ọkwa. ""Ndị PDP were ndị ha kpọrọ ""Transition Commitee Chairmen"" tinye n'ọkwa. Iwu obodo megidere nke a"" Ọ sị na ọ bụ nke a mere pati ya jiri gbajụọ isonye mee ntuliaka. Dọkịnta Uche Uzochukwu so na ndị isi PDP n'okpuru ọchịchi Ọgwụ gwara BBC na ya amaghi ihe onye APC na-ekwu makana etu ya si hụ ntuliaka ahụ, o gara nke ọma. Ọ sị, ""Na Nkwe be anyị, ebe m nọ tụọ vootu, ndị mmadu pụtara n'igwe bịa kwado PDP. Ndị APC pụtara enweteghi otu vootu."" Dọkịnta Uzochukwu sị na ọ bụ makana PDP na-eme ọfụma mere ndị mmadụ ji akwado ha nke ukwuu n'Enugwu. Onye na-anọchite mpaghara Ọgwụ n'ụlọomeiwu nke Enugwu steeti bụ Johnson Chukwuobasi kwenyekwara n'ihi Dọkịnta Uzochukwu kwuru. Omeiwu Chukwuobasi sị, ""O nwere onye be anyị, onye Mmaku, so zọọ ọchịchị n'aha APC, ọ chịtaghị aja maka na ọ bụ PDP ka ndị ebe anyị na-akwado."" 'Ihe mere PDP ji merie ebe niile' Dọkịnta Uzochukwu sị na aka na-achị Enugwu steeti bụ Ifeanyi Ugwuanyi na-eme ọfụma nke mere ndị mmadụ ji sị ka PDP chịrị gawa. Ọ sị, ""Agaghị m asị na ọ bụ makana APC anaghị achịta na gọọmentị etiti mere ka ndị mmadụ na-akwado PDP, makana steeti dị iche iche. Nke bu eziokwu bụ na PDP na-eme ọfụma n'Enugwu site na gọọmenti Ifeanyi Ugwuanyi."" Omeiwu Chukwuobasi rụtụrụ aka n'usoro Bekee kpọrọ zoning, bụ atụmatụ PDP na-eso n'Enugwu, dịka otu ihe mere ndị mmadụ jiri akwado patị ahụ. Ọ sị, ""Zoning na-enye aka. Dịka ugbua, onye meriri ịbụ onyeisi ọchịchị ime obodo bụ onye Ọgwụ, onye rituru n'ọkwa bụkwa onye mpaghara ọzọ. Etu a ka e si eme ya."" Atụmatụ ""zoning"" a malitere n'Enugwu kamgbe Chimaroke Nnamani bụ gọvanọ steeti ahụ. Ya bụ atụmatụ metụtakwara etu e si a họpụta ndị ọchịchi Bekee kpọrọ ""Councillor"" Ebe APC kwụ Okey Ogbonna na-ekwusi ike na aka pati ya adịghị na ntuliaka ahụ, ma na-ekwukwa na ya nwere olileanya na ndịisi pati ha no n'Abuja ga-aghọta na ọ bụ ya ka ""ụlọikpe kpebiri dịka onyeisi APC n'Enugwu kpọmkwem."""	https://www.bbc.com/igbo/afirika-51705949
health	Ear infection: Tinnitus, Otitis externa na ọrịa ndị ọzọ nwereike inye ntị gị nsogbu	Kedụ ihe ị ma maka ọrịa ndị na-enye maọbụ nwereike inye gị nsogbu na ntị? Ọrịa dị iche iche nwereike inye gị nsogbu na ntị, ụdị gụnyere ụda maọbụ mkpọtụ nakwa abụ ịpụta mmadụ na ntị so n'ihe ndị na-enye nsogbu na ntị. Ụfọdụ n'ime ọrịa ndị a nwere ngwọta ebe ụfọdụ bụ ọrịa tara nchara na-enweghi ọgwụgwọ. Ntị mmadụ nwere nke Bekee kpọrọ 'middle ear' nakwa 'inner ear'. Nke mbụ bụ ebe ụda na-esi n'udu ntị ('tympanum') agaru na n'ime ntị (inner ear). A bịa n'ọrịa ntị, nke kacha emetụta ndị mmadụ ọkachasị ndị okenye bụ nke a kpọrọ Tinnitus. Anyị ga-akọwa ihe ọrịa bụ. 1) Tinnitus: Nke a bụ ọrịa ntị nke mmadụ ga na-anụ ụda maọbụ mkpọtụ na ntị ya. O nwereike ime mmadụ n'otu ntị maọbụ na ha abụọ. Ụfọdụ oge ọ na-abụ oke mkpọtụ dịka nke si n'igwe okwu (loudspeaker), mmadụ imerụ ahụ n'isi, nakwa oke anya ajụ na-ebute ya. Marakwa na mkpọtụ ahụ ị na-anụ na ntị gị n'ihi tinnitus abụghị n'okirikiri gị ka o si abịa, ọ bụ n'ime ntị gị ka o si. Ụfọdụ oge ọ na-eji aka ya alara onwe ya, mana oge ndị ọzọ ọ ga-adị mma ka onye dọkịta ntị nyochaa gị. Etu ị ga-esi agwọ tinnitus: Ụlọọrụ ahụike NHS nke mba Briten nyere usoro a maka ilekọta tinnitus Obi amapụla gị na ị nwere tinnitus n'ihi na ọ bụghị oge niile ka o gosiri na ntị gị nọ n'ezigbo nsogbu ichi. 2) Otitis (media na externa): Ọrịa Otitis na-ebu ụzọ egosi onwe ya site n'oke mgbu na ntị nakwa ebe mmiri (fluid) juru na ntị. Nje (bakteria) kacha ebute ya bụ ndị nke a kpọrọ Streptococcus pneumoniae, Haemophilus influenzae, Moraxella catarrhalis, nakwa Streptococcus pyogenes. Nke a nwereike isi na nsogbu mkpọchi imi dịka rhinitis malite. N'ihi na e nwere okporo jikọrọ azụ imi na etiti ntị (middle ear) nke Bekee kpọrọ 'Eustachian tube', rhinitis nwereike ikpalite ọrịa a n'azụ imi ma ọ bụrụ na okporo a anaghị arụ ọrụ ọfụma, nke ga-eme ka mmiri tojuo n'etiti ntị n'azụ udu ntị. Ihe na-egosi na mmadụ nwere nsogbu n'etiti ntị ya: Etu e si agwọ ya: Ndị iche dị n'orịa Otitis media na Otitis externa: Ọrịa a bụ nke na-etinyekarị mmadụ n'ọnọdụ ebe ọ dị ya ka ụwa ya ọ na-eme ntụgharị. Ọ bụ nsogbu nke ime ntị (inner ear) na-eme ka isi ejuru mmadụ. A mabeghi ihe na-ebute ọrịa Meniere a, mana a ma na ọ bụ nsogbu mfachi ntị so eme ya. Ihe na-egosi ọrịa Meniere: Etu e si agwọ ọrịa Meniere: Ọrịa a enweghi ngwọta, mana dọkịta nwere ike inye gị ọgwụ ga-enyere gị aka maka anya ajụ na ịgbọ agbọ. Ọ bụrụ na ọ na-arịa gị, o gosi gị na ọ chọwala imalite dịka ibu gị anya ajụ na ihe ndị ọzọ, ndị dọkịta NHS na-ekwu na ọ ka mma na ị wegharịghị isi gị ọsịsọ, ma were nwayọ nwayọ na-aga ije, nọrọkwa maọbụ dinara ala ruo mgbe ọ kwụsịrị inye gị nsogbu. Nke a bụ ọrịa na-emetụta ọkpụkpụ 'mastoid' dị n'azụ ntị mmadụ. Ọ bụ ụmụaka ka ọ kacha emetụta. Ihe na-egosi na mmadụ nwere ọrịa a: Etu e si agwọ Mastoiditis: Ọrịa ndị ọzọ na-emetụta ntị mmadụ gụnyere:	https://www.bbc.com/igbo/afirika-57138132
health	Igbo delicacies: Ị hụtụla ụgba pụrụiche maka ndị na-asọ anụ?	Nnenna Ubani bụ osite Igbo anaghị eri anụ maọbụ azụ. Ọ na-eme ụgba n'ụzọ pụrụiche n'etinyeghị anụ maọbụ azụ maka ịdozi ime ahụ mmadụ. BBC Igbo gara n'ụsekwu ya ebe ọ gosiri anyị etu o si agwọ ya. Lee ihe anya anyị hụrụ ebe a.	https://www.bbc.com/igbo/afirika-50873631
sports	Akụkọ kachasị n'abalị a: Serena Williams agaghị asọmpi Italian Open	Akụkọ kachasị n'abalị a Naịjirịa akwadola maka Ebola Ndị ọrụ Immigration na ngalaba na-ahụ maka mgbochi ọrịa bụ Nigeria Centre for Disease Control (NCDC) na-ekwu na ha ekeela nkwụcha iji hụ na ọrịa ebola bịachịrị na mba Congo abataghị Naịjirịa ọzọ. Ha kwuru na ha na ndị ọrụ nchekwa na Congo na-akpakọrịta. A chụọla kọmishọna uweojii n'Imo steeti Ewepụla onye bụbu kọmishọna ndị uweojii nke Imo steeti bụ Chris Ezike. Akụkọ kwuru na-ewepụrụ ya n'ọrụ maka ọnọdụ ya n'ihe mere n'etiti ndị ọnụ na-eru n'okwu n'otu APC na Rochas Okorocha bụ gọvanọ Imo steeti. N'akụkọ mba ofesi, Ndị mba North Korea atọghapụla ndị mba Amerịka atọ ha tinyere n'ụlọ mkpọrọ. A na-ahụta ya ka ihuọma ndị North Korea chọrọ iji kwado maka nzukọ dị n'etiti onyeisiala ha bụ Kim Jong-un na onyeisiala mba Amerịka bụ Donald Trump. Serena Williams agaghị asọmpi Italian Open Serena Williams bụ dike n'ịpịa tenis ekwuola na ọ gaghị eso asọmpi Italian Open maka na ọ ka chọrọ ohere ikwado ọfụma maka asọmpi nke mbụ ọ ga-apịa na clay kamgbe ọ mụchara nwa. Ebe Wilfried Zaha bụ onye egwu ndị otu Crystal Palace enwetala ihe nrite 'ọkacha agba na Premier League' nke ọnwa Epreelụ. Gee akụkọ anyị n'otu nkeji ebe a Lee ihe nkịrị taa	https://www.bbc.com/igbo/afirika-44059942
health	Coronavirus update: Gịnị bụ 'herd immunity'?	Nkọwa ihe 'herd immunity' pụtara.	https://www.bbc.com/igbo/afirika-52724621
health	Coronavirus aghọọla ọrịa 'o zuru-ụwa-ọnụ' - WHO	"Otu ahụike mba ụwa bụ WHO n'aha ịchafụ akpọpụtala Coronavirus dịka ọrịa 'o zuru ụwa ọnụ' nke Bekee kpọrọ ""pandemic"" dịka ọrịa ahụ metụrala mmadụ  118,000  na mba  114 countries, ebe mmadụ 4,291 tụnyerela ndụ ha. Onyeisi  WHO bụ Tedros Adhanom Ghebreyesus bụ onye kwupụtara nke a na mgbede Wenezde ka ọ na-agwa ndị ntakụkọ okwu,kwuru na nnu aghala ya bụ ofe dịka ọrịa ahụ. "" WHO na-elebanye anya n'ọrịa kemgbe ọ gbakapụtara ma ihe kachasị echu anyị ụra bụ ka o si efesasị na-akpa ike nakwa ka ọtụtụ siri gba nkiti ghara ime ihe ọbụla."" ""Puku kwuru puku nọ n'ụlọgwụ na-alụ ọgụ ọnwụ na ndụ. ""Thousands more are fighting for their lives in hospitals. N'abali ole na izuụka ole na-abịa, anyị na-atụ anya na ọnụọgụgụ ndị nwere #COVID19, nakwa ndị ga-anwụ site n'ọrịa nakwa mba ndị ọ ga-emetụta ga-agbali karịa."" Dr Tedros gara n'ihu kwuo na  n'izuụka abụọ gara aga, ndị burula ọrịa  ma agụpụ Chaina dị mmaji iri na atọ, ebe mba dị oferela dị mmaji atọ. ""Ugbua enweela mmadụ  118,000  na mba  114 countries, ebe mmadụ 4,291 tụnyerela ndụ. "" O kwuru na ụfọdụ mba enweghị ndị ọrụ doro anya , ụfọdụ obodo enweghị ihe ọ ga-eri, ebe mba ụfọdụ enweghị  mkpebi obi ime ihe kwesịrị."" Ihe mere na Mgbo, Ebonyi steeti Nwa eze obodo Ngbo dị na Ebonyi steeti bụ Uche Ali ekwuola ọgbaghara tara isi ọtụtụ mmadụ n'obodo ha ụbọchi Tuzde bụ okwu ala dị n'etiti ha na ndị Agila dị na Benue steeti, na ọ bụghị nso ndị ọchịehi. Ị nụla na ụlọomeiwu ukwu Naịjirịa amalitela itinye anya n' iwu ga-amachi ịtụbata maọbụ ire igweọkụ latrik. Sanusi na El-Rufai Nke a bụ ọrụ nke abụọ Gọvanọ  Nasir El-Rufai na-enye Sanusi na abalị nabọ  a chuturu ya n'oche eze. Ụlọikpe mba Amerika atụọla nwoke amama amam na Hollywood bụ Harvey Weinstein nga afọ iri abụọ na atọ maka ịwakpo ụmụnwaanyị. Ebugharịala asọmpị dị n'etiti otu Arsenal nakwa Manchester City n'ihi ọrịa Coronavirus. Ozi otu Arsenal dere na peeji ha sị na ọtụtụ ndị ọgba bọọlụ ha na Evangelis Marianakis nwe otu Olympiakos enweela mmekọ mbụ. Cheta na nje a abụghi akuko ifo. Gbado anya ma ga BBC Igbo dọt kọm gụọ akụkọ anyi nwere gbara ya. Ụlọikpe eyigharịala ikpe Sowore ọzọ Ụlọikpe ukwu na Abuja eyighrịala ikpe Omoyele Sowere onye kpokọbara ""#Revolutionnow"" ọzọ. Ha bụgara ya ụbọchị 1 na 2 ọnwa Eprelụ iji nye ohere ka ndị gbara ya akwụkwọ wekọta ihe ndị akaebe ha chọrọ iji kpe ikpe. Ijeoma Ojukwu bụ onye ọkwaiwu kachasị na ya bụ ikpe gbarụrụ ihu maka etu ndị gbara akwụkwọ esighị dị njikere n'ikpe a. Cheta na gọọmentị Naịjirịa boro Omoyele Sowore ebubo ịgba mgba okpuru nke mere ha ji jichie ya ọnwa ole na ole n'afọ gara aga. Ọ bụ Buhari nyere iwu ka achụtuo Sanusi Lamido - Kwankwaso Aka chịbụrụ Kano steeti bụ Rabiu Kwankwaso etinyela ọnụ n'okwu na-akpọtụ maka Sanusi Lamido Sanusi. Kwankwaso kwuru na ọ bụ onyeisiala Buhari nyere iwu ka a chutuo ya n'ọkwa sị na ""ndị isi n'ebe ahụ n'onwe ha kwuru na e si n'elu nye ha iwu."" Cheta na ọ bụ n'ụbọchị Monde ka Gọvanọ Umar Ganduje nke Kano steeti chụturu Emir Sanuisi Lamido Sanusi n'ọkwa ma dochie onye ọzọ. Rue ugbua, anụbeghị 'pịm' n'ọnụ Onyeisiala Buhari maọbụ gọọmentị ya n'ihe na kpọtụ na Kano steeti. Minista na-ahụ maka ahuike ndị mba Briten bụ Nadine Dorries ebutela ọrịa coronavirus. Dorries onye dị afọ iri isiina abụọ kwuru na ọ wepụrụ onwe ya iche n'ụlọ ya mgbe ọ chọpụtara na o bu ya bụ ọria Coronavirus. Mịnịsta Dories bụ onye mbụ bụ onye omeiwu Briten bu ọrịa Coronavirus. Ndị bu ọrịa a na mba Briten eruola mmadu narị atọ iri asatọ na abụọ ebe mmadụ isii lagoro mụọ maka ya bụ ọrịa na Briten. Dịka ọ dị ugbua, Dorries kwuru na akwụkwọ ọ depụtara na ngalaba na-ahụ maka ahuike ebidola ịchọpụta ndị niile ha na ya nwere mmekọ. O kwu kwara na twitter ya were sị ""Ọ bụchaghị ihe nwere isi, ebum n'obi na nke ka njọ agafela...kama ọ bụ nne m gbara afọ iri asatọ na anọ mụ na ya bị bidoro kwọwa ụkwara ka ụche m dị."" ""Ọdọụgbọelu Enugwu agafena Eprelu"" - Ndị ụlọomeiwu Ndị ụlọomeiwu ukwu na nta nke Naịjirịa agbarụọla ihu gbasara ọdọ ụgbọelu Akanu Ibiam nke dị n'Enugwu. Ha gwara ndị ji ọrụ ngo ahụ ha gbaa mbọ rụtọpụ ya n'ọnwa Eprelu dịka ha si kwe nkwa maọbụ anapụ ha ya bụ ọrụ n'aka. Onyeisi otu ndị omeiwu na-elekọta njem ụgbọelu bụ Nnolim Nnaji kwuru nke a dịka ha gachara njem nleta n'ụdọụgbọelu ahụ. Sanusi Lamido eritela ọkwa ọzọ Gọvanọ na-achị Kaduna steeti bụ Nasir El-Rufai etinyela Sanusi Lamido Sanusi bụ bụ eze Kano n'ọkwa na ngalaba na-ahụ maka mwulite akụnaụba steeti ahụ. Nke a na-abịa dịka Sanusi Lamido na-akwado ị ga ụlọikpe ịgbagha nchutu achuturu ya n'oche. Ronaldinho atọla na mkpọrọ Otu ọkaiwu na mba Paraguay ajụla ịnye ikike ka atọghapụ ọgba bọolụ a ma ama bụ Ronaldinho n'ụlọ mkpọrọ. Cheta na anwụchịrị ya na nwanne ya nwoke n'ụbọchị Fraide izuụka gara aga maka iji akwụkwọ njem adịgboroja bata mba ahụ. Gee akụkọ ụwa n'ime otu nkeji ebe a"	https://www.bbc.com/igbo/afirika-51813257
politics	Rev Father Mbaka: Ndị chọrọ ka Buhari nwụọ ga-ebu ya ụzọ nwụọ	"Ụkọchukwu Ejike Mbaka bụ onyeisi ụka Adoration dị n'Enugwu ekwuola na Onyeisiala Muhammadu Buhari abụghị nsogbu Naịjirịa. Mbaka kwuru nke a ụbọchị Wenezde n'ọgbakọ ofufe nru ọ na-ehiwe kwa izuụka n'ogige Adọration dị n' Umuchigbo Iji-Nike, Emene, Enugwu. Fada Mbaka sị na o ruru afọ 16 ndị chịburu Naịjirịa mbụ ji mebicha obodo ma kwukwaa na ndị mmadụ chọziri ka Buhari jiri afọ ole na ole mezie ihe niile. ""Ndị mmadụ na-akọ m ọnụ na m na-akwado Buhari ka a ga-asị na Buhari adịghị eme ọfụma."" Mbaka gara n'ihu sị na ọchịchị Buhari ga-adị, na ndị chọrọ ka ọ nwụọ ga-ebu ya ụzọ nwụọ. Ọ sị na ya ma na ọ bụ Buahri nọ n'Asọ Rock makana ọ na-echeta nkata ha abụọ kpara tupu ọ bụrụ onyeisiala. N'okwu banyere ndị na-achi ehi, Mbaka sị na ya nwere ehi, nke mere ya onye ọchịehi. Lee ihe 20 gbara ọkpụrụkpụ ndị ọzọ o kwuru n' ozi ya: 1.  Buhari abụghị nsogbu anyị, ndị Buhari bụụrụ nsogbu bụ ndị na-ezufu ego 2. Buhari abụghị nsogbu Ndigbo. Kedụ mgbe Buhari banyere n'ọchịchị Naịjịria? 3. Jonathan enyere Igbo Biafra, Buhari jụ inye ụnụ ya? Obasanjo enyere Igbo Biafra, Buhari jụ inye ụnụ ya? Ken Nnamanị bụ onyeisi Sineti, o nyere ụnụ Biafra? 4. N'ọrụ ugbo, Naijiria na-alaghachi ugbua na ị bụ ebe e jiri ịkọpụta ihe ubị mara n'Afrịka 5. Ihe e mebiri n'afọ 16, agaghị edozili ya n'otu afọ 6. Onye bụbụ Mịnịsta Mmanụ bụ Dieaziani ọ bụ na ọ bụghị onye Igbo na-alụ ya? 7. Ndị gọvanọ chọọ ụzọ ha ga-esi gboo mkpa nchekwa na steeti ha, ọ bụghị Buhari ga-abịa gburu gị anwụ. 8. E kwuru m ka a ghara ime ngagharịiwe maka Fada Offu e gburu ma ọ bụrụ na e meghị nchọpụta ka e were hụ ihe a gbadoro ụkwụ. 9. Esonyeghị m mee ngagharịiwe n'agbanyeghị na m bere akwa maka ogbugbu ya. 10. Ndị wepụtara foto sị na ọ bụ m ebe m so eme  ngaharịiwe maka ogbugbu Fada Paul Offu ga-ata ahụhụ. 11. E nwere ndị Fulani bụ ndị ajọ mmadụ na-ememila ndị mmadụ mana ha abụghị ndị ọchịehi. E nwekwara ndị ọchiehi na-eme ihe ọjọọ, 12. E nwekwara ndị Igbo bụ ajọ mmadụ bụ ndị ntọ, ọ bụghị naanị ndị Fulanị 13. Anyị nwere nnukwu nsogbu nke ihe ga-egbo ya bụ inwe ọrụ. 14. Ụfọdụ ndị gọvanọ ga-ezufucha ego, ha agaghị akwụ ụgwọ ọnwa ndị ọrụ. 15 Gọvanọ ọbụla bụ onyeisi nchekwa steeti ya, ha na-ata ego nchekwa kwa ọnwa maka nke a. Kedụ ihe ha ji ya eme? 16. Ndị uweojii na-ejichi ndị Keke na-anapụ ha ego n'ike ọ bụ Buhari na-eme nke a? A na-eme ya n'Ugwu Awụsa? 17. Bịafra, Bịafra, enye Ndigbo Bịafra ugbua, a sị anyị nweta onyeisiala, ndị Anambara a ga-ekwe ndị Imo? Ndị Imo aga-ekwe ndị Enugwu? Ndị Enugwu aga-ekwe onye Ebonyi? Abịa aga-ekwe Imo? 18. Ọ bụrụ na m bụ Ịmam ndị Ugwu, ndị Ugwu ga-echekwa m. Ọ bụrụ na m bụ ụkọchukwu ndị Ọdịda Anyanwụ, ndị Yoruba ga-echekwa m. Igbo nwere eze na-egbu onwe ha. 19. Ha chọrọ igbu Fada Mbaka ka ha bo ya ndị Fulani. 20. Ndị na-eti Biafra Biafra na-egbu oge ụnụ, na-anapụ ụnụ ego."	https://www.bbc.com/igbo/afirika-49355341
business	Coscharis Group: Etu N200 jiri gbanwe bụrụ ide ego n'aka m	"Onye ojiego achụa ego a ma ama bụ Cosmas Maduka onye e ji Coscharis mara, kọwara etu o siri bụrụ ide ego na mkparịta ụka pụrụiche ya na BBC Igbo nwere n'ụbọchị Tọọzde, abalị iri na itoolu nke ọnwa Sepụtemba afọ 2019. Maazị Maduka sị na ya bidoro njem ịchụ ego ya n'ịgba bọị, tupu nna ya ukwu eji narị naịra abuo duo ya n'afọ 1976. Lee etu o siri gbarie njem ya: Maduka kọwakwara etu o si malite njem azụmahịa ya wee ruo n'ogogo ọ nọ ugbua. Ọ kọwara na ""Coscharis"" bụ nchịkọta aha ya na nwunye ya bụ Cosmas na Charity. Ọ kwụsịrị agụmakwụkwọ n'elementarị nke atọ ma bido ịmụ ahịa n'aka nna ya ukwu bụ onye ji naanị N200 dụọ ya ụlọ n'afọ 1976. Ọ bụ ahịa akụrụmgwa ọgbatumtum ka o jiri bido. 1) Ndụmọdụ na nkwado Nne ya ""Agụụ chineke mere ka m hara igahe ụzọ."" Cosmas Maduka Nne ya bụ ezigbote onye na-ekpere chineke, ọ gwara ya ka ọ nwee okwukwe na Chineke nakwa n'ime onwe ya. Nne ya kuziri ya etu e si ekpe ekpere ma nye ya ndụmọdụ etu o ga-esi bie ezigbo ndụ. Mama Madụka mere ka ọ nwee ezigbo olileanya na okwukwe na ihe ga-agaziri ya. Madụka sị na onweghi ike iwepụ anya n'ebe Chineke nọ. ""Onweghị ihe dịka ihu ụzo (Vision) ọ ga enyere gị aka imata ihe i ga-eji ndụ gị  mee."" Cosmas Maduka Mazi Cosmas Maduka rịọrọ ndị ntoroọbịa ka ha bido n'oge chụwa ewu ojii. Madụka kwuru na onweghị ihe o mere ma mmadụ bido n'afọ iri na abụọ nwee ihe ọ na-atuanya n'ime ndụ ya. o kwuru na ihe niile abụghị ihe ndapụta maka na e nwere iwu na-ahazị ihe n'ụwa. Mazi Madụka kwuru na mgbe ọ dị afọ iri na isii, ọ marala ihe ọ chọrọ ibụ. Ọ dekwara n'akwụkwọ na tupu ọ ruo afọ iri abụọ na atọ na ọ ga-ego ụgbọala nke ya. Ọ sị na o mezuru nke a ka o si dee ya. Ọ gwara BBCIgbo na ihe mmadụ na-eme taa ga-egosi ihe ọ ga-abụ na mgbe na-adịghị anya. Onye ọ bụla kwesiri inwe onye ga-edu ya ma soro nzọ ụkwụ onye ahụ. O kwuru na ọ bụ mgbe ọ gbara nna ya ukwu ""Boy boy"",  ka ọ chịkwara onwe ya ma soro ezigbo nzụ ụkwụ dịka nwata. "" Ego 'dot.com' ga efukwa ka 'dot.gone' "" Cosmas Madụka Cosmas Maduka gwara BBC na ebe ọbụla mmadụ chọro i ga n'ụwa a, ọ gbado anya ọ ga-erute ya. Mana ọ dị kwa mkpa ka onye ahụ kwụwa aka ya ọtọ. Ọ sị na ọ bụ ndị Japan mepere ya ụzọ n'ahia. O kwuru na ọ bụ ikwụwa aka ya ọtọ mere ka ndị ụlọọrụ Japan tukwasị obi n'ebe ọ nọ ma mepere ya ụzọ. Maduka kwukwara na ọ bụ ezi omume a mere ka ụlọọrụ ya bụ Coscharis ji na-anọchite anya ụlọọrụ dịka Jagua, Rolls Royce, Range Rover na Ford na Naịjirịa. ""Ndi enweghị ebe ha na-aga ga-achọ ka gị na ha nọrọ n'otu ebe.""  Cosmas Maduka Ọ naghị ele ihe onyonyo, kama ọ ga-ele ihe onyonyo ya gụọ akwụkwọ. Enweghị ihe onyonyo mekwara ka ya na nwunye  nwee ezigbo mmekọrịta. Ọ bụ akwụkwo mgbasa ozi ka o ji amata ihe na-eme. Mazi Madụka na-eri ezigbote nrị na-edozi ahụ. Mazi Maduka nwere ala rụrụ oke ala 3,000Ha ebe ọ kọrọ osịkapa n'Anambra steeti. Kama ọ bụ naani 1,200Ha ka ha na-akọ ugbua. Ọ kwuru na Naijirịa na-emefu  Ijeri naịra atọ n'ibubata osikapa, na ọ chọrọ inweta pasentị iri abụọ na ise (25%) n'ime ego a. Ọ ka na arụ ya, mgbe ọ rụchara ọ ga-enye ndị mmadu ruru 3,000 ọrụ."	https://www.bbc.com/igbo/afirika-49751952
politics	Naanị otu nwaanyị so azọ ọkwa onyeisiala Naịjirịa 2023	Princess Ojei Chichi bụ naanị nwaanyị Independent National Electoral Commission (Inec) depụtara aha ya dịka onye so azọ ọkwa onyeisiala Naịjirịa na ntuliaka 2023. Princess Chichi na azọchitere pati Allied Peoples Movement (APM) ọkwa a. O si n'akụkụ ndịda Naịjriịa nke Delta steeti. Osote ya bụ Ibrahim Mohammed dịka Inec siri depụta. N﻿galaba nhazi ntuliaka bụ Independent National Electoral Commission ewpụtela aha ndị ga-eso zọọ ọkwa ọchịchị dị icheiche na gọọmentị etiti na ntuliaka 2023. I﻿nec bipụtara aha ndị a taa bụ Tuzde 20 Septemba 2022 dịka ha si kwubuo, ebe achụmnta vootu ga-amalite n'uju n'ụbọchị 28 nke ọnwa Sepụtemba 2022. Gọvanọ David Umahi ga-eso zọọ ọkwa Sineti Dika ọ chịtaghị aja na ndọrọndọrọ imeụlọ ndị APC maka ọkwa onyeisiala, Gọvanọ Umahi ga-azọzi ọkwa Sineti nke Ebonyi South. Aha ya dị n'akwụkwọ nke Inec, mana ha dere na ọ bụ mkpebi ụlọikpe kpatara nke a. Cheta na ọ bụ nwanne David Umahi bụ Augustine meriri ntuliaka imeụlọ ndị APC maka ọkwa a, mana ọ rituuru Gọvanọ Umahi dịka ọ dachara na ntuliaka imeụlọ nke onyeisiala. O﻿nyeisi Sineti bụ Ahmad Lawan amabeghị ọnọdụ ya Ka ọ dị ugbua, o﻿nyeisi ụlọ omeiwu ukwu Naịjirịa bụ Ahmed Lawan agaghị eso zọọ ọkwa Sineti na 2023. L﻿awan so na ndị zọrọ ntuliaka imeụlọ APC maka ọkwa onyeisiala, mana ọ nwetara naanị vootu 152. Akụkọ kwuru na o﻿ge Lawan chọrọ ịlaghachi azụ ga zọọ ọkwa Sineti nke Yobe North, onye meriri ntuliaka imeụlọ APC maka ọkwa ahụ bụ Bashir Machina jụrụ ajụ irituru ya. K﻿a ọ dị ugbua, Inec etinyeghị ma aha Ahmed Lawan ma nke Bashir Machina n'akwụkwọ a ha bipụtara. R﻿ochas Okorocha agaghị eso zọọ ọkwa ọbụla na 2023 R﻿ochas Okorocha bụ aka chịburu Imo steeti ma bụrụkwa onye na-anọchite anya Imo West n'ụlọ omeiwu ukwu Naịjirịa, mana aha ya agaghị adị na ndị ga-eso zọọ ọkwa ọbụla na 2023. O﻿korocha zọrọ ọkwa Onyeisiala na ntuliaka imeụlọ nke ndị APC mana o nwetaghị ọbụladị otu vootu. N﻿'oge ahụ, kepukepu pụtakwara na ọ si azụ ụlọ gbata akwụkwọ pati PDP maka ọkwa Sineti, mana odoghị anya ma akụkọ ahụ ọ bụ eziokwu. K﻿a ọ dị ugbua, aha Okorocha adịghị n'akwụkwọ ndị Inec, ma na APC, ma na PDP. N﻿a APC, ọ bụ Osita Izunaso ka Inec wepụtara aha ya maka ọkwa Sineti nke mpaghara Imo West; na PDP ọ bụ Onyeriri Jones ka aha ya dị na ya.	https://www.bbc.com/igbo/articles/cxreldg0wq9o
