entertainment	BBNaija Lockdown Reunion: Highlights of Monday episode of 'BBNaija reunion 2021' on Tolanibaj/Prince & Vee	"Fans of di popular reality television show for Nigeria, Big Brother Naija still dey tok about di relationships of housemates Di situationship between Ozo, Nengi and Dorathy during di Friday episode of BBNaija Lockdown Reunion still dey fans mouth. For di show di host Ebuka Obi-Uchendu bin torchlight di stories wey surround Nengi, Ozo, Dorathy and Prince situationship inside di house. But di main highlight wey shock fans na di gbas -gbos  wey happun between Dorathy and Wathoni. Dora bin dey address di situationship between herself Nengi and Ozo wit di host Ebuka. Di exchange of words occur her revelation say she bin like Prince not Ozo inside di house. Di two ladies bin clash wen Wathoni chook mouth as Dora bin dey address di mata wit Ebuka. Dis na di  first time wey di Lockdown gang dey come togeda for inside di same place since di show end almost a year ago. Di reunion na to clear di air and tok dia church mind towards each oda. And also revisit some of di highlights and memorable moments from Season 5 edition wey Laycon emerge as a winner. From di short teaser at di end of Friday episode Ebuka still focus on di relationship mata inside di house for Monday episode. Dis time na Prince and Tolanibaj relationship, wetin happun and how tins be now. Tbaj bin address Prince inside di short video clip wey dem show, Earlier Tbaj say she come di reunion to ""come speak her truth not to change di narrative. But she explain di narrative wey some pipo don attach to di Tolanibaj name."" She also mention say she go confront di pipo wey she need confront. For anoda clip wey di organizers Tolanibaj clsh wit Vee. For inside di video, Baj say she go 'smack' Vee. Fans go get to find out for demsefs, wetin dey cause dis gbas-gbos. Na cable company DSTV dey show di ""BBNaija Lockdown Reunion"" for African magic Urban at 10:00pm. And at 10:30pm on AM Family from Mondays -Fridays. Organisers say di four things to expect from di Lockdown Reunion na For di first time for di Big Brother Naija Reunion history, every single Housemate for di Lockdown Season go attend. E get more love triangles and squares than wetin pipo fit imagine According to Big Brother, di biggest clash come from two supposed friends and di first reconciliation come from two longtime enemies. Di show host, Ebuka mention say e get more than one few jaw dropping moments. And even di Housemates dey shocked to find out how much dem no really sabi each oda, Ebuka add. BBNaija Reunion Show na part of preparations for di commencement of another season of di reality show. And fans go once again get to see dia favourite 'Lockdown geng'."	https://www.bbc.com/pidgin/tori-57551048
health	Coronavirus update: Why Ghana no shutdown schools despite Covid-19 spread	"Parents for Ghana intensify dema calls for govment to shut down schools sake of fears say Covid-19 dey spread.  National Council of Parent Teacher Associations (NCPTAs) say de children dey live in fear and panic sake of dema dey hear of colleagues who dey catch de virus.  Alexander Yaw Danso, President for National Council of Parent Teacher Associations (NCPTAs)  talk BBC Pidgin say ""Ghana start as one, two, three cases but right now we catch 24,000. Dem wan make we wait until September?"" ""De worst part be say dem no dey test dem too… how dem go know if de students test positive for de virus when dem no dey test dem?"" he add.  Tension start dey mount among parents after news broke say 55 people made up of students den teachers for Accra Girls' Senior High School test positive for Covid-19.  Ghana Health Service (GHS) and Ghana Education Service (GES) release joint statement where dem reveal say after testing 314 people for de virus in de school, 55 test positive.  GES say dem go continue to test, trace and treat cases for schools across de country to manage Covid-19 cases in schools.  Cassandra Twum Ampofo, GES Spokesperson talk BBC Pidgin say ""we dey identify and segregate contacts from other students.""   •      Authorities distribute nose masks give students •      GES intensify education on use of nose masks, sanitizers and social distancing •      Students now dey attend dinning in smaller units so say dem no go experience overcrowding on campuses •      Testing of suspected Covid-19 cases across de country. •      Second mass disinfection exercise of schools •      Strengthen counselling and psychological support over de Covid-19 fear National Council of Parent Teachers Association dey call for de shut down of school but according to de GES dis no be de best move at dis time.  But GES Spokesperson, Cassandra Twum Ampofo, explain give BBC Pidgin say from how dem dey manage de situation sending dem home no be good move. Why Ghana no shut down schools? See di reason dem give. •      Main reason students dey on campus be sake of dema final exams, after which all go return home •      E no be safe to send students home now, rather keeping dem in schools go help manage any suspected cases of Covid-19 •      Govment get opportunity to easily test, trace and treat students wey catch de virus while dem dey in confined places like school •      Students dey come from all over de country, if authorities leave dem make dem go house, dem go fit infect dema communities •      Most of de cases dem dey record for schools dey in incubation period, so e go be better say authorities go keep dem in school and treat dem •      Once govment confine dem, e go be easy to contact trace, identify and treat students  Despite calls from National Council of Parent Teachers Association, GES say despite dem get de interest of students at heart wey dem go finish de exams and return home to dema families."	https://www.bbc.com/pidgin/tori-53400328
politics	INEC set September 2 for PVC collection for Kogi, Bayelsa elections	Independent National Electoral Commission (INEC) for Nigeria don announce September 2 for di collection of Permanent Voters Card (PVC) for di Bayelsa and Kogi states election wey dey come. For statement wey di National Commissioner Festus Okoye sign on 20 August, di election office say pipo wey neva collect dia PVC get till 30 September to do am. Kogi and Bayelsa State go hold dia own govnorship election on 16 November, 8 months afta majority of states for di kontri don do dia own. Dis dey happun because of court order wey replace govnors for dos state, na so di date for four-year term also change. Di election office say because time wey no dey to conduct election for di two states, dem no go fit do fresh registration of voters, transfer of voter's cards and to reprint of voter's card wey don spoil. INEC also draw ear give parties say di dates wey dem don set, extension no go dey. Di last day for parties to deal with mata wey relate to dia primaries na September 5 while di last day for submission of candidate list and dia personal particulars na September 9 for INEC Abuja headquarters.	https://www.bbc.com/pidgin/tori-49407978
entertainment	"Nicki Minaj new song Mixtape ""Beam Me Up Scotty"": American rapper explain why she take long break from music and wetin next"	"American rapper Nicki Minaj don return to di music scene afta long break. After she shock fans wit unexpected Instagram tease on Monday, di singer on Friday rerelease her 2009 mixtape ""Beam Me Up Scotty"" on streaming services . Dis dey come months afta Nicki announce retirement from music for September 2019. ""Dis na just to get back to di basis a little bit, to di essence of why I begin dey rap"", Nicki tok about why she decide to re-release her 2009 mixtape Di rapper also tok during one Instagram live she do on Friday, say she don add three new tracks to di original project. ""I know say if I just rerelease di mixtape without putting anything new, I know say una go abuse me out,"" Minaj tok. Di mixtape new adds include ""Fractions,"" a ""Crocodile Teeth"" remix wit Skillibeng and one return to di Young Money team ""Seeing Green"" wey feature Lil Wayne and Drake. For di live video, Nicki also explain why she take a long break from music only to return now. ""Di little hiatus na because I dey for mommy mode but also because I dey go through wetin dem dey call 'writer's block' And if you be artist, no matter wetin you do, you no really fit flex your art di way you bin dey do am. So I bin go through a little bit of writer's block and I be like damn..."" Di ""Super Bass"" rapper never release any new album since 2018 wey she release ""Queen"" and her last single na ""MEGATRON,"" for June of 2019. For September 2019, Minaj shock fans wen she announce say she dey step away from music. ""I don decide to retire & have my family,"" she bin write on Twitter. She later turn back for one interview wit Billboard, to say ""I love music and interacting wit fans, so I no really see taking myself completely away. But I wan dey open to other possibilities in my life,"" she tok three months afta her initial announcement. On Sept. 30, 2020, she and husband Kenneth Petty welcome dia first child together, a baby boy."	https://www.bbc.com/pidgin/tori-57120409
health	Coronavirus: Ghana hospital workers wey dey sell PPE for dia personal gain unmasked	One Africa Eye undercover investigation don show say some staff for Ghana hospitals dey sell Personal Protective Equipment (PPE) for dia personal profit.  More dan 2,000 medical workers for Ghana don catch coronavirus since di outbreak begin. Di kontri don see serious scarcity of essential protective equipment like face shields, masks and suits.  Di investigation show how some medical workers dey make profit at di expense of dia colleagues.	https://www.bbc.com/pidgin/tori-53719592
entertainment	Netflix confirm Busi Lurayi death, manager tok how she 'suddenly' die	"Busisiwe Lurayi, wey act Tumi for Netflix comedy series How To Ruin Christmas, don die. Her management confam say di South African actress pass away for her residence on Sunday. Netflix South Africa confirm her death on Monday for dia verified Instagram page. Her family don release statement on Busisiwe Lurayi death. For statement wey Lurayi handlers - Eye media Arts - release, dem say: “We dey deeply saddened to notify una of di passing of our beloved Busisiwe Luerayi."" According to her managers , ""she pass away suddenly and dem pronounce her dead for her residency on 10 July 2022.” Di cause of her death still no dey known. Di family say dem go wait for autopsy and ask for privacy during dis 'difficult period'. Meanwhile tributes dey pour in for di South African actress passing.  Neflix South Africa dey mourn di passing away of di actress ontop dia social media platform. ""One incredible light don off for South African entertainment industry."" ""We dey deeply saddened by di passing of award-winning stage and screen actor Busi Lurayi. Netflix add. ""We go hold onto di laughs, di beauty and all di moments of joy wey she bring to us. Busi Lurayi na both stage and on-screen actress. Dem sabi her well-well afta she star as Phumzile for one SABC1 sitcom City Ses’la and di spin-off series Ses’Top La. She don since appear for plenty movies and TV series. Her popularity later grow afta she appear for di first two seasons of one Netflix hit series. 'How to Ruin Christmas: The Wedding and How to Ruin Christmas: The Funeral.' Dem born Busi for Tembisa Ekhuruleni for Guatend, South Africa. She don gbab many awards like di Golden Horn Award for Best Supporting Actress for one TV Comedy for 2006. She don also win Golden Horn Award for Best Actress for TV Comedy for 2011."	https://www.bbc.com/pidgin/articles/c3gd0g3v7x2o
politics	Gbas-gbos between APC Oyetola and Labour Party Lasun days before poll	"Osun State Govnor Gboyega Oyetola don deny di allegation from Yusuff Lasun, say im supporters attack im house on Monday morning. Lasun na di govnorship candidate of di Labour Party for di Osun State gubernatorial poll wey go happun on Saturday, July 16. Lasun claim say di attack happun for im house wey dey Ilobu for Irepodun local goment area of Osun State, southwest Nigeria around 1:00am on Monday, 11, July, 2022. Lasun also share fotos of di attack on im Twitter page on Monday. Lasun wey be former House of Representatives deputy speaker say di gunmen shoot im building as dem attempt to kill am, and add say di attack last for about 20 minutes. E say e get evidence say Govnor Oyetola supporters na dem dey behind di attack on im house. However, Oyetola wey be di candidate of di All Progressives Congress (APC) for di Saturday election, Oyetola describe di claim as lie. Di tok-tok pesin for Osun State govnor Ismail Omipidan tell BBC Yoruba say na Lasun plan di attack on im own house just to tarnish di image of Govnor Oyetola. “Pesin wey no win im local goment during primary election wen im still dey APC, e no win im local goment, na dat kind pesin we go dey afta?” Omipidan tok. Omipidan accuse Lasun say e won cause trouble on di day of election and na why e dey claim say dem attack im house. “My problem be say wia di pipo wey dey guard im house dey for midnight wen di attack happun? Dem dey sleep or dem no dey house. If no be Lasun plan am, we suppose see two pipo wey go confront di attackers,” Omipidan tok. Omipidan say Lasun no be threat to di re-election of Govnor Oyetola and challenge di former lawmaker to prove im allegations against di APC candidate. ""Di foto wey Hon. Lasun Yusuf dey try to paint dey very unfortunate sake of say Osun remain di most peaceful State for Nigeria and we go do everytin wey dey humanly possible to as goment to protect dis status,” e add. Omipidan say Osun goment and security need to investigate di mata as e accuse Lasun of planning to unleash violence on di pipo of Irepodun on election day."	https://www.bbc.com/pidgin/articles/cn0gwyq5gdeo
health	Coronavirus disease 2019: Malawi don become di first African kontri to burn thousands of expired AstraZeneca Covid-19 vaccine	"Health authorities for Malawi don burn 19,610 expired doses of di AstraZeneca coronavirus vaccine. Dem say dis go reassure di public say any vaccines dem collect dey safe. Malawi go be di first African kontri to publicly do dis. Di World Health Organization bin done tell kontris make dem no destroy expired doses but now dem don change di advice. Pipo wey show to collect vaccine for Malawi low and health workers hope say dis move go ginger public confidence. For dia population of about 18 million pipo, di kontri get record of 34,232 confirmed cases and 1,153 deaths. Malawi bin receive 102,000 doses of di AstraZeneca vaccine from di African Union on 26 March and use almost 80% of dem. But di expiry date wey dey di labels na 13 April so dem remove di vials from di cold chain dem take store am. Malawi principal health secretary tell BBC say e dey unfortunate say dey gatz destroy di vials but di benefits of doing pass di risks. ""Wen news spread say we get vaccines wey don expire, we notice say pipo no dey come our clinics to get immnunisation again,"" na so Dr Charles Mwansambo tok. ""If we no burn dem, pipo go think say we dey use expired vaccines for our facilities..."" Dr Mwansambo explain say one of di reasons health workers no use di vaccines before na because e dey hard to ginger adults to collect di vaccine. Malawi no be di only kontri for Africa to get expired vaccines. Di WHO bin ask affected countries to keep di vaccines until dem fit establish whether e go still dey good for use. But dem tok now say make kontris destroy vaccines wey don expire. WHO advise say make manufacturers comot di expired doses from di distribution chain and safely dispose am. Oda vaccines wey dey now fit stay up to 36 months. Di challenge wit Covid-19 vaccines na say e just dey in use for less dan a year and no correct data dey around dia effectiveness afta long periods."	https://www.bbc.com/pidgin/tori-57175697
politics	Buhari go address 74th UNGA, follow Bill Gates do meeting for New York	"Nigeria President Muhammadu Buhari go travel out on Sunday 22 September to attend di 74th session of di United Nations General Assembly wey dey happun for New York. Oga Buhari na di number five world leader wey go go address di United Nations General Assembly on di following Tuesday for America. Di topic for di dis year UNGA na ""Galvanizing Multilateral Efforts for Poverty Eradication, Quality Education, Climate Action and Inclusion."" Afta e address world leaders, di President go do meeting wit oga of big big companies dem like Aliko Dangote and Microsoft founder Bill Gates, on di mata of how Polio no go return to Nigeria and how how to bring investment come di West African kontri. In addition to those high-level meetings dem, some Nigeria officials wey follow oga Buhari travel go also attend some small-small programmers wey Ministries, Departments and Agencies (MDAs) organise dia. Di official Twitter handle of di Nigerian goment say Buhari go carri state governors Abdullahi Sule of Nasarawa, Abubakar Atiku Bagudu of Kebbi and Adegboyega Oyetola of Osun go New York. Ministers wey go go na di one of Foreign Affairs, Geoffrey Onyeama; of Environment, Muhammad Mahmoud; of Finance, Zainab Ahmed; and of Health, Osagie Ehanire."	https://www.bbc.com/pidgin/tori-49760331
health	Madagascar coronavirus cure: Meet di man and kontri wey dey try 'save' Africa	"For time wey di World dey look for answer to di global coronavirus pandemic, one kontri leader don dey di forefront of di battle. Madagascar President Andry Rajoelina don catch di world attention wit im 'herbal drink' wey im say dey cure coronavirus. Although di World Health Organization (WHO) don warn say di drink need further testing, some African kontris don begin enter queue to order am to test. On 8 April, president Rajoelina announce to di world di ""medicinal plant"" wey go see Madagascar"" change di course of history"" sake of im discovery. Despite wetin WHO tok, Rajoelina say pipo wey dey criticize im solution to coronavirus dey show di West attitude towards tins wey come from Africa. Im say ""If e be say na European kontri actually discover dis remedy, so much doubt go dey? I no tink so."" 46-years-old Rajoelina na long time businessman and na one-time Disk Jockey alias DJ. Im enter politics for 2007 wen im contest to be Mayor of Madagascar capital, Antananarivo. Rajoelina na di 7th president of di island nation, im don marry and get three children. Madagascar get 192 confam coronavirus cases according to informate from John Hopkins University. Out of dat number, 105 don recover and nobody don die from di virus."	https://www.bbc.com/pidgin/tori-52631726
entertainment	Emmanuella house: 10-year old Mark angel comedy star tok about her mother new house and plans she get for her parents	"Popular young Nigerian actor Emmanuella open up to BBC Pidgin about di house she build for her mama. Di young comedian wey say e take her about a year to build di house say her mama deserve estate for everything she don do for her and say she still get oda ogbonge plans for her parents. You fit like to read: Her full name na Emmanuella Samuel, dem born her for July 22, 2010. She be 10 years old. She be from Imo state, wey dey for di south east part of Nigeria. For 2016, she collect award as di best new comedienne and princess of comedy for di Afro-Australia Music and Movie Awards for Australia. Still for inside dat same year, she win award for Top Subscribed Creator from YouTube for di first edition of di Sub-Saharan African YouTube Awards. Emmanuella Samuel, na child comedienne for Mark Angel YouTube channel wey get ova six million subscribers. She become popular for her comedy skit ""This Is Not My Real Face Oh"". She also get some endorsements for some big brands for di kontri. ﻿"	https://www.bbc.com/pidgin/tori-54970441
politics	'We go change Nigeria for good' - Peter Obi tok for Labour party campaign flag-off	J﻿elilat Olawale B﻿BC News Pidgin D﻿i Labour don officialy staart dia presidential campaign ahead of di 2023 Nigeria general elections. D﻿i rally happun on Saturday 29 October, for Lafia, Nasarawa state capital for North-Central part of di kontri. P﻿residential candidate of di party Peter Obi and im running mate, Datti Baba-Ahmed; plus di oda members of di party 1,234 campaign council members dey in attendance for di wey plenti supporters attend. R﻿ecall say Obi bin earlier postpone di flag off to go visit some part of di kontri wia flood don scata and render pipo homeless. E also also ask oda presidential candidates to pause dia campaign sake of di flooding and pay respect to di victims. Di Director General of di campaign council, Doyin Okupe say di campaign train go dey massive across all di six geopolitical zones of di kontri. Peter Obi, 61 promise to solve Nigeria flood challenge and ensure say di kontri attain sufficiency for food production if dem elect am for 2023. E say im goment go move Nigeria from consumption to production and job creation. Obi also promise to fix Nigeria power palava, amongst odas. E come wonder why di Super Eagles no no fit qualify for Qatar 2022 World Cup wey dey start next month. “I dey assure you now say if we come into power, we go solve dis flooding problem.” Obi tok afta e don obeserve one minute silence in honour of di pipo wey die for di flooding wey don cause gbege for di kontri. “We no go do am overnight but we go begin dey solve am. E no go take 30 years. Di Federal Goment say e go take 30 years, e no go take 30 years for us to solve am. “Make I assure una, di goment of Obi and Datti Baba-Ahmed go change Nigeria for good,” e tok for di rally. Di Labour party candidate also promise say e go support farmers and youths for di di kontri. E add join say Nigeria fit feed imsef if dem take correct measures. “If we enta goment, I assure una, farmers go go back to farms because we go deal with insecurity, we go support youths; di more youths dey pulled comot from poverty, di more we go reduce criminality. “We will support youths because today Nigerian youths don’t have a home. When we come into government, the youths will have homes because we will solve their problems.” “Today for Nigeria, pipo dey spend all dia money to feed emselves. So many pipo no even fit feed demselves. We go make sure say we start di journey of Nigeria being sufficient for food production. If Israel fit feed imsef, Nigeria fit feed imsef. If India fit feed imsef, Nigeria fit feed imsef,” e tok. ''D﻿i goment wey we go form go be goment of youths and women. E no longer go be goment of old pipo. ''Governance no be retirement home'. No be old pipo home. I go form goment wey dey energetic', look at di two of us , we dey ready for di job, we sabi una problem.'' Obi continue. E﻿ come tell im supporters to ensure say dem support am and make dem also campaign for am. '﻿'Support us. Start to dey campaign for us. For your future no listen to dis pipo wey dey share money. Na una money wey dem steal’’ ‘’We go give una back your future’’ Obi tok as im supporters chorus im name. N﻿igeria presidential and National assemly elections go happun for 25 February , 2023 while govnorship and state assemblies election go take place across di kontri 11 March same year. N﻿a 18 presidential candidates wey Obi dey part of go contest for di highest political seat for di kontri.	https://www.bbc.com/pidgin/articles/clm8vkmyygpo
