politics	Nine steps to impeach a Nigerian President - Simple guide	Opposition members of Senate don give ultimatum to President Muhammadu Buhari to fix security threat across Nigeria within weeks or face impeachment. On Wednesday, di floor of di senate inside di parliament bin see drama afta di senators insist to pass motion to mandate Buhari to improve di situation. Dis one make opposition senators for different party lines, vex waka comot from sitting. Di senators bin dey shout  say “President Muhammadu Buhari must go”. Dem address press, issue  six weeks deadline to di president to begin im impeachment. But how di process dey actually work? BBC Pidgin consult Nigeria constitution and a constitutional lawyer to explain wetin e take - and why e fit be political risky. Constitutional lawyer Kennedy Osunwa na im tok about wetin di process to impeach a Nigeria president be. Oga Osunwa explain say no be now lawmakers suppose dey tok about impeachment. E say a lot of tins don happun for di kontri since president Muhammadu Buhari enter office and to tok about impeachment now dey some how as time no dey. Oga Osunwa further explain say according to di constitution, e dey possible to impeach president but two-third of di majority must agree say di president ghas go. Kennedy Osunwa say di process to impeach a president be long process. According to Section 143 of di 1999 Constitution of di Federal Republic of Nigeria as amended, here be di steps to impeach di President:  Step 1 There must be notice of any allegation for writing wey allege gross misconduct on di part of di President. Dis notice must dey signed by not less dan one-third of di members of di National Assembly (both di Senate and House of Representatives) and e go dey presented to di Senate President.  *Gross misconduct as di Constitution define am be ‘ grave violation or breach of di provisions of dis Constitution or  misconduct of dat kind nature as e amount for di opinion of di National Assembly to gross misconduct.’ Step 2 Di Senate President must within 7 days, serve di President and each member of di National Assembly wit one copy of di notice of allegation. Step 3 Di President get right of reply (e/she fit no reply), and any kind statement to reply to di allegation must dey served on each member of di National Assembly.  Step 4 Within 14 days of di presentation of di notice to di Senate President, each chamber of di National Assembly ghas resolve by motion without any debate whether or not dem suppose investigate di allegation. Dis motion need pass by at least two-thirds majority of all members of each chamber of di National Assembly.  Step 5 If di motion fails to reach di two-thirds majority, di process go immediately stop, and no further action go dey taken. However, if di two-thirds majority dey obtained and di motion dey passed, den di Senate President go within 7 days wey dem pass di motion, request di Chief Justice of Nigeria to appoint one Panel of seven persons wey for im opinion dey of unquestionable integrity to investigate di allegations. Di members of di Panel no fit be members of any public service, legislative house or political party.  Step 6 Di President wey dem dey investigate im conduct under dis section go get right to defend imself in person and dey represented before di Panel by legal practitioners of im own choice. Step 7 One Panel go dey appointed wey go; (a) Get dat kind power and exercise in function according wit di kind procedure as fit dey prescribed by di National Assembly; and (b) Within three months of dia appointment report dia findings to each House of di National Assembly.  Step 8 Where di Panel reports say di allegation never dey proven, there go be no further action. However, if di report be say di allegation against di President don dey proven, den di National Assembly go consider di report, and resolution for di adoption of di report go dey moved.  Step 9 For di resolution to dey adopted, e must dey supported by not less dan two-thirds majority of all di members of each House. Once e dey adopted, di President go stand removed from office as from di date of di adoption of di report. President Muhammadu Buhari don again express serious concern ova di current security challenges wey some parts of di kontri dey face. Di president say e no go stop at nothing to change di tide, according to Buhari National Security Adviser to di President, Babagana Monguno, President Buhari tok dis one when e call emergency meeting of di National Security Council on Thursday for Abuja. All security chiefs and di Inspector General of Police bin dey expected to attend di meeting inside di presidential palace, Abuja. Dis meeting na di third in one month for di kontri political capital wey dey under safety threat. Early July, attackers dem identify as extremist militants hit di Kuje prison inside Abuja, free hundreds of prisoners. Dozens of Boko Haram convicts dey among di escapees. And since then di city dey face almost a daily security concern. On Wednesday some members of di National Assembly give President Muhammadu Buhari six weeks deadline to handle di mata. Senators of di opposition party say make Buhari fix di problem, if not dem go begin impeachment alias remove am from office. By: Daniel Semeniworima, Kareemot Salami	https://www.bbc.com/pidgin/articles/cg65k9q5gxno
sports	Novak Djokovic beat Roger Federer to win back to back Wimbledon title	"Novak Djokovic beat Roger Federer to win back to back Wimbledon title. Djokovic wey be di defending champion gree die beat Federer 7-6 (7-5) 1-6 7-6 (7-4) 4-6 12-12 (7-3) for match wey last over four hours 57 minutes Dis victory mean say di Serbian player don win 16 Grand Slam titles now. Federer mistake wey im hit di ball high give Djokovic victory for di match. ""I go try to forget dis final, but na great match dat na wetin Federer tok afta di match. ""Di match long and i give am everything i bin get my chance and im too get im chance. i happy for my performance, But Novak congratulations, that was crazy. na wetin im add put. Djokovic wey now don win five Wimbledon title say  ""Roger na one of di greatest players of all-time, l dey respect well -well na  wetin Djokovic tok ""im dey  inspires me,."""	https://www.bbc.com/pidgin/sport-48983400
politics	Chris Ngige: Bola Tinubu, Hon Faleke vs Minister 'palava' -	"Chris Ngige, Honourable James Faleke and Asiwaju Bola Ahmed Tinubu drama wey happun on di floor of Nigeria House of Representatives still dey make pipo wonder why. Tori be say Ngige, Nigeria Minister of Labour and Productivity tell Faleke  wey dey represent Ikeja Federal constituency  say im dey on di same level wit Tinubu, di National leader of di All Progressives Congress. E happun say di lawmakers bin invite Ngige make im come tok wetin im know as dem dey torch light why di minister suspend di management of di Nigeria Social Insurance Trust Fund. Di minister accuse di management say dem embezzle 48 billion naira fund. As di House of Representatives Ad Hoc Committee on di Arbitrary Breach of Presidential Directive on di Suspension of Management and Executive Members of NSITF and oda goment Agencies by Ministers begin question am, oga Ngige tell di lawmakers say im senior all of dem. E change am for Faleke say both of dem no be age mate, say im dey di same level wit Faleke oga, Bola Tinubu. He say apart from say im and di former Lagos state govnor be age mate, dem get di same political achievements. Oga Ngige tok say ""Faleke dem say you don reach 60, sure you near my age, but I use at least seven years senior you. I dey di same age wit your mentor for Lagos, Aswaju. I be govnor di same time wit am. He be senator, I be senator too. I be minister for two times and im don do minister before"". Faleke reply, yab am say Tinubu win all im elections well and e no do wuruwuru. Di minister give am back sharperly say ""no problem, just like you win your own election for Kogi State very well. Na only you be deputy govnor and govnor of Kogi state."" Wen Faleke say make e respond to di questions di committee dey ask am, Ngige tok say I dey respond my friend, if you yab me, I go yab you ten times. ""I be Lagos boy, you na small boy for Lagos. See dis Mushin boy, he dey follow Victoria Island boy tok. See dis Mushin boy from Kogi"". Many pipo for social media don shook mouth for di mata and hope say e no go turn tribal war. On top why di lawmakers invite am, Ngige tok say di Nigeria Social Insurance Trust Fund management go get opportunity to clear themselves of di financial fraud wey dem dey accused of. Oga Ngige tok say im no go contrary to di presidential directive and dat di suspension follow procedure in line wit relevant authorities. Ngige also accuse di NSITF say dem fail to submit Annual Audited Accounts wey go epp prepare annual reports for Mr President."	https://www.bbc.com/pidgin/tori-53511008
entertainment	BBNaija update: Liquorose cry, Maria tackle Pere, Angel and Yousef plus oda drama wey happun afta Saturday night party	"Di Saturday night party na one of di main part of di Big Brother Naija [BBNaija] show wey Housemates and audiences dey always look forward to. Di second Saturday night party for di 'Shine Ya Eye' 2021 edition see how most of di Housemates high from plenty alcohol. Saskay, Cross, Liquorose, Angel, JayPaul, Maria, Beatrice, Boma and Princess no fit hide dia highness. Liquorose breakdown in tears afta di party as fellow Housemates Tega and Jackie B try to console her inside toilet wia she dey cry. ""I just dey emotional because I miss my dad. I go make you proud daddy, I promise you. Don't worry I'm fine. Na just say I dey in my feelings tonight,"" Liquorose tell di housemates. 29 year old Maria and Pere na two housemates wey audiences dey monitor dia attitude toward dem sef for di House as dem dey look say something fit develop between dem. Earlier dis week, na gbas gbos between di two wen Maria ""serve"" Pere breakfast wia she tell am say she no like di ex-US Marine. But di gbas gbos continue afta di Saturday night party wen Pere tell Maria say im no want anything wit her inside Big Brother house. Dis na afta Maria confront am about im attitude for di party and why Pere ignore her afta di party. ""Why you dey give me a attitude, you want make we make out for national TV or to tell you say I Love You on a national TV? What do you want from me? Not even friendship?"" Maria ask Pere wey say im no want anything. Afta di Saturday might party, one of di housemates Princess say she for no like sleep alone. ""I no go get cute guys for dis house make I come dey sleep alone,"" Princess play-play tok her mind. From di beginning of di party, till e end, Saga hold tight to Nini - even as di party close we see di housemates wey be like say dem wan start relationship for di Big Brother house dey get along well. Also, e remain small make Boma no sleep for im Head of House room. Na Peace di head of house e hold tight and dey wit afta di Saturday night party before Jackie B carry am go di HoH room to sleep. Today na eviction night and one between Yerins, Beatrice, Whitemoney, Yousef and Niyi wey dey u for eviction go-go house today."	https://www.bbc.com/pidgin/tori-58132126
politics	Ghana voter registration exercise: Ahead of Presidential and parliamentary elections, more than 15 million Ghanaians register to vote in December	More than half of Ghana total population don register to vote for 2020 presidential election. Na 15 million voters for Ghana register dema names in de ongoing voter registration exercise which end Thursday 6 August. After 31 days of de registration exercise, electoral commission capture 15,117,438 people on de new voters register. Dis be de gender distribution as at phase 4 of se registration process where dem capture 11,629,480 Ghanaians. Out of dis total figure gender distribution be 5,528,970 males which dey represent 47.54 percent and 6,100,510 be females which dey represent 52.46 percent. Before Ghana Electoral Commission go start dis registration exercise, some people speculate say sometimes de EC no go fit record high turn out during de registration, but dis current figures dey prove otherwise. Deputy Chair of Ghana Electoral Commission, Dr. Bossman Asare talk say de current figures wey dem capture dey exceed de EC en target of 15 million voters. De current figure of 15 million go fit go up small by close of mop-up exercise where dem go finish de exercise for weekend. Despite say de exercise go end Thursday Ghana Electoral Commission say dem dey set aside two days for mop-up. De mop up exercise go happen on Saturday 8th August and Sunday 9th August 2020. Next Phase of activities before elections Regional breakdown Out of de number of persons registered so far, Greater Accra Region capture 3,225,508 voters, dis be de region with de highest number. Followed by Ashanti region who record 2,700,805 voters and Eastern region who dey third plus total of 1,444,274 voters. From de data wey EC supply, so far, de number of people wey chop 18 years on de register be 480,851. Voters wey chop 19 years be 419,530 and voters wey chop 20 years and above be 10,729,099. After dis registration process, Electoral Commission go exhibition of de register by September 1, 2020. Exhibition exercise go help make people check if dem capture dema names for de register which EC go take conduct de 2020 elections. Around October 15, Electoral Commission of Ghana go allow voters who want transfer dema votes to specific areas apart from where dem register. Dis transfer of votes go help make people vote for places wey dem go fit visit on December 7. After EC finish de next phase of processes, dem go now open polling stations across de country for voter to choose de Presidential and Parliamentary candidates dem go like lead dem.	https://www.bbc.com/pidgin/tori-53690208
politics	Ministerial list: President Buhari say im no go allow anybodi to pressure am to release any list	"Nigerian President Muhammadu Buhari tok at say even though Nigerians dey put pressure on am to release ministerial list, na those wey im know personally na im e go appoint. Presido tok dis one for one ogbonge meeting wit di leadership of di National Assembly for state house on Thursday night. Buhari say for im first term, all di ministers wey im work wit, im no know any of dem sake of say na di party and some individuals choose dem for am. "" I go take my time for dis second term to search for those wey I know personally to work wit."" ""Even though some pipo for dis dinner meeting wan see di ministerial list so dat dem go go dey leave in peace, I no go allow anybody dis time around to pressure me to release any list."" im explain Although President Buhari agree say im dey under pressure because of di list,e say im go take im time to search wella. President Muhammadu Buhari bin take oath of office for May 29 2019 but since den, e neva appoint im ministers dem. Nigerians bin don di expect di ministerial list afta di  Senate President, Ahmad Lawan bin announce say di list go come out before dis week finish. But for dinner party, oga Lawan deny say im no tok like dat and dat afta senator Bassey Akpan from Akwa Ibom raise di point of order on di need for goment to release di ministerial list before dem go on break, im come assure dem say di list fit even comot dis week. E claim say im no give direct info on top di mata. Meanwhile afta di meeting, di presidency release statement to thank di leadership of di National Assembly and on top how dem di conduct demselves so far."	https://www.bbc.com/pidgin/tori-48953706
business	Nigeria don jail 15 oil tiffs, two collect two years self-contain inside prison	"Nigeria corruption police - EFCC don send two oil tiffs to go take self-contain inside prison for two years. Na 15 of dem wey Economic and Financial Crimes Commission (EFCC) cari go Federal High Court Port Harcourt court for illegal Oil Bukering for Rivers State, Southern Nigeria. While Justice A. T Mohammed sentence two of dem wit option of fine, di oda 13 chop fines of one hundred thousand naira. According to EFCC all of di convicts trouble wen Nigerian Army, 6 Division, Port Harcourt sojas catch dem sometimes in 2018 and 2019 for different locations inside Port Harcourt, Rivers State as dem dey distribute Automotive Gas Oil (AGO) using Trucks, Tankers, Escavator wit registration numbers YLA 112 ZV; YLA 110 ZV; MGN 22 XA; KPR 23 XA; LFA 403 XA, KPR 24 XA; BNY 490 XA; KPR 345 XA; MUB 807 XA; BGM 229 XA; YEN 423 XA; BKR 395 XA; KWL 60 ZA and an Escavator 320 CL CAT witout goment licences. Na on Tuesday, July 30, 2019 wey EFCC, Port Harcourt Zonal office cari dem go court, on one-count separate charge wey concern illegal dealing in petroleum products, wey dey againt Section 4(1) of di Petroleum Act, Cap P10 Laws of di Federation of Nigeria (LFN) 2004 and wey get punishment under Section 4(6) of di same Act. According to di charge wey EFCC publish,  e say; ""Mohammed Abba, Adamu Usman and Babangida Audu on or about June, 2018, inside Port Harcourt, Rivers State bin distribute petroleum product (Automotive Gas Oil) withMack Truck wit registration number YLA 112 ZV, witout Licence and so dem commit offence wey dey against Section 4(1) of di Petroleum Act, Cap P10 Laws of di Federation of Nigeria (LFN) 2004 and wey get punishment under Section 4(6) of di same Act."" Justice Mohammed convict and sentenc Mohammed Abba, Adamu Usman  to two years imprisonment with an option of fine of N100, 000 (One Hundred Thousand Naira) each, while the rest 13 (thirteen) defendants chop jail fine of One Hundred Thousand Naira (100,000.00) each. Dem include: Babangida Audu; Chijioke Ali; Muhammad Jamilu; Umaru Hussaini; Ahmadu Adamu; Muhammed Muhammed; Mahmud Girei; Abubakar Mai Nasara; Sadiq Ismaila; Sama'ila Njidda; Mahmud Abdullahi, Chima Onuha and Ismaila Balarebe. Di Judge also order say di petroleum products wey dem catch dem wit na Federal Goment go collect am. Oil bunkering wey be illegal refining and selling of petroleum products dey happun well well for Rivers State, Nigeria. Rivers State dey inside di Niger Delta region whre crude oil wey dey kontri dey use make money, boku well well. Most of di pipo wey dey do di oil bunkry dey do as hustle but e dey against Nigerian laws to do am witout license, na dis one follow for some of di environment pollution for di region."	https://www.bbc.com/pidgin/tori-49189065
health	Coronavirus: Akufo-Addo release $100 million dollars for Ghana Covid-19 disease response plan	"Ghana step up preparations and response plan to deal with coronavirus plus $100 million dollar financial commitment. Prez Akufo-Addo announce Wednesday night inside national address say he direct en finance minister make he release dis fund. Dis monies go ""expand infrastructure, buy materials and equipment, and public education"" Akufo-Addo explain. During de address Ghanaian leader also urge nationals make dem shun dey foreign travels for now. ""All of us for shun foreign travels, except de most critical ones until de virus matter finish"" President Akufo-Addo talk. Dis proposal to citizens dey come on de back of a temporary ban wey de Prez impose on public officials this week against all foreign travels. Ghana raise de preparation and response plan to coronavirus after all three neighboring countries, Togo, Burkina Faso and Benin record cases. Prez Akufo-Addo add say once World Health Organization (WHO) announce day de virus turn ""pandemic"" den e mean say as a nation dem for step up preparation. Ghana Health Ministry already set up 100-bed capacity facility inside one remote area to quarantine suspected cases plus some 5000 PPE kits. Some Ghanaians talk say dem no sure if de country make ready sake of health infrastructure be poor. But with dis monies, health officials leading de fight fit boost de country en preparedness and response plan against de pandemic."	https://www.bbc.com/pidgin/tori-51848582
entertainment	Framing Britney Spears: Wetin her documentary reveal as she dey fight for freedom	"Britney Spears don start to dey trend again for social media afta her documentary wey she do with The New York Times wey dem call Framing Britney Spears. Dis documentary really show wetin cause her public breakdown for 2007 wey cause am to shave her hair and also bash one car with umbrella. E also enta di mata of di media bin treat her as per paparazzi, and also di mata of her conservatorship. Na for November last year, she lose legal battle to comot her papa as conservator afta 12 years wey im don dey run her life. Britney Spears start her career for di Disney Channel show, Mickey Mouse club at di age of 11 wey she bin do with Christiana Aguilera , Justin Timberlake and Ryan Gosling. Afta di show tori be say she comot from Hollywood to go attend High school for Loiusiana. She tok for di interview say she bin pla basketball for school. Afta dat one, she comot with hit single, One More time and di documentary tok say she bin start to dey promote di song for inside shopping malls dem. She go on to release nine studio albums and one Las Vegas residency wey dem say dey super successful despite her public breakdown, relationship breakup and court order wey say make anoda pesin dey in control of her life (conservator) on top say she dey ""incompetent"". At di beginning of Britney Spears career for 1999, na im she start to dey date fellow Mickey Mouse star Justin Timberlake. Di relationship pack up for 2002 and na dat time according to di documentary one Maryland first lady bin tok fsay she go fit shoot Britney Spears on top tori say she cheat on JT. Di mata according to di documentary no reduce, when for di video of ""Cry Me A River"", JT cast pesin wey resemble Britney to spread di message. Even use am brag for interview say im bin knack di singer. Kim Kaiman, di senior director of marketing for Jive Records during Britney's rise tok say im no too see di papa, Jamie Spears wen she bin dey blow for di beginning. She say, di only tin di papa bin follow am tok na say, ""My daughter go rich sotay she go buy me boat."" Dem tok for di documentary say her parents bin spend evritin she bin get to boost dia pikin career. Bu while Lynne di mama bin dey enta New York every once in a while to make sure sa Britney blow, her papa no too show face. However e come back for 2007/08 wen tori be say Spears bin get mental kasala to take ova her life as conservator. Di documentary how how di podcast Britney's Gram bin make di hashtag #FreeBritney afta tori bin land say dem cari Britney lock for inside mental health facility afta she cancel her second Vegas residency. Di documentary tok say her brother Bryan bin even comot to tok she always bin wan comot from di conservatorship. One lawyer Adam Streisand wey tok say Spears bin want am to represent her for di first conservatorship hearing tok say she bin want pesin wey dey independent and professional to dey in charge of am and her estate. Im say she bin yell am  ""I no want my papa to be my conservator."" One of di lawyers wey bin dey Jamie Spears team for di 2020 case to keep am as conservator, Vivian Thoreen tok say e dey rare to see conservative wey don successfully comot conservator ship. Na for November 2020, she lose legal battle to comot her papa as conservator afta 12 years wey im don dey run her life. Di documentary reveal say wetin cause di 2007 breakdown wey make di musician cut her hair and bash paparazzi car bin come tey-tey. Dis mata follow her divorce from Kevin Federline wey she lose custody of her two pikin even though she bin get frequent visits with dem. According to di documentary, how paparazzi bin dey treat he before dat time in make am scared to even come outside even as dem bin label am say she be bad mama. Di documentary reveal say pictures of am during dis period bin dey go for one million dollars wacth. And one of di paparazzi even confess for di documentary say she bin dey playful for di beginning of her career and bin dey follow chat with dem but na so her relationship with dem grow worse as time continue."	https://www.bbc.com/pidgin/tori-56013742
