business	Abin da 'yan Najeriya ke cewa kan  matakin CBN na taƙaita yawan kuɗin da za a iya cirewa kullum	"'Yan Najeriya na ci gaba da bayyana ra'ayoyinsu game da sabon matakin da babban bankin ƙasar CBN ya ɗauka na taƙaita yawan kuɗin da za a iya cirewa daga asusun ajiyarsu na banki. A ranar Talata ne dai babban bankin Najeriya CBN ya fitar da sababbin dokoki na hada-hadar kuɗaɗe a bankunan ƙasar. A cikin sabbin dokokin, CBN ya ce daga ranar tara ga watan gobe yawan kuɗin da mutum ɗaya zai iya fitarwa a banki a sati shi ne naira 100,000 yayin da kamfani zai cire naira 500,000 ne kawai a sati. Haka kuma CBN ɗin ya ce yawan kuɗin da mutum zai iya cirewa ta hanyar amfani da na'urar cirar kuɗi ta ATM a sati shi ne naira 100,000, wato yawan abin da za a cire a rana naira 20,000 ne kacal a na'uran ATM da kuma wajen masu amfani da POS. Tun bayan fitar da sabbin dokokin 'yan ƙasar ke tofa albarkacin bakinsu, a yayin da wasu ke sukar matakin wasu kuma cewa suka yi suna maraba da matakin. Haka kuma tun bayan da muka wallafa labarin a shafinmu na Facebook ranar Talata da yamma, zuwa ranar Laraba da safe mutum 26,000 ne suka so labarin, sannan kusan mutum dubu bakwai ne suka yi tsokaci game da labarin inda aka raba shi fiye da sau 1,000. Ga ra'ayoyin wasu daga cikin masu bibiyar shafin namu: A yayin da wasu ke sukar wannan mataki, a gefe guda kuma wasu maraba suke yi da sabon matakin da CBN ɗin ya ɗauka. Wasu mutanen kuma da wannan sabon mataki zai shafa su ne masu sana'ar cire kuɗi ta na'urar POS, waɗanda a cewarsu ke sauƙaƙa wa mutane shafe dogayen layuka a na'urar cirar kuɗi ta ATM. Abdulganiyyu Muhummad wani mai sana'ar POS ne a ƙasar ya kuma shaida wa BBC cewa haƙiƙa wannnan mataki zai shafi duka masu sana'ar tasu. ''Akwai mai zuwa ya cire 200,000, ko 300,000 ko ma 500,000 a lokaci guda, kuma a kowacce 100,000 akan ba mu naira 500, to ka ga idan a ka ce a rana iya 20,000 kawai mutum zai cire to ka ga abin da zai ba mu bai fi 200 ba, to ka ga ai ya shafe mu sosai,""  in ji Abdulganiyyu. Ya ƙara da cewa ba iya su kaɗai abin zai shafa ba har bankunan da suke hulɗa da su, da manyan 'yan kasuwa masu zuwa cire kuɗi masu yawa domin sarin kaya su ma abin zai shafe su. Suma masana na ci gaba da tsokaci kan wannan batu, Farfesa Kabiru Isa Dandago wani masanin tattalin arziki ne a Najeriyar ya kuma shaida wa BBC cewa adadin ya yi kaɗan. ''Wannan tsari ne wanda ba shi da wani muhimmanci ga rayuwar al'umma, abu ne da za a takurawa mutane da dama wajen hada-hadarsu ta cinikayya'' ''Na biyu kuma mutanen da suke da bankuna mutane ne da ke zaune a birane mutanen karkara ba su ma san menene ke guda na ba'', in ji ji. Farfesan ya ƙara da cewa duk da cewa matakin na da fa'ida ta rage yawan hada-hadar da takarkar kuɗi a hannu, tare da komawa amfani da hada-hadar kuɗi ta banki. To amma ya ce mutanen da suke da dama hada-hadar banki a ƙasar ba su kai yawan da ake buƙata ba. ''In dai kuɗi bai zo hannun mutane ba to hada-hada ma ba za ta yi wa ba, yayin da kuwa aka tsaurara, to su waɗanda suke da halin da ke sa ran za su riƙa bayar da gudunmowa ga waɗanda ke ƙasa-ƙasa marasa ƙarfin tattalin arziki, sai ka ga ƙuncin ya daɗa yi wa mutane yawa''. A wani jawabi da shugaban ƙasar Muhammadu Buhari ya yi a lokacin ƙaddamar da sabbin takardun kuɗin ƙasar ranar 23 ga watan Nuwamba ya ce sababbin takardun kuɗin za su taimaka wa Najeriya ta wajen warware matsaloli da dama da suke addabar ƙasar."	https://www.bbc.com/hausa/articles/c99gx0y8pv2o
technology	Trump ya haramta wa Amurkawa amfani da Alipay da wasu manhajojin China bakwai	"Shugaba Donald Trump ya sanya hannu kan wata dokar shugaban kasa da za ta haramtawa Amurkawa amfani da wasu manhajojin China takwas, manhajojin sun hada da Alipay, wadda ake amfani da ita wajen biyan kudade ta intanet a China da kasashe masu yawa. Akwai kuma QQ Wallet da WeChat Pay. Wannan dokar wadda za ta fara aiki nan da kwana 45, na cewa an haramta amfani da manhajojin ne saboda suna barazana ga tsaron Amurka. Ta kuma ce ana iya amfani da manhajojin wajen naɗan bayanai kan Amurkawa musamman ma'aikatan gwamnatin tarayya. Tencent QQ, CamScanner, SHAREit, VMate da WPS Office na cikin manhajojin da aka haramta amfani da su a Amurka, amma a lokacin Mista Trump ya riga ya bar aiki. ""Tilas ne Amurka ta rika daukan matakai cikin sauri kan wadanda ke hadawa ko ke sarrafa manhajojin kasar China domin mu kare tsaron kasar mu,"" inji bayanin da dokar ta kunsa. A baya shugaba Trump ya sanya hannu kan dokokin shugaban kasa irin wadannan kan kamfanoni ko kayayyakin China, inda yake cewa suna iya aikawa da bayanan sirrri ga gwamnatin China. A watan Agusta, Amurka ta ba kamfanin ByteDance, wanda ya mallaki manhajar nana mai farin jini ta TikTok cews ko dai ya sayar wa Amurka bangaren kamfanin da ke Amurka ko kuma ya bar kasar gaba daya. Amma duk da cewa kamfanin bai cika ko da daya daga ciin sharuddan da aka gindaya ma sa ba, har yanzu Amurkar ba ta dauki wani matak kan kamfanin ba."	https://www.bbc.com/hausa/labarai-55555188
politics	Gane Mini Hanya tare da Gwamnan Filato Simon Lalong	Latsa hoton sama don sauraron shirin:	https://www.bbc.com/hausa/shirye-shirye-na-musamman-61771129
politics	Bauchi: Na fi ƙarfin Yakubu Dogara – Ƙauran Bauchi	"Gwamnan jihar Bauchi ya mai da martani ga Yakubu Dogara cewa idan ɗan siyasa zai sauya sheƙa ""bisa wani hasashen samun muƙami, to bai kamata ya yi ƙarya ba, bai kamata ya kawo husuma ba"". Sanata Bala Mohammed dai ya bayyana fitar tsohon shugaban majalisar wakilan daga jam'iyyarsu ta PDP zuwa tsohuwar jam'iyyarsa ta APC a matsayin wata asara kuma abin takaici. Yayin zantawarsa da BBC a karon farko tun bayan sauyin sheƙar Yakubu Dogara, gwamnan ya ce ana hasashen Dogara ya fita ne don neman wani muƙami don haka ""ina yi masa fatan alheri"". Ranar 24 ga watan Yuli ne, aka sanar da komawar tsohon shugaban majalisar zuwa jam'iyya mai mulki, daga bisani kuma ya dangantaka sauyin sheƙar da rashin shugabanci nagari a jiharsa ta Bauchi. Sai dai Gwamna Bala Mohammed ya bayyana takaicin cewa bai kamata ɓatanci ya zama hanyar ban kwana kafin barin babbar jam'iyyar adawar ta Najeriya ba. ""Shi yana ganin, shi ya mana alheri muka zama gwamna. Mu kuma muna ganin mu muka taimaka masa shi ma ya zama. Amma shi fa Allah, shi ke ba da mulki,"" in ji Ƙauran Bauchi. Ya ce bai dogara da Dogara kafin zamansa gwamna ko sanata a jiharsu ta Bauchi ba. A cewarsa asara ne matasan 'yan siyasa kamar Dogara su riga biyewa son zuciya ""saboda yaudara da ƙarya da kuma ruɗi"". Shi dai Yakubu Dogara ya ce ba gaskiya ba ne zargin da wasu ke yi cewa ya sauya sheka ne saboda burin neman wata dama a jam'iyyar APC. Saɓanin haka a cewarsa, ya fita ne saboda matsalolin da suka haɗar da ba da kwangiloli ba bisa ka'ida da Gwamna Bala Mohammed yake yi da kuma rashin biyan ma'aikata albashi a kan lokaci. Ya kuma koka a kan rashin gudanar da zaɓukan ƙananan hukumomi cikin wata shida na farko, kamar yadda Bala Mohammed ya yi alkawari. Ya kuma yi zargin cewa: ''Gwamnati ta ciyo bashi na naira biliyan hudu, daga baya aka gano kudin a asusun wani kamfani, duk da yake an ranto su ne da sunan jihar Bauchi, baya ga ninka kudin kwangiloli da ake yi"". Sai dai gwamnan ya musanta rashin bin ƙa'ida wajen bayar da kwangiloli. Ya ce gwamnatinsa ce ma ta kawo dokar ba da kwangiloli da kuma rage kuɗaɗen aiwatar da ayyukan raya ƙasa. Ya ce: ""Na zo na samu, aikin da za a yi shi a biliyan bakwai, ana yin sa a biliyan goma. Misali hanyar nan da ta taso daga Awala zuwa Meri"". A cewarsa gwamnatiin da suka gada ta ba da kwangilar ce a kan sama da naira biliyan goma, amma gwamnatinsa ta cimma yarjejeniya da 'yan kwangilar waɗanda ya ce su da kansu sun yarda an tsuga kuɗi. Bala Mohammed ya ce duk kwangilolin da suka bayar, sukan ba da su ne bisa ƙayyadajjen tsarin da ake amfani da shi ne a ko'ina cikin faɗin duniya. Ya ce fitar Yakubu Dogara daga PDP ba ta rasa nasaba da batun masu iya magana da ke cewa ""In ka ga kare yana gudu, ko ana bin sa ne, ko kuma shi yana bin wani abu ne ya kama"". A matsayinsa na babban ɗan siyasa wanda ya riƙe muƙamin shugaban majalisar wakilai kuma mutum na huɗu a Najeriya. Yana ma iya zama ko shugaban ƙasa ko wani abu daban ma, cewar Bala Mohammed. Sai dai ya ce duk da yake rabuwa da Dogara asara ce gare su amma hakan ba zai zame musu giɓi ba ko illa ba, don kuwa a cewarsa suna tare da al'umma."	https://www.bbc.com/hausa/labarai-53625849
health	Shin ko cutar Asthma na gurbata muhalli?	"Mutane da yawa da ke fama da cutar Asthma na iya rage fitar da iskar Carbon dioxide don taimaka wa muhalli ta hanyar sauya magungunansu zuwa wadanda ba sa gurbata muhalli, in ji wasu masu bincike a Birtaniya. Sauyawar za ta yi tasiri sosai ga muhalli. Ba don komai ba, sai don abin shaka na masu Asthma na fitar da iska da ke janyo dumamar yanayi. Amma tawagar ta Jami'ar Cambridge ta ce dole ne masu lalurar su tuntubi likitocinsu kafin su sauya magungunan. Sama da mutane miliyan biyar ne su ke da cutar Asthma a Birtaniya. Binciken ya duba tasirin da abin shakar yake yi a kan muhalli a Ingila. A shekarar 2017, likitoci sun rubuta wa masu cutar abin shaka miliyan 50. Bakwai cikin 10 da na abin shakar da aka bai wa marasa lafiyan, masu fitar da gurbatacciyar iska ce. Ana amfani da iskar- mai suna Hydrofluoroalkane- wajen hankado iska daga cikin abin shakar. Masu binciken sun yi kiyasin cewa abin shaka daya wanda ba ya bata muhalli zai rage yawan iskar Carbon dioxide da kiloton 58. Wato kusan iskar Carbon da motoci 180,000 za su fitar idan suka je birnin Edinburgh daga Landan sannan su koma, a cewarsu. Idan aka sauya Inhaler daya mai gurbata muhalli da marar gurbatawa, za a rage kusan kilogram 150 zuwa kilogram 400 a shekara. Mutanen da ke da bukatar ci gaba da amfani da abin shakar mai fitar da gurbatacciyar iska na iya ci gaba da amfani da shi, in ji kwararru. Sauyawa zuwa marar gurbata muhalli na iya jawo matsaloli ga masu cutar Asthma, saboda akwai abubuwan da yana da wasu sabbin abubuwa don haka dole a nemi taimakon likita ko malaman jinya. Ga masu cutar da ba za su iya sauyawa ba, likitoci sun ce akwai wasu hanyoyi masu gyara muhalli da za a iya bi. Shugabar kungiyar Asthma ta Birtaniya Jessica Kirby, ta bayar da shawarar cewa: ""Yana da matukar muhimmanci ku ci gaba da abin shakarku yadda likita ya ce. ""Idan kuna da damuwa kan tasirinsa ga muhalli, ku yi magana da likitanku ko malaman jinya idan kun je asibiti, don ganin ko akwai wani abin shakar da za ku iya amfani da shi."" Shugaban NHS, Simon Stevens ya ce: Hukumar Lafiya ta riga ta rage yawan iskar gas din da take fitarwa da kusan kashi daya cikin biyar a shekaru goma da suka gabata. Kuma sauyawa daga abin shaka masu gurbata muhalli zuwa wanda ba sa yi na cikin tsare-tsarenmu na dogon zango kuma zai taimaka wa doron kasa da mutanen da ke cikinta."	https://www.bbc.com/hausa/labarai-50232370
business	Shagunan kasuwancin da ba sa bari mutane su manta da ƙasashensu na asali	"A shagon da danginta ke lura da shi mai suna Popat Mithai & Farsan, Popat da 'yan uwanta kan shafe lokaci suna hulɗa da kwastomomi a harsuna daban-daban har ma ba sa samun lokacin da za su zauna su huta, balle ma hira da 'yan jarida. Mrs Popat ta kafa kasuwancin ne a Leicester, Birtaniya a 2011 don sayar da alawowi da kayan maƙulashe na Indiyawa kuma ya haɓaka daga ma'aikata biyu zuwa 15.  Sun ƙaddamar da shafin sayayya ta intanet a 2018. Hadahada ta hauhawa a lokacin annobar korona daidai lokacin da kwastomomi ke neman abinci mai sauƙi - nau'in wanda suke kawowa daga ƙasashen Indiya da Pakistan da Bangladesh da Sri Lanka. Ɗan Popat mai suna Shyam ne ya yi magana da BBC a madadin tawagar. ""Mahaifiyata ta shahara a wannan unguwar a matsayin 'yar kasuwa,"" in ji shi. ""Kuma kowa na son ya yi magana da ita saboda ta samo masa wani nau'i na kaya."" Ya ƙara da cewa ba iya waɗanda suka je Birtaniya tsawon lokaci ba ne ko kuma waɗanda ba su daɗe da zuwa ba kwastomomin nasu. ""A lokacin dokar kulle, shafinmu na intanet ya ceci rayuwar mutane da dama, yanzu kuma da muka fita daga dokar ya zama babban kasuwanci a kan kansa,"" in ji Shyam Popat. ""Yanzu cinikin da ake yi ta intanet ya kai kusan kashi 1 ko 2 cikin huɗu na ribar da ake samu."" Baya ga kayayyakin da suke kaiwa daga Kudancin Asiya, suna sayo kaya daga Kenya. A baya-bayan nan, gwamnatoci na sane da cewa gudunmawar da mazauna ƙasashen ƙetare ke bai wa tattalin arzikin ƙasashensu na asali, wanda da wuya a iya kwatanta shi. Yanzu haka akwai mutum aƙalla miliyan 281 da ke cirani a ƙasashen da ba nasu na asali ba, a cewar rahoton Cirani na Duniya na 2022 da Majalisar Ɗinkin Duniya ta fitar ta hannun sashen International Organization for Migration (IOM). Wannan adadi ya kai kashi 3.6 cikin 100 na yawan al'ummar duniya, ko kuma 1 cikin duk mutum 30. Babu 'ya'yan waɗannan mutane a cikin lissafin ko kuma 'yan uwan 'yan ciranin. Wani abu da ya tabbata shi ne cewa ƙarfin niyyar 'yan cirani wajen yin kasuwanci a fili yake. Wani rahoto da cibiyar Organisation for Economic Co-operation and Development ta fitar a 2010 ya ce 'yan kasuwa 'yan cirani sun fi ilimi sama da tsaransu 'yan ƙasa, kuma sun fi samun yiwuwar kafa sabon kasuwanci. \nShagon Vijaya Popat da ire-irensa na taka rawa wajen haɓaka darajar kayan da Indiyawa ke shigarwa Birtaniya zuwa dala biliyan 10.4 a shekarar da ta gabata. Shi ma Olivier Habiyambere da ke zaune  abirnin Paris na taimakawa wajen fitar da kayayyakin Kenya zuwa Turai. Shi ne ya kafa dandalin Kenyan Diaspora Market da ke safarar abinci da tufafi daga ƙasar sannan kuma ya sayar wa kwastoma a Turai. Mr Habiyambere da ya tashi a Kenya, ya yi tunanin kafa kasuwancin ne lokacin da ya koma birnin Paris don ya yi karatu inda kuma ya haɗu sauran 'yan Kenya. ""Kowa na rububin kayan Kenya, amma matsalar ita ce yadda za a kai kayan zuwa nan daga Kenya,"" a cewarsa. ""Mutane za su iya samun kayan idan suka je Kenya amma matsalar ba duk shekara suke zuwa ba."" Saboda haka ne ya kafa kasuwancin a watan Afrilun 2022 don samar wa Kenya mazauna Turai hanya mai sauƙi wajen sayen kayayyaki daga gida. Mista Habiyambere ya ce kasuwancin nasa ya girma saboda taimakon da yake samu daga 'yan Kenya bayan an ba su labari a zaurukan dandalin zumunta na WhatsApp. Duk da cewa 'yan Kenya na mayar da hankali kan kayan ƙasarsu, shagon Agora Greek Delicacies da ake birnin Glasgow na da kwastomomi daga wasu sauran sassa fiye da 'yan ƙasar Girka. Wasu ma'aurata ne suka kafa shi kusan shekara 10 da suka wuce. Christina Lyropoulou da mijinta Michael Sofianos sun je karatun jami'a ne a Birtaniya. Yanzu suna da ma'aikata 14 kuma suna shigar da abincin Girka a wuraren cin abinci. ""Mun fara faɗaɗa harkar a Birtaniya da kuma matafiya zuwa Girka ko masu abokai a Girka,"" in ji Ms Lyropoulou. ""Cinikin da shagonmu ya samu ya ninka a watan farko da aka saka dokar kulle."""	https://www.bbc.com/hausa/articles/cz9394q307do
sports	Guardiola ya ce Newcastle za ta iya lashe Premier a bana	Pep Guardiola ya ce Newcastle tana daga cikin kungiyoyi shida wadanda za su iya lashe Premier League a bana. M﻿anchester City, wadda take mataki na biyu a teburin bana da Arsenal ke jan ragama, tana fatan lashe Premier na uku a jere. C﻿ity na kan turbar kafa tarihin lashe babbar gasar tamaula ta Ingila uku a jere, bayan Arsenal da Huddersfield da Liverpool da kuma Manchester United. R﻿anar Asabar City za ta karbi bakuncin Fulham a wasan mako na 15, idan ta yi nasara za ta koma mataki na daya a kan teburi, kafin sakamakon wasan Arsenal. T﻿sohon kociyan Barcelona da Bayern Munich ya ce ya hangi wadanda za su iya daukar Premier a bana har da Liverpool a ciki, wadda keda tazarar maki 13 tsakaninta da City da Newcastle. N﻿ewcastle tana mataki na hudu a kan teburi kasa da shekara daya da attajiran da Saudi Arabia ke marawa baya suka sayi kungiyar. K﻿ungiyar na taka rawar gani a kakar nan karkashin Eddie Howe, wadda ke buga kwallo mai ban sha'awa, sannan tana cin wasa da zura kwallaye da yawa. E﻿ddie Howe mai maki 24 a mataki na hudu ya ci wasa shida da canjaras shida da rashin nasara daya shi ne da Liverpool. N﻿ewcastle ta tashi 3-3 a wasan mako na uku a gasar Premier League ranar 21 ga watan Agusta, inda da kyar Guardiola ya kwaci kansa a hannun Eddie Howe. '﻿'Newcastle tana da gogaggen koci da matasan 'yan wasa,'' in ji Guardiola, ''Ina jin za su dade a matakin da suke a yanzu, saboda rawar da suke takawa. '﻿Ba sa buga gasar Zakarun Turai, saboda haka hankalinsu ya karkata kan Premier League, ba wani abin da ya dauke musu hankali.'' G﻿uardiola ya ce Arsenal ce ''ta farko'' da za ta iya lashe kofin bana sai ya kira Chelsea da Tottenham da Manchester United da kuma Newcastle United. Duk da cin United da City ta yi bana, Guardiola na hangen kungiyar Old Trafford tana da dama tare da Tottenham, wadda ba su kara ba a tsakaninsu a kakar nan.	https://www.bbc.com/hausa/articles/cpr78z0j480o
entertainment	An fara caccakar hukumar tace fina-finai kan Adam Zango	"Matakin da hukumar tace fina-finai ta jihar Kano ta ce za ta dauka a kan Zango, ya sa wasu daga cikin 'yan fim ba su ji dadi ba, Falalu Dorayi kuma na daga cikinsu. Falalu Dorayi, mai shirya fim da bayar da umarni ne, sannan kuma ya kan fito a matsayin jarumi a wasu lokutan a cikin fina-finan hausa na Kannywood. Falalu na daga cikin makusantan Adam Zango a Kannywood. Ya kuma wallafa a cikin shafinsa na Instagram cewa:"" Idan har hukuma za ta ba wa film satifiket a nuna shi a cinema, duk da akwai jarumai marasa rijista da hukumar a shirin, babu hujjar hana jaruman cikin film din zuwa su gana da magoya bayansu. ""Idan akwai hujjar, za ta fara ne daga lokacin da film din ya zo hannun hukumar, sai su hana satifiket su ce wane ba shi da rijista da mu"". Falalu ya ci gaba da cewa, ""abin da mamaki, na san jarumai da mawaka da dama da ba su da lasisin hukumar suna halartar wurin nuna fim a Filmhouse, wani fim din su ne a ciki, wani kuma kallo kawai suka je. ""Ba a taba yunkurin kama su ba, sai rana tsaka a ce an hana wani saboda ba shi da lasisin hukuma"". Daraktan fina-finan ya ce ""Adalci shi ne a yi hukunci na bai daya babu nuna fifiko, mene ne bambancin sa da Dija? ""Ba a kano take ba, ba a Kano yake ba, idan har za a bar ta ta zo me zai hana Zango zuwa? ""Ba na jin Dija na da lasisin hukumar, haka kuma idan za a bar wadancan jarumai da mawaka marasa lasisin hukuma su zo kallo, me yasa aka hana Zango?,"" a cewar jarumin. Kungiya ra'ayi ce, idan kaga abin da kungiya take baya gamsar da kai, kana da ikon fita, kuma ba a kan Zango aka fara fita daga kungiya ba, Adam A. Zango ya sanar ya fita daga kungiya, amma ba shi ne yake nuna ya daina zamunci da Kano ba. ""Me yasa hukuma take kokarin mayar da abin ya zama hada husuma? Ni dai ban taba ji Zango ya zagi ko cin zarafin Kano ba, kar mu yi amfani da siyasa mu jefi 'yan uwanmu da sharri."" Jagora nagari ana so niyyarsa ta zamo mai kyau ba ta son zuciya ba, sannan ya zamo mai yin abu domin Allah ba domin a gani a fada ba, kuma kar ya zamo mai aibata ko cin zarafin mutane, in ji Falalu Dorayi. ""Idan jagora yana so wadanda yake jagoranta su yi masa biyayya, sai ya yi jagoranci da adalci, ya kiyaye nuna fifiko, ya bai wa dokar gaskiya dama ta yi aiki, ba dokar fadi a baki ba,"" Falalu Dorayi ya fada. Falalu Dorayi ya ce "" Jagora ya zamo mai aiki da mashawarta nagari, kar ya zamo mai mulki domin bukatar wasu, hakan shi ke kawo mulkin zalunci, har ta kai ana kin girmama juna"". Daga karshen martanin daraktan fina-finan, ya kawo tunatarwa a cikin ayoyin al-Qur'ani mai girma kamar haka: Qurani a cikin An-Nisa'i (58) Allahu (SWT) Ya ce: ""Lallai ne Allah yana umarnin ku bayar da amanoni zuwa ga masu su."" Falalu Dorayi ya mayar da wannan da martani ne bayan da hukumar ta ce fina-finai da dab'i ta jihar Kano ta ce dole tauraron fina-finan Kannywood Adam A. Zango ya bi dokokinta idan yana so ya je jihar domin gudanar da harkokin fim. Adam A. Zango dai ya fito a wani bidiyo da Rahama Sadau ta wallafa a Instagram yana yi wa masoyansa Kanawa albishirin cewa zai je jihar domin kallon fim din 'Mati A Zazzau'. Sai dai jim kadan bayan hakan ne wasu kafafen sadarwa na zamani suka ambato shugaban hukumar tace fina-finai ta jihar, Isma'ila Na'abba Afakallah, yana shan alwashin kama tauraron idan ya sanya kafarsa a jihar. Isma'ila Na'abba Afakallah ya ce Zango yana cikin wadanda ba su yarda sun yi rijista da hukumar ba hasali ma ya ce ya fita daga tsare-tsaren hukumar. A watan Agustan 2019 ne Adam A. Zango ya ce ya fita daga kungiyar masu shirya fina-finan Hausa ta Kannywood. Tauraron fim din kuma mawaki ya ce daga yanzu zai fara cin gashin kansa ne, kamar yadda ya wallafa a shafinsa na Instagram. Sai dai bai yi karin haske ba game da abin da yake nufi da fita daga kungiyar, ganin cewa akwai kungiyoyi da dama da suke cikin Kannywood. Amma ya yi zargin cewa ""ana yin shugabancin kama karya da rashin hukunta mai karfi ko arziki saboda kwadayi da son zuciya."	https://www.bbc.com/hausa/labarai-51532731
sports	Barcelona vs Eintracht Frankfurt: 'Yan Barca da za su kara da Frankfurt a Camp Nou	Eintracht Frankfurt ta ziyarci Barcelona, domin buga wasa na biyu a daf da na kusa da na karshe a Europa League da za su fafata a Camp Nou. Kungiyoyin biyu sun tashi 1-1 a wasan farko da suka kece raini a Jamus ranar 7 ga watan Afirilu. Frankfurt ce ta fara cin kwallo ta hannun Ansgar Knauff daga baya Barcelona ta farke ta hannun Ferran Torres. Barcelona za ta buga wasan da kwarin gwiwa, bayan da Memphis da Sergino Dest suka koma taka leda, bayan da suka yi jinya ta makonni. Tuni kociyan Barcelona Xavi ya bayyana 'yan kwallon da zai fuskanci Frankfurt. 'Yan wasan Barcelona: Ter Stegen, Dest, Pique, R. Araujo, Sergio, Riqui Puig, O. Dembélé, Memphis, Adama, Braithwaite, Neto, Lenglet, Pedri, L. De jong, Jordi Alba, Ferran, F. De Jong, O. Mingueza, Eric, Aubameyang, Nico, Gavi, Balde da kuma Arnau Tenas. Gerard Pique yana cikin 'yan wasan da aka bayyana, duk da ba a fayyace koshin lafiyarsa ba. Ansu Fati, Sergi Roberto da kuma Samuel Umtiti na jinya, yayin da Dani Alves ba a yi masa rijistar buga gasar ba.	https://www.bbc.com/hausa/61084872
sports	Senegal ta ci wasan farko, ta kori Qatar daga Kofin Duniya	Masu masaukin baƙi Qatar sun fice daga Gasar Kofin Duniya bayan sun yi rashin nasara a karo na biyu a hannun Senegal. Ƙasar da ke Gabas ta Tsakiya ta yi bakin ƙoƙarinta amma ta zama tawaga ta farko da ta fice daga gasar tun a zagayen rukuni bayan Netherlands da Ecuador sun yi canjaras 1-1 a nasu wasan na Rukunin A. A gefe guda kuma, Senegal ta kama ƙasa a rukunin da makinta uku, abin da ya sa ta zama ƙasar Afirka ta farko da ta ci wasa zuwa yanzu. Boulaye Dia ne ya fara jefa ƙwallo a ragar masu masaukin baƙin minti huɗu kafin a tafi hutun rabin lokaci. An sake sare gwiwar Qatar ne bayan Famara Diedhiou ya ci ƙwallo ta biyu minti uku bayan dawowa daga hutun. Sai a minti na 78 Muntari ya farke wa Qatar ƙwallo ɗaya amma minti shida a tsakani Dieng ya ƙara ta uku, wadda ta sa masu masaukin baƙin komawa ƙasan teburin rukunin ba tare da maki ko ɗaya ba. Senegal za ta buga wasa na gaba kuma na ƙarshe a rukuni da Ecuador ranar 29 ga watan Nuwamba.	https://www.bbc.com/hausa/articles/cxxjjgej8gjo
business	Dangote da BUA: Ganduje ya sasanta manyan masu kuɗin Najeriya biyu	"Gwamnan Kano Dr Abdullahi Umar Ganduje ya sasanta tsakanin hamshaƙan ƴan kasuwar Najeriyar nan biyu ƴan asalin jihar, Alhaji Aliko Ɗangote da Alhaji Abdussamad Isyaka Rabi'u kan saɓanin fahimtar da suka samu a baya-bayan nan. A wata sanarwa da ya wallafa a shafinsa na Facebook, Gwamnan Ganduje ya ce an yi zaman sulhun ne tsakanin jami'an gwamnatin jihar da wasu manyan masu faɗa a ji da kuma ƴan kasuwar ranar Alhamis. Rahotanni sun ce rikicin na baya-bayan nan ya samo asali ne tsakanin manyan masu arzikin biyu kan batun farashin sikari a kasuwar Najeriya. Jaridar Premium Times ta ruwaito cewa Dangote ya zargi BUA da amfani da wata dama ta hanyar da ba ta dace ba, yayin da shi kuma Abdussamad ya ce yana so ya mamaye kasuwar ne ya kuma dinga sa farashi yadda ya ga dama. Sai dai a wata sanarwa da ya fitar a makon da ya gabata, Dangote ya yi watsi da zargin sanya farashin da ya ga dama. Sanarwar ta ce ""wannan tataɓurza da ake ta yi ce ta sa Gwamna Ganduje ya gayyaci 'yan kasuwar biyu kasancewar su 'yan asalin jihar Kano da kuma irin gudunmawar da suke bai wa jihar da ƙasa baki ɗaya."" Amma a zaman da aka yi da 'yan kasuwar da gwamnatin Kano, sun tabbatar da cewa babu ƙamshin gaskiya a kan maganar da ake yaɗawa cewa, Aliko Dangote ya nemi Abdussamad Isyaka Rabi'u domin su yi ƙarin kuɗin sikari, inda suka tabbatar da cewa wannan zance ba shi da asali. A yayin zaman sulhun dai manyan ƴan kasuwar biyu sun tabbatar da cewa za su wadata Najeriya da sikari. Cikin manyan mutanen da suka halarci sulhun har da hamshaƙin ɗan kasuwa Alhaji Aminu Alhassan Dantata, wanda kawu ne ga Aliko Dangote. Sannan akwai Ministan Ciniki da Masana'antu Niyi Adebayo da Wakilin Kano, Sarkin Dawaki Babba Alhaji Aminu Babba Dan Agundi da shugaban hukumar NEPZA Adamu Fanda da kuma shugaban majalisar limaman Juma'a kuma limamin masallacin Ahmadu Tijjani da ke Ƙofar Mata wato Sheikh Nasiru Adam. ""Bayan tattauna muhimman batutuwa da jan hankali da Gwamna Ganduje da kuma Aminu Dantata suka yi, an samu daidato da fahimtar juna tsakanin manyan yan kasuwar biyu, inda suka yi alƙawarin ɗinke duk wata rashin fahimtar juna da ke tsakanin su,"" a cewar sanarwar. Aliko Dangote shi ne mutumin da ya fi kowa kudi a Afirka sannan shi da Abdussamad Isyaka Rabi'u abokai ne. Duk da cewa mutanen biyu ƴan asalin jihar Kano ne, amma sun fi yin harkokin kasuwancinsu a jihar Legas da ke kudu masu yammacin Najeriya."	https://www.bbc.com/hausa/labarai-56762235
