religion	'Yadda ake auren mut'ah da kananan yara a Iraki'	"Latsa alamar hoton da ke sama domin kallon wannan bidiyon Wani binciken kwakwaf da BBC ta yi kan auren mut'ah ta gano yadda wasu malamai ke gudanar da auren mut'ah da kananan yara a Iraki. Binciken sirrin da BBC ta yi a daya daga cikin wuraren da malaman suke domin gudanar da irin wannan aure ta gano cewa malaman na daura auren mutu'a na takaitaccen lokaci, a wani lokacin ma har na zuwa sa'a daya ko kwana daya. Wasu malaman ma na aurar da har mata 'yan shekara tara domin a sadu da su. Binciken ya gano cewa malaman na sa albarka ga yara wadanda ba su kai shekarun aure ba domin su zama amare na takaitaccen lokaci. Auren mut'ah wani sashe ne na addini a mazhabar Shi'a da wasu daga ciki ke yi, inda ake aure na dan takaitaccen lokaci, ana kuma biyan matan da aka yi auren da su kudi kafin gudanar da auren. Asali auren mut'ah ana yin shi ne idan mutum zai yi tafiya sai ya tafi da matar, amma a yanzu namiji da mace za su yi auren mut'ah su zauna a gari daya na dan wani lokaci. Auren mut'ah ya rarraba kan malaman musulunci inda wasu na daukarsa a matsayin karuwanci wasu kuma na ganin ya hallarta, kuma ana muhawara kan tsawon da za a iya dauka na zaman auren. Sashen larabci na BBC a Iraki ya yi bincike na watanni 11, inda BBC ta yi shigar burtu, inda wakilanta suka rinka zuwa wurin malaman domin nemo irin wadannan matan don cinikin auren mut'ah da su. A lokacin da ake wannan ciniki, duk BBC na daukar abubuwan da ke faruwa a bidiyo cikin sirri . BBC ta tattauna da matan da aka yi auren mut'ah da su da kuma wasu daga cikin mazan wadanda suka biya malaman domin nemo masu matan da za su yi auren mut'ar da su. Bayan an shafe kusan shekaru 15 ana gwabza yaki a Iraki, an yi kiyasin cewa kusan mata miliyan daya mazansu sun mutu wasu kuma matan sun rasa muhallansu. BBC ta gano cewa akwai mata da yawa da suna yin auren mut'ah ne sakamakon talauci. Wuraren da ake yin auren Mut'ah a Iraki Binciken da BBC ta yi ya gano cewa ana yin wannan auren a manyan masallatan Shi'a guda biyu a Iraki. Misali, masu binciken sun samu malamai 10 a Khadhimiya da ke Bagadaza. Takwas daga cikinsu sun bayyana cewa za su gudanar da auren mut'ah; rabinsu sun yarda za su daura auren da 'yan shekara 12 zuwa 13. Masu binciken na BBC sun kuma hadu da wasu malaman a Karbala, wanda shi ne wuri mafi girma ga 'yan Shi'a a duniya, biyu daga cikin malaman sun yarda za su hada auren mut'ah da yara mata kanana. BBC ta nadi bidiyon wasu malamai guda hudu a cikin sirri, uku daga cikinsu sun ce za su samar da mata balagaggu domin auren mut'ah, biyu kuma sun ce za su samo kananan 'yan mata. Sayyid Raad, wani malami a birnin Bagadaza ya shaida wa wakilin BBC mai binciken kwakwaf cewa shari'a ba ta kayyade takamaiman shekarun auren mut'ah ba: ''Namiji zai iya auren ko mata nawa yake so, za ka iya auren mace ko da na minti talatin, idan lokaci ya yi shi kenan, za ka iya auren wata ma nan take. A lokacin da BBC ta tambayi Sayyid Raad idan shari'a ta yarda da yin auran mut'ah da karamar yarinya sai ya ce, 'a bi a hankali kawai kada ta rasa budurcinta.'' Ya kara da cewa ""Za ka iya yin wasa da ita, ku dan kishingida, ka taba jikinta da mamanta... Ba za ka sadu da ita ba ta gaba. Amma zuwa mata ta dubura ba matsala."" Da aka tambaye shi me zai faru idan yarinyar ta ji zafi, sai malamin ya ba da amsa cikin kaduwa. ""Wannan tsakaninka da ita ne, kuma shin za ta iya jure radadin ko kuwa."" An tambayi Sheki Salawai, wani babban malami da ke Karbala idan za a iya auren mut'ah da 'yar shekara 12 inda ya ce ''Eh babu matsala da 'yar shekara tara - babu matsala kwata-kwata. shari'a ta yadda.'' Auren Mut'ah ta waya Domin tabbatar da wannan batu na auren mut'ah da kananan yara, mai binciken ya kirkiri sunan wata yarinya mai suna ''Shaimaa'' inda ya shaida wa Sheik Sayyid Raad cewa yana so ya yi auren mut'ah da ita. A gaske, wakilin BBC ya yi wasa da hankalin yarinyar ta wayar tarho. Sayyid Raad bai nemi ya hadu da yarinyar ko ya yi magana da iyayenta ba, kai tsaye sai ya amince wa wakilin BBC cewa zai daura auren ta waya. Sun yi wannan alkwarin ne zaune a cikin mota tasi tare da wakilin na BBC. Suna zaune sai ya kira yarinyar ta waya ya tambaye ta: ''Shaima kin amince za ki aure shi tsawon kwana daya kan dinari dubu 150?''A karshe sai ya ce. ''Yanzu kun zama ma'aurata kuma za ku yi zama na halal tare.'' Sheik Sayyid ya bukaci a biya shi dala 200 na 'yan mintunan da ya yi wajen daura auren, inda daga karshe wakilin BBC  ya biya wadannan kudade."	https://www.bbc.com/hausa/rahotanni-49933057
religion	Burkina Faso: Yadda Musulmai da Kirista 'yan gida daya ke bikin Kirsimeti	"Cikin shekarun nan mabiya addinin Musulunci masu rinjaye sun fuskanci hare-haren masu da'awar jihadi a kasar Burkina Faso. A daren ranar Kirsimeti mutum 30 ne suka mutu yawanci mata, a harin da mayakan jihadi suka kai kasar. Sai dai duk da haka akwai wani daddadan labari baya ga na tashin hankali. Kasar dai tana da dadadden tarihin zaman lafiya tsakanin mabiya addinai, kuma ba sabon abu ba ne ganin yalan da suka gauraya tsakanin Musulmai da Kirista wadanda suke kashi 23 cikin 100 na al'ummar kasar. Dan jarida Clair MacDougall ya kai wa irin wadannan iyalai ziyara a birninOuagadougou. Iris Osnia Ouattara mai shekara biyar ta taso karkashin kulawar iyayenta biyu a Burkina Faso, mahaifinta mabiyin darikar Katolika ne mai suna Desis Ouattara, da mahaifiyarta musulma Afoussatou Sanou. Lokacin bikin Sallah da ita ake yi, haka ma idan kirsimeti ta zo ana shagalin da ita. A gidansu da ke Ouagadougou, an rataye daya daga cikin hotonta a lokacin tana jaririya tare da fada kirsmeti. An dauki hoton a shekarar 2015, a wata dabdala da kamfanin siminti da mahaifinta ke aika suka shirya. Yayin da mahaifinta ke koya mata abubuwan da suka shafi addinin Kirista, mahaifiyarta ma tana koya mata abin da ya shafi addinin Musulunci. ''Tana raka ni masallaci, sannan ta raka mahaifinta coci ranar lahadi,'' in ji Afoussatou. Afoussatou tana salloli biyar a kowacce rana, amma a ranakun Juma'a tana zuwa masallaci tare da Iris. Haka kuma Iris tana tashi da asubar fari ta yi sallah tare da mahaifiyarta. ''Musulunci addini ne da ke yada zaman lafiya, ba ya takura mutane ko tilasta wa wani abin da bai aminta da shi ba,'' in ji ta. Cikin koyarwar addinin Musulunci a saukake Iris ta koyi yadda ake yin alwala. Cikin littattafan da suke gidansu, har da na koyarwar addinin Kirista. Denis da Afoussatou na tare da juna sama da shekara shida, haduwarsu ta farko sun yi ta ne a garin toussiana, mai nisan kilomita 55 daga birni na biyu mafi gima a Burkina Faso wato Bobo Dioulasso. Sun shirya yin aure shekara daya bayan haduwarsu, a wani kwarya-kwaryan biki da aka gudanar na addinin Musulunci da Kirista. Shi ma Denis kamar wasu mutanen ya sauya addini wanda yawancin mabiya Kirista kan yi gabannin aure, musamman idan za su auri Musulma daga bisani sai su koma ruwa. ""Mun fuskanci tirjiya daga wasu 'yan uwa a lokacin aurenmu,'' in ji Denis, wanda mahaifinsa ya nuna rashin amincewa. ""An kai ruwa rana daga farko. Mahaifina ba shi da matsala, amma mahaifiyata sam ta ki amincewa,'' in ji Afoussatou. ""Yawancin lokuta idan namiji Kirista ya zo neman auren Musulma, iyayenta ne ba sa amincewa.'' Har yanzu tana kokarin sauyawa mahaifiyarta tunani, don ta amince da aurenta da Denis. Yawancin iyalai a Burkina Faso sun gauraya tsakanin Musulmai da Kirista, kuma suna da kyakkyawar dangantaka tsakaninsu tare da gayyatar juna wuraren ibada. Ana yi wa kasar kallon mai dadadden tarihi ta fuskar zaman lafiya tsakanin mabiya addinai daban-daban. Afoussatou tana da kawaye mabiya addinin Kirista, don haka tun da ba za ta je coci a ranar Kirsimeti ba, za ta zauna a gida don gudanar da shagalin ranar tare da 'yan uwan mijinta. Ta ce dukkan sha'ani idan ya taso na mabiya addinin Musulunci da Kirista da ita ake yi, daga watan Ramadan, karamar sallah, sallar layya da bikin ista da kirsimeti. A ranar kirsimeti, Majami'ar Immaculate Conception ta mabiya darikar katolika na cika makil da mutane. Ana sa ran za a girke sojoji a harabar majami'ar da sauran wurare. An sha kai hare-hare a coci da masallatai a baya-bayan nan. Gabannin wannan rana, limaman coci na gargadin mabiya su kiyaye, kar su yi amfani da manyan jakunkuna, sannan su yi saurin sanar da jami'an tsaro da zarar sun ga wani abu da bai gamsar da su ba. Yawanci mutanen da suke da sha'awar kyale-kyale, kan siyo bishiyar kirsimeti mai fitilu launi-launi a jikinta, da aka kawata ta da dusar kankara ta boge su kuma girketa a wajen coci. A ranar kirismeti, Denis yana daukar Iris zuwa cocin King Christ Parish of Pissy a birnin Ouagadougou, daga bisani baki dayan iyalan gidan ciki har da Afoussatou kan taru a gidan kawun Denis. ''Addini ya koyar damu yadda zamu kaunaci juna, da amici,'' inji Denis. ''Allah ne kadai zai iya mana hisabi.'' Iyayen Iris za su ba ta zabin addinin da ta ke son yi idan ta girma, amma a yanzu suna koyar da ita dukkan addinan Musulunci da Kirista. ''Saddini,' in ji Denis yadda ya amince kowa yana da damar yin addinin da ya so. Labari da hotuna daga Clair MacDougall"	https://www.bbc.com/hausa/labarai-50912390
sports	S﻿enegal ta sadaukar da nasararta ga marigayi Papa Bouba Diop	"'Yan wasan kasar Senegal sun sadaukar da nasararsu a kan Ecuador ga marigayi tsohon dan kwallon kasar, Papa Bouba Diop, wanda ya buga gasar Kofin Duniya a 2002. N﻿asarar Senegal da ci biyu da daya a kan Ecuador ita ce ta ba ta damar kai wa zagaye na biyu kuma za ta hadu da Ingila a ranar Lahadi mai zuwa. N﻿asarar ta zo shekaru biyu cif bayan rasuwa dan kwallon, wanda ya mutu yana da shekaru 42. D﻿iop ne ya zura kwallon da ta bai wa Senegal nasara a kan Faransa a wasan farko na gasar cin Kofin Duniya shekaru 20 da suka wuce. K﻿yaftin din Senegal Kalidou Koulibaly ya sanya kambum kyaftin dauke da lamba 19 watau lambar da Diop ne ke sakawa. ""﻿Mun karrama shi ne kasancewarsa gawurtaccen dan kwallon,"" in ji Koulibaly. D﻿iop ya taimaka wa Senegal kai wa zagayen gab da na kusa da karshe a Japan da Koriya ta Kudu. K﻿asashen Afrika biyu ne kawai suka taba kaiwa zagayen gab da da kusa da karshe a gasar cin Kofin Duniya, watau Senegal da Kamaru."	https://www.bbc.com/hausa/articles/c4nr6w1zw42o
entertainment	Mawaƙiya Abida Illo	Ku latsa hoton da ke sama don sauraro: Saurari Abida Illo kan yadda ta soma waka da kuma ranar da waka ta yi mata	https://www.bbc.com/hausa/media-53234911
entertainment	...Daga Bakin Mai Ita tare da Umar Gombe	Latsa hoton sama domin kallon bidiyon Daga Bakin Mai Ita wani shiri ne na BBC Hausa da ke kawo muku hira da fitattun mutane kan wasu abubuwan da suka shafi rayuwarsu zalla. A wannan kashi na 70, shirin ya tattauna da Umar Gombe jarumin fina-finan Kannywood. Jarumin ya amsa tambayoyin da suka shafi rayuwarsa da fina-finai. Ɗaukar bidiyo da Tacewa: Abdussalam Usman	https://www.bbc.com/hausa/media-58988173
business	Hankalin kasashen duniya ya karkata kan  harin Poland	Gwamnatin Poland ta yi kira ga  al'ummarta da su kwantar da hankalinsu,  bayan  da mutum biyu suka rasa rayukansu sanadin  fadawar wani makami mai linzami a wani kauye da ke kusa da kan iyakar kasar da Ukraine. Shugaba Andrzej Duda ya ce makami ne da aka kera a Rasha amma babu cikakken bayani a kan wanda ya harba shi. Shugaba Duda ya fada wa ‘yan jarida cewa : ”Ba mu da wata kwakkwarar shaida ya zuwa yanzu a kan wanda ya harbo makamin….akwai yuwar cewa makami ne  da aka kera a Rasha amma wani abu ne da ake gudanar da bincike a kansa a halin yanzu.”  Firaministan Poland Mateusz Morawiecki  ya ce gwamnati za ta tsaurara tsaro a sararin samaniyar kasar  sakamakon al'amarin da ya faru. “ Mun yanke shawarar ganin cewa wasu daga cikin zababbun rundunoninmu na dakarun kasar  sun kasance cikin shirin ko-ta-kwana musamman a fannin da ya shafi sa ido a kan  sararin samaniya” a jawabin da ya yi wa ‘yan jarida. Al'amarin wanda ya janyo damuwa tsakanin mambobin kungiyar tsaro ta Nato wanda Poland mamba ce a ciki ya janyo musayar kalamai tsakanin Kyiv da kuma Moscow. Rasha ta bayyana ikirarin da ake yi a kan cewa ita ce ta ke da alhaki a matsayin takalar fada daga wurin Kyiv wadda manufarta ita ce ta ja sauran kasashen duniya a cikin rikici  dan a yi mata taron-dangi Sai dai a daya bangaren Ukraine ta yi watsi da zargin na Rasha, a kan cewa ita ce take da alhakin harin a matsayin  ba komai ba ne illa kutungwila ce kawai  daga Rasha. Ministan harkokin wajen Ukraine Dmytro Kuleba a shafinsa na Twitter ya ce: ''A yanzu Rasha ta gabatar da wani bayani da ya yi zargin cewa makamin  tsaron sararin samaniyar Ukraine ne ya fada a yankin Poland. Wannan kuma ba dai dai ba ne.'' A taron kasashe 20 mafiya karfin tattalin arziki a duniya da ke gudana a Bali na kasar Indonesia hankalin kowa ya karkata zuwa Poland. Shugabannin kasashen na G20 sun rika magana da ministocin tsaronsu da na harkokin kasashen wajensu ta wayar tarho da kuma jami'an gwamnatin Poland. Shugaba Joe Biden na Amurka da Firaministan Birtaniya Rishi Sunak na cikin wadanda suka kira shugaban kasar ta Poland. Haka kuma shugabannin Amurka da Birtaniya da na Tarayyar Turai da Sifaniya da Jamus da Kanada da Faransa da Japan da kuma Netherlands sun taru  domin gudanar da abin da fadar White Hiouse ta kira  taron gaggawa. Sai dai Shugaba Biden ya ce da wuya a ce daga Rasha ne aka harba makamin da ya yi sanadin mutuwar mutum biyu a Poland. Ya ce,  “ an samu bayanan farko da suka nuna shaku” kan ko al'amarin da ya faru a Poland yana da nasaba da makamin da aka harba daga Rasha,'' “ Ba na son na fadi haka sai mun kammala bincike amma abu ne mai wuya idan aka dubi yanayin inda aka harbo makamin, a ce daga Rasha ne amma za mu gani,'' in ji shi. Sai dai ya ce shugabannin duniya za su tantance matakai na gaba da za su dauka bayan sun gano abin da ya faru bayan an kammala  binciken da ake yi a Poland.	https://www.bbc.com/hausa/articles/cp9k2j872l9o
religion	Ku San Malamanku tare da Sheik Ibrahim Ahmad Maqari	"Ku latsa hoton da ke sama don kallon hirar BBC da Sheik Ibrahim Ahmad Maqary a shirin Ku San Malamanku, sannan kuna iya shiga shafinmu na Youtube don kallon cikakken bidiyon: Fitacce malamin addinin Musuluncin nan na Najeriya Sheik Ibrahim Ahmad Maqri ya ce babban abin da ya sanya a gaba shi ne samar da makarantu ko zawiyyoyi ko masallatai wadanda za su dace da tsari na wannan karni. Malamin, wanda shi ne kuma limamin babban masallacin Juma'a na Abuja, ya faɗi hakan ne a hirar da ya yi da BBC Hausa a shirinmu na musamman mai taken ''Ku San Malamanku''. ""Babu abin da na sanya a gaba illa kokarin yadda za mu samar da tsari na institution na addini. Idan an ce institution, ana nufin makarantu, ana nufin zawiyyoyi, ana nufin masallatai wadanda za su zama mu'assasat wadanda suka dace da zamanin da muke ciki, karni na ashirin da daya da kalubalen da ke cikin karni na ashirin da dayan, kuma su rika ba da gudunmawarsu a wannan tsari,"" in ji shi. Ya kara da cewa muhimmin abu shi ne kada tsarin addini ya dogara da mutum daya. Malamin ya ce ko da yake bai taba tsayawa ya kirga adadin littafan da yake rubutawa ba amma ""za a iya cewa za su kai arba'in."" Ya ce akwai littafin da yake rubutawa yanzu wanda yake ""kokarin dauko sababbin mas'aloli wadanda za su kara kyautata fahimtar matasa almajirai ilimi da addinin Musulunci gaba daya a zamanin da muke ciki wanda ke cike da tahaddiyat."" Wane ne Sheik Ahmad Maqry? An haifi Sheik Ibrahim Ahmad Maqary a garin Zaria cikin  jihar Kaduna da ke arewacin Najeriya a shekarar 1976. Sheikh ya bayyana cewa ya fara karatunsana  firamare a garin Katsina bayan da aiki ya mayar da mahaifinsa can. ''Kakana wanda ya haifi mahaifina shi ya zo kasar Zaria daga garin Borno da niyyar neman ilmi, kuma bayan ya samu abin da yake so ya bukaci ya koma inda ya fito don ya cigaba da ilmantar da al'umma,'' in ji Sheik Maqary. Ya kuma ce ""amma sai sarki Zazzau na wancan lokacin ya ce ai shi malamai ba sa zuwa garinsa su bar garin, don haka sai ya ba shi gida ya ci gaba da zama yana ilmantarwa."" Malamin ya ce ya yi karatu gwargwado a gidan shahararren malami a garin Katsina Sheik Abba Abu. Ya kuma ce malaman da ya zauna da su don daukar karatu a garin Zaria suna da dan dama, cikinsu akwai malam Tanimu Kusfa shahararren malamin fiqihu da sauran fannonin ilimi. Sannan akwai babban malami a Zaria Malam Bala Kusfa a wannan lokacin ""kanin mahaifina yana daga cikin almajiransa, don haka yana daukarsa yana kai shi zaurensa don sauraron karatun."" Kafin tafiyarsa kasar Masar karo karatu, Sheik Maqary ya hadu da daya daga cikin malaman da suka fi yin tasiri a rayuwa, Sheik Muhammadu Amin Abdullahi mutumin Okene. Malamin ya ce a kasar Masar babban  guzirin da zai iya cewa ya samu shi ne haduwarsa da babban malaminsa, abin alfaharinsa a dukkan fannonin karatu da rayuwarsa Sheik Ibrahim Saleh al- Hussaini, kuma shugaban babbar majalisar Fatwa ta Najeriya. Ya je kasar Masar karatu a daidai lokacin da ya bude makaranta Yawanci malamansa ba 'yan Najeriya ba ne, sun zo daga kasashen Mauritania da Morocco, don haka ya yi amfani da wannan damar wajen daukar wasu fannoni daga cikin  ilmi daga hannun malaman. Malamin ya ce yana da kimanin shekara 13 har zuwa 14 ya yi haddar AlKur'ani mai girma a makarantar da aka bude mai suna Madarasatul Faidatul Islamiyya ta gidan Sheik Yahuza Zaria. A wannan lokacin ne ya samu babban sauyi a rayuwarsa, bayan da mahaifinsa ya cire shi daga tsarin karatun boko bayan ya kammala makarantar sakandare ya mayar da shi makarantar da yake jagoranta da ake kira Jama'atu 'College of Arabic and Islamic Studies' kuma a lokacin ne ya muhimmantar da harshen Larabci musamman ilmin ginin ka'idar jimla da ake cewa ilmim nahawu. ""Lallai mun yi karatu mai yawa a wannan lokacin, mun haddace mafi yawan litattafan da ake  karantawa a wannan lokacin,"" in ji shi. Malamin ya kuma ce yana da wani yanayi da ba ya iya barci da dare da sauki, inda a lokuta da dama mahifinsa idan ya ga ya ki tashi ya daina karatu don ya je ya kwanta sai ya kashe duka wutar gidan. Sheik Maqary Farfesa ne da ya koyar da Larabci a Jami'ar Bayero da ke Kano amma ya ritaya a 2020. Wasu karin labaran da zaku so karantawa"	https://www.bbc.com/hausa/labarai-55932475
politics	Wasu manyan makusantan Shekarau da suka ki binsa PDP	"Wasu jiga-jigan 'yan siyasa a Kano da ke arewacin Najeriua kuma makusantan tsohon gwamnan Jihar, Malam Ibrahim Shekarau, sun yi masa turjiya a yayin da ya fice daga jam'iyyar NNPP inda ya koma jam'iyyar PDP. A farkon makon nan ne dan takarar shugaban kasa na  PDP Atiku Abubakar ya karbi Sanatan da ke wakiltar  Kano ta Tsakiya a majalisar dattawan kasar a wani kwarya-kwaryar biki da aka gudanar a birnin na Kano. Shekarau ya ɗauki matakin komawa PDP ne sakamakon abin da ya kira ""rashin adalci"" da jagoran jam'iyyar NNPP kuma ɗan takarar shugaban ƙasarta a zaben 2023, Sanata Rabiu Kwankwaso, ya yi musu wajen rabon kujerun da za a yi takara a kansu da wasu batutuwan. Wannan ne karo na biyu da Sanata Shekarau ya sauya jam'iyya a cikin shekarar 2022 -- ya bar APC zuwa NNPP a watan Mayu, sai kuma ya bar NNPP zuwa PDP a Agusta. Wannan lamari ya matuƙar jawo ce-ce-ku-ce a tsakanin ƴan Najeriya, musamman ma al'ummar jihar Kano. Wasu na ganin tsohon gwamnan na Kano ba shi da alkiba inda yake sauya sheka a-kai-a-kai, yayin da wasu ke ganin matakin ya yi daidai saboda akidar Sanata Shekarau ta ganin cewa an tsare ""gaskiya"". Kazakila batun ya raba kawunan magoya bayansa da kuma makusantansa a bangaren siyasa, musamman wadanda tare da su ya shiga jam'iyyar NNPP kuma tuni aka ba su takarar manyan kujeru. A cikin wadannan 'yan siyasa har da dan majalisar wakilan Najeriya Kabiru Alhassan Rurum, wanda ya ce ba su ji dadin fitar Sanata Shekarau daga NNPP zuwa PDP. A hirarsa da BBC, ya ce matakin tamkar wata kaddara ce da Hausawa kan ce ta riga fata. ''Ba mu ji dadin abin da ya faru ba, mu ire-irenmu wadanda muka dawo jam'iyyar NNPP tare da Malam Ibrahim Shekarau mun kai hamsin da biyar, wasu na da mukamai wasu 'yan takara ne a mukamai daban-daban, kuma muna nan a jam'iyyarmu ta NNPP."" Kabiru Rurum, wanda ke takarar majalisar tarayya a zaben 2023, ya ce sun amince da tsare-tsare da kuma ""manufofin da aka kafa jam'iyyar NNPP kuma ba za mu fita daga cikinta ba."" Shi ma Abdulrahaman Kawu Sumaila, wanda ya dade yana gwagwarmaya tare da Sanata Ibrahim Shekarau, yana cikin jam'iyyar NNPP, inda yake takarar  majalisar dattawa mai wakiltar Kano ta Kudu. Sanata Ibrahim Shekarau ya koma jam'iyyar NNPP a watan Mayun da ya gabata daga APC mai mulkin Kano bayan rikici tsakaninsa da Gwamna Ganduje, wanda ya kai ga zaɓar shugabannin jam'iyyar biyu. Dama dai wani jigo a jam'iyyar ta NNPP, Injiniya Buba Galadima,ya shaida wa BBC ya ce ya tabbatar ""kashi 90 cikin dari na magoya bayan Sanata Shekarau ba za su bi shi zuwa jam'iyyar PDP ba"", inda ya ce za su ci gaba da zama a jam'iyya NNPP."	https://www.bbc.com/hausa/articles/cjl7k03ernwo
religion	Mubarak Bala: Dalilin kama wanda ake zargi da cin zarafin Musulunci	"Kungiyar kare hakki ta Amnesty International ta ce tana bibiyar halin da Mubarak Bala wanda aka ce shi ne shugaban wadanda babu ruwansu da addini a Najeriya yake ciki, bayan kamashi da jami'an 'yan sanda suka yi. Amnesty ta ce ta damu matuka kan karuwar barazanar da ake yi wa rayuwarsa a kafafen sada zumunta a Najeriya. A ranar Talata aka kama Mubarak Bala a jihar Kaduna, kuma ana sa ran za a mayar da shi Kano jiharsa ta haihuwa, inda a nan ne dimbin Musulamai suka rubuta wa hukumomi korafi da zarginsa da yin batanci ga Annabi Muhammad S.A.W. 'Yan sandan Kaduna sun kama Mubarak, wanda aka ce shi ne shugaban wadanda babu ruwansu da addini a Najeriya, bisa bukatar takwarorinsu na Kano. Ana zarginsa Ana zargin ya ci zarafin addinin Musulunci ne a wani sako da ya wallafa a shafinsa na Facebook. Wata tawagar lauyoyi ce ta mika wa 'yan sanda korafi a Jihar Kano. Tuni dai wasu masu rajin kare hakki suka yi ca a shafukansu na zumunta suna neman a saki Mubarak Bala, wadanda suka ce yana da 'yancin shiga addinin da ya kwanta masa a rai. Barista Salisu Salisu Umar ne jagoran lauyoyin da suka yi korafi kan Mubarak, kuma ya fada wa BBC cewa ba don ya bar addinin Musulunci suka nemi a kama shi ba. ""Mun yi musu korafi ne kan aibata Annabi S.A.W. da ya yi a shafinsa na Facebook,"" a cewar Salisu Salisu. Ya ci gaba da cewa: ""Ba wai don ya yi ridda ba ne ko sabo, korafinmu a kan barin masu addini su yi addini ne."" ""Abin da muke nufi shi ne, tun da shi (Mubarak Bala) ya bar Musulunci tun a shekarar 2014 bai kamata kuma ya rika aibata addinin ba da kuma abin da masu binsa suka yi imani da shi. ""A matsayinmu na lauyoyi, daga cikin hakkinmu mun nemi 'yan sanda su binciki abin da yake fada ko ya saba da abin da aka iyakancewa mutum ya yi magana kan addini."" Barista Salisu ya bayyana cewa suna so ne a hukunta shi da kundin tsarin mulkin Najeriya. A shekarar 2014 ne matashi Mubarak Bala mai shekara 29, a lokacin, da ke birnin Kano ya ce bai yarda da samuwar Allah ba kuma ya ce ya bar addinin Musulunci. Iyayensa sun kai shi asibitin masu tabin hankali domin binciken lafiyarsa a lokacin. Karin wasu labarai da za ku so ku karanta:"	https://www.bbc.com/hausa/labarai-52423313
