technology	Fargaba game karɓar kuɗi don ba da shuɗin maki a Twitter	"A﻿ttajiri Elon Musk na ci gaba da jaddada matsayarsa ta fara karɓar dala $8 kan duk waɗanda ke son a maƙala masu shuɗin maki a dandalin sada zumunta na Twitter. C﻿ikin sauye-sauyen da ya bijiro da su bayan saye dandalin kan dala biliyan 44, Mista Musk ya ce ""abu ne mai muhimmanci a yaƙi zamba"". A﻿ yanzu ana bayar da shuɗin maki akasari kyauta, wanda akasari ake bai wa manyan mutane da kamfanoni. M﻿atakin zai sa a kasa gane majiyoyi managarta, a cewar masu sukar sa. Mista Musk wanda shi ne mafi arziki a duniya, ya ce waɗanda suka biya kuɗin za su samu zaɓi a wurin mayar da martani (comment) da wurin neman ƙarin bayani, sannan rabi za su rinƙa gani na yawan tallace-tallace. ""﻿Iko a hannun al'umma! Shuɗin maki dala $8 a wata,"" kamar yadda biloniyan ya wallafa a Twitter, yana mai sukar tsohon tsarin tantancewar. Y﻿a ce yana so ne ya rage dogaron da Twitter ke yi da tallace-tallace duk da cewa wasu kamfanoni sun nuna damuwa game da ɗorewar tallan a Twitter ƙarƙashin mulkinsa. G﻿eneral Motors - abokin hamayyar kamfaninsa na Tesla mai ƙera motoci masu amfani da lantarki - ya ce zai daina yin tallan a dandalin. A﻿ wani saƙon daban kuma, Musk ya ce: ""Zuwa ga masu ƙorafi, ku ci gaba da ƙorafi amma sai an biya dala $8."" S﻿ai dai Nu Wexler, tsohon shugaban hulɗa da jama'a a harkokin ƙasashe na Twitter, ya ce biyan kuɗi domin samun shuɗin maki zai sa a kasa gane labaran ƙarya. ""﻿Yayin da ake fama da yaɗa labaran ƙarya, tantancewa (shuɗin maki) ɗaya ce daga cikin hanyoyi da 'yan jarida, da masu bincike, da sauran jama'a ke amfani da ita wajen fayyace labaran bogi da kuma marasa inganci,"" kamar yadda Mista Wexler ya faɗa wa shirin BBC na Today. ""﻿Idan ka fara ba da hayar shuɗin maki, zai zama abu mai wuya a iya gane labaran boge da kuma samun masu inganci."" James Fallows, wani mai yaɗa labarai, a Amurka ya ce ya ce ba adadin kuɗin da za a biya ne yake jawo ƙorafi ba, ""abin da za a karɓi kuɗin saboda shi ne"". ""﻿Karɓar kuɗi na wata-wata: ba matsala, domin a cire talla: ba matsala, domin mutum ya samu maɓallin gyara saƙo: ba matsala,"" in ji shi. ""﻿Amma shuɗin maki? Mutanen da suke shi ba za su biya ba, mutanen da suke biya ba su cancanta ba."" K﻿azalika, shahararren ɗan jaridar Zimbabwe Hopewell Chin’ono ya tambayi Musk game da yadda za a gane waɗanda suka cancanci shuɗin makin idan aka ce sai an biya kuɗi. ""﻿To, idan duk wanda yake da dala $8 zai iya samun tantancewa (shuɗin maki), ta yaya za a bambance waɗanda ke buƙatarsa saboda tsaro da kuma masu son sa  saboda alfahari? ""﻿Na zaci ana bayar da shi ne saboda aikin da mutum yake yi ba wai domin zai iya biya ba. Babu sauran inganci ke nan ko?"" T﻿sohon tsarin da Twitter ke bi na tantancewa ko bayar da shuɗin makin ya haɗa da cike fom wanda aka tanada ga waɗanda ake yawann yi musu sojan-gona kamar taurarin fina-finai da ƴan siyasa da ƴan jarida. K﻿amfanin ya ƙaddamar da tsarin a 2009 bayan ya fuskanci matakin shari'a, inda aka zarge shi da gazawa wajen daƙile masu yin sojan-gona. A﻿ cewar wani rahoton jaridar Guardian, akwai shafuka masu shuɗin maki kusan 400,000 a Twitter ya zuwa 2021. Sai dai Mista Musk na fuskantar babban ƙalubale yayin da yake yunƙurin sauya alƙiblar harkokin kasuwancin Twitter, wanda bai samu wata riba ba a tsawon shekaru."	https://www.bbc.com/hausa/articles/cv28z3537ylo
technology	Kamfanin AceOn ya samar da lantarki mai amfani da hasken rana domin amfani a Afirka	"Wani kamfani ya samar da  na'urar lantarki mai amfani da hasken rana mai rahusa, domin samar da wutar lantarki ga yankunan matalauta. AceOn da ke Telford, Shropshire, ne ya yi aikin da za a yi amfani da shi a kasashen Afirka kudu da hamadar sahara, yankin da rabin al'ummar ba sa samun wutar lantarki. Shirin ya samu tallafin kudade, bayan an yi na'urar mai kama da batiri da saukin amfani a ƙasashen Afrika inda kusan rabin al'ummar nahiyar ke rayuwa ba lantarki. Kwararru sun ce zuba jari a yankin zai samar da gagarumar riba. Kashi 60 cikin 100 na 'yan Najeriya ne kadai suke samun wutar lantarki, yawanci kuma sai dai su yi amfani da janareto mai karar gaske, da fitar da hayaki a lokutan da babu wutar lantarki. Mark Thompson, shi ne manajan daraktan kamfanin AceOn Group, ya ce na'urar na nadar hasken rana, sai kuma ya bada hasken wutar da daddare. Kamfanin dai ya kulla kawance da wasu kamfanoni a Najeriya, wadanda suke rarraba janareto. Shugaban kamfanin Nevadic, Dave Nwosu, ya ce: ""Ba ka bukatar zuwa gidan mai ko wajen 'yan bunburutu don sayan fetur a kowacce rana, saboda matukar akwai hasken rana ba ka da wata matsala, wannan zai sa ka huta da yawon zuwa siyo mai ga kuma kare muhalli daga gurbataccen hayakin da janareto ke fitarwa."" Masu bincike a Birtaniya ne suka bunkasa na'urar, watakila ita ce irin ta ta farko da aka yii amfani da sinadarin sodium-ion na batira, wanda ake samarwa daga abubuwa masu saukin farashi, sannan ba su da wata illa ga muhalli, da kuma ake amfani da su a wayoyin salula, da na'urar kwamfuta da motoci masu amfani da batiri. Babban jami'i da ke jagorantar kirkira na kamfaninin Innovate da ke Birtaniya, Harsh Pershad, wanda ke samar da kudade da tallafi ga kungiyoyi da kamfanoni domin kirkirar sabbin kayayyaki, ya ce: ""Ina ganin a gare mu riba za mu ci idan muka zuba jari da abokan huldarmu, musamman da kasashe masu tasowa. ""Idan muka taimaka a daidai wannan lokacin da suke tsananin bukatar hakan, bayan an dauki mataki kan dukkan ayyukan ababen more rayuwa. Daga nan ne za mu amfana, da cin gajiyar guminmu....za kuma mu taimakawa wasu suma su samar da wannan fasaha...a nan kun ga riba ta mu ce."""	https://www.bbc.com/hausa/labarai-59753444
religion	Bidiyon yadda aka harba roka shugaban ƙasa na Sallar Idi a Afghanistan	Ku latsa hoton da ke sama don kallon bidiyon: Shugaban ƙasar Afghanistan na cikin Sallar Idi da sauran al'umma sai aka harba rokoki a kusa da fadar gwamnatin. Sai dai duk da ƙarar fashewar da aka ji Shugaba Ashraf Ghani da sauran manyan jami'an gwamnati sun ci gaba da sallarsu cikin nutsuwa. An ji karar fashewar a talabijin yayin da ake watsa yadda ake gudanar da sallar kai tsaye. Wannan hari na zuwa ne makonni bayan tafiyar dakarun Amurka, wdanda suka janye bayan shafe shekara 20 a Afghanistan.	https://www.bbc.com/hausa/media-57900865
politics	Wasu dattawan Arewa sun ce sun koma bayan Atiku Abubakar	Wasu da suke yi wa kansu lakabi da kungiyar shugabannin al'ummar arewacin Najeriya sun ce sun  yanke shawarar zaben dan takarar shugaban kasa na jam'iyyar PDP, Alhaji Atiku Abubakar. `Yan kungiyar, wadda suka ce ta kunshi Musulmi da Kirista sun dauki wannan matakin ne don nuna rashin amincewarsu da abin da jam`iyyar APC ta yi na tsayar da Musulmi da Musulmi a matsayin dan takarar shugaban kasa da mataimaki.  Jiga-jigan kungiyar shugabannin al`ummomin arewacin Najeriyar, sun ce tafiyar tasu ta Musulmi da Kirista ce daga jam`iyyun siyasa daban-daban. Kuma sun bayyana cewa sai da suka dauki lokaci suna tuntuba tare da nazarin siyasar kasar, musamman ma manyan jam`iyyu da masu yi musu  takarar shugaban kasa, kana suka yanke shawarar mara wa na jam`iyyar PDP baya. A cewarsu babu adalci a tsarin da jam`iyyar APC ta yi na hada Musulmi da Musulmi a matsayin dan takarar shugaban kasa da mataimaki.  Tsohon mataimakin gwamnan Jihar Sokoto Alhaji Muktari Shagari wanda yana cikin jagororin kungiyar ya shaida wa BBC cewa kungiyoyin sun yi la'akari da hakki na kowa da kowa  da yadda tsarin zama na kasar yake.  Ya ce, ‘’Idan kungiyoyin siyasa za su tsayar da ‘yan takara, suna la'akari da hakki na kowa a Najeriya da yadda tsarin zamanmu yake  …Musulmi da Kiristoci.'' ''Ba za mu yarda a yaudare mu ba saboda haka da Kiristocin Najeriya da Musulmin Najeriya mu hada kai mu zabi  wannan jam'iyya da wannan dan takara Alhaji Atiku Abubakar da mataimakinsa.” In ji shi.  ‘’Su ne  suka nuna cewa lallai-lallai babu shakka za a yi wa kowa adalci a cikin wannan kasa tamu ta Najeriya,’’ a cewarsa. Kungiyar ta yi  misali da  wasu jihohi da ke da gwamna Musulmi da mataimaki Kirista wadanda suka hada da Adamawa da Osun .  Dattawan arewan sun yi amannar cewa kauracewa jam’iyyar da suka yi saboda hadin da ta yi na takarar shugaban kasa zai yi tasiri kan jam’iyyar ta APC ta yadda ba za ta yi nasara ba.  Farfesa Doknan Sheni, wanda tsohon shugaban jami`ar Jihar Filato ne  ya ce sun hada kai ne domin  ta wannan hanyar ce  kawai za su iya samun nasara.  ''Da mun hada kai dole za mu ci zabe, APC ba za ta ci zabe ba,  APC za ta ci zabe  ne kawai idan ba mu hada kai ba, ” in ji shi.  Ya kuma yi ikirarin cewa  suna da magana ne da yawun dukkan Kirista  da ke  Arewa.  Sai dai wanann abu ne mai wuya a tabbatar saboda akwai wasu Kiristoci da  har yanzu  suna tare da dan takarar jam’iyyar APC.   Cikin manyan wannan kungiya da suka rada mata suna kungiyar shugabannin al`ummomin arewacin Najeriya har da tsohon kakakin majalisar wakilai, Hon Yakubu Dogara.	https://www.bbc.com/hausa/articles/c0vqxlxq13go
politics	Abin da Buhari ya gaya wa manyan APC gabanin zaben fitar da gwani	"Shugaba Muhammadu Buhari na Najeriya ya gana da manyan jiga-jigan jam'iyyar APC, gabannin taronsu na ƙasa domin zaɓen wanda zai tsaya takarar gaje kujerarsa a zaɓen 2023. Ganawar da aka yi a fadar gwamnati a Abuja, ta samu halarta mataimakin shugaban kasa Yemi Osinbajo, da shugaban majalisar dattawa, Ahmad Lawan da kuma tsofaffin shugabanni jam'iyyar na riƙo da gwamnonin jam'iyyar. Ana dai gani ganawar a matsayin wani ƙoƙari na cimma daidaituwa kan mutumin da za a mara wa baya a zaɓen fitar da gwani da jam'iyyar ke somawa ran Litinin 6 ga watan Yuni ta kuma ƙarƙare a jibi Laraba, 8 ga watan Yuni. Baya ga ganawar jiya Lahadi, an yi ta samun tuntubar juna, kuma sama da mako guda kenan ana zama tsakanin gwamnoni da masu takara domin samar da maslaha gabanni zaɓen fitar da gwamnin. A wata sanarwar da kakakin shugaban ya fitar, Femi Adesina, na cewa Shugaba Buhari ya yaba da kokarin tuntuɓar juna da aka rinƙa samu tsakanin masu neman kujerarsa ta shugaban Najeriya da kuma yiwuwar cimma matsaya kan mara wa mutum guda baya. A cewar sanarwar, shugaban ya ce yana da ƙwarin-gwiwar suna kan gaba wajen sake lashe zaɓe a karo na uku jere, ƙarƙashin inuwar jam'iyyarsu ta APC. Sannan yana son ganin taron ya samar da shugabanci mai ƙarfi da alƙibla a wannan gaɓar da ake ciki, na tunkarar babban zaɓe a 2023. Ya ce: ""Ina da ƙwarin-gwiwar cewa sakamakon wannan tuntuɓa da kwamitin bayar da shawarwari na jam'iyya zai taimaka wajen sake ba mu alƙbila, da taimaka mana wajen cimma manufofinmu na dimokraɗiyya, al'adu da tsare-tsarenmu da dama ake bi a jam'iyyarmu. ""Kuma ana cikin wannan yanayi, na tattauna da gwamnonin jam'iyyarmu, da kuma sauran manyan mambobin jam'iyyarmu da ke neman tikitin takarar shugaban kasa a jam'iyyarmu a zaɓen 2023. ""Ina farin cikin sanar da ku cewa na samu sakamako mai kyau a ganawar da na rinƙa yi wanda ke nuna irin shirin da jam'iyyarmu ta yi domin sake ɗanne mulki a karo na uku jere tun 2015, a zaɓen shugaban kasa."" Shugaba Muhammadu Buhari ya kuma nuna muhimmancin haɗa-kai da mara wa juna baya a ƙoƙarin sake gina jam'iyyarsa zuwa ga nasararsu a idon duniya baki daya, yana mai cewa kar jam'iyyarsu ta zama ta daban. Mutanen da suka halarci zaman jiya da Shugaba Buhari sun haɗa da tsohon shugaban riƙo na farko na jam'iyyar, Cif Bisi Akande da John Odigie-Oyegun. Akwai kuma shugaban jam'iyyar ta ƙasa, Sanata Abdullahi Adamu da Sakataren Jam'iyyar, Sanata Iyiola Omisore da wasu gwamnoni. A cikin gwamnonin akwai na Borno, Babagana Zulum da Simon Lalong na Filato da Bello Matawalle na Zamfara akwai kuma gwamnan Ebonyi, David Umahi. Ana kuma sa ran a yau Litinin ma Buhari zai sake ganawa da gwamnonin Jam'iyyar APC 22. Rahotanni na cewa duk da cewa yau Litinin ake soma taron, ba za a soma gudanar da zaɓen ba sai a yammacin Talata daga 6 zuwa 9 na yamma. Daligete sama da 2,300 da ake sa ran shigar su Abuja domin zaben wanda zai riƙe tikitin kara a APC."	https://www.bbc.com/hausa/labarai-61704184
health	Abubuwan da kuke bukatar sani game da bambancin lokacin motsa jiki tsakanin namiji da mace	"Motsa jiki yana da kyau matuƙa a lokacin da ake yinsa, sai dai lokacin da ya kamata a samu abin da ake so wurin motsa jiki ya bambanta tsakanin mace da namiji, kamar yadda wani binciken Amurka ya bayyana. Bincken ya gano cewa mata sun fi ƙona kitse a lokacin motsa jiki da safe fiye da maza, inda kuma da yamma maza sun fi ƙona kitsen. Akasarin abin da aka sani kan wannan lamari an same shi ne daga irin binciken da ake yi a kan maza. Bambancin sinadaren jiki, da kuma bambancin bacci tsakanin mace da namiji duk za su iya taka muhimmiyar rawa. Wani bincike da aka yi kan maza 30 da mata 26 waɗanda duka suna da cikakkiyar lafiya kuma suna tsakanin shekara 25 zuwa 55 an shafe makonni 12 ana binciken inda aka sa ido kan irin motsa jiki daban-daban da ake yi wanda suka haɗa da guje-guje. Wani rukuni na mutanen ya yi atisaye na sa'a ɗaya tun kafin 8:30 na safe inda ɗayan rukunin kuma suka soma yi da dare tsakanin 18:00 zuwa 20:00. Duka waɗanda aka yi gwajin da su akwai iri abincin da aka amince su ci. Masu binciken sun yi gwajin jini da kitsen kowa da ƙarfin mutum da yadda mutum zai iya sarrafa jikinsa. Duka waɗanda aka yi gwajin da su sun samu ci gaba a kiwon lafiyarsu a tsawon makonni 12. ""Lokacin da ya fi kyau wurin motsa jiki shi ne lokacin da mutum zai iya yi a lokacinsa,"" in ji Dakta Paul Arcerio, wanda jagora ne a bincike, marubuci kuma farfesan kiwon lafiya da halayyar ɗan adam a kwalejin Skidmore da ke New York. Sai dai ya bayyana cewa akwai wani abu da ke faruwa wanda ke nuna cewa akwai lokacin da ya kamata namiji ko mace duka kowa ya motsa jiki. Bisa irin sakamakon da aka samu, matan da suke so su rage kitsen jikinsu da kuma rage hawan jini ya kamata su rinƙa motsa jiki da safe, in ji Dakta Arcerio, Wannan na da muhimmanci sakamakon ciki ya nannaɗe sassan jikin mutum da ke can ciki, da suka haɗa da hanta, kuma hakan na da hatsari. Mazan da ke cikin binciken ba su cika damuwa ba da lokacin motsa jiki da rana ba, inda suke samun ci gaba a lafiyarsu da safe da dare. Sai dai an gano cewa motsa jiki da dare ya fi ga maza inda yake ƙara kyautata zuciyarsu da kuma yadda ɗan adam ke firar da bayan gida da kuma fitsari,"" in ji Dakta Arcerio. Hakan na nufin wannan zai rage barazanar yin ƙiba fiye da kima da ciwon suga da ciwon zuciya da shanyewar rabin jiki. Babu tabbaci kan takamaiman dalilin da ya sa lokutan motsa jiki tsakanin maza da mata suka bambanta, inda masu bincike suka ce ana buƙatar a ƙara zurfafa bincike domin gano dalilin hakan. Sun bayyana cewa akwai yiwuwar mata na ƙona kitse fiye da maza da safe sakamakon akwai yiwuwar su fi samun kitse a ciki."	https://www.bbc.com/hausa/labarai-61644380
politics	Haruna Abdullahi Ningi: Abin da ya sa nake nadamar yi wa Buhari waka	"Latsa hoton da ke sama domin kallon bidiyon: Fitaccen mawakin nan da ya yi wa 'yan siyasar Najeriya waka, Haruna Ningi, ya ce ya yi nadamar yi wa Shugaba Muhamadu Buhari waƙa ne saboda bai cika alkawuran da ya ɗauka ba. A hirarsa da BBC Hausa, mawaƙin ya ce ""har ga Allah a wani wuri na yi da-na-sani, saboda ba za ka yi da-na-sani gaba daya kan al'amarin ɗan adam ba. ""A inda muka yi da-na-sanin shi ne, abubuwan da muna da tabbacin cewa shi shugaban kasa zai yi su, to sai aka samu gazawa ta wannan ɓangaren""."	https://www.bbc.com/hausa/labarai-60265959
politics	Ko Tinubu ya fara yakin neman zaben 2023 daga Jihar Kano ne?	"Masana harkokin siyasa a Najeriya sun fara tsokaci kan bikin zagayowar ranar haihuwar Sanata Ahmad Bola Tinubu, jigo a jam'iyyar APC mai mulki da za a yi a Jihar Kanon Najeriya. Wannan ne karon farko da ake yin bikin a wata jiha da ke arewacin Najeriyar, inda a baya an fi yin bikin a mahaifar Tinubu wato Legas. Gabanin taron, Tinubu ya kai ziyara tare da duba wasu daga cikin ayyukan da gwamnatin Kano ta yi, sannan ya gana da ƙabilun yankin kudancin kasar mazauna Kano da kuma wasu daga cikin malaman addinin Musulunci. Kafin zuwansa Kano, Tinubu ya je Jihar Katsina a makon da ya gabata, har ma ya bai wa 'ƴan kasuwar da gobarar babbar kasuwar jihar ta shafa tallafi. A na sa ran manyan ƴan siyasa daga jam'iyyar APC da masu riƙe da muƙamai daga sassan ƙasar daban-daban za su je Kano don halartar wannan biki. Sai dai mai bai wa Shugaba Muhammadu Buhari shawara kan harkokin siyasa, Sanata Babafemi Ojudu, ya wallafa a shafinsa na Facebook cewa rashin kyawun yanayi ya hana wasu manyan ƙasar da dama tafiya Kanon. Ya ce: ""Mataimakin shugaban kasa Farfesa Yemi Asinbajo, da Sakataren Gwamnatin Tarayya Boss Mustapha, da Kakakin Majalisar Wakilai Femi Gbajabiamila da ni kaina ba za mu samu damar halartar taron ba, sakamakon rashin kyawun yanayi da ake fama da shi a Kanon, dalilin da ya hana tashi da saukar jiragen sama."" Malam Kabiru Sufi, masanin kimiyyar siyasa ne a kwalejin share fagen shiga jami'a ta CAS a Kano, yana da ra'ayin cewa lallai da walakin goro a miya. A cewarsa: ''Bisa al'ada a birnin Lagos ake yin bikin, amma abin mamaki bana an kawo shi arewacin Najeriya kuma a Jihar Kano, wannan ya nuna tabbas akwai alaƙa ta manufar Tinubu ta yada manufar siyasarsa a shekarar 2023, a matsayin dan takarar shugaban kasa karkashin jam'iyyar APC mai mulki''. Ƴan adawa ke yaɗa jita-jitar ɓaraka tsakanin Buhari da Tinubu - Fadar Shugaban Ƙasa Kabiru Sufi ya ce tuni an samu masu sukar matakin, wadanda suke ganin a baya-bayan nan da aka yi ta samun tashin hankali a yankin Yarabawa Tinubu bai ce komai ba, alhalin yana daga cikin masu karfin fada-a-ji a yankin nasu. ''Wannan ya nuna lallai akwai siyasa a lamarin, kuma ana ganin zabar arewa da ya yi ba lallai 'yan arewa su yi murna da shi ba. ""To amma wasu na ganin an fito da muhimmancin Jihar Kano a siyasar arewacin Najeriya, tun da har Tinubu ya zabe ta a matsayin inda zai fara kada gogen share fagen siyasar 2023,'' in ji Sufi. Masu lura da al'amuran yau da kullum ba su yi mamakin goron gayyatar da aka bai wa Tinubu zuwa Kano ba, ganin cewa da ma Gwamna Abdullahi Umar Ganduje na goyon bayansa, sannan ba za a gane tasirin taron ta nasara ko akasin haka ba sai an kammala shi da kuma abin da ya biyo bayansa. Malam Kabiru Sufi ya ce ziyarar da Tinubu ke kai wa jihohin arewacin kasar duk na daga cikin zawarcin kuri'u na al'ummar yankin. Menene alfanu da nakasun wannan ziyara ga jam'iyyar APC? ''Hakan zai iya zama alfanu ko naƙasu ga ita jam'iyyar APC, musamman idan jam'iyyun adawa suka tsaya tsaf suka dubi al'amarin suka yi wani shiri da zai ba su riba, sabanin wanda APC ta fara yi a yanzu, to zai iya zama nakasu a gare ta,"" in ji Kabiru Sufi. ""Amma idan fara shirin da suka yi da wuri bai sa jam'iyyun adawa sun farga sun fara nasu shirin ba, to APC za ta ci nasara da gajiyar wannan taro da na murnar zagayowar ranar haihuwar shi Bola Ahmad Tinubu a jihar Kano. ""Amma su kansu jam'iyyun adawar za su iya amfani da damar da suke da ita, idan aka yi la'akari da rarrabuwar kawuna da barakar da ke cikin jam'iyyar APC, za su iya cin gajiyar hakan,'' in ji Kabiru Sufi. Me 'ƴan Najeriya ke cewa kan cikar Tinubu shekara 69? Tun da sanyin safiyar Litinin, shafin sada zumunta na Twitter ya ɗauki batun cikar Bola Tinubu shekara 69 a duniya baki ɗaya. An ƙaddamar da maudu'i mai taken #Jagaban da kuma #TinubuIsKey, aka yi ta amfani da su wajen taya shi murnar cika waɗannan shekaru. Wasu sun yi ta kuranta shi, wasu kuma suna amfani da damar wajen sukarsa. Akasarin saƙonnin da mutane ke wallafawa a shafin suna nuni ne da cewa suna fatan shi ne zai tsaya takarar shugaban ƙasa a 2023, kuma suna maraba da hakan. A hannu guda kuma, akwai masu rajin cewa bai kamata matasa su zaƙe wajen assasa batun tsayar da Tinubu takara a shkearar 2023 ba, inda suke cewa lokaci ya zo da ya kamata a bai wa matasa dama su karbi ragamar mulkin. Ga dai abin da wasu ke cewa: @apro_dawildcat ya ce: ""Barka da zagayowar ranar haihuwarka Asiwaju na Lagos, Jagaban ɗin Lagos, jagoran siyasar yammacin Najeriya: shugaban jam'iyyar APC, Asiwaju Bola Ahmed Tinubu. Allah Ya ja kwana. @IsaTochukwu ya ce: ""Asiwaju na Lagos. Allah Ya kara maka kwanciyar hankali, tausayi da nutsuwa a yanzu da koyaushe. #Jagaban@69! @Okeydegeneral ya ce: Ƴan Najeriya ba su san kansu ba! A watan Oktoban bara lokacin zanga-zangar #EndSARs, duk batun da ake yi ba yadda matasa da jam'iyyunsu za su mamaye zaɓukan 2023 ba ne. ""Bayan wata biyar sai ga shi ana ta zancen Jagaban Bola Ahmed Tinubu da Atiku da sauransu. Har yanzu ba mu koyi komai daga shekarar 2015 ba."""	https://www.bbc.com/hausa/rahotanni-56565038
technology	Masu bincike a Madagascar sun gano hawainiya mafi 'kankanta a duniya'	"Masana kimiyya sun ce sun gano dabba dangin kadangaru mafi kankanta a duniya - hawainiya wadda girmanta kamar na kwayar hatsi. Wata tawagar masana kimiyya na kasar Jamus da Madagasca ce ta gano biyu daga cikin irin wadannan hawainiyoyi masu kankanta a kasar Madagascar. Hawainiyar wanda namiji ne mai suna  Brookesia nana, ko nano-chameleon a turance, girmansa bai wuce  13.5mm ba. Hakan na nufin shi ne dangin kadangaru cikin nau'uka 11,500 da aka sani, a cewar gidan ajiye namun daji na the Bavarian State collection of Zoology da ke birnin Munich. Girmansa daga kansa zuwa jelarsa bai wuce 22mm (0.86in) ba. Macen ta fi girma inda ta kai kusan 29mm, a cewar gidan ajiye namun dajin, yana mai karawa da cewa har yanzu ba a gano sauran nau'ukan dabbobin dangin kadangaru ba, duk da  ""babban kokari da aka yi"". ""Ana samun wannan sabon nau'i na hawainiya ne kawai a dajin da ke arewacin Madagascar kuma tana fuskantar hatsarin shudewa daga doron kasa,"" a cewar mujallar kimiyya ta the Scientific Reports. Oliver Hawlitschek, wata masaniyar kimiyya da ke Cibiyar Tarihi da ke Hamburg, ta ce: ""Abin takaicin shi ne wannan nau'i na hawainiya yana fuskantar barazanar gushewa daga gurgusowar hamada, amma an sanya matakan tsaro a yankin don haka wadannan nau'uka za su tsira."" Masu bincike sun gano cewa hawaniyar tana cin gara da ke daji sannan tana buya tsakanin ciyayi don gudun kada hallitun da ke farautarta su ganta. A wani sako da ya wallafa a shafin intanet, Dr Mark Scherz, daya daga cikin masu binciken da suka gano nau'in hawainiyar, ya ce wannan ""wani al'amari ne mai ban sha'awa na misali mafi kankanta na zamantakewar halittu"". Ya kara da cewa dajin aka gano wadannan halittun na da nasaba sosai da sauran dazuzzuka a sassan daban-daban na arewa da wurin da aka gano. ""Don haka wannan nau'i na hawainiya ya sha bamban da irin wadanda aka saba ganowa mafi kankanta a kanakan tsibirai. Hakan na nufin wani abu yana bayar da dama ga wadannan hawainiyoyi su kasance kanana,"" in ji shi. A rahotonsu, masana kimiyya sun bayar da shawarar sanya hawainiya a cikin jerin halittun da ke fuskantar matukar barazanar gushewa daga duniya domin a taimaka wajen kare ta da kuma muhallinta."	https://www.bbc.com/hausa/labarai-55953287
