politics	Zaɓen 2023: Dokar zaɓe ba ta san da  mataimakin ɗan takara na riƙo ba - INEC	"Hukumar zaɓe mai zaman kanta ta Najeriya, INEC,  ta yi watsi da batutuwan da wasu ƴan takarar shugaban ƙasa suke yi cewa sun bayar da sunayen waɗanda suka zaɓa mataimaka a matsayin na riƙo. A yayin wata tattaunawa da gidan talabijin na Arise a Najeriya, ɗaya daga cikin Kwamishinoni na INEC, Festus Okoye ya bayyana cewa  babu batun ɗan takarar mataimakin shugaban kasa na riƙo a kundin tsarin mulki. Ya bayyana cewa tuni duka ƴan takarar shugaban ƙasa suka bayar da duka sunayen mataimakansu ga hukumar INEC, ba wai mataimaka na riƙo ba. Wannan lamari dai ya jawo ce-ce-ku-ce matuƙa inda jama'a da dama ke ganin me zai sa wasu daga cikin ƴan takara su aikata wannan kuskure. Ko a kwanakin baya sai da Tsohon Gwamnan Kano Rabi'u Kwankwaso ya shaida wa BBC cewa ya bayar da sunan wani mutum a matsayin mataimakinsa na riƙo ba na dindindin ba. Ya bayyana cewa nan gaba idan ya kammala tuntuɓa da sauran masu ruwa da tsaki za su tura wa hukumar INEC sunan mataimaki na dindindin wanda zai maye gurbin wanda suka saka a yanzu. Kazalika, a kwanakin baya an yi ta raɗe-raɗin cewa shi ma dan takarar shugaban kasa na APC, Bola Ahmed Tinubu ya bayar da sunan Kabiru Ibrahim Masari, wani dan siyasa dan asalin Jihar Katsina, a matsayin mataimakinsa na riƙo. Sai dai Tinubu ya fito ya bayyana cewa  an zaɓi Kabiru Masari ne, amma  zai iya sauka zuwa wa'adin da hukumar zaɓe ta bayar yana mai cewa hakan bai saɓa wa doka ba. Dangane da wannan tirka-tirka, BBC ta tuntuɓi Barrista Abubakar El Zubair wanda lauya ne a Najeriya domin ƙarin haske kan wannan lamari. A cewarsa, a dokar zaɓe ta Najeriya, babu wani batun mataimakin ɗan takara na riƙo amma Turancin da wasu ƴan takara suka yi amfani da shi ne ya kawo ruɗani sakamakon babu shi a kundin tsarin mulki ko kuma dokar zaɓe. ""Dokar zaɓe ta bayar da dama ga jam'iyyun siyasa su sauya mataimakansu na gwamna da na shugaban ƙasa, kuma suna da sati uku zuwa huɗu su yi sauyin, sauyi ne da zai tabbata, amma Turancin da aka yi amfani da shi Festus Okoye yake magana a kai, cewar irin wannan Turancin babu shi. ""Lokacin da ake so a yi sauyi, su waɗanda aka ba mataimakan shugaban ƙasa za su rubuto takarda, cewa ba su so su ci gaba da takarar mataimakin shugaban ƙasa, sai jam'iyya ta sauya sunayensu da na wasu waɗanda suke so su ba. 'Magana ta-ɓaci' Kan dai wannan lamari, BBC ta tambayi Barrista El Zubair, wani fitaccen lauya da ke birnin Kaduna, kan ko me zai faru idan ɗan takarar mataimaki ya ƙi yarda ya rubuta takarda  cewa ya janye musamman idan ana so a tursasa shi? A cewar Barrista Abubakar El Zubair, "" to magana ta-ɓaci ke nan, idan ya ce ba zai sauka daga wannan matsayi da aka ba shi ba, sai dai jam'iyyar ta tafi zaɓen a haka, saboda idan ya yi turjiya shikenan. ""Canjin dama a hannusa yake ba a hannun jam'iyya ba sai idan shi ya yarda, shi yasa suke zaɓar waɗanda suka yarda da su sai su ba shu da zummar cewa idan aka zo ba za a samu rikici ba,"" in ji Barrista El Zubair."	https://www.bbc.com/hausa/articles/cje2n2584q2o
sports	Kasuwar 'yan ƙwallo: Makomar Coutinho, Haaland, Traore, Puig, Wirtz, Di Maria	Aston Villa na da zaɓin saye ɗan wasan Brazil da ya tafi zaman aro Philippe Coutinho, sai dai Arsenal na sayon ta saye shi daga Barcelona a wannan kakar idan bai koma hannun Steven Gerrard ba baki daya. (Sport - in Spanish) Abin da Erling Braut Haaland ya fi bai wa fifiko a yanzu shi ne komawa kungiyoyin Sifaniya wato Real Madrid ko Barcelona, duk da cewa a wannan makon an yi ta samun rahotanni da ke danganta ɗan wasan na Borussia Dortmund mai shekara 21 da Manchester City. (Sport) ShugabanBarcelona Joan Laporta ya ce ƙungiyar ba zai kulla kwantiragi ba kan Haaland a wannan kakar muddin yarjejeniya na iya jefa ƙungiyar cikin matsalar kudi. (TV3, via Goal) Barcelona ta matsu ta dauko dan wasan gefe Adama Traore mai shekara 26 daga Wolves a wannan kakar, ta na kuma iya mika tayi kan Riqui Puig mai shekara 22. (90Min) Ƙungiyoyin Manchester United, Liverpool da Newcastle na farautar ɗan wasan Bayer LeverkusenFlorian Wirtz, sai dai ɗan wasan mai shekara 18 da ke buga tsakiya ya samu mumunan raunin da ka iya zaunar da shi har karshen kaka babu wasa. (Express) Dan wasan Argentina Angel di Maria ya yanke hukuncin barin Paris St-Germain a wannan kakar kuma yana iya komawa Benfica. (AS - in Spanish) Koci Mauricio Pochettino da ɗan wasan Faransa Kylian Mbappe na shirin jagorantar gagarumin shirin bakwana da Paris St-Germain a wannan kakar. (L'Equipe, via Mirror) Zinedine Zidane mai yiwuwa ya maye gurbin Pochettino a PSG, yayinda shi kuma ke harin Real Madrid. (El Nacional - in Catalan) Arturo Vidal ya shirya bankwana da Inter Milan kuma tuni Flamengo ta nuna zawarcinta kan ɗan wasan na Chile mai shekara 34. (Calciomercato - in Italian) Juventus ta shirya sayar da ɗan wasanta Adrien Rabiot, 26 da ke buga tsakiya a wannan kakar. (Calciomercato - in Italian) Roma na shirin gabatar da tayi kan ɗan wasan BarcelonaSergino Dest, mai shekara 21. (Corriere dello Sport - in Italian)	https://www.bbc.com/hausa/wasanni-60725484
religion	Bidiyon Ku San Malamaku tare da Sheikh Muhammad Khamis Muhammad	"An haifi Sheikh Muhammad Khamis a ranar Juma'a, 3 ga watan Satumbar 1976, ya kuma yi karatuttuka daban-daban tun daga karatun allo zuwa karatun islamiyya har zuwa karatun boko. Malamin ya haddace Al-Ƙur'ani tun yana kimanin dan shekara 14, yana da shekara 16 kuma ya shiga Islamiya mai suna Madarasatul Abdulaziz  Al-Islamiyya. Malamin da ya soma karantar da shi sunanshi Malam Muhammad Umar. Sheikh Khamis ya yi musabaƙar izifi daban-daban tun daga izu biyu har zuwa sittin da tafisiri. Ya bayyana cewa hardar Al-Ƙur'ani da ya yi a lokacin da yake da ƙuriciya ya bashi damar halartar kowane irin zaure da ake yin karatu. ""Na halarci zaure irin na Malam Abubakar Tureta, sannan kafin ya rasu, yana karantarwa kuma akwai zaƙaƙuran ɗalibansa waɗanda idan ba shi nan ko yana da uzuri su ke zama kan kujerarsa su karantar, kamar Malam Umar Jibril wanda aka fi sani da Al-Basawiy kuma na yi karatu sosai a wajensa, sannan akwai Muhammad Yahya shi ma na yi karatu a wajen shi,"" in ji shi."	https://www.bbc.com/hausa/labarai-59512459
business	Bukatun da Shugaba Buhari ya gabatar a taron zuba jari na Saudiyya	"Taron saka jari da ake gudanarwa a Saudiyya dama ce ta gabatar da buƙatu da cin gajiyar taron. Taron na kwana uku wanda aka soma a ranar Talata shi ne karo na biyar da Sarkin Saudiyya ke jagoranta a Riyadh babban birnin ƙasar. Taron ya ƙunshi shugabannin ƙasashe da manyan ƴan kasuwa masu saka jari da bankuna, kuma an bayyana cewa ya ƙunshi kamfanoni sama da 5,000 da ke halartar taron. Shugaban Najeriya Muhammadu Buhari yana cikin shugabannin duniya da suka halarci taron wanda aka yi wa take da 'zuba jari kan inganta rayuwar al'umma'. A cikin jawabin da ya gabatar a wurin taron, shugaba Buhari ya ce Najeriya ta mayar da hankali kan wasu manufofi na ci gaba, ta hanyar rage dogaro da arzikin fetir zuwa noma da fasahar sadarwa da kuma ma'adinai. Ƙasar kuma a cewar Buhari ta mayar da hankali kan yaƙi da rashawa da matsalar tsaro da sauyin yanayi da ƙaddamar da shirin tallafawa al'umma. Mai magana da yawun shugaban Najeriya Malam Garba Shehu a hirarsa da BBC game da taron ya ce ""taro ne da za a iya kiransa kamar tsarin bajekoli"" tare da bayyana wasu guzurin buƙatu da Najeriya ta gabatar a taron. A cikin jawabinsa, Buhari ya ce saka jari kan ilimi da fannin kiwon lafiya da  karfafa wa matasa da kawar da talauci da sauyin yanayi da samar da abinci, zai taimaka sosai wajen sake farfado da tattalin arzikin duniya bayan annobar korona. Kuma Malam Garba Shehu ya ce Buhari ya tallata wasu buƙatun Najeriya kamar man fetur wanda shi ne ƙashin bayan arzikin duniya. Ya ce wata biyu da suka wuce Buhari ya sa hannu a kan sabuwar dokar man fetur wacce ta ba da izinin saka jari daga kasar waje - ""ka saka jari ka kuma fita da shi cikin sauki yadda kaka so."" Ya ce an  sauye-sauye wajen haƙar ma'adinai inda aka sassuta doka don ba ƴan ƙasashe waje damar shiga su zuba jari. ""Yawan al'umma miliyan 200 baiwa ce da Allah Ya yi wa Najeriya, ita ma haja ce. Kuma a cikin ƴan Najeriyar akwai kwararru masu ilimi da za a yi sha'awar a zo don za a samu ma'aikata. Kamar aikin gona, irin dazuzuzuka da za a iya mayar da su zuwa gonaki. A bunkasa asibitoci da makarantu da tituna,"" ""Ka gina titi ka dinga karbar haraji don ka mai da kudinka."" ""Buhari duk ya tallata su kuma abin ya samu kyakkaywar karbuwa,"" in ji shi. Gwamnatin Najeriya ta ce taron fage ne na janyo hankalin duniya ga  abin da kuka mallaka da kuma kasuwar da kuke da ta ita Za a nuna wa duniya da masu kuɗi da masu saka jari su fahimci cewa lallai idan ka shigo Najeriya da abu za ka samu riba mai yawa saboda irin dumbin al'umma da arziki da kasar ke da shi, a cewar Garba Shehu. Ya ƙara da cewa za a nuna wa masu saka jari kan abubuwan da ke bukatar a shigo da jarin a kafa kamfanoni don a ci moriyarsau a amfana daga kowanne ɓangare. Sai dai Najeriya na cikin ƙasashe da ke fama da matsalar tsaro inda ƴan Boko Haram suka shafe shekaru sama da 10 a shiyar arewa maso gabashi da kuma ƴan bindiga masu fashin daji da satar mutane a arewa maso yammacin Najeriya da matsalar ƴan a ware a kudancin Najeriya. Matsalar tsaro na iya zame wa yan kasashen waje barzanar zuwa zuba jari a Najeriya - kuma shi kansa Buhari ya ce matsalar tsaro barazana ce ga zuba jari a Najeriya."	https://www.bbc.com/hausa/labarai-59053304
religion	Yadda mahaifiyar Deborah ta ji da kisan 'yarta kan zargin ɓatanci ga Annabi	"Wasu mutane da aka kashe 'yan uwansu sakamakon zargin sun yi ɓatanci ga addinin Musulunci sun bayyana wa BBC irin halin da suke ciki bayan kisan nasu. Alheri Emmanuel, mahaifiyar matashiya Deborah Samuel - matashiyar da aka kashe a Jihar Sokoto - ta ce ta ji kamar an soka mata mashi lokacin da ta samu labarin kisan 'yar tata. Ita ma Zainab Ahmed, matar wani ɗan banga da aka kashe a Abuja bisa zargin ɓatanci ga Annabi Muhammadu S.A.W. ta ce ba za ta yafe wa waɗanda suka kashe mijin nata ba. Cikin wannan bidiyo na musamman, duk da malaman addinin Musulunci sun jaddada cewa ""duk wanda aka tabbatar ya yi ɓatanci ga Annabi hukuncinsa kisa ne"", amma sun ce ba mutanen gari ne za su zartar da hukuncin ba."	https://www.bbc.com/hausa/articles/cv2md02wvkko
business	Coronavirus: Duniya za ta shiga matsin tattalin arziki mafi muni cikin shekara 90	"Tattalin arzikin duniya zai ragu da kashi uku cikin 100 a wannan shekarar, yayin da na kasashe a fadin duniya ke raguwa cikin saurin da ba a taba ganin irinsa ba a baya-bayan nan, in ji Asusun Bayar da Lamuni na Duniya, IMF. IMF ya bayyana durkushewar tattalin arzikin a matsayin mafi muni tun matsin tattalin arziki da aka shiga a duniya a shekarun 1930, wato Great Depression. Asusun ya ce annobar ta jefa duniya cikin ""rikicin da bai da tamka"". Sannan ya kara da cewa idan annobar ta dade ba a shawo kanta ba, gwamnatocin kasashe da manyan bakunan kasashe za su wahala kafin su farfado da tattalin arzikin. Gita Gopinath, babbar jami'a a bangaren tattalin arziki a IMF ta ce matsin da aka shiga zai wawure dala tiriliyan tara daga arzikin da aka samar a duniya a shekara biyu masu zuwa. Yayin da rahoton IMF kan tattalin arzikin kasashen duniya ya yabi kasashe kamar Burtaniya da Jamus da Japan da Amurka kan matakan gaggawa kuma masu ma'ana da suka dauka, rahoton ya ce babu kasar da za ta gujewa durkushewar tattalin arziki. Yana sa rai tattalin arzikin duniya zai gyaru da kashi 5.8 cikin 100 a shekara mai zuwa idan annobar ta bace a watanni shidan karshe na shekarar 2020. Ms Gopinath ta ce dakatar da ayyuka da kasuwanci da zirga-zirga cik mummunar alama ce ga masu kirkirar manufofi, wadanda ke fuskantar ""rashin tabbas kan girmar barnar da annobar za ta yi."" ""Ana sa rai za a samu sauki a shekarar 2021,"" in ji Ms Gopinath. ""Amma yawan arzikin da aka samar zai zauna a matsayin da yake kafin annobar ta bullo, kuma babu tabbas kan yadda karfin tattalin arzikin zai kasance idan ya habako. Ms Gopinath ta ce a karon farko tun bayan matsin tattalin arziki na shekarun 1930, ana sa rai kasashen da suka ci gaba da masu tasowa duk za su fusknaci durkushewar tattalin arziki. IMF ta yi gargadin cewa ba za a ga ci gaba a tattalin arzikin kasashen da suka ci gaba ba sai a kalla nan da shekarar 2022. Ana sa rai tattalin arzikin Amurka zai ragu da kasha 5.9 cikin 100 a wannan shekarar, kuma wannan shi ne durkushewarsa mafi girma a shekara tun 1946. Haka kuma, ana sa rai rashin aikin yi a Amurka zai karu da kashi 10.4 cikin 100 a wannan shekarar. Ana sa rai a shekarar 2021 tattalin arzikin zai dan farfado, kuma a Amurka zai farfado ne da kashi 4.7 cikin 100. Ana sa rai tattalin arzikin China zai karu da kashi 1.2 cikin 100 kawai a wannan shekarar, kuma shi ne girman tattalin arzikinta mafi karanci tun 1976. Karin labaran da za ku so ku karanta Australiya za ta fuskanci durkushewar tattalin arzikinta tun 1991. IMF ta yi gargadin cewa akwai ""munanan hadurra kan yadda tattalin arzikin zai zama"". Ya ce idan annobar ta dade ba a shawo kanta ba kuma aka sake samun barkewarta a 2021, wannan zai sake rage kashi 8 cikin 100 na gaba daya arzikin da aka samar a duniya. Asusun ya ce wannan na iya jawo wa kasashen da suke da yawan bashi mummunan koma baya. Ya ce masu zuba jari ba za su so su sake bai wa wadannan kasashe bashi ba, kuma wannan zai kara dagula lamarin. IMF ya kara da cewa: ""Wannan karin da za a samu a farashin kudin da ake arowa na iya hana kasashe da yawa samar da kudin rage radadin talauci da ake so a samar. Yayin da dakatar da ayyuka cik zai matsa wa ayyukan kasuwancin kasashe, IMF ya ce killacewa da barin tazara na da matukar muhimmanci. Ya ce: ""Matakan hana yaduwar cutar na da muhimmanci kuma za su bai wa asibitoci da cibiyoyin lafiya damar iya kula da marasa lafiya kuma suna taimakawa wajen samar da hanya nan da nan da za a dawo da ayyukan kasuwanci. IMF ta jera hanyoyi hudu mafi muhimmanci na shawo kan annobar. Ya yi kira da a kara sa kudi a bangarorin kiwon lafiya, a bai wa ma'aikata da sana'o'i tallafin kudi, babban bankin kasa ya ci gaba da ba da tallafi sannan a samu tsari mafi dacewa wajen habako da tattalin arzikin. Ya bukaci kasashe su yi aiki tare wajen ganowa da rarraba magunguna da riga kafi. Asusun ya kara da cewa kasashe masu tasowa da yawa za su bukaci a biya masu basukansu a watanni da shekaru masu zuwa."	https://www.bbc.com/hausa/labarai-52295454
religion	Ku San Malamanku tare da Ustaz Aliyu Rasheed Makarfi	"Latsa hoton sama domin kallon bidiyon Wani Malamin addinin Musulunci a jihar Kaduna da ke Najeriya Ustaz Aliyu Rasheed Makarfi ya ce babban abin da ya so shi ne haɗin kan al'umma, musamman da waɗanda ba musulmai ba. Ya ce mutunta kowa da addininsa da mutuncinsa zai taimaka kwarai da gaske wajen samun ji gaba. ""Na farko a addinance, addinin da nake yi na Musulunci idan zama ya haɗa mu da waɗanda ba Musulmai ba akwai buƙatar zaman lafiya,"" in ji Sheikh Aliyu. Ya ƙara da cewa babu abin da yake faranta masa kamar ganin iyali suna zaman lafiya a tsakaninsu, ko ganin abota ta amana. ""Babu abin da ke yi min daɗi illa ganin jama'a sun taso cikin haɗin kai, duk lokacin da na ga wani ya zo ya wuce da iyalinsa ko a kasuwa ko a shago ko masallaci, a rai na na kan yi farin ciki har na kan yi musu addu'a,'' in ji malamin. Amma kuma akwai abubuwa da malamin ya ce suna ɓata masa rai, kamar ya ga ana cin mutuncin wani, ko ana son tozarta wani. An haifi Sheikh Aliyu Rashid Makarfi kimanin shekaru arba'in da biyar da suka gabata a garin Makarfi a Karamar Hukumar Makarfi da ke jihar Kaduna. Sheikh Aliyu ya taso ne a gaban mahaifinsa, kuma shi ne na 11 a ɗakin mahaifiyarsu. A hirarsu da BBC, malamin ya kuma bayyana cewa ya fara karatu a makarantar firamare ta garin Makarfi daga nan bayan ya kammala ya tafi kwalejin Barewa ta Zaria, kuma sai Kwalejin Ilimi ta Nuhu Bamalli da ke garin Zaria kafin ya zarce zuwa Jami'ar Bayero ta Kano. Amma kuma in ji malamin yanzu ya karkata ne wajen al'amuran da suka shafi almajiranci na karantar da addini kasancewar mahaifinsa malam Adamu Rashid shi ne malamin makarantar Islamiyya ta farko a garin Makarfi. ""Wannan ya saka min zumma tun da na taso sai na ga ina da sha'awar abin da mahifinmu ke yi, don haka sa na mayar da hankali wajen karatu tun daga wajen mahaifin nawa,"" in ji Ustaz Aliyu. Ya kuma kara da cewa ya kuma yi karatu a wurin malamai da dama da suka haɗa da marigayi Sheikh Usman Ahmed Kauru da marigayi na'ibin Zazzau Alkali Malam Yahuza, da Malam Alu na Zaria. Sannan ya ce lokacin da yake zaune a Kano ya yi karatu a wurin Malam Mohammed Sani Kaka da marigayi Sheikh Abubakar Imam Ikara da Shiekh Yusuf Sambo Rigachikun. Ya kuma ya yi karatu a Zaria a gaban Malam Adam Auwal Albani da kuma Farfesa Nuhu Tahir Tajuddeen. Malamin ya bayyana cewa ya fi son tuwon masara wanda yanzu ana sarrafa shi zuwa samanbita da tuwan dawa da na shinkafa, amma idan bai samu ba ya kan ci shinkafa. ""Da yake na yi zaman karkara, ina cin danwake, ina cin gauda, ina cin rummace, ina cin gwarangwaje, ina cin gaigaya, da sauran cimakar karkara,"" in ji shi. Ta fannin wasanni kuma malamin ya ce yana yin wasa tare da yaransa, yana buga kwallo a cikin gida, kuma yakan fita gudu yana motsa jiki. Malamin ya bayyana cewa yana da burin ganin cewa yana rokon Allah ya azurta shi da kudi na halal da zai gina masallaci da makaranta babba ya kuma danƙa shi zuwa ga al'umma. ""Abu na biyu kuma babban abin da nake buri shi ne zuri'ata, akwai 'ya'yana, akwai 'ya'yan kannena da na abokaina da marayu ina son kafin Allah ya ɗauki rai na, ia ga cigabansu da ɗaukakarsu, idan kuma hakan bai yiwu ba, Allah ya daukaka su bayan rai na,"" in ji shi."	https://www.bbc.com/hausa/labarai-59832780
sports	PSG ta kammala mallakar Nuno Mendes daga Sporting	Nuno Mendes ya saka hannu kan kwantiragin kaka hudu a Paris St Germain, bayan da ta biya kunshin yarjejehiyarsa a Sporting. Tun farko dan kwallon ya koma buga wasannin aro a PSG a bara daga Sporting Lisborn, lokacin da Lionel Messi ya bar Barcelona da Sergio Ramos ya hakura da Real Madrid ba don yana so ba. Bayan da Messi da Ramos suka kasa taka rawar gani a kakar farko a PSG, shi kuwa Mendes ya yi abin azo-a-gani a kungiyar da ta dauki league 1 na kakar nan. Dan kwallon tawagar Portugal ya yi wasa 37 a dukkan karawa a PSG har 27 a Ligue 1 da wasa 18 da aka fara da shi a cikin fili - wanda ya samu damar-makin cin kwallaye sau 19.	https://www.bbc.com/hausa/wasanni-61648476
sports	AFCON 2023: Za a raba jadawalin shiga gasar kofin Afirka ranar Talata	Hukumar kwallon kafa ta Afirka, Caf za ta yi bikin raba jadawalin neman gurbin shiga gasar kofin nahiyar Afirka da za a yi a 2023. Code d'Ivore ce za ta karbi bakuncin wasannin da za a yi a 2023, bayan da Kamaru ta gudanar da gasar 2020, wadda aka yi a 2022. Hakan ya biyo bayan cutar korona da ta kawo tsaiko, sannan aka yi gasar tsakanin Janairu zuwa Fabrairun 2022. Za a raba jadawalin ne a Afirka ta Kudu ranar Talata, inda Thomas Mlambo zai gabatar tare da Solomon Kalou da kuma Lucas Radebe. Kasashe 48 ne za su fara fafatawa zuwa zagaye na biyu, inda za a raba su zuwa tukunya hudu, kowacce kasa za ta kasance a gurbin da take da shi a jadawalin Fifa, wanda ta fitar ranar 31 ga watan Maris din 2022. Daga nan za a raba kasashen rukuni 12 dauke da hur-hudu kowanne, wato daga A zuwa L, inda duk wadda ta yi ta daya da ta biyu za ta  kai gurbin buga gasar kofin nahiyar Afirka da Code d'Ivoire za ta karbi bakunci a 2023. Itama Code d'Ivoire za ta kasance cikin kasashen da za a raba jadawalin da ita, duk da tuni ta samu gurbin buga gasar tunda ita za ta karbi bakuncin wasannin. Kenya da Zimbabwe wadanda Fifa ta dakatar suna daga cikin wadanda za a raba jadawalin tare da su, sai dai kuma idan nan da mako biyu ba a cire takunkumin da aka dora musu ba, za a fitar da su daga buga wasannin neman gurbin shiga kofin Afirka. Saboda haka a rukunin da suke za su zama uku kenan, kuma ba za a saka su waje daya ba. Za a fara wasannin cikin watan Yunin 2022. Rabon da Code d'Ivoire ta karbi bakuncin gasar tun 1984. Senegal ce ke rike da kofin Afirka, wanda ta lashe a Kamaru, bayan da ta yi nasara a kan Masar.        3 Abdel Khalek Tharwat Street, El Hay El Motamayez, P.O. Box 23 6th October City, Egypt - Tel.: +202 38247272 Se désinscrire/unsubscribe	https://www.bbc.com/hausa/wasanni-61141415
entertainment	Maryam Yahaya: Tauraruwar fina-finan Kannywood ta ce maleriya da taifod ne ke damunta	"Tauraruwar fina-finan Kannywood Maryam Yahaya ta bayyana cewa tana fama da cutar maleriya da taifod, shi ya sa aka ji ta shiru ba ta fitowa a fina-finai. Ta bayyana haka ne a wata hira da BBC domin yin watsi da rahotannin da ke cewa tana fama da cutar da ta danganci jifan aljanu. Wakilin BBC a Kano, Khalifa Shehu Dokaji, wanda ya yi tafiyayya zuwa gidan su tauraruwar, ya ce ta yi matukar ramewa. Sai dai a cewarta: ""Na yi taifod da maleriya ne, ina kan yi. Amma yanzu jiki Alhamdulillahi, na samu lafiya."" Da take amsa tambaya kan raɗe-raɗin da ke cewa an yi mata asiri ko jifa, tauraruwar ta ce ""gaskiya ni ba jifa ba ne ya dame ni don ban ma san shi ba."" Ta ce ta kwashe fiye da wata ɗaya tana fama da rashin lafiya, tana mai cewa yanzu tana samun sauki sosai, ""sai dai rashin ƙwari kuma dama sai a hankali ƙwari yake zuwa."" A nasa bangare, mahaifin tauraruwar, Alhaji Yahaya Yusuf, ya ce 'yar tasa ta kwana biyu a kwance kuma sun kai ta asibiti. Ya kara da cewa yanzu suna haɗa maganin asibiti da na Hausa, inda ya sa malaman addini suke yi mata addu'a. Ya ce tabbas maleriya da taifod ne ke damun 'yarsa yana mai yin watsi da masu yaɗa jita-jitar cewa an jefi 'yar tasa. Matashiyar tauraruwar mai shekara 20 ta fara haskawa ne a cikin fim dinta na farko mai suna Mansoor. Wasu labaran da za ku so ku karanta:"	https://www.bbc.com/hausa/labarai-57987744
health	Shin da gaske cutar kyandar biri ta barke a Najeriya?	Cibiyar da ke yaki da yaduwar cututtuka a Najeriya ta karyata jita-jitar da ake yadawa kan cewa cutar kyandar biri wadda aka fi sani da ''monkey pox'' ta mamaye wasu manyan jihohin Najeriya. Cibiyar ''Nigeria Centre for Disease Control'' ta bayyana cewa suna ganin labarai kamar ''kyandar biri ta shiga Lagos da Ribas da Akwa-Ibom'' amma duka ba gaskiya bane kamar yadda hukumar ta bayyana. Ta kuma ce tun bayan da aka samu bullar wannan cuta a Najeriya a 2017, tun daga lokacin ta ke sa ido kan kanana-kananan bullar cutar nan da can a fadin kasar. Ta kuma yi karin haske inda ta ce ''cibiyar na bincike da kuma tattara alkaluman masu kamuwa da cutar a duk mako a fadin Najeriya. Muna nan muna kokarin shaida wa ma'aikatanmu na jihohi da su rinka kokarin sanar da mu idan aka samu bullar wannan cuta.'' Cibiyar ta ce a rahoton da ta ke wallafawa duk mako a shafinta na intanet, mutum uku ne ake zargi da kamuwa da cutar - biyu a Legas, daya a Ribas, kuma babu wanda ya mutu. Hukumar Lafiya Ta Duniya (WHO) ta ce cutar kyandar biri cuta ce da ta fi addabar yammacin Afirka da kuma tsakiya. A cikin sanarwar da cibiyar ta fitar a ranar Juma'a, ta gargadi kafafen yada labarai da su guji saurin yada labaran da ba gaskiya ba. Cibiyar da ke yaki da yaduwar cututtuka a Najeriya ce dai hakkin bayyana dokar ta baci kan cututtuka ko kuma ta bayyana barkewar cuta a kasar.	https://www.bbc.com/hausa/labarai-50107933
