health	Ba ma son ganin kowa a kan titunan Daura - Masari	"Gwamnatin jihar Katsina ta ba da sanarwar kulle garin Daura da kewaye ba shiga ba fita, a wani mataki na dakile bazuwar annobar coronavirus, wadda ta addabi duniya. ""Daga safiyar Asabar, ba ma son mu ga kowa a kan titunan garin Daura da kuma kauyukan da ke karkashin karamar hukumar,"" in ji Gwamna Aminu Masari. Matakin ya zo ne bayan samun mutum uku da suka kamu da cutar a jihar Katsina, kuma suna da alaka da wani likita da ya rasu bayan sakamakon kamuwa da cutar mai sarke numfashi. Gwamnan jihar Katsina Aminu Bello Masari yayin wani taron manema labarai ranar Juma'a bai bayyana ko tsawon kwana nawa ne matakin na kulle Daura zai dauka ba. Ya ce: ""maganar nan da nake muku yanzu haka ana kan hanyar kawo su Katsina, babban asibiti na tarayya inda ake da cibiyar kebe marasa lafiya, inda za a killace su kuma ana ci gaba da ba su magani. Gwamna Masari ya ce sun yi shawara da jami'an tsaro da kuma kwamitin kar-ta-kwana mai yaki da cutar coronavirus na jihar da sauran jami'an lafiya wadanda suka amince a rufe garin Daura. ""Duk garin da ya gwada ko karamar hukumar da ta gwada akwai wannan (cuta), to za mu rufe ta kaf, kamar yadda muka rufe Daura a yau,"" in ji gwamna. Ya ce kwamitin kar-ta-kwanan zai tantance kantunan sayar da magani kamar guda uku da kantunan sayar da hatsi uku wadanda mutanen garin Daura za su rika zuwa cefane a lokacin wannan al'amari. Har wa yau, gwamnatin Katsina za ta tallafa wa mutanen Daura a lokacin da wannan doka za ta yi aiki., a cewar Masari."	https://www.bbc.com/hausa/labarai-52251302
health	Labaran matan da suka cinnawa kansu wuta saboda “muzgunawar maza”	Labaran matan da suka cinnawa kansu wuta saboda “muzgunawar maza” Mata a Iraƙi na fuskantar ƙaruwar cin zarafi a gidajen aure da wajen ƴan uwa. Matsalolin cin zarafi sunƙaruwa da kashi 125 cikin 100 a shekarar 2020 da 2021, a cewar Majalisar Ɗinkin Duniya. A yankin Kurdistan na ƙsar, matan da ke samun kansu cikin cin zarafi a gidaje kan ɗauki matakain ƙona kansu da zummar mutuwa a matsayin hanya ɗaya da suke ganin ita ce mafita. Gwamnatin yankin Kurdistan ta yi ƙoƙarin magance matsalar cin zarafin mata dar muzguna musu da ake yi, amma da yawansu kan kasance cikin haɗari. An bai wa BBC wata dama da ba a cika samu ba ta shiga manyan asibitocin jinyar masu ƙuna a Kurdistan da ke iraƙi, inda mata da dama suk mutu sakamakon ƙona kansu da suka yi.	https://www.bbc.com/hausa/articles/c10d14jrrp0o
technology	Dokar Kare sirrin bayanai ta BBC	Amincewar da kuka yi mana na da matukar muhimmancin a wurinmu. BBC ta kudirin aniyyar kare dukkan bayanan da suka shafe ku, a duk lokacin da kuke hulda da wasu abubuwa na BBC. Yana da matukar muhimmanci ku karanta wadannan bayanai domin sani yadda za mu yi mu'amula da bayananku. Wannan dokar ta kare sirrin bayanan na bayyana yadda za mu karbi bayananku da kuma yadda za mu yi amfani da bayanan a lokaci da kuma bayan huldarmu da ku, bisa doron dokar kare bayanan sirri. Hikayata gasa ce ta ƙagaggun gajerun labarai wadda ke samar da dama ga mata marubuta, waɗanda ba su ƙware ba da kuma ƙwararru, don nuna fasaharsu da ba da damar karanta labaransu a harshen Hausa. Dole ne labaran da za a shiga su kasance ƙagaggun labarai kan wani jigo. Mata biyu na iya haɗa gwiwa su shigar da labari guda amma ka da su haura mata biyu, kuma labari ɗaya kacal mace za ta iya shigarwa. Wata tawagar alƙalai waɗanda ba ma'aikatan BBC ba ne, bisa jagorancin ma'aikacin BBC za ta zaɓi gwarzuwa ɗaya da labarinta ya yi nasarar yin na ɗaya sannan za su zaɓi ta biyu da ta uku. Kafin tura wa alƙalan labaran don tantancewa za a cire duk wani bayani dangane da mai shiga gasa kuma ba za a aika masu ko wane irin bayani kan masu shiga gasar ba. Waɗanda su ka yi nasara za su samu kyautar kuɗi da lambar yabo: wannan ya ƙunshi $2,000 ga wadda ta zo ta ɗaya, $1,500 ga wadda ta zo ta biyu, $1000 ga wadda ta zo ta uku. BBC za ta watsa labarai 12 da alƙalan suka ce sun cancanci yabo da guda ukun da suka yi nasara a tasharta ta BBC Hausa. Duka labaran da aka naɗa za su ƙunshi sunan labarin da sunan marubuciyar. Ma'aikatan BBC Hausa za su karanta labaran da suka cancanci yabo cikin mako 12. Waɗanda suka yi nasara za su karanta labarinsu gaba ɗaya da kansu a ɗakin gabatar da shirye-shirye na BBC. Za a watsa karatun labaran da aka naɗa a tashar BBC Hausa da tashoshin rediyo na abokan hulɗarmu Freedom Rediyo da Rediyo Gotel da Rima Rediyo da ma wasu. Za a wallafa kuma a watsa muryoyin marubutan da labaransu suka yi nasara a gasar da aka naɗa da sunan marubutan, a shafin BBC Hausa na intanet da BBC Hausa Rediyo da shafukan sada zumunta na BBC kamar Twitter da Instagram da Facebook. BBC ka iya gayyatar waɗanda suka yi nasara da wasu waɗanda labaransu suka cancanci yabo, domin halartar taron bayar da kyaututtuka a Abuja. BBC za ta ɗauki nauyin kuɗin mota da masauki wanda bai wuce ƙima ba. Waɗanda aka gayyata su ne ke da alhakin nema wa kansu izinin shiga Najeriya. Tawagar BBC Hausa za ta karɓi bayananku don Gasar Gajerun Ƙagaggun Labarai ta Mata. Tawagar BBC Hausa za ta amsa bayanaku ta adireshin email da shafin inatnet da BBC ke amfani da shi. Idan muka watsa labarinki, yana iya kasancewa a shirye-shiryen da ake adanawa a intanet kuma ana iya amfani da labarin naki a shirye-shiryenmu na gaba. Domin karin bayani dangane da yadda BBC ke alkilta bayananmu za ku iya ziyartar shafin da ke bayani dangane da yadda muke amfani da abokan huldarmu https://www.bbc.com/contributors/working-for-the-bbc/privacy-notice Sai shekarunki sun kai 18 ko sun haura za ki iya shiga gasar. BBC za ta karɓa kuma ta yi aiki da bayanan da suka shafe ki waɗanda kika aiko mana. Dole ne a aika duka labarai ta hanyar manhajar uploader da ke (Yadda za a shiga gasar) wanda ke kan shafinmu na bbchausa.com kuma dole ne bayanan su ƙunshi waɗannan dangane marubuciya/marubuta: •Suna •Lambar Waya •Adireshin email •Adireshin gida (gari ko ƙauye) •Shekarunki •Taƙaitaccen tarihinki •Taƙaitaccen bayani kan labarinki Idan aka zaɓi labarinki, BBC na da ikon buƙatar ganin shaidar shekarunki don tabbatar da cewa kin cika sharuɗɗan shiga gasar. Idan aka buƙaci ganin shaidar shekarunki, za a yi haka ne ta hanyar gani da ido. BBC ce 'sarrafa bayanai' da kika aiko. Hakan na nufin cewa BBC za ta yanke shawarar abin da za ta yi da bayananki, da hanyoyin da za a yi amfani da su. Don guje wa shakku, za a karɓi bayananki kuma a yi amfani da su bisa dalilin da aka tsara a bayanan tsare sirrinki kawai. BBC ta dogara ne kan buƙatunta da ke bisa ƙa'ida a matsayinta na kafar yaɗa labarai don sarrafa bayananki wajen shiga gasar, da bibiyar gawarazan gasar da mu'amala da masu bibiyarmu. A wajen dogaro da buƙatunta da ke bisa ƙa'ida don sarrafa waɗannan bayanan, BBC za ta daidaita buƙatunta wajen tallata wannan gasa tare da kare bayanan sirrinki. Idan kika shiga gasar, BBC za ta aika bayananki zuwa wani shafin sarrafa bayanai da BBC ta saba amfani da shi, wanda kuma zai samar wa BBC wurin da zai taimaka mana mu gudanar da gasar. Muna tabbatar da cewa shafin da za mu yi amfani da shi yana da ƙa'idojin da suka dace wanda zai tabbatar da cewa ba za su iya yin komai da bayananki ba sai idan mun ba su umarnin yin haka. Ba za mu yaɗa bayananki da wani ko wasu ba har sai idan doka ta ba mu izinin yin haka. Idan labarin da kika aiko bai yi nasara ba, BBC za ta adana bayananki da abin da kika aika har tsawon wata shida daga ranar da kika ɗora bayanan, daga nan kuma za a goge shi. Idan aka sanya labarinki cikin waɗanda suka kai mataki na gaba ko kuma ke ce kika yi nasara, za mu adana bayananki har tsawon shekara biyu bayan an rufe gasar. Idan kika kai mataki na gaba ko kuma ke ce tauraruwar gasar, sannan muka wallafa labarinki tare da sunanki, to BBC za ta adana bayananki har abada saboda dalilai na aiki. Za a adana bayananki a tarayyar Turai da Birtaniya da Amurka. Kina da haƙƙoƙi ƙarƙashin dokokin kare bayanai. Za ki iya neman kwafin bayananki da BBC ta adana. Kina da ƴanci ki nemi a goge bayananki da muka karɓa sai dai akwai iyakoki da togaciya kan wannan ƴancin, abin da zai sa BBC ta ki amincewa da buƙatarki. A wasu lokutan, kina da ƴanci ko taƙaita ci gaba da amfani da bayaninki ko ki nuna rashin amincewa da ci gaba da neman bayananki. Kina da ƴancin ki nemi mu tura miki bayananki ko wata hukumar, a wasu lokutan. Za ki iya tuntubar Ofishin Kare Bayanai a Data Protection Officer idan kina da tambaya, idan kuma kina so ki samu ƙarin bayanai a kan ƴancinki, ziyarci sashin Bayanan Sirri na BBC da Ka'idojin Kare Bayanai http://www.bbc.co.uk/privacy. Idan kina da wata damuwa kan yadda BBC take mu'amala da bayananki na sirri, za ki iya bayyana damuwarki da hukumomin da suke sa ido a Birtaniya, wato Ofishin Kula da Bayanai (ICO) https://ico.org.uk/. Za mu sabunta waɗannan bayanai idan akwai gagarumin sauyi kan yadda muke amfani da bayananki.	https://www.bbc.com/hausa/game-da-mu-61342735
business	Waiwaye: Ƙara yawan kuɗin da za a dinga cirewa daga banki, Majalisar dattawa ta ƙi amincewa da kasafin kuɗin 2023	"Wannan maƙala ce da ke duba muhimman batutuwan da suka faru a Najeriya cikin makon da ya gabata Babban bankin Najeriya CBN, ya yi amai ya lashe kan matakinsa na ƙayyade yawan kuɗaɗen da za a dinga cirewa daga bankuna a ƙasar. A wata sanarwa da ya fitar ranar Laraba, CBN ya ce a yanzu ɗaiɗaikun mutane za su iya cire kuɗi har naira 500,000 yayin da kamfanoni kuma za su iya cire naira miliyan biyar duk mako. Wannan sabon matakin na CBN na zuwa ne kwana 15 bayan fitar da dokar farko da ta ƙayyade yawan kuɗaden da mutane za su iya cirewa daga bankunan a duk sati. Karanta cikakken labarin a anan Majalisar dattawan Najeriya ta ƙi amince wa da kasafin kuɗin ƙasar na 2023 da ta shirya amince wa da shi a yayin zaman majalisar na ranar Alhamis ɗin da ta gabata. Shugaban Majalisar dattijan ƙasar Ahmad Lawan ya ce rashin amincewa da kasfain kuɗin ya biyo bayan kura-kurai ne da kasafin kuɗin ke ƙunshe da shi, daga ɓangaren gwamanti. ""Sakamakon wasu ƙalubale, ba za mu iya karɓar rahotan kwamitin kula da kasafin kuɗin ƙasar ba saboda, ya zo majalisa da matsaloli''. Ga cikakken labarin a nan Babbar Kotun Tarayya a jihar Kano da ke arewacin Najeriya ta yanke hukuncin cewa Muhammad Abacha ne ɗan takarar gwamnan jihar a ƙarƙashin jam'iyyar PDP. Mai Shari'a AM Liman ne ya yanke hukuncin a ranar Alhamis ta manhajar Zoom kasancewar baya gari. Ya ce ɓangaren da suka gudanar da zaɓen fitar da gwani a Lugard Road shi ne halastaccen zaɓen ɗan takarar gwamnan na jam'iyyar PDP, kasancewar jami’an hukumar INEC sun halarci wurin tare da sanya ido kan zaben. An dai samu rarrabuwar kawuna a lokacin gudanar  da zaɓen fitar da gwani na jam'iyyar a jihar, lamarin da ya sa aka samu ɓangarori biyu waɗanda ke ikirarin yin halastaccen zaɓen fitar da gwani Saudiya ta dawo wa da Najeriya adadin kujerun da ta saba ba ta sama da 95, 000, na mutanen da za su je aikin Hajji a 2023. Hukumar ƙasar ta Saudiya ta bayyana hakan ne a wata ganawa da hukumar alhazan Najeriya, a ranar Laraba. Suwaiba Ahmad, mai magana da yawun hukumar alhazan Najeriya ce ta tabbatar wa BBC matakin na Saudiya. ""Saudiya ta dawo wa da Najeriya kujerun da ta saba ba ta 95, 000, wanda a baya ta rage suka koma, 45,000 saboda matsalar cutar korona''. Shugaba Muhammadu Buhari ya sanar da aniyar gwamnatinsa ta inganta aiki da rayuwar 'yan sandan Najeriya. Sanarwar da mai magana da yawun shugaban, Malam Garba Shehu ya fitar, ta ce shugaba Buhari ya sanar da hakan ne a makon da ya gabata, lokacin da ya karɓi rahoto kan rundunar 'yan sandan ƙasar na shekarar 2021, da karɓar ƙudurin kasafin kuɗin 'yan sanda na baɗi. Sanarwar ta ambato shugaba Buhari na cewa: “wannan gwamnatin ta sanya walwala da inganta aikin 'yan sanda a sahun gaba, kuma hakkinta ne ta kawo sauye-sauye masu inganci a aikinsu. Ga cikakken labarin a nan"	https://www.bbc.com/hausa/articles/cyxwr7j02vpo
politics	Buhari ne ya bayar da umarnin cire Sarki Sanusi - Kwankwaso	"Tsohon gwamnan Kano, Injiniya Rabi'u Musa Kwankwaso ya dora alhakin tube Sarkin Kano, Muhammadu Sanusi na biyu kan shugaba Muhammadu Buhari. Jigon adawar,  ya ce ""shugabannin gwamnati na Kano su da kansu ne ke cewa umarni aka ba su (su tube sarki Sanusi). Shi ya ba su umarni"". Ya yi zargin cewa sabanin maganganun da makusantan Buhari ke cewa, shugaban ba ya tsoma baki cikin irin wadannan rigingimu, ""sai dai musamman mu nan a Kano yadda muke gani (Buhari) yana hargitsa inda yake sa hannu"". ""Shugaba Buhari yana tsoma hannu cikin al'amuran jihar Kano"", in ji Kwankwaso. ""Inda ya kamata ya sa hannun sai mu ga ba nan ya sa hannu ba, inda kuma bai kamata ya sa hannu ba, sai mu ga a nan ya sa hannu"". Tun bayan daga aka cire Sarkin a ranar Litinin, gwamnatin Buhari a hukumance ba ta ce komai ba akan batun. Sai dai a makonnin baya Shugaba Buhari ya ce ba zai haka baki a harkokin cikin gida na jihar Kano ba. Sai dai BBC ba ta samu bayanai daga wasu kafofi masu zaman kansu ba da ke tabbatar da ikirarin Sanata Kwankwaso. Kwankwaso, wanda a zamanin mulkinsa ne cikin shekara ta 2014 aka nada Sarki Muhammadu Sanusi II, yana wannan kalami ne lokacin zantawarsa da BBC a kan batun cire tsohon sarki. A ranar Litinin ne, gwamnatin jihar Kano ta sanar da tube rawanin basaraken, tare da korarsa daga Kano zuwa garin Awe cikin jihar Nasarawa, inda ake ci gaba da killace shi. Tsohon gwamnan Kanon ya ce tube sarkin Kano, wani abin bakin ciki ne ga jihar Kano da Najeriya da ma duniya gaba daya, ""dama shi mai martaba sarki, mutum ne na duniya gaba daya"". A cewarsa daga abin da suka ji da abin da suka gani, ko shakka babu gwamnatin da ta san ya kamata ba za ta tube Muhammadu Sanusi ba. Muhammadu Sanusi II, basarake ne mai yawan janyo ka-ce-na-ce kuma tun a lokacin mulkin Kwankwaso ya fara kai ruwa rana da gwamnatin jihar, har ta ba shi takardar gargadi karo biyu. Sai dai Kwankwason ya musanta hakan, inda ya ce ""ni ban taba ba Mai martaba sarki wata takardar gargadi ko ma wani abu irin wannan ba"". Haka kuma an tambaye shi game da zargin da ake yi wa magoya bayansa 'yan Kwankwasiyya wajen rura wutar rikici tsakanin Sarki Sanusi da Gwamna Ganduje, nan ma tsohon gwamnan ya ce su ba sa goyon bayan kowa sai bangaren gaskiya. Ya ce a iyakar saninsa kamar yadda ""su kansu mutanen gwamnati ke fada"", Sarki Sanusi ya gamu da fushin Ganduje ne saboda sun ce basaraken ya ce duk wanda ya ci zabe a Kano, a ba shi nasararsa. Kwankwaso ya kuma koka kan abin da ya ce wulakancin da aka yi wa jama'ar jihar Kano ta hanyar wulakanta tsohon sarki."	https://www.bbc.com/hausa/labarai-51828851
sports	Chelsea na takaicin Tchouameni, Yaya Toure na horar da tawagar Ingila	Nice na fatan shawo kan tsohon kociyan Paris St-Germain da Tottenham Mauricio Pochettino domin maye gurbin Lucien Favre a kungiyar ta gasar Faransa. (ESPN) Mai kungiyar Chelsea kuma darektan wasanni na kungiyar na wucin-gadi Todd Boehly na jin haushi da bacin rai da kuma mamakin yadda tsohuwar hukumar kungiyar  da ta gabata ba ta nemi Aurelien Tchouameni ba kafin dan wasan na tsakiya ya tafi Real Madrid. (Sport - in Spanish) Dan wasan tsakiya na Belgium Youri Tielemans, ya ce bai yi nadamar zama a Leicester City ba a bazaran nan duk da yadda ake danganta shi da tafiya Arsenal. (Sky Sports) Dan wasan Chelsea na tawagar Amurka Christian Pulisic, ya ce ya yi matukar mamaki kan yadda tsohon kociyan kungiyar Thomas Tuchel ya ki sa shi tun a farkon wasa na karawarsu ta biyu da Real Madrid ta wasan kusa da karshe na gasar Zakarun Turai a 2021. (ESPN) Dan wasan tsakiya na Everton da Brazil Allan, ya fara tattaunawa domin tafiya kungiyar Al-Wahda ta Hadaddiyar Daular Larabawa nan da mako biyu. (Football Insider) Dan wasan gaba na AC Milan da Portugal Rafael Leao, yana son kulla sabuwar yarjejeniya da kungiyar duk da cewa Chelsea na sha'awarsa. (La Gazzetta Dello Sport, via Teamtalk) Sakamakon matsalar biza an bar dan bayan Manchester United Lisandro Martinez, da na Tottenham Cristian Romero, ba su samu damar shiga tawagar Argentina da za ta yi wasan sada zumunta biyu ba. (Mirror) Ana sa ran dan wasan tsakiya na Leeds United, dan Ingila Jamie Shackleton ya bar kungiyar a bazara mai zuwa, saboda Millwall na da damar sayensa idan wa'adinsa na zaman aro a kungiyar ya kare. (Athletic - subscription required) Hukumar darektocin Juventus za ta yi taro ranar Juma'a domin tattauna makomar kociyan kungiyar Massimiliano Allegri, saboda yadda kungiyar take a matsayi na takwas a tebur bayan da ta ci wasa biyu kawai a cikin bakwai. (Calciomercato - in Italian) Chelsea na zawarcin shugaban RB Leipzig Oliver Mintzlaff domin ya karbi matsayin darektan horarwa a Stamford Bridge. (Athletic - subscription required) Tattaunawa ta yi nisa tsakanin Tottenham da kwararren mai zawarcin 'yan wasa Jeff Vetere domin ya shugabanci masu nemo wa kungiyar 'yan wasanta na kasa da shekara 21. (Football Insider) Tsohon dan wasan tsakiya na Manchester City da Ivory Coast Yaya Toure na taimaka wa tawagar Ingila ta 'yan kasa da shekara 21, a shirin da take na karawa da Italiya da Jamus, a karatun da yake na kammala kwarewa a aikin kociya. (Mail)	https://www.bbc.com/hausa/articles/ckkd1xgvkddo
entertainment	...Daga Bakin Mai Ita tare da Momee Gombe	Latsa hoton da ke sama domin kallon bidiyon: Daga Bakin Mai Ita wani shiri ne na BBC Hausa da ke kawo muku hira da fitattun mutane kan wasu abubuwan da suka shafi rayuwarsu zalla. A wannan kashi na 92, BBC ta tattauna da Momee Gombe, inda ta amsa tambayoyin da suka shafi rayuwarta. Daukar bidiyo da tacewa: Yusuf Ibrahim Yakasai	https://www.bbc.com/hausa/media-60935654
politics	Zaɓen 2023: Fitattun 'yan siyasa da suka sha kaye a zabukan fitar da gwani na APC da PDP	Zaɓukan da aka gudanar na fitar da gwani na masu neman takara a matakai daban-daban a manyan jam'iyyun siyasar Najeriya biyu a makon jiya, sun bar baya da kura inda wasu 'yan takara, musamman wadanda suka sha kaye, suka yi zargin tafka magudi. Kazalika zaɓukan na cike da ruɗani da zarge-zargen tafka kura-kurai da nuna son kai tsakanin 'yan siyasa da ke fafutukar neman tikitin takara a jam'iyyar APC da ke mulki a kasar da kuma babbar jam'iyyar adawa ta PDP. Yanzu dai kusan jam'iyyun sun kammala tsayar da mutanen da suke son yi musu takara, ban da APC da ta dage nata zaɓen na fitar da gwani a matakin shugaban kasa zuwa ranar 6 zuwa 8 ga watan Yuni. Rahotanni sun nuna cewa akalla sanatocin 14 da 'yan majalisar wakilai 23 masu-ci ba za su iya komawa kujerunsu ba. Akwai kuma wasu cikinsu da suka samu tikitin gwamna a jihohinsu daban-daban. Mataimakin shugaban majalisar dattawa, Ovie Omo-Agege; Sanata Aishatu Dahiru Binani, mai wakiltar Adamawa ta Tsakiya, da Sanata Sandy Onor, sun lashe tikitin neman gwamna na APC da PDP a Delta, Adamawa da Cross Ribas. Mun yi nazari kan wasu daga cikin fitattun 'yan siyasa da suka sha kaye a zabukan fitar da gwani na manyan jam'iyyun siyasar kasar biyu, wato APC da PDP: Ɗan majalisar da ke wakiltar Kano Municipal, Sha'aban Ibrahim Sharada, ya sha kaye a zaɓen fitar da gwanin neman gwamna a hannun mataimakin gwamna mai-ci, Nasir Yusuf Gawuna. Hakan ya bai wa tsohon Kwamishinan Ayyuka na musamman, Muntari Ishaq Yakasai damar samun tikitin takarar majalisar wakilai ta tarayya, a karkashin jam'iyya APC. Akwai tsohon Hadimin shugaban kasa, Bashir Ahmed, da a karon farko shi ma ya shiga takara aka fafata da shi domin neman tikitin wakiltar Gaya/Ajingi/Albasu, sai dai ya sha kaye a hannun dan majalisar da ke kan kujerar, Abdullahi Mahmoud Gaya. Sannan akwai irin su Barrister Isma'il Ahmed da Sanata Bashir Lado da duk suka sha kaye a zabukan fitar da gwani na APC. A PDP Kano, akwai Jafar Sani-Bello da ya sha kaye a takarar neman gwamna, inda Mohammed Sani Abacha ya yi nasara. Sai dai akwai rabuwar kawuna a jam'iyyar PDP reshen jihar Kano domin Sadiq Wali ya fito yana cewa shi ne sahihin dan takarar jam'iyyar a bangaren da Bello Hayatu Gwarzo ke shugabanta. Sanatoci uku a Jigawa sun sha kaye a neman damar sake komawa kujerunsu a zabukan fidda gwani na jam'iyyar APC. Biyu daga cikinsu, Sanata Sabo Muhammad Nakudu da ke wakiltar Jigawa ta Tsakiya da Sanata Ibrahim Hassan Hadeja da ke wakiltar arewa maso gabashin Jigawa sun rasa damar samun tikitin gwamna. Sanatocin biyu sun sha kaye a hannun Malam Umar Namadi da ya yi nasara. Sanatan da ke wakiltar Arewa maso Yammacin Jigawa, Abdullahi Danladi Sankara ya rasa damar sake komawa kujerarsa bayan ya janye sa'o'i kafin zaben. Wannan na nufin a yanzu Sanatoci uku daga Jigawa a APC ba za su koma zama majalisa ba a zaben 2023. Akwai kuma ɗan majalisar wakilai, Muhammad Gudaji Kazaure, da shi ma ya sha kaye a zaben fitar da gwani a yankin Kazaure/Roni/Gwiwa/Yankwashi. Gudaji Kazaure ya yi rashin nasara ne a hannun Mukhtar Zanna da ke shugabantar karamar hukumar Kazaure. A PDP, Sale Shehu, tsohon Karamin Ministan Ayyuka, ya sha kaye a hannun Mustapha Lamido, ɗa ga tsohon Gwamna Sule Lamido. Sanata Aishatu Dahiru da ke wakiltar Adamawa ta Tsakiya ta doke dan majalisar wakilai Honorabul Abdulrazaq Namdas da tsohon shugaban EFCC Nuhu Ribadu wajen samun tikitin takarar gwamnan Jihar. Komati Laori ya sha kaye neman sake komawa kujerarsa karkashin jam'iyyar PDP domin wakiltar Numan/ Lamurde/ Demsa. 'Yan majalisa takwas a APC da yanzu ke kan kujera sun rasa tikitin sake komawa takara a Katsina, ciki har da ɗa ga 'yar uwar Shugaba Muhammadu Buhari, Fatuhu Muhammadu da ke wakiltar Daura/Mai'Adua/Sandamu a jam'iyyar APC. Muhammad ya sha kaye ne a hannun Aminu Jamo wanda ya samu yawan kuri'u 117, Fatuhu kuma ya samu 30. Hakazalika akwai Murtala Isa, da ke wakiltar Faskari/Sabuwa/Dandume da ya sha kaye a hannun mataimakin kakakin majalisar Jiha, Dalhatu Tafoki. A Katsina ta Tsakiya, tsohon Kwamishinan Wasanni da Ci gaba, Sani Danlami, ya doke dan majalisa na yanzu, Salisu Isansi. Haka abin yake a yankin Batagarawa/Rimi/Charanci da Usman Banye ya kada Hamza Dalhatu. Ashiru Mani da ke wakiltar Mani/Bindawa ya doke Ahmed Yusuf  da hana shi sake komawa kujerarsa. Shi ma Ahmed Dayyabu da ke wakiltar Safana/Danmusa/Batsari ya rasa damar komawa kujerarsa bayan shan kaye a hannun Kwamishinan Ayyuka na Musamman, Abdulkadir Zakka. Aminu Balele ya kwace tiketin Kurfi/Dutsin Ma. Abdullahi Aliyu ya doke Ahmed Usman Liman da ke kan kujerar a yanzu. A Sokoto, Sanata Ibrahim Gobir ya sha kaye a takarar neman gwamna a APC. Rahotanni sun nuna cewa Gwamna Aminu Tambuwal, wanda ya janye domin mara wa tsohon shugaban kasa Atiku Abubakar baya a zaben fitar da gwani, yanzu haka na hararar kujerar Sanata. Ana tunanin zai karbi tikitin takarar a hannun Aminu Bala Bodinga wanda ke rike da tikitin a yanzu. Sanata Dino Milaye ya sha kaye a hannun Tajudeen Yusuf da ke wakiltar yankin Kabba-Bunu/Ijumu a majalisar wakilai a PDP, inda yanzu ya rasa takara karkashin PDP ta sake komawa kujerarsa ta Sanata mai wakiltar Kogi ta Yamma. Sanata mai ci Smart Adeyemi ya rasa damar takarar nemawa kujerarsa domin wakiltar Kogi ta Yamma. Ya sha kaye ne a hannun Sunday Karimi. Karimi ya samu kuri'u 288 inda ya doke Adeyemi da sauran mutane hudu da ke takarar a Kabba.	https://www.bbc.com/hausa/labarai-61631539
