religion	An yi gasar Al Kur’ani ta ƴan ƙasa da shekara 13 a Ghana	Latsa hoton sama domin sauraren shirin An gudanar da gasar karatun Al Kur`ani ta ƙasa a Ghana a karon farko a Accra, tsakanin `ƴan kasa da shekara 13 daga yankuna uku na ƙasar da suka ƙunshi yankin Ashanti da kuma arewacin Ghana. Yara biyar ne daga kowanne yanki suka samu nasarar zuwa zagayen ƙarshe na wannan gasa, inda suka fafata tsakaninsu a ɗakin taro na ƙungiyar malamai ta kasa. Wakilin BBC na Ghana Fahd Adam ya halarci gasar kuma ya aiko da rahoto na musamman.	https://www.bbc.com/hausa/shirye-shirye-na-musamman-59196606
business	Manoman Najeriya na kokawa kan karancin taki	Manoma a Najeriya na ci gaba da kokawa game da karancin taki yayin da damina ta yi nisa. Manoman sun ce taki nau'in Yuriya, wanda shuka ke buƙata a daidai wannan lokaci da ake marka-marka, ya yi wahala a kasuwa. Dillalan takin dai na danganta ƙarancinsa a kasuwa da kamfanonin samar da shi, inda suke cewa ko sun biya kuɗi, ba sa samu.  Manoman musamman na arewacin Najeriya na cewa a yanzu ko da kudinka zai yi wahala mutum ya samu takin a kasuwa. Manoman shinkafa da masara da dawa na matukar bukatar takin domin ya taimaka wa amfanin gonar ya habaka. Alhaji Idris Mai Unguwa, shi ne shugaban kungiyar manoma ta Jihar Jigawa, kuma ya shaida wa BBC cewa tun da watan Agusta ya kama taki nau'in Yuriya ya soma wahala. Ya bayyana cewa ko da manomi ya ci sa'a ya samu takin, farashinsa ya tashi matuƙa. Haka kuma ya ce yanzu ne lokacin ruwa da ya kamata a ce an samu takin an saka, idan ba haka ba kuwa ba shi da wani amfani nan gaba. Ba iyakar manoman Jihar Jigawa ba ne ke kokawa da karancin takin samfurin Yuriya ba, sauran jihohin arewacin kasar ma haka lamarin yake, sai dai wasu jihohin kari a kan wannan matsalar, takunkumin da aka sanya na hana sayar da Yuriya din, saboda matsalar tsaro na matuƙar shafar su. Jihohin sun haɗa da Gombe da Yobe da Borno da Adamawa da Taraba. Alhaji Modibo Sadiq Nafada shi ne shugaban kungiyar manoma na jihar Gombe kuma ya shaida wa BBC cewa kamfanoni uku ne kacal ke wadatar da Najeriya da Yuriya inda ya ce matsalar Yuriya matsala ce da ta shafi Najeriya baki ɗaya. Ya bayyana cewa wannan matsala ta sa an koma amfani da kashin dabbobi da juji da sauran abubuwan da aka baro a baya inda ya ce manoma ba su jin daɗin wannan lamari. Sai dai dillalan takin sun bayyana cewa su kansu sun shiga halin rashin tabbas saboda sun shigar da kudi a kamfanonin samar da takin, amma a cewar Alhaji Haro Shehu, wani dillali a jihar Jigawa, har yanzu ba su samu takin ba. Duk kokarin da BBC ta yi domin ji daga hukumomi hakan bai yiwu ba. To sai dai wata majiya da ke kusa da shugaban kwamitin shugaban kasa kan harkokin taki, da kuma gwamnan jihar Jigawa Alhaji Badaru Abubakar, ta ce gwamnan ya zare hannunsa daga sabgar takin, tun shekaru biyu da suka gabata, saboda wasu tsare-tsare da wasu jami’an gwamnati suka bullo da su kuma ya yi gargadin cewa za su iya haifar da wannan matsalar da ake ciki yanzu.  Amma a cewar majiyar an yi biris da shawarar da ya bayar, al’amarin da ya sa ya kakkaɓe hannunsa duk da cewar bai ayyana sauka daga shugabancin kwamitin ba.	https://www.bbc.com/hausa/articles/cd1qevly7xwo
politics	APC: Shugaban jam'iyyar Abdullahi Adamu ya ce ya ɗauki alhakin matsalolin da ta shiga	"Shugaban jam'iyyar APC mai mulki a Najeriya, Sanata Abdullahi Adamu, ya ce ya ɗauki alhakin duk matsalolin da jam'iyyar tasu ta shiga musamman game da zabukan fitar da gwani da aka kammala a farkon watan Yuni. Shugaban na mayar da martani ne kan matakin da jam`iyyarsu ta ɗauka na miƙa sunan Shugaban Majalisar Dattawa Sanata Ahmad Lawan ga hukumar zaɓe a matsayin ɗantakarar sanata mai wakiltar Mazaɓar Yobe ta Arewa maimakon Bashir Machina, wanda ya ci zaɓen fitar da gwani na mazaɓar. Cikin wata hira ta musamman da BBC Hausa, Sanata Adamu ya ce ""ni a matsayina na shugaba,  duk abin da ya faru tun daga lokacin da Allah ya ba ni shugabancin APC, na ɗauki laifi"". Ya ƙara da cewa: ""Idan ban ɗauki laifi ba wa za zan ɗora wa laifin? Ni ne shugaba, kuma ai wuta ake so a kashe."" To ko waɗanne matsaloli ne APC ke ciki? Daga cikin manyan matsalolin da APC ke ciki a yanzu har da batun karɓe tikitin takarar sanata daga hannun Bashir Machina, wanda shi kuma ya lashi takobin bin kadin lamarin a gaban kotu. Da wakilin BBC Ibrahim Isa ya tambayi Abdullahi Adamu game da lamarin, sanatan ya yi kakkausan gargaɗi ga Machina cewa ya yi hattara saboda ""maganganun da yake fadi sun fara neman su yi yawa"". A cewarsa: ""Ni a matsayina na shugaba na san babu wata doka da jam'iyya ta karya, domin babu wata doka da ta ce idan ka shiga wata takara ba za ka shiga wata ba. Don haka ba dokar da ta hana shi ko ta hana kowa ma. ""Shi fa ɓarawo idan ba ka iya kama shi ba sai ya kama ka. Machina, ya yi hattara zuwa yanzu."" Tun farko Abdullahi Adamu ya yi iƙirarin cewa Ahmad Lawan ya sayi fom kuma ya shiga zaɓen fitar da gwani na sanatan Yobe ta Arewa. Sai dai Bashir Machina na cewa shi kaɗai ya tsaya takara a zaɓen. Tun bayan rashin nasara da ya yi a zaben fitar da gwani na takarar shugaban ƙasa a APC, aka fara dambarwa kan Sanata Ahmad Lawan kan yiwuwar kasa komawa majalisar bayan ya shafe fiye da shekara 20 yana wakiltar al'ummarsa a Majalisar Wakilai da ta Dajjitai. APC na ci gaba da shan suka game da yadda jam'iyyar ta kasa ɗaukar mataimakin ɗan takararta na shugaban ƙasa Bola Ahmed Tinubu, wanda sai a ranar da wa'adi ke cika sannan ta miƙa sunan Kabiru Masari. Sai dai rahotanni da kuma masu sharhi na ganin cewa ɗan takarar ""na riƙo"" ne yayin da masu ruwa da tsaki na jam'iyyar ke ci gaba da tattaunawa don sauya sunan mataimakin a nan gaba kamar yadda hukumar zaɓe INEC ta ba su dama. ""Babu wata doka da ta ce dole a kawo mataimaki [na ɗan takarar shugaban ƙasa] na take, to mece ce damuwar? ""Don an kai wani lokaci ba mu fitar da ɗan takara ba iyawa ce, don mu daddale, mu fito da mutumin da zai karɓu a wajen al'ummar da za a nemi ƙuri'unsu."" Sauran jam'iyyu kamar NNPP ta Rabiu Kwankwaso da LP ta Peter Obi duk sun miƙa sunayen mataimakan ne na riƙo yayin da suke ci gaba da tattaunawa don yin ""maja"" kafin babban zaɓen na 2023. Bashir Machina ya ce ya wallafa takarda a shafukan intanet wadda ya ce ya aike wa APC kan tuntuɓar da aka yi masa ko yana nan kan takararsa, inda ya amsa da cewa bai janye ba kuma yana kan takararsa. Ya ƙara da cewa Ahmad Lawan bai tuntuɓe shi ba baki da baki ba, don haka yana nan kan bakansa kamar yadda jama'a suka zaɓe shi. Wata matsala da jam'iyyar ke ciki ita ce ta ficewar wasu 'yan siyasa daga cikinta zuwa jam'iyyun adawa, abin da shugaban jam'iyyar ya ce ba abin mamaki ba ne saboda ""mana cikin matsala"". A Kano misali, jam'iyyar NNPP ta tsohon Gwamna Rabiu Musa Kwankwaso ta kwashi 'yan APC da yawa, cikinsu har da jiga-jigai kamar Kawu Sumaila da Abdulmumini Jibrin. ""In na ce babu wanda ya bar APC na yi ƙarya...ba shakka akwai waɗanda suka shiga zaɓe ba su samu ba kuma sun ce za su bar jam'iyyar,"" a cewar Abdullahi Adamu. Sai dai ya ce yawan waɗanda suka bar APC ba su kai yawan mutanen da 'yan jarida ke faɗa ba."	https://www.bbc.com/hausa/labarai-61905326
health	Kalli matar da aka yi wa tiyata a kwakwalwa tana kada goge	Latsa hoton da ke sama don kallon bidiyon: Wata mara lafiya a Asibitin Kwalejin Kings da ke Landan ta kada goge a lokacin da likitoci suke mata tiyata a kwakwalwa don cire mata tsiro. Dagmar Turner, mai shekara 53, ta kada gogen ne don likitoci su tabbatar da cewa sauran sassan kwakwalwar da ke sa hannaye yin aiki ba su tabu ba a yayin tiyatar.	https://www.bbc.com/hausa/labarai-51575823
health	Yawan hutawa na cutar da lafiya - amma yana da amfani ta wani bangaren	"Duk wani ma'aikaci mai jajircewa da ya yi ritaya na fargabar yadda ranakunsa za su cika da rashin aikin yi. Ga mutanen da suke ganin zuwa aiki shi ne gishirin rayuwarsu, suna ganin rayuwa ba za ta yi armashi ba idan ba sa zuwa aiki. Duk da cewa zuwa aiki na cike ranakun mutum, ana iya ganin lokacin da za a bata nan gaba ba tare da ana wani aiki ba a matsayin mai cike da rudani kuma yana iya jefa mutum cikin wasu munanan ayyuka kamar shan kwayoyi. ""Daga bayanan da muka samu - da kuma la'akari da al'amura na yau da kullum - cewa mutane da yawa na fadi tashi a aiki,"" in ji Andrew Yang, dan takarar shugabancin Amurka a jam'iyyar Demokrat kuma wanda ya kafa kungiyar samar da aiki ta Venture for America. ""Ba ma yin komai; ba ma aikin sa-kai sosai, duk da cewa muna da lokaci sosai. Sannan lokaci na tafiya sai mu fara buga wasannin komfuta da shan barasa. Al'umma gaba daya ba ta ci gaba idan babu aikin yi,"" a cewarsa. Aikin da ake biyan albashi ba shi kadai ne hanyar da ke kai ga rayuwa mai dadi ba. Misali, 'yan Japan suna da wata al'ada ta ikigai. Al'ada ce ta kara masu karfin guiwar samun farin ciki ta hanyar mayar da hankali ga wani abin da suke yi da zai sa su tashi da sanyin safiya. Cikin 'yan kasar Japan da aka gudanar da bincike a kansu a 2010, binciken ya nuna cewa kashi daya bisa uku suna amfani da al'adar ikigai, sauran kashi biyu bisa ukun da suka rage, rashin albashi da soyayya da kuma mayar da hankali kan wasu hidimomi ya sa suka yi ritaya daga aiki. A wannan zamani, mata suna aikatuwa kwarai da gaske amma irin wannan aikin ba a daukar shi da muhimmanci kamar irin aikin albashi. Misali lura da yara da kuma yin ayyukan gida da sauran hidimomi na cin sa'o'i dayawa. Rage yawan aiki a ofis zai iya bayar da daman samun lokaci da kuma kuzari domin aiwatar da sauran ayyukan gida da hidimomi - amma kamfanoni da gwamnatoci kada su rage zuba jari a wasu bangarori saboda sun dogara da wasu su yi aiki kyauta. Wani bincike da aka gudanar kan gajeren hutun karshen mako ya nuna ma'aikata masu dogon hutun karshen mako- amma wadanda albashinsu ba a kara masu ba - suna amfani da sauran lokutansu wajen yin abubuwa kamar buga wasan kwallon golf da sauran wasanni. Alexandra Hartnall, wata mai aikin tuntuba kan kasuwanci da sadarwa a London ta ce ta gano cewa yin aiki a biya ta ya sa ta samu natsuwa, wannan ne ya sa ba ta yin aiki ya wuce na sa'o'i hudu a rana. Wani kalubale a nan shi ne ko da mutum ya samu saukin aiki kuma yana da lokaci ba shi zai sa lallai mutum ya yi wasu abubuwan da suka hada da taimakon al'umma ba. Melanie Oppenheimer daga jami'ar Tokyo ta bayyana cewa a Australia wadanda ke tsakanin shekaru 35 zuwa 44, su ne suka fi yin ayyuka na sa-kai. Dalili kuwa shi ne aikin sa-kai na da fadi ba kamar yadda mutane ke tunani ba: akwai buga wasan game na talabijin da kuma taimaka wa 'yan ci-rani samun matsuguni da taimaka wa wasu masu aikin karatun kimiyya duk na cikin aikin sa kai. A ra'ayin Oppenheimer, lokaci ba zai kasance kalubale ga irin lamarin ba, amma yana da kyau a taimaka wa masu son aikin sa-kai a kuma taimaka masu da dama idan ta samu."	https://www.bbc.com/hausa/labarai-49688440
business	Dalilan gwamnati na jingine batun cire tallafin man fetur a Najeriya	Gwamnatin Najeriya ta ce za ta ci gaba da bayar da tallafin man fetur a kasar, matakin da ke zuwa a daidai lokacin da 'yan kasa ke ci gaba da fargaba kan yiwuwar kara farashin mai. A ranar Litinin ne aka fitar da sanarwa da ke tabbatar da cewa gwamnatin Muhammadu Buhari ta jingine shirin janye tallafin man fetur bayan wani taro da aka gudanar karkashin jagorancin shugaban majalisar dattawa, Sanata Ahmed Lawan. Mahukunta a Najeriya dai sun yi bayani kan aniyarsu ta ci gaba da ba da tallafin man fetur a wannan shekara wanda tun a farkon wannan shekara 'yan ƙasar suka shiga fargaba, sakamakon rashin sanya tallafin man fetur a kasafin kuɗin bana. Mai taimakawa Sanatan kan hulda da jama`a, Alhaji Bashir Hayatu Jantile, ya shaida wa BBC Hausa cewa Sanata Ahmed Lawan ya gayyaci masu ruwa da tsaki kan harkar man fetur inda ya nuna musu damuwarsa da sauran 'yan majalisar da kuma shaida musu tattaunawar da ya yi da shugaban kasa da sauran masu ruwa da tsaki. A cewar Jantile a wajen taron ne aka samu sabon bayani daga Ministar Kudin Najeriya a kan abin da gwamnatin tarayya ke yi game da batun tallafin man, wanda ake ta rade-radi game da janye shi. Kuma bayanin da ta yi a gaban shugaban majalisar dattawan, a cewar sa ta kawar da dukkan shakku domin daga na zuwa watan Yuni akwai kudin ci gaba da biyan tallafi, dama matsalar sai daga watan Yuli za ta soma. Ya ce wannan bayyani ya farantawa sanatocin rai kuma suka yi kira ga kungiyoyin kwadago su tsayar da batun yajin aiki ko bore da suke shirin yiwa gwamnati. Babu shaka an shiga zaman zulumi a Najeriya game da janye tallafin man fetur. Tun a karshen shekarar da ta wuce wasu ruwayoyi ke cewa za a janye tallafin, har ta kai ga gidajen mai da dama suka yi ta tsimin man da suke sayarwa a manyan biranen kasar, har da Abuja babban birnin ƙasar. Wani abin da ya karfafa zaton janye tallafin shi ne rashin sanya tallafin a cikin kasafin kudin kasar na bana. Ko a lokacin da majalisar koli da ke kula da tattalin arzikin ta yi taro, da dama na yi tsammani za ta fadi ainihin matsayin gwamnati game da janye tallafin. Amma sai ta ce 'yan majalisar ba su yanke wata shawara a kan wannan maganar ba. Maganar janye tallafin dai kusan kowa ba ya son alakanta kansa da ita, saboda tana iya janyo bakin-jini. A dan tsakanin nan ma na ambato minstan man kasar, Timiprye Syva yana cewa shugaban kasar Muhammadu Buhari bai ba da umurnin a janye tallafin man ba. Masu lura da al'amura dai suna cewa gwamnatin Najeriyar ta samu kan ta a wani yanayi ne na gaba kura, baya sayaki. Tana son janye tallafin mai, sakamakon kukan rashin kudin da take yi, da zargin cewa wasu kalilan ne ke cin gajiyar tallafin. Sannan a bangare guda kuma tana gudun bacin ran 'yan kasar da zai biyo bayan janye tallafin, a wata gabar da ake tunkarar babban zabe.	https://www.bbc.com/hausa/labarai-60121222
business	Halima Zawiya: Matashiyar da ta rungumi harkar noma a Jigawa	Latsa wannan hoton da ke sama domin kallon hira da Halima: Hausawa kan ce kallabi tsakanin rawuna domin misalta macen da take yin wani aiki da ake kallon na ‘ya’ya maza ne. Kuma wannan karin magana ya dace da matashiya Halima Zawiya, mai shekara 24 'yar jihar Kano, wadda take aikin na-duke wato noma. Halima, wadda take da digiri kan fannin noma, ta zabi komawa gona domin dabbaka abin da ta karanta a jami’a. Matashiyar na da makekiyar gonar shinkafa a jihar Jigawa inda take noman rani da na damina domin noman kayan miya da shinkafa. A wannan karo BBC ta je gonar ta Halima mai girman kadada 70 domin ganin yadda za ta girbi amfanin da ta shuka.	https://www.bbc.com/hausa/media-57813007
business	Coronavirus: Wanne tasiri karyewar farashin man fetur zai yi ga Najeriya?	"Farashin man fetur ya yi faduwar da bai taba yin irinta ba a cikin shekaru sakamakon annobar korona, lamarin da ya kara tayar da hankalin kasashen duniya. Farashin danyen mai nau'in West Texas Intermediate na Amurka a ranar Litinin ya yi karyewar da ya zama tamkar ana neman kai da shi karon farko a tarihi. Hakan na nufin masu samar da man suna biyan dillalai su karbi man daga hannayensu bisa fargaba rashin isasshen wurin da za su ajiye shi a watan Mayu mai zuwa. Haka ma farashin danyen mai a Turai da sauran kasashen duniya ya fadi da kashi 8.9% inda ake sayar da man kan $26  duk ganga. Yawan man fetur shi ne ya janyo faduwar farashinsa kamar yadda ta taba faruwa a 2015 inda farashin ya yi matukar faduwa A halin yanzu dai akwai man da yawa a kasuwa, yayin da farashin ke faduwa saboda barkewar annobar coronavirus. Kasuwar man ta bushe, bukatarsa kuma ta ragu, yayin da al'ummar duniya ta kasance kusan a kulle ba fita. Ana  fargabar cewa abin da ya janyo farashin danyen man Amurka faduwa babbar barazana ce ga sauran kasashe, domin abin da ya ci Doma ba ya barin Awai. A farkon watan Afrilu mambobin kungiyar kasashe masu arzikin fetur OPEC suka amince su rage yawan man fetur da suke samarwa da kashi 10% - wanda shi ne adadi mafi yawa da aka taba ragewa na yawan man da ake fitarwa kasuwa. Jaridar Bloomberg ta ce 'yan kasuwa a yammacin Afrika sun ce kusan ganga miliyan 10 ne yake jibge ba a sayar ba a watan Afrilu, yayin da watan ke dab da karewa. Kuma yawancin man na Najeriya ne maimakon Angola, saboda kasashen Turai da suka saba saya sun daina saboda raguwar bukatarsa a kasuwa. Farashin ya yi kasa fiye da farashin da Najeriya ta yi hasashe a cikin kasafin kudinta na bana. Najeriya na dogaro ne da arzikin man fetur, kimanin kashi 90% na kudaden shigarta ke fitowa daga man da take sayarwa. Tasirin faduwar mai ga Najeriya Faduwar farashin ne ya tilatstawa gwamnatin Najeriya sake tsara kasafin kudinta, inda a watan Maris gwamnatin Najeriya ta yi wa kasafin kudinta kwaskwarima saboda barazanar cutar korona. Gwamnati ta rage sama da Naira biliyan N320 a kasafin kudinta na 2020, inda ya koma N10.27 tiriliyon kan dala 30 duk gangar mai daya, sabanin adadin da majalisa ta amince na dala 57 duk ganga. Masana na ganin kasashen da ke dogaro da man fetur kamar Najeriya za su shiga mayuwacin hali, saboda raguwar bukatar man saboda annoba ta tilasta wa kamfanoni masu bukatarsa, rufe harkokinsu. Farfesa Mustapha Muktar masanin tattalin arziki a Jami'ar Bayero Kano, ya ce yadda farashin man ke faduwa, gwamnatin Najeriya ba za ta iya aiwatar da kasafin kudin bana ba. ""Idan an sayar da mai yakan dauki lokaci kafin kudinsa ya dawo, nan gaba kasashen masu fetur za su shiga mugun mawuyacin hali saboda kudaden da suke samu ya ragu,"" in ji masani. ""Kudin da za a saya a kasuwar duniya ba zai kai kudin da aka hako shi ba,"" a cewarsa. Ya kuma ce faduwar farashin zai yi tasiri sosai ga sauran fannonin tattalin arziki inda wasu ma za su durkushe, saboda arzikin mai ne ke samar da kudaden shiga da ke yunkura sauran fannonin. ""Idan farashin ya ci gaba da faduwa sauran fannonin ma za su durkushe,"" in ji shi. Masanin ya ce a wannan lokaci na annoba ba wata dama ta saita tattalin arziki ga kasar da ke dogaro da man fetur. Kamata ya yi gwamnati a yanzu ta fara tunanin tsuke bakin aljihu ya kasance sai abubuwan da suka zama dole kamar kula da lafiya da tsaro za ta kashe kudadenta a kai. Duk wani abin da ba dole ba ga 'yan kasa to wajibi ne gwamnati ta rage, gwamnati ta san abubuwan da ba na dole ba domin kaucewa shiga mayuwacin hali. Tsuke bakin aljihun shi ne matakin da ya kamata gwamnati ta dauka. a ririta kudaden da ake samu wajen harkokin kula da lafiya da tsaro da sauran abubuwa na dole. Wasu na ganin faduwar farashin zai sa farashinsa a gidajen mai ya ragu, amma kuma zai rage yawan kudaden shiga da gwamnati ke samu. Za a iya samun raguwar kudin sufuri wanda zai janyo raguwar kudaden kayayyaki da kuma raguwar hauhawan farashin kayyakin. Sai dai Farfesa Mustapha ya ce rashin rage farashin iskar gas da kalanzir da sauran albarkatu da ake samu idan an tace danyen mai ba zai rage farashin kayayyaki ba."	https://www.bbc.com/hausa/labarai-52362289
entertainment	Mutanen da suka shafe awa 30 a layin yin bankwana da gawar Sarauniya Elizabeth	"Dubban mutane ne suke ta tururuwar zuwa yin bankwana da gawar Sarauniya Elizebeth, a yayin da ya rage kwana uku a binne ta. Wakilin BBC Kristian Johnson, ya shiga cikin mutanen da suka shafe dare a kan layin shiga ganin gawar Sarauniyar inda har ya yi sabbin abokai a zaman da suka yi cikin zubar ruwan sama a Landan. Da misalin karfe 10 na yammacin ranar Talata ce aka bude wajen shiga ganin gawar Sarauniyar. Mutanen da suka yi sabo da juna a wajen kafin su shiga ganin gawar na da dama sosai, kuma sun rinka amfani da lemar juna saboda ruwan da ya sauko a wajen. Ina daga cikin wadanda suka yi sa'ar shiga wajen. Ya ce, ""Na samu wajen fakewa a jikin ginin wani banki saboda ruwan da ake yi, to amma duk da haka sai da wandona ya jiƙe. Ba kuma ni kadai ne hakan ta faru da ni ba."" Wata mata da ke wajen ma ta ce sun jiƙe sharkaf, amma daga bisani sun bushe. Yawan 'yan jarida a wajen ya fi na mutane a ranar Litinin, a lokacin da Vanessa Nathakumaran, ta je wajen ta shiga gaban layin. Daga ita sai 'yar jakarta ta je wajen kuma tana da sa'a fiye da 48 da suka rage mata kafin ta shiga cikin dakin da aka ajiye gawar. Kristian Johnson, ya ce a lokacin da je wajen da rana ya tarar da ita kuma ya samu an ba shi lamba 17 a cikin wadanda ke kan layi. Michael Darvill, mai kimanin shekara 85 tare da 'yarsa Mandy Desmond mai shekara 55, sabbin makwabtan dan jaridar ne da tuni suka samu kujeru suka zauna don jiran shiga ganin gawar. Babu wasu litattafai ko wasu abubuwan da za su iya dauke musu kewa a wajen, illa kawai hira tsakanin wadanda ke wajen. Babu wanda yake duba wayar salularsa ko kuma ya sanya ta a caji, akwai batutuwan yin hira a kansu a wajen. A lokacin da ruwan sama ya sauko da rana a ranar Talata, mutum 50 ne kadai suka rage a kan layin in ji dan jaridar. Wani mutum mai suna Gary Keen, ya rinka bin layi yana raba wa mutane gutsuren pizza. Jacqueline Nemorin, daga Mauritius, ta rinka rarraba wa matan da ke kusa da ita a kan layi inibi, can kuma sai ga wasu mutane sun isa wajen sun raba kofin shayi da na gahawa. Yaqub Yousuf, wanda ke zaune a kusa da Gadar Lambeth, ya kawo nasa taimakon wajen, don taimaka wa mutanen da ke kan layin shiga ganin gawar Sarauniya. Daga bisani mutane da dama sun rinka kai nasu taimakon ciki har da masu kai abinci wajen. Duk da kasancewar ana tsakiyar ruwan sama a wajen a lokacin, Andrew Israels-Swenson, ya ci gaba da samun labarai daga wajen wannan dattijuwa mai shekara 85, Truus Nayman. Ta kuma bayar da labarai daban-daban. Andrew, wanda ya je wajen daga Minnesota a daren ranar Asabar, ya ce ya samu tikitin zinare saboda samun damar zuwa wajen da wuri har ya shiga layin ganin gawar Sarauniya, ya kwana a kan benci a zaune. Truus, ta zo ne daga Netherlands, ta shaida mini cewa ta je Landan ne a shekarar 1954, shekara guda bayan nadin Sarauniya Elizebeth. Ta ce, ""Na dan yi tsufa a yanzu musamman wajen bin layin, ni da mijina mun taba bin layi irin wannan a lokacin da Winston Churchill ya mutu a 1965, sai da muka shafe dare muna tsaye a nan."" ""A lokacin da Gimbiya Diana ta mutu a 1997, ni da ɗana mun sake bin layi a Fadar Kensington don rubuta ta'aziyyarmu a cikin littafin da aka ware. ""Sannan a lokacin da mahaifyar Sarauniya Elizebeth ma ta mutu a 2002, na zo da kaina na bi layi, ni asalina mai biyayya ce."" Da misalin karfe biyu na dare na shiga tantina na ɗan kwanta. Ko da na tashi bayan sa'o'i biyu, sai na ga Micheal da 'yarsa Mandy suna dariya duk da rashin baccin da ba su yi ba. Micheal ya ce, ""Mun jiƙe da ruwa tun misalin karfe biyu na dare, kuma ga shi ba mu bushe ba, saboda ruwan yana zuwa ya kuma dauke don haka a cikin ruwa muka zauna."" Cikin ikon Allah, sai ruwa ya dauke a lokacin rana ta fara fitowa. A nan mutane wasu fara shan gahawa wasu kuma na goge idanunsu yayin da ya rage musu sa'o'i su shiga gani da kuma bankwana da gawar Sarauniyar. Monica Farag, wadda 'yar asalin Philippines ce, ita ce ta shida a kan layi. Ba ta samu kujerar zama ba, a haka matar mai kimanin shekara 61 da haihuwa ta rinka kai komo har gari waye. Ta ce, ""Ina matukar daukin gani da bankwana da gawar Sarauniya, ko da yake ban ko rintsa ba. ""Lokaci ne mai matukar tarihi a gare ni saboda na shafe shekara 36 a Ingila."" ""Jim kadan bayan wayewar gari aka umarci ta naɗe tanti na, can na hango cuncurundon mutane ga shi kuma kowa ya hau kan layi. ""Da misalin karfe 3 na yamma, sai aka umarci mu shiga amma an kiyasta cewa mutum 20 ne za su rinka shiga a lokaci guda. ""Na bi sahunsu Truus da Andrew da Micheal da Mandy da kuma Paul, wadanda suka kasance makwabtana a wannan dare a lokacin da aka umarci su fara tafiya a hankali zuwa Westminister. Da misalin karfe 5 na yamma, aka bude kofar majalisar dokoki a hankali daga nan sai aka fara shiga a hankali kuma kowa ya tsit. A tsakiyar zauren taron na Westminister akwatin gawar Sarauniya ne a ajiye. Wata mata da ke bayana sai na ji ta fara shesshekar kuka, a gabana kuma Andrew da Truus ne suke tafiya kadafa da kafada. Na ji dadin shiga wannan zaure bayan na shafe sa'o'i 30 ina jira."	https://www.bbc.com/hausa/articles/cy03vv8k532o
