entertainment	Waƙata ta taɓa mayar da aure da ceton rai- Nura M Inuwa	"Nura M Inuwa, na ɗaya daga cikin mawaƙan zamani wanda za a iya cewa ya shahara a ƙasar Hausa, kuma ya yi wakoƙi musamman na soyayya da dama. A wata tattaunawa da BBC ta yi da mawaƙin a Shafin Instagram da Facebook, mawaƙin ya bayyana cewa ya fara waƙa ne tun a 2007, kuma ya fara ne da waƙar siyasa. A cewarsa, a halin yanzu waka ta zama sana'a, kuma hanya ce da zai iya isar wa mutane sako musamman idan ya ga ɓarna sai ya gyara. Ya ce wakokinsa da dama sun kawo sauyi, domin akwai wata waƙarsa mai suna 'Ga Wuri Ga Waina' wadda a ciki ne ya yi magana kan makomar wanda ya kashe kansa. Ya ce a sakamakon haka ""akwai waɗanda suka kira ni suka ce na yi ceto, ma'ana na ƙwaci wata yarinya daga halaka, tana ƙoƙarin halaka kanta ta ji waƙar 'Ga Wuri Ga Waina' ta bari"". Mawaƙin ya ce akwai waƙarsa ta Tambihi wadda a sakamakon haka ne wani mahaifi da ya yi niyyar yi wa 'yarsa auren dole ya daina. A irin waƙoƙi masu isar da saƙo dai da Nura ya yi akwai ta 'Dafin S' wadda ya ce ""a waƙar na yi maganganu daban-daban wanda akwai wanda ya kira ni ya ce a dalilin wannan har ya yi fushi matarsa har ta yi yaji, don haka abin da na faɗi na matsayin da so yake da shi,  hakan ya ja suka yi sulhu ya dawo da abarsa."" Nura ya bayyana cewa duk a cikin waƙoƙi ya fi son waƙar soyayya, sakamakon babu abin da ya fi so fiye da soyayya a rayuwarsa. Ya bayyana cewa ya yi waƙoƙi da dama tun bayan da ya fara waƙa, amma waƙar da ya fi so ko kuma ta zama bakandamiyarsa ita ce Rigar Aro. A hirar da aka yi da shi, ya kuma bayyana dalilin da ya sa ba a cika ganinsa a cikin fina-finai ba, ya ce ""ni mutum ne wanda ina so in ɗauki layi guda ɗaya, in ba shi ƙarfi, ni shi na zaɓa, ni ba ni da ra'ayin fim""."	https://www.bbc.com/hausa/labarai-53097128
business	Iskar Gas: Jamus ta juya wa Amurka baya saboda Rasha	Jamus ta bi sahun Rasha wajen yin tir da matakin da Amurka da dauka na sanya wa takunkumi a kan shirin Rasha na shimfida bututun iskar gas daga Rasha zuwa Jamus. Mai magana da yawun Shugabar gwamnatin jamus Angela Merkel ta yi watsi da takunkumin da cewa za su yiwa kamfanonin Jamus da ma na Tarayyar Turai illa matuka. Angela Markel ta bayyana takunkumin na Amurka a kan shirin da aka fi sani da suna Nord Stream Two gas pipeline, a matsayin katsalandan ga harkokin cikin gidan Jamus. Tuni dai Rasha da makwabciyarta Ukraine suka rattaba hannu kan yarjejeniyar amfani da bututun gas din. Bututun wanda Rasha za ta yi amani da shi wurin aikawa da iskar gas zuwa Tarayyar Turai na tsawon shekara biyar ya ratsa ne ta cikin Ukraine domin. Yarjejeniyar ta kunshi tsabar kudi dala biliyan 2.9 da Rashan ta biya Ukraine domin biyan wasu batutuwan sarkakiyar sharia tsakanin kasashen biyu. Rasha Ukraine sun kuma amince da tsarin damar sake tsawaita yarjejeniyar 5 da karin shekara goma. Masu sharshi na kallon hakan a matsayin babban cigaban dangantaka tsakanin makwabtan biyu masu gaba da juna. Takun saka tsakanin kasashen ya biyo bayan matakin Rasha na mamaye yankin Crimea da ke Ukraine zuwa karkashin ikonta a cikin shekara ta 2014. Kazalika  matakin Rasha na nuna goyn bayanta ga 'yan aware a gabashin Ukraine.	https://www.bbc.com/hausa/labarai-50879694
religion	Hukuncin ɗanɗana abinci ga mai azumi a Musulunci	Ku latsa hoton da ke sama don kallon bidiyon: Shin idan mace mai azumi tana girki za ta iya ɗanɗana abinci gabanin shan ruwa? Ga amsar da Sheikh Aminu Ibrahim Daurawa ya bayar.	https://www.bbc.com/hausa/media-56778070
entertainment	Yarima Harry da maiɗakinsa Meghan sun sami karuwar jaririya	"Duke na Sussex Yarima Harry da maiɗakinsa Duchess Meghan sun sanar da cewa sun sami ƙaruwar jaririya. An haifi Lilibet ""Lili"" Diana Mountbatten-Windsor ne da safiyar ranar Juma'a a wani asibiti da ke birnin Santa Barbara ta Jihar California. Wata sanarwa da iyalan gidan Yarima Harry su ka fitar na cewa jaririya Lilibet da mahaifiyarta Meghan na cikin koshin lafiya a gida. Fadar Buckingham ta ce: ""Sarauniya da Yariman Wales da Duchess na Cornwall da kuma Duke da Duchess na Cambridge na murnar samun wannan labari mai faranta rai."" Yarima Harry da Meghan sun sanar da cewa sun raɗawa jaririyar, wadda ita ce ta biyu cikin 'ya'yansu, sunan Lilibet saboda wani laƙani ne da ake kiran Sarauniya da shi, wadda ita ce mahaifiyar kakan jaririyar. Ɗaya sunan na ta wato Diana, sun zaɓo shi ne domin karrama kakarta marigayiya Gimbiya Diana ta Wales, inji sanarwar. An dai haifi Lilibet ne da karfe 11:40 agogon Jihar California ta Amurka, kuma a halin yanzu tana gida tare da iyayenta. Ita ce tattaɓa-kunnen Sarauniya ta 11, kuma ta takwas a jerin wadanda za su gaji gadon sarautar Ingila. Firaministan Birtaniya Boris Johnson ya aika da sakon taya murnarsa ga iyayen, kuma jagoran jam'iyyar adawa ta Labour Sir Keir Starmer ma ya yaba da labarin da ya samu na haihuwar. Yarima Harry mai shekara 36 ya fara ganin Meghan ce mai shekara 39 yayin wani biki da aka yi a fadar Windsor, kuma a watan Mayun 2018 su ka yi aure, inda bayan shekara guda kuma su ka sami karuwar da namiji mai suna Archie Harrison Mountbatten-Windsor. Saboda janyewa da Yarima Harry da mai dakinsa Meghan su ka yi daga ayyuka a fadar Ingila kuma su ka koma Amurka da zama, jaririya Lilibet ta kasance jikar gidan ta farko da aka taba haihuwa a wata kasar waje. Me ya sa suka zaɓi suna 'Lilibet' Lilibet - wanda laƙanin Sarauniya ne - ya zama inkiyarta ne tun ta na ƙarama kuma ba ta iya faɗin sunanta ""Elizabeth"" sosai. A watan Nuwamba, Meghan ta bayyana cewa ta yi ɓarin cikin da ta ke ɗauke da shi cikin watannin da su ka gabata. Ta bayyana cewa ta shiga wani mawuyacin hali cikin wani labari da ta wallafa da kanta a jaridar New York Times."	https://www.bbc.com/hausa/labarai-57379854
religion	Malamin cocin da ke gina masallaci	"Wani Malamin Cocin Orthodox da ke Habasha na tara kudi domin gina coci da masallaci a yammacin Hararge da ke yankin Oromia na kasar. Coci da masallacin a garin Lange sun kasance cikin yanayi na rashin gyara sa'annan al'ummar garin ba su da kudin yi musu gyara. Malamin cocin mai suna, Abba Aklilemariyam Komos ya fada wa wakilin BBC Afaan Oromoo cewa, ""Allah zai yi fushi"" da shi idan ya gina coci kadai ya kuma yi watsi da yanayin masallacin. Ya samo dabarar tara kudin ne a shekarar 2015 yayin wata ziyara da ya kai garin Lange, a lokacin da ya fahimci yadda cocin garin yake. Tuni dai ya fadada shirin ya hada da gina sabon masallaci. Ya bayyana cewa,""idan har na tara kudi na gina coci-coci kawai alhalin masallacin 'yan uwana musulmai na bukatar hakan, Allah zai yi fushi da ni. Akidarmu ba daya ba ce, amma soyayya daya ce."" Ya sanarwa da shugabannin majalisar koli ta harkokin addinin Musuluncin Habasha da su yadda cewa da gaske yake. ""Na fara karbar kudin a watan Oktoban 2018 inda na fara zuwa masallacin Nur da ke Addis Ababa. Kafin a kai watanni biyu, mun karbi fiye da birr 200,000 na Habasha kwatankwacin dala 6,200"". Inji shi."	https://www.bbc.com/hausa/labarai-51280166
politics	Ko Tinubu ya fara yakin neman zaben 2023 daga Jihar Kano ne?	"Masana harkokin siyasa a Najeriya sun fara tsokaci kan bikin zagayowar ranar haihuwar Sanata Ahmad Bola Tinubu, jigo a jam'iyyar APC mai mulki da za a yi a Jihar Kanon Najeriya. Wannan ne karon farko da ake yin bikin a wata jiha da ke arewacin Najeriyar, inda a baya an fi yin bikin a mahaifar Tinubu wato Legas. Gabanin taron, Tinubu ya kai ziyara tare da duba wasu daga cikin ayyukan da gwamnatin Kano ta yi, sannan ya gana da ƙabilun yankin kudancin kasar mazauna Kano da kuma wasu daga cikin malaman addinin Musulunci. Kafin zuwansa Kano, Tinubu ya je Jihar Katsina a makon da ya gabata, har ma ya bai wa 'ƴan kasuwar da gobarar babbar kasuwar jihar ta shafa tallafi. A na sa ran manyan ƴan siyasa daga jam'iyyar APC da masu riƙe da muƙamai daga sassan ƙasar daban-daban za su je Kano don halartar wannan biki. Sai dai mai bai wa Shugaba Muhammadu Buhari shawara kan harkokin siyasa, Sanata Babafemi Ojudu, ya wallafa a shafinsa na Facebook cewa rashin kyawun yanayi ya hana wasu manyan ƙasar da dama tafiya Kanon. Ya ce: ""Mataimakin shugaban kasa Farfesa Yemi Asinbajo, da Sakataren Gwamnatin Tarayya Boss Mustapha, da Kakakin Majalisar Wakilai Femi Gbajabiamila da ni kaina ba za mu samu damar halartar taron ba, sakamakon rashin kyawun yanayi da ake fama da shi a Kanon, dalilin da ya hana tashi da saukar jiragen sama."" Malam Kabiru Sufi, masanin kimiyyar siyasa ne a kwalejin share fagen shiga jami'a ta CAS a Kano, yana da ra'ayin cewa lallai da walakin goro a miya. A cewarsa: ''Bisa al'ada a birnin Lagos ake yin bikin, amma abin mamaki bana an kawo shi arewacin Najeriya kuma a Jihar Kano, wannan ya nuna tabbas akwai alaƙa ta manufar Tinubu ta yada manufar siyasarsa a shekarar 2023, a matsayin dan takarar shugaban kasa karkashin jam'iyyar APC mai mulki''. Ƴan adawa ke yaɗa jita-jitar ɓaraka tsakanin Buhari da Tinubu - Fadar Shugaban Ƙasa Kabiru Sufi ya ce tuni an samu masu sukar matakin, wadanda suke ganin a baya-bayan nan da aka yi ta samun tashin hankali a yankin Yarabawa Tinubu bai ce komai ba, alhalin yana daga cikin masu karfin fada-a-ji a yankin nasu. ''Wannan ya nuna lallai akwai siyasa a lamarin, kuma ana ganin zabar arewa da ya yi ba lallai 'yan arewa su yi murna da shi ba. ""To amma wasu na ganin an fito da muhimmancin Jihar Kano a siyasar arewacin Najeriya, tun da har Tinubu ya zabe ta a matsayin inda zai fara kada gogen share fagen siyasar 2023,'' in ji Sufi. Masu lura da al'amuran yau da kullum ba su yi mamakin goron gayyatar da aka bai wa Tinubu zuwa Kano ba, ganin cewa da ma Gwamna Abdullahi Umar Ganduje na goyon bayansa, sannan ba za a gane tasirin taron ta nasara ko akasin haka ba sai an kammala shi da kuma abin da ya biyo bayansa. Malam Kabiru Sufi ya ce ziyarar da Tinubu ke kai wa jihohin arewacin kasar duk na daga cikin zawarcin kuri'u na al'ummar yankin. Menene alfanu da nakasun wannan ziyara ga jam'iyyar APC? ''Hakan zai iya zama alfanu ko naƙasu ga ita jam'iyyar APC, musamman idan jam'iyyun adawa suka tsaya tsaf suka dubi al'amarin suka yi wani shiri da zai ba su riba, sabanin wanda APC ta fara yi a yanzu, to zai iya zama nakasu a gare ta,"" in ji Kabiru Sufi. ""Amma idan fara shirin da suka yi da wuri bai sa jam'iyyun adawa sun farga sun fara nasu shirin ba, to APC za ta ci nasara da gajiyar wannan taro da na murnar zagayowar ranar haihuwar shi Bola Ahmad Tinubu a jihar Kano. ""Amma su kansu jam'iyyun adawar za su iya amfani da damar da suke da ita, idan aka yi la'akari da rarrabuwar kawuna da barakar da ke cikin jam'iyyar APC, za su iya cin gajiyar hakan,'' in ji Kabiru Sufi. Me 'ƴan Najeriya ke cewa kan cikar Tinubu shekara 69? Tun da sanyin safiyar Litinin, shafin sada zumunta na Twitter ya ɗauki batun cikar Bola Tinubu shekara 69 a duniya baki ɗaya. An ƙaddamar da maudu'i mai taken #Jagaban da kuma #TinubuIsKey, aka yi ta amfani da su wajen taya shi murnar cika waɗannan shekaru. Wasu sun yi ta kuranta shi, wasu kuma suna amfani da damar wajen sukarsa. Akasarin saƙonnin da mutane ke wallafawa a shafin suna nuni ne da cewa suna fatan shi ne zai tsaya takarar shugaban ƙasa a 2023, kuma suna maraba da hakan. A hannu guda kuma, akwai masu rajin cewa bai kamata matasa su zaƙe wajen assasa batun tsayar da Tinubu takara a shkearar 2023 ba, inda suke cewa lokaci ya zo da ya kamata a bai wa matasa dama su karbi ragamar mulkin. Ga dai abin da wasu ke cewa: @apro_dawildcat ya ce: ""Barka da zagayowar ranar haihuwarka Asiwaju na Lagos, Jagaban ɗin Lagos, jagoran siyasar yammacin Najeriya: shugaban jam'iyyar APC, Asiwaju Bola Ahmed Tinubu. Allah Ya ja kwana. @IsaTochukwu ya ce: ""Asiwaju na Lagos. Allah Ya kara maka kwanciyar hankali, tausayi da nutsuwa a yanzu da koyaushe. #Jagaban@69! @Okeydegeneral ya ce: Ƴan Najeriya ba su san kansu ba! A watan Oktoban bara lokacin zanga-zangar #EndSARs, duk batun da ake yi ba yadda matasa da jam'iyyunsu za su mamaye zaɓukan 2023 ba ne. ""Bayan wata biyar sai ga shi ana ta zancen Jagaban Bola Ahmed Tinubu da Atiku da sauransu. Har yanzu ba mu koyi komai daga shekarar 2015 ba."""	https://www.bbc.com/hausa/rahotanni-56565038
technology	Daliban Jami'ar Bayero Kano sun kirkiri gawayi maras hayaki	Ku latsa hoton da ke sama don kallon bidiyon Wasu dalibai uku a Jami'ar Bayero a Kano da ke Najeriya sun kirkiro wata fasaha ta samar da gawayi wanda ba ya hayaki. Suna hada gawayin ne ta hanyar amfani da sharar gona wadda bayan an girbe ake bari a gona irin su karare da su buntun shinkafa wadanda ba su da amfani sosai ga manoma. Suna sayen sharar ne kan kowane kilo sai su karba su kai masana'antarsu inda ake sarrafawa. Matasan dai sun hadu ne a wajen taro inda suka tattauna yadda za su kirkiro wannan fasahar. Da aka bude wata gasa ta kasar Ingila a Jami'ar Bayero, sai suka kirkiro fasahar sannan aka hada musu ita a Cibiyar Kyankyasar Fasaha da ke Kano, Technology Incubation Centre. Bayan an hada fasahar, sai suka halarci wannan gasar inda suka yi na daya, wanda hakan ya ba su damar zuwa birnin tarayya Abuja inda aka yi gasar yanki ta kasashen Afirka, kuma suka sake zuwa na daya. Don haka suka samu zuwa Ingila inda suka halarci wani shirin bunkasa da horar da mutane masu fasaha. Yanzu haka daya daga cikinsu ya koma Ingila inda idan suka yi sa'a zai ba su damar shiga cikin tawagar mutum shida da za su je Majalisar Dinkin Duniya a birnin New York na Amurka, domin gabatar da fasaharsu. Idan suka yi dace za su iya samun goyon bayan da zai bai wa mutum 10,000 damar samun aikin yi nan da shekara 10. Mata da yawa a Afirka suna fama da cututtuka ko suna mutuwa sakamakon hayakin da suke shaka wajen girke-girke. Haka zalika, sare bishiyoyin da ake yi wajen samar da gawayin itace na daya daga cikin dalilan da ke janyo kwararowar hamada da sauyin yanayi. Da wannan tunanin ne, tawagar daliban mai suna Brycoal ta ga wannan fasahar ta dace wajen bayar da gudunmowa a Najeriya. Bidiyo: Fatima Othman	https://www.bbc.com/hausa/labarai-49531404
technology	Abubuwa biyar da suka kamata ku sani game da sabunta Apple iOS 14.5	"Apple ya sanar da fitar da sabuwar babbar manhajarsa ta iOS 14.5 a wayar salula ta iPhone da kuma iPad. Manhajar za ta bai wa mutum zabi idan yana son kamfanoni su sani a lokacin da yake amfani da shafukan sada zumunta. Amma ga wasu abubuwan da suka ja hankalinmu. Abin da aka sani shi ne wayoyin hannu na zamani na da fasahar da ke amfani da fuska wurin bude waya. To a wannan sabuwar babbar manhaja ta iOS 14.5 mutum kan iya bude wayarsa ko da kuwa ya rufe fuskarsa baki daya. Baya ga waya,  za a iya amfani da wannan fasaha wurin bude agogon hannu da ake kira Apple Watch. A sanarwar da Apple ya fitar ya ce: ""Matsawar kana sanye da agogon Apple Watch, za ka iya kallon wayarka ta iPhone kuma a take za ta bude, yayin da agogonka zai fada maka cewa wayarka ta bude."" Wato abin nufi a nan shi ne idan mutum yana so wayarsa da agogonsa za su rika aiki tare. Ko kuma za ka iya bude wayarka ta hanyar kallon agogonka. Haka kumma sabon iOS din ya zo da wata manhaja da za ta ba mai amfani da iPhone zabi idan har yana so wata manhaja, misali Facebook ya samu bayani a lokacin da kake kan intanet (wato online) ko kuma a'a. Wannan manhaja ce ta haifar da ce-ce-ku-ce, don a baya sauran manhajoji kamar Facebook na amfani da cewa mutum na onlayin sai su tura masa talla ta hanyar bibiyar abubuwan da ka fi sha'awa a intanet. A yanzu kuma sabon iOS 14.5 ya ba da zabi. A kan haka kamfanin Facebook ya fito fili ya nuna adawa da wannan manhaja. Sai dai masana na zargin Apple da nuna son kai. Dalili kuwa shi ne kamfanoni na samun kudade wurin tallace-tallace da suke karba, kuma idan har hakan ba ta samu ba to kuwa za su fara sayar da manhajojinsu wanda hakan zai sa Apple ta samu makudan kudi. Baya ga manhajojin, Apple ya samar da sabbin hotunan da ake amfani da su wurin sadarwa ko kuma nuna yanayin da mutum ke ciki da ake kira emojis. Daga cikinsu akwai fuskar da ke nuna cewa ana mura, da kuma zuciya mai ci da wuta da kuma mace mai gemu da dai sauransu. Apple ya kuma sanar da ƙara inganta manhajarsa ta 'Siri' wata murya da masu amfani da Apple ke iya sakawa aiki a wayarka. A sabon iOS Apple ya ba masu amfani da wayarsa zabin muryar da suke so su ji a 'Siri', sabanin a baya da murya daya ce kawai. Apple ya ce ya yi wannan sauyi ne la'akari da cewa ya kamata a bai wa jama'a zabin irin muryar da suke so su ji a wayoyinsu. Amma masu suka sun ce duk da a China Apple ke kera kayansa, kamfanin bai taba fitowa ya soki cin zarafin da gwamnatin kasar ke yi wa yan ƙabilar Uighur ba. A kan haka masu sukar suka ce ya kamata Apple ya riƙa yin allah-wadai a gida da waje ba tare da nuna bambanci ba. AirTags ita kuma wata na'ura ce da za ta iya gano wa mutum kayansa da suka ɓata. Za ka iya maƙala wannan ƴar ƙaramar na'urar da ke kama da zobe a jikin makulli ko jaka ko wani kaya mai muhimmanci, saboda ka iya gano inda suke da zarar sun ɓata. Amma wannan na'ura ta Apple AirTag na kamanceceniya da wata irinta da ke kasuwa mai suna 'Tile'. Ko a makon da ya gabata majalisar dattawan Amurka ta zargi Apple da satar fasahar 'Tile'. Ita ma shugabar kamfanin na Tile Kirsten Daru ta sanar cewa ""muna maraba da takara a harkar kasuwanci, amma kuma ya kamata ta zama tsabtatacciyar takara ba irin yadda Apple ya yi ba a wannan karon. Hakan bai dace ba."" To amma Apple ya mayar da martani cewa bai saci fasahar Tile ba, kuma na'urarsa ta AirTag kwata-kwata ba ta kama da komai a kasuwa, a cewar Kyle Andeer na kamfanin Apple."	https://www.bbc.com/hausa/labarai-56900117
politics	Najeriya: Majalisar dokokin Najeriya ta tafi hutu ta bar baya da ƙura kan ƙudurori	"Bisa dukkan alamu matakin amincewa da wasu muhimman ƙudurorin dokoki da ƴan majalisun dokokin Najeriya suka yi ya bar baya da ƙura, kasancewar babbar jam'iyyar hamayyar kasar, wato PDP ta ce za ta ƙalubalanci wasu kudurori biyu. Kudurorin na da matuƙar muhimmanci ga tattalin arziki da kuma dimokuraɗiyyar kasar. Wannan na faruwa ne yayin da ƴan majalisar suka fara hutunsu na shekara-shekara. A makon jiya ne ƴan majalisar dattawa da ta wakilai suka amince da ƙudurin gyara ga dokar zaɓe a wani yanayi mai taƙaddama, saboda ƴan PDP sun ce sai an sanya batun amfani da laturoni wajen kaɗa ƙuri'a da kuma sanar da sakamakon zaɓe. Kudurin da bangarori biyu da majalisar suka amince da shi bai tanadi cewa dole a yi amfani da na'urar kwamfuta wajen kaɗa ƙuri'a da kuma aikewa da sakamakon zaɓe zuwa cibiyar tattara sakamako ba. Haka nan majalisun sun amince da ƙudurin yin garambawul ga harkar man fetur wanda shi ma wasu ƴan PDP ke nuna tirjiya a kai. Suna neman a ƙara kudaden da kamfanoni za su dinga keɓe wa al'umomin da ake haƙar mai a yankunansu zuwa kashi bakwai cikin dari na jarin kamfanonin, amma majalisun suka yi watsi da wannan bukatar. Majalisun dai sun amince da a riƙa kebe kashi uku cikin dari ne ga al'umomin a sabuwar dokar, wanda ke nufin an yi wa al'umomin karin rabin kashi daya a kan adadin da aka saba ware masu. Wasu labaran masu alaƙa 'PDP Za ta kai kara kotu' To sai dai duk da cewa Majalisar Dokokin ta kasa ta amincewa da ƙududorin biyu ta hanyar kaɗa ƙuri'a tsakanin 'yan majalisar, bisa dukkan alamu jam'iyyar PDP mai hamayya ba ta gamsu da matakin bangarori biyu na majalisar ba. Sakamakon rashin gamsuwar, jam'iyyar PDP ta ce za ta ƙalubalanci matakin a kotu. Jam'iyyar APC mai mulki ce ke da rinjayen wakilai a cikin ɓangarorin biyu na majalisa - wato Majalisar Wakilai ta Tarayya da kuma Majalisar Dattawa. An ambato shugaban PDP na kasa, Mr Uche Secondus na cewa ƙin amincewar majalisun dokokin a sanya shaɗarar doka da za ta wajabta aikewa da sakamakon zabe zuwa cibiyar tattara sakamako ta hanyar amfani da laturoni, alama ce ta yadda APC ""ba ta da niyyar ƙarfafa dimokuradiyyar Najeriya."" PDP ta ce tabbatar da zaɓe nagari, cikin ƴanci da kamanta adalci, shi ne gimshikin dimokuradiyya. Mista Secondus ya bayyyana cewa ""PDP za ta dauki dukkan matakan shari'a da suka wajaba"" don ganin matakin ƴan jam'iyyar APC a majalisar bai tabbata ba. Tun farko dai PDP ta ce ba ta goyon bayan wasu sassa na shi ma ƙudurin dokar yi wa harkar man fetur a Najeriya garambawul. Musamman yadda majalisar dokokin ta kasa ta amince da 3% a matsayin kason da za a riƙa keɓe wa al'umomin da ake haƙo man fetur a yankunansu. PDP da kuma wasu gwamnonin kudancin Najeriya na ganin kamata ya yi adadin kason ya ruɓanya hakan. Kawo yanzu dai babu tabbas kan lokacin da jam'iyyar ta PDP za ta shigar da kara, da kuma irin hujjoji da zata gabatar a gaban kotu. To amma bisa dukkan alamu lamarin na tayar da kura. Sai dai ƴan APC na cewa PDP na neman nade tabarmar kunya ne kawai domin kuwa tun da har majalisa ta riga ta amince da ƙudurorin, to batun zuwa kotu ba zai yi tasiri ba. Sanata Abdullahi Adamu, dan majalisar dattawa daga jam'iyyar APC mai mulki ya ce ''sambatu'' kawai shuwagabanni na jam'iyyar PDP ke yi, da nufin nuna wa talakawa masu goyon bayansu cewa wakilansu a majalisa ba su bayar da kai ba. Sanata Abdullahi ya shaida wa BBC cewa ba sa tsoron zuwa kotu domin ''kotu ta kowa ce'' kuma duk wanda ya ji an yi masa ba daidai ba yana da 'yancin zuwa kotu. To amma ya ce a ganinsa lamarin ƙudurorin bai bar baya da ƙura ba. Sanata Abdullahi ya ce kamata ya yi 'yan PDP su haƙura, su haɗa kai da sauran ƴan majalisa domin ciyar da kasa gaba - domin kuwa dama lamarin majalisa, batu ne na masu rinjaye ake amfani da ra'ayinsu. Ya musanta zargin ƙumbiya-ƙumbiya da rashin nuna gaskiya wajen amincewa da ƙudurorin a majalisa, yana mai cewa an bi ƙa'ida. Kawo yanzu dai abin da ya rage don ƙudurorin sun zamo cikakkun dokoki shi ne a miƙa wa shugaban kasa Muhammadu Buhari ya sanya hannu a kansu. A cewar Abdullahi Adamu, abin da aka amince da shi a majalisa ya zauna kuma ''mai kwance wannan abu kawai sai Allah da ya yi mu.'' Wannan dambarwa tsakanin manyan jam'iyyun siyasar Najeriya dai ta bayyana ƙarara tun lokacin da ake tafka muhawara a cikin majalisa. A wasu lokutan sai da aka bai wa hamata iska tsakanin 'yan majalisa sakamakon saɓanin ra'ayi kan ƙudurorin. Kudurorin dokokin guda biyu na daga cikin mafiya muhimmanci da majalisar dokokin ta kasa ta tafka muhawwara a kansu ta kuma amince da su cikin aikinta na tsawon shekaru. Misali, shirin dokar yin garambawul ga harkar man fetur a Najeriya ya shafe fiye da shekaru goma a gaban majalisar, inda duk yunkurin da aka yi a baya na amince da shi ya faskara. Tattalin arzikin Najeriya dai ya dogara ne kusan kacokam kan albarkatun man fetur. Wannan ya sanya duk abin da ya shafi bangaren man fetur kan shafi kasar, da kuma janyo muhawara tsakanin shugabanni da kuma talakawa. Shi ma ƙudurin yi wa dokokin zabe gyaran fuska na da muhimmanci ga makomar Najeriya ganin kasar na tunkarar muhimman manyan zabuka a 2023 - wato nan da kasa da shekaru biyu masu zuwa. Abin da wannan kuma ke nufi shi ne dokar za ta yi tasiri kan tafiyar dimokuradiyyar kasar. A cikin watan Satumba ne dai ake sa ran ƴan majalisar za nsu kammala hutunsu kana su koma bakin aiki na zaman majalisa. Babu tabbas kan abin da zai kasance yayin da 'yan majalisar wakilan da 'yan majalisar dattawa suka dawo daga hutun."	https://www.bbc.com/hausa/57911233
