politics	Tinubu ló sanwó ta fi gbé òkú Moji Olaiya wá láti òke òkun - Jide Kosoko	Yorùbá bọ̀ wọ́n ní ọmọ ẹni kò ní ṣe ìdí bẹ̀bẹ̀rẹ̀ kákó ìlẹ̀kẹ̀ sídìí ọmọ ẹlòmíràn. Nínú ọ̀sẹ̀ yìí ni fídíò kan gba orí ayélujára tó ṣàfihàn àwọn àgbà ọ̀jẹ̀ nínú eré tíátà Yorùbá níbi tí wọ́n ti ń ṣe àtìlẹyìn fún olùdíje sípò Ààrẹ ẹgbẹ́ òṣèlú All Progressives Congress, Asiwaju Bola Ahmed Tinubu. Lára àwọn tó wà nínú fídíò náà ni Jide Kosoko, Adebayo Salami, tí ọ̀pọ̀ mọ̀ sí ọga Bello, Foluke Daramola, Fausa Balogun, Yinka Quadri, Taiwo Haasan Ogogo, Iya Awero àti bẹ́ẹ̀ bẹ́ẹ̀ lọ. Fídíò yìí ló ti ń fa ọ̀pọ̀lọpọ̀ awuyewuye lórí ayélujára pàápàá láàárín àwọn ọ̀dọ́ tí wọ́n ń sọ wí pé kò yẹ kí àwọn àgbà òṣèré máa fi ipò wọn ṣe ìpolongo fún àwọn olóṣèlú. Ẹ̀wẹ̀, nígbà tí Jide Kosoko ń bá àwọn akọ̀ròyìn sọ̀rọ̀, ó ní ipa tí Tinubu ti kó nínú ìgbésí ayé ọ̀pọ̀lọpọ̀ àwọn òṣèré tíátà kò ṣé fi ọwọ́ rọ́ sẹ́yìn rárá. Kosoko ní Tinubu kìí kan ṣe olórí lásán bíkòṣe aláàánú, tó fi ọrọ̀ rẹ̀ mọ àwọn òṣèré tíátà náà. Ó ní ìdí nìyí tí àwọn náà fi ń gbá rùkù tìí, tí àwọn sì ń ṣe ìpolongo fún-un. “Ọ̀pọ̀lọpọ̀ ènìyàn ni Asiwaju ti fa lọ́wọ́ sókè nínú eré tíátà pàápàá àwọn tó bá ní ìpèníjà ìlera”. “Nígbà tí Moji Olaiya kú sí orílẹ̀ èdè Canada, Tinubu ló san gbogbo owó tí wọ́n fi gbé òkú rẹ̀ wá sí orílẹ̀ èdè Nàìjíríà.” Bákan náà ló ní ìyàwó Tinubu náà ti ṣe ọ̀pọ̀lọpọ̀ àǹfàní fún ọ̀kan-ò-jọ̀kan ènìyàn nínú eré tíátà tí àwọn kò le kà tán. Fídíò yìí ló ti ń fa ọ̀pọ̀lọpọ̀ awuyewuye lórí ayélujára pàápàá láàárín àwọn ọ̀dọ́ tí wọ́n ń sọ wí pé kò yẹ kí àwọn àgbà òṣèré máa fi ipò wọn ṣe ìpolongo fún àwọn olóṣèlú. Ẹ̀wẹ̀, nígbà tí Jide Kosoko ń bá àwọn akọ̀ròyìn sọ̀rọ̀, ó ní ipa tí Tinubu ti kó nínú ìgbésí ayé ọ̀pọ̀lọpọ̀ àwọn òṣèré tíátà kò ṣé fi ọwọ́ rọ́ sẹ́yìn rárá. Kosoko ní Tinubu kìí kan ṣe olórí lásán bíkòṣe aláàánú, tó fi ọrọ̀ rẹ̀ mọ àwọn òṣèré tíátà náà. Ó ní ìdí nìyí tí àwọn náà fi ń gbá rùkù tìí, tí àwọn sì ń ṣe ìpolongo fún-un. “Ọ̀pọ̀lọpọ̀ ènìyàn ni Asiwaju ti fa lọ́wọ́ sókè nínú eré tíátà pàápàá àwọn tó bá ní ìpèníjà ìlera”. “Nígbà tí Moji Olaiya kú sí orílẹ̀ èdè Canada, Tinubu ló san gbogbo owó tí wọ́n fi gbé òkú rẹ̀ wá sí orílẹ̀ èdè Nàìjíríà.” Bákan náà ló ní ìyàwó Tinubu náà ti ṣe ọ̀pọ̀lọpọ̀ àǹfàní fún ọ̀kan-ò-jọ̀kan ènìyàn nínú erér tíátà tí àwọn kò le kà tán.	https://www.bbc.com/yoruba/articles/cm5vj89m208o
health	Mouth odour: Ọ̀nà márùn-ún tí o lè gbà láti ṣẹ́gun ẹnu rírùn àti ìṣòrò eyín	Láti igba ti olukuluku ti wa ni ọmọde lo ti n gbọ pe ẹẹmeeji lojumọ lo yẹ ki eniyan maa fọ eyin. Ṣugbọn awọn onimọ iṣegun ti ṣalaye ọna ti o le gba gbogun ti isoro eyin didun ati ẹnu rirun, erigi to n ṣẹjẹ ati awọn inira eyin miiran. Gẹgẹ bi wọn se sọ awọn koko yii ni lati sọna bi eyin awọn eniyan ko se ni maa ra ti yoo si fa iṣoro eyin didun. Máa ṣan ẹnu rẹ nu ni kete ti o ba fi ọṣẹ fọyin tan Ajọ eto ilera lorilede UK (NHS) gba awọn eniyan niyanju pe ti o ba ti fọ ẹnu tan, o le tu ọṣẹ ifọyin rẹ danu ṣugbọn ma ṣan ẹnu rẹ ni kiakia. Idi eyi ni pe ti o ba ṣan yoo ṣan eroja Floride ti o yé ki o pa kokoro to wa ninu eyin rẹ danu. NHS fi kun imọran rẹ pe, ki enikẹni ma ṣe maa lo igi itayin yọ ounjẹ to ba ha sinu eyin kuro. Idi eyi ni pe, o le gun erigi ti yoo di egbo ti yoo si fa aisan sinu eyin naa. Imọran ti wọn fi kun un ni pe ki eniyan lo okun tinrin ti o ba ni eji laarin awọn eyin rẹ lati yọohunkohun to ba ha sibẹ kuro. Eyi ni ti o ba fi okun tabi owu tinrin si aarin eyin rẹ lati yọ idọti to ba wa nibẹ kuro. O dara ki eniyan maa lo okun lati yọ idọti kuro ninu eyin rẹ,n itori ajọ NHS sọ pe ti eniyan ba n se eyi deede yoo mu adinku ba awọn aisan to maa n ṣe eyin. Wọn ni eyi ni yoo yọ gbogbo idọti to wa ninu eyin. NHS fi imọran sita pe omi ifọyin lẹyin ti o ba ti fọnu tan, o le ṣe isẹ ti omi naa yoo se lati san gbogbo ọṣẹ ti o fi fọnu kuro lẹnu. Lakotan NHS sọ pe o ṣe pataki lati maa ba ọmọ fọnu titi yoo fi pe ọmọ ọdun meje. Imọran naa ni pe, ti o ko ba le ran lọwọ o yẹ  ki o moju too bi o se n fọọ titi ti yoo fi pe ọdun meje	https://www.bbc.com/yoruba/58810705
entertainment	Bunmi Akinnanu: Ọlọ́run kìí fún èèyàn méjì ní orin ẹ̀mí kan ṣoṣo, ẹ jẹ́ ká ṣe sùúrù	Gbajugbaja akọrin ẹmi kan, Bunmi Akinnanu to kọ orin Omije Oju mi n beere aanu rẹ, ti ke si awọn akẹẹgbẹ rẹ lati mase da orin ẹmi papọ mọ orin aye. Akinnanu, lasiko to n ba BBC Yoruba fi ọrọ jomitorro ọrọ lo gbe imọran yii kalẹ, to si tun woye pe o yẹ ki orin aye wa ni ẹgbẹ kan ni, ki orin ẹmi naa si wa ni ẹgbẹ kan. O ni orin aye ati orin ẹmi ko jọ ara wọn rara, iyatọ nla lo si wa ni aarin wọn. Bakan naa lo tun salaye pe o yẹ ki awọn olorin ẹmi se suuru fun ara wọn lori bi wọn se maa n kọrin ti ẹlomiran ti kọ, ti wọn yoo si ni Ọlọrun lo dijọ fun awọn mejeeji ni imisi orin naa. “Ọlọrun kii fun eeyan meji ni imisi orin kan soso, awa lo yẹ ka se suuru fun ara wa. Nigba to n salaye bo se di akọrin ẹmi ti aye n tẹwọgba, Bunmi Akinnanu salaye pe inu ẹgbẹ akọrin ọmọ ni oun wa ninu ijọ ECWA to wa ni Mushin. O ni awọn lo sawari talẹnti tuntun ninu oun, ti wọn si si ri pe oun le kọrin, lẹyin igba naa ni oun lọ si ẹgbẹ akọrin fun awọn agbalagba. Omije Oju mi ni inu ẹgbẹ akọrin agba yii ni oun ti ri pe oun naa le fi orin ẹmi jẹun. Akinnanu, lasiko to n sọrọ lori isesi ati ihuwasi awọn akọrin ode iwoyi si ti atijọ, o salaye pe isesi awọn akọrin ẹmi lode oni yatọ pupọ si ti awọn iya to n kọ orin naa laye atijọ. “Iwa ta ba lọwọ awọn iya wa laye atijọ kọ ni a n hu lode oni nitori iyatọ nla lo wa nibẹ. Amọ odabi ẹni pe a tun ti n pada lọ si ti atij nitori gbogbo wa la ti mọ bayii pe ba se da gbogbo rẹ pọ nigba yẹ, ta n lu alujo kiri ti yatọ. Ẹni to gbe igbagbọ dani, ko gbe dani, ẹni to si gbe ti aye dani, ko di mu nitori ko jọ ara wọn rara. Maa ri awọn ẹlomiran, wọn yoo maa lo ‘slang’ aye lorisirisi, maa kan wo pe se eleyi jọ orin ijọba ọrun bi.” Bunmi Akinnanu tun salaye fun BBC Yoruba pe oun si wa ninu ijọ Ecwa lodi si ero awọn eeyan pe oun ti fi ijọ naa silẹ. O salaye pe ipe lati ọdọ Ọlọrun ni orin ti oun nkọ, o si yatọ si akọrin inu ijọ lasan. “Lootọ ni Ọlọrun fa mi dide laarin ECWA amọ wọn ri pe oun to wa ninu mi tobi pupọ. N ko sọ pe ko si wahala laarin wa amọ Ọlọrun ti yanju gbogbo, ti wọn si ti fi mi silẹ. Koda, ti wọn ba fẹ se ajọdun, wọn maa n ransẹ pe mi lati wa kọrin fun wọn.” Bunmi Akinnanu ni o yẹ ki akọrin ẹmi maa ni itẹriba fun awọn to ba niwaju, ko si mase gbe igbesẹ lati bi ẹnikẹni subu. O ni bi wọn ba se ri Akọrin ẹmi, lo yẹ ki wọn daa mọ pe akọrin ẹmi ni, lai si igberaga nibẹ. O wa dupẹ lọwọ awọn ololufẹ rẹ pe wọn seun, wọn ku atilẹyin oun nitori naira kan ati meji ti wọn n na fun oun, lo gba akisa kuro lọrun oun.	https://www.bbc.com/yoruba/afrika-60279371
religion	Easter celebration: FRSC ń sisẹ́ papọ̀ pẹ̀lú iléesẹ́ ìpèsè isẹ́ òdé láti tún àwọn òpópónà Eko sí Ibadan se	Ajo ẹ̀sọ́ aabo FRSC ipinlẹ̀ Ogun àti Eko kede lati rii pe lilọ-bibọ loju marose Eko si Ibadan rọrùn lasiko ọdún Ajinde. Ogbeni Olusegun Ogungbemide to n dari eso oju popo FRSC ni ipinle Eko ati Ogbeni Umar Ahmed to n dari FRSC ipinle Ogun ni won a jo fọwọsowọpọ̀ sise papọ̀ lasiko ọdun Ajinde yii. Ninu atejade ti wọ́n jọ fọwọ́si ni ikede ipese aabo yii ti jade sita. Kini ajo FRSC tun fẹ́ fi pese iranlọ́wọ́ fara ilu lasiko odun yii? Agbenuso fun ajo FRSC, Ogbeni Olabisi Sonusi salaye pe igbesẹ̀ yii yoo jẹ́ ko rọrun fun awon arinrirnajo lati Eko si Ibadan lasiko ọdun Ajinde yii. Bakan naa ni Olusegun Ogungbemide ati Ahmed Umar  se ipade pelu awọn ọ́ga agba ileese ijọ́ba apapọ̀ to n risi isẹ́ òde. Amojuero Adebote salaye pe ajo FRSC, won ti n tun awon opopona se ki irin awọn awakọ le lọ geere. Olusegun Ogungbemide so pe o le ni ẹsọ́ aabo oju popo egberun meji ti wọ́n ti da sita pẹ̀lú ọkọ̀ metadinlogota ati alupopo mẹ́jọ ti wan yoo wa lopopona marose Eko si Ibadan. O ni isẹ́ akanse yii ti bẹ̀rẹ̀ lati Ojoru, ọjọ́ ketala osu yii titi di ọjọ́ru, ogunjọ́ osu yii. Ni ipari, ajo FRSC parọ́wa fun awon awakọ lati rọra sare loju popo ki wọ́n si tẹ̀le ofin oju popo gbogbo. .	https://www.bbc.com/yoruba/61114388
religion	Passover Night: Òjíṣẹ́ Ọlọ́run ní o lè gbàdúrà ìparí ọdún nílé rẹ láì lọ sí ṣọ́ọ̀ṣì	"Lílọ ""Cross-over night"" kò ní kí ọdún ó yabo láì ní ìpinnu tàbí ètò f'ọ́dún tuntun- Pásítọ̀ Ajifowowe Cross-over night: Pásítọ̀ Ajifowowe ní ""o lè gbàdúrà ìparí ọdún nílé rẹ láì lọ sí ṣọ́ọ̀ṣì"" A ko gbọdọ tapa si ofin ijọba lori adura ipari ọdun 2020 si 2021 nitori ajakalẹ arun coronavirus. Pasitọ Alfred Femi Ajifowowe lo sọrọ yii fun BBC Yoruba. Bẹẹ ba gbagbe, ijọba ipinlẹ Eko ti sọ tẹlẹ pe ẹnikẹni to ba tapa si ofin konile o gbele lati ago mejila oru si ago mẹrin owurọ, yoo sanwo itanran lati ẹgbẹrun lọna ogun naira sí ẹgbẹrun lọna ẹẹdẹgbẹta naira. Nigba to n fesi si ọrọ yii, Pasitọ Ajifowowe sọ pe iwe mímọ ní kí a maa bọwọ fun awọn alaṣẹ. O ni ""fun idi eyi, awọn Kristẹni ni lati gbọran, ki wọn si gbadura ipari ọdun yala nile wọn tabi ki wọn ṣe isin ipari ọdun ninu ṣọọṣi wọn ki o si pari si ago mọkanla dipo mejila to maa n pari tẹlẹ."" ""Ni ṣọọṣi tiwa, ago mọkanla alẹ la o pari isin adura opin ọdun wa, ki awọn eeyan le lanfaani lati pada si ile wọn ki iṣede to bẹrẹ laago mejila."" Pasitọ Ajifowowe ni ""lilọ si ""Cross-over night"" ko ni ki ọdun o yabo fun eeyan, bi ko ṣe ki eeyan ni ipinnu lori ọdun tuntun."" Pasitọ Ajifowowe ni ko sí ohun kan ti yoo yipada fun ẹnikẹni ti ko ba ni ipinnu tabi eto fun ọdun tuntun. O ni ko si ohun to wa ninu ""Cross-over night"" ju kí eeyan fi ọna ara rẹ le Ọlọrun lọwọ ninu gbadura lọ. Bakanna, olugbe ilu Eko ti ko darukọ ara rẹ sọ fún BBC Yoruba sọ pe, fun anfaani araalu ni ijọba ṣe sọ pe k'awọn eeyan gbe ile wọn lati ago mejila oru si ago mẹrin owurọ. O ṣalaye siwaju síi pe Ọlọrun gan an lo fi awọn alaṣẹ ijọba sori oye, eyi to tumọ si pe ""a gbọdọ gbọran sí wọn lẹnu."" Arabinrin naa tun sọ pe ko si bi awọn eeyan ko ṣe ni sun mọ ara wọn ju bo ti yẹ lọ ninu isin ""Cross-over night."" Obinrin naa fikun ọrọ rẹ pe awon eeyan le ṣe isin ipari ọdun nile wọn lai lọ si ṣọọṣi. Bi itankalẹ arun Covid-19 ṣe peleke si ni Naijiria, awọn gomina ipinlẹ kọọkan to fi mọ apapọ ẹgbẹ Kristẹni ni Naijiria wọgile ìsìn aisun ọdun tuntun, ti wọn maa ṣe lọdọọdun. Asiko isin yii lawọn ile ìjọsìn máa n fi sadura ati ìsìn lati fi sure nkan daada ti wọn ba n fẹ lọdun tuntun. ""Ìsìn oru ọdun tuntun ""Cross over service"" je ìsìn pàtàkì fawọn Kristẹni àti awọn musulumi kọọkan ṣugbọn nitori ajakalẹ Covid-19, ilana oriṣirisi ni wọn gbé kalẹ t'awọn mi sí wọgile ìsìn naa lodun yii. Awọn ipinlẹ kan nilẹ kaarọ o jiire ti wọgile ìsìn yi patapata lọdọ wọn. Ijọba Eko lo kọkọ wọgile ìsìn oru mojumọ naa, to sì ni awọn ṣe bẹẹ nitori aṣẹ ijọba apapọ lori isede ago mejila oru sí aagọ mẹrin afẹmọjumọ. Pẹlu ilana tí ijọba gbe kalẹ yii, ọpọ àwọn ilé ìjọsìn n gbero lati ko idaji ọmọ ijọ wọn jọ lati ṣe ìsìn, ki gbedeke akoko isede to to. Ni ipinlẹ Ogun, ijọba fòfin de ìsìn aisun ọdun tabi ipejọpọ kankan ni ipinle ọhun. Amọ ṣa ẹgbẹ ọmọ Kristẹni ipinlẹ naa fẹ ki ijọba gbẹsẹ kuro lórí òfin yii. Ijọba Oyo ko fi oju kekere mu ọrọ yii, ti wọn sì ti fohun silẹ pe awọn ko ni yẹ lori ipinu wiwọgile ijọsin aisun ọjọ ọdun. Sugbọn iroyin to tun tẹ wa lọw nirọlẹ Ọjọru lo fi lede pe ìjọba Oyo naa tun ti pahunda, to si faaye gba awọn ile ijọsin lati se aisun ọdun. Amọ o fi ote le pe awọn ọmọ igbimọ amusẹya lori Coronavirus yoo maa lọ yika awọn ile ijọsin naa lati ri pe ero to wa nibẹ ko ju aadọta lọ. Nipinlẹ Ondo, Alaga tẹẹkoto lori kikoju Covid-19 ni ipinlẹ Ondo, Adesegun Fatusi ni, ko daa to ki olori awujọ tabi ẹsin maa kesi awọn eeyan lati tapa si ofin ijọba lori ọrọ ilera. Ni ti ijọba ipinlẹ Osun, o ti kọkọ wọgile isin yii sugbọn wọn tun ipinu wọn da ro. Kọmisana feto iroyin Funke Egbemode sọ pe, ijọba to n gbaroye araalu ni awọn jẹ, nitori naa, lawọn fi yi ipinu pada lori isin aisun ọjọ ọdun tawọn wọgile saaju. O sọ pe ""Ijọba Osun ti pinu lati jẹ ki awọn eeyan korajọ fun isin yii sugbọn ile ijọsin ti yoo ba se isin gbọdọ ri pe awọn eeyan pari rẹ lasiko, ti wọn ko si ni kọja aago kan oru'' Isin Cross over ori ayelujara: Ohun ti ile ijọsin Redeemed Christian Church sọ fun awọn ọmọ ijọ rẹ ni pe lori ayelujara lawọn yoo ti se isin tọdun aisun dun tawọn. Ninu atẹjade ti wọn fi sita, wọn ni eyi wa lati bọwọ fun ilana tawọn ijọba apapọ ati ipinlẹ gbe jade nitori itankalẹ Covid-19. Bakan naa ni ijọ Winners Chapel ti kọkọ kede pe isin aisun ọdun ko ni waye ni gbogbo ẹka ijọ naasutgbọn nigba to ya, lo tun da ọrọ rẹ ro, to si ni isin naa yoo waye pẹlu awọn ilana kan. Bo ti lẹ jẹ wi pe oludasilẹ ijọ naa ti saaju bẹnu atẹ lu idena akojọpọ ijọsin, amọ Bisọọbu David Oyedepo ni oun yi ipinu pada nitori isin tawọn maa n se kii kọja ago mẹwa si ago mẹrin owurọ ni gbogbo ọjọ Kọkanlelọgbọn osu Kejila ọdọọdun. O ni dipo isin oru ọjọ ọdun, awọn yoo se isin lọjọbọ ti yoo gba awọn ni nkan bi wakati meji si mẹta, ati pe, lọjọ ọdun awọn yoo se isin kan laago meje aarọ, tawọn yoo si fi han lori ayelujara. Bẹẹ naa ni oludasilẹ ijọ Mountain of Fire and Miracles Ministry, sọ pe ijọsin awọn yoo waye laarin ago mẹsan si mọkanla. O ni eyi to ku awọn yoo maa se lori ayelujara titi wọ ọjọ ọdun. Ni ti ijọ Deeper, awọn sọ pe ago mẹwa alẹ lawọn yoo bẹrẹ isin aisun ọdun tuntun. Covenant Christian Centre to wa ni Eko sọ pe awọn eeyan yoo kopa ninu isin awọn laarin ago meje alẹ si ago mẹsan alẹ.Amọ eyi to ku awọn yoo se loju opo ayelujara lati ago mọkanla alẹ di ago kan owurọ. CAN ti saaju sọ fun BBC pe awọn ko mọ nkankan nipa ilana ti ijọba gbe kalẹ lori isin oru aisun ọdun sugbọn wọn yi ohun pada ninu atẹjade kan. Aarẹ CAN Samson Ayokunle sọ fun gbogbo awọn ile ijọsin Naijiria lati bọwọ fun ofin ki wọn si tẹle ilana ijọba nipa isin ọjọ aisun ọdun. Wọn ni ko si ''ifarajin to pọju lati wa ọna idẹkun ajakalẹ yi patapaa'' CAN wa parọwa sawọn ile ijọsin gbogbo nipinlẹ ti ijọba ti wọgileisin yi  lati se isin wọn ki ọjọ to lọ ki wọn si palẹmọ o pẹ ju ago mọkanla alẹ. Ẹgbẹ́ ọmọlẹ́yìn Kírístì ni Nàìjíríà (CAN) ti rọ àwọn ìjọ ni gbogbo ìpinlẹ̀ Nàìjíríà, tó fi mọ ìlú Abuja, láti tẹ̀lé gbogbo ìlànà ìjọba lórí ọ̀rọ̀ Covid-19. Nínú ọ̀rọ̀ rẹ̀, àgbẹnusọ ààrẹ CAN, Pásítọ̀ Bayo Oladeji tó sọ̀rọ̀ lórúkọ ààrẹ ẹgbẹ́, Dókítà Supo Ayokunle ni, gbogbo àwọn alága ìpínlẹ̀ ni àwọn ti jọ sọ̀rọ̀ yé pọ láti tẹ̀lé òfin ti ìjọba ìpínlẹ̀ ti wọ́n wà bá là sílẹ̀ lori sise aisun ọdun tuntun. Oladeji ní gẹ́gẹ́ bi ìròyìn tó tẹ́ ẹgbẹ́ CAN àpapọ̀ lọ́wọ́, ìjọba apapọ̀ kò fi ìgbà kankan sọ pé ki àwọn ìjọ máse péjú fún ètò ìsìn ìrékọjá sínú ọdún tuntun, sùgbọ́n àwọn ìpińlẹ̀ kan sọ pé, lá kò sí ǹkan tó jọ ọ́. Gẹ́gẹ́ bí ìgbésẹ̀ tí àjọ CAN ń gbé, àwọn yóò fi àtẹjáde kan síta lónìí ọjọ́ ìṣẹ́gún láti sọ fún gbogbo àwọn ọmọ ẹgbẹ́ láti tẹ̀lé ǹkan ti ìjọba ìpínlẹ̀ wọ́n bá sọ. Oladeji sàlàye pé, ó ṣeni láànu pé, sọ́ọ̀sì nìkan ni ìjọba n kọjú sí lórí títèlé àlàálẹ̀ òfin Covid-19, bí ó ti lẹ̀ jẹ́ pé gbogbo òfin yìí ni àwọn ìjọ ń tẹ̀lé. ""Tí ẹ bá lọ sínú àwọn ọjà wa, kò sí ẹni tọ n tèlé ìlàna òfin Covid-19, ko si si ẹni tó mú wọ́n si. Kódà gbogbo àwọn olóṣèlú wa ni à n ri lóri amóhùnmáwòràn bi wọ́n ṣe n ṣe ètò òṣèlú láì tẹ̀lé òfin Covid-19 sùgbọ́n tó bá ti di ọ̀rọ̀ sọ̀ọ́sì..."" Bákan náà lo rọ àwọn ìjọ pé, ki wọ́n fi alafo tó péye silẹ̀ dáada láàrín àwọn ara sọ́ọ̀sì ki wọ́n ma ba fún pọ́. Ó tún ni àwọn rọ wọ́n kí wọ́n ṣe ìsìrìn náà sáájú àsìkò tí wọ́n maa n ṣee tẹ́lẹ̀ ki olúkúlùkù sì pàda síé wọ́n kí ilẹ̀ tó ṣú. ""Gbogbo ǹkan ti ìjọba n ṣe yìí fún ànfàní olúkúlùkù ni, nítórí náà gbogbo ǹkan ti a bá le ṣe, láti dẹ́kun àjàkálẹ̀ ààrùn Covid-19 ki ó fi kásẹ̀ nílẹ̀, ni à ó ṣe"". ""Tí a bá ti ṣe, ti àìsàn yìí bá ti lọ pátápátá, à ó pada si bí a ṣe ń ṣe tẹ́lẹ̀"". Bákan náà ló tun rọ àwọn ìjọ tó ni onírúúrú ààyè nínu ilé ìjọsin wọ́n, pé ki wọ́n pin àwọn ènìyàn síbẹ̀ tàbi kí wọ́n pín ìsì wọ́n sí ọ̀nà ọ̀tọ̀ọ̀tọ, ki èrò má ba pọ nínú ìsìn. Sáájú àsìkò yìí ni ẹ̀ka CAN ti ìpínlẹ̀ Ondo ti ni, kò sí ǹkan tó kan àwọn pẹ̀lú ọ̀rọ̀ ìjọba nítórí náà àwọn yóò ṣe ìsìn òpin ọdún ní tàwọ́n."	https://www.bbc.com/yoruba/afrika-55473968
politics	Godwin Emefiele: Mo bẹ́ orí fún gbogbo àgbẹ̀ àti olùfọkànsìn tó ń dáwó fọ́ọ̀mù Ààrẹ fún mi àmọ́ ẹ jẹ́ n lo óògùn ara mi	"Gomina banki àpapọ̀ orílẹ̀èdè Naijiria, Godwin Emefiele tí fi ọrọ idupẹ ránṣẹ́ sì awọn kan to  ni wọn kórajọ lati ra fọ́ọ̀mù oludije ipo Ààrẹ fun un. Emefiele fi sita loju opo Twitter rẹ pe irẹlẹ wọ oun lẹwu gidi pẹlu iru ifẹ ti awọn to n pe oun lati wa dije du ipo Ààrẹ lọdun 2023 ni si oun. Bo tilẹ̀ jẹ pe o ni oun ko tii de bi ìpinnu yii, o ni oun mọ riri ifarajin ""awọn àgbẹ̀ àtàwọn olùfọkànsìn ọmọ Nàìjíríà to n ṣe akitiyan de bi pe wọn n da owo lapo ara wọn ti wọn si n náwó fọ́ọ̀mù lati du ipo Ààrẹ si mi. Mo dupẹ lọwọ wọn pupọ "". Ẹwẹ, Emefiele ni bi oun yoo ba tiẹ̀ wa gbọ́ si wọn lẹ́nu lati dije du ipo Ààrẹ, owo ara oun ti oun laagun ko jọ  ni ọdun marunlelọgbọn lẹ́nu isẹ banki gẹgẹ bi ọga agba ni oun yoo fọ́ọ̀mù oun ""lai ran ẹnikẹ́ni, ni gbangba àti pẹlu ọwọ mimọ àti ni ibamu pẹlu alakalẹ ìwé ofin Naijiria"". Bo ba tun wa ri bẹẹ, Emefiele ni oun yoo tesiwaju lati maa sin àti farajin fawọn ọmọ orílẹ̀èdè Naijiria lábẹ́ akoso Ààrẹ Muhammadu Buhari. Gomina ilé ifowopamọ Naijiria sọ pé: ""Ipinu to ṣe pataki ni eleyi to si nilo ìlọ́wọ́ sí Ọlọ́run ; ni ọjọ díẹ̀ to ku, Ọlọ́run alagbara yoo dárí"". Láti ìgbà tí àwọn kan ti ra fọ́ọ̀mù ìdíje dupò Ààrẹ fún gómìnà ilé ìfowópamọ́ àgbà Nàìjíríà, Godwin Emefiele ni awuyewuye ti ń wáyé wí pé ǹjẹ́ ó lẹ́tọ̀ọ́ láti dupò Ààrẹ. Àgbà onímọ̀ ìṣirò owó kan tó tún jẹ́ olóṣèlú, Hussein Olanrewaju Mustapha nígbà sọ fún BBC News Yorùbá wí pé kò sí òfin kankan lábẹ́ òfin tó dé ìlòdì sí àwọn òṣìṣẹ́ báńkì Nàìjíríà yálà aládani tàbí ti ìjọba láti dupò òṣèlú. Mustapha ní kò sí ohun tó burú tí gómìnà báńkì àpapọ̀ Nàìjíríà bá gbégbá láti di Ààrẹ Nàìjíríà níwọ̀n ìgbà tó bá ti tẹ̀lé àlàkalẹ̀ ìwé òfin Nàìjíríà. Ó fi kún un pé lóòótọ́ ni òfin ìlànà ètò ìdìbò tuntun tí Ààrẹ Muhammadu Buhari buwọ́lù láìpẹ́ yìí làá kalẹ̀ wí pé ẹnikẹ́ni tó bá dipò òṣèlú mú gbọ́dọ̀ kọ̀wé fipò sílẹ̀ fún iye ìgbà kan kó tó gbégbá ìbò. Ẹni tí mo máa gbé ìjọba lé lọ́wọ́ rèé - Ààrẹ Buhari Ògo Naijiria yóò padà wá tí mo bá di Ààrẹ - Pasitọ Tunde Bakare Ìdí tí Osinbajo fi ṣèbẹ̀wò sí Olubadan àti ohun tí wọ́n sọ rèé Wo àwọn ọmọ Yorùbá mẹ́fà tí ẹnu ń kùn lórí ìbò ààrẹ ọdún 2023 Ó ní èyí tako ìwé òfin Nàìjíríà tó fi àyè gba gbogbo ọmọ Nàìjíríà láti dìbò tàbí du ipò tó bá wù ú lábẹ́ òfin. Ó wòye wí pé èyí ló fà á tí ọ̀pọ̀lọpọ̀ àwọn Mínísítà tó ti kéde èròńgbà wọn láti díje dupò òṣèlú kan tàbí òmíràn fi kọ̀ láti kọ̀wé fipò wọn sílẹ̀. Bákan náà ló tẹ̀síwájú wí pé òfin fi àyè gba Emefiele láti dú ipò tó bá wù ú tàbí ṣe ẹgbẹ́ òṣèlú tó bá wù ú láì tàpá sófin. Gomina Banki apapọ Naijiria Godwin Emefiele naa ti ṣetan lati darapọ mọ awọn to n gbero lati  du ipo aarẹ Naijiria ni kete ti saa aarẹ Buhari ba de opin. Lọjọ Ẹti yi ni awọn ololufẹ rẹ kan lọ ba gba fọọmu iferongba silẹ lati du ipo aarẹ labẹ aṣia ẹgbẹ APC ni olu ileeṣẹ ẹgbẹ naa lAbuja. Ẹni ọgọta ọdun yi ni Gomina Banki apapọ akọkọ ninu itan Naijiria ti yoo ṣe iru nkan bayi. Eleyi si ti mu kawọn eeyan maa beere pe ṣe o lẹtọ labẹ ofin Naijria lati dije du ipo aarẹ. Bi Emefiele ba tẹsiwaju pẹlu erongba rẹ yi, oun ati awọn eekan ẹgbẹ oṣelu APC bi igbakeji aarẹ Yemi Osinbajo, Asiwaju Bola Ahmed Tinubu ati awọn Gomina tẹlẹ ri mi ati awọn mii to wa lori ipo ni yoo jijọ maa figa gbaga nínú ẹgbẹ́ òṣèlú APC. Bákan náà ni yóò máa wako pẹ̀lú àwọn èèkàn bíi Atiku Abubakar, Bukola Saraki àti bẹ́ẹ̀ bẹ́ẹ̀ lọ nínú ẹgbẹ́ òṣèlú PDP. Ọjọ́ kẹta oṣù kẹfà, ọdún 2022 ni àjọ tó ń rí sí ètò ìdìbò Nàìjíríà fún àwọn ẹgbẹ́ òṣèlú di tí wọ́n yóò fi fi orúkọ àwọn olùdíje kalẹ̀. Ikú d'óró! Wole Adetiran tó kọ orin àdákọ àgùnbánirọ̀ Naijiria 'NYSC Anthem'  ti jáde láyé"	https://www.bbc.com/yoruba/afrika-61358920
