religion	VPN, FG suspends Twitter: Pásítọ̀ Enoch Adeboye sọ̀rọ̀ lórí bí ìjọba ṣe gbégilé ojú òpó Twitter	"Olori ijọ Redeem lagbaye, Pasitọ Enoch Adeboye ti sọrọ lori aṣẹ ijọba apapọ to gbegile oju opo Twitter ni Naijiria ati igbeṣẹ wọn lati fi iya jẹ ẹnikẹni to ba tapa si ofin naa. Pasitọ Adeboye ni kii ṣe orilẹede Naijiria nikan ni ẹka ile ijọsin oun wa, nitori naa ijọba ko le e da awọn duro lati maṣe lo oju opo Twitter. Ọrọ yii ko ṣẹyin ẹsun ti wọn fi kan Baba Adeboye wi pe oun tẹ oju ofin Naijiria mọlẹ nipa lilo oju opo Twitter lẹyin ti wọn gbegile ni Naijiria. O ni lilo Twitter tẹlẹ ofin Aj Iṣọkan Agbaye, UN to fun awọn ọmọ eniyan laṣẹ lati fi ohun wọn lede ni gbogbo igba. Bakan naa ni Baba Adeboye fihan pe awọn ni ẹgbẹgbẹrun miliọnu eniyan lagbaye ti wọn n tẹle wọn ni oju opo ikansiraẹni Twitter. ''Ijọ Redeemed Christian Church of God wa ni orilẹede aadọsan ni agbaye, ti lilo oju opo Twitter wa si tẹle aṣẹ Ajọ Iṣọkan Agbaye ni Article 19 ti UN universal declaration of Human Rights."" Minisita fun eto iroyin ni Naijiria , Lai Mohammed lo kede pe awọn ti fofin de oju opo ikansiraẹni Twitter ni Naijiria. Lai Mohammed ni ijọba ti paṣẹ fun ileeṣẹ ijọba to n sakoso eto iroyin ni Naijiria,NBC lati fofin de awọn oju opo kọọkan ni Naijiria. Lati igba ti ijọba ti ti oju opo naa, ni ẹgbẹgbẹrun miliọnu ọmọ Naijiria ko ti laṣẹ si oju opo ikansiraẹni Twitter naa, ti wọn si n wa ọna miran lati le lo oju opo naa. Ẹsun ti ijọba apapọ fi kan Twitter ni pe wọn n fari apa kan da ikan si pẹlu bi wọn ṣe yọ 'ọrọ ti aarẹ Buhari kọ si oju opo rẹ nitori o sọ wi pe awọn kan n kọ lẹta si ogun ni Naijiria. Agbẹjọro Agba ni Naijiria to tun jẹ minisita fun eto idajọ, Abubakar Malami ti paṣẹ pe ki wọn o fi oju gbogbo awọn to ṣi n lo ayelujara ibaraẹnidọrẹ Twitter wina ofin. Ọjọ Ẹti ni ijọba Naijiria kede pe oun ti fi ofin de Twitter ni Naijiria nitori pe awọn ọmọ Naijiria n lo o lati ma tako ijọba. Eyi waye lẹyin ti awọn alaṣẹ Twitter, to jẹ ileeṣẹ ilẹ America, pa ọrọ ti Aarẹ Muhammadu Buhari sọ nipa ogun Biafra to waye lọdun 1967. Ninu atẹjade kan to tẹ BBC lọwọ, Malami paṣẹ fun Oludari ẹka  to n gbe ọdaran lọ sile ẹjọ ni ileeṣẹ eto idajọ ti ijọba apapọ, lati bẹrẹ isẹ ni kiakia lori fifi ofin mu awọn to tako aṣẹ ijọba lori lilo Twitter ni Naijiria. Ikede ifiyajẹni yii waye nitori bi awọn eeyan kan ṣi ṣe n lo Twitter pẹlu imọ ẹrọ ayelujara Virtual Private Network Malami ni ki ẹka naa ṣiṣẹ pọ pẹlu ajọ to n mojuto ibaraẹnisọrọ, National Communication Commission, ileeṣẹ ijọba apapọ fun ibaraẹnisọrọ ati okoowo ori ayelujara, ati awọn ajọ mii lati ri pe wọn tete gbe awsn arufin lọ si ile ẹjọ. Ki wa ni VPN? VPN tumọ si virtual private network ti awọn to n lo ayelujara nilo lati lo yatọ si ti gbogboogbo ti wọn n pe ni  public internet connection. Gẹgẹ bi akọṣẹmọṣẹ Kehinde Akinseli ṣe ṣalaye fun BBC, O ni laisi VPN ko si be eeyan ṣe tun fẹ wọn Twitter lai lo awọn ileeṣẹ ẹrọ ibanisọrọ bii MTN, Etisalat, GLo ati awọn to ku. O  ni eyi tumọ si pe awọn eeyan Naijiria to n lo Twitter yoo dinku jọjọ. Bawo lo ṣe le ri VPN gba? Akinseli Kehinde Kayode ṣalaye pe VPN yii ni yoo fun ọ laaye lati le de ori Twitter lati orilẹ-ede mii. O ni eyi tun tumọ si pe ero Naijria ko ni pọ mọ lori Twitter. O mẹnuba ewu ki awọn eeyan maa ja wọ inu ibi ifipamọ ẹni ninu lilo VPN ẹlomii. Kehinde ni VPN da bii IP ti a jijọ n ṣapinlo ni ti ko wa fun ẹnikan ṣoṣo. Ati pe nipa lilo VPN, oṣeeṣe ki awọn eeyan mii maa mọ ohun ti o n ṣe lori ẹrọ ayelujara rẹ. Ati pe o rọrun ki awọn eeyan maa ṣe ẹ̀dà ohun ti o n ṣe lọwọlọwọ. Ìjọba àpapọ̀ dá iléeṣẹ́ Twitter dúró lórílẹ̀èdè Nàìjíríà lẹ́sẹ̀kẹsẹ̀! Ijọba apapọ orilẹede Naijiria ti paṣẹ dida ileeṣẹ oju opo ikansiraẹni ayelujara Twitter duro ni Naijiria. Minisita to n ri si iroyin ati aṣa, Lai Mohammed lo kede rẹ ninu atẹjade kan to fi sita lọjọ Ẹti niluu Abuja. Lai Mohammed ṣe apejuwe bi wọn ṣe n lo oju opo ikansiraẹni naa fun awọn ilo to lee da ibagbepọ alafia orilẹede Naijiria jẹ. Bi ẹ ko ba gbagbe, l'Ọjọbọ ọsẹ yii kan naa ni ileeṣẹ Twitter yọ ọrọ ti aarẹ Buhari sọ to jọ mọ didunkoko mọ awọn ọmọ Naijria lori ọrọ abo kuro loju opo naa. Amọ lọgan ni ijọba naa fesi ti wọn si fi ẹsun kan pe alagabagebe ni ileeṣẹ Twitter pẹ̀lú oniruuru apẹrẹ ọrọ ti ijọba wu jade. Wo ohun tó yẹ kí o mọ̀ nípa bí 'twitter' tíjọba dá dúró ní Nàijíríà yóò ṣe kan ọ Saaju ni ijọba Naijiria ti da ileeṣẹ Twitter duro ni Naijiria lẹyin to yọ 'Tweet' Aarẹ Buhari kuro Ìdí rèé tí Twitter kò fi le gbé ìdájọ́ Trump lé Ààrẹ Buhari Lẹyin naa ni ọpọ ọmọ Naijiria n woye pe ki lo n ṣẹlẹ bayii ti ero wọn si ṣotọọtọ Twitter kò dá sí ọ̀rọ̀ IPOB àti Nnamdi Kanu, bó ṣe wù wa la ṣe lè darí Nàìjíríà- Lai Mohammed Bawo wa ni idaduro Twitter yii ṣe kan iwọ funra re? Eyi lo mu ki BBC kan si akọṣẹmọṣẹ nipa lilo ẹro ayelujara, Akinseli Kehinde lori ohun ti yoo ṣẹlẹ bi ijọba Naijiria ṣe fofin de Twitter yii. O ni ọna kan ṣoṣo ti erongba ijọba fi le wa si imuṣẹ lori ofin yii ni pe ki ijọba paṣẹ fun awọn Internet Service Providers to wa ni Naijiria lati yọ IP Address to n wa lati Naijiria lọ si oju òpó Twitter. O ni eyi tumọ si pe ileeṣẹ bii MTN, GLO, Etisalat ati awọn to ku ko ni jẹ ki awon eniyan Naijiria de oju opo Twitter nipase ileeṣẹ erọ ibanisọro ti wọn mọ. Akinseli ni eyi ja si pe MTN, GLO, Etisalat ati awon to ku ko ni jẹ ki awọn eniyan Naijiria le de oju opo Twitter lati ọdọ ti wọn bi o ṣe yẹ. Akosemọṣẹ yii tun salaye pe ọna kan ṣoṣo miran ti eeyan tun fi le de oju opo Twitter ti ko ba lọ nipasẹ ISP ni nipa lilo VPN. Bakan naa, minisita ti paṣẹ pe ki ajọ to n bojuto igbohunsafẹfẹ ni Naijiria ki wọn bẹrẹ si ni fun awọn alagbata itakun ayelujara laṣẹ lati ṣiṣẹ. Ẹwẹ, awọn Naijiria o jẹ ko balẹ tabi tutu rara ti wọn ti n fun ijọba apapọ lesi. Ọpọlọpọ eeyan lo ni ""Ẹ da ileeṣẹ Twitter duro, Twitter ọhun naa si lẹ lo lati fi ọrọ yii sita. Ni ti Usman @UIncorp, adura lo gbe ṣe fun aarẹ Buhari, Lai Mohammed ati orilẹede Naijiria lapapọ. Agada Stephen Michael @agadastephenmic ni Twitter kan naa ti wọn fi yi irọ mọ aarẹ ana, Goodluck Jonathan naa ni wọn tun wa ni o ni ero ibi si Naijiria. Ẹwẹ, ko tii si ẹni to lee fi aridaju ohun ti itumọ igbesẹ yii jẹ gangan sitta. Ninu iwoye, wọn lee gbe igi di oju opo Twitter lori adirẹsi itakun agbaye Naijiria eyi to tumọ si pe oo nilo VPN koo to le lọ soju opo Twitter ṣugbọn ko sẹni to tii sọ eyi. Laipẹ yii naa ni Twitter gbe olu ileeṣẹ wọn ni Afirika lọ si orilẹede Ghana."	https://www.bbc.com/yoruba/media-57364616
entertainment	Opeyemi Ayeola: Gbàjúmọ̀ òṣèré tíátà sọ̀rọ̀ sókè lórí ìlera rẹ̀, ó ní Ọlọ́run ló kó òun yọ	Awọn agba bọ wọn ni a kii ro kadun, ko sisi ẹni ti kii rẹ, se kẹnimani ara ko si, apọju rẹ ni ko sunwọn. Gbajumọ oṣere tiata, Ọpẹyẹmi Ayeọla ti sọrọ sita lori ilera rẹ ati ipenija ti o n koju lori aisan to da a wolẹ ninu fidio kan to gbe soju opo ayelujara rẹ. Ọpẹyẹmi Ayeọla ṣalaye loju opo Instagram rẹ pe, ọwọ rere ni ọdun 2022 fi bẹrẹ fun oun pẹlu oniruuru idokoowo to dantọ, ipe sawọn iṣẹ tiata loriṣiriṣi atawọn iṣẹ to mowo dani miran bẹẹ. Amọṣa o ni oṣu keji n sun kẹrẹkẹrẹ wọle ni ipenija ilera de ba oun, ki Eleduwa to mu oun bori. Nigba to n ohun to se to fi di ero ile iwosan, osere tiata naa ni lojiji ni esu gbe ise rẹ de, ti aisan naa si wọle wa. Amọ o ni oun dupẹ lọwọ Ọlọrun to da si isẹlẹ naa, to si fun oun ni isẹgun ati idapada ilera oun. O wa n kan saara si Oluwa ti o seun lori ilera rẹ naa, to si ni ko maa jọba lọ ninu aye oun nitori Ọlọrun ti kii se eniyan ni. Ni kete ti ara le pada yii ni osere tiata naa n fi ẹmi imoore rẹ han si awọn eeyan to duro ti i, lasiko ti oju ogun le, ti aisan si da wolẹ. Ko ṣai dupẹ lọwọ iya rẹ, ọkọ rẹ, awọn ọmọ atawọn mọlẹbi rẹ gbogbo, titi kan awọn akẹgbẹ rẹ lẹnu iṣẹ tiata fun aduroti wọn. Bi ẹ ko ba ni gbagbe, ni nnkan bii oṣu kẹrin si ikarun ọdun 2021 ni iroyin kan pe, ara gbajumọ oṣere yii ko ya, o ṣi ogun lo fun ara rẹ ti o si daku rangbọdan. Opeyemi Aiyeola, tii se ẹni ọdun mẹrinlelogoji, jẹ gbajumọ osere tiata ni ede Yoruba, to si tun jẹ oludari ere pẹlu. Ọdun 1998 lo darapọ mọ ere tiata, ọmọ bibi ilu Sagamu nipinlẹ Ogun nii se, amọ ilu Eko lo gbe dagba. Ọmọ mẹta ni awọn obi Opeyemi bi, osu si ni ọmọ keji. O se igbeyawo pẹlu ọkọ rẹ, Babatunde Olayiwola Owolomose, ti Ọba oke si fi ọmọkunrin meji ta wọn lọrẹ. Gbajumọ osere tiata naa si ti gba ọpọ ami ẹyẹ nidi isẹ tiata, to si n gbe ni Amẹrika pẹlu ọkọ rẹ.	https://www.bbc.com/yoruba/afrika-60314774
religion	Bethel Baptist kidnap: Àwọn ajínigbé tú 28 nínú akẹ́kọ̀ọ́ 121 Bethel Baptist tí wọ́n jígbé sílẹ̀	Mejidinlọgbọn ninu awọn akẹkọọ mọkanlelọgọfa tawọn ajinigbe gbe lọ lati ile ẹkọ Bethel Baptist loṣu to lọ nipinlẹ Kaduna. Pẹlu omije loju lawọn obi awọn akẹkọọ naa fi pade ara wọn lẹyin ti wọn ti lo ogunjọ lakata awọn janduku ajinigbe. Ọkan lara awọn oludasilẹ ile ẹkọ naa, Rev John Joseph Hayab sọ fun BBC pe awọn ajinigbe naa gba lati tu awọn akẹkọọ naa silẹ lẹyin ti wọn jiroro pẹlu obi awọn ọmọ naa. Amọ ko sọ boya awọn obi awọn akẹkọọ ti wọn jigbe sanwo itusilẹ ki wọn to tu awọn ọmọ naa silẹ. Ṣugbọn Rev Hayab ni o ṣeeṣe ki awọn obi awọn akẹkọọ ti san owo itusilẹ ki wọn to fi wọn silẹ. Rev Hayab sọ pe o ti rẹ awọn ọmọ naa nigba tawọn ajinigbe fi wọn silẹ lalẹ ọjọ Abamẹta. Ni owurọ ọjọ Aiku ni awọn akẹkọọ ọhun lanfaani lati pade awọn obi wọn lẹyin ti wọn ṣe ayẹwo ara fun wọn tan. Ọjọ karun un oṣu keje ni awọn janduku ajinigbe yabo ile ẹkọ Bethel Baptist nibi ti wọn ti ji awọn akẹkọọ naa gbe lo. Koda awọn ajinigbe ọhun tun yinbọn pa awọn ẹṣọ eleto abo to n ṣọ ilẹ ẹkọ naa. Ijọba ipinlẹ Kaduna ko tii sọ ohun kan lori itusilẹ diẹ lara awọn ọmọ ile ẹkọ Bethel Baptist naa.	https://www.bbc.com/yoruba/afrika-57960696
health	Body odour solution: Wo ǹkan tó ń fa 'body odour' àti bí o ṣè lè ṣẹ́gun rẹ̀	"Àwọn onimọ sọ pe ọpọ eeyan lo gbagbọ pe òógùn lo ma n mu ki ara rùn, sugbọn otitọ to wa nibẹ ni pe óògùn ara eniyan kii rùn rara. Oorun ti ko dara ma n wa lati àwọn ẹ̀yà ara bi ẹnu ati awọn ẹ̀yà mii. Ṣùgbọ́n ninu akọsilẹ yii, awọn òórùn to n jade lati awọ ara ni yoo jẹ afojusun wa. Ati bi kokoro aifojuri ṣe ma n jẹyọ ninu óògùn eniyan. Àwọn nkan to ma n fa òórùn ti ko dara 'body odour' ninu ara: Iwe iroyin imọ iṣegun oyinbo, British Medical News Today, sọ pe oorun yii ma n bẹ̀rẹ̀ lasiko ti eeyan ba ṣẹṣẹ n bàlágà, paapaa nitori awọn ayipada to n ba àwọn ẹ̀yà ara. Yatọ si eyi, o ṣe e ṣe ki awọn eeyan to sanra jù ati awọn to ni aisan bi itọ ṣuga ní oorun ti ko dara ninu ara wọn. Oorun buruku ma n jade ni ara nigba ti awọn kokoro aifojuri ba n la orisirisi ipele kọja, lati darí pinpin eroja PROTEIN to wa ninu òógùn, nibi ti o ti n ri oúnjẹ. Dokita Abubakar Mohammed, ti ileewosan Specialist Hospital, Maiduguri, sọ pe àwọn kokoro aifojuri to n gbe nibi to ba tutu ninu ara lo n fa ki òórùn buruku ma jade, kii ṣe óògùn fúnra rẹ. Idi ree ti awọn to ma n làá gùn pupọ ṣe ma n ni 'body odour'. Dokita Mohammed tun sọ pe jíjẹ awọn oúnjẹ bii galiiki, alubosa ati ata, le mu ki eeyan laagun ju bó ṣe yẹ. Bi o ṣe le dena ati ọna abayọ si 'body odour' Ọ̀pọ̀ eeyan ma n ni iriri 'body odour' ni àwọn ẹ̀yà ara wọn ti aṣọ bá bò - eyi to ma n fa óògùn ati ki aṣọ tutu. Dokita Abubakar sọ pe ọkan gboogi lara nkan to n fa ""body odour"" nìyẹn. Lati dena rẹ, awọn ọna ti awọn onímọ̀ ilera sọ ree: - Wiwẹ pẹlu omi to mọ ati ọṣẹ oloorun didun. Ki eeyan si fọ awọn ibi to le run bii ẹnu, abiya ati abẹ́ daadaa. - Wiwọ aṣọ to mọ- nitori ko si bi eeyan ṣe le wẹ̀ tó, ara rẹ yoo rùn to ba wọ aṣọ to dọti. Paapaa aṣọ bi awọtẹlẹ, pátá, ibọsẹ, sikẹẹti, kọmu ati aṣọ olooru. - Fifa irun ara - Ti irun ba kún ni àwọn ibi kan ninu ara, yoo fa óògùn, eyi to má n pada fi ààyè gba kokoro aifojuri to n fa òórùn buburu ninu ara. Nitori naa lo ṣe yẹ ki o fa irun ni awọn ẹ̀yà ara kan, lati le dena rẹ. - Lilo lọfinda - Lilo lọfinda loore-koore, ṣe pataki ninu igbesẹ didena oorun buburu. Yatọ si awọn nkan ti dokita sọ, o tun le lo àwọn nkan bí omi orombo wẹ́wẹ́ (lemon) lati fi òpin si oorun buburu ninu ara rẹ. Fi omi orombo naa pa awọn ibi to ba n run, saaju ki o to wẹ. O tun le fi alọọmu sinu omi iwẹ rẹ, to ba jẹ pe oorun ara rẹ pọ. Ṣùgbọ́n ti o ba ṣe gbogbo nkan wọn yii, ti oorun naa ko ba dinku tabi lọ patapata, tete lọ ri dokita. Idi ni pe ki eeyan ma laagun ju, ati ki oorun buruku ma jade ninu ara, le jẹ ami aisan bi itọ ṣuga, aisan kíndìnrín, ati bẹẹ bẹẹ lọ."	https://www.bbc.com/yoruba/61379653
sports	Joseph Yobo ni igbákejì akọ́nimọ̀ọ́gbá Super Eagles tuntun - NFF	Ajọ to n ri si ọrọ ere bọọlu ni Naijiria, NFF ti kede Joseph Yobo gẹgẹ bi igbakeji akọnimọgba ikọ naa tuntun. Yobo bọ si ipo yii lẹyin ti wọn fi ọwọ osi juwe ile fun  Imama Amapakabo to di ipo na mu tẹlẹ. Ki Yobo to de ipo tuntun yii, o ti fi igba kan jẹ balogun ikọ Super Eagles to si ṣe aṣeyọri ninu idijẹ ifẹ ẹye ti ilẹ Afrika to waye lọdun 2013. Yobo ni ọpọ iriri gẹgẹ agbabọọlu latari bo ṣe ti gba bọọlu ni oriṣiriṣi ẹgbẹ agbabọọlu kaakiri agbaye. O gba igbega si ikọ Super Eagles lẹyin to ṣoju orilẹ-ede Naijiria ninu idije ọjẹ wẹwẹ ti ọjọ ori wọn ko ti ju ogun ọdun lọ lọdun 1999. Ko ti di pe Yobo fẹyinti gẹgẹ agbalọọlu fun ikọ Super Eagles, o ti kopa ninu idioje ife ẹyẹ agbaye nigba mẹta, ati ninu idije ife ẹyẹ ilẹ Afrika nigba mẹfa. Lara awọn ẹgbẹ agbabọọlu ti Yobo ti ṣeṣẹ tẹle ni ikọ Olympique Marseille, Everton, Norwich City ati Fenerbahçe.	https://www.bbc.com/yoruba/afrika-51478929
sports	Mama Arsenal: Ẹgbẹ́ kan ti fún màmá ní ẹ̀bùn owó	Bi a ba ku, iṣe o tan ni Yoruba maa n wi. Bẹẹ gẹlẹ ni ọrọ ri pẹlu mama agba ololufẹ ẹgbẹ agbabọọlu Arsenal, Nosimatu Hassan. Mama to jẹ ẹni ọdun mẹtadinlọgọrin di ẹni ti ọgọọrọ eeyan n sọ nipa rẹ lori ayelujara lẹyin ti sọ ọpọ ọrọ nipa ẹgbẹ agbabọọlu to yan laayo. Lati igba naa ọpọ ẹlẹyinju aanu ọmọ Naijiria ti n ṣeleri lati fun mama ni ẹbun kan tabi omiiran. Ṣugbọn ni bayii, ẹgbẹ ololufẹ awọn ikọ agbabọọlu Naijiria, Authentic Nigeria Supporters' Club ti fun mama ni ẹbun owo rọgun rọgun. Owo ti ẹgbẹ ololufẹ agbabọọlu Naijiria naa fun mama Arsenal ni ṣe ẹgbẹrun un lọna ọta le lugba o din mẹwaa. Ọlọ́run ló yàn mí ti Arsenal, mi ò lè fi wọ́n sílẹ̀ láéláé- Mama Arsenal yarí Ara meriri , mo ri ori ologbo lori atẹ ni ọrọ mama agba kan, Nosimatu Hazzan, ti ọpọ eeyan mọ si mama Arsenal. Mama agba yii, to nifẹ ẹgbẹ agbabọọlu Arsenal bii oju, ti ọjọ ori rẹ yoo si to aadọrin ọdun, lo nifẹ ere bọọlu ju ọmọde tabi awọn ọkunrin miran lọ. Lasiko ti BBC se abẹwo si ọdọ mama naa, ti ọpọ eeyan mọ si Mama Arsenal nitori bo se nifẹ si ẹgbẹ agbabọslu Arsenal, ẹnu ko gba iroyin. Ko fẹẹ si agbabọọlu Arsenal tẹlẹ abi lọwọlọwọ bayii ti mama naa ko lee darukọ, to si ni oun maa n wo bọọlu ninu ile oun tabi lọ sawọn ibudo ti wọn ti n wo bọọlu. Bakan naa lo ni oun maa n lọ sawọn papa isere idaraya nilu Eko lati wo ere bọọlu, ti oun si nifẹ ere sisa, awọn ere idaraya miran lorisirisi, paapaa ẹgbẹ agbabọọlu Arsenal.	https://www.bbc.com/yoruba/afrika-53304170
health	UK Omicron Nigeria Ban: Àwọn aṣòfin àgbà ní kí ìjọba àpapọ̀ wá ǹkan ṣe sí òfin má wọlé tí UK gbé lé Nàìjíríà	"Ile asofin agba Naijiria naa ti dá sí ọrọ fifi orukọ Naijiria sara awọn orilẹ-ède ti ilẹ Gẹẹsi ko faaye gba lati se irin-ajo silẹ wọn nitori ẹda arun COVID-19. Nise lawon asofin ilẹ naa bẹnu àtẹ lu igbesẹ ti ilẹ Gẹẹsi gbe gẹgẹ bí wọn ti ṣe wi:'lalae ni idi kan pataki"" Nitori naa ile aṣòfin àgbà tí wa kesi ìjọba ilẹ Gẹẹsi lati yọ orukọ Naijiria kuro ninu awọn ile ti wọn fòfin de lati ṣe Irinajo sí orileede wọn. Ile ni o yẹ kí ìjọba UK wo irú ibaṣepọ to wa laarin awon mejeeji ki wọn to gbe iru igbesẹ yi ati ipa ti yóò ní lara awọn ọmọ Naijiria ti wọn n tiraka. Ile ọhun wa rọ ijoba Naijiria lati fi kun lukun pelu ìjọba ilẹ Gẹẹsi lọnà ati yi ìgbésẹ yi pada. Bẹẹ lọ ní kí ijoba ma ṣe yet lori ipinu rẹ lati ṣe ìfilọ́lẹ̀ gbogbo ilana to ba yẹ lati koju ẹda COVID-19 yi ni Naijiria. Awọn ipinu ati imọran ile yí waye lasiko ti wọn n jiroro lori aba kan ti Seneto Ike Ekweremadu fi ṣowọ sile èyí tó dá lórí ọna ati yọ orukọ Naijiria kuro lori orukọ awọn ti ilẹ Gẹẹsi gbegi dina wọn lati wọ ilẹ rẹ. Ninu alaye ti ile ṣe lori ipinu yi jinle Naijiria ni orile-ede to ni iye eeyan to kere julọ to ko ẹda arun COVID-19 yi táa mọ si Omicron. O ni igbesẹ yi yoo da eto ru paapa fawọn ọmọ Naijiria to ti n palẹmọ lati ba mọlẹbi wọn tó wà ni ilẹ Gẹẹsi se ajọdun ọdún Kérésìmesì. Bakan naa lo ni púpọ awọn ọmọ Naijiria to ni idi pataki  lati ṣe abẹwo sí ilẹ Gẹẹsi ti wọn kò fún ni iwe aṣẹ irina ni ki ni le se bẹ. Lakotan, aṣofin Ekweremadu sọ pé kò sí ìgbà tí àwọn ọmọ Nàìjíríà kii tẹle gbogbo ilana ìdáàbòbò ti àjọ ìlera lágbayé gbe kalẹ ati eyi ti ijọba ilẹ Gẹẹsi gbe kalẹ lori arinrinajo tẹlẹ. Ofin tẹ fi de Naijiria eyi ti kọdi awọn ọmọ ilẹ naa lati ma ṣe wọ ilẹ Gẹẹsi nitori ẹda COVID-19 jẹ idẹyẹsi ati pe ko bojumu. Minisita iroyin ati aṣa ni Naijiria Lai Mohammed lo fi oroy yi le'lẹ lasiko to n ba awọn akọroyin sọrọ n'ilu Abuja. Nítorí náà Minisita wa kesi ike Gẹẹsi lati yi ipinu padà lori aṣẹ yi ni kiakia. Bakan naa ni wọn jiroro lori ọna abayọ lati le dẹkùn arun yi nipa fifun awọn eeyan labẹrẹ, amojuto ati ayẹwo to peye lawon ẹnu ibode abawọlu. Ọrọ Minisita Lai yi n waye lẹyin ti Minisita feto ilera Dr Osagie Ehanire  ti ṣaaju bẹnu àtẹ lu igbesẹ yi lati ọdọ ìjọba ilẹ Gẹẹsi. Minisita eto ilera ni Naijiria, Dokita Osagie Ehanire ti sọ pe ko bojumu bi ijọba orilẹ-ede United Kingdom ṣe kọ orukọ Naijiria mọ awọn orilẹ-ede to fofin de nitori ẹda aarun Covid-19 Omicron. Ehanire sọ pe ""inu wa ko dun nigba ti wọn fi orukọ orilẹ-ede mẹfa ni Africa si ara awọn ti ko le wọ ilẹ UK."" O ni ko tii si imọ pupọ nipa ẹda Omicron, ati pe orisirisi ọna ni amojuto fi wa fun aarun Covid-19. Ọjọ Aiku ni Ehanire ti sọ ọrọ naa lori eto kan lori amohunmaworan Channels TV. Eyi waye lẹyin ọjọ kan ti ijọba UK fi ikede naa sita. Dokita Ehanire sọ pe nkan to daju ni pe ẹda tuntun naa ko tii seku pa ẹnikẹni tabi se aisan kọja bo se yẹ. O ni igbesẹ fifi ofin de awọn orilẹ-ede ti yá ju, ti yoo si ni ipa ti ko dara lara eto ọrọ aje, to fi mọ igbokegbogo lasiko ọdun Keresimesi ati ọdun tuntun. Bakan naa lo sọ pe lootọ ni awọn ri aarun Covid-19 lara awọn arinrinajo lati UK, o ni ṣugbọn ko si aridaju pe ẹda Omicron ni. ""Fifi ofin de awọn orilẹ-ede lati ma wọ ilẹ United Kingdom ko le ṣe anfaani kankan fun igbogunti aarun Covid-19. ""Awa gẹgẹ bi orilẹ-ede Naijiria ko ri fifi ofin de irinajo baalu ati awọn eeyan ni anfaani kankan."" Orilẹ-ede Canada ati America lo kọkọ kede ofin to de awọn arinrinajo lati awọn orilẹ-ede kan nilẹ Africa nitori ẹda aarun Covid-19, Omicron. Ilẹ̀ Gẹ̀ẹ́sì, yóò máa bèrè fún àyẹ̀wò covid-19 lọ́wọ́ arìnrìnàjò kankan to bá fẹ́ wọ orílẹ̀-ède wọn  pàápàá jùlọ láti Nàìjíríà. Bákan náà ni arìnrin àjò kọ̀ọ̀kàn yóò ní láti wà ni ìgbélé fún ìgbà díẹ̀ tí wan bá wọ ilú lójíunà láti mú àdínkù bá ìtànkálẹ̀ ààrùn ẹ̀yà Covid-19 Omicron. Mínísítà ètò ilèra Sajid Javid sọ èyí lónìí ọja Abamẹta, pé èyí ṣe pàtàkì láti ri dájú pé ààrùn náà ko tàn kálẹ̀ , nígbà ti àwọn onímọ̀ sáyẹ̀nsì ń gbìyànjú láti mọ̀ si nípà ẹ̀yà náà. Pàápàá jùlọ bí o ṣe ń ran àti bi abẹ́rẹ́ àjẹsára covid ṣe lágbára sí lórí rẹ̀. Javid ni láti bi ọ̀sẹ̀ kan ti ìròyin ààrùn náa tí n tàn ka ni àwọn ti ri ìwòye pé o ń tànkálẹ̀ nítori ìrìnajò ni. Asojú ìjọba ill Gẹ̀ẹ́sì Boris Johnson pe fífi òfin de àwọn orílẹ̀-èdè yìí ja ọ̀nà áti dpenà ìtànkálẹ̀ rẹ̀. "" Sáájú náà ni a ti sọ pé  kò ni fi ohunkóhun falẹ̀ ni àsìkò tí o bá yẹ, ti bí nnkan se ri ba gba pé ki a fi ofin de àwọn ènìyàn , o ti pọ́n dandan bẹ́ẹ̀ náà ni a ó ṣe ṣee. Láti àsìkò yìí lọ gbogbo ẹni ti o ba pọndandan fún láti wọn UK, yóò se àyẹ̀wò arun Covid-19 ni ọja meéjì si àsìkò tí yóò wọ bàálú Ní báyìí wọn ti gbé àlàpupa lé orí orúkọ Nàìjíríà , èyí túmọ̀ sí pé àra àwọn orílèedè ti o léwu fún ààrùn Covid-19 Javid ṣàlàyé pé, iye àwọn ti o ti ni ààrùn Covid-19 Omicron ni ilẹ̀ Gẹ̀ẹ̀sì ń ps si lójòòjúmọ́ ti o si ti tó ènìyàn ọgọ́jọ báyìí, ti o si jẹ pé àwọn to rin irin àjò lọsi orilede Nàìjíría lo tun gbe ìgbá orókè lẹ́yìn South Africa. South Africa àti àwọn orílẹ̀ mẹ́sàn mííràn láti ìhà gúúsù Africa ni wọn tun fi sibẹ ni opin ọsl to kọja. Itumọ̀ èyí si ni pé, àwọn ọmọ ilẹ̀  Gẹ̀ẹ́sì nìkan tàbi àwọn to ni ìwé ìgbélùú nìkàn  ni o ni àànfàni láti wọlé, wọn yóò sì ni láti wa ni ìgbélé ni ile ìtura fún ìgbà díẹ̀. South Africa Botswana Eswatini Lesotho Namibia Zimbabwe Angola Mozambique Nigeria Zambia"	https://www.bbc.com/yoruba/media-59533936
religion	Ghana Cathederal project: Ìmáàmù àgbà orílẹ̀èdè Ghana gbé owó kalẹ̀ fún kíkọ́ Ṣọ́ọ̀ṣì	Imaamu agba lorilẹede Ghana, Sheikh Osmanu Nuhu Sharubutu ti gbe owo to le ni ẹgbẹrun mẹjọ dọla kalẹ lati ṣe atilẹyin fun kikọ ijọ nla kristẹni kan lorilẹede naa. Sheikh Sharubutu kede ẹdawo naa lasiko ti awọn igbimọ majẹobajẹ ti wọn gbe kalẹ fun kikọ ṣọọṣi nla naa bẹẹ wo ni ọfiisi rẹ. O ni igbesẹ naa ko yẹ lẹyin lilọ igi ifẹ laarin awọn ẹlẹsin gbogbo nibẹ ni alẹye Bi o tilẹ jẹ pe Orilẹede Ghana wa lara awọn orilẹede ti alaafia ti n jọba laarin awọn ẹlẹsin gbogbo lagbaye sibẹ ẹgbẹrun mẹjọ dọla ti Imaamu agba naa da fun kikọ ṣọọṣi naa jẹ eyi to ya ọpọlọpọ lẹnu. Ṣọọṣi apapọ naa ti n fa ọpọlọpọ awuyewuye lorilẹede naa lẹyin ti ijọba orilẹede ọhun gbe aba gbigbe igbimọ ikowojọ naa dide lati ṣe koriya fawọn ọmọ orilẹede Ghana  lati lee dawo fun kikọ ṣọọṣi naa si ilu Accra tii ṣe olu ilu orilẹede naa. Ile ijọsin ọhun yoo na wọn ni owo to le ni ọgọrun miliọnu dọla. Bakan naa ni wọn fi idi rẹ mulẹ pe kiko owo rẹ jọ ko ni lọwọ ijọba ninu. Ọpọ lo ti kọminu lori kikọ ṣọọṣi naa eleyi ti wọn ni ko tọ lasiko ti ọrọ aje dagun lorilẹede naa.	https://www.bbc.com/yoruba/afrika-58366969
