politics	Prince Phillip: Àwọn aṣíwájú lágbáyé ránṣẹ́ ìbánikẹ́dùn	"Awọn lọbalọba, olori orileede ati olotu ijọba gbogbo kariaye ni wọn ti n ranṣẹ ibanidaro lori iku Arẹmọ Phillip, Duke of Edinburgh ti ilẹ Gẹẹsi to jade layelẹni ọdun mọkandinlọgọrun. Ọba orilẹede Spain ati aya rẹ tẹ iwe ranṣẹ si Ọbabinrin ilẹ Gẹẹsi ri wọn pe ni ""Dear Aunt Lilibet"" lori iku ọkọ rẹ ti wọn pe ni "" Dear Uncle Phillip"" Yatọ si  lọbalọba ilẹ Yuroopu to daro, awọn orilẹede ro wa labẹ igbimọ aṣepo Commonwealth naa kan sara si igbe aye ifaraẹnijin ti Arẹmọ Phillip gbe nigba aye rẹ loke erupẹ. Igbe aye imurasi ojuṣeeni, ifọkansin ati ijolootọ si Ọbabinrin ilẹ gẹẹsi kun ara awọn ohun manigbagbe tawọn aṣiwaju orilẹede agbaye naa yombo lara Arẹmọ Phillip. Ni ọjọ Ẹti ni aafin Buckingham kede ipapoda Arẹmọ Phillip ẹni to fi ọpọ igba ba Ọbabinrin ilẹ Gẹẹsi rinrinajo kaakiri agbaye. Ọpọlọpọ awọn lọbalọba ilẹ Yuroopu lo ba Arẹmọ Phillip tan ni ọna kan tabi omiran bẹẹni pupọ wọn lo ti n fi ọrọ ibanikẹdun wọn ranṣẹ. Atẹranṣẹ Ọba Felipe ati aya rẹ Letizia ti Spain da yatọ ninu eyi ti wọn ti kọ ọ wi pe "" ifẹ ati idaro wa wa pẹlu Aunt Lilibet (eyi ni orukọ ifẹ ti Arẹmọ Phillip maa n pe aya rẹ Ọbabinrin ilẹ Gẹẹsi) ati Uncle Phillip wa tootọ. Wọn so fun Ọbabinrin ilẹ Gẹẹsi ninu atẹranṣẹ wọn pe, ""A ko le gbagbe awọn akoko ti a jọ wa pọ pẹlu rẹ pẹlu ogun isojuṣe ẹni ati ifaraẹnijin fun Ọba ati ilẹ Gẹẹsi nigba to wa pẹlu rẹ"" Ọbalaye orilẹede Sweden, Carl Gustaf pẹlu ṣedaro ninu eyi to ti ni Arẹmọ Phillip jẹ ""ọrẹ gidi fun ẹbi wa fun ọpọlọpọ ọdun, eleyi ti a ko ṣai mọ riri rẹ."" Agbẹnusọ fun ile Ọba orilẹede Sweden, Margareta Thorgren ṣalaye fun BBC pe ọba orilẹede Sweden ati Arẹmọ Phillip ti jumọ rinrinajo ojuomi ri ni ilẹ Gẹẹsi leyi to ni o jẹ ibẹrẹ jrinajo ọrẹ gidi laarin wọn"" Ile ọba orilẹede Holland ni awọn n ṣeranti Arẹmọ Phillip pẹlu ọwọ, pẹlu afikun pe : "" O fi igbe aye rẹ jin fun sinsin awọn eeyan ilẹ Gẹẹsi ati ọpọlọpọ ojuse rẹ. O jẹ ọloyaya eeyan toi iṣe rẹ ni ipa lokan awọn to baa pade."" Ninu ọrọ tiwọn, Ọba Phillipe ti orilẹede Belgium ati olori rẹ, Mathilde ni awọn ""yoo maa fi igba gbogbo ṣeranti awọn ajọṣepọ wọn pẹlu rẹ"". Awọn ọrọ ibanikẹdun wa lat'ọdọ awọn orilẹede mẹrinlelaadọta to wa labẹ ajọ Commonwealth pupọ ninu wọn to ti ni ipilẹ pẹlu ijọba ilẹ Gẹẹsi pẹlu awọn eeyan to le ni biliọnu meji. Olotu ijọba orilẹede Australia sọ ninu atẹjade kan pe: "" O duro fun iran kan ti a ko ni ri iru rẹ mọ."" O kan sara si Arẹmọ Phillip gẹgẹ bii baba isalẹ ọpọlọpọ ẹgbẹ ati lajọlajọ ni Australia. Ọrọ lati ẹnu Olotu ijọba New Zealand, Jacinda Adern fara pẹẹ. O ni "" O ni ọpọlọpọ awọn ọdọ lo ti bori oniruru ipenija aye wọn"" nipasẹ eto ami ẹyẹ Hillary Award ti Arẹmọ Phillip gbe kalẹ. Justin Trudeau, olotu ijọba orilẹede Canada ni Arẹmọ Phillip"" ko ipa to pọ ninu idagnoke awujọ lorilẹede wa- ati lagbaye"". O fi kun pe: "" Arẹmọ Phillip jẹ ọkunrin takuntakun to ni ifọkansin ati afojusun to n se koriya fun un lati ṣiṣẹ sin awọn eeyan miran. ""A n ṣeranti rẹ gẹgẹ bi opomulero ninu aye Ọbabinrin wa."" Bakan naa ni Olotu ijọba orilẹede India, Narenda Modi kun awọn to yombo igbe aye ifaraẹnijin Arẹmọ Phillip fun "" ọpọlọpọ iṣe isinlu"" Aarẹ Uhuru Kenyatta ti orilẹede Kenya sọ pe Arẹmọ Phillip jẹ "" ami nla gagara fun idagnasoke idile ati iṣọkan awọn eeyan ilẹ Gẹẹsi ati gbogbo agbaye lapapọ"" - ọkunrin to ṣiṣẹ fun ""ibagbepọ alaafia laarin ọmọniyan"". Awọn ọrọ ibanikẹdun miran to run wa.lati ilẹ Afirika kan ti orilẹede Zimbabwe- to ni ọpọlọpọ edeaiyede pẹlu ilẹ Gẹẹsi, tiko si si lawujọ awọn orilẹede Commonwealth mọ- ati aarẹ orilẹede Tanzania to padanu olori rẹ, John Magufuli, laipẹ yii. Awọn ọrọ ibanikẹdun miran tun wa lati ọdọ awọn orilẹede to ni Ajosepo to rinlẹ pẹlu Arẹmọ Phillip ati idile rẹ. Olotu ijọba orilẹede Malta, Robert Abela ni: ""ibanujẹ nlanla ni iku Arẹmọ Phillip, to fi orilẹede Malta ṣe ile to si maa n wa si ibẹ lọpọ igba. Awọn eeyan wa n ṣe afẹri iranti rẹ."" Odun meji ni Phillip ati Elizabeth lo ni orilẹede Malta gẹgẹ bi omoogun oju omi ki Ọba George karun to jade laye lọdun 1952. Olotu ijọba orilẹede Israel, Benjamin Netanyahu ni Arẹmọ Phillip jẹ ""oṣiṣẹ ilu to mu iṣẹ rẹ lọkunlundu , orilẹede Israel ati agbaye ni yoo si maa ṣe afẹri rẹ"". Ileejọsin Church of Mary Magdalene to wa ni ilu Jerusalemu ni wọn sin  Arẹmọ Phillip, omoobabinrin Alice ti Battenberg to ku lọdun 1969 Ninu ibanidaro tirẹ, aarẹ Amẹrika nigbakanri, George W. Bush kan sara si iwa ọmọluabi rẹ, to si ni Arẹmọ Phillip gbe ""igbe aye to  to si fi ami lelẹ"" to si ni ""ifaraẹnijin fun awọn iṣẹ rere ati fun awọn eeyan miran"". Minisita ọrọ ilẹ okeere lorilẹede France, Jean-Yves Le Drian kasẹ ọrọ ikẹdun ati idaro gbogbo nilẹ- pẹlu pipe Arẹmọ Phillip ni okunrin ""to ṣe ara ọtọ"". ""Orilẹede France darapọ lati daro awọn ọrẹ rẹ ati lati yombo igbe aye ọkunrin kan to jẹ ẹlẹri si oniruru ipenija ati ireti fun ilẹ Yuroopu."""	https://www.bbc.com/yoruba/agbaye-56694787
religion	Dare Adeboye: Ikú ẹ̀gbọ́n mi, ọ̀rẹ́ mi, ẹnìkejì mi, Dare kọ́ja bẹ́ẹ̀, ṣùgbọ́n... -Leke Adeboye	Leke Adeboye to jẹ aburo oloogbe Dare Adeboye ti sọrọ lori ohun ti oun yoo bẹrẹ si ni ṣe fun ẹbi ẹgbọn oun ni asiko yii to ti fi aye silẹ. Ọjọ Kọkanla, Oṣu Karun un ni Dare Adeboye wọ ilẹ sun, lẹyin ti o doloogbe ni ẹni ọdun mejilelogoji ni Ọjọ Kẹrin, Oṣu Karun un, ọdun 2021. Leke Adeboye lasiko to n sọrọ ni oun yoo sa gbogbo ipa oun lati ri i wi pe awọn ọmọ oloogbe naa ri itọju to peye. Leke ni: ''Nibayii, mo mọ pe mo ni ọmọ mẹfa nitori mo bi mẹta, ẹgbọn mi si bi mẹta, ma a si ṣe itọju wọn.'' ''Gbogbo nkan ti wọn ba n ṣe ni ma a ri wi pe mo peju-pesẹ sibẹ to fi mọ igba ti wọn ba n lọ ṣe ayẹwo ara wọn'' 'Mo ti sọ fun iyawo mi pe: Awọn ọmọ rẹ ti da ti temi, ma a si sa gbogbo ipa mi lati wa nibẹ fun wọn.'' Leke tun ni pe: ''Amọ mi o ni ṣe iṣe ajihinrere to gbe kalẹ nitori ọgbọn lati ṣe iṣẹ ihinrere rẹ yatọ si ti temi, ti ọpọlọpọ eniyan si fẹran rẹ ti o ba n waasu.'' '' Ti ẹgbọn mi ba n waasu, awọn eniyan ma n ho fun ayọ ni, amọ ti emi ba n waasu ko si ẹni ti yoo ho fun ayọ nitori mo ma n sọ otitọ ọrọ bii abata ti a na ni pọ̀pá ni, ẹnikẹni ni ọrọ mi le ta ba ni, kii ṣe bi ajihinrere.'' ''Ohun gbogbo ni emi ati ẹgbọn mi ṣe papọ, to fi mọ ọjọ igbeyawo...'' Bakan naa ni Leke Adeboye sọ oriṣiriṣi ohun ti oun ati ẹgbọn oun jọ ṣe papọ lasiko ti wọn n dagba, titi awọn fi di ọdọ langba. Leke ni ileẹkọ kan naa ni wọn jọ lọ lati ileẹkọ alakọbẹrẹ, girama, to fi mọ kikawe ni oke okun. ''Nigba ti mo gbọ wi pe ẹgbọn mi n lọ ka iwe ni oke okun ti ko si fẹ mu mi lọ, mo sọ fun pe ọkọ baalu rẹ yoo gbina ti ko ba mu mi dani. Leke tun ni: ''Ẹgbọn mi lo fi ẹjọ mi sun Baba Adeboye, ki o to di wi pe ẹmi naa tẹle e, ti a si jọ lọ ka iwe ni ileewe kan naa ni oke okun'' ''Dare Adeboye jẹ ẹni to kun fun ọgbọn, ti kii ṣi ṣe imẹlẹ ni gbogbo nkan to ba n ṣe'' Ọpọlọpọ igba ni awọn eniyan maa n sọ fun mi pe ṣe mi o le dabi ẹgbọn mi ni? amọ a yatọ si ara wa'' Leke Adeboye wa gbadura wi pe ọrun lo ja ju fun gbogbo onigbagbọ, ati wi pe oun gbadura wi pe bi Dare Adeboye ṣe pari daradara naa ni awọn yoo pari daradara ni ile aye.	https://www.bbc.com/yoruba/media-57097274
health	W﻿o obìnrin tó bí ìbaàrún lẹ́yìn tó bí ìbejì lẹ́ẹ̀mejì àti ọmọ mẹ́sàn-án mìí	Awọn eeyan kan nipinlẹ Katsina ti bẹrẹ si ni pe arabinrin kan, Hajara Shuaibu, ni obinrin ti ọmọ pọ lara rẹ julọ ni Naijiria. Eyi waye lẹyin ti obinrin naa bi ọmọ marun-un lẹẹkan ṣoṣo ni Ọjọru. Ṣaaju asiko yii, Hajara ti kọkọ bi ibeji lẹẹmeji, ọmọ mẹsan-an miran, ko tun to bi marun-un. Hajara ba BBC sọrọ lori iriri rẹ to fi di iya ọlọmọ pupọ. Gẹgẹ bo ṣe sọ, o ni oun o ko mọ pe ọmọ to wa ninu oun ju ẹyọkan lọ, ati pe gbogbo nkan to yẹ ni oun ṣe ninu oyun. Hajara ko lọ si ileewosan ri fun itọju alaboyun, ante-natal, ile lo si bimọ si pẹlu iranlọwọ awọn iya agbẹbi ti wọn n pe ni Unguwan ni ede Hausa. Lẹyin to bimọ sile ni wọn to gbe e lọ si ileewosan Funtua General Hospital. O ni igba akọkọ ree ti wọn gbe oun lọ sileewosan nitori ọmọ bibi. Hajara sọ pe oun ko ni ounjẹ kan gboogi tabi asejẹ kankan to mu ki oun maa bimọ bẹẹ. Shuaibu Umar, to jẹ ọkọ Hajara sọ fun BBC pe meji lara awọn ọmọ tuntun naa kú lọjọ Ọjọbọ, to si ku mẹta ati iya wọn nileewosan ijọba apapọ nilu Katsina. “Nitori wọn ko ni irinṣẹ fun awọn ọmọ tuntun ti ko gbó nileewosan ni Funtua, ni wọn ṣe sọ pe ka gbe wọn lọ si Katsina fun itọju to peye.” Shuaibu to jẹ agbẹ ni abule Doma sọ pe ibukun ni oun ka ọmọ si lati ọdọ Ọlọrun. Bakan naa lo sọ pe alaga ijọba ibilẹ Faskari nipinlẹ Katsina, ti fi ẹgbẹrun lọna ọgọrun Naira ran wọn lọwọ. Ṣugbọn o ni awọn ṣi nilo iranlọwọ owo lati tọju ẹbi oun to jẹ elero pupọ. Nigba ti akọroyin BBC beere lọwọ Hajara boya yoo tun bimọ si, o ni ọwọ Ọlọrun ni eto aye oun wa. “To ba sọ pe kadara mi ni ki n tun bimọ si, dandan ni ko ri bẹẹ.”	https://www.bbc.com/yoruba/articles/cjr5vyzlwwvo
entertainment	Lateef Adedimeji: Mo ri iṣẹ́ Ọlọ́run, omijé gbọ̀n mí, mo sì rí ìdí tí ọpẹ́ fi tọ́ sí mi	"Yoruba ni ẹda to ba mọ inu ro, yoo mọ ọpẹ du nitori ẹni to ba ri isẹ Ọlọrun yoo fi ọpẹ fun Eledua. Ọpọ isẹ Ọba Oke si la n ri ni ojoojumọ ti a ko ka kun ayafi igba to ba kan wa gangan. Bẹẹ si ni ọpọ akanda ẹda to yi wa ka ni a ko ti ara wọn yin Ọlọrun logo, ayafi ta ba ri itọni lati se bẹẹ. Boya itọni yii gan ni gbajumọ osere tiata Yoruba kan, Lateef Adedimeji ri, ti omije fi bọ loju rẹ, to si bẹrẹ si ni fi ọpẹ fun ọba oke. Nigba to n salaye ohun to mu omije jade loju rẹ naa, agba osere tiata naa ni oun ronu jinlẹ lori ipo tawọn ẹda to ni ipenija oju wa ni. Adedimeji, ẹni to salaye ohun to foju kan lasiko to sabẹwo sile ẹkọ awọn akanda ẹda to ni ipenija oju loju opo Instagram rẹ, ni ẹru Ọlọrun ba oun. ""Mo ri ẹwa awọn isẹda Ọlọrun lonii lẹkunrẹrẹ, pẹlu omije loju, mo si ri didi to fi yẹ ki n maa dupẹ lọwọ adaniwaye. Ọlọrun lagbara, to si maa n mu ki ẹnu ya ẹda pẹlu awọn ohun iyanu to n se, ọna rẹ si yatọ si ti eniyan patapata. Loni ni mo jami lori aayan mi lati ni oye nipa iru ẹda ti Ọlọrun jẹ, eyi kii se isẹ mi lati mọ, ki oun sa maa jẹ Ọlọrun, ki emi si maa jẹ ẹda ọwọ rẹ."" Adedimeji, ẹni to fi fidio abẹwo to se sile ẹkọ awọn akanda ẹda to ni ipenija oju naa soju opo Instagram rẹ, wa fi ẹmi imoore rẹ han si Ọlọrun fun ipo to wa. Mo gbadun akoko ti mo lo pẹlu awọn akẹkọọ to ni ipenija oju nile ẹkọ Bethesda, wọn ko ni mọra pupọ. Ko si ọna miran ti yoo dara ti mo fi le lo akoko mi ju ki n wa pẹlu awọn akanda ẹda yii lọ, awọn eeyan yii ni ẹyin n pe ni afọju amọ mo n pe wọn ni Oju Ọlọrun. Awọn eeyan yii ko le ri mi bii ẹlẹran ara amọ wọn so pọ mọ ẹmi mi ju ọna kan lọ, Ọlọrun fi ẹbun ọwọ to lagbara jinki wọn ati ẹmi to yanranti."" Adedimeji tẹsiwaju pe lati isẹju akọkọ ti oun de ọdọ wọn, titi di akoko ti oun fi wọn silẹ, se ni ayọ ati okun wa lara wọn. O ni bi o tilẹ jẹ pe oun ti kuro lọdọ wọn, sibẹ ẹmi oun ko kuro nibẹ, to si n rọ awọn ololufẹ rẹ lati maa sabẹwo sawọn akanda ẹda naa. ""Ohun ti mo n salaye yoo tete ye yin tẹ ba n bẹ awọn eeyan yii wo, lati akoko yii lọ, maa sọ abẹwo mi sile awọn eeyan to ni ipenija oju naa di ajọdun ọdọọdun. Wọn ko ni da wa mọ, wọn yoo si maa ri mi ni oore koore ju ti tẹlẹ lọ."" Adedimeji ni ipa sise bii afọju ti oun ko ninu ere ti oun se nile ẹkọ awọn afọju naa jẹ ki oun mọ si nipa ohun tawọn eeyan to ni ipenija oju n la kọja. Osere tiata naa wa rọ awọn eeyan to ba n la ipo to nira kọja lati ni ọkan akin, ki wọn si maa ranti pe alaanu ni Ọlọrun. ""Ọlọrun yoo farahan yin lasiko ti ẹ ko nireti rẹ, ẹ sa maa fi ẹmi imoore yin han si, kẹ si maa dupẹ lọwọ rẹ. Bi ẹmi ba wa, ireti n bẹ, ẹ mase sọ ireti nu nitori ile aye yii rẹwa pupọ, Ọlọrun si dara."	https://www.bbc.com/yoruba/afrika-56729522
sports	Gabon youth coach arrested: Olùkọ́ni ẹgbẹ́ agbábọ́ọ́lù U-17 ní Gabon dèrò àtìmọ́lé fún ẹ̀sùn fífipá bá àwọn agbábọ́ọ́lù ọ̀kùnrin sùn	Olukọni tẹlẹ fun ẹgbẹ agbabọọlu Under-17 ni orilẹ-ede Gabon, Patrick Eyi, ti wa ni ahamọ ọlọpaa bayii nitori ẹsun ifipabanilopọ. Ọjọ Ẹti to kọja ni ajọ bọọlu orilẹ-ede naa da a duro lẹnu isẹ, lẹyin ti ileeṣẹ to n mojuto ere idaraya sọ pe Aarẹ Ali Bongo ṣapejuwe ẹsun naa gẹgẹ bi eyi to lagbara pupọ. Ọgbẹni Eyi sọ fun BBC pe oun ko jẹbi ẹsun naa. O ni ọna lati yẹyẹ awọn aṣeyọri oun ni. Ẹsun ti wọn fi kan-an ni pe o n ni ibalopọ pẹlu awọn ọdọmọkunrin kekeeke to n dari. Iwe iroyin The Guardian to jẹ ti ilẹ Gẹẹsi sọ pe agbabọọlu kan to wa pẹlu ikọ ọjẹ wẹwẹ nigba kan, sọ fun ohun pe iwa fifi ipa banilopọ ti n waye fun ọpọlọpọ ọdun ninu ajọ bọọlu alafẹsẹgba ni Gabon. Agbabọọlu naa sọ pe wọn fi ipa ba oun lopọ. Lọjọ Aiku bakan naa, wọn tun da olukọni miran duro ni Gabon lori ẹsun fifi ipa ba ọmọde lopọ. Ẹgbẹ agbabọọlu TP Akwaenbe da Mickala Orphe duro lẹyin ti awọn eeyan fi ẹsun ifipabanilopọ kan lori ayelujara. Ni bayii, ileeṣẹ eto ere idaraya ni Gabon ti bẹrẹ iwadii lori awọn ẹsun ifipabanilopọ to n waye ninu ẹgbẹ agbabọọlu orilẹ-ede naa, to si tun sọ fun ileeṣẹ eto idajọ lati tan ina iwadii de awọn ẹka ere idaraya yooku.	https://www.bbc.com/yoruba/ere-idaraya-59738953
religion	Eid Al Fitri Public holidays: Wo àwọn ìpínlẹ̀ tó kéde àfikún ọjọ́ ìsinmi ọdún ìtúnu awẹ̀ síi	Awọn ipinlẹ kan lorilẹ-ede Naijiria ti ṣafikun ọjọ isinmi fun ọdun itunu aawẹ Ramadan ti 2021 siwaju sii. Awọn ipinlẹ naa fi oni ọjọ Eti, ọjọ kẹrinla, oṣu karun un kun ọjọ meji ti ijọba apapọ kọkọ kede tẹlẹ, iyẹn ọjọru, ọjọ kejila ati ọjọbọ, ọjọ kẹtala, oṣu karun un. Gomian ipinlẹ Kano, Abdulahi Ganduje lo kọkọ kede pe oun ti fi ọjọ Eti kun isinmi awọn eniyan ipinlẹ naa ni eyi ti wọn yoo fi fi ọjọ mẹta sami ayẹyẹ ipari awẹ Ramadan tọdun 2021. Ogbeni Muhammed Garba Shehu to jẹ kọmiṣọnna ifitonileti ati iroyin gbogbo fun ipinlẹ Kano lo kọkọ fi eyi sita. Lẹyin naa ni ijọba ipinlẹ Jigawa naa kede itẹsiwaju isinmi pe ki ti ipinlẹ naa di ọjọ mẹta. Hussaini Ali Kila to jẹ olori awọn oṣiṣẹ ni ipinlẹ Jigawa lo fi atẹjade sita lati kede isinmi ọjọ Eti kun eyi ti ijọba apapọ kede tẹlẹ. Wọ́n ti kírun ọdún ìtúnu àwẹ̀ n'Ibadan L'Ọjọru ni Imam agba ilẹ Ibadan, Sheikh AbdulGaniyu Abubakry Agbotomokekere le iwaju irun itunu awẹ ni gbagede Yidi to n bẹ ni gbegbe Agodi nilu Ibadan. Igbakeji gomina ipinlẹ Ọyọ, Rauf Olaniyan ati Olubadan ilẹ Ibadan, Oba Saliu Adetunji wa lara awọn eeyan pataki to pejupesẹ sibi irun naa. Adura yii waye t'oun ti bi ajọ to n mojuto ọrọ ẹsin Islam lorilẹede Naijiria, 'Nigerian Supreme Council for Islamic Affairs (NSCIA)' ṣe paa laṣẹ wi pe ki awẹ Ramadan tẹsiwaju nitori osupa Shawal ko yọ ni alẹ ana. Aṣẹ yii lo mu ki awẹ di ọgbọn. Ọrọ kan ti wọn fi lede loju ọpọ ikansiraẹni Facebook Sheik Agbotomokekere lana lo kede rẹ wi pe awẹ Ramadan ti pari l'ọjọ Iṣẹgun, ọdun itunu awẹ yoo si waye l'Ọjọru. Gẹgẹ bi ileri ti o ṣe, Sheik Agbotomokekere le iwaju awọn Musulumi kan lọ si Yidi, ṣugbọn pupọ ninu awọn adari ẹsin bi i Aarẹ Musulumi ilẹ Yoruba, Edo ati ipinlẹ Delta, Alhaji Dawud Makanjuola Akinola De-Damak, gomina tẹlẹri nipinlẹ Ọyọ, Oloye Rashidi Ladoja ati awọn mii ko si nibi ipejọpọ naa. Bo tilẹ jẹ wi pe awọn eeyan pọ nibi ipejọpọ naa, onka awọn to kirun ọdun itunu awẹ nibẹ ko to iye awọn to n wa tẹlẹri. Iredi sini wi pe awọn eeyan kan ṣi gba awẹ titi di oni. Eleyii ki i ṣe igba akọkọ ti iru igbese yii yoo waye, asaaju ẹsin yii kede iru igbese yii ni ọdun mẹta sẹyin, botilẹ jẹ wi pe awọn alaṣẹ ni o yẹ ki awẹ tẹsiwaju.	https://www.bbc.com/yoruba/afrika-57091471
entertainment	Babatunde Usman: Òṣèré tíátà Okele ṣé fídíò síta,ẹ gbọ́ nkán tó sọ fún àwọn olólùfẹ́ rẹ̀	"Osere tiata Yoruba nii, Babatunde Usman ti gbogbo eeyan mọ si Okele ti fi ọrọ idupẹ ranṣẹ sawọn ololufẹ rẹ lori aarẹ to de mọlẹ laipẹ. Ninu fọnran fidio kan to fi si oju opo rẹ ni Instagram lo ti fi ikini yi ranṣẹ. O ni ohun dupẹ pupọ paapa lọdọ awọn to pe tabi ti wọn fi ọrọ ikini ranṣẹ lasiko toun wa lori aarẹ. Lọjọ Aiku to kọja yi  lo ṣe fidio naa sita ti o si jọ pe ko si nkankna to ṣe ninu fidio naa. ''Fun awuyewuye orisirisi  to n lọ lori ayelujara pe ki ẹ gbadura fun Okele.Okele ree, ko si nkankan to ṣe mi'' Babatunde ṣe ọrọ naa lowelowe to si ni ''mo dupẹ pe awọn to gbe koto ko gbẹ jin, ẹni to ko si naa Ọlrun ko ni ko da lapa'' O ni oun ni lati ṣe fọnran fidio naa sita lati dupẹ lọdọ awọn eeyan ati lati fi han ko si nkankan to ṣe oun. Ọmọ bibi ipinlẹ Kwara ni adẹrinposonu ẹni ọdun mejilelogoji yi to si ti n ba ere tiata bọ to nkan bi ogun dun sẹyin. Gbajugbaja adẹrinposonu nni, Babatunde Usman ti ọpọ eeyan mọ si Okele, lo ti di ero ile iwosan bayii nitori aidape ara. Osere tiata miran, to jẹ ọrẹ timọtimọ si Okele, eyiun Saliu Gbolagade ti awọn eeyan tun n pe ni Ogboluke lo kede bẹẹ ninu fidio kan to fi soju opo Instagram rẹ. Ogboluke, ẹni to n fi fidi naa fi ọrọ ransẹ si awọn eeyan kan lagbo tiata salaye pe kii se pe Okele mọọmọ fara pamọ lati mase yọju sibi ere sinima kan ti wọn pe si ni. Amọ Ogboluke ni ko si ẹni ti kii rẹ, aidape ara lo gbe Okele sanlẹ, to si ti wa nile iwosan nibi to ti n gba itọju. Osere tiata naa ni ti kii ba se pe oun wa sile iwosan naa lati fidi ootọ ọrọ mulẹ, oun naa ko ba ti mọ pe oun to n se Okele gbopọn pupọ. Ogboluke wa yan pe ""Kii se pe mo se fidio yii lati bẹbẹ owo fun itọju Okele, amọ mo fẹ fidi rẹ mulẹ fun awọn eeyan to ni Okele n fi aisan parọ ni ko ma ba wa ya ere. Ko yẹ ki eeyan sọ pe o fi aisan parọ, ni set ti emi naa ti n bọ, wọn lo fi aisan parọ ni, pe ko wa. Emi dẹ mọ ẹni ti mo n pe, mo dẹ n sọ fun wọn pe o ni nnkan kan to sẹlẹ, amọ ka sa dupẹ lọwọ Ọlọrun ni. N ko fẹ sọ pe ipo ti Okele wa critical amọ ka sa dupẹ lọwọ Ọlọrun sa."" Ogboluke wa gbadura fun Okele pe Ọlọrun ko ni jẹ kawọn sunkun lori rẹ, to si ni ọwọ aye ko ni tẹ nitori ẹni to n pa araye lẹrin ni, ko si ni sunkun lasẹ Ọlọrun Ọba. Ninu fidio naa la ti ri Okele to sun sori ibusun, ti wọn n fa omi ati oogun si lara pẹlu rọba kan ti wọn so mọ apa ati imu rẹ. Bakan naa ni rọba kan wa ni ọwọ isalẹ to lọ sinu ọra nla kan, ti itọ rẹ da rogun si, ti Okele si n se amin si awọn adura ti Ogboluke n se. Sugbọn Ogboluke ko sọ pato iru aisan to n ba Okele wọya ija, to fi da wolẹ sile iwosan to ti n gba itọju."	https://www.bbc.com/yoruba/afrika-58433927
entertainment	Yoruba film celebrities: Yomi Fabiyi ké sí àwọn ará kí wọ́n gbà á tọwọ́ tẹsẹ̀	"Gbajumọ ni Yomi Faibiyi lagbo oṣere fiimu Yoruba o si ti kede faraye pe oun ti pada sinu ẹsin ti wọn bi oun si bayii. Ọniruuru ni iroyin ti awọn eeyan mọ nipa oṣere yii amọ ọpọ ololufẹ rẹ ko fibẹẹ le tọka si ẹsin kan pato to n ṣe. Ninu atẹjade to kọ sita funrarẹ lori ayelujara lo ti ni inu ẹsin Islam ni wọn bi oun si, oun si ti pada sinu rẹ pẹlu iwuri. ""Mo ti pada si ẹsin ti wọn bi mi sinu ẹ. Mo ni iwuri lati jẹ Musulumi. E gbe Ọlọrun Ọba tobi..."" Yomi Fabiyi kede pe nibayii, orukọ oun ni Lukmon Abayomi Fabiyi. Lori eyi ni ọpọlọpọ akẹgbẹ rẹ ati ololufẹ r ti n kan sara sii fun igbesẹ tuntun to gbe. Bi awọn kan ṣe n ki i ku oriire ni awọn mii ro pe sakamanje lasan ni to fi n gbe awọn mọra. Koda awọn kan n kọ ọ pe kii ṣe ọwọ alafia bi ko ṣe ọwọ tun ni wọn maa n gbe Al Quran si."	https://www.bbc.com/yoruba/56629812
health	Coronavirus in Nigeria: Ǹjẹ́ ààrùn olówó ni coronavirus bí?	Oriṣiiriṣii nnkan lawọn eeyan m sọ nipa aarun coronavirus to n ṣọṣẹ kaakiri gbagbo agbaye bayii. Awọn kan gbagbọ tẹlẹ pe awọn oyinbo alawọ funfun nikan ni aarun n mu wi pe kii mu awọn alawọdudu ilẹ Afirika. Awọn miiran tiẹ sọ pe ohun elo imọ ẹrọ ibaraẹnisọrọ ti wọn n pe ni 5G lo n ṣokunfa aarun covid-19. Loju awọn mii, aarun olowo ni coronavirus jẹ, kii mu talika. BBC Yoruba ṣe alaye lẹkunrẹrẹ lori ọrọ yii.	https://www.bbc.com/yoruba/52218358
entertainment	Baba Ijesha: Yomi Fabiyi ní àwọn yóò ṣe ìwọ́de tí ọlọ́pàá kò bá mú àwọn àgbààgbà tó ló ọmọdé fún aṣemáṣe	"Ọrọ awuyewuye to n waye lori ọrọ Baba Ijesha ko tii jẹ rodo lọ mumi rara. Idi ni pe gbajumọ osere tiata, Yomi Fabiyi si n leri leka pe oun ati awọn eeyan kan yoo se iwọde laarin ọjọ meje tako ileesẹ ọlọpaa ipinlẹ Eko. Fabiyi ni iwọde naa yoo waye bi awọn ọlọpaa ko ba mu gbogbo awọn agbalagba to lo ọmọde, lati se akọsilẹ ẹri asemase fun Baba Ijesha. Fabiyi lo fi ọrọ yii ransẹ si igboro lati oju opo Instagram rẹ, eyi to kọ sibẹ tente. O ni awọn yoo sewọde alaafia ni Alausa ati lawọn agbegbe miran nipinlẹ Eko tako ọga agba ọlọpaa Eko Bakan naa lo ni awọn yoo tun beere pe ki wọn gba isẹ lọwọ olori ẹka to wa feto idẹrun araalu nipinlẹ Eko nitori pe wọn ko mọ isẹ wọn bii isẹ. ""A ko le maa wo awọn eeyan yii niran lati maa fi owo ori araalu sofo, wọn ko mọ isẹ wọn doju ami. A ja fun ọmọ kọọkan ti ko ni ẹsẹ lọrun, ti wọn ko naa ni rẹ. A si n se eleyi fun isisẹ sin ọmọniyan."" Kí ni yóò ṣẹlẹ̀ lónìí láàrin ìjọba ìpínlẹ̀ Kaduna àtàwọn tó jí akẹ́kọ̀ọ́ fásitì Greenfield gbé? Microsoft gbé ìgbésẹ̀ láti pèsè iṣẹ́ 27,000 fún àwọn ọmọ Naijiria Gbajumọ osere tiata naa fikun pe yoo dara ki awwọn eeyan naa se ohun to tọ lasiko, nitori iwọde naa ni yoo wa fun ọmọ kọọkan ti ko ni ẹsẹ lọrun, awọn jẹ wọn ni ojuse yii. Yomi Fabiyi tun gbe imọran kalẹ pe yoo dara ka lo awọn ọdọ wa bo se yẹ, ojuse yii si ni oun yoo ri daju pe o fidi mulẹ. Bẹẹ ba gbagbe, lati igba ti isẹlẹ ẹsun sise asemase pẹlu ọmọde ti wọn fi kan Baba Ijesha ti waye ni Yomi Fabiyi ko ti panumọ. Saaju la ti sọ fun yin pe, gbajugbaja oṣere tiata, Yomi Fabiyi to n ja fun pe ki gbogbo eeyan farabalẹ tẹle ofin lori ọrọ Baba Ijesha ti fesi lori fọnran ti ile iroyin kan fi si ta lori Baba Ijesha. ""O ṣe ni laanu gidi gan bi mo ṣe wo fọnran CCTV nibi ti Ọgbẹni Lanre Omiyinka ti a mọ si Baba Ijesha ti fi ilọkulọ ibalopọ lọ ọmọdebinrin kan. Ko si awawi. Mo bu ẹnu atẹ lu u tori o ti ni loju o si ba ni lorukọ jẹ pẹlu"". Yomi Fabiyi ni oun ti farabalẹ duro de ohun to tọ gidi ki oun to sọrọ gẹgẹ Bi wọn ṣe n ṣe lawọn orilẹede to laju ti oun si wa ri i pe ""eeyan kan ṣoṣo ti ọwọ rẹ mọ ninu kiko si gbaga ọlọpaa ni ọmọdebinrin naa"". Yomi Fabiyi ri i ninu fidio naa pe itasẹ agẹrẹ pọ daadaa latọdọ Baba Ijesha ninu fidio naa. O ni ibeere to yẹ ki gbogbo eeyan maa bere ni pe ""to ba ṣe ọmọ tirẹ obinrin ni ọmọbinrin naa, ṣe o lee jẹ ko tun iru iriri yẹn la kọja nitoripe o fẹ ni ẹri to daju. Nitori eyi, o tun n funpe si awọn alaṣẹ to n ṣamojuto ohunkohun to n lọ sori ayelujara. Yomi gba pe ofin ṣe pataki, paapaa nipa didaabo bo ẹtọ awọn ọmọde ni Naijiria. ""Koda, gbogbo ọmọ Naijiria to ba ni kaanu ọmọdebinrin naa ni ko fọn soju popo fun iwọde wọọrọwọ lati ja fun ki wọn fi ọwọ ofin mu awọn to lọwọ si aṣemaẹ yii."	https://www.bbc.com/yoruba/56963044
