entertainment	Yomi Fabiyi Oko Iyabo: Ẹgbẹ́ TAMPAN ti dá Yomi Fabiyi dúró lẹ́yìn tó gbé fíímù Oko Iyabo jáde	"Saaju la ti mu iroyin wa fun yin pe apapọ ẹgbẹ awọn oṣere tiata ni Naijiria, TAMPAN ti fofin de Yomi Fabiyi pe ko lọ rọọkun nile na. Ninu atẹjade ti ẹgbẹ naa fi sita lọjọ Ẹti lo ti kede pe igbesẹ naa waye nitori iwa abuku ati eyi ti ko ba oju mu gẹgẹ bi oṣere ti Fabiyi hu nipa fiimu Ọkọ Iyabọ to gbe jade laipẹ yii. Fiimu naa to gbe jade ni ọjọ Aiku to kọja da lori ọrọ ẹsun ifipabanilopọ ti wọn fi kan osẹre miran, Baba Ijesha. TAMPAN sọ pe igbesẹ naa waye lẹyin ti oun gbọ awijare Yomi Fabiyi to jẹ olukọtan, olootu ati oludari fiimu naa, ati oludari keji, Ọgbẹni Dele Matti. ""A ri pe wọn jẹbi hihu iwa ti ko bojumu fun akọṣẹmọṣẹ oni tiata. Awọn alaṣẹ TAMPAN sọ pe botilẹ jẹ pe Ọgbẹni Fabiyi taku pe ẹtọ oun gẹgẹ bi eniyan, ni lati gbe fiimu jade, eyi ti yoo sọ bi nakn ṣe ri gan-an lori iṣẹlẹ ọrọ Baba Ijesha, wọn ni alajọṣiṣẹpọ rẹ gba pe oun jẹbi, to si kabamọ ipa to ko ninu ṣiṣe fiimu naa. Ninu atẹjade ti ẹgbẹ naa fi si ori Instagram rẹ ni ikede naa ti jade. Awọn abajade iwadii ati idajọ ẹgbẹ TAMPAN nipa Yomi Fabiyi: Ọgbẹni Yomi Fabiyi mọọmọ ṣe fiimu naa lai bọwọ fun ilana to de fiimu ṣiṣe, eyi to tumọ si pe o sẹ isẹ naa pẹlu erongba lati da wahala silẹ laarin ilu. Ti iṣẹ naa (fiimu) kii ba ti i ṣe ti ile Sinima, ẹnikẹni ko ni ẹtọ lati lo orukọ eeyan ti iṣẹlẹ ṣẹlẹ si ninu fiimu. ""Nitori naa, iwa aibikita ni bi Fabiyi ṣe lo orukọ, ati awọn iṣẹlẹ to waye loju aye, lai gba aṣẹ lọwọ awọn ti ọrọ kan. Ìtàn, agbekalẹ itan, ohùn, ọrọ, akori, orukọ, ati gbogbo nkan to nii sẹ pẹlu fiimu ""Ọkọ Iyabọ"" jẹ awsn nkan to ṣẹlẹ, eleyi to le mu ki ojuṣaaju waye lori ẹjọ naa to ti wa ni ile ẹjọ. Iwa aibikiti to hu ti tabuku si orukọ ẹgbẹ wa. Ẹni ti wọn jọ dari ere naa, Ọgbẹni Dele Matti, ti fihan pe oun jẹbi, o ti ronu piwada, a si daa duro fun oṣu mẹta pere. A paṣẹ ki gbogbo ọmọ ẹgbẹ wa to kopa ninu fiimu naa yọju siwaju igbimọ to wa fun yiyanju aawọ ati ilana isẹ wa, ni ọjọ kẹrinlelogun, oṣu Keje, ọdun2021. Lakotan, ẹgbẹ TAMPAN sọ pe ẹgbẹ awọn eeyan to jẹ ọmọluabi ni oun, ti ko si ni ṣe atilẹyin fun ohunkohun to ba le da wahala silẹ ni awujọ."	https://www.bbc.com/yoruba/afrika-57783258
entertainment	Dejo Tunfulu: Àwọn ọmọ olòógbé ní àwọn dókítà kò kọbi ara sí ìtọ́jú rẹ̀, ló tètè ṣekú pa á	"Bi ina ba ku, a fi eeru boju, bi ọgẹdẹ ba ku, yoo fi ọmọ rẹ rọpo, bi oloye ba ku, yoo fi oloye silẹ lọ ni. Kunle Makinde Adetokunbo, ta tun mọ si Dejo Tunfulu tii se gbajumọ alawada ninu ere tiata to jade laye lọjọ Ẹti, ni wọn ti sin nile rẹ ladugbo Agbowa nilu Ikorodu ni irọlẹ ọjọ naa. Oloogbe naa si fi ọmọ mẹrin silẹ saye lọ. Nigba ti BBC Yoruba de ile oloogbe naa, a ba awọn ọmọ to n selede lẹyin rẹ sọrọ, ti wọn si sọ iru ẹda ati baba ti Dejo Tunfulu jẹ si wọn, nigba to wa nile aye. Akọbi oloogbe naa, Fatai Makinde Adetokunbo Junior salaye pe, oun jẹ ọmọ oniwahala, to maa n yọ baba oun lẹnu pupọ nigba to wa laye. Lẹ́yìn oṣù díẹ̀ tí wọ́n sìnkú rẹ̀, obìnrin yìí di dédé yọ sí ìlú rẹ̀, l'ọ̀rọ̀ bá di... Akẹ́kọ̀ọ́ rí ẹ̀wọ̀n ọdún márùn-ún he lẹ́yìn tó ná $1m tó ṣèèṣì wọ àpò àsùnwọ̀n rẹ̀ O ni lọjọ to kẹyin ọdun 2021, ni baba oun pe oun pe ti oun ko ba jẹ ọmọ to daa si oun, ki oun sa daa fun ara oun nitori lẹyin baba oun, oun lo kan gẹgẹ bi akọbi. ""Lati igba yẹn ni mo ti n tiraka lati yi awọn iwa lile mi pada nitori baba to n kara masiki ọmọ nii se. Kii fi itọju awọn ọmọ rẹ sere, oun nikan si lo da tọju wa, baba daadaa ni. Iya wa fi wa silẹ lọ fẹ ọkọ miran, baba wa nikan lo n da tọju wa: Nigba to n salaye bi Dejo Tunfulu se mu itọju ọmọ lọkunkundun si, akọbi rẹ naa ni kii kuku se pe awọn ko ni iya. Amọ o ni se ni iya awọn fi awọn silẹ, o kọ baba awọn, to si lọ fẹ ẹlomiran, lati igba naa si ni baba awọn ti n ko ba oju ati imu, lati tọju awọn. ""Tẹ ba mọ aburo mi to jẹ abigbẹyin wa, ọmọ osu mẹjọ ni iya wa gbe silẹ, to fi ba ọkọ mii lọ. Daddy mi lo maa dana ounjẹ ta jẹ, a maa fun ọmọ kekere naa ni ounjẹ titi to fi dagba. Bawo ni ko ba se dun to, to ba jẹ pe o duro jẹun ọmọ, ohun to n dun mi, to si n pa mi lẹkun gan ree. Baba mi ko jẹun ọmọ rara, koda, foonu to sẹsẹ ra fun mi niyi."" Fatai Makinde Adetokunbo Junior, ẹni to salaye pe awọn ko fẹ ki orukọ baba awọn parẹ ninu isẹ tiata, wa kede pe oun naa le sere tiata lati mase jẹ ki orukọ Dejo Tunfulu parun. O ni ti oun ba ri ẹni gbe oun nigbọnwọ, ran oun lọwọ, oun yoo sisẹ tiata daadaa nitori baba oun nigbagbọ ninu oun pe oun le sere tiata daadaa. ""Oju lo maa n ti mi, ara mi ko si balẹ amọ nigba ti baba mi ti ku bayii, mo le sere tiata. Ti mo ba ri ẹni ti yoo fi mi sinu ere, maa se daadaa. Nigba to n sọ fun BBC Yoruba nipa ọrọ ikẹyin ti baba rẹ sọ, ko to mi kanlẹ, Fatai ni ohun to sọ ni pe kawọn mase ba awọn dokita ile iwosan ijọba ni Ikorodu ja. O ni wọn ko tọju baba oun rara nile iwosan naa, gbogbo ohun ti wọn si ni kawọn se fun itọju wọn, naa lawọn se. O wa fọwọ gbaya pe awọn osere tiata ti wọn jẹ akẹẹgbẹ baba oun tiraka pupọ, wọn saayan lati tọju rẹ. ""Gbogbo wọn ni wọn dide, mo mọ riri wọn, wọn tiraka agbara wọn lati duro ti baba wa. Mo ki gbogbo awọn to wa sibi oku baba wa, wọn seun o, a ko ni fi iru rẹ san funra wa. Akọbi Dejo Tunfulu naa sisọ loju rẹ pe sinima si wa nilẹ, ti baba oun ti se pari, amọ to ku diẹ ko jade. O ni baba oun ti ra awọn eroja ere tiata kan silẹ bii ina ati ẹrọ ayaworan. Ohun to n wu oun bayii ni bi oun yoo se maa jẹ ki ori rẹ wu nibikibi to ba wa, nipa bawọn ti se tun ẹyin rẹ se. Bawọn dokita ko se tọju baba wa nile iwosan daadaa gan lo seku paa: BBC Yoruba tun ba ọmọ Dejo Tunfulu lobinrin sọrọ, Pamilerin Adetokunbo ẹni to sisọ loju rẹ nipa bi baba wọn se ku. O ni aisan iba lo se baba oun, to si jade lọ si igboro ni ọjọru, bo si se de, lo wo lulẹ tori aisan naa. ""A gbe wọn lọ si lọ si ile iwosan ijọba to wa ni Ikorodu amọ wọn ko sa ipa wọn bo se yẹ. Gbogbo ohun ti wn nilo nile iwosan la pese fun wọn amọ awn osisẹ ibẹ ko kọbi ara si wọn rara. O fẹrẹ dabi ẹni pe oun to pa wọn gan niyẹn nitori wọn n tọkasi iru abẹrẹ ti wọn fi fa omi si wọn lara. Gbogbo eroja fun itọju alaisan la ra nibẹ, koda, a sanwo pe baba mi fẹ tọ lasan nibẹ. Yatọ si pe a sanwo ẹjẹ ti wọn fun baba mi, nigba ti wọn tun ku tan, ile iwosan naa tun gba ẹjẹ lara wa ti ile iwosan naa yoo fi pamọ fun ẹlomiran. Ile iwosan naa ni ofin awọn ni pe a tun gbọdọ fi ẹjẹ silẹ pada lẹyin ta fi owo ra ẹjẹ tan fun baba wa. Koda, ka to ri oku baba wa gbe jade nibẹ, oju wa ri to. Wọn tun se ayẹwo oku ni ọna mẹrin, ki wọn to gbe oku wọn fun wa."" Pamilerin tun salaye fun BBC Yoruba nipa ọrọ ikẹyin ti baba wọn, Dejo Tunfulu sọ, ko to jade laye. ""Nigba ti Baba wa wa nile iwosan, wọn kan joko sori aga, wọn si sọ fun wa pe ti awọn ba ti gba ẹjẹ yii tan, ki ẹgbọn mi lọ sọ fawọn dokita pe ko fun awọn ni abẹrẹ, ki awọn to sun. Lootọ lo n pariwo pe ori n fọ oun, paapaa nigba to si wa nile iwosan. Ma se aaro ohun gbogbo nipa baba mi, awa ọmọ mẹrẹẹrin to bi yoo mọ riri iku rẹ lara. Were ọlọmọ ni baba mi lootọ, o maa n ko awa ọmọ rẹ kiri ni . Baba gbogbo aye ni, to si maa n se awada pupọ, wọn kii dibọn amọ bi iwa wọn se ri, ni wọn se n hu u."" Emi ati Dejo Tunfulu jọ wa nibi ọjọ ibi Tinubu lọjọ Isegun ni - Tajudeen Gbadamosi: Ọkan lara awọn osere tiata to ba BBC Yoruba sọrọ, Tajudeen Gbadamosi ti ọ̀pọ mọ si Coach ninu tiata naa sọrọ nipa iku Dejo Tunfulu. Coach salaye pe awọn dijọ wa nibi ọjọ ibi agba oselu nilu Eko, Bola Tinubu lọjọ Isẹgun nile Itura Eko Hotel ni. ""Ọmọ to daa, to ni alubarika ni Dejo Tunfulu, ko si ẹni ti ko nifẹ rẹ ninu gbogbo wa, o si wa lọdọ mi lọjọbọ ana. Kii fun wa ni wahala lagbo tiata, ọmọ jẹjẹ nii, ti kii si fa ijangbọn kankan, mo si gbadura pe ki Ọlọrun tẹ si afẹfẹ rere. Àṣekẹ́hìn ni yóò jẹ́ fún ẹnikẹ́ni tó bá tún hu ìwà ọ̀daràn ní ìpínlẹ̀ Oyo - Makinde Akẹ́kọ̀ọ́ rí ẹ̀wọ̀n ọdún márùn-ún he lẹ́yìn tó ná $1m tó ṣèèṣì wọ àpò àsùnwọ̀n rẹ̀"	https://www.bbc.com/yoruba/afrika-60965195
sports	Venus Williams virginity: Ṣé lóòtọ́ọ́ ni Venus Williams kò tíì mọ ọkùnrin lọ́mọ ọdún 41?	Ọrọ nla ni ọrọ jija abale ọdọbinrin laye ọjọun. Nitori naa, ọpọ obinrin ni wọn kii ti ni ibalopọ ri pẹlu ọkunrin ki wọn to lọ si ile ọkọ. Iyi nla lo si maa n jẹ fun wọn ati ẹbi wọn ti ọkọ wọn ba le ba wọn nile lasiko orun akọkọ ti wọn ba jọ sun. Bakan naa, itiju nla lawọn ti ọkọ wọn ko ba bawọn nile maa n ba bọ nibẹ atawọn ẹbi wọn. Amọ, gbogbo nkan ti yatọ laye ode oni, ọpọ ọmọdebinrin lo ti n mọ ọkunrin ki wọn to mura lati lọ si ile ọkọ rara. Awọn obinrin kan si tun wa laye ode oni ti wọn ko tii mọ ọkunrin bo tilẹ jẹ pe ọjọ ori wọn ko kere. Iru obinrin bẹẹ ni agbabọọlu tẹniisi ọmọ orilẹede Amẹrika, Venus Williams eleyii ti iroyin sọ pe ko tii mọ ọkunrin di akoko yii. Iroyin ti a gbọ ni pe, Venus ko tii mọ ọkunrin bo tilẹ jẹ pe o ti pe ọmọ ọdun mọkanlelogoji bayii. Koda, ọjọ kẹtadinlogun oṣu kẹfa ọdun 2022 yii ni Venus yoo pe ọdun mejilelelogoji. Sibẹ naa, ohun ti a gbọ ni pe ko tii ni nibalopọ pẹlu ọkunrin kankan ri lati igba to ti gbọnju. Venus ti maa n sọ fawọn akọroyin pe oun ko ni igbagbọ ninu ibalopọ pẹlu ọkunrin afẹsọna ṣaaju igbeyawo.	https://www.bbc.com/yoruba/afrika-60026219
religion	Boko Haram: CAN àti àwọn ará Chibok ní kò sí orílẹ̀èdè tó yege nínú yíyí ọkàn aṣẹ̀rùbálú padà	Ile igbimọ aṣofin nilu Abuja ti gunle abadofin ti yoo ṣedasilẹ ileeṣẹ ijọba, ti yoo ma ṣetọju awọn ọmọ ẹgbẹ Boko Haram to ba ronupiwada. Abadofin ọhun ni Sẹnatọ to n ṣoju Ila-oorun ipinlẹ Yobe, to tun jẹ gomina ana nipinlẹ ọhun, Ibrahim Gaidam n ṣagbatẹru rẹ. Gẹgẹ bi agbekalẹ abadofin naa ṣe sọ, ileeṣẹ ọhun yoo pese anfani fun awọn agbesunmọmi to ba jọwọ ohun ija wọn, lati lọ si ile iwe. Lẹyin eyi, yoo ṣe atunkọ ohun ti wọn gbagbọ, iyipada ọkan wọn, ti yoo si tun da awọn eeyan naa pada si awujọ gẹgẹ bi ẹni to ti ni iyipada ọkan ati ẹdun tuntun. Ko tan sibẹ, ileeṣẹ naa yoo tun kọ awọn eeyan naa ni iṣẹ ọwọ bii gbẹnagbẹna, iṣe amọkoko, ati bẹẹ bẹẹ lọ. Igbimọ to ga julọ fun ọrọ ẹsin Musulumi, eyi ni Supreme Council for Islamic Affairs ti ṣe atilẹyin fun abadofin naa. Ṣugbọn lẹyin wakati diẹ ti abadofin naa kọja kika akọkọ, ni awọn olugbe ilu Chibok, ti Boko Haram ṣakọlu si lọdun 2014 ati CAN tako abadofin naa. Bẹẹ naa ni adari ajọ ọmọlẹyin Kristi, CAN lori ọrọ ofin, Kwamkar Samuel sọ fun awọn akọroyin pe, oun ko tii ri orilẹ-ede kankan lagbaye to ṣaṣeyọri ninu yiyi ọkan ẹgbẹ aṣẹrubalu pada. Yatọ si ẹgbẹ CAN ati awọn ara ilu Chibok, ogunlọgọ awọn Naijiria lo n bu ẹnu ẹtẹ lu awọn asofin naa pe, abadofin ọhun kii ṣe ọna abayọ si ọrọ ikọ Boko Haram. Agbẹnusọ fun ilu Chibok ni tirẹ sọ pe, abadofin ọhun jẹ ohun ti ko ni ọgbọn ninu. Ti ẹ ko ba gbagbe, ọjọ kẹrinla Oṣu Kẹrin ọdun 2014 ni ikọ Boko Haram ṣakọlu si ilu Chibok, to si ji awọn ọdọbinrin to le ni igba gbe lọ.	https://www.bbc.com/yoruba/afrika-51583036
sports	Nigeria vs Ghana: Eléyìí kọjá jọ̀lọ́ọ̀fù ẹni tó dùn ju, orí pápá ní Nàìjíríà àti Ghana yóò tí fìjà pẹẹ́ta	Bi eeyan ba darukọ Naijiria ati Ghana papọ ninu gbolohun kan, ohun meji lo maa n wa si ọkan awọn to ba gbọ ọ. Akọkọ ni jọlọọfu ẹni to dun ju ti ẹlẹẹkeji si jẹ ẹni to mọ bọọlu gba julọ ninu awọn orileede mejeeji yi. A tun le fi olorin to ba mọ orin kọ ju ninu olorin Naijiria ati Ghana kun  afiwe yi ṣugbọn nitori pe ọrọ wa niṣe pẹlu ere idaraya, a o fi mọ nidi ere bọọlu. Lọjọ kẹẹdọ́gbọn ati ọjọ Kọkandinlọgbọn oṣu Kẹta, ija kan ni wọn yoo pari laarin ikọ agbabọọlu il wnyi, ẹni to ba si jaweoluboriu ni yoo tẹsiwaju lọ si idije ere bọọlu agbaye ni Qatar 2022. Ipade laarin Naijiria ati Ghana ni Kumasi lọjọ Karundinlọgbọn oṣu yi yoo kamama. Gbọngbọn yoo kan si, alarẹ yoo jagba ti pẹpẹyẹ yoo si pọnmọ lọjọ taa n wi yi. Ipade akọkọ ree lari awọn orileeede mejeeji lati nkan bi ọdun mkanla sẹyin nigba ti wọn koju ni ọdun 2001. Ọjọ mẹrin lẹyin ti wọn ba kọkọ figa gbaga ni Kumasi, wọn yoo tun fi ipade si Abuja fun ifẹsẹwọnsẹ ikẹyin ṣaaju irinajo ẹni to ba pegede si Qatar. Naijiria n gbiyanju lati lọ si idije Workld Cup ẹlẹẹkẹrin wọn lera ti Ghana si fẹ tun tọ adun idije yi wo lẹyin ijakulẹ wọn lọdun 2018 ti ko jẹ ki wọn kopa ni Russia. Ọkùnrin kan fípa bá obìnrin tó sùn sẹ́gbẹ̀ẹ́ ọkọ rẹ̀ lòpọ̀! Wo bí gbẹgẹdẹ ṣe gbiná Olùdásílẹ̀ ìjọ méjì di afurasí tó pa ọmọ ìjọ lásìkò ìsìn, wo bí wọ́n ṣe sin òkú rẹ̀ láì sọ f'Ọ́lọ́pàá Naijiria ati Ghana kii se ajoji arawọn. Ni ti ẹni to kọkọ gba ominira, Ghana ṣaaju Naijiria jakun lọwọ amunisin ṣugbọn ninu orileede to tobi julọ, Naijiria gbe Ghana mi laimọye igba. Koda ninu ibi tawọn ọmọ  Ghana ti n wa ọna ijẹ ati imu ni Naijiria wa lati ibẹrẹ ko to di ọrọ Ghana must Go to da ọpọ ọmọ ilẹ naa pada sile. Amọ ṣa bo ba kan ti ọrọ ere bọọlu, Ghana ti gba ife ẹyẹ Afcon lẹẹmẹrin ti Naijiria si ṣẹṣẹ ri gba niwọn igba mẹta pere. Laarin ọdun1970-1980 Ghana a maa foju Naijiria gbole. Bi a ko ba gbagbe,wọn gbewuro soju Naijiria ni ọdun 1992 nigba ti wn bori Naijiria ni abala to kangun si aṣekagba idije Nations Cup. Omi tuntun ti ru bayi ti Naijiria si ti gba ife ẹyẹ Afcon ni ọdun 1994 ati 2013.Lati 1982 ti Ghana ti gba ife yi kẹyin, nkan ko rọgbọ fun wọn titi di asiko yi. Lara ọgbọn ti Ghana da lati le ko ipaya ba Naijiria ni pe wọn ko tete kede orukọ awọn ti yoo ṣoju ilẹ naa lori papa. ''O si ko idamu bawọn'' nigbolohun to jade lẹnu ọmọ ẹgbẹ igbimọ alaṣẹ ere bọọlu Ghana Sammy Anim nigba to n ba BBC Sport sọrọ nibẹrẹ ọṣẹ yi. ''A ko le maa lo ọgbọn atẹyinwa ta ba fẹ bori Naijiria. Eyi taa lo yi, o da wa loju pe a o bori Naijiria lati tẹsiwaju lọ si Qatar 2022'' Balogun ikọ Ghana Andre Ayew ko ni kopa ninu ifẹsẹwọnsẹ Kumasi nitori pe o gba kaadi pupa. Otto Addo ni akọnimọọgba Ghana bayi ti Chris Hughton agbabọọlu tẹlẹ fẹgbẹ Tottenham yoo jẹ oludari eto ikọ naa. Awọn agbabọọlu Naijiria kanna wa ti wọn ko ni kopa ninu ifẹsẹwọnsẹ yi.Alex Iwobi ti gba aṣ lọrọọkun nile, Wilfred Ndidi farapa ṣugbọn Ademola Lukman yoo ṣoju Naijiria lyin to paarọ orileede kuro nil Gẹẹsi lati le ṣoju Naijiria. Ghana nikan kọ ni nkan ko rọgbọ fun. Awọn alatilẹyin Naijiria ti wọn ruga apa soke ti wa n se pẹlẹ bayi lẹyin tijakulẹ ikọ wn ni Afcon to kọja yi. Eyi ko si ṣyin ijakulẹ ti ikọ Augustine Eguavoen koju lẹyin ti Tunisia fi goolu kan ṣoṣo ja ireti wọn labala komẹsẹoyọ. ''Mo gba pe emi ni mo lẹbi ijakulẹ ati gbogbo nkan to ṣẹlẹ ni Cameroon ṣugbọn nkan yoo yatọ pẹlu Ghana'' Ọrọ iwuri ree ti akọnimọọgba Super Eagles sọ lasiko ifọrọwanilẹnuwo pẹlu BBC. ''Nkan to tobi lo wa nilẹ yi to si da lori niti yoo kopa ninu idije ife ẹyẹ agbaye. Mi o fẹ sọrọ pupọ. Ipade dori papa''	https://www.bbc.com/yoruba/ere-idaraya-60865074
sports	Mourinho kò ọ́rọ́ rẹ̀ jẹ,o padà wá dì akọ́nimọ̀ọ́gbá tuntun fún ikọ̀ Tothenham	Aya bẹ silẹ o bẹ sare lọrọ Jose Mourinho to gba iṣẹ akọnimọọgba tuntun Tottenham fẹ jọ. Lọsan Ọjọru ni yoo ṣe igbaradi akọkọ pẹlu awọn agbabọọlu ẹgbẹ naa lalai fi asiko falẹ. Loju opo Twitter kaakiri lawọn eeyan ti n sọ nipa iyipada tawọn n reti lati ọdọ Mourinho amọ wọn ko ye sọ nipa bo ti ṣe ṣaaju sọ pe oun ko ni gba iṣẹ akọnimọọgba ẹgbẹ naa. Bẹẹni,Mourinho ti sọ tẹlẹ pe ifẹ toun ni si Chelsea pọ bẹ debi pe ohun ko le gba iṣẹ akọnimọọgba Tottenham. Akọsilẹ fi han pe o sọ ọrọ yi lọdun 2015 ṣaaju ifẹsẹwọnsẹ Chelsea pẹlu Tottenham ninu idije League Cup ni papa iṣere Wembley. Ninu ifọrọwerọ pẹlu awọn akọroyin,Mourinho ni alaga ẹgbẹ Tottenham Daniel Levy ti fi igba kan ba ohun sọrọ nipa gbigba iṣẹ ni Tottenham lọdun 2007. Gẹgẹ bi ohun gbogbo to ni ṣe pẹlu Mourinho,iriwisi ọtọọtọ lo ti n waye lati igba ti wọn yan si ipo tuntun yi. Bawọn kan ti ṣe n dawọọ idunnu lawọn miran n sọ pe ko si ipa to le mu ba Tottenham yatọ si eleyi to ti wa nilẹ tẹlẹ Jose Mourinho ti da akọnimọọgba ẹgbẹ agbabọọlu Tottenham, lẹyin ti wọn yọ Mauricio Pochettino ni isẹ. Akọnimọọgba tẹlẹri fun ikọ agbabọọlu Chelsea ati Manchester United ti bu ọwọ lu iwe adehun ọlọdun marun un 2022 si 2023. Mourinho ni o dun mọ oun ninu nitori ọpọ igba ni oun ti ma n woye lati je akọnimọọgba fun ẹgbẹ agbabọọlu Tothenham. Lọpọ igba ni o ti kọ isẹ akọnimọọgba ni orilẹede China, Spain, Portugal lati igba to ti kuro ni Manchester United. Mourinho n gbe ni ilu London, ti o si ti gba ami ẹyẹ Premier League mẹta ati FA Cup pẹlu ikọ Chelsea, bẹẹ lo si gba Europa League and Carabao Cup pẹlu ikọ Manchester United.	https://www.bbc.com/yoruba/50484802
sports	English Premier League: Arsenal jẹ́ọ́ àgbò tó tàdí mẹ́yìn fún Aston villapẹ̀lú àmì ayò mẹ́ta sí méjì	Ori lo ko Arsenal yọ lọwọ Aston Vila ni idije Premiership to waye ni papa iṣire Emirates. Ilẹ kọkọ ṣe bi ẹni fẹ pooyi fun Arsenal ninu ifẹsẹwọnsẹ naa nigba ti John mcGinn gba bọọẹu wọle nitori aikiyesara awọn adilemu Arsenal to n woran lẹyin. Nicolas Pepe gba gbeelẹ koo gba sile, pẹnariti wọle lẹyin ti awọn agbabọọẹu Aston Villa gbe Gendouzi, agbabọọẹu Arsenal lulẹ ninu oju iwọn alapoti Aston villa ko jẹ ko tutu ti wọn tun ti fi  gba omiran wọle. Lẹyin eyi ni Calum Chambers ati Aubameyang wa gba ayo kọọkan wọle lati bọ ẹwu  itiju ti aston villa fẹ da ro Arsenal ni ibuba rẹ kuro. Pẹlu esi yii, ipo kẹrin ni Arsenal wa lori tabili liigi ilẹ Gẹẹsi bayii pẹlu ami mọkanla. Ọkan lara awọn agbabọọlu Arsenal, Ainsley Maitland -Niles gba kaadi pupa ti wọn si lee jade nitori ikọlu rẹ si agbabọọẹu Aston Villa kan.	https://www.bbc.com/yoruba/afrika-49786169
