sports	Icegeranyo kivuga ko Diego Maradona yapfuye kubera ugusamara kw'abaganga	"Umurwi w'abahinga mu vyo buvuzi wemeje ko uwahoze ari umukinyi rurangiranwa wa Argentine mu mupira w'amaguru Diego Maradona ""atitaweho kandi habaye urwangara"" imbere 'yuko asandaba. Abashikirizamanza muri Argentina bari basavye uyo murwi gukora amatohoza ku bari bajejwe gukurikirana amagara ya Maradona inyuma y'aho apfiriye mu kw'icumi na rimwe umwaka uheze. Maradona yahitanywe n'indwara y'umutima muhira iwe i Buenos Aires afise imyaka 60. Mu ntango z'ukwa cumi na rimwe yari yabazwe mu bwonko ikivyimba cari cavuye kw'ivura ry'amaraso, akaba yagomba abandanye avurwa ingaruka z'inzoga. Nk'umwe mu bakinyi babaye rurangiranwa mu bihe vyose, Maradona yahavuye agira ubuzima bubi bwaranzwe no kunywa ibiyayuramutwe n'inzoga nyinshi. Urupfu rwa Maradona yabaye kizigenza w'umurwi nserukiragihugu wa Argentina igihe iki gihugu gitahukana igikombe c'isi yose mw'ihiganwa mpuzamakungu ry'umupira w'amaguru  mu 1986, rwababaje abakunzi b'umupira w'amaguru kw'isi, bakaba bibajije vyinshi ku bijanye n'abari bajejwe kumuvura. Haciye imisi mike apfuye, abashikirizamanza baciye batangura amatohoza ku baganga n'abaforoma bari bajejwe kumuvura. Mu kwa gatatu, abo bashikirizamanza batumyeko abahinga 20 muvyo ubuvuzi  kugira ngo bihweze icatumye Maradona apfa bongere bihweze nimba harabaye urwangara. Ivyavuye mu matohoza y'abo bahinga vyatangajwe n'ibinyamakuru vyo muri Argentina ku wa gatanu. Mu cegeranyo c'impapuro 70, uyo murwi werekana ko Maradona yasinzikaye cane hafi amasaha 12 imbere y'uko apfa. Muri iki gihe, ""ntiyakurikiranywe bikwiye"", nk'uko iki cegeranyo kibivuga. Gisubiramwo ibiri muri ico cegeranyo, ikinyamakuru Clarin co muri Argentina kivuga ko uyo murwi wagiriza abaganga bari bajejwe kuvura Maradona ""bamutanye wenyene"" Abo bahinga bavuga ko Maradona yari gushobora kuronka amahirwe yo gukira iyo ajanwa kuvurirwa kw'ivuriro hakumugumiza muhira, nk'uko ico kinyamakuru kibivuga. Uyo murwi uvuga ko abari bajejwe kuvura Maradona batamuvuye neza kandi baranzwe n'urwangara, nk'uko vyandikwa n'itororokanirizo ry'amakuru Reuters naryo ryaronse ico cegeranyo. Umuganga bwite wa Maradona Leopoldo Luque w'imyaka 39 hamwe n'uwari ajejwe gukurikirana ubuzima bwiwe bwo mu mutwe, bari mu baganga bariko barakorwako amatohoza n'aho bashikirizamanza. Umurwi w'abahinga washikirije icegeranyo cawo, hasigaye ko abashikirizamanza bafata ingingo ku bijanye no kurengutsa abagirizwa. Ikinyamakuru Clarin kivuga ko bimwe muvyo bashobora kwagirizwa harimwo ubwicanyi. Uru rupfu rwakozweko amatohoza inyuma y'uko babiri mu bakobwa ba Maradona bitwaye. Bavuze ko bagize amakenga ku kungene se wabo yakurikiranywe amaze kubagwa mu bwonko. Muganga Luque wewe nta caha camwagiriye. Arahakana ko ataruhara yabigizemwo. Mu kiganiro yagiranye n'abanyamakuru akorora amosozi mu kwa cumi na rimwe, Muganga Luque yararize, avuga ko yakoze uko ashoboye kugira arokore ubuzima bw'umugenzi wiwe. Uyu muganga yavuze ko yakoze ""ivyo yari ashoboye vyose gushika aho ananirwa""."	https://www.bbc.com/gahuza/amakuru-56961508
business	Ubufaransa bwemeje amakori ataguye neza Amerika	Inama nshingamateka y'Ubufaransa yemeje integuro y'itegeko rigena amakori acibwa ibigo bikomakomeye nka Google, Facebook na Apple. Guca 3% nk'ikori ku bikorwa vy'ibigo bikoresha itumatumanako bigera ku 30 birwiriyemwo ivyo muri Leta zunze Ubumwe za Amerika bishobora kuzanira leta y'Ubufaransa miliyoni 400 z'ama euros muri uyu mwaka wonyene. Abashingamateka birengagije akamo ka Leta Zunze Ubumwe za Amerika zavuga ko ari akarenganyo, kandi ko zigiye kwihora mu kuzoshiraho amakori nk'ayo. Umushikiranganji w'ikigega ca Leta w'Ubufaransa Bruno Le Maire yiyamirije impungenge za Amerika, avuga ko ibintu nk'ibi bikwiye gutoregwa umuti mu biganiro. Ubufaransa buvuga ko bikwiye ko ibigo vyifashisha itumatumanako, bitanga amakori aho bikorera aho kuyatanga aho bifise icicaro gikuru, ivyinshi bikaba bibarizwa muri Amerika. Ubufaransa bwananiwe kwumvisha ibindi bihugu gufatira hamwe iyo ngingo mw'ishirahamwe rya Bulaya, bari kwita 'GAFAs' mu majambo avunaguye, n'ukuvuga Google, Apple, Facebook na Amazon. Ubu rero bwahisemwo gutangura bwo nyene guca ayo makori, ariko bukizera ko iyi ngingo yabwo izoba iy'igihe gito. Hari ibiganiro hagati y'ibihugu bitunze kuruta ibindi bigize umugwi G7 hamwe n'ikigo kijejwe kuraba  imigenderanire mu butunzi n'iterambere mu kugabangana amakori avanwa mw'ikoreshwa ry'itumatumanako muri kino gihe rifise ikibanza gikomeye. Gutyo rero hakaboneka umwumvikano uvuye mu nama ugasubirira ingingo nka bene iyi y'Ubufaransa. Ubwongereza bwatangaje umugambi wo gushiraho amakori asa n'aya y'Ubufaransa, ico cemezo kikazoshobora kuja mu bikorwa mu mwaka uza. Espagne yo yakoze umushinge w'itegeko muri uyu mwaka. Umunyamakuru Dave Lee akorera muri Amerika ya ruguru ati 'Ubufaransa burikumiriye'. Ubutegetsi bwa Washington bwamaze kuvuga ko bugiye kwugurura ingingo yitwa 'Section 301', mu nzira yo gutohoza nimba hari aho burenganywa. Ni ingingo yakoreshejwe mbere, nk'inzira yo gushiraho ibiciro bishasha ku bihugu ubutegetsi bwa Trump bwibaza ko biriko biburiramwo mbege. Nimba Ubufaransa bugiye gukura miliyoni amajana z'ama euros mu mifuko y'ibi bihangange vyo muri Amerika, Amerika nayo ishobora kuvuga iti :'kuki tweho tutokura amafranga mu vyo Ubufaransa bukorera iwacu?' Uko niko vyagenze ku Bushinwa,  bigahamba Amerika mu ntambara y'ubudandaji ishobora no gukomera muri kazoza. Amakori ku bikorwa vy'itumatumanako, ni ikibazo giteye impungenge ku Bufaransa, kuko bwikumiriye. Ibiganiro vyigeze gutangura hagati y'ibihugu kuri ayo makori vyahavuye biburizwamwo kuko bamwe muri bo batari bashigikiye ayo makori. Aha umuntu yovuga nka Irland yavyungukiyemwo mu guhamagara abashoramitahe bashaka isoko ku mugabane wa Bulaya. Ibindi bihugu nk'Ubwongereza, Espagne na Autriche biracagonanwa gufata iyo nzira. Ico impande zompi zihuriyeko n'uko igihe carenze co kwiyumvira ingene ibigo vyungukira mw'itumatumanako bitozwa amakori. Ubufaransa bushobora kwitega ibintu bibiri. N'uko ibihugu bitera ikirenge mu cabwo bishiraho amategeko yavyo, bigatuma Ubufaransa butaba nyamwigendako. Ikindi n'uko iyo ntambwe Ubufaransa bwateye ishobora gutuma n'ibindi bihugu bibona ko hageze kwumvikana uko bitoza ayo makori biri hamwe. Ivyo vyotuma amafranga ivyo bigo vyahora vyikwegerako ataha mu bigega vy'ibihugu.	https://www.bbc.com/gahuza/48958633
sports	Ayavugwa mw’igura n’igurishwa ry’abakinyi: Kante, Ziyech, De Vrij, Ronaldo, Min-jae, Berge, Smalling	"Barcelona irashobora guheraheza amasezerano yo kugura umufaransa akina hagati  N'Golo Kante, mu kwa mbere, ariko bikazovana n'ingene imvune yiwe yo mw'itako izoba imeze, amasezerano afitaniye na  Chelsea akaba azorangira mu ci riza. (Sport) AC Milan ishobora guhagarika urugamba rwayo rwo kurondera umukinyi wo ku ruhande wa  Chelsea, Hakim Ziyech w'imyaka  29, kubera ivyo uyu mukinyi mpuzamakungu wa Maroc asaba, ariko uyu murwi w'Ubutaliyano ukaba ucipfuza umusatirizi wa Albania Armando Broja w'imyaka 21 na we nyene akina muri aba ba Blues. (Gazzetta Dello Sport, via Football Italia) Tottenham ishobora kuraba ingene yogura umukinyi w'inyuma, umunya-Hollande  Stefan de Vrij w'imyaka 30 akina muri Inter Milan mu kwa mbere.  Atletico Madrid nayo nyene iripfuza uyu mukinyi azoba yirebanga mu ci riza. (Football Insider) Umumenyereza wa Manchester United  Erik ten Hag yari yashatse guha uruhusha umusatirizi wa Portugal Cristiano Ronaldo akigira mu kwa munani guheze ariko imirwi itari mike yaranse ayo mahirwe yo kugura uyu musatirizi w'imyaka 37 ubu yasezeye muri uyo murwi wa Old Trafford, ku mushahara wa 80.000 vy'amapawundi ku ndwi. (Athletic) Manchester United yasubiye kurondera umukinyi w'inyuma wa Naples/Napoli Kim Min-jae ariko rero iriko imurwanira na Real Madrid, amasezerano y'uyu mukinyi w'imyaka 26 akomoka muri Korea y'Epfo akaba arimwo ingingo ivuga ko umurwi umushaka utegerezwa gutanga imiriyoni 38 z'amapawundi. (Sunday Mirror) Tottenham, Juventus, Inter Milan na  Atletico Madrid yose iripfuza umukinyi wo hagati akina muri  Brighton, umunya-Argentina Alexis Mac Allister w'imyaka 23. (Fichajes) Arsenal na Chelsea yompi yari yipfuje kugura mu mwaka uheze umusatirizi wa Côte d'Ivoire  Wilfried Zaha w'imyaka 30 asanzwe akinira  Crystal Palace. (Teamtalk) Newcastle ni wo murwi ufise amahirwe menshi yo kugura umukinyi w'inyuma akina muri Inter Milan, umunya Slovakia  Milan Skriniar w'imyaka 27. (Calciomercato) Chelsea na Liverpool yompi iripfuza umukinyi w'umunya-Norvège  akina hagati, Sander Berge, 24, akina muri  Sheffield United wo mu cicaro ca kabiri. (Jeunesfooteux). Juventus yahambije Inter Milan mu gukurikiranira hagufi  umwongereza akina inyuma  Chris Smalling w'imyaka 33, akaba ashobora kwirebanga mu ci riza mu gihe amasezerano afitaniye na Roma azoba arangiye, mu gihe yokwanka amasezerano mashasha canke akanka kwongereza ayo afitaniye n'uyu murwi w'Ubutaliyano.  (Sky Sports Italia ) Umunya-Portugal akina inyuma ku ruhande rw'ibubamfu Raphael Guerreiro w'imyaka 28, asa n'uwushobora kuva muri  Borussia Dortmund mu ci riza. (Ruhr Nachrichten) Sevilla iripfuza umukinyi wo hagati wa Angers  Azzedine Ounahi w'imyaka 22 ariko yitwara neza mu murwi nserukira gihugu wa Maroc muri rino higanwa ry'igikombe c'isi yose 2022. (Fichajes ) Borussia Dortmund ntishaka kugurisha umubirigi akina ku ruhande rw'i buryo inyuma, Thomas Meunier, mu kwa mbere, ni mu gihe Barcelona yipfuza uyu mukinyi w'imyaka 31. (Sport ) Umukuru wa Bayer Leverkusen  Simon Rolfes avuga ko uyu murwi ""ata bwoba na buke ufise"" ku bijanye na kazoza k'umukinyi wayo w'inyuma, umunya-Hollande  Jeremie Frimpong w'imyaka 22,  asanzwe yipfuzwa na  Manchester United, ni mu gihe amasezerano afitaniye n'uyu murwi azorangira mu 2025. (Sky Deutschland iciye kuri Manchester Evening News)"	https://www.bbc.com/gahuza/articles/c0vq2wp11xvo
sports	Ayavugwa mu mupira w'amaguru: Lukaku, Bernardo, Pogba, Coutinho, Messi, Kounde	"Inter Milan yiteze ko Chelsea isubira kurondera umusatirizi w'umubirigi Romelu Lukaku w'imyaka 28 yongereje amahera ishaka gutanga, igapfuma ishikana imiriyoni zababa 153 z'amadorari y'abanyamerika, inyuma y'aho yankiye imiriyoni 118 z'amadorari kwongerako ukuminyi w'inyuma wa Espagne Marcos Alonso w'imyaka 30. (Mail) Mu gihe Jack Grealish yitezwe cane muri Manchester City, bishobora gutuma Bernardo Silva agenda, mu gihe Barcelona na Atletico Madrid yipfuza uyu mukinyi wo hagati w'umunya Portugal w'imyaka 26.  (Mundo Deportivo - in Spanish) Aston Villa yitezwe kubandanya irondera umukinyi wo hagati wa Norwich, umwongereza Todd Cantwell w'imyaka 23 mu gihe Grealish yoramuka yimukiye muri Manchester City ku miriyoni 139 z'amadorari y'abanyamerika.  (Sky Sports) Atalanta yiteze kugiriranira ibiganiro na Chelsea mu mpera z'iyi ndwi kugira bumvikane ku musatirizi w'umwongereza Tammy Abraham w'imyaka 23. (Gianluca di Marzo) Paul Pogba azotangura umwaka w'inkino wimirije mu murwi Manchester United ariko akaba yiteze gufata ingingo kuri kazoza kiwe imbere y'uko ikiringo c'igura n'igurishwa ry'abakinyi kirangira, mu gihe PSG ikirondera uyu mukinyi wo hagati w'umufaransa w'imyaka 28. (Telegraph - subscription required) Tottenham irashaka kugura umukinyi wo hagati muri rino ci, aho umwongereza Noni Madueke w'imyaka 21 akina muri PSV Eindhoven hamwe n'umunya Danemark akina ku ruhande Mikkel Damsgaard w'imyaka 21 akina muri Sampdoria, bari ku rutonde rw'abaronderwa. (Standard) Umusatirizi wa Barcelona, umunya Brésil Philippe Coutinho w'imyaka 28, ari mu bakinyi baronderwa na Tottenham mu gihe yoramuka igurishije umusatirizi wayo Harry Kane w'imyaka 28. (Mundo Deportivo - in Spanish) Lionel Messi yiteze gutera igikumu ku masezerano mashasha na Barcelona mu mpera z'iyi ndwi. Amasezerano yari afitaniye n'uwu murwi yarangiye mu kwezi guheze, ariko uyu musatirizi wa Argentina w'imyaka 34 asa n'uwemeye ayandi masezerano mashasha y'imyaka itanu, ariko umushakara wiwe ukagabanuka gushika ku bice 50%.  (Sky Sports) Leicester City yanse amafaranga atangwa na Arsenal ikongerako n'umukinyi mu rugamba rwo kurondera umwongereza akina hagati James Maddison w'imyaka 24. Aba Foxes bavugwa ko badashaka abakinyi batangwa n'abo ba Gunners mu kubaguranya n'uyu mukinyi.  (Football Insider) Urugamba rwa Chelsea rwo kurondera umukinyi w'inyuma wa Sevilla Jules Kounde rwakwamye kubera mugenziwe w'umufaransa Kurt Zouma w'imyaka 26 bari biteze kugurisha kugira ngo ahe ikibanza uyu mukinyi w'imyaka 22, yanse kwimukira muri West Ham. (Guardian) Newcastle ivuga ko yipfuza kwakira umwongereza akina hagati Oliver Skipp w'imyaka 20 avuye muri Tottenham nk'intizo.  (Mail) Sheffield United iriteze ko Liverpool ishobora kuyitiza umukinyi w'inyuma w'umwongereza Ben Davies w'imyaka 25, mu gihe atarigera akinira uyu murwi kuva aguzwe avuye muri Preston mu kwa mbere.  (Goal) Umukinyi wo ku ruhande wa Liverpool, umuswisi Xherdan Shaqiri w'imyaka 29 araronderwa n'umurwi wo muri Serie A,  Lazio, inyuma y'aho abwiriye abarongoye Anfield ko yipfuza gusezera uwo murwi wo muri Premier League. (Corriere dello Sport - in Italian) Umumenyereza wa Crystal Palace Patrick Vieira avuga ko yagiriraniye ""ikiganiro ciza"" n'umusatirizi wa Côte d'Ivoire Wilfried Zaha w'imyaka 28, kandi ko yizeye ko azobandanya akinira aba ba Eagles. (Sky Sports) Palace iriko irarondera ko Arsenal yoyitiza umusatirizi Reiss Nelson w'imyaka 21, kandi bikaboneka ko aba ba Gunners bashobora kumutanga kubera bigaragara ko ashobora gukinishwa gake cane mu mwaka w'inkino wimirije. (Sky Sports) Abaserukizi b'umukinyi wo hagati wa Atletico Madrid Saul Niguez bariko baragerageza kurondera ko yokwimukira muri Liverpool, ariko Anfield ntibona ko uyu mukinyi wa Espagne w'imyaka 26 yoba ashaka kwimukira muri uyu murwi.  (CaughtOffside) Southampton iri hafi yo kugura umusatirizi w'umwongereza Adam Armstrong w'imyaka 24 asanzwe akina muri Blackburn Rovers inyuma y'aho uwo murwi ugurishirije umusatirizi w'umwongereza Danny Ings w'imyaka 29 muri Aston Villa. (Football League World) Umukinyi wo hagati, umudagi Joshua Kimmich w'imyaka 26 yemeye amasezerano mashasha y'imyaka itanu n'umurwi  wiwe wa Bayern Munich watahukanye ihiganwa ry'Ubudagi Bundesliga.(Bild, via 90 Min)"	https://www.bbc.com/gahuza/imikino-58099449
politics	Burundi: CNDD-FDD yemejwe burundu ko yatsinze amatora yo ku wa 20/05/2020	Kuri uyu wa kane igenekerezo rya 04/06/2020, sentare ijejwe kwibahiriza ibwirizwashingiro mu Burundi ihejeje kwemeza ko umugambwe uri ku butegetsi mu Burundi CNDD-FDD ari wo watahukanye intsinzi mu matora yabaye ku wa 20 z'ukwezi kwa gatanu guheze. Iyo sentare yari ifise iminsi itarenga icenda kugira ngo yemeze ivyavuye muri ayo matora nk'uko yabishikirijwe n'umurwi ujejwe gutegura amatora muri ico gihugu. Iyo sentare yatangaje ko ibirego vyatanzwe n'umukuru w'umugambwe CNL utavuga rumwe n'ubutegetsi Agathon Rwasa ari nawe yari yawuserukiye mu matora y'umukuru w'igihugu bidafise ishingiro. Uyo mugambwe wariyamirije ibiharuro vyatangajwe na CENI ukaba waritwaye uvuga ko ivyo biharuro, kuva ku rwego rwa komine gushika ku rwego rw'igihugu, ari ivy'ubusuma, ukavuga ko ari wo watsinze amatora yose. Ibiheje gutangazwa n'iyo sentare rero bihejeje kwemeza icese ko Evariste Ndayishimiye, yitoje ku giti c'umukuru w'igihugu kw'izina rya CNDD-FDD ari we agiye kurongora igihugu mu myaka indwi iri imbere. Uyu mukuru w'igihugu ahejeje kwemezwa akaba agiye kurongora igihugu yisunze bwirizwashingiro rishasha ryemejwe mu 2018, ritandukanye n'iryo mu 2005 ryakomotse ku masezerano y'amahoro ya Arusha yo mu 2000, ryategekanya ikiringo c'imyaka itanu. Ku munsi wa mbere w'indwi iheze, umurwi CENI umaze gutangaza ibiharuro vy'imfatakibanza vyerekana ko uwo mugambwe uza ubwa kabiri, umushingamateka Agathon Rwasa yabwiye BBC ko mu gihe iyo sentare itotunganiriza umugambwe wiwe ko bazoca bitura sentare y'umuryango wa Afrika y'Ubuseruko. BBC yashatse kumubaza igihe azokwiturira iyo sentare ariko ntiyashoboye kumuronka.	https://www.bbc.com/gahuza/52928793
entertainment	Khadar Ahmed: Ingene uwabuze aho yiga gukora film ubu ariko aratahukana udushimwe no gukundwa na benshi	"Film 'The Gravedigger's Wife' (umugore w'umwimvyi w'imva), yatahanye agashimwe, wogira ngo yatunganijwe n'umuntu abifisemwo uburambe, ariko niyo film ya mbere ya Khadar Ahmed. Ingene igenda, umwanya imara n'ubwiza bwayo vyerekana ukwiyemera gufiswe n'uwo mugabo w'imyaka 40 atagira uburambe muri uwo mwuga. Yahunze n'umuryango wiwe  intambara yo muri Somalia amaherezo baruhukira muri Finlande afise imyaka 16 - kandi ntiyigeze ahonyoza ikirenge mw'ishure ryo kwiga gukora no gutunganya film (cinema). Yabwiye BBC ati: ""Imana yonyene niyo izi kangahe nasavye ishure ryo kwiga film ariko nkaba ntigeze ndarironka."" Ariko guteza imbere film ziri mu rurimi rw'igi-Somali yabigize ihangiro - kugira yerekane akaranga n'amamuko vyiwe abicishije muri film. Ku bwa Ahmed, kubona yatahanye agashimwe ka mbere mw'ihiganwa rya Afrika ry'ama film Fespaco mu kwezi guheze, vyerekana ko inkuru mu rurimi rwiwe zishobora  gukundwa n'ahandi. Bitandukanye na Bollywood The Gravedigger's Wife ni inkuru y'urukundo irimwo hamwe hamwe hababaje ariko mu buryo butwenza y'aho umuntu ashobora gushika kugira arokore ubuzima bw'uwo akunda. Uwo mwimvyi w'imva - Guled, akinwa na Omar Abdi - yicaye imbere y'ibitaro ari kumwe na bagenziwe,  afise igipawa, arindiriye ko hagira umurwayi apfa. Aho bibabarije, n'uko kugira  Nasra,  umugore wiwe arwaye, abandanye kubaho,  Ahmed ategerezwa kuronka  amafaranga, ayo nayo akaboneka ari uko hagize abapfa. Uwo mugore akinwa na Yasmin Warsame, ari ku mpfiro kubera amafyigo yiwe atagikora. Kubera amafaranga menshi akenewe kugira   abaganga bamwiteho abandanye kubaho, bisaba Guled gufata ingingo zikomeye cane. Iyo nkuru ata  bintu vyinshi vyo kuyiryohora birimwo, yakorewe amasanamu arimwo ibice vyinshi ata  majambo wumva n'ibirere vyagutse cane, ntaho ihuriye n'inkuru Ahmed yakuriyemwo. Yibutsa film za Bollywood ziba zirimwo umuziki, ugutamba n'ukurangira mu kanyamuneza.   Ahmed avuga ati: ""Ntaco nari nzi kuri izo film, nta film nari mfise kugira ndabireko mu gukora iyi. ""Gutyo rero nayikoze uko jewe nyene binjemwo n'uko ndabibona"". Mu vy'ukuri, ntaho yibuka yoba yarabonye film y'igi-Somali ikozwe hakurikijwe ubuhinga nyabwo bw'umwuga. Nyina wiwe yagumye  akorora amasozi  mu mwanya wose bamaze bariko bararaba The Gravedigger's Wife ubwa  mbere mw'ihiganwa rya sinema rya Cannes mu kwezi kw'indwi.  Ahmed avuga ati nyina ""yararengewe. Hari benshi batigeze baronka urweze n'amahirwe yo kwibona muri film. N'ivyo nashaka gushikako."" 'Kwumva wishimye' The Gravedigger's Wife ibera, kandi amasanamu yayo yafatiwe ku rubuga, muri Djibouti, bihana urubibe na Somalia, ariko ntirerekanwa muri ivyo bihugu. Avatar yongeye kuba film yinjiza cyane ku isi Abantu benshi b'aba-Somali, n'abandi bafise amamuko yo muri Somalia, barabonye iyo film mu kwezi kw'icenda mw'ihiganwa mpuzamakungu ry'ama film i Toronto muri Canada. Ahmed avuga ko ""bose bumvise bishimye. Vyari biryoshe kubaraba ingene baryohewe no kuyiraba hanyuma bagaca banzako"". Uwo atunganya ama fiml avuga ko inzira yaciyemwo mu gukora iyo film ishobora gutanga icitegererezo. Ntiyigeze aja mw'ishure ryigisha ivya film, nta n'aho yigeze aronka uwumwigisha ivyo gutunganya ama film, nta na film y'uwundi muntu yari bwigere akorako. Yatanguye urugendo rwiwe rwo gutunganya iyo film mu myaka 10 iheze igihe yandika integuro yayo. Yari afise ishaka ryo kuba ariwe ubwiwe yoyitunganiriza mu gi-Somali ku buryo yabanje kubika  iyo nteguro  kugira yige ingene bikorwa mu kurabira ku ma film yakunda. Amaze kuraba Bollywood, yaciye azunguruka amazu y'ama cinema kw'isi, harimwo muri Korea y'Epfo na Iran. Ariko izamutereye ivyiyumviro cane ni fim zakorewe muri Afrika. Arakunda cane cane igikorwa c'umunya-Mauritania Abderrahmane Sissako, yari umukuru w'umugwi w'abatanga udushimwe twa Fespaco uyu mwaka. Umunya-Chad  Mahamat-Saleh Haroun nawe ari mu bo Ahmed yafatiyeko, akaba yibuka ingene yatangariye ubwiza bwa film yiwe yo mu 2010, A Screaming Man. Amaze  kwiga izo film akagerageza kwuva ubuhinga bw'ingene zikorwa, yaciye atunganya film zibiri ngufi mu  hanyuma yandika mu ki-Finlande imbere y'uko akora  The Gravedigger's Wife. Ubu rero aribaza niba iyo aba yaragiye kw'ishure ryo kwiga ingene film zikorwa  hari ico kuba  vyahinduye mu nzira mbi canke nziza. ""Nshaka gutera intege abanya-Afrika bakiri bato bakora film, abadasanganywe amahirwe menshi, gufata camera hanyuma bakore film zabo, bandike inkuru zabo, bafate amasanamu yabo kandi bavyikorere bo nyene, kuko si bose baronka basanganywe ubushobozi bwinshi."" We nyene avuga ko afise ishaka ryo kubandanya akora ama film muri Afrika: ""Namuka muri Afrika kandi nemera ko kazoza k'ama film ari muri Afrika. Hari inkuru nyinshi zidashobora gukinirwa mu bihugu vya Buraya."""	https://www.bbc.com/gahuza/amakuru-59117220
entertainment	Amafoto yaranze Afrika : kuva itariki 23-29 z'ukwa kane 2021	Amafoto meza yaranze indwi yatororokanijwe ku mugabane wa Afrika n'ahandi.: Aya mafoto yose tuyafitiye uburenganzira bwo kuyakoresha	https://www.bbc.com/gahuza/amakuru-57009737
entertainment	Umwamikazi Elizabeth II na Africa: Ibihe bikomeye vy'ingoma yiwe	"Umwamikazi Elizabeth II yagendeye ibihugu birenga 20 vyo muri Afrika ku ngoma yiwe, igihe ingoma y'Ubwongereza yariko irarangira, ukwikukira nakwo kuriko kurashwara Afrika. Ubucuti budasanzwe bwarabandanije biciye mw'ishirahamwe rya Commonwealth, umwamikazi yari arongoye. Yari imigenderanire ikomeye - rimwe na rimwe igoye - imigenderanire iri hagati y'ingoma y'Ubwongereza  hamwe n'igihe c'ubukoloni. Umuganwakazi Elizabeth yavugiye ijambo imbere y'inzu ya reta i Cape Town, muri Afrika y'Epfo igihe yashikana imyaka 21, yiyemeza ko ubuzima bwiwe bwose azokorera ishirahamwe rya Commonwealth. ""Ahantu hose nagiye muri iki gihugu ciza ca Afrika y'Epfo.... abavyeyi banje, mwenewacu nanje nyene twarakunzwe cane n'abanyagihugu baco, gushika aho twiyumva nk'abantu bari muhira ngaha, nk'uko umenga twabanye na bo ubuzima bwabo bwose. Umuganwakazi Elizabeth agaragara ngaha mw'ihoteli Treetops muri Kenya ari kumwe n'umugabo wiwe, Duke wa Edinburgh. Mu nyuma akiri muri urwo rugendo, yumvise amakuru ko se wiwe, Umwami George VI yatanze kandi ko ategerezwa kuba umwamikazi. Uru ni rumwe mu ngendo zibiri umwamikazi Elizabeth yagize muri Nigeria. Yafashwe ifoto ngaha ari kumwe n'umutegetsi Oba Adenji-Adele II i Lagos. Yaragendeye kandi Calabar, Enugu, Jos, Kaduna, Kano na Port Harcourt. Umwamikazi Elizabeth ariko aratambana na Kwame Nkrumah, prezida wa mbere wa Ghana inyuma yo kwikukira, yaza n'imbere mu muhari w'abashaka kwikukira. Yatamvye umuziki wateguriwe urwo rugendo wiswe Welcome Your Majesty. Umwamikazi Elizabeth n'umuganwa Philip bafashwe ifoto bari kumwe n'igikomangoma Haile Selassie wa Ethiopia i Addis Abeba, mu rugendo rw'akazi. Ico gikomangoma carahungiye mu Bwongereza hagati ya 1936 na 1941 inyuma y'aho Ubutaliyano bwigaruriye igihugu ciwe aza kugaruka ku ngoma mu 1941 igihe Ubwongereza na Commonwealth batsinda Ubutaliyano. Umwamikazi Elizabeth na prezida El Tigani El-Mahi bariko barava ku kibuga c'indege ca Khartoum mu modoka. Urugendo rwiwe muri Sudani harimwo n'umuhingamo w'isiganwa ku ngamiya hamwe n'urugendo rwo kuraba ibikorwa vyo kwubaka urugomero rw'umuyagankuba rwa Roseires kuri Nil Bleu, rwarangiye mu mwaka ukurikira. Umwamikazi ari kumwe na prezida Julius Nyerere atanguye urugendo rw'akazi rw'imisi itatu. Imyaka 18 imbere y'aho, Dr Nyerere yari yashikanye Tanganyika yahoze ikoronijwe n'Ubwongereza ku ntahe yo kwikukira, aca aba uwa mbere akibereye umushikiranganji wa mbere hanyuma aba prezida w'ico gihugu wa mbere. Uko imyaka yagenda, yagiye yanka cane Ubwongereza n'Uburaya. Ariko, reta y'Ubwongereza yamubona nk'umuntu afise inguvu zo guhoyahoya mu karere karimwo ibihuhusi vyinshi. Prezida wa Zimbabwe yarahawe ikidari n'umwamikazi mu 1994. Ariko igihe imishamirano yongerekana hagati ya Zimbabwe na reta y'Ubwongereza ku mugambi w'isubirwamwo ry'itangwa ry'amatongo, Zimbabwe yarikuye muri Commonwealth mu 2003 - hanyuma Mugabe aca yakwa ico kidari mu 2008. Umwamikazi Elizabeth yafashwe ifoto ashitse ku kibuga c'indege ca Durban. Yari mu rugendo rw'akazi rw'imisi itandatu muri Afrika y'Epfo, hakaba habaye igihe c'imvura ciza mu myaka 10, aho yaciye atazirwa Motlalepula canke ""umwamikazi w'imvura"". Umwamikazi ari kumwe n'umukuru w'igihugu wa mbere wa Afrika y'Epfo w'umwirabure, Nelson Mandela, bivugwa ko bakundana cane. Umwamikazi yarandikiye amakete prezida Mandela aho yakoresha ""Umugenzi wawe  nyawe, Elizabeth R"" kandi bisa n'uko yamuhamagara ""Nelson"", mu gihe bivugwa ko na we yamuhamagara bisanzwe ""Elizabeth"" aciye ku ruhande amategeko agenga ubwami. Umwamikazi yaragendeye Nigeria ubugira kabiri mu 2003. Ico gihugu cari carahagaritswe muri Commonwealth kubera kutubahiriza agateka ka zina muntu ku butegetsi bwa gisirikare bwa Sani Abacha mu 1995, gisubira kwemererwa kugaruka mu 1999, hagarutse ubutegetsi bwa gisivile. Umwamikazi na prezida Obasanjo bagaragara ngaha mu birori vyo kwugurura inama y'abakuru b'ibihugu bihurikiye mw'ishirahamwe Commonwealth i Abuja. Mu rugendo rwa nyuma ku mugabane wa Afrika, uwo mwamikazi amaze umwanya muremure ku butegetsi yarahuye n'umwe mu baprezida bamaze imyaka myinshi ku butegetsi, Yoweri Museveni, na we ari ku butegetsi kuva mu 1986. Yari yarigeze kugendera Uganda imbere y'aho - mu rugendo rwa mbere rw'akazi muri Afrika nk'umwamikazi mu 1954."	https://www.bbc.com/gahuza/amakuru-62837788
