religion	France: Cardinali Ricard ari mu basenyeri 11 bagirizwa guhohotera abana	"Umu cardinali w’Umufaransa Jean Pierre Ricard yavuzwe izina na Ekleziya Katolika nk’umwe mu basenyeri 11 bagikorera canke bigeze gukorera iryo shengero bagirizwa guhohotera abana Mw'itangazo, uyo mu cardinali yanditse ko yahohoteye  umwana w'umukobwa w’imyaka 14 igihe yari akiri padiri kw'iparuwase haraheze  imyaka mirongo 35,  kandi ko ubu ashobora gukura meza mu mabanga yiwe. H﻿araciye umwaka, umugwi washinzwe utoye ivyemeza ko hari ibihumbi n'ibihumbi vy'abantu bashurashuza abana, bakorera mw'ishengero Katolika ry'Ubufaransa mu myaka irenga mirongo ibiri. Uko   bagirizwa ari 11 bose barashengejwe mu butungane canke bahabwa ibihano na Ekleziya Katolika. I﻿bi vyagiye ahabona mu gihe mu gihe hariko haraba inama y'abepisikopi b'Ubufaransa i Lourdes, mu bumanuko bushira uburengero bw'Ubufaransa. Musenyeri mukuru Eric de Moulins-Beaufort yabariye abamenyeshamakuru ko muri abo 11 harimwo Musenyeri wa Creteil Michel Santier yagiye mu karuhuko ko muzabukuru mu mwaka uheze inyuma yo kwagirizwa ihohotera rifatiye ku gitsina mu myaka  mirongo ibiri iheze. Bamwe bariko bakorwako amatohoza ajanye n'ihohotera rifatiye ku gitsina  mu gihe abandi bagirizwa kubinuma. Musenyeri mukuru yasomeye ku mugaragaro ikete rya Cardinali Ricard, aho yavuze ko yitwaye nabi ""mu buryo bukwiye guhanwa"" ku mwana w'umukobwa w’imyaka 14 kandi ko  mu vy’ukuri imyitwarire yiwe yagize ingaruka mbi kandi  zitazopfa zibagiwe kuri uwo mwana w'umukobwa. Mu gihe ubu ari mu karuhuko k'iza bukuru inyuma y'imyaka 18 ari musenyeri wa Bordeaux, uwo mu cardinali w'imyaka 78 yavuze ko yamusavye ikigongwe kandi asaba n'imbabazi ku bantu bose yababaje. M﻿usenyeri ahari ubu, Jean Paul James, yavuze ko yifatanije umubabaro n'abakorewe icaha, aca asubira gutera akamo uwo ari we wese yoba yarahohotewe muri iyo diyoseze kubivuga. Umukuru w'imana y'abepisikopi yavuze ko kiretse uwo mu Cardinali na Michel Santier, abasenyeri batandatu bagirijwe n'ubutungane canke ishengero kandi ko  umwe aza yaramaze gupfa. Yongeyeko ati:""A﻿bandi bahoze ari abasenyeri bariko baragirwako amatohoza n'ubutungane mu gihe uwundi wa gatatu amaze kwitaba abashikirizamanza."" Mu cegeranyo cayo co mu kwezi kwa 10 mu 2021 , akanama kigenga kashizweho na Ekleziya Katolika yo mu Bufaransa kasanze abana ibihumbi 216 barahohotewe kuva mu myaka ya 1950, benshi muri bo bakaba bari abana b’ababahungu bari gahati y’imyaka 10 na 13. Umukuru w'ako kanama yavuze ko hari ivyemezo ko hari abakoze ihoterwa bashika 3.200 kandi ko ivyo vyemezo vyarahawe  abashikirizamanza mu mice 22 aho ingingo zo gukurikiranwa kuri ivyo vyaha zishobora gufatwa. U﻿bufaransa ni kimwe mu bihugu aho ibivugwa ko habaye ihohoterwa rifatiye ku gitsina vyateye vyanyiganyije ishengero ya Ekleziya Katolika. Mu mwaka uheze, Papa Francis yarahinduye amategeko agenga ishengero Katolika kugira ihohoterwa rifatiye ku gitsina, kwiyegereza abana ugamije kubashurashuza, gutunga ama film y’abana bariko barahuza ibitsina hamwe no gukingiranira ikibaba ku caha c'ihohoterwa, ko ari icaha gihanwa n'amategeko ya Vatikano. Mu butumwa yatanze imbere y'uko hatangura iyo nama y'abepisikopi i Lourde, Papa yavuze ko ishengero ryo mu Bufaransa ryaguye mu gahundwe kubera ihohoterwa ryakozwe na bamwe mu bungere baryo. I﻿yo nama yari ifise intumbero yo guteza imbere uburyo bwo guhanahana amakuru no gukorera mu muco ku mabi y'ihohoterwa ishengero rifisemwo uruhara."	https://www.bbc.com/gahuza/articles/cp9revjnwpno
entertainment	Astro azwi mu ndirimbo nka Kingston Town, Red Red Wine ari muri UB40 yashengeye	"Umunyamuziki w'umwongereza akongera akaba n'umwe mu batanguje umurwi UB40 Terence Wilson, azwi cane kw'izina rya Astro, yapfuye ku myaka 64. Astro umuririmvyi yaririmbanye n'uyu murwi wo mu mudiho wa reggae mu kiringo c'imyaka irenga 30 yahitanywe n'indwara y'igihe gito, nk'uko vyemezwa n'umurwi yari asanzwe aririmbamwo. Itangazo ryacishijwe ku rubuga n'umurwi Ali Campbell and Astro rivuga riti:  ""Turababaye cane. Isi yose irabuze intwari"". Astro yasezeye mu murwi UB40 mu 2013 akaba yagiye kubandanya n'umurwi wiyonkoye UB40 featuring Ali Campbell and Astro, ukaba wari umaze kuremesha ibiteramo bitari bike muri uno mwaka. Wari witeze kuzunguruka ugenda uremesha ibiteramo mu mwaka uza wa 2022. Umurwi wiwe wa mbere watangujwe mu ntango z'imyaka ya 1980 n'umudiho wa reggae wisangije kamere, ukaba waramenyekanye cane mu miziki itari mike harimwo nka Red Red Wine na Can't Help Falling In Love. Uyu murwi wa Birmingham wagurishije ama casettes arenga imiriyoni 70 kandi imiziki yawo iraba iya mbere mu Bwongereza ku ncuro zitatu zose. Itangazo ry'abagize umurwi UB40 wa kino gihe wanditse kuri twitter uti: ""Wiruhukire mu mahoro Astro. ""Muri iri joro twumvise inkuru y'umubabaro ko uwahoze mu murwi UB40, Terence Wilson, azwi kw'izina rya  Astro, yasandavye inyuma y'indwaya y'igihe gito. Turahojeje umuryango wiwe"". Muri rusangi, UB40 yasohoye indirimbo 39 muri 40 za mbere mu Bwongereza, yongera isohora album 28 muri 40 za mbere mu gihugu, na Astro akaba ari we yari umuririmvyi mukuru mu ndirimbo Rat In Mi Kitchen yabaye iya 12 mu 1987. Uyu murwi kandi waramenyekanye cane kw'isi yose, harimwo no muri Amerika, aho indirimbo Red Red Wine yabaye iya mbere, nk'uko vyagenze no ku yindi yitwa, Can't Help Falling in Love with You, yamaze amayinga indwi yose ari yo yiganje mu 1993. Aba mbere mu bagize uyu murwi baramaze imyaka 30 yose baririmbira hamwe imbere y'uko Ali Campbell  awusezera mu 2008. Mu kiganiro Astro yagiranye na The Guardian mu kwa gatanu, yavuze ko uyu murwi umaze gushingwa mu 1978 wahindutse ijwi ry'abanyagihugu batishimiye ibijanye na poritike hamwe n'ibibazo bihanze isi. Yabwiye iki kinyamakuru ko nawe yabonye ""amabwa nk'ayo abandi birabure bose bahuye nayo mu mpera z'imyaka ya 1970"", aha akaba yashaka kuvuga itegeko ryaha uburenganzira igipolisi guhagarika no gusaka abantu bafatwa ko bateye amakenga - ivyo Astro avuga ko vyama biba buri ndwi. Ati: ""Twabonye vyari bigoye kwandika indirimbo z'urukundo gusumba indirimbo z'abarwanira agateka kabo, kubera vyari vyoroshe cane kwandika ku bintu wewe nyene wiboneye canke wasomye ahantu. Yari kamere yacu"". Mu 2016, uyu munyamuziki yabwiye urubuga ngurukanabumenyi rw'Ubwongereza UK Music Reviews ko iri ritazirano yarironse akiri umwana kubera yambara ibirato vya Dr Martens vyari bizwi nka ""Astronaut"". Yongeyeko ati: ""Ku gihamana ciza, nta muntu yigeze anyita astronaut kuko ari ijambo rirerire, ari naco gituma baciye barigabanya bafata Astro, kandi kuva ubwo ryaciye ringumako"". Abajijwe ingene yiyumva iyo ariko arazunguruka aremesha ibiteramo, Astro yavuze ati: ""Nta kazi kuri iyi si koguha umunezero nk'uwo ndonka. Jewe ndiho kugira ngo ndirime"". Mu kw'umunani, uwundi mugenzi bakoranye muri UB40 batangranye uyu murwi Brian Travers yarapfuye ahitanywe na kanseri ku myaka 62."	https://www.bbc.com/gahuza/amakuru-59195926
entertainment	Abantu bakomakomeye Africa yabuze mu mwaka urangiye: abaperezida, abahoze ari abaperezira n'abandi	"Mu gihe umwaka waraye urangiye uwundi nawo ukaba utanguye, turabire hamwe bamwe mu bantu bakomeye bapfuye kuri uno mugabane wa Afrika. Turabe cumi muri aba bantu tutakiri kumwe. Mamma Sarah, nk'uko bamutazira, yagiye kumenyekana cane kw'isi igihe umwuzukuru wiwe Barack Obama abaye umukuru w'igihugu wa Reta Zunze Ubumwe za Amerika mu 2009, ariko imbere y'aho, yari azwi cane mu karere yamukamwo mu burengero bwa Kenya aho yari yarongowe n'umugabo yari akuze cane nawe akiri umuyabaga - nk'uko imico n'imigenzo yabitegeka. Mu myaka mirongo, yari arongoye ikigo co gufasha kwigisha impfuvyi n'abakobwa, ikintu yiyumvamwo cane kubera we nyene ubwiwe atari azi gusoma. Mu 2014, ONU yaramuhaye agashimwe ku gikorwa ciwe. Barack Obama  yavuze ko kwitangira indero vyatanguriye ku bana biwe, ati: ""N'ubwo atari nyina wiwe w'amaraso, Nyokuru yarareze dawe nk'umwana wiwe, kandi urukundo rwiwe ruri mu vyatumye dawe ashobora guhangana n'ingorane aritwara neza mw'ishure gushika aho aronka uburenganzira bwo kuja kwiga kw'ishure kaminuza ryo muri Amerika"". Barack Obama yavuze ko mu buzima bwiwe, Sarah Obama yagiye abona impinduka zitari nke uko ibihe vyagenda ""ariko ubutwari bwiwe  - kugira umutima rugabo, yiyemera, akunda ibikorwa, adatwarwa n'ibihuhusi hamwe n'ubugwaneza vyiwe - ntibwigeze buhungabana"". Sarah Obama yapfuye ku wa  29 z'ukwa gatatu 2021 Urupfu rw'uyu yari umukuru w'igihugu ca Tanzania rwatangajwe mu kwa gatatu inyuma y'indwi zirenga zibiri zari ziheze ataboneka. Reta yatangaje ko yahitanywe n'indwara y'umutima, ariko rero abakeba biwe bamwe bamwe ba poritike bavuze ko yari yanduye Covid-19. John Magufuli, uwakuriye mu muryango w'abarimyi, yagiye kuba umukuru w'igihugu mu 2015 akaba yari mu bategetsi bari bubashwe muri Afrika. Kw'izina ry'iritazirano nka Tingatinga (The Bulldozer), abamurwanya bamwagiriza ko yari umutegetsi yatwaza umukazo yarwanije ibinyamakuru, agatera ubwoba abatavuga rumwe nawe, yongera atuma abantu benshi bahitanwa na ca kiza ca coronavirus kubera yafashe minenerwe imigambi yo kukirwanya. Muri iki gisata, twatakaje kandi : Umukuru w'igihugu wa Tchad Idriss Déby, yiciwe ku rugamba, hamwe n'umushikiranganji wa mbere wa Côte d'Ivoire Hamed Bakayoko, yahitanywe na kanseri. Abahoze ari abakuru b'ibihugu vya Algeria - Abdelaziz Bouteflika, Madagascar - Didier Ratsiraka, Somalia - Ali Mahdi Mohamed na Chad - Hissène Habré, nabo nyene barapfuye. Icegera c'umukuru w'izinga rya Zanzibar Seif Sharif Hamad, umushikiranganji w'imigenderanire wa Zimbabwe Sibusiso Moyo hamwe n'umushikiranganji yari ajejwe gutwara abantu n'ibintu Joel Biggie Matiza nabo bose barapfuye bahitanywe na  Covid-19. UMUNYAMUZIKI Alemayehu Eshete, 80 Uyu azwi nka Elvsi wa Ethiopia, Alemayehu yabaye rurangiranwa muri Ethiopia mu muziki wo mu mudiho wa jazz kuva mu myaka ya 1960 akaba yabandanije aryohera abantu gushika umwaka wanyuma w'ubuzima bwiwe. Kuva akiri muto, yari azwi cane mu gusubiramwo indirimbo za Elvis Presley, ariko mu 2008 yabwiye ikinyamakuru Guardian ko James Brown ari we yahavuye aba icitegererezo kuri we. Ati: ""Nambara nk'umunyamerika, ndatereka imishatsi yanje, nkama ndirimba Jailhouse Rock na Teddy Bear - rimwe na rimwe twararirimba Strangers in the Night. Ariko kuva igihe ntanguriye kuririmba indirimbo z'iki amharic, abantu barankunze bimwe bidasanzwe"". Alemayehu Eshete yapfuye ku wa 02 z'ukw'icenda, abanya Ethiopia bakimukunda cane. Muri iki gisata c'abanyatugenegene, twaratakaje kandi : umunyamuziki wa Afrika y'Epfo Sibongile Khumalo, yaririmvye kuva ku midiho ya jazz gushika ku midiho kama; umucuraranzi w'itarumbeta wa Afrika y'Epfo Jonas Gwangwa;  umuririmvyi w'indirimbo zihayagiza Imana n'umudiho wa jazz  Wambali Mkandawire; umwe mu banyamuziki ba Senegal bakomeye cane Thione Seck; umunyamuziki wa Cameroun  Wes Madiko; umunyamuziki w'umunyarwanda wo mu mudiho wa rap Jay Polly, yari yapfunzwe yagirizwa gutunga ibiyayuramutwe; umunya Namibia yaririmba mu mudiho wa hip-hop Kanibal hamwe n'umwe mu baririmvyi ba Algeria  bakunzwe cane Rabah Deriassa UMUHINGA mu kuremura ibihimba vy'umubiri Matolase Mtonga, 34 Nk'umwe mu bahinga ba Zambia mu vyo kubaga mu kuremura ibihimba vy'umubiri vyonionekaye  (chirurgie plastique/plastix surgery),  Mtonga yagiye kubona umuhamagaro wiwe igihe yariko aravura abarwayi bahiye, ico gihe akaba yari umunyeshure yiga ivy'ubuganga. Ishirahamwe ReSurge ryanditse riti: ""Ni ukuri yari icitegererezo c'umugore w'akarorero, kandi yari mu nzira yo kuba umugore wa mbere muri Zambia yose w'umuhinga mu bijanye no kuremura ibihimb vy'umubiri vyononekaye. Uru ni uruhombo rukomeye cane, atari gusa kuri twebwe twari tumuzi, ariko kandi no kuri kazoza muri iki gisata, haba mu gihugu ciwe eka mbere no kw'isi yose"". Mtonga yapfuye mu kwa cumi na kabiri haciye igihe gito avuye mu nama ya chirurgie plastique yari yabereye muri Amerika. Rwabaye urupfu rubabaje cane. Ubutumwa bwacishijwe kuri Facebook ni ubwo umugabo umwe yavuriye umugore wiwe mu myaka mike iheze, aho yanditse ati: ""Dr Mtonga yageze kure akoresha amafaranga yiwe kugira agure ivyari bikenewe kugira ngo ashobore kuvuga umugore wanje, aho hose yashaka ko umugore wanje akira ukuboko kwiwe kw'iburyo n'intoke"". Twatakaje kandi: Umwigisha wa kaminmuza wa Nigeria akongera akaba n'umuhinga mu bijanye n'imigera David Olufemi Olaleye hamwe na John Baptist Mukasa, umwe mu bahinga bake ba Uganda mu bijanye n'ukubaga imitsi, yari yiyemeje kwigisha abandi baganga ku nyungu za kazoza. Uyu munya Afrika y'Epfo yahanganye n'ubutegetsi bw'ivanguramoko bwa apartheid muri Afrika y'Epfo, yinjiye mw'ishengero rya Anglican  aratera imbere gushika aho aba umwirabure wa mbere abaye Musenyeri mukuru  wa Cape Town mu 1986  - haciye imyaka ibiri ahawe ka gashimwe k'amahoro kitiriwe Nobel ku ruhara rwiwe mu kurwanya intwaro y'inkehwa z'abazungu. Kw'izina ry'iritazinaro rya The Arch, yahavuye agenwa kurongora umurwi wo kumenya ukuri n'ukurekuriranira inyuma y'aho Nelson Mandela atsindiye amatora ya mbere y'inyuma ya apartheid mu 1994. Nk'umuntu yafatwa nk'umuhanuzi muri Afrika y'Epfo, Tutu ntiyatinya kunegura bikomeye ubutegetsi bw'inyuma ya apartheid muri ico gihugu yataziriye The Rainbow Nation.  Tutu yapfuye mu kwezi guheze kwa cumi na kabiri, iyi ndwi yose ikaba iheze bariko baramwunamira, bikaba bitegekanijwe ko ashingurwa kuri uyu wa gatandatu. Twatagkaje kandi : FW de Klerk, umukuru w'igihugu wa nyuma w'ubutegetsi bwa apartheid muri Afrika y'Epfo, yasangiye agashimwe ka Nobel na Mandela mu 1993 kubera yafashije mu biganiro vyarangije ubutegetsi bwa apartheid. TB Joshua yapfuye ku wa 05 z'ukwa gatandatu. Ubutumwa bwacishijwe ku rubuga  rwa Facebook rw'uyu muvugabutumwa wa Nigeria  bwavuga buti: ""Imana yisubije Umukozi wayo"". Bwatumye imiriyoni n'imiriyoni y'abanywanyi b'ihsengero ryiwe kw'isi yose Synagogue Church of All Nation baja mu kigandaro. Uyu muvugabutumwa yari asanzwe afise abanyaporitike bo hejuru mu banywanyi biwe, yagiye kuba rurangiranwa kubera ""ibitangaro"" vyiwe, mbere akaba yatangaje ko yari afise ububasha bwo gukiza indwara z'ubwoko bwose, harimwo n'umugera wa SIDA. Muri iki gisatan yene twaratakaj: Umukardinali wa Cameroun Cardinal Christian Tumi, aho urupfu rwiwe rwashize hamwe mu mubabaro iki gihugu kirangwamwo indyane,  Alexandre José Maria dos Santos, umupatiri wa mbere w'umwirabure wa Mozambike yagiye kuba mu nyuma umu kardinali wa mbere w'ico gihugu, umutegetsi wo mw'idini rya Islam muri Tunisia  Hichem Djait hamwe n'umusenyeri mukuru wa Katorika muri Sudani y'Epfo Paulino Lukudu Loro. Abanonotsi ba Kenya baracitse intege bamaze kwumva ko mugenzi wabo yaciye umuhigo kw'isi yacumiswe imbugita gushika yitabe Imana mu kw'icumi. Umugabo wiwe, Ibrahim Rotich, avuga y'uko ata ruhara afise muri ubu bwicanyi. Tirop yaboneka ko yari agiye kuba umwirutsi rurangiranwa inyuma yo guca umuhigo ku birometero 10 ku ruhande rw'abagore mu kw'icenda, mbere akaba yaraserutse mu nkino za Olempike i Tokyo. Twatakaje kandi: Umunyonzi w'ikinga wa Eritrea Desiet Kidane, yapfuye agonzwe n'imodoka igihe yari mu myimenyerezo, umunya Senegal yahoze arongoye ishirahamwe ry'abanonotsi kw'isi (IAAF) Lamine Diack, umukinyi w'umupira w'amaguru wa Afrika y'Epfo Ryder Mofokeng yabaye kizigenza w'umurwi Kaizer Chiefs mu kiringo c'imyaka 11, hamwe n'umukinyi w'umupira w'amaguru wo muri Nigeria Yisa Sofoluwe, yari azwi mu murwi nserukiragihugu nka ""Defence Minister"" (umushikiranganji w'ukwivuna abansi). Uyu mwami w'Abazulu muri Afrika y'Epfo, yari umuntu akomeye cane yaharanira akaranga n'imico kama mu myaka 50 yose yari amaze ku butegetsi. Yari uwo mu muryango w'Umwami Cetshwayo, yayoboye Abazulu muri ya ntambara yabahuza n'igisirikare c'Ubwongereza mu 1879. N'aho uyu mugabo, se w'abana 28 yavyaye ku bagore batandatu, ata butegetsi bwa poritike bwite yari afise, yaserukira abafise ivyiyumviro vy'uko Afrika y'Epfo itiyigeze yibagira akahise kayo, n'aho yahindutse ikaba igihugu ca none. Umwe mu bagore biwe, umwamikazi Queen Mantfombi Dlamini-Zulu, yaramusubiriye mu kwa gatatu, ariko yaciye apfa haciye ukwezi kumwe gusa. Twatakaje kandi: Sulutani Sultan El-Hadj Ibrahim Mbombo Njoya w'umunya Cameroun, umwami w'abanyagihugu bo mu bwoko bw'aba Pedi muri Afrika y'Epfo, Victor Thulare III na Kefa Sagbadjou Glele, umwami w'aba Abomey muri Benin. Uyu mukinyi w'amareresi wo mu Misiri yamaze imyaka 50 akina amareresi. Yarakinye amareresi ateye ubwoba ariko kumbure yari azwi cane kandi akundirwa ubuhinga bwiwe bwo gutwenza. Kuri bamwe, izina rya El-Bably ryibutsa imyaka ya 1950 na 1960 igihe sinema yabica bigacika. Mu nyuma yahavuye amenyekana cane kuri televiziyo akina udukino mu mareresi yakunzwe cane mu buzima bwa buri muryango igihe cose ca Ramadani. Soheir El-Bably yapfuye k uwa 21 z'ukwa cumi na rimwe. Twatakaje kandi : Umunyarwenya w'umusomalia Ibrahim Ismail, azwi cane ku ritazirano rya  Soran, hamwe na Abdi Muridi Dhere uwundi munyarwenya w'umunyasomalia nyene. Uwundi umwe mu banyarwenya ba Nigeria rurangiranwa Baba Suwe na we nyene yarapfuye. Uyu yarwaniye ukwikukira kwa Zambia yapfuye mu kwa gatandatu, yari umwe mu bategetsi ba nyuma ba Afrika barwanije intwaro za gikoloni. Yavuga ko icipfuzo ciwe ari ukubona buri munya Zambia afise igi ku meza mu mfungurwa ziwe zo mu gitondo, agacupa k'amata - kandi buri munya Zambia akambara ibirato. Kw'izina ry'iritazirano rya KK, yarakunda kuvuza igitari, akaba yari umwigisha imbere y'uko yinjira mu rugamba rwo kurwanira ukwikukira, mbere akaba yari mu bantu bari bafashe mu mugongo utwigoro two kurandurana n'imizi ubutegetsi bwa apartheid muri Afrika y'Epfo, yongera afata mu mugongo imihari yo kwibohora muri Mozambike no muri Zimbabwe."	https://www.bbc.com/gahuza/amakuru-59829167
politics	Igisirikare ca Myanmar cagirije Suu Kyi kwakira $600.000 n'inzahabu	"Abategetsi ba gisirikare muri Myanmar bagirije uwo batembagaje Aung San Suu Kyi kuba yarakiriye mu buryo bunyruranye n'amategeko ibihumbi 600 vy'ama dorari hamwe n'inzahabu. Nivyo bintu bikomeye cane yagirijwe n'abasirikare kuva batembagaje uwo mugore n'uburungozi bwa demokrasi itariki ya mbere ukwezi kwa kabiri. Brigadier general Zaw Min Tun yanagirije ibiturire prezida Win Myint na benshi mu bashikiranganji. Umugambwe wa Madame Suu Kyi, National League for Democracy, batsinze ku bwinshi amatora yabaye mu mwaka uheze, ariko igisirikare kivuga ko amatora yabayemwo ubusuma. Abigenga mpuzamakungu bakurikiranye ayo amatora ntibemera ibivugwa n'ico gusirikare, bavuga ko ata mahinyu babonye muri ayo matora. Madame Suu Kyi haheze indwi zitany apfungiwe mu kibanza kitamenyeshwa akaba yagirizwa ivyaha vyinshi birimwo gutera ''ubwoba no gutera umutima uhagaze"", gutunga ama radio mu buryo buteye kubiri n'amategeko, no kurenga ingingo zijanye na Covid. Ico kirego co kwakira amafaranga aciye mu nzira zitemewe n'amategeko cashikirijwe ku wa kane nico gihambaye cane gushika ubu. Agaciro k'izo nzahabu igisirikare kivuga ko yahawe mu buryo bunyuranye n'amategeko zifise agaciro koba gashika mu bihumbi 600 vy'ama dolari. Myanmar cyugarijwe n'imyiyerekano mu mabarabara kuva igisirikare gifashe ubutegetsi kikanapfunga Suu Kyi. Ivyo bikaba vyatumye amenyekana gusumba. Abandi bantu nibura indwi bishwe n'inzego zijejwe umutekano kuri uyu wa kane , abamaze kwicwa bakaba baciye bashika ku 60. Ababibonye bavuga ko hari abari mu myiyerekano barashwe mu mutwe. ONU, Amerika n'ibindi bihugu vyinshi bariyamirije ubwo bwicanyi bw'abanyagihugu basanzwe muri uko guhasha abitaba imyiyerekano yo kwiyamiriza itembagazwa ry'ubutegetsi, basaba abategetsi kwigumya. Igisirikare nticemera ivyo kinegurwa, ahubwo cegeka kuri madame Suu Kyi  intureka iriko iraba."	https://www.bbc.com/gahuza/amakuru-56362816
sports	Igikombe ca Afrika Misiri 2019 - Imigwi, inkino n'uko batsindana	Uru ni urutonde rw'imigwi y'amakipe ari mu gikombe ca Afrika Misiri 2019, ugashobora kubona amakipe aza guhura, uko batsindanye hamwe n'ukuntu bahagaze mu manota. Ushobora gukurikirana ngaha umunsi ku munsi ukuntu izi nkino ziriko ziragenda	https://www.bbc.com/gahuza/imikino-48638099
health	Amahasa yavutse afatanye imitwe yatandukanijwe vy'imbonekarimwe muri Israel	"Ayo mahasa (impanga)  y'abakobwa bari bavutse bafatanye ku gakomokomo babonanye ubwa mbere inyuma yo gutandukanywa mu gikorwa co kubagwa  muri Israel. Ico gikorwa camaze amasaha 12 mu kigo c'ubuvuzi  ca Soroka mu gisagara ca Beersheba camaze amezi gitegurwa, kandi harimwo no gushira icomeke ku mitwe yabo bompi. Abahinga mirongo bo muri Israel n'ahandi babigizemwo uruhara. Abo bakobwa, batavuzwe amazina, bivugwa ko bariko barakira neza. Eldad Silberstein, umuvugizi w'igisata co kubaga  aho mu kigo ca  Soroka yabwiye ikinyamakuru Channel 12 co muri Israel ko ""Bahema kandi barya bo nyene ubwabo"". Ni ubwa mbere bene ico gikorwa, kimaze kuba incuro 20 gusa kw'isi yose, kibera muri Israel. Impanga zifatanye ziri 'kugira inshuti ku ishuri' Papa yabatije impanga zari zifatanye bakazitandukanya Bashobora kuzobaho batandukanye? Amezi imbere y'uko babagwa,  mu mitwe yabo hashizwemwo udufuko twa silicone twongerezwamwo impwemu (nk'igipurizo) hanyuma tukaja turagurwa kugira dukwege canke tugarure urukoba. Urwo rukoba nirwo rwakoreshejwe mu kwugara imitwe yabo imaze gutandukanywa. Umwiteguro wagiyemwo kandi kubanza gukora igicapo ca 3D c'ikigirerenayo c'ayo mahasa, nk'uko bivugwa na Mickey Gideon, umuhinga wo kubaga ibijanye n'udutsi nsozabwenge (neuro-chirurgien). Yavuze ati : ""Twanezerewe n'uko ibintu vyose vyagenze uko twari twavyifuje"". Abo bakobwa bari bavutse mu kwezi kw'umunani mu 2020, bitezwe kuzobaho ubuzima busanzwe ata ngorane n'imwe."	https://www.bbc.com/gahuza/amakuru-58463957
religion	Coronavirus: Papa asaba ko urucanco n'imiti bishikira bose kw'isi	"Papa Francis yateye akamo abategetsi bo kw'isi ngo bafashe kugira abantu bose bashobore kuronka urucanco rwa coronavirus ata nzitizi. Mw'ijambo rya Noheli yashikirije ku rubuga rwa internet ubwa mbere, Papa yagabishije kudashiraho ""uruhome"" kubakeneye imiti. Ico kiza catumye ubutumwa bwa Urbi na Orbi budatangirwa ku rubaraza rwa Bazelike St Pierre ku bantu benshi, nk'uko vyari bimenyerewe. Ahubwo Papa yatanze ubwo butumwa ari mu cumba i Vatikano. Uko kugabisha kwa papa kuje inyuma y'amakenga y'ingene ibihugu bitunze  bigura incanco zitagira uko zingana gusumba ibihugu bikenye. Yavuze ati:""Ese umwana w'Imana yogarukana mu bategetsi ba politike n'amareta agatima ko gufashanya n'amakungu, bahereye ku magara y'abantu, kugira ngo bose boshobore gushikirwa n'urucanco hamwe n'imiti. ""Imbere y'iki kibazo kitagira imbibe, ntidushobora kwiyubakirako uruhome. Twese hamwe turi mu bwato bumwe."" Papa yavuze ko ingaruka y'iki kibazo c'amagara y'abantu zerekanye ko ubumwe bw'amakungu bukomeye cane. ""Muri iki gihe c'akahise, tugeramiwe n'ibibazo vy'ibidukikije hamwe n'ubusumbasumbane mu butunzi no mu mibano vyagiye kunyurwa n'ikiza coronavirus, birakenewe cane ko twemerana nka benewacu na bashiki bacu."" Papa yateye akamo ngo habe umutima wo gufasha no gushigikira abakozweko n'ico kiza, adoma urutoke cane cane ku bapfasoni bahohotewe muri iki gihe abantu bugaranywe. Avuga ku zindi ngorane ziri kw'isi, yahamagariye abantu gukomeza ubumwe no gusubiza hamwe muri Syria, Yemen, Libya, Nagorno-Karabakh, Sudan y'epfo , Nigeria, Cameroun na Irak. Vyitezwe ko azogira urugendo muri Irak mu kwezi kwa gatatu, urugendo rushobora kuba rubaye urwa mbere rwa Papa mu gihugu cazahajwe n'intambara."	https://www.bbc.com/gahuza/amakuru-55447366
