religion	Tanzania: Perezida Magufuli yirukanye umukozi wa leta yatabuye Ikorowani	"Perezida John  Magufuli wa Tanzania amenyesha ko yirukanye burundu mu kazi umukozi wa leta yatabuye igitabo ceranda c'Ikorowani, maze akwiragiza isanamu ku mbuga hwaniro ariko arayitabura. Yatangaje iyo ngingo uno munsi mu gihe yari mu birori vyo kwugurura ibiro vy'akarere ka Kigamboni mu gisagara ca Dar es Salaam. Ati: ""Nyakwubahwa Jafo, hirya y'ejo niho numva, ko hari umuntu hariya i Kilosa yatabuye igitabo ceranda"". ""Ndagushimiye cane kubona warafashe ingingo yo kuba uramuhagarika, ariko jeho ndamwirukanye burundu. Mwandikire ikete ko yirukanywe burundu"". ""Atsinda urubanza canke atsindwa, uyo ntakiri umukozi wa leta, ntidushobora kubandanya dukorana n'abakozi b'ibijuju nk'abo muri ino leta"". Mu ndwi iheze, umushikiranganji ajejwe ubutegetsi bw'intara n'amakomine, Selemani Jafo, yategetse ko umukozi w'ibiro vy'akarere ka Kilosa mu ntara ya Morogoro, Daniel Elimringi, ahagarikwa, ku caha co gutabura igitabu c'idini rya Isilamu, Ikorowani. Jafo ati: ""Ni ukuri, iki kintu cakozwe n'umukozi nk'uyu nta ciza kizanira igihugu cacu kubera abanyagihugu bacu mu madini yose basanzwe babanye mu mahoro kandi bubahana mu butandukane"". Iyo ngingo ya Jafo yafashwe inyuma y'aho isanamu yerekana uyo mukozi wa leta mu gisata c'ubudandaji mu biro vy'akarere ka Kilosa ariko aratabagura ico gitabo, ikwiragijwe ku mbuga hwaniro zitandukanye. Ikinyamakuru Mtanzania co muri ico gihugu kimenyesha ko uyo mukozi yamaze kurengutswa muri sentare, kandi ko yankiwe kuburana yidegemvya. Ico kinyamakuru gitangaza ko urwo rubanza ruzosubira kwumvirizwa ku wa 20 z'uku kwa kabiri."	https://www.bbc.com/gahuza/amakuru-51464340
politics	Ukraine: Kyiv iriyamiriza ivyo yagirizwa na Russia ko igomba gutera ‘ibombe y’umwanda’	"Ukraine iriyamiriza ibivugwa n’Uburusiya ko Kyiv (umugwa mukuru wa Ukraine) ishobora gukoresha “ibombe y’umwanda”  - ibibombe bisanzwe bivangwa n’ubumara (matières radioactives). Perezida Volodymyr Zelensky avuga ko ibi vyerekana ko Uburusiya bwonyene bushobora kuba buriko butegura gukora igitero nk’iki. Incuti za Ukraine nazo nyene ziriyamiriza ibi bivugwa n’Uburusiya, mbere Amerika ikiyamiriza “icitwazo ico ari co cose cotuma ibintu biyangara”. Umushikiranganji wo kwivuna abansi w’Uburusiya Sergei Shoigu yavuze ivy’amabombe y’umwanda mu gihe yavugana na mugenziwe w’Ubwongereza Ben Wallace kuri terefone. Yavuze ko afise “amakenga ku gishobora kuba agasotoro ka Kyiv karimwo ikoreshwa ry’ibombe y’umwanda”. Ku wa Mungu, Shoigu yagiranye kandi ibiganiro n’abashikiranganji bo kwivuna abansi ba Amerika, Ubufaransa na Turukiya, abashikiriza impungenge za Moscou. Nta vyemezo yatanze bishigikira ivyo yagiriza Ukraine. Mu kwishura kuri ibi, Perezida Zelensky yagiriza Uburusiya ko ari bwo “ntandaro y’ibintu vyose vy’umwanda bishobora kuba muri ino ntambara”. Avuga ko Uburusiya buriko butera ubwoba isi bukoresheje “akaga k’inguvu z’ubumara” ku kigo ca nikleyeri ca Zaporizhzhia bwigaruriye. Anavuga kw’iterabwoba rya Moscou ryo kumena urugomero rukomeye rwo mu bumanuko bwa Ukraine. Kremlin (ibiro vy’umukuru w’igihugu c’Uburusiya) iriyamiriza ibi birego. Umukuru wa Ukraine kandi arashimangira ko “amakungu yofata ingingo zose zikomeye zishoboka”. Hagati aho, Wallace avuga ko yamiriye kure ibivugwa na Shoigu ko ""Ukraine iriko itegura imigambi ifashwe mu mugongo n’ibihugu vy’Uburengero, harimwo n’Ubwongereza, yo gutuma ibintu biyangara muri Ukraine”. Yagabishije kandi ko ibirego nk’ibi ""bitoba icitwazo co gukora ikintu cotuma ibintu vyunyuka”. Amajambo nk’ayo kandi niyo yavuzwe n’umunyamabanga wa Amerika ajejwe kwivuna abansi, Lloyd Austin, igihe yavugana na Shoigu ejo ku wa Mungu, mu kiganiro kigira kabiri nawe kuri terefone mu misi mike cane. Mw’itangazo rusangi, abashikiranganji bajejwe imigenderanire b’ibihugu vy’Ubufaransa, Ubwongereza na Amerika bavuze ko ibihugu vyabo “vyiyamirije amajambo y’ikinyoma ceruye ko Ukraine iriko itegura gukoresha ibombe y’umwanda ku butaka bwayo”, banavuga ko bazobandanya bafata mu mugongo Ukraine ""muri ino ntambara y’ubugome ya Perezida Putin"". Abihweza ibintu n’ibindi mu gisirikare bavuga ko ivyo Uburusiya bwagiriza Ukraine bije inyuma y’aho bugize imisi butsindwa ahatari hake, be no mu gihe ingabo za Ukraine zibandanya ibitero vyo kwivuna mu buseruko no mu bumanuko bw’igihugu. Mu rukurikirane rw’ubutumwa cacishije ku rubuga rwa Twitter, ikigo ca Amerika cigisha ivy’intambara, Institute for the Study of War (ISW), kivuga ko Shoigu ""asa n’uwariko arondera guhagarika canke kugabanya umurindi w’imfashanyo za gisirikare Uburengero buha Ukraine, hamwe kandi kumbure no kurondera ingene aca intege urunani rwa OTAN/NATO  mu kurutera ubwoba”. Hagati aho, ISW yongerako iti: ""Kremlin ntavyo irimwo vyo gutegura igitero ca vuba ca bombe y’umwanda. Ibivugwa na Shoigu bije gukomeza isekeza ry’akarimi Uburusiya bumazemwo igihe kirekire”. Mu bindi vyabaye ejo ku wa Mungu:"	https://www.bbc.com/gahuza/articles/cx8wpexr03ro
health	Abahitanywe na Covid-19 bamaze kurenga imiriyoni zitatu kw'isi	"Abantu bamaze guhitanwa na ca kiza karanda ca Covid-19 kw'isi barenze imiriyoni zitatu, nk'uko bivugwa n'ishure kaminuza Johns Hopkins rikurikiranira hagufi iki kiza. Ibi bimeze uku mu gihe umukuru w'ishami rya ONU rijejwe amagara y'abantu kw'isi, OMS/WHO, agabisha ko isi ""iriko yegereza igitigiri kitari bwabeho c'abandura"" gushika ubu. Ubuhindi - igihugu gihanzwe n'ubwoko bugira kabiri bwa coronavirus - catangaje ko abantu barenga 230.000 ari bo banduye ku musi w'ejo wa gatandatu wonyene. Hafi abantu imiriyoni 140 nibo bamaze kwandura uwu mugera kuva wadutse. Ku wa gatanu, Dr Tedros Adhanom Ghebreyesus arongoye OMS yagabishije ko ""ibitigiri vy'abandura n'abapfa bibandanya biduga ku rugero ruteye ubwoba"". Yongerako y'uko ""mu mezi abiri aheze, ibitigiri vy'abandura ku ndwi vyiyongereye hafi incuro zibiri kw'isi"". Ishure kaminuza Johns Hopkins rivuga ko Reta Zunze Ubumwe za Amerika, Ubuhindi na Brezil - ibihugu bifise abanduye benshi gusumba ibindi kw'isi - vyonyene biteranije ibitigiri vy'abamaze guhitanwa n'uwo mugera barenga umuriyoni. Itororokanirizo ry'amakuru AFP rivuga ko mu ndwi iheze, abantu bashika 12.000 kw'isi yose bahitanye n'iki kiza. Hagati aho, ibitigiri bitangwa n'ibihugu vyinshi kw'isi bishobora kuba atari vyo. Amadoze arenga imiriyoni 800 y'incanco za coronavirus aramaze guhabwa abantu mu bihugu 165 kw'isi yose. Hagati aho, Dr Tedros yabwiye abategetsi ba ONU ku wa gatanu ati: ""Ubusumbasumbane mu bijanye no kuronswa incanco nico kibazo nyamukuru muri kino gihe - kandi turiko turananirwa"". Ibihugu bimwe biramaze kuronka no gucandaga abanyagihugu bavyo batari bake. Ivyo bihugu bifise ibitigiri binini vy'abanyagihugu bavyo bamaze gucandagwa, aha harimwo nk'Ubwongereza na Israel, bifise agahengwe kuko ibitigiri vy'abandura vyagabanutse cane rwose. Abahinga bo kw'ishure kaminuza  Imperial College London bavuga ko isekeza ry'ugucandaga ririko riragabanya abandura, abapfa n'abinjizwa ibitaro. Muri iyi ndwi, umuganga akomeye w'umunya Israel yavuze  y'uko yemera ko Israel - aho abarenga igice c'abanyagihugu bose bamaze gucandagwa - iri mu gushika ku rugero rw'aho igihugu cose kizoba gikingiwe. Ibi rero biri uko mu gihe hari ibihugu vyinshi bikirindiriye kuronswa incanco za mbere. Ibi nivyo vyatumye OMS igabisha ko hari ubusumbasumbane mu kuronswa incanco, aho biboneka ko zitariko zitangwa ku rugero rumwe hagati y'ibihugu bitunze n'ibikenye. Dr Tedros avuga ko mu bihugu bitunze, ica kane (1/4) c'abanyagihugu bamaze gucandagwa, mu gihe mu bihugu bikenye ari umwe ku bantu amajana ane (1/400). OMS iriko ikorana n'umugambi mpuzamakungu covax, mu guhimiriza ko ibihugu bitunze vyosangiza incanco ibihugu bikenye. Gushika mu mpera z'unwo mwaka, covax itegekanya ko yoba imaze gutanga imiriyaridi zibiri z'amadoze kw'isi yose, gusa incanco zimwe zisaba ko umuntu aterwa doze zibiri. Abahinga kandi bafise impungenge ku kuntu izi ncanco ziriko ziratangwa ubu zidashobora kurwanya ubwoko bushasha bw'iyi ndwara bukwirakwira ku muvuduko udasanzwe. Hariko harakorwa ubushakashatsi kugira ngo incanco zisubirwemwo kugira zishobore kurwanya ubwoko bushasha bw'umugera. Prof. Adam Finn ari mu murwi w'Ubwongereza ujejwe incanco (JCVI), avuga ko yiteze ko incanco zigiye kugenda zita inguvu buke buke uko uwu mugera uzogenda uhinduka."	https://www.bbc.com/gahuza/amakuru-56791004
religion	Kardinari w'i Vatican Becciu mu rubanza rwo kunyonyeza miriyoni 412 z'ama dorari	"Umukardinari  w'ishengero Katorika yigeze kuba akorana hafi cane na Papa François agiye gucirirwa urubanza i Vaticano, yagirizwa gukoresha nabi amafaranga y'ishengero mu kamaramaza kahombesheje amafaranga menshi mu mugambi wo kugura inyubakwa i Londres/London. Kardinari Angelo Becciu, w'imyaka 73, niwe mwubahwa  akomeye cane mu barongoye Ekereziya Katorika  mu bihe vya none agiye imbere y'ubucamanza  kubera gukekwako ivyaha bijanye n'amafaranga. Yagirizwa gusohora amafaranga y'amanyaburaya, Euro, angana na miriyoni 350 (arenga miriyaridi 800 mu mafaranga y'Uburundi) y'ishengero mu mugambi utagenze neza  wo kugura inyubakwa  muri Chelsea watumye hatakara amafaranga menshi cane. Arahakana kuba hari icaha yakoze. Abandi bantu icenda bakurukiranwa muri urwo rubanza nabo bagirizwa ivvyaha birimwo kuronka amafaranga ku nguvu canke kw'iterabwoba, kunyuruza no gukoresha nabi ububasha bw'akazi. Kardinari Becciu yirukanywe mu kazi na Papa François mu kwezi kw'icenda igihe amakuru y'ugukoresha nabi amafaranga yaja ahabona. Amatohoza yamaze imyaka ibiri yerekanye ingene Vaticano yatakaje miriyoni z'ama euro, arimwo amashikanwa, inyuma yo kugura inyubakwa  yahora ari ububiko bwa Harrods kuri Sloane Square  Avenue muri Chelsea, mu 2014. Uwo mukardinari yahora  araba amashikanwa mu biro bijejwe amafaranga ya  Vaticano. Ivyaha akurikiranwako birimwo kurungika amafaranga mu rudandazwa rwari rurongowe n'abavukanyi biwe mu ntara y'amavukiro yabo muri Sardaigne. Urwo rubanza rwitezwe kumara amezi menshi. Intahe zibiri zizosasa muri iyi ndwi - ku bibazo  vy'ubuhinga - zishobora kwungururizwa mu kwezi kw'icumi. Abandi icenda bagirizwa barimwo: Abagirizwa bose barahakana kuba barakoze icaha. Hamwe bokwagirwa n'ivyaha, bashobora guhanishwa umunyororo canke ihadabu, canke vyompi. Abashikirizamanza bavuga ko umuranzi  akorera Londres, Gianluigi Torzi,  yanyonyeje Vaticano mu gukoresha amafaranga yayo mu kugura imitahe yo muri iyo nyubakwa yo muri Chelsea yari guca isubirwawo ngo ivemwo amazu y'agaciro yo kubamwo. Torzi avuga ko ibivugwa bishingiye ku kwumva ibintu ukutariko. Ubutariyano buriko buragerageza ngo burabe ko  Ubwongereza bumubarungikira. Mu kwezi kwa kane Papa yafashe ingingo ko aba kardinari n'abepiskopi bagirijwe ivyaha bashobora gukurikiranwa n'abacamanza basanzwe - aho gucirirwa imanza n'aba kardinari nk'uko vyahora. Umukuru mushasha ajejwe amafaranga muri Vaticano, Juan Antonio Guerrero, avuga ko Vaticano iriko irashiramwo inguvu zitari bwigere ziboneka kugira ikorere ku mugaragaro mu bijanye n'amafaranga. Ku wa 24 ukwezi kw'indwi, ku ncuro ya mbere Vaticano yashize ahabona ido n'ido ry'imitahe yayo: amazu 4.051 mu Butariyano n'izishika 1.120 i Londres, Paris, Geneve  na Lausane. Furera Guerreo yagize ati: ''Twamenyereye gukorera mw'ibanga, ariko twamenye ko mu vyerekeye ubutunzi, gukorera ku mugaragaro bidukingira kurusha gukorera nw'ibanga."""	https://www.bbc.com/gahuza/amakuru-57983780
sports	Ihiganwa rya mbere rya Basketball Africa League ryasibijwe muri Senegal kubera coronavirus	"Intango y'ihiganwa ku nshuro ya mbere rya Basketball Africa League (BAL) yasibijwe kubera ubwoba bw'ikiza ca coronavirus. Ihiganwa rya mbere rya BAL ryagomba gutangura ku murwa mukuru wa Senegal, Dakar, itariki 13 z'ukwa gatatu, kandi nta tariki nshasha yatanzwe. Iri higanwa rishasha ry'ababigize umwuga, ryavutse ku gufashanya hagati y'ishirahamwe mpuzamakungu rya basketball, International Basketball Federation, na NBA ryagomba kwitabirwa n'amakipe 12 yo muri Afrika. Umukuru wa BAL, Amadou Gallo Fall yagize ati: ""Twisunze impanuro za leta ya Senegal mu bijanye n'umwitwarariko utewe n'ugukwiragira kw'ikiza ca coronavirus, inkino zitanguza ihiganwa BAL zigijwe inyuma. ""Birambabaje kuba tudashoboye gutanguza iri higanwa ry'amateka nk'uko twari twabiteguye ariko turindiranye igishika ko BAL itangura ku tariki izoza hanyuma."" Abateguye ihiganwa bavuga ko umutekano w'abafana, abakinyi, amakipe hamwe n'abakozi ari kirumara cane kandi ko bazovyihweza neza imbere y'uko batangaza iyindi tariki mu minsi iri imbere. Gushika isaha 08:00 ku masaha mpuzamakungu ya GMT, hari hamaze kwemezwa abantu babiri banduye coronavirus muri Senegal. Inkino hirya no hino kw'isi zarahuye n'ibibazo kubera coronavirus, ariko BAL ibaye ihiganwa rya mbere rikomeye muri Afrika ryigijwe inyuma kubera iki kiza. Ahandi, ishirahamwe ry'umupira w'amaguru muri Tanzania, TFF, ryabujije abakinyi guhana amaboko imbere y'uko inkino zitangura. TFF ivuga ko iriko irakurikiza impanuro z'ubushikiranganji bujejwe amagara zo kwirinda guhana amaboko mu ntumbero yo kubuza iki kiza gukwiragira mu gihugu. Kuwa kabiri, haragaragaye amafoto yerekana umukuru w'igihugu ca Tanzania John Magufuli akozanyako ibirenge mu kuramukanya n'uwundi munyepolisi hako bohanye ibiganza. Ntawanduye coronavirus araboneka muri Tanzania gushika ubu, mu gihe abakekwa bose basanze atayo bafise nyuma yo gupimwa."	https://www.bbc.com/gahuza/imikino-51742734
sports	Qatar 2022 - Portugal: Ivya Cristiano Ronaldo  vyoba birangiriye aha?	"Na Chris Bevan BBC Sport ku kibuga Al Thumama Stadium, Doha Indoto za Cristiano Ronaldo zo gushobora gutsindira igikombe c’isi yose zirarangiye, kandi bisa n’uko ari ubutakigaruka – ariko none twovuga ko umwuga wiwe urangiye burundu? Aho ashiriwe ku rutonde rw’abasubirizi inyuma yo gushwana n’umumenyereza, urugendo rwa Ronaldo muri rino higanwa ntirwigeze ruboneka ko rwari guhava rurangira mu mahoro – ariko gusa amarira yagize inyuma y’’aho Portugal ikuriwe mw’ihiganwa yabaye incamake y’ingene ibintu bimeze ubu. Inyuma yo gutsindwa na Maroc bisigura ko uyu mukinyi w’imyaka 37 gushika ubu ata mudari w’intsinzi y’igikombe c’isi yose agiye yambaye – agashimwe konyene agiye ataronse – mu gihe ubu ari ishusho kw’isi yose ariko idafise umurwi n’umwe yovuga iti ‘aha ni muhira’, inyuma y’aho aviriye muri Manchester United mu buryo atari bwiza, hari mu kwezi guheze. Ico gihe abantu bari basanzwe bariko bibaza nimba yari gusubira gukinira umurwi wiwe, ubu naho, mu gihe abantu muri Portugal bakimukunda cane, hakaba hagiye gukurikira ibibazo kuri kazoza kiwe mu gihugu. Ronaldo yavuye muri Man U hasigaye igihe gito ngo ihiganwa ry’igikombe c’isi yose ritangure, ariko Qatar yatanguye neza kuri we. Igitsindo yinjije kuri penalty yateje impari mu rukino rwa mbere rwa Portugal mw’itsinda ryayo igihe ikina na Ghana cabaye ico “ubuhinga budasanzwe” ku bwa Fifa, kikaba camutumye yitwa umukinyi wa mbere yinjije mu mahiganwa atanu y’igikombe c’isi yose. Ariko kuva ico gihe ibintu vyaciye bitangura kugenda nabi, mbere akaba atashoboye no kwinjiza igitsindo na kimwe mu nkino zibiri zakurikiye atanguzwa mu kibuga, imbere y’uko acanamwo n’umumenyereza  Fernando Santos inyuma y’aho amusubirije mu rukino rwabahuje na Korea y’Epfo. Inyuma yo gushirwa ku ntebe y’abasubirizi mu rukino n’Ubuswisi mu gice c’umunani gishira ica nyuma – bukaba bwari bwo bwa mbere adatangujwe mu kibuga mu nkino zikomeye nk’izi kuva mu 2008 - umusore yamusubiriye Goncalo Ramos yateye bitatu wenyene, ubwo nyene Ronaldo aca yitwa igihangange co ku ntebe y’abasubirizi. Ni nako yakinishijwe mu rukino rwa nijoro na Maroc, n’aho yahawe hafi igice ca kabiri cose, kuva ku munota wa 51, aho nyene igihugu ciwe camaze kurya kimwe ku busa. Kuboneka mu kibuga vyonyene vyasiguye ko yari aciye uwundi muhigo  - urukino mpuzamakungu rwiwe rwa 196, aca anganya n’umusatirizi wa Koweit  Bader Al-Mutawa ku ruhande rw’abagabo – ariko nta kintu kinini yakoze ugereranije n’ivyo yagiye arakora mu myaka iheze. Ronaldo yari asanzwe yaraciye umuhigo ku bitsindo vyinshi mu nkino mpuzamakungu ku ruhande rw’abagabo, aho afise 118, ariko ntiyigeze aboneka ko yari gushobora kwiyongera iteka imbere ya Maroc yaboneka ko yari yariye amavubi. Ronaldo yashoboye gukora ku mupira incuro cumi gusa kandi vyamusavye ko akina gushika ku munota wa 91 kugira ngo ashobore gutera mw’igori, ariko ukaba wari umupira utari ufise inguvu nyinshi zo gutera ubwoba umunyegori wa Maroc, Yassine Bounou, azwi cane nka Bono. Mu gihe Ronaldo yagumye yerekana ishaka, arindiriye ko aronka umupira mwiza kugira ngo akure mu kabaregwa igihugu ciwe, ntiwigeze ushika. Igihe umupira wari utewe na Rafael Leao ku munota wa 97 ukamuca hejuru imbere y’uguterwa n’umutwe na Pepe akawutera inyuma, Ronaldo, ari muri ka gace ka mukorumbone, yakubise amavi hasi n’umwiheburo, yiremeka amaboko, icerekana ko yasa n’uwari abonye ko ivyiwe birangiye. Ifirimbi ya nyuma imaze kuvuga, yararamukanije na bamwe mu bakeba biwe, hanyuma aca ava mu kibuga ubudakebuka, aherekejwe n’uwufata amashusho (cameraman). Mu kanya isase, umufana yagerageje guca mu ryahumye abajejwe umutekano arondera ingene yomusaba kwifotoza i selfie nawe, ariko biranka. Ronaldo amaze kuzimangana mu kibuga yerekanywe ariko atera aja mu cumba c’iyambariro n’amarira, amosozi azokwibutsa ingene avuye mw’ihiganwa, hampande y’ugucanamwo n’umumenyereza wiwe. Inyuma y’aho, Santos yafashe nk’ibisanzwe uku gucanamwo kwiwe na Ronaldo, mu kuvuga ati: ""Si nibaza ko ivyashikiye Ronaldo hari ingaruka vyagize ku rukino, n’aho hari ababineguye. Twese turi hamwe. ""Nimba twovuga ko hari abantu babiri bababaye cane, ni Ronaldo na jewe nyene. Iki kiri mu bigize akazi ku mumenyereza n’umukinyi”. Bafise kuba bunze ubumwe, ariko Portugal iratashe – inyuma y’ibibazo vyinshi, aho abantu bibaza nimba koko umurwi w’iki gihugu hari ico woshikako utari kumwe n’iyi nyenyeri yawo. Ibihe biha ibindi kandi ni ibisanzwe ko imirwi ikomeye itsindwa mu nkino zikomeye, ariko, n’aho Santos yogenda canke akaguma ari umumenyereza, Ronaldo si umuntu agiye kwibagirwa vuba. Aracafise iteka mu gihugu ciwe inyuma y’ivyo yagikoreye mu gutsindira igikombe ca Bulaya mu 2016 (Euro 2016), igikombe ca mbere gikomeye mu nkino nkuru nkuru. Igitigiri c’abafana ba Portugal bari bambaye imipira yanditseko 'Ronaldo 7' hanze y’ikibuga Al Thumama Stadium ejo ku wa gatandatu kirerekana neza ko batibagira ibihe vyiza vya kahise kiwe n’aho ibiherutse kuba mu ndwi nkeya ziheze atari vyiza. Mushiki wa Ronaldo, Katia Aveiro, yaravugiye abatari bake abicishije mu butumwa bwuzuye umubabaro ku rubuga rwa Instagram inyuma yo gutsindwa na Maroc. Yatanguye ati: ""Igihe abuzukuru banje bazombaza ivyerekeye urugamba, iteka, icubahiro, akazi, ukwitanga, inzitizi, ububi bw’abantu buciye kw’ishari; ni bansaba kuvuga ivyerekeye ibikombe, ibitsindo, ubushimwe, inyandiko z’umurage utarigera uboneka, nzobabwira ivyerekeye musazanje, se wabo”. Arangiza avuga ati: ""Nzobabwira ivyerekeye ubwami yubatse, nzobabwira inguvu ziwe, ivyo yemeye n’ivyo yakoze, nzobabwira amateka yiwe, nzobabwira ko atigeze acika intege n’igihe baba bamaze kumwimbira icobo. Nzobereka firime [film], firime nyayo y’ubuzima bwa se wabo”. Ntituzi ingene iyo firime izorangira, ariko mu gihe vyoshika agakina ihiganwa ry’igikombe c’isi yose rigira gatandatu, vyoba ari ibintu bitangaje cane. Ico gihe, ni ukuvuga mw’ihiganwa rindi ry’igikombe c’isi yose, azoba afise imyaka 41, ariko nimba yipfuza irindi teka, aracafise amahirwe mw’ihiganwa ry’igikombe ca Bulaya kizoba mu 2024. Ikindi kibazo nyamukuru ni ukumenya ni uyuhe murwi asobora kuzoba akinira. Hari imirwi itari mike yipfuza kugura Ronaldo muri ka kanya k’igura n’igurishwa ry’abakinyi ko mu kwa mbere, harimwo Al-Nassr  wo muri Arabia Saoudite wamaze no kumwemerera agashahara gafadika mu ndwi iheze. Uburasirazuba bwo hagati si ahantu yaronderera na gato – ariko mu misi dushobora kuba ari yo tuzomubona."	https://www.bbc.com/gahuza/articles/c3g52jkjw0eo
business	Ndayishimiye: ‘Karashize ingani, abakozi ba Reta bitwe abatishoboye?’	"Umukuru w'igihugu c'Uburundi Evariste Ndayishimiye avuga ko ibibazo Uburundi bwagiye buracamwo vyatumye igihugu gisigara inyuma mu bisata bitandukanye. Akebura  abakozi gukura amaboko mu mpuzu kugira bagwize umwimbu. Mw'ijambo yaraye ashikirije Abarundi buca bahimbaza umusi mpuzamakungu wahariwe abakozi, Perezida Ndayishimiye ahamagarira Abarundi kwemanga ko basamaye hanyuma bafate ingingo yo gukura amaboko mu mpuzu. Mu gihe abakozi ba reta bari biteze ko umusi nk'uwu ari akaryo keza ko kwongerwa imishahara, Perezida Ndayishimiye avuga ko batokwitega ko bahava bongerwa agashirukabute mu gihe ""n'umwenda Reta yafashe mu myaka iheze kugira ihembe abakozi utararihwa"". Perezida Ndayishimiye avuga ko gushika ubu hari abakozi bironderera kwongerezwa impembo mu gihe ataco bariko bafasha reta kugira ironke uburyo bukwiye, bakagomba ko reta isaba imfashanyo kugira ngo ibahembe. Ati: ""Uno musi urasanga umukozi wa Reta ashaka agashirukabute gakirurutse ariko we nyene abona abanyonora ikigega ca reta akihorera canke akabakingira ikibaba. Mbere hari naho usanga ari we nyene ariko aranyonora agaca asaba impembo irengeye. ""Hari abandi bareka ibidandazwa vyari gutanga amakori bigaca ku ruhande ariko ukwezi kwahera agasaba impembo. None yibaza ko iyo mpembo ica iva hehe, ko hari aho nyene?"" Perezida Ndayishimiye ntiyumva ivyo gusaba imfashanyo, kuko kubw'iwe, abakeneye imfashanyo ni abatishoboye. Ahamagarira  abarundi gutahura ko ivyo bagiye baracamwo  vyatumye basamara. Ati: ""None ko umuntu wo gufashwa ari uwutishoboye, koko karashize ingani, abakozi ba Reta bitwe abatishoboye?  Jewe si uko ndavyumva; sindanavyemera; ni co gituma bintera isoni gusega"". Perezida Ndayishimiye abona ko uwutakoze atari akwiye guhembwa ukwezi guheze kuko ku bw'iwe, ""ni we ngumba y'ukuri kuko imana yamuhaye ubwenge n'inkomezi hanyuma abipfisha ubusa"". Avuga ko muri kino gihe igihugu kirangwamwo amahoro, agasaba Abarundi guhaguruka bakiyishura ivyo bataye, bakarangura imigambi yo kwiteza imbere. Ati: ""Twarabuze vyinshi, twarataye umwanya mwinshi kubera ububegito bwa benshi muri twebwe bwatumye tubura amahoro. ""Muri uwo mwanya twataye, ibikorwa bitakozwe ni vyinshi kandi biraturindiriye. ""Kurima, tukworora kijambere ntavyo twitaho; twarira ikija mu nda gusa, umusesekara ntiwotubajije, tukitwaza imyibutsa yataye igihe ngo ivy'ejo biraba ab'ejo. ""Guhingura itunga kama uwo wari umugani kuko biteba kwimbuka ... gutunganya aho abamukerarugendo ... vyari umugani."" ""Ivyo vyose vyari akazi koduha itunga dukeneye kandi n'ubu karacaturindiriye"".Atera akamo abarundi ko bova hasi bagakora kugira ngo bahamvye ibindi bihugu kuko vyovyo vyamaze kugera kure. Ati: ""Abandi barakamaze. Barubatse amabarabara, barubaka amashure, barubaka ingomero z'umuyagankuba, barubaka ivyo ba mukerarugendo bakenera, barubaka ibikoresho vy'ubuhinga ngurukanabumenyi, barubatse amahinguriro, ubu ntaco basigaje. ""Twebwe, ivyo vyose biracaturindiriye, dukure amaboko mu mpuzu dukore""."	https://www.bbc.com/gahuza/amakuru-56958068
business	Burundi: Inyuma y'indwi imwe ibitungwa bizosubira kubagwa	"Ubushikiranganji bw'intwaro yo hagati mu gihugu n'umutekano bumenyesha ko ibitungwa bigiye gusubira kubagwa kuva ku musi wa gatatu w'indwi iza. Ivyo vyashikirijwe n'umunyamabanga ntayegayezwa Martin Niteretse mu nama yagiranye n'abarongoye intara, abarongoye uturere mu gipolisi hamwe n'abajejwe uburimyi n'ubworozi mu ntara. Ingingo yo guhagarika kubaga ibitungwa yari yafashwe kubera iyaduka ry'ingwara y'inyonko yo mu kiyaya ca Rift (Fièvre de la vallée du Rift) Kugira ivyo bishoboke ngo ibitungwa vyo kubagwa bitegerezwa kwegeranirizwa hamwe. Agira ati:""Abayangayanga  bakeneye kuzobaga mubatunganirize aho begeraniriza ibitungwa bashaka kuzobaga mu ndwi iza. ""Nta nka izobagwa itavuye aho muri ico kibanza. Kuko ntayizova mu muhana ica ija kubagwa ubwo nyene."" Ivyo bitungwa kugira bije kubagwa, bitegerezwa kumara imisi indwi biri mu kibanza categekanijwe mu makomine yose, bigenzurwa ko bitagwaye. Martin Niteretse kandi avuga ko ata nyama izova mw'ikomine zija mu yindi. Nta n'inka zirekuriwe kuvanwa mu ntara zija mu yindi, kiretse ngo izijanywe kubagirwa mu gisagara c'ubutunzi ca Bujumbura. Ariko ngo nko mu ntara zitagira inka nyinshi, abayangayanga baho barashobora kuja kuzigura ahandi, ariko abategetsi b'aho baziguze bategerezwa kubaha urupapuro ruziherekeza. Kandi ico gihe zizoca ziherekezwa n'igipolisi kugira ntihagire izururukira mu nzira canke izuririra mu nzira  zitagenzuwe neza. Icipfuzo ngo n'uko mu ndwi iza hatangura kubagwa inka, hamwe n'impene n'intamaba 'bishobotse'. Abadandaza basabwe kandi kudaca bikika mu kiza ngo baduze ibiciro. Ku bijanye n'urucanco, Martin Niteretse yabasavye kuja gutegura abajejwe ako kazi kugira incanco zishitse bace baja ku kivi. Haraheze amezi arenga abiri hatanzwe itegeko ko kizira kikaziririza kubaga inka, impene n'intama, mu ntumbero yo gukumira inyono yo mu kiyaya ca Rift."	https://www.bbc.com/gahuza/articles/c975ejp1g1jo
entertainment	Akaririmbo k'uyu mu Somaliakazi karakunzwe cane ku mbuga...	Urashobora kuba umaze kwumva akaririmbo kakunzwe cane ku mbuga k'uyu mu Somaliakazi. Aha ariganira BBC ingene vyagenze.	https://www.bbc.com/gahuza/59436729
