entertainment	"Burundi: Umuririmvyi Délégué Général arafunzwe kubera indirimbo yiwe ""idahuje n'umuco"""	"Umuririmvyi Olegue Baraka azwi kw'izina rya Délégué Général afunzwe kuva ku wa mungu, ejo ku wa kane yerekanywe n'igipolisi c'Uburundi. Yagirizwa ivyaha vyo ""gukwegera abantu mu buhumbu no guhungabanya imico y'ikirundi"". Ibi bifatiye ku masanamu y'ururirimbo gw'iwe yise ""Delegue General"" bavuga ko rurimo ibiterasoni. Igipolisi kivuga ko kizokurikirana n'abandi bose bakinye muri iyo sanamu nk'abanyeshure nk'uko bivugwa n'ibimenyeshamakuru mu Burundi. Amakuru y'uko uyu muririmvyi afunzwe yavuzwe bwa mbere ku wa mbere w'iyi ndwi ku mbuga hwaniro. Ururirimbo rwiwe rurimwo urwaruka ruboneka nk'abanyeshure bakinira mu cumba c'ishure bambaye impuzu z'ishure. Uru ruririmbo rwasohotse mu kwezi gushize k'umunani, ubu kuri Youtube, aho rukigaragara kugeza mu gitondo uyu munsi, rumaze kurabwa inshuro zirenga 25,000. Ubwo yerekanwa n'igipolisi, uyu muririmvyi yumvikanye avuga ko asaba ikigongwe kuko yakoze iyi ndirimbo abakuru bakamubwira ko ari amakosa. Mu gihe we ayikora ngo yumva ko ibiyirimwo ari ibintu bibaho. Ku mbuga hwaniro, abantu bamwe bavuga ko uru ruririmbo nta kidasanzwe kirimwo kitabonetse mbere cotuma Olegue Baraka n'abagenzi biwe bafunzwe ubu. Abandi bavuga ko akwiriye guhanwa kuko ayo masanamu ahushanye n'imico y'ikirundi."	https://www.bbc.com/gahuza/amakuru-49930503
religion	Uganda: Amadini n’abayoboke abangamye kandi abangamiwe	“Hari n’abica ku bwa Christ (Kristu)”, ni bimwe biri muri iri tohoza rya BBC Africa Eye. Peter MacJob agaragaza uturorero muri Uganda, aho n’abakiri bato bakoreshwa n’aba ‘pastors’ (abapasitori) bo mu madini atandukanye, n’abantu bakahasiga ubuzima.	https://www.bbc.com/gahuza/amakuru-61035285
religion	India: Ingene umwambaro wa hijab wambarwa n'abagore bo muri Islam uteje ibibazo	"Intara yo mu Buhindi yugaye amashure yisumbuye na kaminuza biturutse ku kibazo c'umwambaro wa hijab kiriko gikurikiranirwa hagufi n'amakungu inyuma y'aho uwuharanira agateka ka muntu Malala Yousafzai yatsindiye agashimwe kitiriwe Nobel avyinjiriyemwo. Reta y'intara ya Karnataka iri mu bumanuko bw'Ubuhindi yafashe iyi ngingo inyuma y'aho abanyeshure bihereye amabarabara mu myiyerekano ishingiye ku bakobwa bambara uwu mwambaro wo mw'idini rya Islam, imyiyerekano yandurutsemwo imigumuko. Kuri uyu wa gatatu, sentare nkuru y'iyo ntara itegekanya kwiga ku rwandiko ruvugira abagore b'aba Islam. Ibi bibaye inyuma y'aho abanyeshure batandatu b'urwaruka bagiriye imyiyerekano imbere y'ishure ryegukira reta ku kibazo co kwambara hijab, imyiyerekano yaciye ikwiragira ku yandi mashure. Abanyeshure batari bake b'aba Hindu nabo baciye biha amabarabara bambaye ibitambara vy'umutugutu  - ibara ry'ikimenyetso c'idini rya Hindu - mu kwiyamiriza abakobwa b'aba Islam bambara hijab. Ejo ku wa kabiri, umupfasoni Malala - umugore yarokotse igitero c'aba Taliban muri Pakistan afise imyaka 15 ahorwa ko yariko avugira abakobwa ko boronswa uburenganzira bwo kwiga  - yateye akamo abategetsi b'Ubuhindi ko bogira ico bakoze kugira ""bahagarike inenwa abagore b'aba Islam bakorerwa"". Uyu mupfasoni w'imyaka 24 yanditse kuri Twitter ati: ""Kubuza abakobwa kuja kw'ishure bambaye hijab zabo ni ibintu bibabaje. Ivyo gufata nabi abagore birabandanya - kubera uko bambaye"". Mu Buhindi, uru ruhagarara rwongereje ubwoba n'ishavu mu nkehwa z'aba Islam bavuga ko ibwirizwashingiro ribaha uburenganzira bwo guhitamwo ivyo bambara. Ejo ku wa kabiri, amareresi yakwiragiye cane yerekana umukobwa w'umu Islam ariko azomerwa n'ikirwi c'abagabo bakiri bato  bamuvugiriza induru, n'impari zikomeye hagati y'abanyeshure bambaye hijab n'abandi bambaye ibitambara vy'umutugutu. Mu bintu bidakunze kuba, umucamanza ariko arakurikirana uru rubanza yateye akamo abanyeshure hamwe n'abandi ""kubungabunga amahoro n'umutekano"". Ikibazo catanguye kuja hejuru igihe abanyeshure batandatu biga kw'ishure ryisumbuye ryo mu karere ka Udupi mu ntara ya Karnataka batangura imyiyerekano kubera bari babujijwe kuja mw'ishure bambaye hijab. Udupi ni kamwe mu turere dutatu tugize intara ya Karnataka iri ku nkengera - ari naho higanje umugambwe Bharatiya Janata Party (BJP) w'umushikiranganji wa mbere Narendra Modi. Abihweza ibintu n'ibindi bafata ko iyo ntara ari icicaro gitegurirwamwo poritike y'aba Hindu ari na bo benshi mu gihugu. Umugambwe BJP kandi ni wo urongoye iyi ntara ya Karnataka. Iri shure rivuga ko ryemereye abanyeshure kwambara hijab mu gihe bari mu kigo, ariko bagasabwa gusa kuzikura iyo bari mu masomero. Ariko abari mu myiyerekano  - bose bakaba bari mu mwambaro w'ishure - bavuga ko ari ngombwa ko bemererwa gupfuka imishatsi yabo mu masomero. Umwe muri aba banyeshure Almas AH, yabwiye BBC Hindi ati: ""Turafise abigisha bakeya b'abagabo. Rero ni ngombwa ko dupfuka imishatsi yacu imbere y'abagao. Ni co gituma twambara hijab"". Aba banyeshure barahakana ivyo bagirizwa ko bazambara babitegetswe n'umurwi Campus Front of India - ishami ry'umurwi w'abanyeshure ugendera ku vyiyumviro bikaze vya Islam, Popular Front of India - ari na wo ubavugira. Si kenshi abagore bakunze kuboneka bambaye hijab na burka (umwitwikiro w'umubiri wose mw'idini rya Islam) mu Buhindi, aho kwerekana ibimenyetso vy'idini ku mugaragaro ari ibintu bisanzwe. Ariko umukuru w'iri shure avuga ko ari ngombwa ku mwigisha kubona abanyeshure mu maso, kandi ko umwambaro w'ishure utuma ata vangura riba mu banyeshure. Inama z'urutavanako hagati y'abanyeshure, abarongoye ishure hamwe n'abaserukira reta ntaco zashitseko. Ikibazo c'abanyeshure b'abakobwa b'aba Islam bambara hijab carakwiye mu yandi mashure makuru makeya y'i Karnataka, ariko cagiye kurenga inkombe igihe amasanamu y'aba bakobwa bari mu myiyerekano i Udupi akwirakwirijwe. Ubwo nyene, abanyeshure b'aba Hindu mu yandi mashure amwe amwe baciye batangura kuza mu masomero bambaye ibitambara vy'umutugutu  - ivyatumye abarongoye ishure bategeka ko iyi myambaro yompi itemewe mu bigo. Mu ndwi iheze, ireresi yafatiwe kw'ishure rikuru rya Kundapur mu karere ka Udupi yerekana abanyeshure bambaye hijab bankiwe kurengana bariyeri, yatumye ibintu biyangara. Imirwi y'abanyeshure b'aba Hindu  - abahungu n'abakobwa - nabo baciye batangura imyiyerekano yo kwiyamiriza bagenzi babo bigana bambaye hijab. Gusa nta mishamirano yari bwabe gushika ejo ku wa kabiri - hasigaye amasaha makeya ngo sentare itangure kwiga urwo rwandiko - aho baciye batangura guterana amabuye mbere baranaturira mu bisagara bimwe bimwe. Abategetsi b'abakere baciye bashira mu ngiro ingingo ya 144 (Section 144) - itegeko ryo mu gihe c'ubukoloni ryabuza abantu barenga bane gukoranira hamwe - mu ntumbero yo guhagarika iyi migumuko. Mu karere ka Shivamogga, umurwi w'abanyeshure b'abahungu bafashwe amashusho baduza ibendera ry'umutugutu kw'ishure ryabo, reta ica itangaza ko hagiye gukorwa amatohoza. Mu karere ka Mandya, ireresi yazungurutse cane yerekana umukobwa yambaye burka asugerezwa n'umurwi w'abagabo bambaye ibitambara vy'umutugutu. Mu gihe babandanya bamuzomera bavuga ngo Jai Shri Ram (twogereranya na 'Mana nziza'), nawe yarihagarayeko, ashira ijwi hejuru ati ""Allah Akbar"" (Imana ni yo nkuru) mu gihe abarongoye ishure bamuherekeza bamuvanaho. BBC ntibazwa ibivuye ku zindi mbuga Mu nyuma, uyo mugore azwi kw'izina rya Muskan yavuze ko umukuru w'iryo shure yamwemereye ko azomushigikira. Yabwiye ikinyamakuru The Indian Express ati: ""Hari abandi bakobwa b'aba Islam na bo nyene bazomerewe nk'uku. Abarongoye ishure be n'umukuru waryo ubwiwe ntibigeze batubuza kwambara burka, none ni kubera iki nokwumviriza abo hanze?"" Umutegetsi mukuru mu gipolisi yabwiye BBC Hindi ko ibi ari ""ikibazo gito"" kandi ko bafise ibintu mu minwe. Reta y'intara ivuga iki? Umushikiranganji w'indero w'intara ya Karnataka Nagesh ashigikiye abategetsi b'ishure bavuga ko, vyaba ibitambara n'ibisikafu vy'umutugutu, vyaba ibitambara vy'imyitwikiro, vyose ntivyemewe mu bigo vy'amashure. Avuga kandi ko aba banyeshure bagumuwe ""n'inkozi z'ikibi"". Afatiye ku kungene ishami rya poritike ry'umurwi Popular Front of India ririko rigerageza gushinga imizi mu karere ko ku nkengera, Nagesh yabwiye BBC Hindi ati: ""Vyose bishingiye kuri poritike. Ibi vyose biriko biba kubera amatora yimirije mu mwaka uza"". Sentare ivuga iki gushika ubu? Sentare yahawe inzandiko zibiri zivugira abari muri iyi myiyerekano. Rumwe ruvuga ko ibwirizwashingoro ry'Ubuhindi ritanga uburenganzira kuri buri muntu guhitamwo ivyo yambara. Urundi narwo rukarwanya itegeko riherutse gushingwa na reta y'intara ritegeka inyambaro yemewe mu mashure, ribuza ibitambara vyo mu mutwe n'ama hijab. Imbere y'uko urubanza rutangura kwigwa, igihe umushingwamanza yari asavye ko rwunguruzwa, umucamanza Krishna Dixit yaranse. Ati: ""Ibishobisho vyose bigume hanze. Ibwirizwashingiro ni Bhagavad Gita (igitabo ceranda c'aba Hindu). Jewe nzokorera ku ndahiro nagize igihe ntangura akazi. Si vyiza ko abanyeshure baguma hanze"". Uyu mushingwamanza aburanira abari mu myiyerekano avuga ko itegeko rya reta ribuza hijab riteye kubiri n'amategeko kandi ko rihonyanga ibwirizwashingiro - agasaba kandi ko sentare ifata ingingo mfatakibanza yokwemerera abanyeshure kubandanya biga imbere y'uko ibibazo bitangura."	https://www.bbc.com/gahuza/amakuru-60315011
sports	Ayavugwa mu mupira w'amaguru ku wa gatanu 05.07.2019: Maguire, Fernandes, Niguez, Marcelo, Lukaku, Gomez	"Umukinyi Bruno Fernandes arashashaye cane kwimukira muri Manchester United. Bitegekanijwe ko uyo mukinyi wo hagati w'imyaka 24 asanzwe akina muri Sporting Lisbon no mu murwi nserukiragihugu wa Portugal afata urugendo rumushikana Old Trafford gupimwa kwa muganga. (Sport Witness) Man U irarondera kandi umunyegori wa Atletico Madrid Saul Niguez w'imyaka 24 kugira asubirire Paul Pogba mu gihe uyu mukinyi w'umufaransa w'imyaka 26 yoramuka avuye i Old Trafford. (Express) Manchester City ntiyiteguye kuriha amahera asabwa na Leicester ku mukinyi Harry Maguire  w'imyaka 26, akaba ari amahirwe kuri Manchester United yo gushobora kugura uyo mukinyi mpuzamakungu w'umwongereza. (90Min) Arsenal nta mahirwe bagize y'ukuronka umunyegori w'umudagi w'imyaka 21, Markus Schubert, yafashe ingingo yo kuja gukinira Schalke avuye muri Dynamo Dresden. (Sport1) Arsenal bariko bakora hasi hejuru kugira bagure Marcelo inyuma y'aho uyo mukinyi w'umunya Brezili asavye ko yova muri Real Madrid. (Sport - via Metro) Arsenal yatanguye kuvugana n'umurwi Gremio kugira irabe ko yoronka umukinyi w'inyuma wa Argentine, Walter Kannemann w'imyaka 28. (Globo Esporte - via Metro) Inter Milan biriko birayigora kugura umusatirizi wa Manchester United akinira umurwi nserukiragihugu w'Ububirigi, Romelu Lukaku w'imyaka 26. (Sun) Uwahoze ari umukinyi rurangiranwa wa Tottenham, Ossie Ardiles, avuga ko kugerageza kubuza Christian Eriksen w'imyaka 27 kugenda ari ""uguta umwanya"". (Talksport - via Goal) West Ham United iriko irarwanira na Valencia umusatirizi wa  Celta Vigo Maxi Gomez w'imyaka 22 akinira kandi n'umurwi nserukiragihugu wa Uruguay . (Sky Italia - via Inside Futbol) Leicester umutima wayo wose uri ku mukinyi w'inyuma wa Burnley, James Tarkowski, ari nka hamwe Harry Maguire yokwimukira muri Man United. Hagati aho, Leicester izomurwanira na Wolves nayo nyene yipfuza uyo mukinyi. (Birmingham City) Man United iriteguriye kugiriranira amasezerano mashasha n'umunyegori David de Gea akaba yohembwa imiliyoni 85 z'amapawundi milioni 85, aho yoronka umushahara w'ibihumbi 350  ku ndwi. (Star) Umukinyi w'inyuma w'umunya Croatia, Dejan Lovren ashobora kuva muri Liverpool akaja muri AC Milan yipfuza cane uyo mukinyi w'imyaka 30, ikaba yoba iriko irategura amahera ngo imushikane i San Siro. (Mirror) Manchester City na Barcelona iriko irarwanira umukinyi w'inyuma wa Juventus,  Joao Cancelo w'imyaka 25, akaba kandi akinira n'umurwi nserukiragihugu wa Portugal. (Sport English - via Mirror) Frank Lampard yifotoreje mu kibuga ca Stamford Bridge aho yakirwa nk'umumenyereza mushasha wa Chelsea. (Mail) Arsenal yugururiwe inzira y'ukugura umusatirizi w'umunyabrezili akinira Barcelona, Malcom w'imyaka 22, ariko ico irondera ahanini  kukaba ari ukugura umusatirizi wa Cote d'Ivoire Wilfred Zaha  w'imyaka 26 akina muri Crystal Palace. (Mirror) Aba Gunners bariko bategura imiliyoni 70 bashaka gutanga kuri Zaha, n'aho Palaceyoyo ivuga ko uyo mukinyi afise agaciro kangana n'imiliyoni 80 z'amapawundi. (Sky Sports) Tottenham yahagaritse ibiganiro vyayihuza na Real Betis ku mukinyi wo hagati akomoka muri Argentina, Giovani Lo Celso w'imyaka 24 inyuma y'aho iyo mirwi inaniranye kwumvikana ku mahera. (Sky Sports)"	https://www.bbc.com/gahuza/imikino-48881468
politics	Afghanistan: Uwahoze atwara igihugu Ashraf Ghani yasavye imbabazi z'uko yahuze	"Uwahoze ari umukuru w'igihugu ca Afghanistan Ashraf Ghani yasavye imbabazi abanya-Afghanistan inyuma yo kuva mu gihugu akaja mu buhungiro muri Emirats Arabes Unis (United Arab Emirates). Yavuze ari : ""Kuva muri Kabul niyo yabaye ngingo ya mbere  igoye cane mu buzima bwanje,"" aca yongerako ko asavye imbabazi kuko ""ntabona ukundi ryari kurangira"". Uwahoze ari umukuru w'igihugu Ghani yahunze Afghanistan ubutarariye igihe aba-Taliban bari basugereje umurwa mukuru Kabul ku wa 15 ukwezi kw'umunani. Avuga ko atifuza guheba abanyagihugu ariko ko ""yari yo nzira yonyene"". Mw'itangazo yashize no kuri  Twitter ku wa gatatu, Ghani yavuze ko ata kundi yari afise yari kugira atari ukuva mu gihugu kugira ntihabe intureka mu gihugu cose. ""Nahavuye ndabisabwe n'bajejwe umutekano ku kirimba, bangiriye inama ko kugumaho vyotuma haba intambara yo mu mabarabara nk'uko vyagenze mu gisagara igihe c'intambara yo hagati mu gihugu mu myaka ya 1990"", abandanya avuga ko yabikoze kugira ""akize   Kabul n'abantu imiriyoni 6 bayibamwo"". Yavuze ko yari amaze imyaka 20 yitanga kugira Afghanistan kibe igihugu kirangwa na ""demokrasi, kiroraniwe kandi cigenga"". Uyo yahoze ari umukuru w'igihugu yongeye guhakana ""ibitagira aho bishingiye"" bivugwa ko yahunganye amafaranga angana na miriyoni 169  z'ama dorari (hafi miriyaridi 338 mu mafaranga y'Uburundi). Uwo mugabo w'imyaka 72, yaneguwe cane n'abandi banyaporitike bo muri Afghanistan kubera guta igihugu, yavuze ko azosigura ""ingene ibintu vyagenze gushika aho ata akagenda""  mu minsi mike iri imbere. Mw'ijambo ry'ikibiriraho kuri Facebook ku wa 18 ukwezi kw'umunani, Ghani yavuze ko ""yahatiwe"" kuva muri Afghanistan n'abamucungerera umutekano kuko ""hari ivyago vyinshi ko nashobora gufatwa nkicwa"". Yavuze ko igihe aba-Taliban binjira ku kirimba c'umukuru w'igihugu i Kabul, ""batanguye kundondera icumba ku kindi"". Ahakana ibivugwa ko yagiye atwaye amafaranga menshi mu guhunga igihugu, Ghani yavuze ko ""atemerewe no gukura isandari ngo yambare ibirato"". Muri iyi ndwi, aba-Taliban bamaze indwi zitatu bafashe  igihugu,  baratangaje abagize reta ata mugore n'umwe arimwo. Ku wa gatatu, abagore baharurwa mu mirongo muri Kabul no mu ntara ya Badakhshan yo mu buraruko bushira ubuseruko bwa Afghanistan baragize imyiyerekano yo kwiyamiriza iyo reta nshasha bavuga ko batazokwemera reta itagiramwo   abashikiranganji b'abagore."	https://www.bbc.com/gahuza/amakuru-58497615
sports	Igura n'igurishwa ry'abakinyi ku mugabane wa buraya 29.07.2022	Everton iriko iravugana na Paris St-Germain kugira igure umukinyi wo hagati wo muri Senegal Idrissa Gueye w'imyaka 32, bikaba vyitezwe ko ivyo biganiro bibandanya mu misi mike iri imbere.  (Fabrizio Romano) Nuno Tavares w'imyaka 22 arakorerwa ibipimo kuri uyu wa gatanu n'umugwi wa Marseille inyuma y'aho uwo mugwi wo mu Bufaransa ushitse ku masezerano yo kumutizwa na Arsenal.  (Fabrizio Romano). Marseille kandi yaratanguye ibiganiro vyo kuzana muri uwo mugwi umunye Chili Alexis Sanchez w'imyaka 33 ava muri Inter Milan. (L'Equipe) West Ham irabandanya ibiganiro na Eintracht Frankfurt ku mukinyi wabo w'umunye Serbia Filip Kostic, 29, ashobora gukina inyuma mu bubamfu. (90 min) Tottenham iriko iragerageza gutwara umukinyi w'imbere w'Ubutaliyano Nicolo Zaniolo, 23 akinira umugwi wa Roma,  yaronderwa kandi na Juventus. (Tuttosport) Barcelone ifise umugambi wo kugura umukinyi Sergio Reguilon, 25 wo mu mugwi wa Tottenham  mu gihe batoshobora kugura umukinyi w'inyuma mu bubamfu wo muri Espagne Marcos Alonso, 31, ari muri Chelsea. (AS) AC Milan yagiriraniye amasezerano na Charles de Ketelaereyahora ari mu mugwi wa Club Bruges, mu gihe uwo mukinyi w'umubiligi w'imyaka 21 yahora aronderwa kandi n'imigwi ya Leeds na Leicester. (90min) Umugwi wa Palmeiras uramaze kwankira incuro zibiri zose umugwi wa Ajax kugura umukinyi w'umunye Brezil Giovani w'imyaka 18. Uwo mugwi wo muri Hollande ukaba umugwanira na Newcastle hamwe Bayern Leverkusen. (ESPN) Umukinyi w'inyuma wa Newcastle United n'Ubwongereza Kieran Trippier, 31, avuga ko yari kwimukira mu mugwi wa Manchester United mw'ici riheze, imbere yo gufata ingingo yo kuva muri Atletico Madrid akerekeza muri muri Newcastle mu kwezi kwa mbere. (Mirror) Umumenyereza wa Arsenal Mikel Arteta ntibagiye mu rukino rw'imbere y'uko ihiganwa nyezina ritangura rwabahuje na Brentford abikinyi Bernd Leno,30 wo mu Budagi ahamwe n'abanye  Espagne Pablo Mari,28 na Hector Bellerin, 27. Aho ni mu gihe vyitezwe ko abo batatu bimukira mu yindi migwi muri iri ci. (The Mirror) Umumenyereza wa Liverpool Jurgen Klopp yamiriye kure ibivugwa ko umukinyi w'imbere wa Brezil Roberto Firmino ashobora kuva muri uwo mugwi muri rino ci inyuma y'aho binuganugiwe ko uwo mukinyi w'imyaka 30 ashobora kuja mu migwi ya Juventus na Newcastle. Tottenham iriteguye kugurisha umukinyi Giovani lo Celso igihe hotangwa imiliyoni 17 z'amapawundi muri iri ci. Aho ni mu gihe imigwiVillarreal na Fiorentina iriko irerekana ko ikeneye uwo munye Argentine w'imyaka 26. (Athletic - subscription required). Manchester City yahaye uburenganzira umukinyi w'umwongereza w'imyaka 19, James McAtee bwo kwimukira mu wundi mugwi kw'ideni mu gihe imigwi ya Leeds United na Nottingham bivugwa ko imurondera. Kubera kubura amahera, Leicester yatsinzwe na Naples mu rugamba rwo kugura  umukinyi wa Korea y'Epfo Kim Min-jae w'imyaka 25 yahora akinira umugwi Fenerbahce.  (Football Insider) Umugwi wa Burnley uriko urarondera umukinyi wo hagati w'umunye Scotland Jack Hendry w'imyaka 27 akinira Club Bruges yo mu Bubiligi.	https://www.bbc.com/gahuza/articles/c4nxrwj8qwlo
health	Covid-19: Ubwoko bwayo bwo mu Buhinde bwashitse muri Uganda	Uganda yatangaje ko yagaragayemwo ubwoko bushasha bwa Covid-19 bwo mu gihugu c'Ubuhinde, uwuyirwaye akaba ariko aravurwa. Ibipimo vyafashwe kuri uwo muntu itariki 26 z'ukwezi kwa gatatu, akaba ariko aravurirwa mu bitaro vya Mulago National Referral Hospital. Uganda iramaze kugaragaramwo kandi ubwoko bushasha bw'ico kiza bwo muri Nigeria, Ubwongereza na Afrika y'epfo. Umuyobozi nshingwabikorwa w'ikigo co muri Uganda kijejwe indwara zandukira, Dr. Pontiano Kaleebu, yavuze yuko gushika ubu Uganda imaze kubonekamwo umuntu umwe gusa afise ubwo bwoko bushasha  bwa Covid-19 bwo mu Buhinde. Ubu bwoko bushasha vyemejwe ko bwatowe muri Uganda mu gihe igihugu c'Ubuhinde co muri Aziya bukomakomwo  gihanganye n'umupfunda wa Covid-19 ugira kabiri, umaze gusasika inganda mu miji minini minini. Vyateje ikibazo gikomeye c'amagara mu gihe ibitaro vyaherewe n'ibibanza vyo kwakira abarwayi, gufuba abahasize ubuzima navyo ubu bikaba bibera mu bibanza vy'ahasanzwe hasigwa imiduga (parking). Kaleebu yavuze yuko ubu bagiye kwibanda ku gukumira hamwe no gupima cane  ku mbibe za Uganda. Iki gihugu caratanguje umuce wambere wo gukingira abanyagihugu  Covid-19 mu kwezi kwa gatatu, nyuma yo kuronswa inkingo 864.000 za AstraZeneca zivuye mu mugambi wa Covax, hamwe n'izindi 100.000 zavuye mu Buhinde. Abahereweko gukingirwa mu muce wambere ni abakora akazi gatuma bagira ivyago vyinshi vyo  kwandura barimwo abakora mu vy'amagara y'abantu, abasirikare, abapolisi hamwe n'abigisha. Harimwo kandi n'abafise indwara zituma abasoda b'umubiri bagabanuka, kuva ku myaka 18 kurenga co kimwe n'abakuze cane. Ariko abemera kwikingiza ni bakeyi cane. Abashika 304.000 gusa nibo bamaze kwiteza urukingo rwa mbere gushika ubu. Uganda yatanguye kworosha amategeko ya guma-muhira mu kwezi kwa gatanu mu mwaka uheze, ariko ingingo zo kwikingira nko kwambara agapfuka-munwa hamwe no kutegerana cane, zubahirizwa gake cane.	https://www.bbc.com/gahuza/amakuru-56935177
health	Ibihugu vya Afrika vyumvikanye gukorera hamwe mu guhangana na coronavirus	"Mu gihe abahitanwa n'umugera wa coronavirus bagenda biyongera kw'isi, abashikiranganji bari bateranije i Addis-Abeba ku cicaro c'umuryango wa ibihugu vya Afrika bavuyeho bumvikanye  gukorera hamwe mu guhanahana amakuru be no gucungera uruja n'uruza. Gushika ubu, umuntu umwe gusa akomoka muri Misiri niwe amaze kumenyekana ko yanduye coronavirus ku mugabane wa Afrika, ariko na we nyene ubu yarakize. Tedros Adhanom Ghebreyesus, umukuru w'ishami rya ONU rijejwe amagara y'abantu kw'isi, OMS, yaribukije abari bakoraniye i Addis-Abeba ati: ""Ikituraje ishinga ni uko coronavirus itoshika mu bihugu atako vyifashe mu bijanye n'amagara y'abantu"". Ikigo ca Afrika kijejwe gukinga indwara kimenyesha ko ubu umugabane wa Afrika witeguye neza guhangana n'uwo mugera gusumba uko vyari bimeze haciye ukwezi. Muganga Tedros yanatangarije abari muri iyo nama ko John Nkengasong, arongoye ikigo kijejwe kurwanya indwara muri Afrika, hamwe na Samba Sow, arongoye ikigo kijejwe gukora imiti y'urukingo muri Mali, bagenywe nk'intumwa zidasanzwe mu kurwanya umugera coronavirus. Gushika ubu mu bihugu birenga 25 vya Afrika, hari abaganga barenga ibihumbi cumi bamaze kuronswa inyigisho, haratangwa n'ibikoresho vyo gupima, nayo ugucungera uruja n'uruza bikaba vyarakomejwe. Harashinzwe kandi n'umurwi w'abahinga karuhariwe muvyo ubuvuzi ujejwe gutabara mu buryo bwihuse cane mu gihe hogira umuntu amenyekana ko yanduye uwo mugera. Muganga Tedros yavue ko ishirahamwe OMS rifishe ishaka ryinshi ryo gukorana n'ibihugu vyose vya Afrika kugira ngo ibishoboka vyose bikorwe mu ntumbero yo kurwanya uwo mugera ruhonyabantu."	https://www.bbc.com/gahuza/51604183
religion	"Papa asaba ko haboneka inyishu ""ruhasha"" ku bihe mu butumwa kuri BBC yonyene"	"Mu butumwa bw'ijwi yahaye BBC yonyene, Papa François asaba abategetsi b'isi bazohurira  ku ndwi iza mu nama ya ONU  ku bihe i Glasgow (muri Ecosse), gutanga ""inyishu ziri n'ico zishikako"" ku vyihutirwa ku bidukikije no guha ""icizere gifadika"" abariko bararuka. Muri ubwo butumwa bwafatiwe amajwi i Vaticano  bugahabwa ikiganiro Thought for the Day ca Radio 4 ya BBC, Papa yagarutse ku bihanze isi birimwo ikiza ca Covid -19, ihindagurika ry'ibihe hamwe n'ibibazo vy'ubutunzi, aca asaba abarongoye isi kubitorera inyishu mu buryo bw'icerekezo n'ingingo ruhasha , kugira ""amahirwe"" atangwa n'ivyo bihanze isi ""ntatakare"". Umwungere wa Ekereziya Katorika yavuze ati: ""Duhangana n'ivyo vyugarije isi mu nzira za  nyamwigendako, kwigumizako ivyacu no gukoresha ivy'abandi, canke tukabibonamwo amahirwe nyayo y'impinduka"". Yagarutse ku kuba hakenewe ""ugusubira kwumva uruhara dusangiye rwo kwitaho isi yacu"", yongerako ati ""umwe wese muri twebwe - uwo ari we wese n'aho ari hose - ashobora kugira  ico aterereye mu guhindura inyishu ya twese ku ngeramizi zitari bwigere ziboneka  kw'ihindagurika ry'ibihe n'itituka ry'inzu dusangiye."" Papa mu mwanya uza aja kubonana na prezida wa Reta Zunze Ubumwe za Amerika Joe Biden. Imigambi ya Biden ku bijanye n'ibihe mu gihugu iwe iracari mu mayira abiri inyuma y'aho umugambwe wiwe wigirije inyuma gutora itegeko rigenda  integuro z'amafaranga yo gukoresha. Ubwo butumwa n'ubwibutsa ingene Papa François yashize imbere ibijanye no gukingira ibidukikije mu burongozi bwiwe bwa Ekereziya. Mu majambo ashikiriza, aramaze kugaruka kenshi ku kaga k'ibihe, mu 2015 akaba yasohoye ikete rya  Papa (enciclyque), ryitwa  Laudato Si' rishimikiye kuri ico kibazo. Muri iyo nyandiko inyito yayo yahinduwe mu zindi ndimi nka ""Ku kwitaho inzu dusangiye"" , yiyamirije ugusambura ibidukikije, yerekana ko hakenewe ingingo zofasha  kugabanya iryo hindagurika, aca yemeza ata guca hirya no hino ko ihindagurika ry'ibihe ahanini riterwa n'ibikorwa vy'umuntu. Iryo kete ryasohotse imbere y'uko haba inama ya ONU y'i Paris mu 2015, COP21, rikaba ryabonywe nk'iryagize ico rifashije mu gutuma abategetsi bashika ku masezerano. Inyuma y'imyaka itandatu, abategetsi b'isi bariko baritegurira gukoranira i Glasgow mu nama y'uyu mwaka, COP26. Mu gihe biguma bigaragara ko ivyiyemejwe i Paris bitariko birashikwako kugira  ukwiyongera kw'ubushuhe bw'isi ntikurenge 1.5C, ugereranije n'urugero rw'imbere y'uko hatagura amahinguriro,  Papa François yasubiye gushimika kuri ico kibazo  yizigiye ko ijambo ryiwe rizosubira kugira ico rifashije nka mbere."	https://www.bbc.com/gahuza/amakuru-59086779
religion	Papa Francis yemeye ko yananiwe kwihangana akubita urushi umukenyezi yariko amukwega	"Papa Francis yasavye imbabazi  inyuma y'aho akubitiye urushi ku kuboko umwe mu bakirisu bari mu rugendo rweranda bakoraniye ku kibanza citiriwe umweranda Petero i Roma. Papa yariko aramutsa abana n'abandi bari bakoraniye muri ico kibanza hanyuma agize ngo aragiye, umukenyezi umwe muri bo amukwega ukuboko n'inguvu nyinshi gushika n'aho ahakwa kumugwisha hasi. Ivyo vyatumye Papa ahindukira agerageza kumwikura vyanka, aca amukubita urushi ku kuboko ashavuye abona kumurekura. Niho mu nyuma Papa yemera ko vyanse ko yihangana aremera ko nawe nyene acumura nk'ikiremwamuntu nk'abandi. Ati: ""Kenshi biranka ko twihangana. Naje birashobora kunshikira. Nico gituma nsavye imbabazi ku vyashitse nijoro"". Ivyo vyatangaje benshi kuko imbere y'aho, mu gihe yashikiriza ijambo ry'ukwipfuriza umwaka mushasha abakirisu, yariyamirije ihohotera rikorerwa abakenyezi."	https://www.bbc.com/gahuza/amakuru-50970445
