category	headline	text	url
sports	"AFCON qualifiers: Bannayuganda 7 balondeddwa okugiramula. 
     Bannayuganda musanvu balondeddwa okulamula emipiira gya AFCON Qualifiers wakati wa 9 ne 17 Novemba era ng’amawanga agabbinkana galina okuzannya emipiira ebiri Nga bw’eri enkola, abalina okulamula ttiimu zino baasooka kulangirirwa nga ttiimu zino tezinnakwatagana..."		
health	"Abakulembeze bennyamivu olw’ebyobulamu mu Masaka. 
     Abakulembezze b’omu disitulikiti y’e Masaka balaze okutya olw’ebyobulamu ebisereba buli ddakiika era ne basaba gavumenti okusitukiramu ebeeko ky’ekolawo mu bwangu Bino Omubaka omukyala owa disitulikiti y’e Masaka, JoanNamutaawe n’omubaka wa Bukoto East, Ronald Evans Kanyike, baabyoogeredde mu kulambula amalwaliro okuli Kyannamukaaka Health Centre IV awamu n’amalwaliro amalala mu kitundu kino, gye baasanze nga tewali bikozesebwa ate awamu ng’abalwadde abakazi n’abasajja, bonna bajjanjabirwa mu waadi emu..."		
politics	"Bobi Wine : Omulamuzi Kisakye bamuyiganya lwa kuyimirira ku mazima. 
     Akulira ekibiina ki National Unity Platform, Robert Kyagulanyi Ssentamu (Bobi Wine) agamba nti okuyiganyizibwa okuliwo ku mulamuzi wa kkooti ensukkulumu Esther Kisakye biriwo lwakubaganba yayimirira ku mazima nasalawo okulwanirira Ssemateeka Kino kiddiridde olutalo lw’ebigambo okubalukawo wakati w’omuteesiteesi omukulu ow’essiga eddamuzi Pius Bigirimana n’omulamuzi Kisakye..."		
politics	"Gen Muntu asabye Muhoozi asooke awummule amagye bwaba ayagala okwenyigira mu by’obufuzi. 
     Akulira ekibiina ki Alliance for National Transformation(ANT) Gen Mugisha Muntu, asabye omuduumizi w’amagye g’oku ttaka Lt Gen Muhoozi Kainerugaba era mutabani wa Pulezidenti Museveni, awummule amagye bwaba ayagala okusigaza ekitibwa kye olwo ayingire eby’obufuzi Muntu okwogera bino abadde ayogerako eri bannamawulire ku bubaga bwa Gen..."		
politics	"Kyagulanyi aweze okulemesa Museveni okuggyawo okweyimirirwa ku bavunaanibwa obutemu. 
     Bannakibiina kya National Unity Platform (NUP) nga bakuliddwa Pulezidenti waakyo, Robert Kyagulanyi aka Bobi Wine, baweze okulemesa enteekateeka za Pulezidenti Museveni ne bannakibiina kya National Resistance Movement (NRM) abaagala abantu abavunaanibwa emisango gy’obutemu n’emirala eminene okubeera nti tebeeyimirirwa Bino we bijjidde ng’ababaka babiri okuli Allan Ssewanyana ne Muhammad Ssegirinya, bazzeemu okukwatibwa abeebyokwerinda oluvannyuma lw’okuyimbulwa ku kakalu ka kkooti ku misango okugezaako okutemula abantu n’obutujju..."		
sports	"Emipiira gy’Amasaza. 
     Empaka z’emipiira gy’amasaza gisembedde era nga gigenda kubeera ku kisaawe e Namboole nga 26th October 2019 Bulemeezi egenda kuzannya  ne Busiro mu mpaka ez’akamalirizo..."		
health	"Okugema Obulwadde bw’ekibumba, ‘Hepatitis B’. 
     Kaweefube azeemu wali mu  bimuli bya Bulange Ekitongole kya Kabaka Foundation kye kiwomyeemu omutwe mu kawefube ono ow’okugema obulwadde bw’ekibumba mu bimuli bya Bulange- Mengo era nga kaweefube ono wakumala ennaku bbiri mu bitundu bye Kampala  Abamu ku bantu abazze okugemebwa ku Bulange-MengoOwekitiibwa Hajji Amisi Kakomo Minisita wa Kabaka nga bamugema Hepatitis B Omwami Kaggwa Ndagala Edward, Ssenkulu wa Kabaka Foundation akubidde bana Uganda bonna omulanga okujjumbira enkola ey’okwekebeza awamu n’okwegemesa ekirwadde kino naddala abavubuka..."		
sports	"Bulemeezi awuumye nga Ssaabasajja Kabaka aggulawo empaka z’Ebika 2022. 
     Essaza lya Beene ery’e Bulemeezi liwuumye, Ssaabasajja Kabaka Ronald Muwenda Mutebi bw’abadde alabiseeko eri Obuganda nga aggulawo empaka z’emipiira gy’Ebika bya Buganda ez’omwaka 2022 mu kisaawe kya Kasana Luweero mu Bulemeezi Obwedda buli Omutanda wayita nga abantu bakwatiridde ku makubo era obwedda Empologoma ewalirizibwa okuvaamu natambuza ku bigere nga bwababuuzaako n’okubawuubira, olwo essanyu nerijula okubatta..."		
politics	"Owek. Mpuuga alabudde Ssaabaminisita Nabbanja ku kutiisatiisa aba Opozisoni. 
       Kampala  Akulira oludda oluvuganya mu Palamenti, Mathias Mpuuga, alabudde Ssaabaminisita Robinah Nabbanja, akomye okutiisatiisa ab’oludda oluvuganya naye abaleke bakole emirimu gyabwe Mpuuga bino yabyogeredde mu Kampala oluvannyuma lwa Ssaabaminisita Nabbanja okutegeeza nga gavumenti bw’etandise okunoonyereza ku bakulira obukiiko ku ludda oluvuganya gavumenti ababukozesa okufuna ssente mu bantu be banoonyerezaako..."		
sports	"Minisita Ssekabembe akunze abantu okwongera okugula emijoozi. 
     Minisita w’ebyemizannyo, okwewummuza n’abavubuka, Owek Henry Ssekabembe Kiberu, akunze abantu ba Ssaabasajja Kabaka okugula emijoozi gy’emisinde gya Kabaka Birthday Run egy’omwaka guno kisobozese kaweefube w’okulwanyisa akawuka ka Mukenenya okutambula obulungi..."		
politics	"Omuwagizi wa NUP attiddwa mu bukambwe. 
     Bya Jesse Lwanga Mukono Ebitalo bigudde mu bawagizi b’ekibiina kya National Unity Platform mu Mukono North, omu ku bannabwe eyali yabula okumala akaseera bwasangiddwa nga yafa omulambo gwe negusuulibwa mukibira kya gavumenti ekisangibwa e Kifu mu Kyampisi Abapoliisi nga batwala omulambo gwa Ssemakula Omugenzi ye Rogers Ssemakula ow’emyaka 36 nga mutuuze we Kiyunga nga kigambibwa nti yabadde akulira abavubuka ba Ghetto mukitundu kino..."		
politics	"AKAMYUFU KA NRM : Abaagala okwesimbawo balagiddwa okuwaayo wofiisi. 
       Kampala Ssaabawandiisi w’ekibiina ki National Resisitance Movement (NRM) Justine Kasule Lumumba, alagidde abakulembeze b’ekibiina abaagala okwesimbawo mu kamyufu okuwaayo wofiisi beewale okubeera nekyekubira Ssaabawandiisi Kasule Lumumba                                                  Bino Lumumba yabitadde bubaka obw’omunda (Internal Memo) bweyawereza abakozi b’ekibiina ku Lwokubiri nategeeza nti yeewunyizza okulaba nga abamu ku bakulembeze babadde bakyalemeddwa okuwaayo wofiisi zebalimu ate nga bakimanyi nti bagenda mu kalulu..."		
sports	"Ssewanyana wakuvuganya Magogo ku bwa FUFA pulezidenti. 
     Omubaka wa Palamenti akiikirira Makindye West, alangiridde  nti waakuvuganya Pulezidenti w’ekibiina ekiddukanya omupiira mu ggwanga ekya Federation of Uganda Football Associations (FUFA), Eng Moses Magogo ku kifo kino..."		
politics	"Museveni yasigala aneesiga wadde ensi yanneesamba – Gen Elwelu. 
       Kampala Amyuka omuduumizi w’eggye lya UPDF omuggya, Lt Gen Peter Elwelu, asiimye Pulezidenti Yoweri Museveni olw’okusigala ng’amulinamu essuubi n’amuwa obuvunaanyizibwa buno..."		
health	"DP: Tugenda kwasanguza era tuswaze ababulankanya eza COVID-19. 
       Kampala Ekibiina kyaDemocratic Party (DP) kirayidde okwasanguzaabakozi ba gavumenti ababulankanya ssente za COVID-19 ezirina okuyamba abantu mu mbeera ya COVID19 Bwe babadde boogerako eri bannamawulire, omwogezi w’ekibiina kino, Okoler Opio Lo Amanu, yategeezezza nti enteekateeka eno eruubirirwa okukunga bannayuganda okukyawa abalyi b’enguzi..."		
religion	"Owek. Mayiga atenderezza obuweereza bw’ Omulabirizi  Ssebaggala. 
         Katikkiro Charles Peter Mayiga atenderezza nnyo obuweereza bw’ Omulabirizi Rt Rev..."		
politics	"Ababaka  b’Acholi  baleeta  Hilary Onek ku bwasipiika. 
    Ababaka ba Palamenti abava mu kitundu kya Acholi  bakkiriziganyiza okuleeta omubaka w’ekitundu kya Lamwo, Hillary Onek okuvuganya ku kifo kya Sipiika  Onek mu kiseera kino ye Minisita w’ebigwa bitalaze, ensonda zitegeezezza  nti kino bakituuseeko mu lukiiko lwabwe lwe batuuzizza e Gulu gye baakungaanidde okuteekateeka okuziika kw’abadde Sipiika Jacob Oulanyah eyafiiridde mu ggwanga ly’Amerika ku Ssande..."		
politics	"NUP eyise Olusirika basalewo gwe banaawagira ku Bwasipiika. 
      Kampala Bannakibiina kya National Unity Platform(NUP), bayitiddwa mu lusirika Ssabbiiti ewedde okusalawo ani gwe banaasimbawo oba okuwagira ku Bwasipiika anaakubiriza Palamenti y’e 11 Abamu ku babaka abawangulira ku kkaadi ya NUP  Kino kibikkuddwa Omubaka John Baptist Nambeshe, omumyuka wa Pulezidenti w’ekibiina avunaanyizibwa ku buvanjuba bw’eggwanga, bw’abadde ayogerako eri bannamawulire ku kitebe kya NUP e Kamwokya..."		
business	"Obwakabaka bwakukwatagana n’ebibiina by’obweggasi okutumbula emmwanyi. 
     Obwakabaka bwa Buganda bwakukwatagana n’ebibiina by’obwegassi binnansangwa okwongera okutumbula ekirime ky’emmwanyi mu Buganda, kisobozese okuagoba obwavu mu bantu ba Buganda ne Uganda Katikkiro Mayiga n’ abeebitibwa wamu naba Masaka Cooperative Union Bino byogeddwa Kamalabyonna wa Buganda, Charles Peter Mayiga, bw’abadde asisinkanye ab’ekibiina ky’obwegassi ekya Masaka Cooperative Union mu Bulange e Mmengo leero ku Lwokubiri..."		
health	"COVID-19: Gavumenti Eyimirizza Bannayuganda Abakomawo Mu Ggwanga. 
     Abamu ku Bannauganda nga batuuka ku kisaawe Entebbe Gavumenti eyimirizza okudda kwa Bannayuganda abakonkomalidde mu mawanga amalala olw’ekirwadde kya Coronavirus Okusinziira ku kiwandiiko ekifulumiziddwa minisitule y’ensonga z’ebunaayira, okuva enkya nga July 4, teri muntu yenna agenda kukkirizibwa kuyingira ggwanga oluvannyuma lw’ebifo gyebakuumibwa biyite kalantiini okujjula..."		
religion	"Ssaabalabirizi Kaziimba akungubagidde Omulabirizi  Magezi. 
                   Kampala Ssaabalabirizi Stephen Samuel Kaziimba akungubagidde omulabirizi wa North Kigezi, Rt Rev Benon Magezi..."		
politics	"Abaali bawambibwa bazuuliddwa mu bibira e Masaka. 
     Bya Jesse Lwanga Abavubuka bataano abagambibwa okuwambibwa emyezi ebiri emabega ng’eggwanga ligenda okulonda bamaze ne bazuulibwa nga babasudde mu bibira by’e Masaka Kino kiddiridde ab’enganda z’abavubuka abawera 15 okutandika okwekalakaasa nga babanja abavubuka bano..."		
health	"Minisita Kiyimba akunze abantu beegemese Corona. 
      Busiro Minisita wa Buganda ow’ebyamawulire, Noah Kiyimba, akunze abantu okwegemesa ekirwadde kya Ssennyiga Corona nga balabira ku kabonero ka Nnyinimu Ssaabasajja Kabaka awamu ne Nnaabagereka Sylvia Nagginda Bino Owek..."		
religion	"Obubaka bwa Kabaka obw’ Amazuukira. 
    Twegatta ku bantu ba Katonda mwenna okujaguza Amazuukira ga Mukama waffe Yesu Kristu ag’omwaka 2021 Omwaka oguwedde, tetwasobola kwetaba ffena mu masinzizo, olw’embeera y’obulwadde bwa covid-19, obwasaanyalaza eggwanga lyonna mu bintu ebitali bimu..."		
politics	"Ababaka baagala  Ssaabawolereza Kiwanuka yeetonde olw’okuwakanya ekya gavumenti okuwamba abantu n’ n’okubatulugunya. 
     Abamu ku babaka ba Palamenti batadde Ssaabawolereza w’eggwanga Kiryowa Kiwanuka ku nninga nga baagala yeetondere eggwanga olw’okusaagira mu bulamu bwa bannansi awamu nokudaalira famire z’ abantu ababuzibwawo n’okutulugunyizibwa Ababaka bagamba nti Kiryowa Kiwanuka bweyali mu lukung’aana lw’ amawanga amagatte olw’omulundi ogwe 75 ku kutulugunya n’okutyoboola eddembe ly’obuntu yawakanya ekya gavumenti okubeera n’ebifo mwekuumira abantu abagiwakanya ebimanyiddwa nga ‘Safe House’ n’okutulugunya bannansi nga agamba si bituufu wadde nga akimanyi nti weebiri wano..."		
politics	"Bobi Wine alumbye Pulezidenti Museveni ku kuwagira okutulugunya bannansi. 
      Kyaggwe Akwatidde ekibiina kya National Unity Platform (NUP), Robert Kyagulanyi Ssentamu(Bobi Wine), alumbye Pulezidenti Museveni ku bigambo bye yayogedde ng’avumirira abeekalakaasa n’okubalabula obutakiddira Bobi Wine nga atabaala Nakifuma Kyagulanyi bw’abadde anoonya akalulu mu bitundu by’e Mukono ku Mmande, agambye nti aba NRM bapangisa abavubuka ne babagatta mu bawagizi baabwe okukola effujjo ku poliisi n’amagye okubavumaganya..."		
sports	"Munnayuganda  Cheptegei awangudde  zzaabu mu z’abasajja eza mmita 5000. 
       Munnayuganda omuddusi w’emisinde emiwanvu,Joshua Cheptegei, awangulidde Uganda omudaali gwa zzaabumu misinde gya mmita 5000 egibadde mu Olympic Stadium e Japan ku Lwokuna Cheptegeieyasooka okulemererwa okuwangula zzaabu mu misinde gya mmita 10000 bwe yatuuka ku kaguwa muddakiika 12:58:15 n’akwata ekyokubiri..."		
politics	"Dr Besigye akungubagidde  Gen Tumwine, asabye bannayuganda obutamusalira musango. 
     Akulira ekisinde ki People’s Front for Transition (PFT), Dr Kizza Besigye akungubagidde Gen Elly Tumwine eyafudde wiiki ewedde era nabasaba bannayuganda obutamusalira musango kwebyo ebyamusobako Okusaba kuno Besigye yakukoledde mu Kampala bweyabadde ayogerako ne bannamawulire ku Lwomukaaga..."		
health	"Abayizi 3855 be bafunye embuto mu muggalo e Luweero. 
     Luweero Abayizi 3855 be baakafuna embuto mu ttundutundu ly’e Luweero okuva Pulezidenti Yoweri Museveni lwe yaggala amasomero ng’agezaako okutangira ekirwadde kya Ssennyiga Corona ekyali kitandise okulonda mu bitundu by’eggwanga eby’enjawulo  Ettundutundu lya Luweero litwalira disitulikiti okuli; Luweero, Nakaseke ne Nakasongola naye ng’eno yonna abakugu bagamba nti omuze guno gususse..."		
politics	"Aba Bobi Wine balemeseddwa okukuba olukungaana e Gulu. 
     Tony Kitara okulira Wooteeri ya De Covenant olukungaana gyerubadde lugenda okubeera   URN Abawagizi b’omubaka wa palamenti akiikirira Kyaddondo ey’obuvanjuba ng’ono ayagala kuvuganya ku kifo kyamukulembeze w’eggwanga balemeseddwa okukuba olukungaana lwabwe e Gulu Okusinziira ku mubaka wa pulezidenti e Gulu, Maj..."		
politics	"Sodo awangudde omusango gw’okumumma kkaadi. 
      Kampala Kkooti enkulu mu Kampala esazizzaamu ekiragiro ky’ekibiina kya National Resistance Movement (NRM) olw’okugaana okuwa Sodo Aine Kaguta bbendera y’ekibiina gye yali awangudde mu kamyufu ka Mawogola North Sodo Aine nga ayogerako eri abawagizi be Omulamuzi Musa Ssekaana bw’abadde awa ensala ye ku Mmande, agambye nti kyali kikyamu akakiiko akakola ku kwemulugunya ne Ssaabawandiisi wa NRM okusazaamu obuwanguzi bwa Sodo nga beesigama ku nsala y’akakiiko eyalimu ebirumira..."		
politics	"Bobi Wine agamba eby’okukuza Muhoozi bamusembereza ntebe ya bwapulezidenti. 
      Akulira ekibiina ki National Unity Platform (NUP), Robert Kyagulanyi (Bobi Wine) agamba ekya Museveni okukuza mutabani we Lt Gen Muhoozi Kainerugaba namutuusa ku ddaala lya Genero omujjuvu kigendereddwamu kumusembereza ntebe ya bwapulezidenti Bino Kyagulanyi yabyogedde wakayita ssaawa busaawa nga Pulezidenti Museveni agobye mutabani we ku kifo ky’omudduumizi w’eggye ly’okuttaka wabula ate namukuza okufuuka Genero..."		
health	"Gavumenti erabudde abanaagingirira sitiika z’emmotoka. 
     Gen Katumba-Wamala Minisita avunanyibwa ku by’enguudo n’entambula Gen Edward Katumba Wamala alabudde abantu bonna banaagezaako okujingirira sitiika z’emotoka ezaagabiddwa abantu n’ebitongole eby’enjawulo abakkiriziddwa okusigala nga bazikozesa  Omukulembeze w’eggwanga Yoweri Museveni kuntandikwa ya ssabbiiti eno, yawera emmotoka zonna okutambula mu kaweefube w’okulwanyisa ensaasaana y’ekirwadde kya COVID-19..."		
sports	"Kabaka aggaddewo empaka z’emipiira gy’ebika by’abaganda e Buddu.. 
     Ssaabasajja Kabaka nga abuuza ku bazannyi b’omupiira gw’ebika by’aBaganda e Kkobe ne Mbogo mu kisaawe e Masaka mu Buddu  Omupiira guno gubadde wakati w’ekika ky’Embogo n’e Kkobe wali e Masaka mu Recration Ground..."		
religion	"Kabaka yeetabye ku mukolo gw’ennyimba z’Amazaalibwa ga Yesu Kristo. 
         Ssaabasajja Kabaka Ronald Muwenda Mutebi II asiimye okusanyusibwa abaweereza be okuva mu bitongole eby’enjawulo mu kivvulu ky’ennyimba z’amazaalibwa ga Yesu Kristo e Bulange -Mmengo akawungeezi konna ak’Olwokutaano Beene azze ne Nnaabagereka Sylvia Nagginda, Nnaabagereka Sylivia Nagginda, Nnaalinnya Lubuga Agnes Nabaloga, Omulangira David Kintu Wassajja ne Ssaabaganzi, nebaanirizibwa Katikkiro wa Buganda Charles Peter Mayiga n’abakungu abalala..."		
politics	"Nabillah Naggayi awangudde kkaadi ya NUP ku Bwaloodimmeeya. 
      Kamwokya Omubaka wa Kampala omukyala Nabillah Naggayi Ssempala, aweereddwa kkaadi y’ekibiina kya National Unity Platform (NUP) ku kifo ky’Obwaloodimmeeya bwa Kampala Omubaka Nabillah Naggayi Ssempala Leero ku Mmande, Nabillah akedde ku kitebe kya kibiina kya NUP okusunsulwamu era nga ono ne munne Hajji Kadra Ssali bwe babadde bavuganya balaze ebisaanyizo byabwe era bwekatyo akakiiko k’ekibiina ak’ebyokulonda nekasalawo kkaadi eweebwe Nabillah Naggayi Ssempala..."		
politics	"Kkooti egobye oguvunaanibwa Omubaka Wakayima Musoke. 
     Kkooti enkulu mu Kampala egobye omusango ogubadde guvunaanibwa omubaka wa Munisipaali y’e Nansana, Hannington Musoke Nsereko Wakayimanga gwekuusa kukuba nti talina buyigirize bumufuula mubaka wa Palamenti Eyavuganya ku kifo kino, Hamis Musoke Walusimbi yamutwala mu kkooti ng’agamba nti taweza bitabo ate nga n’amannya ge galina obutakwatagana..."		
politics	"Museveni alagidde ab’enganda z’abaaliko ba Pulezidenti basasulwe akawumbi. 
     Pulezidenti Yoweri Kaguta Museveni alagidde Minisitule y’abakozi ba gavumenti okuwaayo akawumbi ka Ssiringi za Uganda kamu eri buli famire y’eyaliko Pulezidenti w’eggwanga olw’eddimu lye baakola okukulaakulanya eggwanga Eyali muka Pulezidenti Obote, Miria Kalule Obote y’omu ku bagenda okuganyulwa mu kino Ekyama kino kibotoddwa Minisita omubeezi avunaanyizibwa ku bakozi ba gavumenti, David Karubanga, bw’abadde asisinkanye ababaka ba Palamenti okubategeeza ku kiragiro kino..."		
sports	"Ticket z’omupiira gw’Amasaza ogw’akamalirizo zituuse ku katale.. 
     Ticket z’omupiira gw’akamalirizo zituuse ku katale era nga zino zitongozeddwa minisita w’Obwakabaka bwa Buganda ow’ebyemizannyo Oweek Henry Sekabembe Kiberu..."		
sports	"Katikkiro Mayiga asisinkanye akulira ebikonde mu nsi yonna, asabye ebifo ebitendekebwamu ebikonde biddewo. 
      Katikkiro Charles Peter Mayiga alaze obwetaavu bw’okuzzaawo ebifo ebyo ebyatendekebwangamu abakubi b’ebikonde ebyali bitadde Uganda ku mutindo n’okumanyibwa munsi yonna Obubaka buno, Owek..."		
sports	"Cheptegei anoonya akawumbi 1.7 okumaliriza webatendekera abaddusi. 
             Munnayuganda eyawangulidde Uganda emidaali okuli ogwa zzaabu awamu ne ffeeza mu mpaka za Olympics eza 2020, Joshua Cheptegi, atongozza kaweefube w’okunoonya ssente eziwera akawumbi kamu n’obukadde 700 ( 17b) asobole okumaliriza ekifo ewatendekerwa abaddusi e Kapchorwa..."		
politics	"Ssentebe w’abavubuka e Ssembabule asattira lwa ssente za Museveni. 
      Ssembabule Ssentebe w’abavubuka mu disitulikiti y’e Ssembabule atuuyana zikala, olw’ebigambibwa nti aliko ssente ze yabulankanya nga zino zaali zaakuweebwa bavubuka ku byalo okusobola okunoonyeza Pulezidenti Yoweri Kaguta akalulu  Ssentebe w’abavubuka mu Ssembabule Bill Clinton Ssente ezireese leenya ziwera obukade asatu mu kamu mu emitwalo nsavu mu etaano mu enkumi biri (3175200) nga zino zaali zaakuweebwa ebyalo ebiwera 504 ebiri mu Ssembabule..."		
sports	"Omusumba Jjumba asabidde Buddu omukisa etwale ekikopo. 
     Omusumba w’essaza lye Masaka, Serverus Jjumba awadde ttiimu y’essaza lya Buddu omukisa esobole okuwangula Buweekula mu lumeggana lweb bagendamu ku Lwomukaaga luno okusalawo muwanguzi w’ekikopo ky’omwaka 2021 OmukisaOmusumba Jjumba yagubawadde ku Lwokubiri bwe yabadde asisinkanyeabasambi n’abakungu ba ttiimu eno okubasiibula n’okubawa omukisa ku kitebe ky’essaza lya Ekeleziya e Kitovu mu Buddu..."		
religion	"Ekisiibo kitandika nkya, Taraweeh yakusaalira waka. 
      Kampala Akulira Sharia mu ggwanga era omumyuka wa Mufti wa Uganda, Sheikh Muhammed Ali Waiswa,  akakasizza nti okusiiba omwezi Omutukuvu ogwa Ramadan kutandika nkya ku Lwokubiri April 13 Waiswa yategeezezza bannamawulire eggulo ku Ssande nti olw’okuba omwezi tegwalabise, ekisiibo kijja kutandika ku Lwokubiri..."		
politics	"Ssaabaminisita Nabbanja ne Minisita Onek batabaganye. 
     Ssaabaminisita Robinah Nabbanja ne Minisita w’ebibamba n’ebigwa tebiraze awamu n’abanoonyi b’obubudamu, Hillary Onek bakkirizza obutakkaanya bwabwe okubuteeka ebbali bakolere abantu Bano enzikiriziganya bagituuseeko ku Lwokuna era ne bakakasa mu maaso g’omumyuka wa Pulezidenti, Jessica Alupo nga bwe bagenda okukolera bannayuganda..."		
politics	"Obubaga bw’Amazaalibwa ga Muhoozi bikolwa byakulya mu nsi lukwe – Prof. Oloka. 
     Omusomesa w’ensonga z’amateeka ku Ssettendekero wa Makerere, Prof Joe Oloka-Onyango ategeezezza nti ebikolwa bya Lt..."		
business	"Gavumenti esabye ennyogereza ya obusse3.8, kuliko eza Buganda z’ebanja obuwmbi 26.3. 
      Minisitule y’ebyensimbi eyanjudde embalirira y’ennyongereza ya buse 38eri akakiiko ka Palamenti akakola ku mbalirira nga basaba ensimbi zino zibaweebwe emirimu gisobole okutambula..."		
health	"Abasawo  baddukidde mu Palamenti ku by’okubongeza emisaala. 
      Abasawo abayamba ku badokita awamu n’abazaalisa nga bayita mu kibiina ekibagatta ki ‘Federation of Uganda Nurses and Midwives’ beekubidde enduulu eri Palamenti nga baagala etunule mu nsonga y’okubongeza omusaala Ekiwandiiko ky’ abasawo bano kyanjuddwa omubaka wa Maracha East, Ruth Lematia nasaba olukiiko okutwala ensonga eno nga nkulu kuba abasawo basanga ebizibu bingi ku mirimu era bakole nekunsonga y’ abasawo abali mukugezesebwa..."		
health	"Bannabuddu beefumiitirizza ku Mukenenya. 
     Bya Muwuluzi Yusuf  Abantu ba Ssaabasajja Kabaka mu ssaza ly’e Buddu basisinkanye okwefumiitiriza ku ngeri ekirwadde kya Mukenenya gye kikosezzaamu abantu naddala abaliko obulemu Ppookino n’abamu ku baliko obulemu Bino byabaddewo eggulo ku lunaku lw’ensi yonna olw’ekirwadde kino era ng’ensisinkano eno yabaddemu ab’ekitongole kya MADIPHA ekiyambako abaliko obulemu naye nga mu kiseera kye kimu bawangaala n’ekirwadde kino n’okulaba bwe basobola okubulwanyisa..."		
politics	"Besigye : Sigenda kwesimbawo mu 2021. 
      Najjanankumbi Eyali pulezidenti w’ekibiina ki Forum for Democratic Change (FDC) Col Dr Kizza Besigye, agamba nti tagenda kwesimbawo ku bwapulezidenti mu kalulu ka 2021..."		
business	"Katikkiro Mayiga asabye Gavumenti okusoosowaza ebiyamba abantu okuva mu bwavu. 
      Katikkiro wa Buganda, Owek Charles Peter Mayiga, asabye gavumenti okussa ennyo essira kw’ebyo ebiyamba abantu okwejja mu bwavu era eyambe okutondawo emirimu kisobozese abaana abatikkirwa buli lukya okufuna emirimu..."		
politics	"AKAMYUFU KA NRM:  Eyeesimbyewo Bamusuulidde Ssanduuke y’Abafu. 
      Mitooma Abatuuze ku kyalo Rwakikambuzi mu Mitooma basattidde oluvanyuma lw’okukeera nga luggya lwa munnabwe eyeesimbyewo Arthur Kazoora nga musuliddwamu Ssanduuke y’abafu nga eriko ne ssente Ssanduuke eyasuuliddwa mu maka ga Kazoora Kazoora nga ayagala kukikirira Ruhinda South mu Palamenti, yategeezezza nti balirwana be bebamuyise ku makya ga leero ku Lwokubiri okulaba ekikolwa kino ekya Sitaani era nga kyabulogo..."		
health	"DP erabudde abagaana abatannagemebwa okuyingira mu bifo byabwe, bamenya mateeka. 
      Ekibiina ky’ebyobufuzi ekyaDemocratic Party (DP) kirabudde gavumenti, ebitongole ne kkampuni ezitandise okugaana abantu abatali bageme okuyingira mu woofiisi zaabwe, okweddako kuba kino kimenya mateeka Omuwabuzi w’ekibiina kya DP ku nsonga z’amateeka, Luyimbaazi Nalukoola ntibw’eba nga gavumentieyagala okukozesa kino okukunga abantu okwegemesa, balina okuddayo mu mateeka okunoonya we bayinza okwekwata..."		
sports	"Ssaabasajja Kabaka asiimye okulabikako eri Obuganda nga aggulawo  emipiira gy’Amasaza 2021. 
         Omumyuka owookubiri owa Katikkiro, Owek Robert Waggwa Nsibirwa ategeezezza nti Nnyinimu Ssaabasajja Kabaka Ronald Muwenda Mutebi II asiimye okulabikako eri Obuganda ku Lwomukaaga luno era aggulewo emipiira gy’Amasaza egy’omwaka guno 2021..."		
religion	"Ssekiboobo alagidde abasenze ku ttaka lya Buganda lye yawa ekkanisa okwewandiisa. 
     Bya Jesse Lwanga  Omwami w’essaza lya Ssaabasajja Kabaka ery’e Kyaggwe, Ssekiboobi Elijah Bogere Mulembya, alagidde abatuuze ku ttaka ly’Obwakabaka ery’e Nakanyonyi mu Mukono  okuwandiika bannanyini bibanja okusobola okumalawo embiranye wakati w’Obulabirizi bw’e Mukono n’abatuuze  Ssekiboobo okwogera bino abadde ku kyalo Nakanyonyi ekisangibwa mu ggombolola y’e Nabbaale mu disitulikiti y’e Mukono, okulaba ng’atabaganya abatuuze n’ekkanisa oluvannyuma lw’omulabirizi we, Mukono James Williams Ssebagala okwekubira enduulu ewa Katikkiro..."		
sports	"Abalina ebitone mwefubeeko – Katikkiro Mayiga. 
       Kamalabyonna wa Buganda Charles Peter Mayiga, asabye bannabyamizannyo okwerwanako batumbule ebitone byabwe, basobole okubifunamu ettutumu wamu n’ensimbi beekulaakulanye Katikkiro Mayiga, Shafic Kiwanuka ne Salim Uhuru  Owek..."		
business	"Abavuzi ba takisi bazinzeeko ekitebe kya KCCA. 
     Abavuzi ba takisi  ku KCCA  Abavuzi ba takisi abakolera mu ppaaka ya Usafi olwaleero zazinzeeko ekitebe kya KCCA mu Kampala okulaga obutali bumativu bwabwe olw’okubaawo bannabwe abakolera wabweru wa paaka  Bano bavunaana abakulira ekitongole kya KCCA okulemererwa okussa munkola ekiragiro kyabwe ekigaana takisi zonna ezikolera ku luguudo lw’Entebe okubeera mu ppaaka..."		
politics	"Katikkiro Mayiga avumiridde ekiwambabantu ekisusse. 
       Katikkiro Charles Peter Mayiga avumiridde ekiwambabantu ekisusse mu ggwanga era n’asaba abantu abawambibwa bakwatibwe mu bwerufu era bwe babaako omusango gwe bazza basimbibwe mu mbuga z’amateeeka Bino Katikkiro yabyogeredde mu Lukiiko lwa Buganda olwatudde ku Mmande bwe yabadde ayogera ku bigenda mu maaso mu ggwanga nga bw’eri enkola y’Olukiiko..."		
health	"Omuwendo gw’abakyala abalongoosebwa okuzaala gweraliikiriza – Alipoota. 
     Kampala Omuwendo gw’abakyala abalongoosebwa nga batuuse okuzaala guli waggulu nnyo n’ogwo ogwateekebwawo ekitongole ky’ensi yonna eky’ebyobulamu, ekimanyiddwa nga ‘World Health Organisation (WHO)’ Minisita w’ebyobulamu ebisokerwako Kaducu Okusinziira alipoota efulumizibwa Minisitule y’ebyobulamu buli mwaka, ekitundu kiramba ku bamaama abatwalibwa mu malwaliro g’obwannannyini okuzaala, balongoosebwa..."		
