politics	Nigeria population: Buhari tako ọmọ bẹẹrẹ òṣì bẹẹrẹ ní Nàìjíríà, ó ṣàgbékalẹ̀ ètò láti dẹ́kun rẹ̀	Aarẹ Muhammadu Buhari ti ṣe agbekalẹ eto ti yoo ṣe adinku ọmọ bẹẹrẹ oṣi bẹẹrẹ lorilẹede Naijiria. Buhari to ṣe agbekalẹ eto naa niluu Abuja sọ pe o ṣe pataki bayii lati mu ifeto sọmọ bibi lọkunkundun. Buhari tun ṣe agbekalẹ eto mii ti yoo ṣe iranwọ lori ati dẹkun bi awọn eeyan ṣe n pọ sii ni Naijiria. Buhari ṣe agbekalẹ eto ifeto sọmọ bibi Aarẹ Buhari ṣalaye pe ohun to bi eto ifeto sọmọ bibi wa ni lati mu ibayegbadun ba awọn ọmọ Naijiria. Buhari ni eyi wa lara awọn eto ijọba ẹgbẹ oṣelu APC to wa lode bayii. Eto yii yoo ṣe iranwọ lori bi adinku yoo ṣe ba bi ọpọ eeyan ṣe n bi ọmọ silẹ lọpọ yanturu. Ara awọn ọna ti ijọba fẹ gba lati ṣe eto ọhun ni nipa ilanilọyẹ lori ifeto sọmọ bibi. Aarẹ Buhari gbagbọ pe eto yii yoo ran ọpọ eeyan lọwọ lati fi alafao si aarin awọn ọmọ wọn. Buhari kọminu lori bi Naijiria ṣe pọ julọ l'Afrika Aarẹ Buhari ni orilẹede naijiria lo pọ julọ nilẹ Afirika nigba to tun jẹ orilẹede to wa ni ipo keje lagbaye. Buhari ni Naijiria wa lara awọn orilẹede diẹ lagbaaye to ni ọdọ julọ. Aarẹ ni ida mejilelaadọrin ninu ọgọrun awọn ọdọ yii ni ọjọ ori wọn ko to ọgbọn ọdun. Bakan naa ni Buhari sọ pe idaji awọn obinrin ninu awọn ọdọ yii lo wa ni asiko ti wọn ṣe abiamọ tori ọjọ ori bẹrẹ lati ọdun mẹẹdogun si ọdun mọkadinlaadọta. Ọna abayọ si ọmọ bẹẹrẹ oṣi bẹẹrẹ Buhari ni ijọba ko ni dẹkun lilo eto ẹkọ to peye lati maa la awọn eeyan lọyẹ. Aarẹ ni eto ẹkọ yoo ṣe iranwọ papaa julọ fawọn obinrin to ba jẹ ọmọde tori awọn ni wọn le gboyun nigba kugba. Buhari tun sọ pe eto ikaniyan to n bọ yoo tun ṣe iranwọ lati mọ ọna lati mu adinku ba ọmọ bẹẹrẹ oṣi bẹẹrẹ. Ni bayii, akọsilẹ fihan pe eeyan to wa ni Naijiria le ni ẹgbẹrun lọna igba eleyii yoo si tun pọ sii lọjọ iwaju.	https://www.bbc.com/yoruba/afrika-60226802
sports	Sadio Mane: Wọ́n ti fi orúkọ̀ agbábọ́ọ̀lù Liverpool sọ pápá ìṣeré kan ní Senegal	"Olootu ijọba ni ẹkun Sedhiou, lorilẹ-ede Senegal, ti ṣetan lati fi orukọ ongbatarigi agbabọọlu ẹgbẹ Liverpool, Sadio Mane, sọ papa isẹre to wa ni ẹkun naa. Agbabọọlu naa lo gba goolu pẹnraiti sinu awọn lasiko ti Senegal koju Egypt ni aṣekagba idije AFCON 2022 to sẹṣẹ pari, eyi to mu ki wọn o jawe olubori. Ami ayo mẹrin si meji ni Terenga Lions ti Senegal  fun Egypt. Igba akọkọ si re e ti orilẹ-ede naa gba ife idije AFCON. Olooru ijọba ni Sedhiou, Adboulaye Diop, sọ pe oun pinnu lati fi orukọ Mane sọ papa iṣere Sate de Sédhiou, lati fi ẹmi imoore awọn ọmọ bibi agbegbe naa han si ""ọkunrin to n fi igbe aye rẹ sin ọmọniyan"". ""Sadio Mane tọ si pe ka bu ọla fun un"". Asiko diẹ sẹyin ni Mane di aayo lọkan ọpọ miliọnu eeyan ni ilu abinbibi, nigba to jẹjẹ owo lati fi kọ ileewosan ati ile ẹkọ fun wọn. O tun da owo si kikọ awọn mọṣalaaṣi, to si tun fun ijọba lowo lati gbogun ti ajakalẹ aarun Covid-19. Yatọ si eyi, Mane tun pin aṣọ ẹgbẹ agbabọọlu Liverpool fun awọn ara ilu abinibi rẹ, Bambali, ki wọn o ri nkan wọ lasiko aṣekagba idije Champions League ni oṣu Karun-un, ọdun 2018. Lẹyin ti ikọ ẹgbẹ agbabọọlu Senegal bori ni Afcon lorilẹ-ede Cameroon, Mane sọ pe bi oun ṣe gba akọkọ ife ẹyẹ idije naa fun Senegal, jẹ aṣeyọri to tobi ju ninu irinajo oun gẹgẹ bi agbabọọlu."	https://www.bbc.com/yoruba/ere-idaraya-60366729
entertainment	Tope Alabi ṣe ọjọ́ ìbí, Adeyinka Alaseyori kọrin re kìí	"Oniruru ọrọ ikinni lawọn eeyan ti bẹrẹ si n fi ṣọwọ si gbajugbaja olorin ẹmi, Tope Alabi lati sami si ayẹyẹ ọdun mọkanlelaadọta rẹ loke eepẹ. Lara awọn eeyan jankan to n ṣe ayẹsi Tope Alabi ni Adeyinka Alaseyori to jẹ ki orin ""Oniduro"" di gbajumọ. Alaseyori fi ikinni naa ranṣẹ si Tope Alabi loju opo Instagram ati Facebook rẹ. O ni ""Ẹku ayẹyẹ ọjọ ibi yin o maami, ẹ ṣeun ti ẹ gba lati jẹ ohun ti Ọlọrun fẹ ki ẹ jẹ, ayọ yin ṣẹṣẹ bẹrẹ ni, ẹku oriire naa."" Ti ẹ ko ba gbagbe, ninu oṣu Kẹfa ọdun yii ni fidio kan gbode lori ayelujara, nibi ti Tope Alabi ti n bu ẹnu atẹ lu orin Oniduro, eyii to sọ Alaseyori di gbajumọ olorin ẹmi. Ninu fidio ọhun ni Tope Alabi ti sọ pe Ọlọrun kii ṣe oniduro toun. Tope Alabi sọ siwaju si ninu fidio naa pe ti eeyan ba kọ orin ẹmi, o yẹ ko maa gba imisi lati ọdọ ẹmi mimọ ko to gbe orin jade. O fikun pe ti akọrin ba tun gba imisi lati ọdọ ẹmi mimọ naa tan, o yẹ ko maa fi ọgbọn ori gbe orin kalẹ. Ọrọ naa bi ọpọ ọmọ Naijiria ninu to bẹẹ ti ọpọ fi n sọ pe ẹtanu lo mu ki irufẹ ọrọ bẹẹ jade lati ẹnu Tope Alabi si olorin to ṣẹṣẹ n bọ lẹyin rẹ. Lẹyin ti fidio ọhun jade tan ni awọn eeyan bẹrẹ si n bu ẹnu atẹ lu Tope Alabi lori ayelujara, paapaa lojo opo Facebook ati Twitter, koda wọn ko jẹ ki oju opo Instagram rẹ sinnmi pẹlu. Bo tilẹ jẹ pe ọpọ eeyan lo n reti ọrọ ti Alaseyori yoo sọ lori fidio Tope Alabi naa, ọrọ kankan ko jade lẹnu rẹ titi to fi sọ pe bii iya ni Tope Alabi jẹ si oun. O ni ""Iya wa ni Tope Alabi, bii iya lo si jẹ si gbogbo wa, a si ti di alabukun fun lati inu iṣẹ iranṣẹ rẹ...."" Ẹwẹ, lasiko ti rogbodiyan naa n lọ lọwọ ni ẹni gan to kọkọ gbe orin Oniduro naa jade, Tolulope Adelegan sọrọ soke lori orin ọhun ati igbesẹ to gbe lẹyin ti orin naa sọ Alaseyori di gbajumọ. Adelegan ṣalaye fun BBC Yoruba pe lootọ, oun lo kọkọ gbe orin naa jade, ṣugbọn ẹmi mimọ lo ni ki oun dakẹ lẹyin ti orin naa sọ Alaseyori di gbajumọ, ti ọpọ si lero pe Alaseyori lo ni orin ọhun."	https://www.bbc.com/yoruba/59066958
health	Coronavirus Cases in Africa: Gomina Makinde gbàlejò àwọn Imam lásìkò àrùn Coronavirus	Ọpọlọpọ awuyewuye ti tẹle igbesẹ Gomina ipinlẹ Oyo, Seyi Makinde to pe awọn imaamu ni ipinlẹ Ọyọ fun ayẹyẹ Iftar. Irọlẹ Ọjọru ni ayẹyẹ Iftar naa pẹlu awọn Alfa ati Imaamu waye ni Ile Ijọba Ipinlẹ naa. Ninu atẹjade ti Adari ikọ Iroyin Gomina Seyi Makinde, Taiwo Adisa fi lede fihan pe kii ṣe igba akọkọ ni yii ti gomina naa n ṣe ayẹyẹ yii. Adisa fikun wi pe o da oun loju wi pe ayẹyẹ ohun koni tako ofin yiyagofunraẹni ati wi pe ti awọn eniyan naa ba pọju mẹwa lọ, awọn yoo wa n kan ṣe si. Amọ awọn Ẹgbẹ́ àwọn Imam, the Joint Action Committee for the Preservation of the Rights and Honours of Imams tako àyẹyẹ naa. Adari ẹgbẹ awọn Imaamu naa, Abu Muhammad ni Gomina naa takọ ofin ijọba apapọ lori yiyago funraẹni ti ijọba apapọ gbe kalẹ lati koju itankalẹ arun Coronavirus to n ja rain lorilẹede Naijiria. Abu Muhammad si kesi awọn imaamu ati Alfa ti gomina naa pe wi pe ki wọn ma da gomina naa lohun lasiko yii fun anfaani ara wọn. Oludari agba fun ajọ iṣakoso okoowo ẹkun iwọ oorun gusu Naijiria, DAWN, Ṣẹyẹ Oyelẹyẹ ti jẹ ko di mimọ pe ikọ alaabo ẹkun naa ti ọpọ mọ si Amọtẹkun ko ku o, bẹẹni ina rẹ ko parun. Ọgbẹni Ṣẹyẹ Oyelẹyẹ ṣalaye pe ko sohun meji to n da ibẹrẹ iṣẹ iks naa duro lawọn ipinlẹ ju wahala ajakalẹ arun coronavirus to gba aye kan bayii. O fi kun un pe ko si ipinlẹ kọkan lara awọn ipinlẹ to wa lẹkun naa to pẹlyinda si afẹnuko lori idasilẹ ikọ ọhun. Amọtẹkun jẹ ọkan lara awọn eto ti awọn ijọba ipinlẹ lẹkun iwọ oorun gusu Naijiria gbe kalẹ lati koju oniruuru ipenija ọrs to n doju kọ awọn eeyan nibẹ. Ọkanojọkan ifojusọna lawọn eeyan si ti ni lori ohun ti yoo tẹyin rẹ jade paapaajulọ pẹlu mọhurumọhuru awọn fulani darandaran kan lẹkun naa. Amọṣa lẹyin ti ọrọ ikọ naa ho ṣukuṣuku fun igba diẹ lo ba da wai, eleyi to ti nkọ ọpọ lominu pe ṣe kii ṣe pe ohun naa, gẹgẹ bi ọpọlọpọ eto ijọba miran ti fori ks igbo. Nibayii naa, ipinlẹ meji lo ti gbe igbimọ isakoso kalẹ fun ikọ naa ni ipinlẹ koowa wọn. Ipinlẹ Ọṣun ati Ekiti ti gbe igbimọ kalẹ gẹgẹ bi itẹsiwaju igbesẹlẹyin ti gbogbo awọn ipinlẹ naa ti kọkọ buwọlu ofin Amọtẹkun ki wahala ajakalẹ arun coronavirus to wọle de	https://www.bbc.com/yoruba/afrika-52613574
sports	Chichi Igbo: Ọ̀pọ̀ máa ń rò pé mo ní nǹkan ọkùnrin lábẹ́ torí ìrísí mi jọ ti ọkùnrin	Ọkan lara awọn ọmọ ẹgbẹ agbabọọlu lobinrin fun orilẹede Naijiria, Super Falcons, to ti fẹyin ti ni Chichi Igbo jẹ. Ọdun mejidinlogun si lo fi gba bọọlu, ko to fẹyin ti Chichi ni isan, idi ati egungun lile ju awọn ọkunrin miran lọ , ti irisi rẹ ko si yatọ si tawọn ọkunrin amọ obinrin ni. Nigba to n ba BBC sọrọ lori oju ati ohun ti awọn eeyan awujọ n sọ nipa rẹ, Chichi ni ọpọ eeyan lo ti fi ẹnu pa oun lai tii ku. O wa koro oju si awọn ọrọ ibajẹ ti ọpọ eeyan maa n sọ nipa rẹ nitori pe irisi rẹ jọ ti ọkunrin. O si gba awọn eeyan nimọran lati lati ye pa awọn eeyan nipa ọrọ ti wọn ba kọ lawọn oju opo itakun agbaye.	https://www.bbc.com/yoruba/afrika-53372798
entertainment	Ronke Oshodi Oke: Ronke Oshodi Oke ṣe ìdárò ọmọ rẹ̀ tó di olóògbé	"""Ọmọ mi ọ̀wọ́n, àkọ́bi mi, ọ̀rẹ́ mi àti gbogbo ǹkan ti mo ni, Oluwabunmi Akinleye ọdun kẹwàá rèé tí o ti fi mi sílẹ̀"" Èyí ni ọ̀rọ̀ idaro ti gbajúgbajà òṣèré tiata, Ronke Ojo tí gbogbo ènìyàn mọ̀ sí Ronke Oshodi Oke kọ nipa ọmọ rẹ̀ tó di olóògbé. Ronke Ojo ló gbé fótò ọmọ rẹ̀ síta pé, ó ti le ni ọdún mẹ́wàá tí ikú ti wọle mú àkọ́bí òun lọ. Láti àsìkò yìí ni ọ̀pọ̀ àwọn olọ́lùfẹ́ Ronke Ojo ti fọ́n sórí ayélujára láti ba kẹ́dun ikú ọmọ rẹ̀ tó d'olóògbé. Bó tilẹ̀ jẹ́ pé Ronke Oshodi Oke kò sọ ǹkan tó ṣokùnfa ikú ọmọ náà, sùgbọ́n ìwé ìròyìn kan sọ pé àìsàn jẹjẹrẹ inu egungun ló paá. Ẹni kan tó fẹ́ ká forúkọ bo òun láṣírí sọ pé, ẹni ọdún mọ́kàdínlọ́gbọ̀n ni Bunmi lásìkò tó papò dà, tó si máa n ṣe bi amúgbálẹ́gbẹ̀ẹ́ fún Ronke Ojo lásìkò náà. Ìròyìn náà fi kun pé, tí ènìyàn bá ri bi ọmọbinrin náà ṣe sún mọ́ òṣèré náà tó, ọ̀pọ̀ ni yóò rò pé, ọmọ tàbi àbúrò rẹ̀ ni lóòtọ́. Wọn ni ní ǹkan bi ọdún mọ́kànlá sẹ́yìn ni Bunmi ni ààrun jẹjẹrẹ inú egungun, èyí sì ló mú kí ọ̀pọ̀ àwọn òṣèré tíátà lásìkò náà bẹ̀rẹ̀ ìpolongo láti kówó jọ fún, kí wọn le gba ẹ̀mí rẹ̀ là. Àṣẹ̀yìn wá àṣẹ̀yìn bọ̀, Bunmi ko rí ìjà náà jà lájàyè, tó sì gbé ẹ̀mí mì lọjọ kọ̀kanlá oṣù kẹrin ọdún 2011 ni ilé ìwòsàn UCH Ibadan, níbi tó ti ń gba ìtọ́jú. Ọ̀pọ̀ àwọn olólùfẹ́ Ronke Ojo ló n ṣeléde lẹ́yìn ọmọ náà, díẹ̀ lára ìkíni wọn rèé."	https://www.bbc.com/yoruba/afrika-56708271
entertainment	Ikú tún ṣọṣẹ́! Àgbà òṣèré Yorùbá míì ti dágbére fáyé!	Bo ṣe n tẹ wa lọwọ bayii ni pe ọkan lara awọn agba oṣere fiimu Yoruba, Olaniyi Raji ti ọpọlọpọ mọ si “Baba Atọli” ti dagbere faye. Ọkan lara awọn oṣerebinrin to ni ajọ kan to fi n ṣetọju awọn agba oṣere lo fi ikede yii sita ni Ọjọbọ loju opo ayelujara rẹ. Ninu atẹjade rẹ lo ti fi fọto Baba Atoli sita pẹlu akọle to kọ pẹlu rẹ pe “Ibanujẹ lo jẹ pe a padanu Baba Atoli, ibanujẹ gbaa ni eyi”. Awọn akẹgbẹ wọn naa ti n fi ọrọ ikẹdun sita lọlọkanojọkan lori ayelujara to fi mọ ẹbi ati ojulumọ oloogbe. Ṣaaju iku rẹ, Baba Atoli fi ọrọ sita lori fidio kan to ti n tọrọ fun aanu ati iranlọwọ lati tọju ailera to n koju.	https://www.bbc.com/yoruba/articles/ce9ez3m5empo
entertainment	Nkechi Blessing: Gbajúgbajà òṣèré ní ó sàn fún òun láì tíì lọ́kọ báyìí ju kí òun lọ́kọ láì láyọ lọ	Gbajugbaja oṣere tiata Yoruba, Nkechi Blessing tun ti ja gudugbẹ ọrọ mii lẹyin to sọ pe o san fun oun lai tii lọkọ bayii ju ki oun ti ṣe igbeyawo lọ. Nkechi to sọrọ yii lori ayelujara ṣalaye pe o san fun oun ki oun ni ayọ lai tii lọkọ ju ki oun wa lọọdẹ ọkọ pẹlu inanujẹ ọkan lọ. ''Ẹyin omugọ ti ẹ n pariwo ẹnu pe ki n lọ ṣe igbeyawo, ti o ba ka yin lara, ẹ wa fi ipa mu mi ki ẹ si sin mi lọ si ile ọkọ,'' Blessing lo sọ bẹẹ. Gbajugbaja oṣere ọhun to awọn eeyan ko mọ ẹnikan ni pato gẹgẹ bi ọrẹkunrin ṣalaye pe ko si ohun to buru ninu ki eeyan maa ti lọ sile ọkọ ni wọn igba to ba ti layọ. Laipẹ yii ni Blessing tun sọ fawọn akọroyin pe ikebe ti Eleduwa fi jinki oun tobi ju ohun ti oun le dọwọ bo lọ. O ni gbogbo eeyan lo mọ pe Ọlọrun pari iṣẹ si ẹyin oun, o ni awọn to ni ipenija oju kan to ba sun mọ oun le mọ bi ikebe oun ṣe tobi to. Gbajugbaja oṣere naa ni o jẹ iyalẹnu fun oun pe awọn kan n sọ kaakiri wi pe oun maa n ju idi oun fun ṣe ki a ri mi ṣugbọn o sọ pe ọrọ ko ri bẹẹ rara. Blessing ni aṣiṣe nla lawọn to n sọ pe oun ju idi kiri ki awọn aye le maa sọrọ ṣe nitori iṣu Ọlọrun ti ko ṣe fọwọ bo ni ikebe naa jẹ foun. O tun mẹnu idi ti o fi n gbaruku ti Laycom nile Ẹlẹgbọn Agba iyẹn Big Brother Naija. Gbajugbaja oṣere Yoruba naa ni ọlọpọ pipe ni Laycom, eyi lo jẹ ki oun maa dibo fun un.	https://www.bbc.com/yoruba/afrika-54498689
entertainment	Bolaji Amusan: TAMPAN ń ṣiṣẹ́ lórí 'minimum wage àti insurance' òṣèré báyìí- Mr Latin	Ọpọ́ àwọn  tó n tọrọ owọ lori ayelujara  ni ẹgbẹ́ àti 'indicvidual'ti ràn lọ́wọ́- Latin Aarẹ ẹgbẹ awọn oṣere ni Naijiria, Bolaji Amusan ti ọpọ mọ si Mr Latin gablejo BBC Yoruba. Nibẹ lo ti sọrọ ni kikun lori pe awọn oṣere kọọkan n tọrọ owo lori ayelujara nigba ti wọn ba wa ninu iṣoro. O mẹnuba ipa ti ẹgbẹ n ko lati ran awọn oṣere lọwọ. Bakan naa ni Mr Latin tun sọ nipa pataki ṣiṣe sinima ti yoo kọ awon eeyan lẹko ati pataki jijẹ ọmọluwabi gẹgẹ bi oṣere ni eyi ti ẹgbẹ fi n kọ won ni TAMPAN. O tun sọrọ lori bi onikaluku ṣe n na owo rẹ lọtọọtọ pe oriṣii nakn to wu onikaluku lo n na owo rẹ si lawujọ. O menuba ipa ti ẹgbẹ n ko lori eto adojutofo ati owo sisan fun awon oṣere.	https://www.bbc.com/yoruba/64023795
religion	Mbaka missing: Father Ejike Mbaka ti ṣí aṣọ lójú àwọn tó sọ ọ́ dàwátì	"Gbajumọ oluṣọaguntan ijọ aguda nipinlẹ Enugu, Ẹniọwọ Ejike Mbaka ti ọpọ mọ si Fada Mbaka ti ṣalaye awọn to wa nidi bo ṣe di awati fun ọjọ meji. Nigba to n ba awọn olujọsin ijọ rẹ sọrọ nileejọsin Adoration ministries ni Umuchigbo Nike nilu Enugu, Fada Mbaka ṣalaye pe awọn alaṣẹ daosisi ijọ Aguda nilu Enugu lo wa nidi bi oun ṣe dawati. O ni Bisọbu agba ijọ aguda nibẹ lo pe oun sibi ipade kan, ibẹ si ni wọn ti fi oun si abẹ ahamọ. O ni ara ẹsun ti wọn ka si oun lẹsẹ̀ ni pe oun gbadura fun Nnamdi Kanu, aṣiwaju ẹgbẹ agbesunmọmi IPOB. Gẹgẹ bi o ṣe sọ fawọn ọmọ ijọ rẹ, ọgbọn ọjọ ni wọn gbero lati fi fi oun si ahamọ ki o to di pe awọn ọmọ ijọ rẹ pariwo sita ti wọn fi tu oun silẹ. Fada Mbaka ṣalaye pe oun ti wọn sọ fun oun ni pe oun yoo wa lahamọ fun oṣu kan fun oun lati gbadura ki oun si ṣe aṣaro lori iṣe oun. O ni oun rọ wọn lati fun oun laaye lati ba awọn eeyan ijọ oun sọrọ ki oun si ti ilẹkun ileejọsin naa ""ṣugbọn wọn ni rara, ẹ gbami laaye lati ṣe isin oni fun awọn olujọsin ijọ mi, mi o tilẹ ni sọ fun wọn pe mo wa labẹ ibawi, wọn ni rara. Maa kan sọ fawọn ọmọ ijọ mi ni pe mo n lọ fun adura ọlọgbọn ọjọ, a o pada wa gbogbo wa yoo si bọwọ fun gbogbo nnkan ti wọn ba sọ, wọn ni rara"" O ni oun tilẹ bẹ wọn pe ki wọn gbe iranṣẹ Ọlọrun miran lọ si ijọ naa, sibẹ wọn kọ ni. Ni Ọjọru ni okiki kan nigba tawọn ọmọ ijọ Adoration ministries ti Fada Mbaka n ṣe oluṣọaguntan fun wọde nilu Enugu ti wọn si n pariwo pe ki wọn ba awọn wa Fada Mbaka ti wọn ji gbe. Ninu ọrọ rẹ, Fada Mbaka ni awọn oṣiṣẹ ileeṣẹ agbofinro DSS kọ lo gbe oun gẹgẹ bi awọn eeyan kan ṣe ro. Wọn ti ri ojiṣẹ Ọlọrun, Fr Ejike Mbaka. Ṣaaju ni iroyin jade pe alufaa naa to ni ijọ Adoration Ministry nilu Enugu ti di awati fun bi ọjọ meji. Iṣẹlẹ yii n waye lẹyin ọjọ diẹ ti Mbaka pe ki Aarẹ Muhammadu Buhari fi ipo silẹ nitori bi eto aabo ṣe ri ni Naijiria. Bi iroyin ṣe jade pe wọn ko ri Mbaka, ni awọn alatilẹyin rẹ ti tu jade fun iwọde lọ si ile Olori alufaa ijọ Aguda nilu Enugu. Botilẹ jẹ pe a ko ti i le sọ nkankan nipa bi alufaa naa ṣe pada si ilu tabi ibi to ti n bọ, tilu-tifọn, tijo tayọ ni awọn eeyan fi pade rẹ. Awọn to wa ni ayika alufaa naa sọ pe o ti le ni ọjọ meji ti awọn ti ri Mbaka gbẹyin. A gbọ pe o dagbere fun to sunmọ pe pun n lọ si ile Alufaa Agba ijọ Katoliliiki ni ẹkun Enugu, ṣugbọn wọn ko ri i lati igba naa. Fr Mbaka kọ ẹ̀yìn sí Buhari nítorí kò rí nǹkan jẹ lábẹ́ rẹ̀ - Iléeṣẹ́ Ààrẹ Fr Mbaka, ọmọ ìjọ rẹ̀ kọ̀lu akọ̀ròyìn BBC, wọ́n lù wọ́n ní àlùdojúbolẹ̀ Lasiko ti BBC ṣe abẹwo si inu ọgba ijọ rẹ, Adoration Ministry, niṣe ni eero pe jọ sibẹ, ti wọn si n beere pe nibo ni Father Mbaka wa. Ṣugbọn, BBC ko ti i le sọ ni pato boya wọn ji alufaa naa gbe lọ ni, boya o farapamọ ni tabi wa ni ọdọ awọn agbofinro. Bakan naa ni awọn alaṣẹ ijọ Aguda nilu Enugu sọ pe awọn ko ti i gbọ nipa iṣẹlẹ naa. Alufaa kan to sunmọ Mbaka naa sọ pe oun ko gbọ nipa didi awati rẹ, ṣugbọn ko gbe ipe oun si ori ẹrọ ibanisọrọ rẹ. Iṣẹlẹ yii si ti mu ki awọn ọmọ ijọ rẹ bẹrẹ iwọde."	https://www.bbc.com/yoruba/afrika-56998652
health	Toddlers fed spiked Crackers: Olùdarí 'Daycare' tàwọn ọmọdé mẹ́ta tí jẹ bisikíítìi tí wọn fí igbó sí yóò fojú bá ilé ẹjọ́	Alakoso Daycare kan ti awọn ọmọ kekeeke ti jẹ bisikiiti ti wọn yi igbo mọ, lawọn ọlọpaa ti fẹsun ṣiṣe ika fọmọde kan nilu Virginia l'Amẹrika. Ọrọ yii jẹyọ ninu atẹjade kan ti ẹka ileeṣẹ ọlọpaa agbegbe Stanford ni orileede Amẹrika fi sita. Gẹgẹ bi wọn ṣe sọ, ni oṣu Kẹta ọdun yii ni ọlọpaa dahun si ipe kan ti wọn ni ki wọn wa wo nkan to n ṣẹlẹ ni ile iwosan Strafford. Ni ile iwosan naa, wọn lawọn ri awọn ọmọde mẹta kan ti ọjọ ori wọn ko ju ọdun kan lọ. Nkan taa si gbọ ni pe awọn obi wọn gbe wọn lọ si ile iwosan lẹyin ti wọn ri pe oju awọn ọmọde yi n pọn, ti wọn si n fa tikọ tikọ. Awọn dokita ile iwosan ṣalaye fawọn agbofinro pe awọn ri ẹri pe awọn ọmọ yi ti ni alabapade eroja  oogun oloro taa mọ si tetrahydrocannabinol. Lati le mọ ibi ti ọrọ ti wọ wa, iwadii ranpẹ fihan pe ile itọju Daycare kanna lawọn ọmọ mẹta yi jijọ n lọ. Kete ti wọn gbọ ọrọ yi ni wọn yan ọlọpaa kan lati pada lọ si itọju Daycare ọmọde ti wọn ti gbe awọn ọmọ naa wa si ile iwosan. Nibẹ ni wọn ti ri ounjẹ ipapanu ''gold fish crackers'' ti a le pe ni bi bisikiiti tawọn ọmọde n jẹ, ti wọn fi si ẹgbẹ aga ijoko awọn ọmọ yi. Aṣẹyinwa aṣẹyinbọ, wọn gbe bisikiiti yi lọ si ile ayẹwo laabu, ti esi to jade nibẹ si fihan pe oogun oloro igbo wa ninu eroja bisikiiti yii, iyẹn tetrahydrocannabinol. Kini nkan ti wọn ṣe fun ẹni to ni Daycare ọmọde yi? Arabinrin ẹni ọgọta ọdun to ni Daycare naa ko duro ki ọlọpaa wa mu, ko to lọ yọju si agọ ọlọpaa. Nibẹ ni wọn ti fi ẹsun onigun mẹta kan lori pe o ṣe akoba fun ọmọde. Wọn gba oniduro rẹ ni ẹgbẹrun meji dọla tii ṣe $2,000 lọwọ rẹ, ki wọn to tu silẹ lati pada sile gẹgẹ bi atẹjade ọlọpaa ṣe wi. Bakan naa ni ile itọju ọmọde Daycare yi ti jọwọ iwe aṣẹ wọn.	https://www.bbc.com/yoruba/agbaye-61127960
entertainment	Baba Ijesha: Agbẹjọ́rò ní àwọn kan ló dúró pé ojú ló fi ri béélì, ètè rẹ̀ kò ní bà á	"Ariwo ""nibo ni Baba Ijẹṣa wa? Nibo ni Baba Ijẹṣa wa?"" ni ibeere ti ọpọ n beere lori ayelujara bayii. Ibeere naa gbalẹ kan lẹyin wakati mejidinlaadọta ti adajọ ile ẹjọ Majisireeti agba kan nipinlẹ Eko, fun gbajumọ oṣere tiata Yoruba, Olanrewaju Omiyinka ti ọpọ mọ si Baba Ijẹṣa ni anfani beeli, Ibeere si idahun yii ni pe, titi di asiko ti a fi n ko iroyin yii jọ, ahamọ ọlọpaa, ni ẹka ọtẹlẹmuyẹ to wa ni Panti nilu Eko ni Baba Ijesha ṣi wa o. Ki wa lo sokunfa bi ọrọ yii se ri, ki lo n da Baba Ijesha duro lati lọ sile lẹyin ọjọ meji to gba beeli? Nigba to n wa idahun si awọn ibeere yii, ti BBC News Yoruba takoto rẹ si, ọkan lara awọn agbẹjọro Baba Ijesha, Amofin Adeshina Ogunlana ṣalaye wi pe, wọn ko tii ri ọrọ beeli rẹ yanju ṣugbọn o ṣeeṣe ki ọsan ko so didun laipẹ. ""Ni bi mo ṣe mọ ati bi mo ṣe wa yii, O (iyẹn Baba Ijesha) ṣi wa nibẹ (Panti)"" Nigba ti a beere nipa igba ti o ṣeeṣe ki nnkan bọ soju ọwọ fun agba apanilẹrin naa, Amofin Ogunṣina ni oun a fẹ ki a ṣi ni suuru di irọlẹ Ọjọru lati mọ bi nnkan yoo ṣe lọ si fun. Bakan naa ni agbẹjọro naa ko ṣalaye nipa ilana gbigba beeli afurasi naa to takoko, ti wọn ko tii ri ọna se amusẹ rẹ fun gbigba beeli afurasi naa. Amofin Adeshina Ogunṣina wa kọminu lori ilana eto idajọ ati ofin lorilẹede Naijiria. O ni o ṣeni laanu pe, bi ofin to tọ ṣe wa to lorilẹede Naijiria, awọn to wa ni idi aro ifidimulẹ ofin wọnyi ni ka bẹ, lati ṣe ohun to tọ nigba gbogbo. Amofin ni ohun to ku diẹ kaa to ni pe adajọ ni lati dide lọ si ahamọ ọlọpaa ni Panti, lati rii daju pe idajọ ododo wọle tọ Baba Ijẹṣa lọ amọ sibẹsibẹ, o ni awọn kan ṣi duro ni iduro pe 'oju lo fi ri beeli naa, ete rẹ ko ni kan an"""	https://www.bbc.com/yoruba/afrika-57169164
sports	Sekinat Quadri ọmọ ọdún méje ajẹ̀sẹ́ to fẹ dabi Anthony Joshua	''O wun mi ki n di Naijiria 'Champion' bi Anthony Joshua '' Erongba Sekinat Quadri abẹṣẹkubiojo ọmọbirin ọmọ ọdun mẹjẹ re e nilu Eko. Papa iṣere Oworo Sports Centre ni a ti ṣe alabapade re e nibi ti oun ati awọn ajẹsẹ miran ti n gbaradi. Nigba ti Sekinat wa ni ọmọ ọdun maarun ni oun ati Baba rẹ jijọ nasẹ lọ si papa iṣere naa ti o si ri awọn to n ja ẹṣẹ. ''Mo sọ fun Mummy mi wi pe mo fẹ́ ma ja ẹṣẹ ṣugbọn wọn sọ wi pe rara. Daddy mi lo sọ wi pe ko buru'' Laarin awọn akẹgbẹ rẹ, Sekinat jẹ ọmọ to fi ọkan si ẹṣẹ jija ti ọrọ rẹ a si ma ya olukọni rẹ lẹnu. ''Mi o lero wi pe yoo ṣe daada nidi ẹṣẹ jija yi nitori ko lara pupọ.Sugbọn lati igba ti o ti bẹrẹ niṣe ni o n jọ mi loju.''	https://www.bbc.com/yoruba/afrika-46691478
