health	Àṣìṣe márùn ún tí àwọn lọ́kọláyà ńṣe nípa owó àti níní ìmọ̀ nípa ara wọn	Jijiroro lori iṣuna ati eto inawo jẹ ohun kan to n fa ọpọlọọ wahala fun awọn eeyan paapaajulọ awọn lọkọlaya. Bi a ba wo ọrọ gbogbo, iṣoro eto inawo ati iha ti koowa n kọ si ọrọ owo lee fa oniruuru nnkan fun ọpọlọpọ eyan eleyi to mu ki sisọrọ nipa rẹ o fẹ nira pupọ. O ṣe pataki ki a sọrọ nipa ọna ti a le gba ṣe amojuto owo tabi iṣuna wa pẹlu awọn ọkọ tabi iyawo wa ki o ma baa fa wahala ni ọjọ iwaju. Amọṣa, bi o ko ba tii ni anfani lati ṣeto ijiroro yii bayii, o dara ki o tete wa aye fun. Ninu iṣẹ iwadii ijinlẹ kan to waye laipẹ yii, lori awọn ohun to n fa wahala laarin awọn lọkọlaya, ohun marun un lo jẹyọ lori ohun ti awọn lọkọlaya n koju nipa ọrọ owo ati ọna ti wọn le gba yanju rẹ. 1.Aisi asiko fun ijiroro lori inawo ninu igbeyawo tabi ifẹ: Ọpọlọpọ nnkan to ṣe pataki fun igbesi aye wa, gẹgẹ bi riri dokita tabi akọṣẹmọṣẹ nipa itọju eyin; bẹẹ gẹgẹ ni o yẹ ki a maa ṣe lori ọrs owo. Sisọrọ nipa owo ati inawo lee nira pupọ, ṣugbọn o ṣe pataki fun igbeyawo lati kogoja. Ṣe eto asiko to dara julọ fun iwọ ati ololufẹ rẹ lati jiroro nipa inawo yin. Maṣe duro de igba ti ẹnikan ninu ẹyin mejeeji ba na owo to gọbọi lati ra ohun kan tabi nigba ti iṣoro iṣuna ba waye. Ohun to ṣe pataki ni pe ki ẹ joko sọrs lori inawo yin, o lee da lori bi ẹ ṣe n nawo si, ohun ti ẹ n san owo fun, bi iṣuna ṣe n ri tabi fifi owo pamọ fun ohun kan to ṣe pataki. Ohun to ṣaa ṣe pataki ni pe ki ẹ fi asiko silẹ lati jiroro lori owo. Ọna ti o ba gba na owo rẹ lawọn asiko kan sẹyin lee ni ipa lori ọna ti o o gba na owo rẹ lasiko yii, eyi si ni idi ti lọkọlaya lati mọ ipo ti eto inawo ọkọ tabi iyawo wọn wa. Bi o ba lee mọ nipa ilana inawo atẹyinwa ololufẹ rẹ, yoo ran ọ lọwọ pupọ lori bi ẹ ṣe n na owo yin lọwọlọwọ. Bi ololufẹ rẹ ba wa lati idile ti o lowo, ti owo kii ṣe iṣoro fun, o ṣeṣe ki ọna ti o gba n fowopamọ o ma dun mọ ọ ninu pupọ. Ni kete ti o ba ti mọ itan nipa iṣuna ololufẹ rẹ, nibẹ loo ti le mọ nipa ilana ti wọn fi n na owo ti yoo si ran ọ lọwọ lati maṣe bọ sọwọ aṣiṣe owo. Lasiko ti ẹ ba n ṣeto afojusun inawo yin, iwọ ati ololufẹ rẹ gbọdọ joko jiroro  lati mọ awọn ohun gan ti ẹ fẹ gan ni pato. Ọpọ awọn lọkọlaya lo maa n gba pe ololufẹ wọn fara mọ ohun ti wọn fẹ nipa iṣuna lai sọrọ rẹ rẹ. Lẹyin o rẹyin ni wọn yoo wa rii pe irọ ni wọn n pa. Gẹgẹ bi lọkọlaya, ẹyin mejeeji nilo lati jiroro lori awọn idojukọ yin nipa inawo, dukia ti ẹ ni ati iye owo oṣu ti ẹni kọọkan yin n gba. Lẹyin eyi, ṣe ilakalẹ inawo yin bii owo ori, sisan owo san an diẹdiẹ lori ọkọ rira. Nitori pe dandan ni sisan awọn owo wọnyii, o rọrun lati tete bẹrẹ si ni ṣeto iṣun alori wọn. Lọpọ igba ni edeaiyede yoo maa waye lori iṣuna yin bi ọkan ninu awọn lọkọlaya ba n yọ ninu aṣuwọn ajumọni wọn lati nawo fun ohunkohun. Nitori eyi, o ṣe pataki ki ẹyin mejeeji ṣe eto lori bi ẹ o ṣe maa na owo lsna ti ko ni ṣokunkun si ẹni keji. Fifi ara pamọ fun ololufẹ rẹ lori ọrọ owo, kaadi igbowo ATM rẹ ati awọn ohun tuntun ti o n gbero lati ra lewu pupọ. Ohun to ṣe pataki naa ni ki ẹyin mejeeji jẹ olootọ si ara yin. Bi o ba ti n di pe ẹyin mejeeji ko lee ṣalaye ohun ti ẹ n ra fun ara yin nitori ero pe ẹnikeji rẹ ko ni fọwọsi ohun ti o fẹ ra naa, a dara ki ẹ jumọ joko jiroro pọ lori rẹ	https://www.bbc.com/yoruba/afrika-58888684
religion	TB Joshua: Apostle Paul M.E ti kéde ikú àgbà wòlíì náà láti oṣù kan sẹ́yìn	"Gẹgẹ bi awọn alasẹ ijọ Synagogue Church of All Nations (SCOAN) se sọ lasiko ti wọn n kede iku oludasilẹ ijọ naa, Wolii TB Joshua, bẹẹ ni ọrọ iku rẹ ri. Ijọ naa lo kede ni owurọ ọjọ Aiku pe Ọlọrun kii se nnkan, ko ma kọkọ fi han awọn wolii rẹ saaju. Bakan naa ni ọrọ ri pẹlu Wolii kan, to ti kọkọ sọ asọtẹlẹ ni osu kan sẹyin pe Ọlarun ti setan lati mu Wolii Temitope Balogun Joshua lọ sile ayeraye. Ninu fidio kan to gba awọn oju opo ayelujara kan, ni ojisẹ Ọlọrun kan Apostle M.E Paul ti n sasọtẹlẹ pe oun ri awọn angẹli, ti wọn wa gbe wolii TB Joshua lọ kuro laye. ""Ọlọrun fi iran igba ikẹyin kan han mi, ẹ tẹti si mi, mo duro silẹ, a si gbe mi lọ si ọrun, ferese ọrun si silẹ fun mi, mo si duro lati boju wo isalẹ ilẹ nile aye. Mo ri awọn angẹli mẹfa ti a ran lati ọrun wa sile aye pe ki wọn lọ gbe wolii Joshua wa, ohun ti mo ri ni mo n sọ. Awọn angẹli mẹta mu dani ni ọwọ ọtun ati mẹta ni ọwọ osi, ti wọn gbe wolii TB Joshua soke tente, to si mu ife ẹyẹ kan dani."" Wolii Paul ni oun wo ibi ti awọn wolii naa duro si, ti wọn si ya si apa ọtun, oun naa ba woju wo apa ọtun, amọ oun ko ri oju ẹni to joko sori itẹ. Bakan naa ni Apostle M.E Paul ni oun gbọ ohun Ọlọrun to n sọ fawọn angẹli naa pe ki wọn gba ife ẹyẹ naa lọwọ Wolii Joshua, ki wọn si mu wa fun oun. Bakan naa lo ni ki wọn mu wolii naa lọ sibi to yẹ fun. ""Lọgan ni mo ri awọn agba angẹli to tun ju awọn ti isaaju lọ, ti wọn n duro sẹba itẹ Ọlọrun, wsn wa gba ife ẹyẹ naa lọwọ wolii TB Joshua, ti wọn si gbe lọ siwaju itẹ Ọlọrun. O ni Oluwa ni ki awọn angẹli yii si gbe wolii si ibi to yẹ ko wa nitori o ti pari ire ije rẹ nile aye."	https://www.bbc.com/yoruba/afrika-57385528
sports	Kazeem Tiamiyu: Wọ́n ti sin òkú agbábọ́ọ̀lù Remo Stars tí wọ́n sọ pé SARS pa ní Sagamu	"Wọn ti sin oku agbabọọlu, Kazeem Tiamiyu, ti iṣẹlẹ iku rẹ fa iwọde nilu Sagamu nipinlẹ Ogun, ṣugbọn awọn ibeere kan ṣi n jẹyọ lori iku to pa a. Ẹni ọdun mọkanlelogun ọhun, to n gba bọọlu fun Remo Stars, ni ọkọ gba, to si gba ibẹ ku, ṣugbọn ẹgbẹ agbabọọlu rẹ sọ pe awọn ọlọpaa lo pa a. Ọrẹ rẹ kan naa to sọ pe iṣẹlẹ naa ṣoju ohun naa sọ fun BBC pe awọn ọlọpaa SARS lo ṣokunfa iku rẹ. Nibi eto isinku na to waye ni Ọjọbọ, ọjọ kẹtadinlọgbọn, oṣu Keji, ni awọn ẹbi, ọrẹ ati akẹẹgbẹ rẹ ti kopa, wọn si wọ Tiamiyu ni aṣọ funfun, ti wọn si sin ni ilana ẹsin Islam. Agboole ẹbi rẹ to wa ni Ajaka nilu Sagamu nipinlẹ Ogun ni wọn sin si. Ṣe ko si obi to gbadura lati f'oju sunkun ọmọ, ẹ gbọ nkan ti awọn obi oloogbe Tiamiyu ba BBC Yoruba sọrọ nipa rẹ. Aarẹ ẹgbẹ agbabọọlu Remo Stars, Kunle Soname, ati Aarẹ ajọ to n mojuto bọọlu gbigba ni Naijiria, NFF, Amaju Pinnick naa ti lọ ba ẹbi oloogbe kẹdun l'ọsẹ yii. Jakejado Naijiria ni awọn eniyan ti koro oju si iru iku to pa Tiamiyu, nitori bi iroyin ṣe sọ pe lasiko ti awọn ọlọpaa SARS da a duro sinu ọkọ wọn lo pade iku ojiji. Eyi si mu ki ọpọlọpọ olugbe ilu Sagamu ṣe iwọde, ti awọn eniyan fi n beere fun idajọ ati ipolongo pe ki wọn o pa ẹka ọlọpaa SARS rẹ. Eniyan mẹta si ni iroyin tun sọ pe o padanu ẹmi wọn nibi iwọde naa, ti awọn ọlọpaa si sọ pe awọn ṣi n ṣe iwadii awọn ẹsun yii. Ileeṣẹ ọlọpaa sọ pe ọlọpaa to lọwọ si iṣẹlẹ naa ti wa ni ihamọ, ati pe wọn ti gbe e lọ si ẹka ileeṣẹ ọlọpaa ti wọn ti n ṣewadi iwa ọdaran. Agbẹnusọ ileeṣẹ ọlọpaa, Frank Mba sọ fun BBC pe ""iwadii  ṣi n lọ lọwọ, ileri wa si awọn ọmọ Naijiria si ni pe a ko ni ṣe mago-mago tabi fi ohunkohun pams nipa iwadii naa""."	https://www.bbc.com/yoruba/51677681
religion	IPOB: Abia ń gbóná jain lọ́wọ́, Kumiyi kò gbọdọ̀ wá ṣe ìpàdé gbàgede tó fẹ́ ṣe!	"Ẹgbẹ to n pe fun ominira ilẹ Biafra, IPOB ti ke si adari Ijọ Deeper Life Bible Church, WF Kumuyi pe ko ma wa ṣe ipade gbagede niluu Abia. Wọn gba Kumuyi ni imọran pe nitori agbegbe ila oorun Guusu ariwa Naijiria to gbona jainjain ni awọn ṣe gba ni imọran naa. Ninu atẹjade ti agbẹnusọ ikọ IPOB fi lede, Emma Powerful ni wọn ti sọ pe o ṣeeṣe ki awọn agbebọn ti ko si ẹni to mọ wọn lọ iwọde naa lati fi ṣọṣẹ, ti wọn yoo si dẹbi ru ikọ IPOB. IPOB rọ awọn adari ẹsin ati pasitọ lati gbadura fun opin si eto aabo to mẹhẹ ni Naijiria. Bakan naa ki wọn si beere fun idajọ ododo lori iṣekupani Deborah Yakubu, ti awọn kan dana sun lẹyin ti wọn sọ pe o sọ ọrọ odi si Muhammed, to fi mọ Leah Sharibu naa to wa ni ahamọ ikọ agbesunmọmi. ''A gba Pasitọ Kumuyi ti ijọ Deeper Life Bible Church ni imọran lati woye bi eto aabo ṣe ri ni iha Ila Oorun Naijiria bo ṣe fẹ wa ṣe iwaasu ita gbangba.'' ""Awọn to n pete pero apẹjọpọ yii gbọdọ ri pe iru nkan bẹẹ ko ṣẹlẹ nitori aabo."" ""Nitori naa ni a ṣe gba a nimọran pe ko ma si ipade kankan."" ""Iko IPOB ko ni gba ẹnikẹni laaye lati jẹ ki ẹmi awọn eniyan bọ lasiko ipade gbagede naa."" Bakan naa ni wọn kesi Kumuyi lati fi akoko yii gba adura fun opin si ija ati asọ to fi mọ iwa ọdaran ni agbegbe ọhun. Kí ló ṣẹ̀lẹ̀ tí Lizzy Anjorin ń wọ́ ìdí ìjọ Celestial tuurutu? Látilẹ̀ ni mo ti fẹ́ràn orin ìjọ Kérúbù àmọ́ ẹlẹ́sìn mùsùlùmí àti krìstẹ́nì ni mí - Qdot"	https://www.bbc.com/yoruba/media-61530712
entertainment	Àlàyé rèé lórí bí 'Popular Jingo' ṣé dí inagijẹ akọrin Juju tó bí Wale Thompson 'Lalalẹ Friday'	Pupọ awọn to ba dagba saaju igba kọmputa ta wa yii ni yoo ti gbọ ki wọn maa pe ẹni to ba jẹ ilumọọka tabi gbajumọ ni  ''Popular Jingo.'' Inagijẹ yi wọpọ laarin awọn Yoruba ṣugbọn diẹ lawọn ẹni ti yoo ṣi ranti pe eeyan kan to jẹ akọrin Juju ni apejẹ rẹ n jẹ ''Popular Jingo.'' BBC Yoruba ṣe iwadii ọrọ yii nipa biba alagba David Anwo Agbolade ti awọn eeyan mọ si Popular Jingo sọrọ. Ilumọọka  Akọrin Juju ni David Agbolade tawọn eeyan si ni o wa lara awọn to mu ki orin Juju fẹsẹrinlẹ nilẹ kaarọ o jiire. Lasiko rẹ, eeyan ko le darukọ olorin Juju lagbegbe Ijebu Igbo, Eko ati Ibadan ki wọn ma pe Popular Jingo mọ wọn. Bi awọn Sunny Ade ati Ebenezer Obey  ti ṣe n fi orin juju da awọn eeyan lara ya nilu Eko ni Popular Jingo naa n migboro titi laaye tiẹ naa. Ọdun 1943 ni wọn bi alagba David Anwo Agbolade ti o si bẹrẹ ileewe ni Saint Luke's Primary School ni Japara Ijebu Igbo, lọdun 1949. Alagba David ni ''nigba ti mo wa ni ileewe alakọbẹrẹ ni mo ti bẹrẹ si ni fifẹ han si orin kikọ'' ''Koda mi o ti kẹkọ pupọ ki n to mọ lọkan mi pe iṣẹ orin lọna mi'' Amọ ṣa baba to bi David iyẹn, alagba Moses Anwoloju Aina ko nifẹ si ki ọmọ rẹ kọrin. Popular Jingo ni ''Ada ni baba mi yọ si mi nigba ti mo ni mo fẹ bẹrẹ orin. Inu wọn ko kọkọ dun si nigba naa'' Yatọ si pe o jẹ akọrin Juju, Popular Jingo a tun maa gba bọọlu nigba ewe rẹ. Idi ere boolu gbigba gẹgẹ bi o ti ṣe sọ ni awọn akẹgbẹ rẹ ti fun ni apejẹ rẹ, Popular Jingo. Ifẹ to ni si orin kikọ yii tun tẹsiwaju si ni igba to wa ni Saint Vincent Catholic Modern School. Ni igba taa n wi yii, Agbolade a maa ta jita pẹlu 'Mouth Organ' ki o to wa pada wa maa lo 'Accordion'. ''Ni ọdun 1979 ni mo mọ daju lọkan mi pe mo ni ẹbun orin kikọ. Ohun to si ṣẹlẹ ni pe mo kọrin nigba ti eeyan kan ku lagboole wa'' Lọjọ naa lọhun Jingo sọ pe niṣe ni gbogbo ile pa lọọlọ ti oun si fi orin da awọn eeyan lara ya. 'Awọn eeyan tẹwọgba orin mi lọjọ naa ti inu mi si dun'' Ninu ifọrọwanilẹnuwo pẹlu BBC,Popular Jingo ni ohun ko ni ọga kan pato. Amọ o salaye pe ẹnikan ti wọn n pe ni Kolawole Ijaduoye alias 'Kolly Jo' lawọn bẹrẹ orin Mamba lọdọ rẹ ki awọn to yi pada si Juju ṣugbọn ko pe ti awọn lo lọdọ rẹ. ''IK Dairo, Ojoge Daniel, Tunde Nightingale, ati Rosa Adetola ni mo maa n wo lawokọṣe ni igba naa.'' Agbolade sọ pe ninu gbogbo wọn, ''Tunde Nightingale ni mo maa n tọ ipasẹ re.'' Nigba naa lọhun, Popular Jingo sọ pe Haruna Ishola olorin Apala to jẹ ọmọ Ijebu Igbo a maa gba oun ni imọran lati maa mu diẹ ninu 'style' Tunde Nightingale. Royal Brothers Band lorukọ ẹgbẹ akọrin ti Agbolade sọ pe oun da silẹ lọdun 1962. O si ni nigba naa lọhun irinṣẹ tawọn fi n kọrin ko pọ. Tohun ti bẹ awọn eeyan a maa gbadun orin Juju Popular Jingo paapa lagbegbe Ijebu Igbo, ilu Eko ati Ibadan. Wale Thompson onijuju ọmọ Popular Jingo nii ṣe Popular Jingo gbe awo orin orisirisi jade to fi mọ 'Oridamilare', 'Ile ẹkọ ni ile ọkọ' ati bẹẹ bẹẹ lọ. Alagba David fẹ iyawo, o bimọ, o kọ ile koda ninu awọn ọmọ rẹ ati ọmọ ọmọ rẹ, awọn to n kọrin juju wa ninu wọn. Wale Thompson, gbajumọ olorin Juju nii to kọ orin 'Lalalẹ Friday', ni akọbi Popular Jingo to si tẹwọ gba jita lọwọ baba rẹ. Ẹni ọdun mejidinlọgọrin ni Popular Jingo ti ko si ti maa ṣere ode onijuju mọ. ''Mo dupẹ fun igbe aye mi,inu mi a si maa dun pẹlu ti awọn eeyan ba pade mi ti wọn a si maa sọ pe emi ni mo kọrin nibi ikomọ awọn'' Nilu Ijebu Igbo ni alagba David n gbe titi di asiko yi pẹlu awọn mọlẹbi rẹ.	https://www.bbc.com/yoruba/afrika-54139292
politics	India vs Pakistan: Kí ni ìdí tí ìjọba Gẹ̀ẹ́sì fí yà India àti Pakistan lọ̀tọ̀ọ̀tọ̀ ní ọdún márùndínlọ́gọ́rin sẹyin?	"Loṣu kẹjọ ọdun 1947 ni ilẹ Gẹẹsi fun orileede India ni ominira. Agbegbe ti wọn ṣe ijọba le lori tẹlẹ yi wa pin si India ati orileede tuntun mii ti wọn pe orukọ rẹ ni Pakistan. Lara Pakistan yi kanna lati ri iwọ oorun Pakistan to pada wa di orileede mii Bangladesh. Ipinya yi ṣokunfa wahala nla eleyi to mu ki awọn eeyan to le fẹ ẹ to miliọnu mẹẹdogun di alainile ti awọn eeyan miliọnu kan si padanu ẹmi wọn. Titi di oni, India ati Pakistan ko ba ara wọn rẹ. Ki lo mu ipinya yi wa? Ni 1946 ni ilẹ Gẹẹsi kede pe awọn fẹ fun India lominira. Wọn lawọn ko ni le dari ilẹ naa mọ ati pe awọn f kangara kuro ni kiakia. Adari to wa nipo kẹyin Lord Louis Mountbatten da ọjọ  Kẹẹdogun oṣu Kẹjọ 1947. Ni igba taa n wi yi, ida marundinlọgbọn eeyan ilẹ naa jẹ musulumi. Awọn to pọju ninu awọn to ṣku si jẹ ẹlẹsin Hindu. Ninu wọn la tun ti ri awọn ẹlẹsin Sikh, Buddha ati awọn miran. Ọjọgbọn Navtej Purewal to jẹ onimọ ni ẹka iwadii Arts and Humanities Research Council sọ pe  ""Ilẹ Gẹẹsi fi ẹsin pin awọn eeyan India si ipele ọtọọtọ'' ''Bi apẹrẹ,wọn ṣe agbekalẹ iwe orukọ awọn oludibo musulumi ati Hindu lọtọọtọ fawọn idibo abẹle.Wọn ya awọn ipo kan sọtọ fawọn oloṣelu musulumi ati awọn Hindu.Wọn lo ẹsin fi ṣe oṣelu' Ninu ọrọ alaye rẹ, ọjọgbọn Gareth Price ti Chatam House sọ pe ''Nigba to jọ pe India yoo gba ominira, pupọ awn musulumi bẹrẹ si ni jaya lori bi wọn yoo ṣe gbe nilẹ tawọn Hindu pọ si'' O fi kun pe ''wọn ro pe wọn ko ni ribi ṣe iṣẹmi tara wọn'' tori naa,''wọ bẹrẹ  si ni ṣatilyin fẹgbẹ oṣelu to n polongo idasilẹ orileede musulumi'' Mohandas Gandhi ati Jawaharlal Nehru,awọn olori ipe ominira nigba naa lawọn fẹ India ti yoo faramọ gbogbo ẹsin. Ṣugbọn Muhammad Ali Jinnah to jẹ olori All India Muslim League beere fun iyasọtọ gẹgẹ bi adehun ominira. Onimọ Price sọ pe ''Ọjọ yoo pẹ ki adehun to fẹnuko lori India kan ti yoo gba gbogbo ẹlẹsin'' ''Iyasọtọ dabi ọna abayọ ti ko pẹ ti ko si mu wahala wa.'' Iru inira wo ni iyasọtọ yi mu wa? Oṣiṣẹ ijọba ilẹ Gẹẹsi kan Sir Cyril Radcliffe lo ya ibode tuntun laarin India ati Pakistan lọdun 1947. O ya ilẹ India si apa Guusu ati apa ariwa. Ni Guusu lawọn Hindu pọ si, apa meji ni iwọ oorunariwa ati ila oorun ariwa si lawọn musulumi pọ si. Ṣugbọn awọn ileto musulumi ati Hindu wa kaakiri  ni India ni.Eyi tunmọ si pe lẹyin iyasọtọ, o kere tan eeyan miliọnu mẹẹdogun lo rin lati sọda lọ si ibode ti wọn ṣẹṣẹ la yi. Lọpọ igba ikọlu waye tawọn eeyan si le awọn mii kuro ni ile wọn. Apẹrẹ akọkọ ni ti eleyi to waye ni Calcutta ti wọn pa o kere tan ẹgbẹrun meji eeyan lọdun 1946. Ọmọwe Eleanor Newbigin sọ pe awọn musulumi ati Hindu da ikọ ọmọ ogun silẹ. ''Awọn adunkoko mọni ẹgbẹ yi lo n le awọn eeyan kuro labule wọn ki wọn ba le gbalẹ si ọdọ ti wọn'' O kere tan eeyan bi ẹgbẹrun lọna igba si miliọnu kan ni wọn lo ku nipa aarun tabi lawọn ibudo ti wọn ko atipo si. Ẹgbẹgbẹrun obinrin, Hindu ati Musulumi ni wọn fipa ba lopọ, ji wọn gbẹ tabi ti wọn si ba loju jẹ Kini ipa ti iyasọtọ yi ni? Lati igba ti wọn ṣe iyasọtọ yi tan India ati Kashmir ko sinmi lati maa ja si agbegbe taa n pe ni Kashmir. Ogun meji ọtọọtọ ni wọn ti koju ara wọn nitori agbegbe yi, ọkan lọdun 1947-1948 ati omiran ni ọdun 1965. Bẹẹ wọn tun kọlu ara wọn ni 1999 ni Kargil lori ọrọ Kashmir yi naa. Orileede mejeeji n sọ pe awọn lawọn ni agbegbe yi ti wọn si n ṣakoso awọn apa kan nibẹ lọtọọtọ. Bakan naa India kogun ja Pakistan lọdun 1971 nigba ti wọn tẹnu bọ ọrọ atilẹyin ominira fun East Pakistan to pada wa di Bangladesh ko yapa kuro lọdọ Pakistan. Ko to da meji ninu ida ọgọrun awọn ọmọ ilẹ Pakistan to jẹ ẹlẹsin Hindu nisinyi. Ọmọwe Price sọ pe ''Pakistan ti n fojojumọ fara jọ orileede musulumi ''eyi ko si ṣẹyin pe ''musulumi lo pọ nibẹ tawọn perete ninu wọn si jẹ Hindu'' Bẹẹ India naa si ti n di orileede India bọjọ ṣe n gun ori ọjọ."	https://www.bbc.com/yoruba/agbaye-62546530
entertainment	Kenyan Dance Party: Òde ijó yìí kò sí fáwọn abo tó ń fẹ́ ara wọn pẹ̀lú	"Ti a ba n se ayẹyẹ, tọkunrin tobinrin lo maa n peju pesẹ lati fi ara kinra, eyi ti yoo mu ki ayẹyẹ naa dun, ko si larinrin. Sugbọn iyalẹnu gbaa lo jẹ lati ri pe ode ijo kan lee wa, ti yoo wa fun kikida awọn obinrin nikan, ti wọn yoo si le awọn akọ sẹyin. Gẹgẹ bi BBC se se awari rẹ, ilu Nairobi lorilẹede Kenya ni idan orita naa ti n waye, nibiti wọn ti haya ibudo kan to wa fun ile ijo, ti orin si n dun lakọlakọ nibẹ, sugbọn kinni kan to ba Ajao jẹ, ti apa rẹ fi gun ju itan lọ ni pe kikida awọn obinrin lo wa lagbo ijo naa, to n jo pẹlu ara wọn. Gẹgẹ bi awọn obinrin to ba BBC sọrọ ti wi, o dara ni ẹkọọkan bayii lati maa fi ọwọ lile mu awọn ọkunrin, ti awọn obinrin nikan yoo ti da wa laisi awọn ọkunrin nibẹ. Jane, ẹni ọdun mẹrindinlọgbọn, lasiko to n ba BBC sọrọ ni, ""ọkan mi balẹ lati wa si agbo ijo to wa fun obinrin nikan lai lọwọ awọn ọkunrin ninu, mo wa pẹlu ọrẹ mi obinrin, eyi to mu ki inu mi dun lati wa pẹlu ẹni to loye nipa oun."" Nibi agbo ijo naa, se ni ipese abbo to peye wa, iwọnba awọn ọkunrin ti wọn si gba laaye lo wa ja awọn obinrin silẹ, ni kete ti wọn ba si se bẹẹ tan ni wọn yoo jade kuro nibẹ. Koda, awọn eeyan to jẹ agbọti, agbounjẹ, osisẹ eleto aabo, awọn gbogbo elere to n lu awo orin, awọn atọkun eto to fi mọ awọn asọna lo jẹ obinrin, laisi ọkunrin ninu wọn. Ọdun 2018 ni wọn bẹrẹ agbo ijo awọn obinrin nikan naa, ti erongba idasilẹ rẹ si kọja jijẹ igbadun alẹ ọjọ kan. Idi ni pe oju awọn obinrin ri mabo lọdun to kọja naa nitori awọn isẹlẹ hihu iwa ipa si awọn obinrin ati ifipabanilopọ, eyi to mu ki awọn obinrin pinnu lati maa da wa laisi ọkunrin. Yatọ si eyi, agbo ijo aọn obinrin naa ko si fun awọn abo to n fẹ ara wọn, taa mọ si Lesbian, ti ode naa ko si wa fun ẹlẹsin kan pato. Ninu ifọrọwerọ rẹ pẹlu BBC, Munira, ẹni ọdun mejilelogun ati Khadija, ẹni ọdun mẹẹdọgbọn, ti wọn jẹ mususlumi salaye pe ode ijo naa ba ilana ẹsin Islam mu, eyi to faramọ ki awọn ọkunrin maa da wa loju kan. ""Ọpọ wa lo maa n bọ asọ ibori (Hijab) wa lati darapọ mọ awọn akẹẹgbẹ wa lasiko ta ba n jo. Idi ni pe ti wọn ba ri wa pẹlu Hijab, wọn yoo ya ẹnu pe ki la wa se nibẹ."" Iru ipejọpọ bayii ni Munira lo dara pupọ nitori wọn ko fi aaye gba awọn lati maa fara ro ọkunrin. Ireti si wa pe laipẹ laijinna, irufẹ ode ijo bayii yoo tan kalẹ bii ọwara ojo yika gbogbo ilẹ Afirika, nibiti wọn yoo ti maa gbe awọn obinrin larugẹ bo se yẹ."	https://www.bbc.com/yoruba/afrika-49329514
politics	Election Tribunal: Lai Muhammed àti Oshiomole ní òfo ni ẹjọ́ kòtẹ́milọ́rùn PDP yóò já sí	Ọrọ ko tii jẹ rodo lọ mumi lori idajọ ti igbimọ olugbẹjọ nipa awuyewuye ibo aarẹ gbe kalẹ, eyi to ni aroye oludije fun ipo aarẹ fẹgbẹ oselu PDP, Alhaji Atiku Abubakar se niwaju igbimọ naa ko lẹsẹ nlẹ. Lara awọn ohun to n jẹyọ lẹyin idajọ naa ni bi awọn alasẹ ati ẹgbẹ oselu APC lapapọ se n fi ẹgbẹ PDP to gbe wọn lọ sile ẹjọ se yẹyẹ. Ijọba apapọ ilẹ yii, ti ẹgbẹ oselu APC n dari lo kọkọ kesi ẹgbẹ oselu PDP pe, ta ba le ni, ta ba ba ni iwọn laa bani se ọta mọ, yoo si dara ki PDP tete yara mọ agba lẹgbọn, ko si tọrọ aforiji lọwọ APC pe ko ma binu. Minisita feto iroyin ati asa, Lai Muhammed lo kede bẹẹ nigba to n fesi lori idajọ ti igbimọ olugbẹjọ naa gbe kalẹ lọjọru. Sugbọn ẹgbẹ oselu PDP naa ti wa fesi pada fun pe yoo dara ki ẹgbẹ APC ati Lai Muhammed dunnu mọ niwọn lori idajọ naa, nitori ẹni to ba rin ẹrin igbẹyin lo ri ẹrin rin. Akọwe ipolongo fẹgbẹ PDP Kọla Ọlọgbọndiyan salaye pe, idajọ ti APC n dunnu si yii ko lee jẹyọ nile ẹjọ to ga julọ lorilẹede yii, ti awọn si ti setan lati tun ẹjọ naa gbe dide nibẹ. Bakan naa ni alaga fun ẹgbẹ oselu APC, Adams Oshiomole naa ti n rẹrin keke si ọrọ PDP yii, to si ni bi wọn ba fẹ, wọn lee pe ẹjọ kotẹmilọrun ni kootu agbaye, ohun to si da ohun loju ni pe pabo naa ni ọrọ wọn yoo ja si. Lasiko to n jẹwọ pẹlu awọn akọroyin nile ijọba nilu Abuja lẹyin to se ipade tan pẹlu aarẹ Buhari, Oshiomole salaye pe gbigba fun Ọlọrun ni isisnmi, ko si si ẹjọ kankan to tuntun ti PDP fẹ gbe lọ sile ẹjọ to ga julọ nilẹ yii nitori wọn ko ni ẹri kankan gidi to fi ẹsẹ mulẹ.	https://www.bbc.com/yoruba/afrika-49685339
politics	Afenifere sọ̀rọ̀ àbùkù sí agbẹnusọ Buhari lẹ́yìn tó tako àwọn tó ń bu ẹnu àtẹ́ lu ìjọba rẹ̀	"Ẹgbẹ ọmọ Yoruba, Afenifere ti sọko si agbẹnusọ Aarẹ Muhammadu Buhari, Femi Adesina, lori bo ṣe tako awọn to n bu ẹnu atẹ lu ijọba to wa lode. Akọwe agba ẹgbẹ Afenifere, Sola Ebiseni lo sọ ọrọ naa ninu atẹjade kan pe ijọba Buhari ti ja awọn ọmọ Naijiria kulẹ, o si tọ ki awọn araalu maa sọrọ abuku si. Ṣaaju ni Adesina ti kọkọ sọ pe oun dẹkun lati maa lọ si ṣọọṣi kan niluu Abuja nitori pe alufaa ijọ maa maa n bu ẹnu atẹ lu iṣẹjọba Buhari. Atẹjade ọhun ni lati igba aye awọn wolii ninu bibeli ni wọn ti maa sọrọ si ijọba ti asiko ba n ni awọn araalu lara. O ni ""Laye igba ti wa yi gan, awọn ojiṣẹ Ọlọrun bii Martin Luther king, Desmond Tutu, Biṣọọbu agba Okogie, Biṣọọbu Gbonigi, Matthew Kukah, Tunde Bakare atawọn mi ko dẹkun lati maa ba ijọba sọ ootọ ọrọ ti wọn ko ba ṣe daadaa."" Afenifere sọ pe bo tilẹ jẹ pe awọn ojiṣe Ọlọrun kan n ba ijọba sọ ootọ ọrọ, awọn ojiṣẹ Ọlọrun mii wa ti wọn ko le ba ijọba ijọba sọ eyii tii ṣe ododo ọrọ nitori ohun ti wọn yoo jẹ. Ẹgbẹ ọmọ Yoruba naa tẹsiwaju pe irufẹ awọn ojiṣẹ Ọlọrun bẹẹ lo n tan Aarẹ Muhammadu Buhari jẹ pe o le maa ṣe ohun to wu bii ko maa fi iya jẹ awọn ajijabara nigba ti awọn ọdaran n yan fanda laarin ilu. O ni ""A ni awọn iranṣẹ Ọlọrun kan bii awọn irinwo wolii Ahabu ninu bibeli ti wọn n doju ija kọ Michaili, awọn lo n jẹ ki awọn adari tubọ maa ṣe aṣiṣe si."" ""Irufẹ awọn olubadamọran bẹẹ pọ ninu ijọba yii ti wọn jẹ ki Aarẹ gbagbọ pe o lagbara lori ilẹ awọn ẹya kan, ati pe wọn le yan lati fọwọ mu ilẹ wọn tabi ẹmi wọn."" ""Awọn eeana yii kan naa ni wọn n tan Aarẹ jẹ pe awọn eeyan bii Sunday Igboho le pin Naijiria ati pe pipa Nnamdi Kanu nikan ni ọna abayọ si ọrọ awọn ajijagbara Biafra."""	https://www.bbc.com/yoruba/afrika-59196834
