sports	Villarreal win Europa League: Ìdè ọjọ́ pípẹ́ já, Villarreal fi Man United ṣe àtẹ̀gùn dé ilẹ̀ ìlérí ní àṣekágbá Europa League	Pẹnariti ni Villarreal fi gba ife idije Europa League mọ Manchester United lọwọ l'Ọjọru. Ami ayo 11-10 ni wọn fi sọ ireti  Man United di ofo lẹyin ti goli wọn, De Gea ko ri pẹlu pẹnariti to kẹhin mu. Igba akọkọ re e ti Villarreal gba ife naa. Bi Villareal ṣe jawe olubori yii mu ko jẹ igba akọkọ ti wọn gba ife to nitumọ, bakan naa lo si jẹ igba kẹrin ti olukọni Artsenal nigba kan, Unai Emery, gba ife naa. Asiko ti ifẹsẹwọnsẹ naa wọ iṣẹju mẹẹdọgbọn ni Gerard Moreno gba bọọlu sinu awọn, ko to o di pe Manchester United ri i da pada ni iṣẹju karundinlọgọta lati ọwọ Edinson Cavani ati Marcus Rashford. Aston Villa fọ́ Chelsea lẹ́nu, àmọ́ Tottenham daṣọ àṣírí bò wọ́n Ko si si ẹni to gba bọọlu sinu awọn lẹyin naa titi ti ifẹsẹwọnsẹ fi pari, eyi to mu ki wọn o gba 'extra time'. Ọdun 2014 ni aṣekagba Europa League ti wọ extra time kẹhin , nigba ti Emery Sevilla fi pẹnariti naa Benfica. Villarreal ko gba ife pataki kankan ri lati ọdun mejidinlaadọrun to ti wa, ko to o di pe wọn fi iya jẹ Arsenal ni saa yii lati bọ si ipele to kẹhin. Manchester United si ti bẹ awọ̀n ololufẹ wọn, paapaa awọn to lọ si papa iṣere  ni Gdansk pe awọn mọ riri wahala wọn	https://www.bbc.com/yoruba/ere-idaraya-57264870
entertainment	Kengbe Ilorin: Àṣà ẹ̀yà Fulani, Bariba àti Gambari tó dàpọ̀ mọ́ ti Yoruba	Orisirisi orin ati ilu ni ẹya Yoruba fi maa n da ara wọn laraya laye atijọ bii Bọlọjọ, Sakara, Sẹnwẹlẹ, Apala, Were, Waka, Kengbe lilu ati bẹẹ bẹẹ lọ. Sugbọn asa Kengbe lilu yii lo wọpọ nilu Ilọrin lasiko igbeyawo, idaraya fun ọba ati nibi orisirisi ayẹyẹ miran. O wa se ni laanu pe lode oni, asa Kengbe lilu naa ti n lọ sokun igbagbe, ti ọpọ eeyan ko si ya sidi rẹ mọ. Amọ ọkan lara awọn to jogun ba asa Kengbe lilu naa, Ramat Olowo sọ fun BBC Yoruba pe, oun ti pinnu lati tun se agbende asa naa pada ko ma parun. Ramat ni orin to wa ninu Kengbe lilu maa n danilaraya, kọ ni lọgbọn, to si tun maa n pa ni lẹrin, paapa awọn orin aro, awada, idọwẹkẹ, amusẹya ati ẹẹkẹ eebu to kun inu rẹ. Ramat Olowo fikun pe ẹya Ibariba, Fulani ati Gambari lo ko asa lilu Kengbe wa si Ilọrin amọ o ti yi wọnu asa Yoruba, ti ko si yẹ ko parun. Ẹ wo fidio yii lati mọ bi orin naa se dun to.	https://www.bbc.com/yoruba/afrika-50135500
health	Face Transplant: DiMeo ṣùn lásìkò tó n wa ọkọ̀ lálẹ́, ló bá jóná nígbà tí ọkọ̀ gbiná	Awọn agba bọ, wọn ni ireti si n bẹ fun igi ta bẹ lori, nitori bo pẹ, bo ya, igi yoo pada ruwe. Bẹẹ ni ọrọ ri pẹlu ọmọ orilẹede Amẹrika kan, Joseph DiMeo to jona nigba ti ọkọ rẹ sadede gbina lasiko to sun lọ nigba to n wa ọkọ naa lalẹ. Ete, ọwọ ati Oju Joseph lo jona, to si nira fun lati maa wo digi lati mọ bi aworan rẹ se ri. Amọ awọn ẹbi rẹ seto fun lati sisẹ abẹ lẹyin osu mẹjọ ti isẹlẹ naa waye, tawsn dokita ogoje si se isẹ abẹ naa fun wakatai mẹtalelogun ni igba mẹta ọtọọtọ. Igba kẹta ni aseyọri to wa lati paarọ ọwọ, oju ati ete Joseph to jona, to si pada di eeyan to see wo. Nigba to n ba BBC sọrọ, Joseph DiMeo ni ohun to wu ohun bayii ni lati wa ni ominira toun naa, ki oun si le da duro bii awọn eeyan yoku lati gbara le ẹnikẹni. Àwọn ìtàn mánigbàgbé tì ẹ leè ní ìfẹ̀ síí: O si fi ẹmi imoore rẹ han si awọn ẹbi rẹ naa ti wọn duro tii nigba isoro.	https://www.bbc.com/yoruba/afrika-57132826
sports	Adesanya UFC253: Wo ìlúmọ̀ọ́ká akànṣẹ́ mẹ́ta ọmọ Nàìjíríà tó ń ṣe bẹbẹ lágbàáyé	Bi ọmọ ẹni ba daa, ẹ jẹ ki a wi, kii se pe a kuku fẹ fi ṣe aya ni. Awọn ọmọ Naijiria to n ṣe bẹbẹ lagbo eṣẹ kikan lagbaaye lo bi ọrọ yii. Mẹta ni wọn, awọn naa si ni, Anthony Joshua, Israel Adesanya ati Kamaru Usman. Lootọọ oke okun ni awọn mẹtẹẹta fi ṣe ibugbe, amọ ko si ẹni to gbagbe orilẹede Naijiria gẹgẹ bi orirun wọn, ninu awọn mẹtẹẹta. Ẹ jẹ ki a wo bẹbẹ tawọn ọmọluabi mẹtẹẹta ọmọ Naijiria yii ṣe lagbaaye: Israel Adesanya - Igba ogun lo ti figa gbaga, ti ko si fidi rẹ́mi ninu ikankan Ko si ẹni to le kọ iyan Israel Adesanya kere lagbo ẹṣẹ kikan ti UFC, ti wọn tun maa n pe ni MMA. Ilu Auckland lorilẹede New Zealand lo fi ṣe ibugbe, amọ ilu Eko ni wọn bi Israel si lọjọ kejilelogun oṣu keje ọdun 1989. Igba ogun ni Adesanya ti fija pẹẹta pẹlu oriṣiiriṣii awọn alatako, ṣugbọn gbogbo wọn lo la lalubolẹ bi ilu bẹmbẹ. Koda, o tun ṣẹṣẹ fakọyọ ninu ija to ja kẹyin ni, nibi to ti ṣe Paulo Costa bi ọsẹ ti n ṣe oju, ninu ija to waye niluu Abu Dhabi lorilẹede UAE laarọ lọjọ Aiku. Ipele keje ni wọn ṣẹṣẹ de nigba ti Israel ti lu Costa, ti ori rẹ si bẹjẹ eyi to mu ki alakoso ija gbọwọ rẹ soke pe, o ti jawe olubori. Lọwọ yii, Israel ni igbanu ''UFC Middleweight'' wa lọwọ rẹ lagbaaye. Kamaru Usman - Ninu ija mẹtadinlogun, o fidi rẹmi ninu ẹyọ kan Kamaru Usman naa, tii ṣe ọmọbibi orilẹede Naijiria, jẹ akọni abẹṣẹ ku bi ojo lagbo ija MMA. Orilẹede Amẹrika lo fi ṣe ibugbe, amọ ilu Auchi nipinlẹ Edo ni wọn ti bi Usman, lọjọ kọkanla oṣu karun un ọdun 1987. Igba mejidinlogun ni Usman ti ja, mẹtadinlogun lo ti jawe olubori, ti o si fidi rẹmi ninu ọkan ṣoṣo ninu wọn. Ọjọ kejila oṣu keje ọdun 2020 ni ija to kopa ninu rẹ kẹyin waye, ninu eyi to ti lu Jorge Masvidal niluu Abu Dhabi. Usman ni igbanu ''UFC Welterweight'' wa lọwọ rẹ bayii. Ti a ba n sọrọ awọn afi ẹṣẹ ku bi ojo lagbaaye, ọrọ ko tii tan ti a ko ba darukọ Anthony Oluwafemi Joshua. Niluu Watford lorilẹede England, ni wọn ti bi Joshua lọjọ kẹẹdogun oṣu kẹwaa ọdun 1989, amọ bi iṣu lo maa jẹ orilẹede Naijiria lẹnu. Koda, o ti figba kan gbe ilu Eko ri nigba to n dagba. Joshua ti gba oriṣiiriṣii ami ẹyẹ ninu ẹṣẹ kikan lagbaaye, to fi mọ ami ẹyẹ wura ninu idije ''Olympics'' ọdun 2012. Joshua ti fẹṣẹ yanju awọn ilumọọka akanṣẹ bi Wladimir Klitschko, Charles Martin, Joseph Parker, Alexander Povetkin ati Andy Ruiz Jr. Igbanu mẹta lẹka ẹṣẹ kikan to lami laaka lo wa lo lọwọ AJ nikan. Oun ni igbanu IBF, IBO, WBA ati WBO ''heavyweight'' wa lọwọ rẹ bayii. Káre akọni ọmọ Yoruba! Israel Adesanya fi ẹ̀ṣẹ́ fọ́ Paulo Costa lójú 'Misita Alagidi, emi leleyi!' ni gbolohun ti Israel Adesanya fi da awọn alatako rẹ lohun lẹyin to da bantẹ iya fun Paulo Costa ninu ija wọn to waye ni  Dubai. Isọri keji ija naa ni Adesanyta ti rọjo ẹsẹ lu Costa ti adari ija naa si bọ si aarin wọn lati pari rẹ ni kiakia. Ni bayi, Adesanya ṣi ni o jẹ olubori Middle Weight Champion of the World. Loju opo Twitter awọn ọmọ Naijiria to fi mọ Minisita feto ọdọ ati idaraya Sunday Dare ti n ki ku orire ija naa Ọjọ nii pẹ, ipade kii jian. Ọjọ Aiku tii ṣe ọjọ kẹtadinlọgbọn oṣu kẹsan an ọdun 2020 ni ajijakandi ọmọbibi orilẹede Naijiria to jẹ aṣaaju ninu ija UFC, Israel Adesanya to yoo koju Paulo Costa ọmọ ilẹ Brazil. Faabada! Ẹyin ologinni ko gbọdọ balẹ. Adesanya ko ti fidi rẹmi ri lati igba to ti di agbaọjẹ lagbo UFC. Ija MMA mọkandinlogun ni Adesanya ti kopa ninu rẹ ti o si jawe olubori ninu gbogbo wọn, nigba ti alako rẹ, Costa ko tii fidi rẹmi ninu ija MMA mẹtala to ti ja. Ilu Abu Dhabi, United Arab Emirates lawọn mejeeji yoo ti waako lọjọ Aiku. Nigba ti wọn n tahun si ara ṣaaju ija ọjọ Aiku, Costa oun yoo gbe Israel tọrọ ba doju rẹ tan nitori ko lara. Amọ ile lo kuku ba Adesanya naa, oun naa sọ pe oorun ti ko si Costa loju ohun lo si n ṣakoba fun un. Adesanya ni ti oun ba le ki Costa lọrun mọlẹ pẹrẹ, o ni ọrun naa ko tun jẹ tirẹ mọ. Israel sọ pe o ṣe oun bi ki ija naa ti bẹrẹ nitori oun ko le duro mọ lati da ẹṣẹ bo Costa lori. Igba mẹrinla ni Adesanya ti lu alatako rẹ lalubami ti wọn maa n pe ni TKO ninu ija mọkandinlogun to ti ja.	https://www.bbc.com/yoruba/ere-idaraya-54306993
politics	ALGON Oyo: Àwọn alága káńṣù APC fẹ́ kí ẹjọ́ ọ̀hún tẹ̀síwájú	Ijọba ipinlẹ Oyo ti gbe igbesẹ lati pari rogbodiyan to n waye ni itubi inubi, laarin rẹ ati awọn alaga Kansu, to ni ki wọn lọ rọkun nile. Agbẹjọro fun ijọba, Akin Onigbinde lo sọ ọrọ naa niwaju adajọ Mashud Abass, nibi igbẹjọ to n lọ lọwọ lori họwuhọwu to bẹ lẹyin idaduro awọn alaga ọhun. O ni ijọba ti pinnu pe ki wọn lọ yanju ọrọ naa laarin ara wọn, ki alaafia lee jọba nipinlẹ Oyo. Onigbinde sọ fun adajọ naa pe, wọn yoo pada si ile ẹjọ ti wọn ba kuna lati pari aawọ laarin ara wọn. Ṣugbọn awọn agbejọro fun awọn alaga ijọba ibilẹ ti wọn da duro, Niyi Akintola ati Kunle Sobolaju sọ pe, igbesẹ yii ko tẹ awọn lọrun. Wọn ni ile ẹjọ gbọdọ da ẹjọ naa nu, ki wọn to lee pari aawọ naa ni itubi inubi. Lẹyin atotonu awọn agbẹjọro mejeji, adajọ Mashud Abass ki awọn agbẹjọro ku iṣẹ takuntakun, to si ni ki wọn lọ yanju ẹjọ naa laarin ara wọn, ki wọn si tun ri daju pe alafia jọba nipinlẹ Oyo. Ile ẹjọ ọhun wa sun ẹjọ naa si ọjọ kejila Oṣu Keji ọdun 2020, lati mọ ibi ti ọrọ de duro, bi bẹẹkọ, oun yoo tẹsiwaju lati gbọ ẹjọ naa. Ọjọ kọkandinlọgbọn oṣu Karun un ọdun 2019 ni gomina Seyi Makinde yọ awọn alaga ijọba ibilẹ naa bi ẹni yọ jiga, to si yan awọn alaga fidihẹ. Sugbọn awọn alaga naa fẹ fi tipatipa pada ṣẹnu iṣẹ eyi to da rogbodiyan silẹ.	https://www.bbc.com/yoruba/afrika-51396115
entertainment	Hisham Wadan: Ìlanilọ́yẹ̀ nípa àrùn ojú ló mú mi ṣe fíìmù Lost in London	Asamọ kan lo ni agbara n bẹ ninu aidape ara, bẹẹ si ni agbara lati se ohunkohun wa ninu akande ẹda kọọkan. Bẹẹ ni ọrọ ri pẹlu Hisham Wadan, tii se ọmọ ọdun mejila ti oju rẹ n fọ lọ diẹdiẹ amọ to pinnu lati jẹ eeyan laye lai fi ti ipenija naa se. Ọmọdekunrin naa ni oun ni ipenija bakan naa nipa iriran ni alẹ, eyi to pe ni Night Blindness. Nigba to n ba BBC sọrọ, Wadan salaye pe ọpọ eeyan lo maa n fi iwọsi lọ nitori aisan oju to ni, ti wọn si maa n fi se yẹyẹ ni ọpọ igba. Eyi si lo mu ki ọmọdekunrin naa se fiimu kan nipa awọn iriri to n la kọja to fi mọ idojukọ to n koju lati ọdọ awọn akẹẹgbẹ rẹ. Àwọn ìtàn mánigbàgbé tì ẹ leè ní ìfẹ̀ síí: Wadam wa korajọ pọ pẹlu ibatan rẹ tii se ọmọ ọdun mejila bakan naa lati se fiimu kan to pe akọle rẹ ni ‘Lost in London. Afojusun ọdọmọde naa to n gbero lati di gbajumọ osere lọjọ ọla, to fi se fiimu naa ni lati se itaniji ati ilanilọyẹ nipa awọn ọdọ to n ni ipenija oju.	https://www.bbc.com/yoruba/agbaye-56876995
sports	Manchester United vs Leicester: Leicester City ṣẹ́ṣó ìyà fún Man United, Man City gba ife ẹ̀yẹ Premier League ti sáà yìí	Ẹgbẹ agbabọọlu Manchester City ti gba ife ẹyẹ Premier League fun saa bọọlu yii. Man City gba ife naa lẹyin ti Leicestrer City lu Man U mọle pẹlu ami ayo meji sẹyọkan lọjọ Iṣẹgun. Ami ayo mẹwaa ni Man City fi n ṣiwaju United ninu eyi ti wọn si ni ifẹsẹwọnsẹ mẹta pere to ku ti wọn yoo gba ti saa yii yoo fi pari. Igba kẹta ti Man City yoo gba ife ẹyẹ Premier League ree laarin ọdun mẹrin ti Pep Guardiola ti di akọnimọọgba wọn.	https://www.bbc.com/yoruba/afrika-57075232
sports	Ìdí rèé tí Man U ṣe já Odion Ighalo sílẹ̀ nínú ìgbáradì rẹ̀ tí yóò wáyé ni Spain	"Odion Ighalo ko ni ba awọn akẹgbẹ ni Manchester United kopa ninu igabradi wọn ti yoo waye lorilẹ-ede Spain nitori ibẹru aisan Coronavirus. Ẹlẹsẹ ayo ọhun darapọ Manchester United lati ẹgbẹ agbabọọlu Shanghai Shenhua lorilẹ-ede China, nibi ti aisan naa ti kọkọ  bẹrẹ. Wọn ni ti Ighalo ba tẹlẹ awọn akẹgbẹ rẹ lo si Spain, o ṣeṣe ki ileeṣẹ aṣọbode ilẹ Gẹẹsi ma gba  a laaye lati pada si orilẹ-ede naa nitori ibẹru aisan ọhun. Akọnimọgba Manchester United, Ole Gunnar Solskjaer sọ fun awọn oniroyin pe yoo jẹ didun inu Ighalo lati darapọ mọ awọn akẹgbẹ rẹ. O ni ""Nitori bi ọrọ ṣe ri lọwọ yii ni China, ko da wa loju pe wọn yoo gba Igahlo laye lati pada wọ ilẹ Gẹẹsi to ba lee jade."" Solskjaer tẹsiwaju pe, nitori naa, Ighalo yoo ṣi wa ni ilẹ Gẹẹsi fun akoko yii. Akọnimọgba naa ni igbesẹ ọhun jẹ fun igba diẹ lati le mọ ibi ti ọrọ aisan Coronavirus naa yoo yọri si. Aisan coronavirus ọhun to bẹrẹ lorilẹ-ede China ti mu ọpọlọpọ ẹmi lọ, ti awọn onimọ ijinlẹ si ti n wa ojutu sii."	https://www.bbc.com/yoruba/afrika-51429558
entertainment	Naira Marley Vs Mohbad: Mi ò mọ ohun tí mó ṣe tí Naira Marley fi ń wá ikú mi	"Ọ̀kan lára àwọn olórin ilé iṣẹ́ orin tàkasúfèé, Marlian music, Ilerioluwa Oladimeji tí ọ̀pọ̀lọpọ̀ mọ̀ sí Mohbad ti ké gbàǹjarè pé àwọn ọmọ ikọ̀ orin náà fẹ́ gba ẹ̀mí òun. Mohbad ní nǹkan aburú bá ṣẹlẹ̀ sí òun, gbajúgbajà olórin tàkasúfèé, Naira Marley àti àwọn ẹmẹ̀wà rẹ̀ ló wà nídìí rẹ̀. Mohbad ké gbàànjarè yìí lóri ẹ̀rọ Instagram rẹ̀ lónìí ní kété tó kúrò ní àhámọ́ àjọ tó ń gbógunti egbògi olóró ní Nàìjíríà, NDLEA. Ó ní ní kété tí òun darí láti àhámọ́ ni àwọn ọmọ ikọ̀ orin Marlian gbìyànjú láti ṣe òun ní jàmbá. Nínú fọ́nrán ọ̀hún Mohbad rọ àwọn olólùfẹ́ rẹ̀ pé kí wọ́n ṣàánú òun, òun kò fẹ́ kú báyìí. Ilé ẹjọ́ ju Evans ajínigbé sẹ́wọ̀n gbére Iléeṣẹ́ ọlọ́pàá ti fi Omoyele Sowore sílẹ̀, Ó ti kúrò ní àhámọ́ ""Epo ló tán nínú bàálù tó já ní Opebi l'Eko"" Bákan náà ló ní ilé ìwòsàn ni òun ń lọ bí òun ṣe wà nínú ọkọ̀ tó ti ń ṣe fọ́nrán náà. Naira marley kò ì tíì fèsì sí fọ́nrán tó gba ìgboro kan yìí ṣùgbọ́n ní òwúrọ̀ yìí ló fi léde lórí ẹ̀rọ Twitter rẹ̀ pé NDLEA ti fi Mohbad sílẹ̀ àmọ́ ó ku Zinoleesky ní àhámọ́. Naira Marley ní ohun tó ń ṣẹlẹ̀ sí àwọn ọmọ òun yìí kò tẹ́ òun lọ́rùn àti pé òun nílò láti padà sí Eko ní kíákíá. Ó ní ohun tó ń ṣẹlẹ̀ yìí jẹ́ ìdúnkokò mọ́ òun àti àwọn ènìyàn òun. Àwọn akẹ́kọ̀ọ́ Nàìjíríà ní Ukraine wà nínú ìbẹ̀rù-bojo lẹ́yìn tí Russia yin àdó olóró sí Ukraine Ṣé lóòtọ́ ni Olubadan tuntun, Lekan Balogun buwọ́lu Tinubu fun ipò arẹ lọdun 2023? Ilerioluwa Oladimeji ní orúkọ tí ìyá àti bàbá rẹ̀ sọ ọ. Orúkọ ìnagijẹ rẹ ní Mohbad. Ní ọjọ́ kẹjọ oṣù kẹfà ọdún 1996 ni wọ́n bí sí ìpínlẹ̀ Eko, tó sì lọ sí ilé ẹ̀kọ́ alákọ̀ọ́bẹ̀rẹ̀ àti girama ní ìpínlẹ̀ Eko bákan náà. ọdún 2016 ló bẹ̀rẹ̀ orin kíkọ tó sì wà lábẹ́ ikọ̀ orin Marlian Music tí Naira Marly dá sílẹ̀."	https://www.bbc.com/yoruba/60527377
religion	Insecurity In Nigeria: Ẹ yàgò fún ádùrá ṣiṣe nínú igbó kí ẹ má kò sí ọwọ àwọn ajínigbe-Iléeṣẹ́ ọlọ́pàá	Ileeṣẹ ọlọpaa nipinlẹ Ogun ti kilọ fawọn olujọsin lati yago fun ṣiṣe adura ninu igbo, ki wọn ma ba ko si ọwọ awọn ajinigbe. Ninu atẹjade kan ti wọn fi sita gba latọwọ alukoro ọlọpaa ipinlẹ Ogun, Abimbola Oyeyemi, ileesẹ ọlọpaa ni ilu ti le kọja ki eeyan maa fi ara rẹ sinu ewu adura ṣiṣe ninu igbo. Oyeyemi sọ pe bo tilẹ jẹ wi pe awọn araalu lẹtọ lati jọsin, amọ wọn ko gbọdọ maa ṣe adura lawọn agbegbe to ba da paro paro. O ni iwe mimọ ni bi a baa n ṣe adura, ki a ma sun asunpara bakan naa. Lọpọ awọn igbo to wa ni ipinlẹ Ogun, ṣiṣe eto isin adura paapa fawọn ẹlẹsin Kristẹni jẹ nkan to wọpọ. Ipenija aabo lẹnu ọjọ mẹta yii si ṣe okunfa bi awọn ajinigbe ti ṣe n sa si abẹ igbo kijikiji lati ji awọn eeyan gbe, nibi ti wọn ba ti n ṣe ijọsin tabi iṣẹ wọn. Ni ipinlẹ Ogun paapa lawọn ilu to ba sun mọ igbo tabi ibode pẹlu orileede mii bi Benin, iṣẹlẹ ijinigbe ko jẹ tuntun. Oyeyemi ṣalaye pe, iṣẹ ipese aabo yii, ti gbogbo ara ilu nii ṣe, tori naa, kawọn araalu daabo bo ara wọn ati dukia wọn. Amọ ṣa, o ni ti o ba wa di dandan ki wọn ṣe ijọsin adura wọn yii, ki wọn kan si agọ ọlọpaa to wa ni itosi wọn fun aabo tabi imọran to peye.	https://www.bbc.com/yoruba/afrika-58627614
entertainment	Bunmi Akinnanu: Ọlọ́run kìí fún èèyàn méjì ní orin ẹ̀mí kan ṣoṣo, ẹ jẹ́ ká ṣe sùúrù	Gbajugbaja akọrin ẹmi kan, Bunmi Akinnanu to kọ orin Omije Oju mi n beere aanu rẹ, ti ke si awọn akẹẹgbẹ rẹ lati mase da orin ẹmi papọ mọ orin aye. Akinnanu, lasiko to n ba BBC Yoruba fi ọrọ jomitorro ọrọ lo gbe imọran yii kalẹ, to si tun woye pe o yẹ ki orin aye wa ni ẹgbẹ kan ni, ki orin ẹmi naa si wa ni ẹgbẹ kan. O ni orin aye ati orin ẹmi ko jọ ara wọn rara, iyatọ nla lo si wa ni aarin wọn. Bakan naa lo tun salaye pe o yẹ ki awọn olorin ẹmi se suuru fun ara wọn lori bi wọn se maa n kọrin ti ẹlomiran ti kọ, ti wọn yoo si ni Ọlọrun lo dijọ fun awọn mejeeji ni imisi orin naa. “Ọlọrun kii fun eeyan meji ni imisi orin kan soso, awa lo yẹ ka se suuru fun ara wa. Nigba to n salaye bo se di akọrin ẹmi ti aye n tẹwọgba, Bunmi Akinnanu salaye pe inu ẹgbẹ akọrin ọmọ ni oun wa ninu ijọ ECWA to wa ni Mushin. O ni awọn lo sawari talẹnti tuntun ninu oun, ti wọn si si ri pe oun le kọrin, lẹyin igba naa ni oun lọ si ẹgbẹ akọrin fun awọn agbalagba. Omije Oju mi ni inu ẹgbẹ akọrin agba yii ni oun ti ri pe oun naa le fi orin ẹmi jẹun. Akinnanu, lasiko to n sọrọ lori isesi ati ihuwasi awọn akọrin ode iwoyi si ti atijọ, o salaye pe isesi awọn akọrin ẹmi lode oni yatọ pupọ si ti awọn iya to n kọ orin naa laye atijọ. “Iwa ta ba lọwọ awọn iya wa laye atijọ kọ ni a n hu lode oni nitori iyatọ nla lo wa nibẹ. Amọ odabi ẹni pe a tun ti n pada lọ si ti atij nitori gbogbo wa la ti mọ bayii pe ba se da gbogbo rẹ pọ nigba yẹ, ta n lu alujo kiri ti yatọ. Ẹni to gbe igbagbọ dani, ko gbe dani, ẹni to si gbe ti aye dani, ko di mu nitori ko jọ ara wọn rara. Maa ri awọn ẹlomiran, wọn yoo maa lo ‘slang’ aye lorisirisi, maa kan wo pe se eleyi jọ orin ijọba ọrun bi.” Bunmi Akinnanu tun salaye fun BBC Yoruba pe oun si wa ninu ijọ Ecwa lodi si ero awọn eeyan pe oun ti fi ijọ naa silẹ. O salaye pe ipe lati ọdọ Ọlọrun ni orin ti oun nkọ, o si yatọ si akọrin inu ijọ lasan. “Lootọ ni Ọlọrun fa mi dide laarin ECWA amọ wọn ri pe oun to wa ninu mi tobi pupọ. N ko sọ pe ko si wahala laarin wa amọ Ọlọrun ti yanju gbogbo, ti wọn si ti fi mi silẹ. Koda, ti wọn ba fẹ se ajọdun, wọn maa n ransẹ pe mi lati wa kọrin fun wọn.” Bunmi Akinnanu ni o yẹ ki akọrin ẹmi maa ni itẹriba fun awọn to ba niwaju, ko si mase gbe igbesẹ lati bi ẹnikẹni subu. O ni bi wọn ba se ri Akọrin ẹmi, lo yẹ ki wọn daa mọ pe akọrin ẹmi ni, lai si igberaga nibẹ. O wa dupẹ lọwọ awọn ololufẹ rẹ pe wọn seun, wọn ku atilẹyin oun nitori naira kan ati meji ti wọn n na fun oun, lo gba akisa kuro lọrun oun.	https://www.bbc.com/yoruba/afrika-60279371
health	World Cancer Day: Ènìyàn 26,000 ni àìsàn jẹjẹrẹ ń pa lóòjọ́	Ajọ Eto Ilera Lagbaye, WHO ti pe akiyesi awọn eniyan si ipa ti aisan jẹjẹrẹ n ko lawujọ, pẹlu akiyesi pe miliọnu mẹjọ eniyan ni yoo ku lọdun yii nipa aisan jẹjẹrẹ. Ajọ Agbaye to ni akọri ti ọdun yii ni 'I am and I will',  fikun wi pe ẹgbẹrun mẹrinlelọgbọn eniyan lo n ku lojoojumọ nitori aisan jẹjẹrẹ. Ajọ naa fikun wi pe o ṣeeṣẹ ki o peleke si ninu ọdun yii pẹlu bi oju ọjọ ṣe n bajẹ si, ti igbe aye awọn eniyan o gbe pẹẹli si ati iru ounjẹ ti awọn eniyan n jẹ. Àkójọpọ̀ àwòrán láti ìpàdé ìtagbangba pẹ̀lú àwọn olùdije ní Ọyọ Àwọn ohun mánigbàgbé níbi ìfọ̀rọ̀wérọ̀ BBC Yorùbá l'Ọyọ Èwo nínú ìlérí tí Buhari ṣe ní 2015 ló ti mú ṣẹ? Gbọ̀ngàn Mapo, ọ̀kan lára ibi àmúyangàn n'Ibadan rèé Link Mímu ọtí líle àti oúnjẹ oní sítáṣì le è fa àrùn jẹjẹrẹ ọyàn - Onímọ̀ Àgbálùmọ̀, ohun mẹ́fà tó ń ṣe lára tí o kò mọ̀ Àwọn àwòrán ẹ̀yìn ìtàgé níbi ìpàdé ìfọ̀rọ̀wérọ̀ BBC Yorùbá l'Eko Day 19: Wo ohun àràmàndà tí àwọn olósèlú máa ń ṣe lásìkò ìbò #BBCNigeria2019 Sowore: olùdíje Ààrẹ tó fẹ gbà Nàìjíríà padà fún àwọn ọdọ	https://www.bbc.com/yoruba/47113701
politics	PDP convention: Ìpàdé ìdìbò 'convention' ẹgbẹ́ òṣèlú PDP ń gbìnàyá l'Abuja	Lẹyin ti igbesẹ alaga ẹgbẹ oṣelu PDP tẹlẹ, Uche Secondus lati pagidina igbade idibo itagbangba ẹgbẹ oṣelu PDP bọ si pabo, awọn aṣoju ẹgbẹ oṣelu naa yoo kọrajọ silu Abuja lọjọ Satide ọgbọnọjọ ati ọjọ kọkanlelọgbọn oṣu kẹwaa ọdun 2021 lati yan awọn adari ẹgbẹ oṣelu naa. Ṣaaju lọpọ ti n woye pe ṣe ipade idibo ẹgbẹ naa yoo lee waye lẹyin ti Uche Secondus gbe ẹgbẹoṣelu naa lọ siwaju ile ẹjọ kotẹmilọrun nibi ti ile ẹjọ kotẹmilọrun nilu PortHarcourt ti paṣẹ pe ko sohun to gbọdọ di ipade idibo naa lọwọ. Ipo mọkanlelogun ni wọn yoo wa awọn eeyan tuntun ti yoo maa tukọ ẹgbẹ naa si, eeyan bii mẹtadinlọgbọn ni yo si maa du ipo naa. Amọṣa ohun ti Gomina ipinlẹ Adamawa, Ahmadu Fintiri to jẹ alaga igbimọ to n ṣe aayan ipade idibo gbogboogbo naa sọ ni pe ipo mẹta pere ninu awsn ipo  naa  ni wsn yoo dibo le lori lẹyin ti ẹnu ti ko lori awọn ti wọn yoo gbe si ipo yoku. Itakangbọn fun ipo igbakeji alaga apapọ ẹgbẹ oṣelu PDP fun ẹkun gusu Naijiria yoo wa laarin gomina ipinlẹ Ọṣun tẹlẹ, Ọlagunsoye Oyinlọla ati igbakeji gomina ipinlẹ Ọyọ tẹlẹ, Taofeek Arapaja. O fidi rẹ mulẹ pẹlu pe igbimọ ayẹwo awọn oludije ti wọgile orukọ awọn oludije kan bii Wale Ọladipọ to gbero ati dije fun ipo igbakeji alaga, Eddie Ọlafẹsọ ati Akintan Oludaisi to gbero ati dije fun ipo akọwe ipolongo. Iwọgile wọn waye lori ẹsun pe wọn gbe ẹgbẹ oṣelu naa lọ sile ẹjọ lawọn asiko kan sẹyin. Bakan naa ni wọn tun wọgile erongba Amofin Muo-Aroh SAN lati dije fun ipo akọwe apapọ ẹgbẹ oṣelu naa nitori pe kii ṣe ipinlẹ Imo ti wọn pin ipo naa si lo ti wa.	https://www.bbc.com/yoruba/afrika-59101896
sports	AFCON 2019: Èmi ò lè fi dáa yín lójú pé a máà bórí o - Ndidi	Oni loni n jẹ! Kẹrẹ kẹrẹ, ifẹsẹwọnsẹ laarin ẹgbẹ agbabọọlu Naijiria, Super Eagles ati ti Cameroon ti n sunmọ. Ṣe ni ọpọlọpọ ti n gbiyanju lati Sọ àsọtẹ́lẹ̀ orílẹ̀èdè tí yóò borí ìfẹsẹ̀wọnsẹ̀ t'òní Akọroyin BBC Yoruba to wa ni Alexandria, orilẹede Egypt nibi ti idije ife ẹyẹ AFCON 2019 ti n lọ lọwọ, Joshua Adetunji tun ba ọkan lara awọn agbabọọlu Super Eagles sọrọ lori ohun ti yoo jade lara ifẹsẹwọnsẹ tonii.	https://www.bbc.com/yoruba/afrika-48891801
