sports	Barcelona vs PSG: Messi fi àbàrá kékeré gba ńlá lọ́wọ́ Mbappe ni Nou Camp	Igba laa ni, ẹnikan o lo ile aye gbo. Ohun lo difa fun ọdọmọde agbabọọlu PSG, Kylian Mbappe to rọ agbaọjẹ agbabọọlu Barcelona, Lionel Messi loye. Goolu mẹta ọtọtọ ni Mbappe gba sawọn Barcelona nigba ti PSG pokọ iya fun Barcelona nile wọn ni ipele ẹlẹni-mẹrindinlogun idije UEFA Champions League lalẹ ọjọ Iṣẹgun. Ṣe ẹ mọ pe akọda oro ko da bi adagbẹyin. Messi lo kọkọ gba pẹnariti wọle PSG lai mọ pe o kọ lẹta si iya ni. Ṣugbọn goolu mẹrin ni Mbappe ati Moise Kean fi da pada lẹyin ti wọn lu Barca mọlẹ bi aṣọ ofi pẹlu ami ayo mẹrin sí ẹyọkan. Iti ọgẹdẹ ti ko to ohun ti a n yọ ada si ni PSG fi ọrọ Barcelona ṣe ni Nou Camp tori elege ara PSG, Neymar gan an ko lanfaani lati kopa ninu ifẹsẹwọnsẹ ọhún lẹyin to ti fi ẹsẹ ṣeṣe tẹlẹ. O ṣeeṣe ki Neymar kopa ninu ipele keji ifẹsẹwọnṣẹ ọhun ti yoo waye logunjo, oṣu kẹta ọdun yìí niluu Paris.	https://www.bbc.com/yoruba/afrika-56094403
health	Elega Village Poor Water: Wo ìlú tí èèyan àti àgùntàn, màálù ti ń pín omi kanṣoṣo mu	"Ọrọ Yoruba to maa n ni omi la bù wẹ̀ omi la bù mu a kii ba omi ṣe ọta fẹ ṣe bakan ni ilu elega ni ipinlẹ Kwara o tori wọn o ri i bu wẹ bu mu. Ilu ti wọn ti ko aja pọ mọ ẹran leleyii o lori ọrọ omi toripe ati eniyan, ""ataguntan, ati maalu, baa ṣe jọ n mu u niyẹn"". Eyi ni arabinrin kan sọ. Bẹẹ, orisun omi kanṣoṣo ti wọn ni ilu yii niyii. Koda itan to rọ mọ ọ ti wọn ni awọn baba nla awọn sọ fun awọn ni pe latigba ti wọn ti tẹ ilu Elega do ni wọn ti bẹrẹ si ni gbẹ oju iho omi yii wọn si tun fi le awọn ọmọ wọn naa lọwọ pe ki wọn tubọ maa gbẹ ẹ si i bibẹẹ kọ omi o le sun jade taara. Awọn ara ilu yii kigbe sita pe awọn n wa iranwọ tori iṣoro omi mimu ti wọn n koju. Ọpọlọpọ iṣoro ni aini omi yii n fa fun wọn to si n pa iṣẹ ọwọ ọpọlọpọ lara to bẹẹ ti awọn eeyan ti igbe aye ilu naa ko ba lara mu n sa lọ si ilu Ilorin atawọn ilu mii. ""Àwọn míì tó wọ ìlú tilẹ̀ ní àwọn ò lè máa bá wa gbé máa mu rẹ."" Ojo ni wọn maa n ṣọ ki ere oko to ba ṣoriire le hu jade. Ẹbẹ awọn araalu yii ko lopin tori wọn o ri ọna abayọ si ọpọ ohun to yẹ ki wọn fi raye gbe. Ẹwẹ, nigba ti BBC kan si ẹka ijọba Kwara lori ọrọ omi, wọ́n fesi pe, o yẹ ki ilu naa tọ awọn wa, awọn o si wa nka ṣe toripe kii ṣe gbogbo ilu lawọn le mọ."	https://www.bbc.com/yoruba/56480831
entertainment	Nollywood: Wo àkójọpọ̀ ohun tó wáyé lágbo àwọn òṣèré tíátà lọ́sẹ̀ yìí	"Oniruuru awọn isẹlẹ nla nla lo waye ni agbo awọn osere tiata lọsẹ yii ti ko yẹ kẹ padanu rẹ. Bi awọn isẹlẹ kan se dun mọ ni ninu, ni awọn kan ba ni lkan jẹ, se tibi tire la da ile aye. Awọn akojọpọ isẹlẹ to waye lagbo tiata lọsẹ yii re ni sisẹ n tẹle. Ori lo mọ iṣẹ aṣela laye. Bolaji Amusan ti ọpọ mọ si Mr Latin ati Odunlade Adekola lọ si ilu oyinbo niluu Vienna lorilẹede Austria nibi ayẹyẹ kanifa aṣọ Adire. Mr Latin lo fi fọto oun ati Adekola nibi ti wọn ti wọ aṣọ Adire nibi ayẹyẹ ọhun niluu Vienna si ori ẹrọ Instagram. MR Latin tiẹ sọ loju opo Instagram rẹ pe ""ẹ o tii ri nkan kan"", eyi to tumọ si pe wọn sẹsẹ n mu ẹyẹ bọ lapo ni. Ori arabinrin kan lo ma ti sọre bayii lẹyin to ya ""tattoo"" Okuneye Olanrewaju Idris, ti ọpọ mọ si Bobrisky si ara rẹ. Bobrisky funra rẹ lo fi fọto obinrin naa, to jẹ ọkan lara awọn ololufẹ rẹ si oju opo Instagram rẹ pẹlu ""tattoo"" to ya si ẹyin rẹ. Bobrisky wa ṣeleri lati ṣe ohun mere-mere fun arabinrin naa. O ṣeleri lati fun obinrin ọhún l'ẹbun miliọnu kan naira, ra foonu to ba fẹ fun un ati pe, oun maa gbe arabinrin naa rinrin ajo afẹ lọ si Dubai. Dokita fun Kemi Afolabi ni oogun oorun lati fara nisinmi lẹyin ayẹyẹ isile rẹ: Lẹyin to ṣe ayẹyẹ iṣile tan, oṣere tiata Yoruba, Kemi Afolabi wa ni igbele nibi ti o ti n sinmi. O ni awọn dokita lo sọ foun pe oun nilo lati sinmi nile tori ilera ara oun. Kemi ni oun ko mọ pe awọn dokita oun fi oogun orun sinu abẹrẹ ti wọn fún oun. Iku doro, iku ṣeka, iku ti mu Lofty Eyiwumi Ray to jẹ aburo gbajugbaja oṣere Mukaddam Eyiwumi Ray ti ọpọ mọ sí Muka Ray lọ. Loju opo Instagram rẹ ni Muka Ray ti sọ nipa iku aburo rẹ obinrin yii. Ibeere ""ki lo de, ki lo ṣẹlẹ"" ni Muka Ray n beere pẹlu ẹdun ọkan lori oju opo Instagram rẹ. Bakan naa lo fi ọrọ bii ""sun re o,  o daarọ si ori Instagram rẹ eyi to fi dagbere fun aburo rẹ to ṣe aláìsi."	https://www.bbc.com/yoruba/afrika-55855905
sports	Diego Maradona: Ohun mẹ́wàá pàtàkì nípa Maradona àti ìbáṣepọ̀ rẹ̀ pẹ̀lú ẹlẹ́sẹ̀ ayò Diego Costa rèé	Erin wo, ajanaku sun bi oke! Gbogbo agbaye papaa julọ awọn ogbontarigi agbabọọlu atawọn ololufẹ ere bọọlu lo n ṣe idaro Diego Amando Maradona to jade laye l'Ọjọru lẹni ọgọta ọdun. Ilumọọka elege ara ni agbabọọlu ọmọbibi orilẹede Argentina, Maradona jẹ, koda awọn eeyan kan gbagbọ pe oun ni agbabọọlu to dantọ julọ ninu iwe itan. Maradona wa lati idile ti wọn ko ṣaaba rọwọ fi họri, o si goke agba di agbaọjẹ agbabọọlu kaakiri agbaaye. Maradona gba ami ẹyẹ pẹlu oriṣiiriṣii ẹgbẹ agbabọọlu lorilẹede Argentina, Italy ati Spain. Eyi ti ọpọ eeyan ko le gbagbe laelae ni idije ife ẹyẹ agbaye eyi ti Maradona gba pẹlu orilẹede rẹ lọdun 1986. Lara awọn abawọn ti awọn eeyan ṣaaba maa n tọka si ni mimu oogun oloro ati ọti lile nigba to n gbabọọlu. Ohun mẹwaa pataki to yẹ ki o mọ ree nipa Diego Maradona 1. Maradona gbarada nigba to gba ami ẹyẹ liigi ọjẹwẹwẹ Argentina pẹlu ẹgbẹ agbabọọlu Boca Juniors lọdun 1982. 2. Lọdun 1984, Maradona fi ikọ agbabọọlu Boca Juniors silẹ lọ si Napoli lorilẹede Italy. Oun lo ṣagbatẹru bi Napoli ṣe gba ami ẹyẹ Serie A ti wọn gba lọdun 1987 ati 1990, ami ẹyẹ Serie A meji pere ti wọn gba ninu itan wọn. 3. Maradona nikan ni balogun ẹgbẹ agbabọọlu to ṣoju orilẹede rẹ fun akoko to pọ julọ. Igba mẹrindinlogun ọtọtọ ni Maradona ṣoju Argentina ninu idije ife ẹyẹ agbaye. 4. Ọmọ ọdun mẹẹdogun ni Maradona wa nigba to bẹrẹ si ni maa gbabọọlu lẹyin to darapọ mọ ẹgbẹ agbabọọlu Boca Juniors logunjọ oṣu kẹwaa ọdun 1979. 5. Ọjọ kẹtadinlọgbọn oṣu keji ọdun 1977 ni Maradona bẹrẹ si ni ṣoju orilẹede Argentina. Ọmọ ọdun mẹrindinlogun lo wa nigba naa, orilẹede Hungary ni Argentina koju lọjọ naa. 6. Ẹgbẹ agbabọọlu Argentinos Juniors ti fi orukọ Maradona sọ papa iṣere wọn, Estadio Diego Armando Maradona ni papa isẹre naa n jẹ bayii. 7. Lọdun 1996, Maradona sọ pe ''mo ti loogun oloro, mo si n loogun oloro, mo si maa loogun lọ laelae.'' Kí lo mọ̀ nípa ìbẹta kan ṣoṣo tí Alaafin Oyo bí? Wọ́n pé ọdún méjìlá báyìí Kílódé tí Ọọni Ife, Oba Ogunwusi kò fi gbọdọ̀ rí ọmọ rẹ̀ tuntun ti Olorì Naomi bí títí di bíi ẹ̀yìn oṣù mẹ́fà? Ilé ẹjọ́ dájọ́ ẹgba mẹ́ẹ̀dóògún fún ọ̀daràn tó jí Iphone ní Kaduna Wo dókítà ọmọ Nàìjíríà tí àgbáyé ń wárí fún nítorí abẹ́rẹ́ àjẹsára COVID-19 Wo ọkùnrin ẹni ọdún 55 tí wọ́n ká agbárí  èèyàn mẹ́rin, àti àwọn ẹ̀yà ara mìí mọ́ lọ́wọ́ ní Ogun Ìyàwó wọ sòkòtò fún ayẹyẹ ìgbéyéwò rẹ̀, ní wáhálà bá bẹ́ sílẹ̀ 8. Lọdun 2000, ajọ to n ṣagbatẹru ere bọọlu lagbaaye, FIFA fi ẹbun agbabọọlu to dantọ julọ ninu iwe itan fun Maradona ati Pele orilẹede Brazil. 9. Maradona sọ fun ra rẹ pe Dalma ati Giannina ni ojulowo ọmọ oun nigba ti awọn yoku jẹ aṣiṣe atipe tori owo oun loun fi bi awọn ọmọ yoku. 10. Wọn sọ ẹlẹsẹ ayo Diego Costa to jẹ ọmọbibi orilẹede Brazil to n ṣoju Spain lorukọ Maradona.	https://www.bbc.com/yoruba/afrika-55083936
health	Nigerian Association of Resident Doctors: Ìyanṣẹ́lódí aláìlójọ́ bẹ̀rẹ̀ káàkiri Naijiria ní	Igba kẹrin ni yii ninu ọdun 2021 ti awọn dokita lorilẹede Naijiria kaakiri gunlẹ iyanṣelodi lati bere fun afikun owo oṣu wọn ni ọwọ ijba. Awọn dokita to ba BBC sọrọ ni ijọba kuna lati risi eto igbaye gbadun awọn dokita ati ẹkọ to peye fun wọn. Awọn dokita naa ni aibikita ijọba si ilakọja awọn dokita kaakiri n fa ifaṣẹyin fun eto ilera ni Naijiria. Wọn ni ijọba kọ lati mu adehun ti wọn ṣe pẹlu wọn ṣe ni nkan bi osu mẹrin ṣẹyin ti wọn da wọ iyanṣelọdi duro nigba naa. Kaakiri Naijiria, awọn dokita akẹkọmọṣẹ, Resident doctors lo poju ninu awọn dokita to n ṣiṣẹ ni Naijiria. Ni ọpọ igba ni iyanṣelodi wọn ma n ni ipalara fun awn to nilo dokita, ti gbogbo ileewosan yoo si da paro-paro. Ẹgbẹ awọn Dokita lorilẹede Naijiria, NARD ti sọ wi pe awọn yoo bẹrẹ iyanṣẹlodi kaakiri orilẹede Naijiria bẹrẹ lati Ọjọ Aje, Ọjọ Keji, Oṣu Kẹjọ, 2021. Aarẹ ẹgbẹ NARD, Dr. Okhuaihesuyi Uyilawa, lo kede rẹ ni ilu Umuahia to jẹ olu-ilu Abia lẹyin ipade gbogbo awọn igbimọ alakoso ẹgbẹ naa. Dokita Uyilawa ninu ọrọ rẹ sọ idi ti awọn yoo fi gunle iyanṣelodi ọlọjọ gbọọrọ naa nitori ijọba apapọ kọ lati mu gbogbo ileri wọn ṣe. O ni lati ọdun mẹwa ṣẹyin ni ẹgbẹ awọn dokita ti ni adehun pẹlu ijọba apapọ lori ọna ati mu idagbasoke ba eto ilera ni Naijiria, ti wọn ko si ri nkankan ṣe si titi di asiko yii. Ẹgbẹ awọn dokita ni Naijiria wa rọ tọrọ aforiji lọwọ awọn ọmọ Naijiria ti iyanṣelodi naa yoo fa ipalara fun wọn. Amọ wọn ni ijọba gbọdọ mu ileri wọn ṣe lori gbogbo adehun ti wọn ṣe pẹlu ẹgbẹ awọn dokita kaakiri orilẹede Naijiria.	https://www.bbc.com/yoruba/media-58045507
entertainment	Salawa Abeni:Ọwọ́ ọlọ́pàá ti tẹ ẹni tó fẹ́ ba Queen Waka lórúkọjẹ́ lọ́jọ́sí	"Ọlọpàá RRS sọ pé ọwọ́ tẹ ọmọkurin ẹni ọdun mọ́kàndinlógún náà tó tún jẹ akẹ́kọ̀ọ́ gboyè National Diploma ní Yaba College of Technology tí ìpinlẹ̀ Eko ní Magboro ni Ipinlẹ Ogun Afurasí náà Olufowoke Oladunjoye Emmanuel ni wọ́n lọ gbé nílé àwọn òbí rẹ lọ́jọ́bọ lẹ́yìn ọjọ́ mẹ́ta ti wọ́n ti n ṣọ́ọ kiri. Kọmisona ìpínlẹ̀ Eko, Hakeem Odumosu sàlàyé pé ni kété ti ọ̀rọ̀ náà ti jẹyọ nínú oṣù kẹrin tí wọ́n mú ẹ̀sùn wá pé ẹnìkan fẹ́ bá Salawa Abeni lórúkọ jẹ́ ní òun ti pàṣẹ fún ẹka RRS láti ṣe ìwádìí irú ẹni bẹ́ẹ̀. Afunrasí ọ̀un nínú ọ̀rọ̀ rẹ̀ fún ọlọ́pàá sàlàyé pé lóòtọ́ òun lòun wà nídìí ìbanilórúkọ jẹ́ náà láti gba owó díẹ̀ ní. Àkẹ́kọ̀ọ́ gboyè ìmọ̀ ẹ̀rọ ni YabaTech ọun ni òun ri fótò ìhònhò náà nínú káàdì ìránti kan ní ìlẹ̀ẹ́lẹ̀ nílé iwé òun ní ínu ọsù kọkanlá ọdun 2019 ní. Ó fí kún pé lẹ́yìn ti òun fi fótò náà si orí fóònù òun tàn, òun wá wá nọ́nbà Waka Quenn lójú òpó instagram rẹ. Lẹ́yìn náà lòun fí àtẹ̀jíṣẹ́ ránṣẹ́ sí gbajúgbajà olórin náà lẹ́yìn ti òun fi àwọn fótò díẹ̀ sọwọ́ síi. Èrò ọkàn mi ni láti gba owó  díẹ̀ ki sì ba àwọn fótò náà jẹ́. ""Mo rò pé gbogbo ǹkan sì ńlọ bí mo ṣe rò ni àfi ti mó gbọ nínú ìròyìn lọ́ja keji pé ẹnikàn ń gbìyànjú láti bá òun lórúkọ jẹ́, ẹgbọ́ ìyá mi ni mo wà nígbà ti ìròyìn náà n lọ lorí Rẹdíò ti ìyá mi náà sì n ṣépè lé ẹni tó fẹ́ ba Salawa lórúkọ jẹ́ láì mọ̀ pé, ẹmi gàn ni mo wà nídìí ọ̀rọ̀ náà"" "" Mo rọra yọ jáde, mo sì lọ ba káàdì ìpè mi àti káàdì ìràntí náà jẹ́ tí mò sì júù sọnu ti fóònù si inú omi kan ni Magboro, kò sì si ẹni to sọ ǹkankan nípa ọ̀rọ̀ náà tabi pé Alhaja Salawa lori ọ̀rọ̀ náà mọ"" Ẹ̀wẹ̀ gbájúgbàja olórin náà Salawa Abeni ti dúpẹ́ lọ́wọ́ gbogbo àwọn olólùfẹ́ rẹ̀ ní Nàìjíríà àti lókè òkun fún àdúrótì, bákan náà lo dúpe lọ́wọ́ àjọ ọlọ́pàá pàápàá jùlọ ẹka RRS fún iṣẹ́ ribiribi tí wọ́n ṣe láti wá ọmọkunbrin náà jáde. Salawa ní òun kọ ni ẹni àkkọ́kọ́ ti ọmọkùnrin yìí ṣe irú rẹ̀ fún, sùgbọ́n òun dúpẹ́ fún ìfẹ́ àti àdúrótì gbogbo ènìyàn Àwòrán ìhòhò: Salawa Abeni ti sọ̀rọ̀, ẹgbọ́ ohun tó wí Salawa Abeni: Mi ò leè gbà kẹ́nikẹ́ni bàmí lórúkọ jẹ́ Gbajugbaja olorin waka, Salawa Abẹni ti sọ pe, oun ti fi ẹjọ abanilorukọjẹ to fẹ fi aworan ihoho oun lede lori itakun agbaye sun ijọba. Salawa lo sọ ọrọ yii ninu ifọrọwerọ kan pẹlu BBC. O ni oun ko mọ ẹni to ṣe iṣẹ ibi ọhun, ṣugbọn bi iku ile o pani, tode ko le pani. Salawa sọ pe ọkunrin naa ba oun sọrọ lori ikanni WhatsApp, to si sọ pe ki oun fun un lowo, bi bẹ kọ, oun yoo fi aworan ihoho rẹ lede fun gbogbo aye lati ri. Gbajugbaja olorin waka naa ṣalaye pe iṣelẹ naa ko tu irun kankan lara oun. Lẹyin naa lo sọ pe oun ko lee gba ki ẹnikẹni ba orukọ oun jẹ lẹyin ọpọlọpọ ọdun to ti n to orukọ ọhun jọ, idi re ti oun ṣe fi ọrọ naa to awọn agbofinro leti. Ṣaaju ni Salawa ti fi ọrọ kan lede loju opo Instagram rẹ, nibi to ti ṣafihan atẹranṣẹ ti ọkunrin naa, to pe orukọp ara rẹ ni Jason tẹ si. Ọkunrin ọhun ṣo pe ki Salawa fun oun lowo, bi bẹ kọ, oun yoo fi aworan ihoho Salawa lede fun gbogbo agbaye lati ri. Lẹyin eyi ni Salawa fun ra rẹ wa fi aworan ọhun lede."	https://www.bbc.com/yoruba/52126930
health	Coronavirus Lockdown: Bí Coronavirus ò pani, ebi yóò pani bí a kò bá tajà, àwọn ọlọ́jà ní Bódìjà ṣàlàyé	Ọpọ eeyan lo ti kọminu lori akoba ti awọn igbesẹ ti ijọba lẹkajẹka gbogbo n gbe lati dena itankalẹ arun coronavirus ni lorilẹede Naijiria. Lootọ arun yii kii ṣe eyi ti o gọdọ tan kalenkako, sibẹ awọn araalu n lọgun pe aisi abuja lọrun ọpẹ lori ọna ti mu ounjẹ wọ inu ẹbi kọọkan ti mu ki ọrọ naa di eyi to so si ni lẹnu bu iyọ sii. Ni ilu ibadan, paapaajulọ ọja Bodija nilu Ibadan, kẹtikẹti lawọn eeyan n tu wa sita lati na ọja wọn lai naani ọrọ ijinasiraẹni ti oloyinbo n pe ni self distancing. Eyi lo sun akọroyin BBC News Yoruba, Adedayọ Okedare lọ ṣe ẹ nlẹ n bẹun si wọn lati mọ ki lo n ṣẹlẹ gan an.	https://www.bbc.com/yoruba/afrika-52251907
health	Ẹ﻿yin ọmọ tí wọ́n kó pamọ́ láti 1992 di ìbejì lántì-lanti ní 2022	Ẹyin obinrin kan ti wọn ko pamọ lati ọgbọn ọdun sẹyin ti di ọmọ to jẹ ibeji. Iṣẹlẹ naa waye ni ipinlẹ Tennessee ni orilẹ-ede America. Igbagbọ wa pe ẹyin ọmọ naa ni eyi ti wọn ko pamọ fun igba pipẹ julọ, to si tun pada di ọmọ. Lati ọjọ kejilelogun, oṣu Kẹrin, Ọdun 1992, ni wọn ti ko wọn pamọ sinu eroja nitrogen. Iya awọn ọmọ tuntun naa, Rachael Ridgeway, to jẹ iya ọlọmọ mẹrin, bi awọn ibeji tuntun naa ni ọjọ kọkanlelọgbọn, oṣu Kẹwaa, dun 2022. Tọkọtaya kan ti wọn ko darukọ wọn, lo ni awọn ẹyin ọmọ naa ti wọn kojọ fun eto IVF, ki wọn le ri ọmọ bi. Ọjọ ori tọkọtaya ti wọn ko darukọ naa jẹ aadọta ati mẹrinlelọgbọn lasiko ọhun. Lati ọdun 1992 si ni wọn ti ko wọn pamọ si ibudo ilera kan ni Guusu America titi di ọdun 2007, nigba ti tọkọtaya naa yọnda wọn fun NEDC niluu Knoxville, Tennessee, ki tọkọtaya mii to nilo rẹ le lo o. Ni ajọ NEDC si ni awọn onimọ nipa ọ̀lẹ inu obinrin ti gbe wọn jade kuro ninu amu nkan tutu, ti wọn si gbe wọn sinu obinrin mii ni ibẹrẹ ọdun yii. Ninu atẹjade kan ti wọn fi sita, NEDC sọ pe ireti awọn ni pe iroyin yii yoo fun awọn eeyan mii ni igboya lati gba ẹyin ẹlomiran lo. Awọn ibeji yii ni ọmọ akọkọ ti tọkọtaya Ridgeway bi pẹlu ilana IVF, lẹyin ti wọn ti kọkọ bi ọmọ mẹrin. Ọkọ iyawo, Philip Ridgeway sọ pe ọmọ ọdun marun-un ni oun wa “nigba ti Ọlọrun da awọn naa, Lydia ati Timothy. “O si ti n pa wọn mọ lati igba naa titi di asiko yii.” Ọgbẹni Ridgeway sọ pe awọn ibeji naa ni ọmọ wọn to dagba ju, botilẹ jẹ pe awọn lo kere ju. Ọjọ ori awọn ọmọ mẹrin ti wọn bi tẹlẹ wa laarin ọdun kan si ọdun mẹjọ. Bi ida mẹrindinlogoji ninu ọgọrun, ni ẹyin ọmọ ti wọn ba gbà lo fi maa n di alaaye ọmọ ni America. Ẹyin ọmọ le wa fun ọpọlọlọ ọdun, ti wọn ba ti gbe e sinu eroja nitrogen. Koda wọn n fi ẹyin to ti lo ju ogun ọdun bi ọmọ. Iye owo IVF kan ni America wa laarin ẹgbẹrun mejila Dọla, ẹyin rira si wa laarin ẹgbẹrun lọna ogun si marundinlogoji Dọla. Ni Naijiria, owo IVF kan lati fi bimọ wa laarin miliọnu kan si miliọnu meji Naira. O si le ju bẹẹ lọ, nitori ileewosan kọọkan lo ni iye to n gba, eto ọtọọtọ si lo wa. Awọn mii le lo ẹyin ti wọn, awọn miran le lo ẹyin ẹlomii. Owo kekere kọ ni awọn to ma n fi ẹyin wọn silẹ ma n gba gẹgẹ bi owo iṣẹ.	https://www.bbc.com/yoruba/articles/c4ne08gq387o
religion	Methodist church Prelate Samuel Kanu: Báyìí nì orí ṣé kò olórí ìjọ Methodist, àlùfáà méjì ní Abia yọ lọ́wọ́ ajínigbé	"Ileeṣẹ ọlpaa ti fidi rẹ mulẹ awọn ajinigbe ti tu olori ijọ Methodist Samuel Kanu ti wọn jigbe ni Abia silẹ. Alukoro ọlọpaa ni ipinlẹ naa lo ṣalaye ọrọ yi fun BBC. Amọ SP Geoffrey Ogbonna ko ṣalaye bi wọn se tu silẹ tabi boya wọn san owo idoola. Ni opin opin ọsẹ to kọja yi ni wọn ji olori ijọ yi gbe. Koda wọn ji alufa ijọ meji kan gbe pẹlu rẹ nigba ti wọn n dari  bọ lati eto ile ijọsin kan to wa ni ipinlẹ Abia. Ọlọpaa ni awọn to wa pẹlu olori ijọ yi naa ti gba itusilẹ Awọn biṣọọbu meji to wa pẹlu rẹ ni Biṣọọbu ijọ Methodist Owerri Diocese, ati Prelate Chaplain ijọ naa. Olori kan ijọ eleto, Methodist Church of Nigeria, Ọmọwe Samuel Uche, ti di awati, lẹyin ti awọn kan ji gbe nipinlẹ Abia. Alukoro ọlọpaa nipinlẹ naa, Geoffrey Ogbonna, sọ fun ileeṣẹ iroyin abẹle, Channels Television pé, ọjọ Aiku ni iṣẹlẹ naa waye. Gẹ́gẹ́ bo ṣe sọ, ojisẹ Ọlọrun naa ati eeyan meji ni wọn ji gbé - Biṣọpu ìjọ Methodist ni Owerri,Rt. Rev. Dennis Mark, ati alufaa kan. Ogbonna salaye pe ni nkan bi aago meji ọsan ni wọn ji wọn gbe lasiko ti wọn kuro nibi ìsìn ìjọ kan nilu Okigwe nipinlẹ Imo, pada si ijọba ibilẹ Umu Nneochi nipinlẹ Abia. Àwọn agbébọn jí fadá ìjọ Kátólíkì méjì gbé ní Katsina ""Akẹ́kọ̀ọ́ 1,440 ní iléẹ̀kọ́ 25 ni àwọn agbébọn ti jígbè lọ ní Naijiria"" Kàyééfì! Àṣírí ìyá àti ọmọkùnrin rẹ̀, afurasi tó jí ọmọ ọlọ́mọ gbé fi ṣe iṣẹ́ aṣẹ́wó f'ọ́dún mẹ́ta tú l'Ekiti Agbẹnusọ ọlọpaa ni ijinigbe naa jẹ nkan tó buru pupọ, ṣùgbọ́n o ni idaniloju wa pe ileeṣẹ ọlọpaa ti n sakitiyan lati ri pe wọn pada sile laaye. Bákan naa lo rọ awọn araalu lati fi to ileeṣẹ ọlọpaa leti, ti wọn ba kẹfin ohunkohun to le mu ki ominira awọn ojiṣẹ Ọlọ́run naa rọrun. Ọjọ diẹ sẹyin ni awọn agbebọ̀n pa ọmọ ile asofin kan nipinlẹ Anambra, Okechukwu Okoye. Wọn ti kọkọ ji Okoye gbe lọjọ kẹẹdogun, oṣu Karun-un, ki awọn araalu to o ri oku rẹ lai ni orí. Shina Peller àti Teslim Folarin tahùn síra wọn lórí ẹ̀sùn ìpànìyàn, wàhálà ṣẹlẹ̀ n'ídìbò abẹ́nú Oyo 'Ìdí rèé tí mo fi ń sin ẹkùn méjì nínú ilé mí'"	https://www.bbc.com/yoruba/afrika-61634478
health	Food Poison: Àwọn oúnjẹ́ mẹ́fà tó lè di májèlé ní àgọ́ ara ta bá jẹ wọ́n papọ̀	"Agọ ara ọmọniyan yatọ sira wọn, ohun ti ẹda kan le jẹ ti yoo ba lara mu, si le sakoba fun agọ ara awọn eeyan miran. Bi o tilẹ jẹ pe gbogbo ounjẹ lo ni anfaani to n se fun agọ ara amọ bi ire se wa ninu ibi, naa ni ibi wa ninu ire, ti isoro si le de ba ẹda lati ipasẹ awsn ounjk naa pẹlu. Idi ree to fi dara ki ẹda kọọkan mọ irufẹ ounjẹ to ba lara mu ati eyi to le jẹ majele fun agọ ara ẹnikọọkan. Bakan naa lo yẹ ki gbogbo eeyan mọ awọn ounjẹ kan to le se akoba fun agọ ara wa, to si le jasi iku ojiji, ta ba jẹ awọn ounjẹ naa papọ. Onimọ nipa ounjẹ jijẹ, Habiba Haruna ba BBC sọrọ lori isọri ounjẹ mẹfa to le di majele ninu agọ ara fun ẹda kọọkan. Ẹja ati Miliki jẹ ounjẹ to ni eroja asaraloore ta mọ si Protein to pọ pupọ, amọ ta ba pa ounjẹ mejeeji pọ, ta si jẹ wọn lasiko kan naa, ewu n bẹ loko longẹ. Isoro le de ba ara wa ta ba jẹ ẹja ati miliki papọ nitori ara wa le kọ ọ. Abala ẹya ara kan ko fẹran lati gba ounjẹ to ni eroja kan naa papọ lasiko kan naa, ta ba si se bẹẹ, o le da wahala silẹ. Oniruuru ọna si ni ẹda kọọkan fi le se afihan pe aapapọ eroja ounjẹ mejeeji naa ko ba oun lara mu tabi pe o ti di majele ni agọ ara oun. Ẹlomiran le maa bi nigba ti ẹlomiran le maa yagbẹ nitori pe o jẹ eroja mejeeji naa papọ, bi o tilẹ jẹ pe awsn mejeeji lo ni anfaani nla to n se fun ara. Isọri eroja ounjẹ meji miran to tun le fa akoba fun agọ ara ta ba jẹ wọn papọ ni ọgẹdẹ ati miliki. Amọ fun awsn eeyan miran, ajẹpọ miliki ati ọgẹdẹ le mu ki oorun kun wsn, ki wsn si sun daradara. Ọgẹdẹ ni eroja kan ti wọn n pe ni Potassiun, ẹni ti eroja yii ko ba si to bo se yẹ ni agọ ara rẹ, le mu miliki mọ pọ ọgẹdẹ lai ni isoro. Amọ fun ẹni ti o ba ni eroja Potassium to yẹ ninu ara, to ba fi jẹ ọgẹdẹ mọ miliki, isoro nla le ba agọ ara rk. Lara irufẹ awọn isoro ti yoo maa ri ni ki ọrun maa yun, ko si maa họ, tabi ki irorẹ pupọmaa yọ loju rẹ, to si tun le ni aisan ẹjẹ riru. Ti a ba fi miliki sinu eroja Lemon, kiakia ni yoo poora, tawọn eroja ara rẹ yoo si di akurẹtẹ Idi si ree to fi jẹ pe ti ẹnikan ba po miliki papọ mọ Lemon, o le di majele ninu ara, bakan naa lo tun le jẹ ki aya maa ta eeyan. Ẹpa dara fun agọ ara, to si wulo ni gbogbo ọna, bakan naa lo ni eroja asaraloore Protein ati Carbonhydrate. Ẹpa tun jẹ eroja kan ti awọn eeyan to sanra maa n lo lati tiirin tabi mu adinku ba ọra ara. Bakan naa ni eroja Olive oil dara lati setọju ara, to si tun n wo ọpọ aisan amọ ta ba da pọ mọ ẹpa, ta si jẹ, o le fa wahala fun agọ ara ti ko fẹran eroja Olive oil. Bakan naa, ta ba lo oogun oyinbo pẹlu awọn ohun mimu aladun to ni gaasi ati eroja Lemon, o le se akoba fun agọ ara. Onimọ nipa ounjẹ ni ta ba lo awọn ọti ẹlẹrindodo to ni gaasi ati eroja Lemon pẹlu oogun, ewu n bẹ loko longẹ. O wa gba awọn eeyan nimọran pe ki wọn mase fi ohun mimu aladun lo oogun kankan, paapaa awọn ohun mimu to ni eroja gaasi ati Lemon. Ti eeyan ba ko ẹran ati ẹyin tutu papọ, ewu nla ni fun agọ ara. O le fa majele ba ara, to si tun le mu ki ẹlomin maa bi tabi yagbẹ nitori pe ko ba wsn lara mu. Ẹran tutu le mu akoba ba ra ti a ko ba se daadaa. Bakan naa ni onimọ nipa ounjẹ ss pe ẹyin tutu ko ni iwulo kankan fun agọ ara ayafi ta ba se tabi din, ka to jẹ. ""Ẹyin tutu ko ni igbẹkẹle, ti a ko gbọdọ gbara le rara nitori ewu ni."" O wa gba awọn eeyan nimọran lati maa jẹ awọn ounjẹ ti yoo se ara wọn loore, ti yoo si se anfaani fun ara wọn lai ni akoba ninu."	https://www.bbc.com/yoruba/afrika-58200596
