health	Pneumonia: Dókítà ní kòkòrò àìfojúrí ló ń fàá òtútù àyà	Ọpọ asọdun lo maa n waye nipa aisan kan ta n pe ni otutu aya eyi ti oloyinbo n pe ni Pneumonia. Koda, aisan yii wọpọ ni Naijiria, paapa laarin awọn ọmọde, ti ajọ Unicef si ti kede pe orilẹede Naijiria wa lara awọn ti aisan naa ti wọpọ lagbaye. Nigba to n ba BBC Yoruba sọrọ, Onisegun oyinbo kan, Dokita Afeez Oladele ni aisan otutu aya ko ni ohunkohun se pẹlu otutu rara nitori eeyan lee sun si ori ilẹ lasan tabi si aya si ẹrọ amuletutu lai wọ asọ, ti onitọun ko si ni ni otutu aya rara. O ni awọn kokoro kan ti a ko lee fi oju ri lo n fa aisan naa, ti a si lee ko awọn kokoro kekeke naa latinu afẹfẹ buruku, eefin, eedu, tabi ka lo ife ati ifọyin ẹni to ba ni aisan naa. O wa gba awọn obi nimọran lati maa tete gbe awọn ọmọde ti wọn ba kẹẹfin pe o n hu ikọ lọ sile iwosan fun itọju, ki aisan naa to bọwọ sori.	https://www.bbc.com/yoruba/afrika-50509486
entertainment	Odunlade Adekola: Wo Aàmì èye tí Odunlade Adekola gbà ní AMVCA	"Gbajugbaja oṣere tiata Nollywood to tun n gbe awo orin jade, Odunlade Adekọla ti gba ami ẹyẹ oṣere tiata ọkunrin to pegede julọ ni agbo oṣere. Odunlade bori awọn oṣere to kopa ninu fiimu Rattle Snake, Amina, Gold Coast Lounge ati awọn miran lati gba ami ẹyẹ naa. Ami ẹyẹ AMVCA ni wọn ma n fun awọn oṣere fiimu, awọn ti wọn jọ ṣe fiimu ati gbogbo awọn ti wọn jọ kopa ninu ẹ. Lara awọn akẹgbẹ rẹ to gboriyin fun Adekola ni Bukunmi Oluwashina to ṣe fiimu ''Jankariwo'' to fi gba ami ẹyẹ. Bukunmi lasiko to n gboriyin fun akẹgbẹ rẹ ni o jẹ moriya fun oun. Bakan naa lo dupẹ lọwọ oṣerekunrin naa ti oun pe si fiimu oun to si da loun nipa fiimu rẹ ''Jankariwo'''. ''A ṣe aṣeyọri lori fiimu Jankariwo. Iwuri nla lo jẹ fun mi bi wọn ṣe darukọ fiimu mi fun igba meji ni ami ẹyẹ to gajulọ ni ilẹ Afrika. ''Ẹ ku oriire ẹgbọn mi, ti mo n pe ni ''Number 1""', ẹ se ti ẹ jẹ iwurii ninu iṣẹ ti ẹ yan laayo.'' Bakan naa ni Bukunmi dupẹ pe o gbọ ipe oun lori fiimu naa, to si gboriyin fun pe iṣẹ nla to ṣe. ''Mo dupẹ lọwọ awọn to bami ṣiṣẹ naa ti wọn si jẹ ko ṣe aṣeyọri.'' Fiimu naa gba ami ẹyẹ gẹgẹ bi fiimu Yoruba akọkọ ti wọn yoo fi orukọ rẹ lede fun ami ẹyẹ ni ọna meji. Ami ẹyẹ Ilẹ Africa ti ''Africa Magic Viewers'Choice Awards (AMVCA), waye ni Ọjọ Kẹrinla, Oṣu Karun un, 2022. Ami ẹyẹ naa ni awọn kan ma n pe ni ami ẹyẹ ti Oscar ti ilẹ Afrika, ti wọn ti n fun awọn oṣere fiimu, awọn to n gbe wọn jade ati awọn onimọ miran ni ẹka wọn. Ọdun yii ni ami ẹyẹ naa tun pada si ilẹ Afrika lẹyin ti wọn ko lee ṣe ni ọdun to kọja nitori ajakalẹ aarun Coronavirus."	https://www.bbc.com/yoruba/media-61468257
politics	Iye ìgbà tí àyípadà ti bá orúkọ, àmì ìdánimọ̀ àti àsìá ìpínlẹ̀ Osun	Kete ti Gomina tuntun fun ipinlẹ Osun, Ademola Adeleke, kede pe ayipada ti ba orúkọ ipinlẹ naa, ati awọn ami idanimọ rẹ, to fi mọ orin ipinlẹ ni ẹnu ti n kun lori rẹ. Ọjọ Aiku, ọjọ́ kẹtadinlọgbọn, oṣu Kọkanla, ọdun 2022, ni Gomina Adeleke kéde àṣẹ naa, lasiko to n sọ ọrọ akọsọ rẹ lẹyin ti wọn bura fun un tan niluu Osogbo. Gomina tẹlẹ fun ipinlẹ Osun, Rauf Aregbesola, lo yi orúkọ ipinlẹ naa, 'Osun State', pada si 'State of Osun' ni ọdun 2011. 'Osun State' ni ipinlẹ naa ti n jẹ lati ọdun 1991 ti wọn da a silẹ kuro lara ipinlẹ Oyo. Yatọ si orúkọ, Rauf Aregbesola tun yi awọn ami idanimọ, ti wọn n pe ni 'Emblem' ati 'Coat of Arms' ni èdè Gẹ̀ẹ́sì padà. Bakan naa lo yi orúkọ inagijẹ ipinlẹ naa pada si 'Land of Virtue' to túmọ̀ si ipinlẹ Ọmọluabi, dipo 'State of the Livingspring', eyi to tumọ si 'orisun iye'. Ọpọlọpọ awuyewuye lo waye lori igbeṣẹ Aregbesola, ṣugbọn o mu erongba rẹ ṣẹ. Ile aṣòfin ipinlẹ Osun lasiko naa buwọlu igbeṣẹ Gomina Aregbesola. Ni ọdun 2017, ile ẹjọ giga ipinlẹ Osun, to wa nílùú Ilesa, da ẹjọ́ pe ayipada orúkọ naa ko ba ofin mu. O si wọgile orúkọ tuntun naa. Wọn si fi sinu ofin ipinlẹ naa lọjọ kejidinlogun, oṣu Kejila, ọdun 2012. Abala marun-un si ni wọn pín sí. Abala akọkọ - Orin ipinlẹ Abala kejì -  Ami idanimọ Abala kẹta - Àwọn itumọ ati nkan ti eroja to wa ninu asia ipinlẹ naa tumọ  si Lẹyin ikede ti Gomina Ademola Adeleke fi sita lọjọ Aiku lori dida orúkọ, asia ati awọn ami idanimọ ipinlẹ Osun pada si bo ṣe wa tẹ́lẹ̀, iroyin sọ pe ile aṣòfin ipinlẹ naa ti tako o. Iroyin kan ti BBC ko tii fi mulẹ sọ pe ile aṣòfin ipinlẹ naa ti sọ nibi ijoko wọn pe igbeṣẹ Adeleke ko le ṣẹ. Ẹni to jẹ alaga igbimọ fun eto iroyin nile aṣòfin naa, Kunle Akande, ni iroyin sọ pe o fi ikede naa sita. Sugbọn iroyin mii tun sọ pe aṣòfin kan, to jẹ ọmọ ẹgbẹ́ oṣelu PDP, Adewumi Adeyemi, sọ pe ayederu ni nkan ti wọn ni àwọn aṣòfin sọ. Aṣofin sọ pe ilé aṣòfin ipinlẹ Osun ko tii ṣe ipade kankan tabi jiroro lori ọrọ àkọ́sọ Gomina Adeleke.	https://www.bbc.com/yoruba/articles/c0drlz0rk21o
health	Coronavirus in Nigeria: Ǹjẹ àgbo lè ṣe òògùn coronavirus?	Oriṣiiriṣii nnkan lawọn eeyan n sọ pe o le wo aarun coronavirus ti o ba gbogbo aye finra lọwọ. Laipẹ yii ni aarẹ orilẹede Madagascar polowo agbo kan pe o le wo aarun aarun coronavirus. Ko si ohun to jọ bẹẹ raa! Ajọ eto ilera lagbaye, WHO sọ pe iwadii si n lọ lọwọ lori ati wa oogun tabi abẹrẹ to le wo coronovirus ṣugbọn ko sii oogun rẹ bayii. Alaye lẹkunrẹrẹ fidio yii.	https://www.bbc.com/yoruba/52399191
health	Coronavirus: Kínni ìtàkùn ayélujára 5G nííṣe gan na pẹ̀lú ààrùn coronavirus?	Ọpọ eeyan kaakiri agbaye papaa julọ lorilẹede Naijiria lo n gbe ahesọ ọrọ kan kiri pe itakun ayelujara 5G n ṣokunfa aarun coronavirus. Amọ, ajọ eleto ilera lagbaaye, WHO ti ṣalaye pe itakun agbaye 5G ko lagbara to bẹẹ to fi le wọn inu ara eniyan lati fa aarun covid-19. Ẹ maa gbagbe pe itakun ayelujara 5G n lo afẹfẹ lati mu igbayegbadun awọn eeuan to ba n lo ẹrọ ibanisọrọ. BBC Yoruba ṣe alaye lẹkunrẹrẹ lori itakun ayelujara 5G.	https://www.bbc.com/yoruba/52185852
politics	Oyo FCC Bill: Ìjọba Ọyọ ní ẹni tí kò bá lẹ́bọ lẹrù, kò yẹ kò bẹ̀rù àjọ FCC	"Ọjọ́ Ajé ni Gómìnà ìpínlẹ̀ Oyo, Seyi Makinde buwọlu abadofin kan láti ṣe àgbékalẹ̀ àjọ tó ń gbógun ti ìwà jẹgúdújẹra ni ìpínlẹ̀ Oyo, FCC. Nínú ọ̀rọ̀ Gomina, ó ni àgbékalẹ̀ àjọ náà kìí ṣe láti gbógun ti ẹnikẹni bikose lati ri daju pe awọn eeyan ko akoyawọ ni gbogbo ileesẹ́ ati ẹka isejọba. Sùgbọ́n, ó dàbi ẹgbẹ́ alátakò ni ìpínlẹ̀ Oyo kò rìií bẹ́ẹ̀. Lásìkò tó ń bá BBC Yorùbá sọ̀rọ̀ lórí ìgbésẹ̀ Makinde náà, Ayodeji Abass Aleshinloye to jẹ ọmọ ẹgbẹ́ òṣèlú APC ní ìpínlẹ̀ Oyo sàlàyé pé, kò sí ǹkan ti gómìnà ń ṣe ju láti gbogun ti àwọn ọmọ ẹgbẹ́ alátakò nípínlẹ̀ Oyo. Nínú ọ̀rọ̀ rẹ̀, o ní ""kò sí ìjọba kankan to le dún koko mọ àwọn, nítori pé, ti ijọba ba gbìyànju irú ẹ, ilé ẹjọ wà láti gbé ẹjọ náà lọ."" O tún mẹnu ba pé, gomina Makinde to ni Ajimobi fí ìdá ààdọrun owó iṣẹ́ ti a n gbé jade se ẹbun fún àwọn ènìyàn, ló tún tún iṣẹ́ òde náà gbé sita pẹ̀lú Bíliọnu mẹsàn àti miliọnu lọna ẹẹdẹgbẹwa naira, lẹ́yin to sọ pé Bílíọnu meje ti pọju fún irú iṣẹ́ ode náà. Alẹshinlọyẹ ni, ""ibúwọlù àbádofin náà kìí ṣe nítori ìfẹ́ ará ìlú, sùgbọ́n ọ̀nà láti dún koko mọ àwọn ọmọ ẹgbẹ́ alátako ni àti pe, òṣèlú  lásàn ni Makinde ń se."" Amọ sa, Kọmisọna fétò ìròyìn ni ìpínlẹ̀ Oyo, Wasiu Olatunbosun naa salaye fun BBC Yoruba pe Makinde ti kede pé àgbékalẹ̀ ajọ to n gbogun ti iwa ibajẹ naa, kìí ṣe láti kó ẹnikẹni láyà jẹ, ẹni ti kò bá si lẹ́bọ lẹ́ru kò nílò láti maa fòyà lóri irú ǹkan bẹ́ẹ̀. Olatunbosun ni ""kìí ṣe ìgbà àkọ́kọ́ rèé ti ìrú àjọ bàyìí yóò di gbígbé kalẹ̀, àwọn ìpínlẹ̀ míràn náà ti dá irú ẹ sílẹ̀ tẹ́lẹ̀, pàápàá jùlọ, Kano àti Kaduna àti pé, gomina funra rẹ setan láti gbé òfin máfọwọ́ kànmi ti gomina maa ń ni ti sẹ́gbẹ̀ kan, to ba huwa aitọ tàbi kówó jẹ."" Ọlatunbọsun wa n beere pe""Kíló de to fi jẹ́ pé ìgbà ti Seyi Makinde bẹ̀rẹ̀ ni ariwo yóò wá bẹ̀rẹ̀? Ipínlẹ̀ Oyo kàn n fẹ́ láti mọ bi wọ́n ṣe ná gbogbo owó rẹ̀ ni, gbogbo ẹni to ba wà lori ijoba lásìkò kan gbọdọ mọ bi a ṣe n ná owó náà"" ""Ti ìjọba to kọja ko bá lẹ́bọ lẹru, kò yẹ kí wọ́n bẹ̀ru, kìí sì ṣe pé àjọ náà yóò kan jòkó síbì kan láti sọ pé lágbàjá kówó jẹ, bí kò ṣe pé ọ̀rọ̀ náà yóò dé ilé ẹjọ láti fun olúkùlùkù lànfàni. Lóri ti òpópònà Mọniya si Iseyin, Olatunbosun ni Seyi Makinde koro oju si isẹ naa, lẹ́yin àgbéjade iṣe ode náà, to yẹ ki wọ́n ṣe fun ọdun kan, ti wọn si gba bílíọnu meji naira fun, ko ni ojuutu kankan fun osu meje, ti wọ́n ko si ṣe kilomita kan ninu kilomita mẹtadinlọgọta. Olatunbọsun ni ǹkan ti Seyi Makinde n ṣe ni oju agbara, eyi ti ijọba ana ko fi kun nkan ti wọn fẹ́ ṣe, sùgbọ́n ni bayìí, agbasẹse gbọdọ pari isẹ rẹ̀ láàrin ọdun kan lai ni ànfani owo miran titi ti yóò fi ṣe iṣẹ́ idá ọgọta iṣẹ́ náà."	https://www.bbc.com/yoruba/50761863
religion	Pope Election: Èyí ni bí wọ́n ṣe n dìbò yan Póópù tuntun nínú ìjọ Àgùdà	"Igbimọ awọn cardinal wa to maa n pejọpọ lati dibo yan Poopu tuntun. Awọn cardinal ni awọn olóyè ijọ to tobi ju. Poopu lo maa n yan wọn si ipo, wọn si ṣaba maa n jẹ oye biṣọọpu. Wọn yoo pe wọn si ipade ni olu ijọ Aguda, to wa ni Vatican, idibo yoo si tẹle e- 'conclave' ni wọn maa n pe eto idibo naa. Awọn cardinal bi igba le mẹta lati orilẹ-ede mọkandinlaadọrin lo wa. Ẹni to ba si ti dagba ju ọgọrin ọdun lọ laarin wọn ko le dibo. Ìkọ̀kọ̀ ni ìdìbò nàá ti n wáyé: Wọn maa n ṣe eto idibo naa ni ayika to pamọ. Niṣe ni wọn maa n ti awọn Cardinal naa mọ ibi kan, ni olu ijọ Aguda, Vatican to wa ni ilu Rome l'orilẹ-ede Italy, Ko si si ẹnikẹni ninu wọn ti yoo bọ si jade bọ si gbangba titi eto idibo naa yoo fi pari, ti wọn si fẹnuko lori Poopu tuntun. Ko pọn dandan ki awọn cardinal naa o yan ọkan lara wọn - ninu akọsilẹ, ọkunrin ijọ Aguda yoo wu to ba ti ṣe iribọmi ni wọn le yan ni poopu - ṣugbọn àṣà sọ pe cardinal ni wọn yoo fẹ ẹ gbe e fun. Eto idibo yii maa n waye fun ọpọlọpọ ọjọ ko to o dipe Poopu tuntun jẹ. Wọn maa n wa ni ipamọ; ko si nkan to jọ tẹlifisan, radio, iwe iroyin tabi ẹrọ ibaraẹnisọrọ. Dokita meji pere, awọn to n tun ile ṣe ati awọn alufaa to ni ẹtọ lati gbọ ijẹwọ ẹṣẹ awọn eniyan ni oriṣiriṣi èdè nikan ni anfaani wa fun lati wọ inu ibi ti wọn wa. Koda, awọn dokita ati awọn oṣiṣẹ to ku gbọdọ bura pe ọrọ kankan nipa idibo naa ko ni i ti ẹnu awọn jade, tabi lo ẹrọ ayaworan ati gbohun-gbohun. Gbogbo eyi n waye, ki aṣiri kankan nipa idibo naa ma ba a tu sita lasiko to n lọ lọwọ tabi to ba pari. Ti ikilọ si wa pe wọn yoo yọ ẹnikẹni to ba sọrọ jade l'ẹgbẹ. Gbọngan ile isin Sistine Chapel ni eto idibo naa ti maa n waye, ""nibi ti ohun gbogbo ti faaye gba iwa laaye Ọlọrun, niwaju ẹni ti gbogbo eniyan yoo ti gba idajọ ni ọjọ kan"". Lọjọ ti eto idibo naa ba fẹ ẹ bẹrẹ, awọn cardinal naa yoo ṣe Isin ni owurọ, ki wọn o to to o wọle sinu ijọ. Ni kia ti wọn ba si ti wọleni wsn yoo bura lati pa aṣiri gbogbo mọ. Lẹyin naa ni ẹnikan yoo paṣẹ fun gbogbo awọn ti ko ni i kopa ninu idibo lati jade sita ki wọn o to o ti ilẹkun. Awọn cardinal naa ni oore-ọfẹ lati mu iwe idibo kan pere dani ni ọsan ọjọ akọkọ. Lati ọjọ keji, iwe idibo meji ni wọn yoo mu dani owurọ, ati meji ni ọsan. Igun mẹrin ni iwe idibo naa ni. Wọn si ti tẹ ọrọ yii ""Eligio Summum Pontificem"" (""Mo dibo yan Alufaa to tobi ju lọ""), si apa oke. Isalẹ ni aaye wa lati kọ orukọ ẹni ti wọn ba yan si. Wọn si maa n paṣẹ fun awọn cardinal naa lati kọ orukọ ẹni naa ni ọna ti ẹnikẹni ko le mọ wi pe awọn ni wọn kọ ọ, ki wọn o si ka iwe pelebe naa lẹẹmeji. Ti wọn ba ti dibo tan, wọn yoo da gbogbo awọn iwe pelebe naa pọ, wọn yoo ka a, wọn yoo si ṣi wọn. Ẹni kan lara awọn to n woye yoo maa pe orukọ cardinal kọọkan ti wọn dibo fun bi wọn ba ṣe n ka awọn iwe pelebe naa. Yoo si fi abẹrẹ gun iwe kọọkan lati fi okun kan pere de wọn pọ. Lẹyin eyi ni wọn yoo dana sun awọn iwe naa - eefin rẹ yoo si han si awọn to n woran ni ita. Eefin naa maa n yipada lati dudu si funfun ni kete ti wọn ba yan poopu tuntun. Wọn maa n da koriko tutu mọ aro ti wọn fi n dana sun wọn, lati le mu eefin naa dudu. Sugbọn, lati bi ọdun melo kan si asiko yii, awuyewuye n wa lori àwọ eefin naa. Aró ni wọn n lo bayii. Bi eto idibo keji yoo ba waye, wọn yoo ko awọn iwe idibo akọkọ si ẹgbẹ kan, wọn yoo si dana sun wọn papọ mọ ti idibo keji. Bayii ni wọn yoo ṣe titi ti oludije kan yoo fi ni ibo to pọ ju. Nini ilana idibo naa, oludije gbọdọ ni ida meji ninu ida mẹta ibo ki wọn o to kede rẹ pe o wọle (ida meji naa yoo le ẹnikan, ti iye awọn cardinal to dibo ko ba ṣe e pin si mẹta). Bi ẹnikẹni ko ba ni ìdá meji lẹyin ọjọ kẹta, wọn yoo da idibo duro fun ọjọ kan lati faaye silẹ fun adura gbigba, ijiroro ati ""iwaasu ranpẹ"" lati ẹnu cardinal ti oyè rẹ ga ju. Lẹyin eto idibo, wọn yoo kọ awọn esi ibo sinu iwe kan, wọn yoo si gbe e le poopu tuntun lọwọ. Wọn yoo fi pamọ si ibi kan ninu apo iwe ti wọn lẹ pa, eyi ti wọn ko le ṣi ti poopu ko ba paṣẹ rẹ. Eefin to n jade lati inu ile lasiko ti wọn n dana sun iwe idibo nikan ni àmì pe idibo n lọ lọwọ. Ni kete ti oludije kan ba ti ni ìdá meji ibo, wọn yoo beere lọwọ rẹ pe: ""Ṣe o faramọ iyansipo rẹ gẹgẹ bi poopu Alufaa to ga ju?"" To ba si ti sọ pe bẹẹni, wọn yoo sọ fun un pe ko yan orukọ to fẹ ki wọn o maa pe e. Lẹyin to ba ti yan orukọ kan, awọn cardinal to ku yoo sun mọ poopu tuntun lati fi ori balẹ fun un. Poopu tuntun yoo wọ aṣọ oye rẹ. Aranṣọ awọn poopu ti maa n ran awọn aṣọ naa silẹ fun ẹni to sanra tabi ti ko sanra - ṣugbọn wọn le ṣe atunṣe pajawiri si i. Lati iwaju ita ijọ Peteru Mimọ (St Peter's Basilica) ni wọn yoo ti kede pe: ""Annutntio vobis gaudium magnum... habemus papam!"" - ""Mo kede ayọ nla fun un yin...a ti ni poopu tuntun!"" Lẹyin naa ni wọn yoo kede orukọ rẹ, poopu tuntun naa yoo si jade si gbangba fun igba akọkọ. Yoo sọ ọrọ diẹ, yoo si gba adura ibukun Urbi et Orbi - ""si ilu yii ati si aye""."	https://www.bbc.com/yoruba/agbaye-50910232
sports	Siasia: Ọlọ́pàá Bayelsa ṣalàye ibi tí wọ́n bá ìyá Siasia tó bọ́ sọ́wọ́ ajínigbé	Iroyin to tẹwa lọwọ latọdọ ile iṣẹ Ọlọpaa Bayelsa ni peawọn agbebọn ya wọ ile arabinrin Beauty Siasia wọn si ji i gbe lọ. Ninu atẹjade ti agbẹnusọ ile iṣẹ ọlọpaa ipinlẹ Bayelsa, SP ASinim Butswat fi ranṣẹ si ile iṣẹ BBC o fi aridaju han pe lootọ ni wọn ji iya agbabọọlu ati akọnimọọgba Naijiria tẹlẹ ri, Samson Siasia gbe. Atẹjade naa ṣalaye pe ni nkan bi agogo meji oru ganjọ ọjọ kẹẹdọgbọn oṣu keje ọdun 2019 ni awọn agbegbọn ti ẹnikẹni ko mọ gba ọna oju omi River Nun wọ ile Arabinrin Beauty. Ẹni ọdun ọgọrin ọdun ni Arabinrin Beauty to n gbe ni ilu Odoni ni ijọba ibilẹ Sagbama ipinlẹ Bayelsa ti wọn si ji i gbe lọ gba ori omi lọ si ibi ti ẹnikẹni kò mọ̀. Kọmiṣana ọlọpaa ipinlẹ Bayelsa ni atoun ati ikọ amuṣẹya awọn ti ṣe ibẹwo si ibi ti iṣẹlẹ naa ti waye ati pe ile iṣẹ awọn pẹlu ajọṣep awọn mii tọrọ kan nipa aabo ti kan lu agbami wiwa awọn agbenipa yii ati lati doola iya ti wọn ji gbe.	https://www.bbc.com/yoruba/48992384
entertainment	FIBAN: Ìpàdé àláàfíà wáyé láàrin KWAM 1 àti FIBAN, ìjà pari	"Gbonmi si omi o to to waye laarin ẹgbẹ awọn sọrọsọrọ Naijiria ta mọ si FIBAN ati akọrin Fuji KWAM 1 ti pari. Ọrọ naa yanju lẹyin ipade alaafia kan to waye tawọn mejeeji si ni awọn ti pana ohunkohun to n da wahala silẹ. Ni aafin Olu ti ilu Itori ni ipade yi ti waye ti Wasiu Ayinde si sọ pe oun ko paṣẹ ki awọn ọmọ gbẹ oun kankan lu Mc Murphy. Nitori naa aarẹ ẹgbẹ FIBAN Desmond Nwachukwu ti wa pasẹ ki awọn ọmọ ẹgbẹ naa jeburẹ ki wọn si bẹrẹ si ni lo orin KWAM 1 lori eto wọn. Àwọn ọmọ ẹgbẹ́ FIBAN ti fi ààké kọrí lórí ìṣẹ̀lẹ̀ to wáyé láàrin MC Murphy tó jẹ́ ọmọ ẹgbẹ́ wọ́n ní ìpińlẹ̀ Ogun àti gbájúgbaja olórín fújì, King Wasiu Ayinde Mashall. Nínú ọ̀rọ̀ rẹ̀ lásìkò tó bá BBC Yoruba sọ̀rọ̀, ní ààrẹ ẹgbẹ́ FIBAN Desmond Nwachukwu sàlàyé pé, àwọn ṣì ń dúró de Ọjọ́rú ọjọ keje, ọdún yìí kí àwọn tó gbé ìgbẹ́sẹ̀ tó kan lórí ọ̀rọ̀ náà. Nwachukwu ní, lẹ́yin ọjọ́ náà, ti Wasiu Ayinde ko ba bẹ̀bẹ̀ gẹ́gẹ́ bi àwọn ṣe kọ̀wé ránṣẹ́ sí í lórí ǹkan ti àwọn ń fẹ́ kó ṣe, lawọn yoo ṣe iwọde lọ sọdọ Kabiyesi iku baba yeye lati rọ ọ loye gẹgẹ bi Mayegun ilẹ Yoruba. Ó  ní ìdí tí àwọn fi fẹ́ kí wọ́n gba oyè lọ́wọ́ Máyégún gbogbo ilẹ̀ Yorùbá ní pé ìwà tó hù kò bá ìlànà oyè tó jẹ́ lọ nítorí náà, Aláàfin Ọyọ Ọba Lamidi Adeyemi gbọ̀dọ gbà á lọ́wọ́ rẹ. Lórí ẹgbẹ̀rún lọ́nà ọgọ́rún Náírà ti Murphy gbà lọ́wọ́ K1, o ní láti le dáàbò bo ẹ̀mi rẹ nítori túlàsì ni wọ́n fi fún un ni owó náà. Tí ọ̀rọ̀ bá sì ti rí bẹ́ẹ̀, ó ti pọndandan ki ènìyàn dáàbò bo ẹmi ara rẹ náà. Lẹ́yìn tí Wasiu Ayinde bá wá ti gbé ìgbésẹ̀ tí ẹgbẹ̀ náà bèrè fún ni àwọn yoo tó mọ̀ boya àwọn yóò dá owó náà padà bi bẹ́ẹ̀ kọ́, owó ọhun kò tí tó ǹkan ti àwọn fi ṣe ìtọ́jú MC Murphy. Ó rọ gbogbo olórin láti so ewe agbéjẹ́ mọ́wọ́ lórí bi wọ́n ṣe máa n huwa sí àwọn akọròyìn, ìwà ìyànjẹ to fi mọ ìwà àitọ sí àwọn akọròyìn ní Naìjíríà. Bákan náà ló fi kún un pé, ìdáhùn ọkan lára amúgbálẹ́gbẹ̀ẹ́ K1 to bá BBC Yoruba sọ̀rọ̀ tó sí ló àwọn ọ̀rọ̀ kan, ẹgbẹ náà ni láti mọ̀ bóya òun gan ló fún un láṣẹ lati sọ̀rọ̀. Bákan náà ni wọ́n gbọdọ̀ tọ̀rọ̀ àforijì lórí ọ̀rọ̀ náà. Àwọn ọmọ FIBAN kò gbọdọ̀ lo orin Wasiu Ayinde mọ́ lẹ́yìn ìfìyàjẹní Murphy- FIBAN Ẹgbẹ awọn oniroyin aladani, FIBAN ti kede pe ọmọ ẹgbẹ wọn kankan ko gbọdọ lo orin Wasiu Ayinde kankan mọ lori eto wọn. Aarẹ ẹgbẹ FIBAN, Desmond Nwachukwu lo fi lede ninu atẹjade kan lati fesi si iṣẹlẹ to ṣẹlẹ laarin Wasiu Ayinde ati oniroyin Wole Sorunke ti wọn n pe ni MC Murphy. Nwachukwu ni iṣẹlẹ naa ko dun mọ awọn ninu nitori pe ki i ṣe igba akọkọ ni yii ti Kwam 1 yoo ma hu iru iwa bayii ni igba de igba. O ni ọrọ abuku ni asoju Kwam 1, Kunle Rasheed sọ nipa iṣẹlẹ naa fun BBC News Yoruba nibi to ti sọ fun ẹgbẹ FIBAN lati sa ipa wọn lori iṣẹlẹ naa, koda wọn le e gbe awọn lọ si ileẹjọ. ''Ma a bẹ awọn ọmọ ẹgbẹ lati da ọrọ Rasheed nu, nitori ko si otitọ kankan to sọ pẹlu ọrọ kubakugbe to sọ si ẹgbẹ FIBAN.'' ''Rasheed tabuku lu wa nitori pe o pe wa ni ẹgbẹ ti ko ni oye nipa iṣẹ to n ṣẹ'' ''Nitori naa ni bayii, ko si ọmọ ẹgbẹ wa kankan ti yoo lo orin Kwam 1 lori eto wa kaakiri iwo oorun orilẹede Naijiria.'' ''Bakan naa ni a ti ranṣẹ si awọn adari ileeṣẹ radio ati amọhunmaworan lati tẹlẹ aṣẹ wa lati maṣe lo orin Kwam 1 mọ.'' Ẹgbẹ FIBAN fi kun un wi pe awọn yoo ṣewode lọ si aafin ti Alaafin Oyo lati fi aidunnu wọn han si iwa ifiyajẹni ti Kwam 1 n wu lawujọ. Bakan naa ni awọn yoo bẹrẹ lọwọ Alaafin lati rọ ọ loye Mayegun ti Ilẹ Yoruba nitori ihuwasi rẹ ti ko ba ọna asa ati iṣe Yoruba mu. Ni owurọ ọjọ Abamẹta ni ariwo gba ilẹ kan pe, ilumọọka akọrin Fuji ati Mayegun ilẹ Yoruba, Wasiu Ayinde Mashall, ti ọpọ eeyan mọ si Kwam 1, gba gbajumọ agbohunsafẹfẹ kan leti loju agbo. Alákòso orín Wasiu Ayinde Mashall, Adebayo Olasoju to ba BBC Yoruba sọrọ lórí fóònù ṣàlàyé pé, ọ̀rọ̀ tó ṣẹlẹ kìí ṣe èyí tó yẹ ki ó jáde rárá nítóri, ọmọ iṣẹ́ K1 ni MC Murphy. Kété ti ọrọ náà bẹrẹ si ni ran ka ni BBC kan si àwọn to jẹ́ ti K1, nítori owe àgbà ló sọ pé agbẹ́jọ́ ẹnikan dájọ àgbà òṣìkà ni. ""Tí ọ̀rọ̀ bá ṣẹlẹ̀ láàrín K1 àti MC Murphy ti Murphy kò si le pé Wasiu Ayinde to wá gbé ẹjọ lọ sí ọ̀dọ̀ àwọn oníròyìn , òun ló mọ"" ""Tí àwọn FIBAN bá sì fẹ́ lọ sí ilé ẹjọ́, kí wọ́n nìsó níbẹ̀"" Ọ̀rọ̀ ti a ń múgbọ́ jú ti Murphy lọ, a ò ni ẹjọ́ kankan ti a fẹ́ bá a rò"" Alakoso orin Kwam 1, Adebayo Olaasoju sọ fun BBC Yoruba pe, ọrọ naa ko ri bẹẹ rara nitori Kwam 1 ko lee gba ẹnikẹni leti rara. ""Awọn wo lo na a, se Kwam 1 ni. Ọmọ Wasiu ni MC Murphy now, ko si yẹ ko gbe ọrọ naa lọ sọdọ awọn akọroyin, oun n gan mọ pe oun ko sọ ootọ bi ọrọ naa se ri.' Bakan náà BBC bá ilumọọka agbohunsafẹfẹ naa ti wọn pe ni Wole Sorunke, ti ọpọ eeyan mọ si MC Murphy, ẹni tii se oludari eto gbogbo nileesẹ radio Fresh FM to wa nilu Abeokuta náà sọ̀rọ̀. Gẹgẹ bi iroyin naa se wi, nibi ayẹyẹ ọjọ ibi ọgọta ọdun Olu tilu Itori, Ọba Abdulfatai Akorede Akamọ ni isẹlẹ naa ti waye, lasiko ti wọn pe Kwam 1, ko wa kọrin nibẹ. A gbọ pe Mayegun se agbohunsafẹfẹ yii, bii ọsẹ tii se oju, to si fi se ẹlẹya lori ọrọ ti ko to nnkan. Ọna lati fi idi otitọ mulẹ nipa iroyin yii, lo mu ki BBC Yoruba kan si MC Murphy, ka le mọ bi isẹlẹ naa se waye. Nigba to n ba BBC Yoruba sọrọ, Murphy ni lootọ ni ọmọ isẹ gbajumọ olorin Fuji , Wasiu Ayinde, to pe orukọ rẹ ni KC gba oun leti, ti Wasiu Ayinde funra rẹ gan si fi bata tẹ oun ni ori ati ẹnu mọlẹ. O fikun pe, lẹyin to tẹ oun lori ati ẹnu tan, ni Wasiu to wa sẹsẹ tun n gbe oun lori dide, eyi ti ko bojumu rara. ""Mo kọkọ n wo pe se ẹgbọn n ba aburo rẹ wi ni abi ibo ni mo ti se asise? Abi nnkan kan sẹlẹ ti Alhaji ko ri ni, abi nnkan ti ko yẹ ki wọn sọ fun wọn ni wọn gbọ ni, ko tiẹ ye mi."" Murphy ni oun lọ siwaju Kwam 1 lati nawo fun ni, ki o le ki ẹnikan ti oun n ba se onigbọwọ, ki oun si fi ọrọ ẹni naa to leti pe onitọun fẹ wa na lowo fun loju agbo. Amọ o ni, Wasiu Ayinde ko dahun, ti oun si sọkalẹ loju agbo naa. ""Sugbọn bi mo se sọkalẹ ni mo gbọ gba leti mi, ti wọn si da mi dọbalẹ, ti wọn n fi bata tẹ mi lori mọlẹ. Gbogbo awọn ero to wa loju agbo lo binu, ti wọn si kuro nibẹ. Murphy ni Olu ti ilu Itori tawọn lọ ba se ayẹyẹ ti bẹ oun, nitori oloye ni oun nilu Itori, oun si ni Aarẹ Amuludun fun gbogbo ilu Itori. ""Mo maa n promote awọn olorin, mo si mọ pe Wasiu gbọ ọrọ ti ko yẹ ni nitori ko ye mi nipa oun ti wọn gba mi leti si, kii si se eeyan bẹẹ."" Nigba ta bi pe ki lo fẹ se nipa isẹlẹ yii, MC Murphy ni isẹlẹ naa ti kọja agbara oun, ti olu ile ẹgbẹ awọn agbohunsafẹfẹ ni Naijiria, FIBAN, si ti tẹsẹ bọ ọrọ naa. ""Wasiu Ayinde funra rẹ gan ti n bẹ mi, to si ti pe mi pe, ki n ranti pe oun ni ẹgbọn oun. Ti Wasiu ba na mi ni kọrọ, o to eeyan to le na mi, amọ eyi to se ni gbangba lo ku diẹ kaa to. Ọlọrun kan fẹ ki iru nnkan bayii sẹlẹ ni, ki Alhaji Wasiu ma baa se iru nnkan bayii mọ."" O wa rọ awọn akọroyin atawọn adari eto, ta mọ si MC pe, ki wọn maa bọwọ fun ara wọn, ki wọn ma si toju bọ ayẹyẹ ti wọn ko ba pe wọn si, tori awọn abuku bii eleyi."	https://www.bbc.com/yoruba/afrika-54398762
