politics	2023 Father Kukah: Ilééṣé ààrẹ fèsì sí Kukah,wọn ní ìwàásù rẹ̀ ń mú ìyapa wà láàrin àwọn ọmọ Nàìjíríà	"Ileeṣẹ aarẹ lorileede Naijiria ti fesi pada si ọrọ ti Biṣọọbu ijọ Katoliiki ilu Sokoto, Matthew Hassan Kukah sọ ni itako ijọba aarẹ Buhari. Gẹgẹ bi atẹjade ti wọn fi sita ṣe wi, wọn ni Kukah lo ọrọ ajọdun Ajinde rẹ lati fi mu iyapa wa laarin awọn ọmọ Naijiria ni. Garba Shehu to jẹ agbẹnusọ aarẹ ni ki Kukah gbaju mọ iṣẹ rẹ bi bẹẹ kọ ko darapọ mọ iṣẹ oṣelu. Ninu alaye rẹ Garba Shehu ni ''a fi tọwọ tọwọ beere ki Kukah fi iṣejọba silẹ fawọn araalu to dibo ati oloṣelu ti wọn dibo yan ko si kọju mọ iṣẹ tiẹ'' Koda o tun fi ẹsẹ iwe mimọ kin ọrọ rẹ lyin pe ''ẹsin jẹ nkan to mọ ati pe oun to tumọ si ni ki eeyan ṣabẹwo si awọn orukan ati opo,ko si ko ara rẹ ni ijanu kuro lọr ile aye'' Bakan naa ni Garba Shehu sọ pe awọn ẹsun ti ko fẹsẹ rinlẹ ni Kukah fi n kan ijọba apapọ Naijiria. O ni kaka ki Kukah lo asiko ọdun ajinde lati ṣe iwaasu isọkan, niṣe lo n fi n sọ ọrọ iyapa ati arinyanjinyan nipa ofin. ''awọn ẹsun to ka si ijọba lẹsẹ kan ṣe afihan iru inunibini to ni si ijọba ni'' Bẹẹ naa ni Shehutun gba Biṣọọbu Kukah lamọran [pe bo ba tiẹ fẹ bẹnu atẹ lu ijọba pẹlu ọrọ tutu lo yẹ ko fi ṣe. O ni bi awn oniwasu tabi olori sin ba ro pe awọn ni ijọ ti yoo tẹti gbọ ọrọ wọn,''ohun ti ko da ni bi wọn baa n ko ọrọ aburu ati iyapa siwọn leti'' Igba akọkọ kọ ni yi ti Kukah ati ileeṣẹ aarẹ Naijiria yoo maa ta oko ọrọ si arawọn. Lọpọ igba ni Father Kukah ti maa n bẹnu atẹ lu iṣejọba aarẹ Buhari paapa lori ikọlu sawọn Kristẹni ni apa ariwa Naijiria. Kukah ti fi igba kan sọ fun ile aṣofin orileede Amẹrika pe awn janduku agbebon ati darandaran Fulani to fi mọ Boko Haram n doju le awọn ile ẹkọ ni ariwa Naijiria paapa awọn ti Kristẹni. Ọrọ yi wa lara awọn eleyi ti ko mu ki ijọba Buhari ri gẹgẹ bi ọrẹ ti ileeṣẹ aarẹ kii si fi ọrọ bo lati ṣapejuwe rẹ gẹgẹ bi ẹni ti ko fran ijọba aarẹ Buhari. Àwọn iròyin tì ẹ leè ní ìfẹ̀ síí: Biṣọọbu ijọ Katọliki ti ilu Sokoto Matthew Hassan Kukah tun ti sọko ọrọ si ijọba aarẹ Buhari lori ailemojuto aabbo ati kikoju ajẹbanu ni Naijiria. O fi eyi lede ninu ọrọ to sọ lori pẹpẹ lasiko ọdun ajinde eleyi to pe akọle rẹ ni  'To mend a broken nation: The Easter metaphor' . Ninu ọrọ yi, o sọ fun aarẹ Buhari pe awọn ọmọ Naijiria ko da orileede wọn mọ mọ nitori awọn alaburu eeyan ti n ṣapata rẹ bọ lati ọjọ to ti pẹ. Gẹgẹ bo ti ṣe ṣalaye, ipenija to n koju Naijiria kii ṣe idibo ọdun 2023 to n bọ lọna bi kii ṣe bi wọn yoo ṣe ṣọ awọn ọmọ ilẹ naa papọ ni alaafia. Ọrọ pọ to sọ amọ awọn koko marun un kan ree ti a ri fayọ ninu rẹ: Ajẹbanu ohun jẹgudujẹra Labẹ akori ọrọ yi, Kukah ni bi ajẹbanu ṣe n gbooro si ni Naijiria niṣe lawọn origun igbe aye miran n dẹnukọlẹ. Gẹgẹ bo ti ṣe wi, ''ko jẹ tuntun ka maa beere pe bawo la ṣe de ibi taa de yii. Ipenija to wa ni baa ṣe ribi jade kuro ninu ọfin taa ja si. Amọ o ṣeeṣe ka tun maa bere pe jade lọ sibo?'' O ni niṣe ni ''ọkan wa ti daru, orileede wa naa ti dẹnukọlẹ. O dabi ileewosan itọju iṣẹlẹ pajawiri ti o kun fọfọ''. Olori ẹlẹsin, asiko to kẹẹ koju ipenija to delẹ Nipa awọn olori ẹlẹsin Kukah ni ọrọ to ta mọ awọn naa leti aṣọ wa. O ni asiko ti to bayi kawọn olori ijọ ẹlẹsin ṣugbaa Naijiria ki wọn koo yọ kuro ninu ewu to wa bayi. Ati olori ẹlẹsin Kristẹni ati Musulumi ko si ẹnikan to yọ silẹ ''awa olori ẹsin Islaamu ati Kristẹni, a ni lati fi ododo koju ipa ti ẹsin n ko lorileede wa.'' O tẹsiwaju pe ''a gbọdo doju kọ nkan to de ba bayi to ṣe pe awọn ọgọrọ eeyan lo n fojojumọ kuro ninu ẹsin Islamu ati Kristẹni.'' O ni wọn ko le maa kọ eti ikun si ko ko ko ẹsẹ awọn ọmọ ijọ to n rin lọ si inu ainigbagbọ ati igbe aye ti ko ka Ọlọrun si. Lori awọn ipenija to ni ko niye to n koju Naijiria Kukah ni eleyi to lagbara julọ kii se ti ọrọ ti idibo 2023 to n bọ lọna. O ni ipenija bawọn ọmọ Naijiria yoo ṣe wa wa papọ ni irẹpọ jẹ eleyi to ka ni laya julọ. Nibi lo si ti sọ bo ṣe maa n sọ tẹlẹ pe ijọba aarẹ Buhari ti mu ipinya ba awọn araalu nipa ẹsin, ẹya ati agbegbge ti wọn ti wa. Kukah sọ pe afojusun ijọba yi nipa mimu ipinya wa laarin araalu ti sọ awọn eeyan Naijiria sinu ewu. O pari ọrọ rẹ pe Naijiria ko ri iru ipinya bayi ri ninu akọsilẹ itan orileede naa. Nibi ni Kukah ti bẹnu atẹ lu bi ijọba ṣe n ṣe idarijin fawọn agbesunmọmi lorileede Naijiria. O ni ""asiko to ki a bẹrẹ si ni ronu nipa Naijiria to ju ibi tawọn ajinigbe ati janduku ti sọ ara wọn di gaba ni ilẹ wa. A ko le maa dakẹ ka si maa tan ara wa pe ikọlu to n waye yi ko lọwọ ẹsin ninu"". Kukah wa daba ọna abayọ lori ipenija yi eyi to ni ''fifi ofin mulẹ lori nkan ti iwe ofin sọ nipa jijẹ orileede ti ko faramọ ẹsin kan ju omiran lọ lo le mu ki a sọ ipo ti ẹsin yoo ko lawujọ wa.'' Kukah ni oun ko tako ẹlẹṣẹ to ba yiwa pada tabi ọdaran to ba fi iwa ọdaran silẹ ṣugbọn ṣe kii ṣe pe ọgbọn ẹwẹ ni iyipada tawọn alaburu yi lawọn yi pada jẹ? Aarẹ Naijiria to n bọ ati iru iwa to yẹ ko ni Eleyi ni ṣe pẹlu awọn amuyẹ yo yẹ ki ẹni ti yoo ba jẹ aarẹ Naijiria ni ati ipenija ṣiṣe atunṣe nkan to bajẹ lara Naijiria. O ṣe agbekalẹ awọn amuyẹ to yẹ ko wa lara ẹni to ba n gbero lati di aarẹ Naijiria. Ninu awọn nkan to darukọ, o ni ẹni naa gbọdọ jẹ eeyan to ni ''ọkan, ẹmi ifarajin ati ẹmi ti o wa laaye' ti ko ku'' O ni ipo aarẹ Naijiria kiiṣe ipo ti o gbọdọ da lori ẹya ẹsin tabi agbegbe ibi ti ẹni naa ba ti wa. O ni ẹni to maa jẹ aarẹ Naijiria gbọdọ jẹ ''ọlọkan, to ni ẹmi ifarajin to si gbọdọ ni gbedeke iru ijiya tawọn araalu gbọdọ jẹ labẹ rẹ''. Kukah sọ pe Naijiria ko nilo ọrọ olugbala nbọ ti ko ni anfaani faraalu. O ni Naijiria nilo ẹni ti yoo le ṣatunto nkan to bajẹ lara Naijiria, ti yoo gbọn ebi ohun iṣẹ kuro faraalu'' Lakotan o ni ẹni ti yoo ba jẹ aarẹ gbọdọ ni ẹri ti yoo fi han pe oun le ko Naijiria yọ kuro ninu ile iwosan ti wọn sọ da yi. O fikun pe atilẹyin ṣe pataki fun ajọ eleto idibo INEC ati awọn eronja mii fun idibo to poju owo. O ni oun bẹnu atẹ lu awọn to n lo jagidijagan lati maa fi dunkoko mọ araalu."	https://www.bbc.com/yoruba/afrika-61138769
religion	Malaysia Church: Ilé Ẹjọ́ fìdájọ́ lélẹ̀, Krìstẹ́nì lẹ́tọ̀ọ́ gẹ́gẹ́ bí àwọn Mùsùlùmí láti pe Ọlọ́run ní Allah	Ile ẹjọ giga lorileede Malaysia ti fofin si ofin ọlọdun marundinlogoji kan to ni awọn Kristeni ko le pe Ọlọrun ni Allah ninu ijọsin wọn. Ọrọ ki awọn Kristeni maa lo Allah lati juwe Ọlọrun jẹ eleyi to n da wahala silẹ laarin awọn ẹlẹsin mejeeji yi. Awọn musulumi lo ko ida meji ninu ida mẹta eeyan ilẹ naa ṣugbọn awọn Kristẹni naa wa nibẹ. Ohun tawọn Kristẹni ilẹ yi n sọ ni pe o ti pẹ tawọn ti n lo Allah lati inu ede larubawa tawọn ti ya si Malay tawọn n sọ. Gẹgẹ bi wọn se ṣalaye, bi igba ti wọn tapa si ẹtọ awọn ni aṣẹ ma juwe Ọlọrun pẹlu Allah yi jẹ fawọn. Ofin ilẹ Malysia faaye gba ki onikaluku maa ṣẹṣin rẹ bo ti ṣe wu u ṣugbọn ọrọ orukọ Allah yi jẹ nkan ti awọn eeyan ko dunnu si. Lọdun 2008 iṣẹlẹ kan waye lori ọrọ yii nigba tawọn alaṣẹ Malaysia fipa gba awọn disiki oniwaasu Kristẹni kan Jill Ireland Lawrence Bill fẹ gbe wọ ilẹ naa. Idi ti wọn lawọn ṣe bẹẹ ni pe wọn lo Allah lati fi juwe Ọlọrun ninu akọle wọn. Lati igba naa ni o ti ko ṣẹjọ lati tako ofin ti wọn ti gbe kalẹ lati 1986 pe Kristẹni ko gbodọ pe Ọlọrun ni Allah. Lọjọru ni ile ẹjọ giga to w ani Kuala Lumpur gbe idajọ silẹ pe idẹyẹsi ni wọn ṣe si latari ẹsin rẹ. Adajọ Nor Bee sọ pe Allah ati awọn ọrọ mẹta mii Kaabah(ile tawọn musulmi n kọju si kirun) Baitullah to tumọ si ile Ọlọrun ati Solat, irun kiki ti di ẹtọ fawọn Kristẹnilati lo O ni aṣẹ to ni ki wn maa lo awọn ọrọ yi ko bofin mu. Igba akọkọ kọ yi ti edeaiyede ti n waye lori lilo orukọ Allah fi juwe Ọlọrun fawọn Kristẹni.	https://www.bbc.com/yoruba/agbaye-56356732
health	Marijuana Use: Àwọn onímọ̀ ìjìnlẹ̀ ṣàlàyé ewu àti ànfàní tó wà nínúi igbó mímu	"Egboogi igbo jẹ okan lara awọn egboogi ti ijọba apapọ ti gbẹsẹle ni Naijiria, ọpọ awọn ọdọ lo si ti wa ni ahamọ nitori pe wọn n mu egbogi naa. Amọ atimọle yii ko tii di ọpọ eeyan mii lọwọ lati fi egboogi naa silẹ. Lootọ ni awọn onimọ ijinlẹ sọ pe igbo ni anfanni to n ṣe fun agọ ara, amọ, egboogi naa tun ni awọn ewu kan ninu, idi rẹ ti ijọba aapọ ṣe gbẹsẹle, ti ajọ NDLEA si n fi ṣikun ofin mu awọn to n ta, tabi ti wọn n mu. Awọn onimọ ijinlẹ so pe igbo wulo lati wo awọn asisan ninu agọ ara eeyan. Onimọ ijinlẹ kan, Ọjọgbọn Makuochi Muobike sọ fun BBC pe igbo dara fun awọn to ni aisan ti wọn n pe ni ""post-traumatic stress disorder"" ati arun ""Parkinson."" Dokita miran, Udodi Okoli sọ pe igbo maa n ran awọn ti kii ri orun sun lọwọ lati sun daadaa Amọ oni dokita nikan lo yẹ ko sọ iye iwọn igbo ti eeyan le mu nitori ilera ara rẹ nigbakugba. O ni ""Bo tilẹ jẹ pe igbo ni anfaani to pọ, kii ṣe ogun to yẹ ki dokita sọ pe ki alaisan lọ lo nitori aṣilo rẹ."" Awọn ewu wọnyin ni awọn onimọ ijinlẹ ti sọ pe o wa ninu igbo amuju. Ajọ NDELA ni ajọ ti ijọba apapọ fun ni agbara lati gbogun ti igbo mimu, ati awọn egboogi oloro mii. Ijiya fun ẹnikẹni ti aje ọrọ naa ba ṣi mọ lori ni ẹwọn ti iye rẹ to ọdun mejila. Bo tilẹ pe awọn ajọ ati oloṣelu kan ti n sọ pe ki ijọba Naijiria ka ofin to fi de igbi mimu kuro nilẹ, amọ ijọba apapọ ti kọ lati ṣe bẹẹ."	https://www.bbc.com/yoruba/60428973
religion	Ì﻿jọba ti ṣọ́ọ̀ṣì tí wọ́n ti n ta 'omi ayẹta ìbọn' fun àwọn olùjọ́sìn ní Kogi	Ijọba ipinlẹ Kogi ti ti ile ijọsin kan pa fun ẹsun pe alufaa ijọ naa n ta omi ayẹta fun awọn ọmọ ijọ. Ọjọ Aje ni wọn gbe ilẹkun ile ijọsin naa, New Jerusalem Deliverance Ministry lẹyin ti Gomina Yahaya Bello paṣẹ rẹ Pasitọ ijọ naa, Peter Adeiza tun ṣi ileewosan lai gba aṣẹ lọwọ ijọba lati ọdun 2008. Igbagbọ wa pe ọpọ eeyan lo ti padanu ẹmi wọn nitori ilana ti wọn n gba ṣe itọju wọn. Awọn ileeṣẹ iroyin abẹle jabọ pe, yatọ si pe wọn n ṣe itọju aisan, ati igbẹbi alaboyun nibẹ, wọn tun n lo ṣọọṣi naa fun itọju aarun ọpọlọ, ti wọn si so ọpọ wọn pẹlu ṣẹkẹṣẹkẹ. Ijọba sọ pe Alufaa Adeiza n lu awọn ọmọ ijọ rẹ ni jibiti nipa ti ta omi kan fun wọn, ‘ti ko ni i jẹ ki ọta ibọn ko ran wọn’. Awọn ọmọ ijọ naa kan sọ fun awọn akọroyin pe lootọ ni baba wọn ninu Oluwa ọhun n fun awọn ni iwosan lori oriṣiriṣi aisan ati aarun. Oludamọran lori aabo fun ijọba ipinlẹ Kogi, Jerry Omodara, sọ pe awọn ọlọpaa ati DSS ti kọkọ mu pasitọ naa nigba kan, lati tọpinpin nkan to n ṣẹlẹ ninu ṣọọṣi naa. Omodara sọ pe awọn ni ẹri to to lati fihan nile ẹjọ pe iṣeṣi pasitọ naa tako ilana ẹsin ati iṣegun oyinbo. O ṣalaye pe laipẹ ni wọn o gbe e lọ sile ẹjọ.	https://www.bbc.com/yoruba/articles/czvnzpvy9jzo
religion	Yoruba gods: Wo àwọn òrìṣà méje ìṣẹ̀mbáyé tó di ilẹ̀ gbogbo àgbáyé mú	Awọn oriṣa ni ilẹ Yoruba jẹ igbagbọ awọn ẹlẹsin ibilẹ paapaa ni orilẹede Naijiria, Benin ati Togo. Ọpọlọpọ awọn onigbagbọ ninu oriṣa iṣẹmbaye ni wọn ri awọn orisa yii gẹgẹ bi ọlọrun wọn. Wọn gbagbọ wi pe awọn orisa yii ṣiṣ̣ẹ pọ fun ara wọn ni, amọ wọn ki n ṣe nkankan naa lati ọdọ Olodumare to ran wọn wa si ile aye. Ohun tí ìyàwó Adeboye ṣe ní ìgbà akọkọ tó fojú hàn lẹ́yìn ikú ọmọ wọn Dare Pasítọ̀ Dare, ọmọ́ Pásítọ̀ Adeboye ti dágbére fáyé Ìyá àláwo tó di àjíhìnrere òjijì fi àwọn òrìṣà rẹ̀ ṣe ẹlẹ́yà Paapaa wọn ni igbagbọ wi pe awọn orisa yii dabi angẹli tabi iranṣẹ olodumare ti awọn eniyan ma n pe ni igba iṣoro. Lara awọn orisa naa ni Esu, Ogun, Ọbatala, Yemọja, Osun, Sango ati Ọya, ti wọn pe ni Ọrumila. In ilẹ Yoruba, awọn ̣elẹsin ibilẹ gbagbọ wi pe esu jẹ oriṣa to lagbara pupọ, to si jẹ iranṣẹ laarin aye ati ọrun, to fi mọ agbede meji. Oun si ni ọkan lara awọn orisa ti o ma n tọ awọn oku sọna lẹyin ti wọn papoda. Wọn gbagbọ wipe esu ni a n ke pe ti ohun ba daru, ti eniyan si n wa ọna abayọ tabi ojutu si nkan to wọ. Bakan naa ni wọn ri ẹmi esu gẹgẹ bi orisa alarekereke, to ṣeeṣe ko tan eniyan jẹ. Awọn aṣọ pupa ati dudu ni o jọ mọ orisa yii, ti wọn si n lo ata wẹwẹ, taba mimu ati ounjẹ gbigbona lati fi bọ oriṣa yii. Ogun jẹ orisa akunlẹbọ ti wọn gbagbọ wi pe oun ni ẹni keji to lagbara julọ ninu awọn orisa meje to ku. Ogun ti gbogbo eniyan mọ pẹlu irin, ni o ma n ṣiṣẹ iwosan to si jọba lori gbogbo ohun ti a fi irin da. Awọn ẹlẹsin ibilẹ gbagbọ wipe abiyamọ tootọ ni Ogun, ti o ma n ṣe atilẹyin fun ọmọde ati idile. Oun si ni wọn n pe lati bura tabi rin irinajo. Wọn gbagbọ wi pe oriṣa kan ti kii sinmi ni Ogun jẹ, to si ma n fi ẹjẹ wẹ bi omi. Amọ, ẹnikẹnị ti ẹjẹ ba n yọ ni ara rẹ ko gbọdọ sunmo idi oriṣa Ogun. Lati bọ Ogun, wọn ma n lo ewe ni ẹba titi, irin, ẹjẹ, awọn ohun ija, ẹran, ogogoro ati bẹẹ bẹẹ lọ. Ọbatala jẹ ọkan lara awọn orisa meje ti o tutu pẹlu ẹbun itusilẹ ati alaafia. Amọ, oun ni awọn oloriṣa gbagbọ wi pe o ma n da awọn eniyan ti ko pe, paapaa awọn akanda eniyan. Ọbatala ni o ni suuru julọ laarin awọn ẹmi meje yii, to si ma n ṣe idajọ ododo. Oriṣa yii fẹran awọn eniyan ti kii ṣe alara gbigbona, ti wọn si le e ko ara wọn ni ijanu. Aṣọ funfun ni a mọ pẹlu Ọbatala, ti o si ma n ṣiṣẹ iwosan fun awọn to ba ni ailera, paapaa awọn akanda ẹda. Bẹẹ si ni Ọbatala kii gba oṭi kikan rara, yatọ si omi, miliki, ṣuga, ọgẹdẹ ati bẹẹ bẹẹ lọ. Yemọja jẹ obinrin lara awọn orisa meje to di ile aye mu, to n gbe ninu omi, to si n jọba lori gbogbo omi nla nla. Yemọja to jẹ ẹja nla ninu odo ni ibatan Osun to jọba lori awọn omi kekeke. Awọn ẹlẹsin ibilẹ gbagbọ wi pe olupese ni Yemọja, to n pese ọmọ to si n fun awọn eniyan ni ohun meremere ninu omi, amọ o si le e fa ibinu yọ bi ẹkun omi tabi iji lile. Lailai, Ọya ati Yemọja kii ṣe ọrẹ nitori naa wọn kii gbe wọn si ibi kan naa. Awọn arinrinajo lori omi ma n bọ lẹba odo, ki wọn to bẹrẹ irinajo wọn, ki o le lo ni irọwọ-rọsẹ. Oriṣa akunlẹbọ yii ni awọn ẹlẹsin ibilẹ gbagbọ wi pe o jọba lori awọn omi kekeke, to si jẹ ibatan Yemọja. Ọsun ni wọn ma n bọ ti wọn ba n wa nkan ayọ, paapaa ọmọ tuntun jojolo. Ọsun kii tete binu, amọ ibinu rẹ ko sunwọn rara. Awọn eroja ti wọn fi n sin Osun ni omi, miliki, oyin ati bẹẹ bẹẹ lọ. Ṣango jẹ ọkan lara awọn oriṣa to gbona jainjain, ti si n rọjo ina ti irin ba koju irin. Ṣango ni awọn ẹlẹsin ibilẹ gbagbọ wi pe o jẹ Ọya ati Ọsun. Ṣango ati Ogun kii ri ara wọn soju nitori wọn kii ṣe ọrẹ nitori ọta ara wọn ni wọn n ṣe. Ṣango ni o ma n ṣe idajọ nipa lilo mọnamọna, ti kii si jẹ ki ibi ṣẹlẹ si awọn ọlọlufẹ rẹ, to si fẹran obinrin, orin ati igbadun. Ọya lo kẹyin ninu awọn oriṣa meje to lagbara julọ lagbaye, ti wọn si ma fi n rọpọ orunmila nigba miran. Awọn ẹlẹsin ibilẹ gbagbọ wi pe obinrin to rẹwa ni ti o si wa ninu omi pẹlu agbara lati ṣiṣẹ iwosan ati ọmọ bibi. Eewọ ni lati pe oriṣa Ọya, Yemọja ati Ọsun papọ lẹẹkan naa, nitori ọta ni wọn, wọn kii ri Ọya soju, afi ti ẹ ba n pe awọn oriṣa mejeeje papọ ni igba kan naa.	https://www.bbc.com/yoruba/56995564
entertainment	Aisha Lawal: Ẹni tó kéde pé mo kú yóò rí ìbínú Ọlọ́run	"Igbe hà hà ni ó gba ẹni àwọn ènìyàn lójú ìpó ìkànsíraẹni Instagram Aisha Lawal, lẹ́yìn ti ó jáde wá láti sọ nǹkan ti àwọn kan kọ nípa rẹ. Gẹ́gẹ́ bí gbajúgbajà òṣèré tiata náà ṣe sọ lásìkò tó n bá àwọn olólùfẹ́ rẹ̀ sọ̀rọ̀ loju opo Instagram rẹ̀, ó ṣàlàyé pé, òun kò kú o. Bakan naa lo ni òun kò ṣe àìsàn, sùgbọ́n òun kò mọ idí ti ẹni tó n gbé RIP, itumọ eyi tii se ‘Sun re o’ sí orí fótò òun, ṣe ń ṣe bẹ́ẹ̀. Sáájú ni fótò kan tí n jà ràìnràìn lori ayelujara, eyi tó ṣàfihan ọmọ tuntun kan ati Aisha Lawal lórí ìbùsùn nilé ìwòsàn àti fótò rẹ̀. Ẹni to gbe fọto rẹ sita yii lo kọ àkọ́lé pé, ""ìkà ènìyàn nìkan ní yóò rí nǹkan yìí ti kò ni tẹ RIP, arábìnrin yìí bímọ ọkunrin làntì tan, ló bá kú. Aisha Lawal ní sàdédé ni òun rí àwọn olólùfẹ́ òun ti wọ́n n fi àtẹ̀jíṣẹ́ ránṣẹ́ lórí Intagram, ti àwọn to mọ Nọ́mbà aago ilewọ òun sì ń pè oun pé àwọn gbọ́ pé ó kú. ""Lẹ́yìn náà ni mo wá lọ sí orí ayélujára níbí tí mo ti rí nǹkan ti ẹni náà kọ"" ""Mí ò mọ nǹkan ti ẹni tó n ṣe irú nǹkan báyìí fẹ́ gbà o, ní tèmí mó fi ẹni náà lẹ fún ìdájọ́ Ọlọ́run"" Bakan naa lo fi kun pe oun ki yoo ku iku kiku kan, bikose yiye lagbara Ọlọrun. Ọ̀pọ̀ àwọn olólùfẹ́ Aisha Lawal náà bẹnu atẹ lu iru iwa ibi báyìí, to si ni ẹnikẹni to ba kede pe oun ku, yoo ri ibinu Ọlọrun. O fikun pe oun yoo ri ileri Ọlrun lori aye oun, tori oun n sin Ọlọrun Alaaye, gbogbo irinsẹ esu ti wọn ba si se doju kọ oun, ki yoo se rere."	https://www.bbc.com/yoruba/media-56926395
politics	Adebayo Alao-Akala: 'Mo ti dàgbà ọ̀jẹ̀, n kò ní díje fún ipò gómìnà ìpínlẹ̀ Oyo mọ́'	Gomina ana ipinlẹ Oyo, Otunba Christopher Adebayo Alao-Akala ti kede pe oun ko ni dije fun ipo gomina ipinlẹ naa mọ nibi ti oun ba a de bayii. Otunba Akala sọrọ yii lori eto kan to waye ni ileeṣẹ redio kan niluu Ibadan lọjọ Abamẹta, ọjọ kọkandinlọgbọn oṣu kẹjọ ọdun 2020 yii. Bakan naa o fidi ọrọ naa mulẹ fun BBC Yoruba latẹnu agbẹnusọ rẹ, Yusuf Olaniyi pe oun ti fiṣẹ silẹ fawọn to ṣẹṣẹ n dide ninu oṣelu. Akala ni ohun ti o ku f'oun lati ṣe bayii ni lati rii pe oludije to kun oju oṣuwọn jade ninu ibo abẹle lati ṣoju ẹgbẹ oṣelu APC ninu ibo gomina ọdun 2023 to n bọ. Otunba Alao-Akala to ṣe ọjọ ibi aadọrin ọdun loke eepẹ laipẹ yii ni igbesẹ oun lati ma dije fun ipo gomina mọ yoo f'oun lanfaani lati ṣiṣẹ ipẹtu si aawọ ti gomina ipinlẹ Oyo tẹlẹ, oloogbe Abiola Ajimobi gbe le oun lọwọ daadaa. Alao-Akala ni oun ati Ajimọbi sọ ọpọlọpọ ọrọ ninu eyi tawọn ti fẹnu ko pe ki oun pari aawọ to wa laarin gbogbo ọmọ ẹgbẹ to n binu lẹyin idibo gbogbogbo to lọ. O ni oun ti ba gbogbo awọn ọmọ APC to n binu atawọn to ti kuro sọrọ, wọn si ti gba lati pada sinu ẹgbẹ. Gomina Oyo tẹlẹ ni oun rawọ ẹbẹ si awọn mii pe ki wọn j'eburẹ ki wọn to gba lati pada sinu ẹgbẹ. ''Ko si ohun ti n ko mọ nipa oṣelu ipinlẹ Oyo, n o si ni erongba lati fa ẹnikan kalẹ lati dije fun ipo gomina lọdun 2023,'' Alao-Akala lo sọ bẹẹ. Alao-Akala sọ pe ilẹkun ile oun ṣi silẹ fun gbogbo ọmọ ẹgbẹ APC nipinlẹ bayii. Nigba ti o n kin ọrọ Akala lẹyin, oluranlọwọ fun gomina ipinlẹ Oyo tẹlẹ, Yusuf Olaniyi sọ fun BBC Yoruba pe Alao-Akala ti di agbaọjẹ ninu oṣelu ipinlẹ, iyẹn lo ṣe ni oun ko ni dije fun ipo gomina mọ. O ni Akala ti da oun to fẹ da laye papaa julọ lagbo oṣelu, ''eyi gan lo jẹ ko pinnu lati fun awọn to wa lẹyin ninu ẹgbẹ lati dije.'' O ni Alao-Akala ti jẹ oye lemọmu bayii, ko tun le maa du oye Ṣeriki mọ, nitori oun ni alaga apẹtu si aawọ ninu ẹgbẹ oṣelu APC ipinlẹ, ko le maa du ipo gomina mọ to jẹ Ṣeriki. Bi o lo dagba, bi o loo gbo, bo ba pẹ titi, oju a hun jọ, Olaniyi ni agba naa ti de si Otunba.	https://www.bbc.com/yoruba/afrika-53957015
politics	Ń kó gbá àádọ́ta bílíọ́nù lóṣooṣù lọ́wọ́ Ambode – Tinubu	"Oludije sipo aarẹ fẹgbẹ APC, Bola Tinubu ti ni irọ ni iroyin kan to n ja kiri pe oun gba aadọta biliọnu losoosu lọwọ gomina tẹlẹri nipinlẹ Eko, Akimwummi Ambode nigba to wa lori alefa. Atẹsita ti adari ẹgbẹ to n ri si ipologo fun Tinubu, Bayo Onanuga fisita fawọn akọroyin ni Tinubu ko ni irufẹ erongba bẹẹ. O wa rọ awọn awọn alatako rẹ lati jawọ ninu pinpin iroyin ti ko lẹsẹ nilẹ mọ. Onanuga ni oludije fun aarẹ APC naa ni ko le beere irufẹ owo ọhun nigba to mọ pe ipinlẹ Eko ko lanfani lati pa owo naa losoosu lasiko saa Ambode. “Tinubu ko le beere irufẹ owo naa nigba ti o mọ pe ipinlẹ Eko ko pa owo toto bẹẹ laarin osu kan. Atẹsita ọhun wa bu ẹnu atẹ lu bawọn alatako ṣe gbe iroyin ti ko lẹsẹ nilẹ kiri lati ṣe akoba fun erongba Tinubu lati di aarẹ Naijiria. “Iroyin ti wọn gbe sita o jẹ iroyin ti ko ni ẹsẹ nilẹ. Agbẹjọro kan o fi ilu Abuja ṣe ibujoko ti wọ àjọ eleto idibo Naijiria, INEC lọ sí ilé ẹjọ lori aipese ojulowo iwe to nise pẹlu ifakalẹ oludije ipo ààrẹ labẹ asia ẹgbẹ oṣelu APC. Ọgbẹni Mike Enahoro-Ebah, tun beere iyọnda lọdọ ile ẹjọ pe ki wọn pàṣẹ ki wọn ṣe agbekalẹ awọn iwe iforukọsilẹ ti Tinubu fi dije dupo Gomina nipinlẹ Eko lọdun  1999 ati 2003.\n\nTinubu ni oludije to n dije ipo ààrẹ labẹ asia APC. Ninu iwe ipẹjọ tí wọn pe ni  FHC/ABJ/CS/1337/2022, Enahoro-Ebah ni oun n béèrè fún ""gbogbo ìwé iforukọsilẹ to fi dije dupo Gomina ati awon iwe mii to jẹri sí idije dipo rẹ lọdun 1999 ati 2003"" Agbẹjọro yi sọ pe iwe meji ọtọọtọ loun fi beere iwe wọnyi labẹ ofin to faaye gba araalu lati beere eyikeyi iroyin to nise pẹlu ọrọ ilu.﻿ Olùpẹ̀jọ yi gẹgẹ bí alaye to se ni idi toun fi fẹ ri awon iwe yi ni pé àjọ eleto idibo INEC lo ní wọn lọdọ.\n\nNigba ti wọn sì jẹ iwe to nise pẹlu aráàlú, oun lẹtọ lati beere fawọn iwe yi ni ibamu ofin eto idibo. O ni ofin idibo naa ti faraalu lanfaani ki wọn beere iroyin nipa ọrọ to ba ruju.\n\nO ni ọjọ mẹrinla tó yẹ ki INEC fi dahun ibeere, ki wọn sì fi iwe wọnyi ṣọwọ ti pe, o sì ti kọja, tori naa lóun ṣe gba ile ẹjọ lọ.\n\nEnahoro sọ pe kikọ ti INEC kọ lati gbe awọn iwe yii kalẹ takò ofin Naijiria.\n\nINEC nikan naa ni agbẹjọro yi da pe lẹjọ níwájú ilé ẹjọ giga."	https://www.bbc.com/yoruba/articles/cxeklg3kmjyo
politics	Ekiti Governorship Election: Gómìnà Fayemi ní kí òṣìṣẹ́ tó bá fẹ́ du ipò gómìnà fi ipò sílẹ̀	Gomina ipinlẹ Ekiti, Kayode Fayemi ti paṣẹ fun awọn oṣiṣẹ ni ijọba rẹ lati fi ipo silẹ ti wọn ba fẹ du ipo gomina ni ipinlẹ Ekiti. Ninu atẹjade gba ọwọ agbẹnusọ fun gomina Fayemi, Yinka Oyebode ni wọn ti fi lede pe Ọjọ Kẹrinla, Osu Kejila ni gomina fun wọn da lati fi ipo silẹ ni ijọba oun. Oyebode ni gomina gbe igbesẹ naa lọna ati rii pe awọn oṣiṣẹ to wa ni ijọba oun ṣiṣẹ wọn bi iṣẹ lai si magomago. Bakan naa ni wọn fi kun un pe eyi tẹlẹ aṣẹ eto idibo lorilẹede Naijiria, paapaa saaju idibo si ipo gomina ni ipinlẹ Ekiti. ''Lọna ati tẹle aṣẹ Ajọ INEC ati ẹgbẹ oṣelu APC ti yoo bẹrẹ idibo abẹle ni Oṣu Kini ọdun 2022, ti idibo sipo gomina naa yoo si waye ni Osu Kẹfa, ọdun 2022 kan naa.'' Lara awọn to wa ni ijọba gomina Fayemi ti awọn eniyan lero wi pe wọn fẹ fu ipo yii ni Akọwe ijọba, Biodun Oyebanji, Adari oṣiṣẹ nipinlẹ Ekiti, Biodun Ọmọlẹyẹ, kọmiṣọnna fun ọrọ awujọ, Bamidele Faparusi ati oluranlọwọ pataki si gomina, Ọjọgbọn Bolaji Aluko laarin awọn miran.	https://www.bbc.com/yoruba/media-59501292
