entertainment	Ọ̀gá Bello: Àìgbọ́n ló ń da àwọn òsèré tíátà tó ń jà lórí ayélujára láàmú	Adebayọ Salami, ti gbogbo eeyan mọ si Ọga Bello ti salaye fun BBC Yoruba pe, ko dara bawọn osere tiata se n ko ara wọn sita lori ẹrọ ayelujara pẹlu ija gbogbo igba. Ọga Bello ni, aigbọn lo n da ọpọ wọn laamu, ti oun si maa n ba wọn da si aawọ naa nigba mii. Amọ o ni ẹkọ ile ti wọn ba ni, ni yoo sọ bi wọn yoo se gba imọran oun si. Ọga Bello tun tako ọrọ kan ti akẹẹgbẹ rẹ ninu isẹ tiata, Yẹmi Solade sọ pe, alagbe ni ọpọ osere tiata. Bello ni isẹ awọn ni awọn n se, ifẹ tawọn araalu ni sawọn, si n lo n jẹ ki wọn maa se aanu awọn. O tun fi idi rẹ mulẹ pe, ajọsepọ to dan mọran wa laarin awọn osere ori itage to wa ninu ẹgbẹ ANTP ati Tapan.	https://www.bbc.com/yoruba/afrika-45140271
religion	"Deborah Samuel: ""Kuran ni aṣáájú Hadith"", bí ọ̀rọ̀ bá dàrú, Akeugbagold sọ ohun tí àá padà sí"	"""Lóótọ́, awọn aayaa igba ogun kan wa ti Hadith wọn sọkalẹ fun awọn Musulumi nigba naa lati ran wọn lọwọ, amọ ogun yẹn ti tan, Hadith ti alafia lo yẹ kẹẹ maa lo bayii"". Gbajumọ oniwaasi nilu Ibadan, Sheikh Akeugbagold n sọ eyi lati da si ọrọ Deborah Samuel ti wọn sọ ni oko pa ti wọn tun dana sun laipẹ yii ni ilu Sokoto. ""Mo ti ṣe waasi kan ninu eyi ti mo ti sọ awọn aaya to pọ lati fi jẹ kawọn eeyan mọ pe ko si ibi ti Ọlọhun ti sọ pe ki wọn sọ eeyan ni oko pa"". Wọ́n gbé 'Póò ìtọ̀ àti igbẹ́’ tó ti já nídìí lé mi lórí lọ dànù l’Eko, pẹ̀lú òúnjẹ́ mi lọ́wọ́ mi - Ajirebi Láí ṣẹ̀ láí rò, wọ́n jó Ṣọ́ọ́ṣì mi pátápátá ní Sokoto, ìrírí mi rèé - Pasitọ ìjọ Celestial Adájọ́ 34 táa tán nílé ẹjọ́, bí wọ́n ṣe sọ àwọn afurasí tó lọ́wọ́ nínú ikú Deborah Samuel sẹ́wọ̀n rèé 'Ẹ yẹgi fún un'! Ọkùnrin ẹni ọdún 42 gba ìdájọ́ ikú lẹ́yìn tó pa Ọba aládé l'Ekiti Àwọn Mùsùlùmí tó ṣekúpa Deborah nítori ọ̀rọ̀ ẹ̀sìn kò ní wọ párádísè - Sheikh Gumi Wo àwon ìròyìn òfégè nípa ikú Deborah Ṣamuel àti ìkọlù sí Bishop Kukah Ẹni ọdún mẹ́rin ni mo bẹ̀rẹ̀ Kéwú, 1967 ni mo ṣe wòlímọ̀, mo lè kéwú láti ìbẹ̀rẹ̀ dópin- Tunde Bakare 'Ọ̀pọ̀ ìgbà l'èmí gan fẹ́ du àwọn ipò òṣèlú kan lọ́dún 2015, 2019, àmọ́ mo tẹ 'slow' torí bàbà mi, Akala náà ń jáde' O tọka awọn eeyan si apa ibi kan ninu Kuran to ti ni Ọlọhun ni ""Anọbi, oo mọọ gbọ ohun ti yoo ba ọ ninu jẹ o, ṣe suuru gẹgẹ bi awọn ti wọn ti lọ si waju ṣe ṣe"". Bakan naa lo tun ka ibomii, to tun ka ibomii, to si tun ka ibomii, to ni ""nkankan naa ni Ọlọhun sọ nibẹ pe Anọbi yoo maa gbọ ohun ti yoo ba a ninu jẹ ni. ""Kurani ni 'Primary, Hadith ni Secondary', tọrọ ba daru, Kuran laa pada si"" O ni nkan ti awọn kan n sọ ninu itan pe Anọbi dajọ iku fun arakunrin kan to bu u ri, ""ti Anọbi ba ṣe bẹẹ, a jẹ pe Anọbi tako Kuran ni, Anọbi ko si ki n ṣe ika"". O ni ẹnikan ti dojukọ Anọbi ri pe ""Were"" ni amọ ti Anọbi daa lohun lọna to tọ ninu Kuran. Láti ìgbà tí wọ́n ti bí mi, kò sí obìnrin tí mo kọnu ìfẹ́ sí tí kò gbà fún mi -Efuoma Amos Àwọn ọlọ́kadà dáná sun 'Sound engineer' l'Eko lẹ́yìn àríyànjiyàn lórí ₦100 Kà nípa àwọn mínísítà mẹ́wàá tó kọ̀wé fipò sílẹ̀ lábẹ ìjọba Ààrẹ Buhari Àwọn àgbébọn ti tú olóyún tó wà lára àwọn awakọ̀ reluwé Abuja sí Kaduna tí wọ́n jí gbé sílẹ̀ Akeugbagold ni Islam kii ṣe ẹsin ika ko si si ninu Kuran rara iwa ti awọn kan hu nilu Sokoto. O ni ki wọn lọ wadi ohun ti Arabinrin Deborah sọ daadaa, iwa ika bii pe awujọ ẹran la n gbe ni wọn hu gbaa. ""Ẹ ma sọ Islam lorukọ ti ko jẹẹ""."	https://www.bbc.com/yoruba/afrika-61462142
politics	Fayoṣe: Bẹ́ẹ ṣe yọ fìlà lórí Bola ige tó pa òwe ikú rẹ̀, kò lè ṣiṣẹ́ fún mi	"Ariwo ijẹ ti ẹ jẹ tẹtẹ Bola Ige, aye ẹ maa jẹ dagunro mí bẹẹ ni Ayodele Fayose mu bẹnu. Igbe gbajare yi n gbẹnu Oshokomolẹ latari iṣẹlẹ to waye ni asekagba ipolongo idibo ẹgbẹ PDP ni Ondo t'awọn kan ti si fila lori rẹ. Gomina tẹlẹ rí ni ipinlẹ Ekiti to si tun jẹ agbaọjẹ ninu ẹgbẹ alatako ni Naijiria fi ọrọ yi sita loju opo Facebook. Agbẹnusọ rẹ Lere Olayinka lo buwọlu atejade yi to si ni Fayose ko ni yẹ ko ni gbo lati maa sọ ododo nigbakugba. Ko fi mọ ọ bẹẹ, Fayose tun naka abuku si agba oloselu PDP nii, Bode George, ati gomina ipinlẹ Oyo, Seyi Makinde pe awọn ni wọn de janduku to si fila lori oun nibi eto ipolongo idibo PDP l'Akure. Ninu alaye ti Fayose sọ nínú atejade rẹ,o ni igba toun n rin lọ si ori aaye t'awọn alejo wa ni janduku kan sadede sun mọ oun to si ṣi fila ori oun. ""Bí wọn ṣe yọ fila lori Bola Ige bi yẹn ni Ile Ife. Gbogbo wa la mọ ohun to t'ẹyin rẹ bo"" ""Nitori naa mi o ni fi ọwọ yẹpẹrẹ mu ọrọ yi"" Fayose salaye pe oun ti fi ọrọ naa to awọn agbofinro leti ati pe wọn gbọdọ wadii awọn to wa lẹyin oro ti o fi n ke. Lẹnu ọjọ mẹta yi, Gomina ipinlẹ Oyo Seyi Makinde ati Ayodele Fayose jijọ n tahun sí ara wọn lori didari ẹgbẹ oṣelu PDP. Aawọ oṣelu to n ṣẹlẹ laarin awọn ọmọ ẹgbẹ oṣelu Peoples Democratic Party ni iha Guusu-Iwọ Oorun Naijiria eyi to jẹ awọn ilu Yoruba da bii pe o tun ti n gbona bii ogun bayii gẹgẹ bi itahunsira ni gbangba ṣe bẹ silẹ laarin gomina Oyo, Seyi Makinde ati gomina ipinlẹ Ekiti tẹlẹ, Ayodele Fayose. Eyi to tun ṣẹṣẹ jẹ tuntun laarin wọn ni igba ti gomina Makinde n fesi si abajade ẹsun ti ajọ to n ri si iwa jẹgudujẹra, EFCC fi kan Ayo Fayose ti Makinde ni ko si ohunkohun ti Fayose i baa ṣe lori ẹjọ yii, ẹwọn ni yoo lọ gbẹyin. Ẹsun mọkanla ni ajọ EFCC fi kan Fayose lati ọjọ kejilelogun oṣu kẹwa ọdun 2018 toun tu ile iṣẹ kan to n jẹ Spotless Investment Ltd. Fayose ni oun o jẹbi ẹsun naa ti wọn si ni beeli rẹ ni aadọta miliọnu naira pẹlu oniduro kan. Latẹnu ọkan lara awọn oluranlọwọ Seyi Makinde, Dare Adeleke ni o ti fesi lori ayelujara si ohun ti Lere Olayinka, agbẹnusọ Fayose sọ pe ""ati iwọ ati ọga rẹ to n sanwo fun ẹ, ẹwọn ni ipin yin, ko si bi ẹ ṣe fẹ yi idajọ naa to, ẹ o lọ sẹwọn"". Bi ẹ ba ranti, ọrọ laarin gomina Makinde ati awọn eekan PDP bii Fayose, Hon. Ladi Adebutu, Sẹnetọ Ademola Adeleke ati alaga ẹgbẹ PDP ni Eko, amojuẹrọ Deji Doherty ti n di fa ki n fa a tipẹ lorii tani yoo ṣakoso idari ẹgbẹ PDP nilẹ Yoruba. Awọn kan korajọ sẹyin Ayodele Fayose paapaa julọ awọn to wa ni Ekiti, Osun, Ogun ati Eko ti awọn ti Oyo ati Ondo gba sẹyin Seyi Makinde Oloye Olabode George, tii se asaaju kan ninu ẹgbẹ oselu PDP nipinlẹ Eko, ti fesi si oko ọrọ ti gomina ana nipinlẹ Ekiti, Ayodele Fayose sọ si. Saaju la ti kọkọ mu iroyin wa fun yin pe Ayodele Fayose ti sọ fun ẹgbẹ oselu PDP nipinlẹ Eko pe ayafi ti oloye Bode George ba yẹba ninu ẹgbẹ oselu naa, ni egbẹ PDP to le moke nipinlẹ Eko. Nigba to n ba BBC Yoruba sọrọ lati fesi si ohun ti Fayose sọ naa, Bode George ni aigbọn ati aimọ lo n se Fayose nitori ko yẹ ko jẹ oun lo yẹ ki Fayose ri fin. Asaaju ẹgbẹ oselu PDP naa ni oun seranwọ fun Fayose lati moke ni igba meji gẹgẹ bii gomina ipinlẹ Ekiti, o si ya oun lẹnu pe o le pada ri oun fin. ""Se bi ti ẹgbẹ ni o, abi o muti yo, abi o mugbo yo, o ti pẹ ti Fayose ti maa n fi ẹnu rẹ yẹn sọ isọkusọ bii ọmọ ti wọn ko bii re, ti kii si se ọmọluabi. Ki lo kan Fayose gan pẹlu ipinlẹ Eko, Ekiti to ti wa gan, wahala to da silẹ nibẹ, a sẹsẹ n yanju rẹ ni."" Bode George ni Fayose ko bọwọ fun agba, ewu to si wa lori oun, kii se pe oun fi owo ra a, bẹẹ ni ko lọgbọn ori, Ọlọrun yoo si gba ẹsan lara Fayose, ayafi ti ko ba wa dọbalẹ ni ọọfisi mi lai mọye igba lati beere fun iranlọwọ. Bakan naa lo fikun pe, Fayose ko le wọ aarin ero ni Eko bi, sebi se lo gbe oku baba rẹ pamọ fun ọdun kan, eyi to fihan pe kii se ọmọ gidi. ""Wọn ko nile iwosan ti wọn ti n wo were, amọ awa ni nilu Eko nibi, a si mu Fayose lọ sibẹ pe ki wọn lọ yẹ ọpọlọ rẹ wo, ologun si ni emi, emi kii gba igba kugba, mo si kọja ẹni ti ọmọ kan maa yọ ẹnu si tabi fi tayin."" ""Ti Fayose ba to bẹẹ, ko bọ si aarin wa nilu Eko, ko maa bọ, yoo ri ẹẹkẹ rẹ lai gbe digi, ọmọ ọdun melo lo wa nigba temi se gomina lọdọ wọn, awa maa tun kọ ni Eko, tori Fayose gọ, o si fi ẹnu họra, wọn ko si bi re."" Ẹgbẹ́ òṣelú People's Democratic Party (PDP) ni ìpińlẹ Eko ti fún gómìnà àná ní ìpínlẹ̀ Ekiti Ayodele Fayose ni gbédéke ọjọ méje láti rawọ́ ẹ̀bẹ̀ sí àwọn àgbà ẹgbẹ́ PDP. Èyí wáye lẹ́yìn tí wọn ni Fayose sọ̀rọ̀ tó lé dá ẹgbẹ́ rú tó sì lè dá wàhalà sílẹ̀ láàrin àwọn ọmọ kéèkèé àti àgbà ẹgbẹ́. Agbẹnusọ ẹgbẹ́ PDP ni ìpínlẹ̀ Eko Taofik Gani sọ nínú àtẹjáde kan to fisíta pé Fayose sọ ọ̀rọ̀ àbùkù lásìkò ti Fayose ni òun n gba àwọn ọdọ ẹgbẹ́ níyànjú tó le mú kí àwọn ọdọ ẹgbẹ́ kọjú ìjà sí àwọn àgbà ẹgbẹ́ ní ìpínlẹ̀ Eko. Lásìkò ìfilọ́lẹ̀ ìgbìmọ̀ ìpolongo fún àtúndi ìbò sẹnatọ ni ẹkun ìlàoorùn ìpínlẹ̀ Eko to wáye ni ọjọ ìṣẹ́gun tó kọjá, níbi tó tí gba àwọn ọdọ́ nímọ̀ràn pé kí wọ̀n fún igbákejì alága ẹgbẹ́ nígbàkan rí olóyè Bode George ní ìsìnmi kúrò nínú ètò òṣèlú. Gẹ́gẹ́ bi àtẹ̀jáde tí akọ̀wé Fayose Lere Olayinka fi síta, to pe àkọlé rẹ ni "" PDP gbọdọ̀ sọ pé kí ìgbákejì alága ẹgbẹ́ PDP nígbàkan ri olóyè Bode George lọ fẹ̀yìntì kí ẹgbẹ́ báa le ní ìlọsíwájú kí wọ́n sì jáwé olúborí nínú ìdìbò tó n bọ ní ìpińlẹ̀ Eko"". Agbẹnusọ ẹgbẹ́ òṣèlú PDP rọ Fayose láti ma jẹ́ àwòkọ́ṣe òdì fún àwọn ọdọ́ nínú ẹgbẹ́. Láti ọja ajé, ọjọ́ kejila, oṣù kẹwàá, ọdún 2020, Fayose kò ni láànfàni láti kópa nínú ètò kankan nínú ẹgbẹ́ PDP, àyàfi tó bá wá túbá lórí gbogbo àwọn ọ̀rọ̀ tó sọ. Bákan náà ni Gani rọ Fayose láti dẹkun àwọn  ọrọ to le dá wàhálà sílẹ̀ láàrin àwọn àgbà ẹgbẹ́, tàbí èyíkéyìí tó lo dènà ìlọsíwájú ẹgbẹ́ òṣèlú PDP ni ìhà Iwọ̀oorù-Gúúsù Naìjíríà."	https://www.bbc.com/yoruba/54415000
sports	Arsenal da àlejò ọ̀ràn fún Bournemouth, 3:0 ni wọ́n fi dá bàntẹ́ ìyà fún wọn	Ẹgbẹ agbabọọlu Arsenal ti fagba han ẹgbẹ agbabọọlu Bournemouth ninu ifẹsẹwọnsẹ Premier League to waye lọjọ Abamẹta. Ami ayo mẹta ọtọtọ ni Arsenal fi da bantẹ fun Bournemouth eyii to mu ki orin ọpẹ gba ẹnu awọn ololufẹ ikọ naa. Igba ti ifẹsẹwọnsẹ ọhun wọ iṣẹju marun un ni Martin Ødegaard kọkọ ṣi oju awọn Bournemouth wo. Nigba ti ifẹsẹwọnsẹ naa gbẹnule iṣẹju mọkanla gerege lo tun dan ẹnu awọn Bournemouth wo lẹẹkansi, ti bọọlu naa si ri ẹyin awọn naa. Ẹwẹ, nigba ti yoo fi di iṣẹju marunlelaadọta ti ifẹwọnsẹ ọhun bẹrẹ ni William Saliba sọ pe aisinibẹ ni ai ba wọn da si, eyii to mu ko ṣọ ami ayo Arsenal do aro mẹta ti ko gbọdọ da omi ọbẹ nu. Wayi, bo tilẹ jẹ awọn ọmọ ẹgbẹ agbabọọlu Bournemouth naa gbiyanju lati ṣe bii ọkunrin, amọ o jọ bi ẹni pe diẹ ọmọkunrin wọn ko to. Ẹwẹ, ninu ifẹsẹwọnsẹ to kọkọ waye, Tottenham ja fitafita ki wọn to ri goolu kan fi ṣagba Wolves. Nigba ti ifẹsẹwọnsẹ naa wọ iṣẹju kẹrinlelọgọta ni Harry Kane sọ ami kan sọsọ wọle. Pẹlu goolu naa, Harry Kane ti lewaju bayii gẹgẹbii agbabọọlu to gba goolu sinu awọn julọ ninu ẹgbẹ agbabọọlu kan naa lati igba ti Premier league ilẹ Gẹẹsi ti bẹrẹ ni nnkan bii ọgbọn ọdun sẹyin. Goolu marundinlaadọwa, (185 goals) ni Harry kane ti gba sinu awọn bayii.	https://www.bbc.com/yoruba/articles/cp9mejgel77o
religion	Eid Al Fitri Public holidays: Wo àwọn ìpínlẹ̀ tó kéde àfikún ọjọ́ ìsinmi ọdún ìtúnu awẹ̀ síi	Awọn ipinlẹ kan lorilẹ-ede Naijiria ti ṣafikun ọjọ isinmi fun ọdun itunu aawẹ Ramadan ti 2021 siwaju sii. Awọn ipinlẹ naa fi oni ọjọ Eti, ọjọ kẹrinla, oṣu karun un kun ọjọ meji ti ijọba apapọ kọkọ kede tẹlẹ, iyẹn ọjọru, ọjọ kejila ati ọjọbọ, ọjọ kẹtala, oṣu karun un. Gomian ipinlẹ Kano, Abdulahi Ganduje lo kọkọ kede pe oun ti fi ọjọ Eti kun isinmi awọn eniyan ipinlẹ naa ni eyi ti wọn yoo fi fi ọjọ mẹta sami ayẹyẹ ipari awẹ Ramadan tọdun 2021. Ogbeni Muhammed Garba Shehu to jẹ kọmiṣọnna ifitonileti ati iroyin gbogbo fun ipinlẹ Kano lo kọkọ fi eyi sita. Lẹyin naa ni ijọba ipinlẹ Jigawa naa kede itẹsiwaju isinmi pe ki ti ipinlẹ naa di ọjọ mẹta. Hussaini Ali Kila to jẹ olori awọn oṣiṣẹ ni ipinlẹ Jigawa lo fi atẹjade sita lati kede isinmi ọjọ Eti kun eyi ti ijọba apapọ kede tẹlẹ. Wọ́n ti kírun ọdún ìtúnu àwẹ̀ n'Ibadan L'Ọjọru ni Imam agba ilẹ Ibadan, Sheikh AbdulGaniyu Abubakry Agbotomokekere le iwaju irun itunu awẹ ni gbagede Yidi to n bẹ ni gbegbe Agodi nilu Ibadan. Igbakeji gomina ipinlẹ Ọyọ, Rauf Olaniyan ati Olubadan ilẹ Ibadan, Oba Saliu Adetunji wa lara awọn eeyan pataki to pejupesẹ sibi irun naa. Adura yii waye t'oun ti bi ajọ to n mojuto ọrọ ẹsin Islam lorilẹede Naijiria, 'Nigerian Supreme Council for Islamic Affairs (NSCIA)' ṣe paa laṣẹ wi pe ki awẹ Ramadan tẹsiwaju nitori osupa Shawal ko yọ ni alẹ ana. Aṣẹ yii lo mu ki awẹ di ọgbọn. Ọrọ kan ti wọn fi lede loju ọpọ ikansiraẹni Facebook Sheik Agbotomokekere lana lo kede rẹ wi pe awẹ Ramadan ti pari l'ọjọ Iṣẹgun, ọdun itunu awẹ yoo si waye l'Ọjọru. Gẹgẹ bi ileri ti o ṣe, Sheik Agbotomokekere le iwaju awọn Musulumi kan lọ si Yidi, ṣugbọn pupọ ninu awọn adari ẹsin bi i Aarẹ Musulumi ilẹ Yoruba, Edo ati ipinlẹ Delta, Alhaji Dawud Makanjuola Akinola De-Damak, gomina tẹlẹri nipinlẹ Ọyọ, Oloye Rashidi Ladoja ati awọn mii ko si nibi ipejọpọ naa. Bo tilẹ jẹ wi pe awọn eeyan pọ nibi ipejọpọ naa, onka awọn to kirun ọdun itunu awẹ nibẹ ko to iye awọn to n wa tẹlẹri. Iredi sini wi pe awọn eeyan kan ṣi gba awẹ titi di oni. Eleyii ki i ṣe igba akọkọ ti iru igbese yii yoo waye, asaaju ẹsin yii kede iru igbese yii ni ọdun mẹta sẹyin, botilẹ jẹ wi pe awọn alaṣẹ ni o yẹ ki awẹ tẹsiwaju.	https://www.bbc.com/yoruba/afrika-57091471
entertainment	Baba Ijesha: Yomi Fabiyi ní àwọn yóò ṣe ìwọ́de tí ọlọ́pàá kò bá mú àwọn àgbààgbà tó ló ọmọdé fún aṣemáṣe	"Ọrọ awuyewuye to n waye lori ọrọ Baba Ijesha ko tii jẹ rodo lọ mumi rara. Idi ni pe gbajumọ osere tiata, Yomi Fabiyi si n leri leka pe oun ati awọn eeyan kan yoo se iwọde laarin ọjọ meje tako ileesẹ ọlọpaa ipinlẹ Eko. Fabiyi ni iwọde naa yoo waye bi awọn ọlọpaa ko ba mu gbogbo awọn agbalagba to lo ọmọde, lati se akọsilẹ ẹri asemase fun Baba Ijesha. Fabiyi lo fi ọrọ yii ransẹ si igboro lati oju opo Instagram rẹ, eyi to kọ sibẹ tente. O ni awọn yoo sewọde alaafia ni Alausa ati lawọn agbegbe miran nipinlẹ Eko tako ọga agba ọlọpaa Eko Bakan naa lo ni awọn yoo tun beere pe ki wọn gba isẹ lọwọ olori ẹka to wa feto idẹrun araalu nipinlẹ Eko nitori pe wọn ko mọ isẹ wọn bii isẹ. ""A ko le maa wo awọn eeyan yii niran lati maa fi owo ori araalu sofo, wọn ko mọ isẹ wọn doju ami. A ja fun ọmọ kọọkan ti ko ni ẹsẹ lọrun, ti wọn ko naa ni rẹ. A si n se eleyi fun isisẹ sin ọmọniyan."" Kí ni yóò ṣẹlẹ̀ lónìí láàrin ìjọba ìpínlẹ̀ Kaduna àtàwọn tó jí akẹ́kọ̀ọ́ fásitì Greenfield gbé? Microsoft gbé ìgbésẹ̀ láti pèsè iṣẹ́ 27,000 fún àwọn ọmọ Naijiria Gbajumọ osere tiata naa fikun pe yoo dara ki awwọn eeyan naa se ohun to tọ lasiko, nitori iwọde naa ni yoo wa fun ọmọ kọọkan ti ko ni ẹsẹ lọrun, awọn jẹ wọn ni ojuse yii. Yomi Fabiyi tun gbe imọran kalẹ pe yoo dara ka lo awọn ọdọ wa bo se yẹ, ojuse yii si ni oun yoo ri daju pe o fidi mulẹ. Bẹẹ ba gbagbe, lati igba ti isẹlẹ ẹsun sise asemase pẹlu ọmọde ti wọn fi kan Baba Ijesha ti waye ni Yomi Fabiyi ko ti panumọ. Saaju la ti sọ fun yin pe, gbajugbaja oṣere tiata, Yomi Fabiyi to n ja fun pe ki gbogbo eeyan farabalẹ tẹle ofin lori ọrọ Baba Ijesha ti fesi lori fọnran ti ile iroyin kan fi si ta lori Baba Ijesha. ""O ṣe ni laanu gidi gan bi mo ṣe wo fọnran CCTV nibi ti Ọgbẹni Lanre Omiyinka ti a mọ si Baba Ijesha ti fi ilọkulọ ibalopọ lọ ọmọdebinrin kan. Ko si awawi. Mo bu ẹnu atẹ lu u tori o ti ni loju o si ba ni lorukọ jẹ pẹlu"". Yomi Fabiyi ni oun ti farabalẹ duro de ohun to tọ gidi ki oun to sọrọ gẹgẹ Bi wọn ṣe n ṣe lawọn orilẹede to laju ti oun si wa ri i pe ""eeyan kan ṣoṣo ti ọwọ rẹ mọ ninu kiko si gbaga ọlọpaa ni ọmọdebinrin naa"". Yomi Fabiyi ri i ninu fidio naa pe itasẹ agẹrẹ pọ daadaa latọdọ Baba Ijesha ninu fidio naa. O ni ibeere to yẹ ki gbogbo eeyan maa bere ni pe ""to ba ṣe ọmọ tirẹ obinrin ni ọmọbinrin naa, ṣe o lee jẹ ko tun iru iriri yẹn la kọja nitoripe o fẹ ni ẹri to daju. Nitori eyi, o tun n funpe si awọn alaṣẹ to n ṣamojuto ohunkohun to n lọ sori ayelujara. Yomi gba pe ofin ṣe pataki, paapaa nipa didaabo bo ẹtọ awọn ọmọde ni Naijiria. ""Koda, gbogbo ọmọ Naijiria to ba ni kaanu ọmọdebinrin naa ni ko fọn soju popo fun iwọde wọọrọwọ lati ja fun ki wọn fi ọwọ ofin mu awọn to lọwọ si aṣemaẹ yii."	https://www.bbc.com/yoruba/56963044
religion	Osun Masqurade attack: Kayode Esuleke, olórí egúngún to bá àwọn musulumi jà ní Osogbo wà láhámọ́ ọlọ́pàá	"Rogbodiyan to waye laarin awọn ẹlẹsin musulumi ti ijọ Kamorudeen Society Central Mosque ati eleegun nilu Osogbo ni ọjọ Àìkú ti gba ọna miran yọ. Idi ni pe ileesẹ ọlọpaa ni ipinlẹ Ọṣun ti mu olori awọn eleegun naa, oloye Kayode Eṣuleke si ahamọ. Gẹgẹ bi iroyin abẹle kan ṣe sọ,  ikọ ọtẹlẹmuyẹ fun ọga agba ọlọpaa, IG Intelligence response Unit, lo ranṣẹ pe oloye Esuleke si ileeṣẹ wọn nilu Osogbo fun ifọrọwanilẹnuwo nibẹ, ti wọn si ti fi si ahamọ. Lẹyin rogbodiyan to waye laarin awọn eleegun atawọn ẹlẹsin Musulumi niluu Osogbo, awọn ti ọrọ naa ṣoju wọn ti baba BBC Yoruba sọrọ lori ohun ti oju wọn ri. Lasiko ti BBC Yoruba ṣabẹwo si agbegbe naa, ọkan lara awọn Musulumi ọhun, Salahudeen Yusuf sọ pe adura ki Naijiria le dara ni awọn n gba lọwọ, ki awọn eleegun naa to kọlu awọn. O ni ""Bi a ṣe kirun Aila tan ni awọn eleegun naa n lulu kọja, lẹyin naa ni wọn duro lagbegbe mọṣalaṣi wa."" ""Ka to wi ka to fọ, wọn ti bẹrẹ si n sọko si wa, ti wọn si bẹrẹ si n yinbọn si wa."" ""Ibọn ba baba agbalaga kan lara wa, awọn miran ti ibọn ba ṣi wa nile iwosan LAUTECH bayii nibi ti wọn ti n gba itọju lọwọ."" Obinrin kan lara awọn Musulumi naa tun ṣalaye fun BBC pe, awọn ọlọpaa wa lara awọn elegun naa, ṣugbọn gbogbo akitiyan awọn lati rọ awọn ọlọpaa ọhun lati pana rogbodiyan naa, lo ja si pabo. O ni awọn ko mura ija, bẹẹ ni awọn ko ba awọn eeyan naa ja nitori adura lawọn n gba, ṣugbọn awọn eleegun naa lo kọlu awọn, ninu eyii ti ẹmi kan ninu wọn ti sọnu. Ẹwẹ, BBC kan si aṣoju idile awọn eleegun naa, Fasola Esuleke, to si sọ pe eegun idile wọn kii ṣe eegun oni jagidijagan. Gẹgẹ bo ṣe sọ, awọn elegun naa n kọja lọ lagbegbe ti Mọṣalaṣi ọhun wa ni, ki awọn Musulumi ọhun to tọ ija awọn. Fasola ni awọn kan n kọja lọ ni, kii ṣe awọn ya lọ ba awọn Musulumi naa. O ni ""Igba ti a n bọ ni gbogbo wọn kọlu wa to fi mọ awọn ọmọde to wa lara awọn."" ""Wọn ko ada, igo ati okuta to fi mọ ibọn, koda wọn dana silẹ ti wọn si pe awọn yoo sun ẹku eegun."" ""Nibi ti a ti n du ki wọn ma farakan egungun, ni ọkan lara wọn gbiyanju lati ṣi ẹku egun kuro loju rẹ ṣugbọn egun ọhun salọ."" Fasola tẹsiwaju pe kii ṣe igba akọkọ ree ti awọn Musulumi naa ati olori wọn yoo kọlu awọn. O fi kun pe pupọ ninu awọn ni wọn ṣe leṣe, koda o ni wọn gun ọmọ kan lara wọn lọbẹ ti ifun rẹ fi tu jade. Aṣoju eleegun naa pari ọrọ rẹ pe awọn ko gbọ pe ẹnikẹni jade laye lasiko rogbodiyan naa. Alukoro ileeṣẹ ọlọpaa ipinlẹ Osun, Yemisi Opalola ṣalaye fun BBC pe wọn ti fi ọrọ naa to awọn leto, lootọ si ni ikọlu waye ṣugbọn awọn ko tii le sọ ẹni to kọkọ kọlu ara ninu igun ẹgbẹ. Opalola ṣalaye pe lootọ ni ẹnikan ba iṣẹlẹ naa lọ ṣugbọn awọn ko tii mọ irufẹ ẹni ti ẹni naa jẹ, nitori awọn mọlẹbi rẹ ko tii wa sọdọ awọn. O fi kun pe awọn ti fi ṣikun ofin mu awọn eeyan kan, ṣugbọn o ni oun ko tii le sọ ni pato iye eeyan ti awọn ti mu. Opalola pari ọrọ rẹ pe kii ṣe awọn Fulani lo wa nidi iṣẹlẹ naa, ṣugbọn iwadii ti bẹrẹ lati mọ ohun to ṣokunfa iṣẹlẹ ọhun. Ki lo ti ṣẹlẹ sẹyin? Saaju la ti mu iroyin wa fun yin pe rogbodiyan kan bẹ silẹ nilu Osogbo lọjọ Aiku ana eyi ta gbọ pe o mu ẹmi eeyan kan lọ nigba ti ọpọ eeyan miran sese pupọ. Bi o tilẹ jẹ pe a ko tii lee fidi ohun to fa wahala yii mulẹ amọ gẹgẹ bi iwe iroyin Osun Defender ti wi, awọn egungun kan to dihamọra pẹlu ohun ija oloro lo fa sababi isẹlẹ naa. A gbọ pe awọn egungun yii lo ti kọkọ n dun mahuru-mahuru tẹlẹ pẹlu awọn janmọ Mọsalasi kan ti ijọ wọn n jẹ Kamorudeen Islamic Society. Asiko ti awọn ijọ ẹlẹsin Islam yii, to wa ladugbo Oluode Aranyin nilu Osogbo, si n se adura lọwọ ni wahala ọhun fọnna soju ni deede aago meji abọ ọsan. Se la gbọ pe awọn egungun yii, to ti kọkọ n paraaro agbegbe ti mọsalasi naa wa, ti wọn n lọ, ti wọn n bọ, ba sadede bẹrẹ si sọ okuta lu awọn to n kirun nibẹ. Osun Defender, to ba ọkan lara awọn to fara gbọgbẹ nibi isẹlẹ naa sọrọ, jabọ pe awọn egungun ọhun lo de si adugbo naa pẹlu ikọ ọlọpaa ati Amotekun. Amọ bawọn ikọ agbofinro naa se fi agbegbe ọhun silẹ, ni awọn egungun naa fa ibọn yọ, ti wọn si n yin lakọ-lakọ. Asiko ti ibọn yii si n dun, la gbọ pe ibọn ba Baba ijọ Mọsalasi naa, Moshood Salawudeen, to si jade laye loju ẹsẹ. Nigba to n bawọn akọroyin sọrọ, Imaam Mọsalasi naa, Quyum Yunus ẹni to fidi isẹlẹ naa mulẹ salaye pe, awọn egungun yii lo ni awọn n seto adura fun orilẹede Naijiria tori aabo to mẹhẹ. Ileesẹ ọlọpaa ipinlẹ Osun ko tii sọ ohunkohun lori isẹlẹ yii amọ BBC Yoruba yoo tẹsiwaju lati tanna wadi isẹlẹ yii, ta si mu abọ rẹ wa fun yin laipẹ."	https://www.bbc.com/yoruba/afrika-57634108
