sports	Mọ nípa àwọn ìfẹsẹ̀wọnsẹ̀  líìgì Ilẹ̀ Gẹ̀ẹ́sì tó wáyé ní Ọjọ́rùú	Ni Ọjọru, ninu ifẹsẹwọnsẹ ligi ilẹ gẹẹsi, awọn ẹgbẹ agbaboolu fakọyọ, ti wọn si mi awọn orisirisi, ti ifẹsẹwọnsẹ yoo si tun waye lalẹ oni. N se ikọ agbabọọlu Manchester United labẹ olukọni Erik Ten Hag gbo ewuro si oju ikọ Tothenham pẹlu ami ayo meji si odo. Fred ati Fernandes lọ ṣe atọna bi wọn ṣe bori ikọ Tothenham sugbọn oro si ma ibo miiran yoo fun lẹyin ti atamatase Cristiano Ronaldo fi ara pa ti wọn si lilo lati gbe jade kuro ninu ifẹsẹwọnsẹ naa. Ikọ Tothenham gbinyanju agbara wọn sugbọn ikọ Manchester United ni awọn ni fun anfani lati ri imu mi ori papaa Old Trafford Ninu ifẹsẹwọnsẹ miiran, ikọ Liverpool bori West Ham United pẹlu ami ayo kan si odo. Darwin Nunez lo mi awọn naa. Kete ti wọn wọ ninu saa keji ni ikọ West Ham ri pẹnariti lẹyin ti Joe Gomez kọlu Jarred Bowen sugbọn ọrọ bẹyin yọọ fun  Bowen nigba ti amule Liverpool ṣe idaduro fun lati mi awọn. Igba akọkọ re ti Darwin Nunez yọọ mi awọn ni papaa Anfield, eyi to jẹ ti Livrepool. Ikọ Newcastle United naa fakọyọ lana nigba ti wọn bori ikọ Everton pẹlu ami ayo kan si odo Akọnimọgba ikọ naa Eddie Howe gbosuba fun awọn agbabọọlu naa paapa julọ Miguel Almiron to mi awọn fun ikọ Newscastle . Nibayi ikọ Newcastle ko ti padanu ifẹsẹwọnsẹ ninu ifẹsẹwọnsẹ mẹfa ti wọn ti kopa ninu ligi ile gẹẹsi. Nise ni ikọ Brentford taku si ọrun ikọ Chelsea, ti ko si ẹnikẹni to ni anfani lati mi awọn ninu ifẹsẹwọnsẹ ana. Ikọ Chelsea ti gba ifẹsẹ wọnsẹ meju bayi ti wọn ko si ti padanu rara ninu ligi ile gẹẹsi lati igba ti wọn ti kede olukọni tuntun Graham Potter Ọpọ igba ninu ifẹsẹwọnsẹ naa ni amule ikọ Chelsea Kepa Arrizabalaga ṣe idaduro fun ikọ Brentford nigba ti Ivan Toney ati Bryan Mbeumo gbinyanju lati mi awọn. Bakan an ni David Raya di apata nla to n ṣe idaduro lana nigba ti Cesar Azpilicueta ati Kai Havertz gba bọọlu si ojule	https://www.bbc.com/yoruba/articles/c6pz5x12x6qo
entertainment	Ebenezer Obey fi ìkéde síta pé òun n gbèèrò láti gbé ìyàwó tuntun,	"Eekan olorin ti gbogbo agbaye mọ ni Oloye Ebenezer Obey jẹ. Iroyin iku rẹ to kaakiri laipẹ yii fihan bi agba olorin Juju naa ṣe lokiki si, nitoripe kaakiri agbaye ni awọn eeyan ti n beere pe ṣe lootọ ni tabi irọ. Amọṣa, ṣe awọn agba bọ, wọn ni baoku iṣe o tan. Nibayii lẹyin ti o ti han gbangba pe agba orin yii ko jade laye gẹgẹ bi awọn kan ṣe sọ, baba funrarẹ ti jade sita pe o ṣeeṣe ki iyawo tuntun o wọle laipẹ o. Ẹyin naa ni haa, baba Ebenezer Obey ṣalaye ọrọ yii ninu ifọrọwerọ rẹ pẹlu iwe iroyin abẹle kan lorilẹede Naijiria. ""Ohun to dara ni ki iyawo wa pẹlu eniyan, ko si tako ofin Ọlọrun...obinrin to ti to ọgọta ọdun ni iru emi bayii n wa, nigba ti mo ba si ṣe e laipẹ, gbogbo aye ni yoo ri."" Nigba ti Ebenezer Obey n sọrọ lori irufẹ obinrin to fẹ, o ṣalaye pe oun ko wa obinrin ti yoo tun maa bimọ mọ bayii bikoṣe nitori ati lee jọ maa wa pọ. ""Mo ti lọmọ, ọmọ-ọmọ ati ọmọ-ọmọ-ọmọ, Ọlọrun ti bukun mi"" O ṣalaye pe ""oponu agbalagba ni yoo ma a gbeero lati fẹ ọdọmọbinrin, nibi ti ọjọ ori mi de bayii"". Obey sọ pe iru ọdọmọbinrin bẹ ẹ ṣẹṣẹ bẹrẹ aye ni, to si l'agbara ibalopọ ati okun. Lara awọn amuyẹ ti iyawo ti baba fẹ ẹ fẹ gbọdọ ni, ni pe yoo ti to ẹni ọgọta ọdun tabi ju bẹẹ lọ, kii sii ṣe nitori ọmọ bibi mọ. Agba akọrin Juju miliki naa ṣalaye siwaju pe ohun kii ye ṣe afẹri iyawo oun to jade laye ti oun si maa n rii loju ala. Ọjọ kẹtalelogun, oṣu Kẹjọ, ọdun 2011, ni iyawo Ebenezer Obey, Ajinhinrere Juliana Obey-Fabiyi kú lẹni ọdun mẹtadinlaadọrin."	https://www.bbc.com/yoruba/afrika-53620895
entertainment	Baba Ijesha case: Amofin Ogala ṣàlàyé bó ṣe di agbẹjọ́rò fún Baba Ijesha	Agba amofin to n duro fun gbajumọ oṣere tiata, Ọlanrewaju James Omiyinka, ti ọpọ mọ si Baba Ijesha, Amofin agba Babatunde Ogala SAN, ti sọ idi to fi n gbẹjọ ro fun Baba Ijesha. Ninu ifọrọwerọ kan pẹlu iwe iroyin The Punch, Amofin Babatunde Ogala ṣalaye pe ko si ohun kan to jẹ koriya fun oun lati duro fun Baba Ijesha ju wi pe wọn fi ẹjọ rẹ lọ oun oun si tẹwọgba. Amọfin agba naa ṣalaye siwaju sii pe niwaju ofin ko si ipo, bakan naa lọrọ si jẹ niwaju oun pẹlu. O ni ofin nikan loun mọ, nigba ti wọn gbe ẹjọ naa tọ oun wa, oun woo daradara ti oun si rii pe awọn ọna kan wa ti a fi lee ti ipasẹ ẹjọ naa mu ilanilọyẹ jade lori ofin. Ni oṣu kẹrin ọdun 2021 ni iroyin jade pe Baba Ijẹsha lọwọ ninu aṣemaṣe kan pẹlu ọmọdebinrin kan. Lẹyin asiko diẹ ni ahamọ ọlọpaa ni wọn gbe lọ si ileẹjọ to si n jẹjọ bayii niwaju Onidajọ Oluwatoyin Taiwo nile ẹjọ giga kan ni ilu Eko. Wọn si ti sun igbẹjọ rẹ si ọjọ kẹtadinlọgbọn oṣu kẹsan ọdun 2021.	https://www.bbc.com/yoruba/afrika-58373862
religion	TB Joshua burial: Àwọn obìnrin Akoko ní kò sí ọmọbíbí ilẹ̀ náà tó tọ́jú àwọn bíí olóògbé	Bi eto isinku Wolii Temitope Balogun Joshua ṣe ti bẹrẹ lati ọjọ Aje, awọn Iyalaje ati Iyalọja ni ilẹ Akoko nipinlẹ Ondo ti pinnu lati ti gbogbo awọn ọja pa ni ọjọ Ẹti. Ọjọ Ẹti gan-an ni wọn yoo sin oku oloogbe. Atẹjade lati ọdọ Iyalaje ti ilu Ikarẹ-Akoko, Alhaja Risikat Mohammed sọ pe awọn ṣe bẹẹ lati bu ọla fun ọmọ wọn to ku. O ni ko si ifarada to tobi ju lati fi yẹ ẹ si fun ifẹ, aanu ati oore to ṣe fun awọn eniyan rẹ nigba to wa laye. O ni eyi yoo tun fun wọn ni anfaani lati wo bi eto isinku naa ba ṣe n lọ lori ẹrọ amohunmaworan ijọ Synagogue, Emmanuel TV. Ẹlomii, to jẹ olori fun gbogbo awọn obinrin to jẹ oye ni ilẹ Akoko, Oloye Margaret Ebun Oladunni sọ pe ọsẹ ọfọ ni ọsẹ yii jẹ fun ilẹ Akoko. O ni ko si ọmọ bibi ilẹ naa to ti ku tabi to wa laye, to ṣe itọju awọn eniyan rẹ bi TB Joshua.	https://www.bbc.com/yoruba/afrika-57767959
health	Covid-19 cure: ìjọba àpapọ̀ ké pe àwọn oníṣègùn ìbílẹ̀ láti wá oògùn Coronavirus	Ijọba apapọ ti kepe awọn oniṣegun ibilẹ lati ṣe awari oogun ajakalẹ arun coronavirus to n ṣọṣẹ lorilẹede Naijiria. Minisita abẹle fun eto ilera ni Naijiria, Dokita Olorunnimbe Mamora lo sọrọ yii nibi ayẹyẹ ayajọ oogun ibilẹ to waye niluu Abuja. Minisita ni ọrọ ajakalẹ arun coronavirus ti de ibi ti awọn oniṣegun ibilẹ ni lati da si ọrọ ati wa oogun si arun naa lọna ti ibilẹ. Dokita Mamora ṣalaye pe ijọba ti sọ fun ajọ NIPRD to n ri si pipoogun ati NAFDAC lati wa oogun covid-19 lati Naijiria. Ọrọ yii jade lẹyin ti adari ajọ alaanu Bill & Melinda Gates Foundation (BMGF), Dokita Mark Suzman, ṣe bu ẹnu atẹ lu aidọgba to wa ninu pinpin abẹrẹ ajẹsara laarin awọn orilẹede to lowo atawọn ti ko rọwọ họri. Dokita Suzman ni iru nkan bayii ko boju mu, ati pe o le ṣakoba fun ọrọ aje fun igba pipẹ. O ṣalaye pe bi ida ọgọrin ninu abẹrẹ ninu abẹrẹ ajẹsara covid-19 ti wọn n pin lagbaaye bayii lo n lọ si awọn orilẹede to lowo nigba ti ida kan ṣoṣo n lọ sawọn orilẹede ti ko rọwọ họri. Dokita Suzman pe fun imugbooro pinpin abẹrẹ ajẹsara papaa julọ nilẹ Afirika nibi ti wọn ti n ri abẹrẹ perete gba. Suzman ni ajọ alaanu BMGF atawọn ijọba orilẹ-ede agbaye kan lo da COVAX bi ọdun kan sẹyin lati fi le pin abẹrẹ covid-19 kaakiri gbogbo orilẹede agbaye. Amọ, o ni ọrọ ko ri bẹ mọ lẹyin tawọn orilẹ-ede to lowo n ko abẹrẹ naa pamọ ti wọn ko si jẹ ko kari. Dokita Suzman sọ pe o yẹ ki ajọ iṣọkan agbaye jiroro ninu ipade wọn lori bi wọn ṣe maa gbe owo kalẹ lati fi ṣe iranwọ fun pinpin abẹrẹ covid-19 kari aye.	https://www.bbc.com/yoruba/afrika-58567856
religion	Church of Satan: Báwo ni ìjọ́sìn ṣe n rí nínú ìjọ Sátánì?	"Laipẹ yii ni ile ẹjọ giga ti ijọba apapọ Naijiria, to wa ni ilu Umuahia nipinlẹ Abia, gba oniduro oludasilẹ ijọ Satani, Ifekwe Udo. Oun ati awọn mẹtadinlogun miran, ni awọn ọlọpaa mu nitori ija igboro to waye ni Ebem Ohafia. Awọn ara ilu naa fi ẹsun kan Udo ati ijọ rẹ pe, apẹẹrẹ buruku ni wọn jẹ fun ilu naa, ti wọn si ba awọn dukia ijọ naa jẹ. Lara ẹsun ti awọn araalu tun fi kan an ni pe, o n da alaafia ilu naa ru. Koda, ijọba ibilẹ naa ti sọ pe ko tun gbọdọ ko ijọ rẹ jọ mọ ni ilu naa, nitori pe o n ta epo si aṣọ àlà ilu naa. Ọgbọnjọ, oṣu Kẹrin, ọdun 1966 ni wọn da ijọ Satani silẹ, lati ọwọ Anton Szandor LaVey, nilu San Francisco l'orilẹ-ede America. Gẹgẹ bi akọsilẹ to wa ni itakun agbaye ṣọọṣi naa, oun ni ipejọpọ akọkọ to n gbe igbe aye rẹ gẹgẹ bi ẹlẹran ara. Fun awọn olujọsin, wọn ko sin Satani, ṣugbọn wọn ri i gẹgẹ bi apẹẹrẹ to ba iru eeyan ti wọn jẹ mu nipa ìbí. Wọn sọ pe esu duro gẹgẹ bi awokọṣe fun igberaga, ominira, ati gbigbe igbe aye ẹni lọna to wu ni - awọn amuyẹ ti awọn kan n pe ni iwa buburu. Igbagbọ awọn ọmọ ijọ Satani ni pe eniyan, nipa ọgbọn inu rẹ, lo da gbogbo awọn ọlọrun ke ke ke. Ẹnikẹni to n sin iru awọn ọlọrun bẹ ẹ, ẹni to da a ni wọn n sin. Ko tan sibẹ o, awọn ọmọ ijọ Satani sọ pe awọn ni ọlọrun ara wọn. Ati pe awọn n fi ifẹ han si ẹni to ba tọ si, ati ibinu si ẹni to ba mu inu bi wọn, tabi tapa si igbagbọ wọn. LaVey gbagbọ pe, Ọlọrun awọn Kristiẹni ko ni òye tabi ni imọ nipa bi ko ṣe rọrun lati jẹ eniyan ẹlẹran ara. O si pinnu lati fi opin si ""iye rira, ati abosi, ti awọn ṣọọṣi ẹsin Kristiẹni n polongo"". Ati nnkan ti yoo mu ki awọn eeyan ni ominira lati lo agbara okunkun fun ifẹ ara wọn. Oriṣa kan to si farajọ iru nkan to fẹ ni Satani - ""ẹda to n fun ni ni èrè to yẹ. Ẹni to jẹ pe dipo ki o dá ẹṣẹ, ki ẹri ọkan o le ma a jẹ awọn eeyan, o kuku fi aaye gba titẹ ifẹ ara ẹni lọrun. Oun nikan ni oriṣa ti ọrọ wa ye."" Ibẹrẹ ijọ Satani: Lati nkan bi ọdun 1950, ni awọn to faramọ erongba LaVey ti n sun mọ ọ, nipa kikorajọ pọ si ile rẹ ""Black House"" nilu San Francisco. Awọn iwadii ti LaVey ṣe nipa ẹmi okunkun, lo pilẹ bi wọn ṣe n lo ẹgba ọrun dudu ati pupa, to ni aworan ẹyẹ àdán. Ṣọọṣi naa tun sọ pe lẹyin ọdun diẹ, LaVey bẹrẹ si iṣẹ idán okunkun ati agbara irubọ, o n ṣe nipa igbega lẹni iṣẹ, ẹbun ọfẹ, owo, adun ibalopọ, ati pipa tabi yanju awọn ọta rẹ. Eyi lo tubọ mu ki ọpọ eeyan sun mọ, nitori wọn gbagbọ pe, o ti ni aṣẹ Agbara Okunkun Aye. Laarin ọdun kan aabọ ti wọn da ijọ Satani silẹ, ẹẹmẹta ni ariwo sọ lori rẹ ninu awọn iwe iroyin. Igba akọkọ ni ti igbeyawo to waye laarin gbajugbaja akọroyin kan, John Raymond, ati Judith Case, ọmọ gbajugbaja agbẹjọro. Awọn mejeeji lo jẹ ọmọ ijọ, ti wọn si kesi Olori Alufaa wọn, LaVey lati so wọn pọ ni orukọ Satani. Gbogbo ileeṣẹ iroyin nilẹ America, to fi de Europe lo fẹ ẹ ni aṣoju nibi eto igbeyawo naa, lati kọ nipa ara meeriri igbeyawo ọhun. Ipele àṣẹ ninu ijọ Satani: Ọmọ ijọ to f'orukọ silẹ Ọmọ ẹgbẹ to n ṣe deede (Oye Akọkọ) Ajẹ/Oṣo (Oye keji) Alufaa ọkunrin/obinrin (Oye kẹta) Magistra/Magister (Oye kẹrin) Maga/Magus(Oye Karun un) Ilana Ijọsin wọn: Irubọ wọn akọkọ jẹ iṣọtẹ si ẹsin Kristiẹni. N ṣe ni wọn sẹ pẹpẹ obinrin to wa ni ihoho, pẹlu orin ikọkukọ. Koda, wọn dori agbelebu kodo, ti wọn si ka Adura Oluwa lati ipari. 'Omi mimọ' ti wọn gbe kalẹ ni wọn sọ di aimọ, nipa kiki nkan si oju ara obinrin. Ọti wiski ni wọn fi jẹ ounjẹ alẹ Oluwa dipo ẹjẹ Jesu. Awọn orukọ oriṣa ni wọn si n pe, dipo orukọ Ọlọrun awọn Kristiẹni. Igbakeji ni asiko ti LaVey ṣe iribọmi fun ọmọ rẹ obinrin ni ilana Satani. Dipo riri ọmọ naa sinu omi, ẹnu ọna pẹpẹ ijọ ni ọmọ naa joko si, pẹlu oriṣiriṣi nkan ti ẹnu n jẹ. Bakan naa lo wọ koto to ni aworan Satani si ori, to si ka oriṣiriṣi ọrọ lati jẹjẹ atilẹyin ati ifọkansi fun Satani. Ọpọlọpọ wọn ko sin Satani: Iyalẹnu to wa nibẹ ni pe ọpọlọpọ awọn to jẹ olufọkansin ninu ijọ naa kii jọsin fun Satani - wọn ko gbagbọ ninu ọlọrun kankan. Wọn ko tako ṣiṣe ọdun Keresimesi: Iyalẹnu nla ni eyi jẹ lati ri i pe wọn faramọ ṣiṣe ajọyọ ọjọ ibi Jesu. Igbagbọ wọn nipe lọwọ awọn ẹlẹsin ibilẹ ni awọn Kristiẹni ti ja akoko ayẹyẹ naa gba. Ṣugbọn ṣa, Baba Keresi jẹ ọna lati dun ara ẹni ninu, eyi to jẹ ọkan pataki lara afojusun wọn. ""Ni asiko yii, a n gbadun adun aye, a si wà pẹlu awọn ti a fẹran."" O ko le ri ijọ Satani kankan ni agbegbe rẹ: Gẹgẹ bi o ṣe wa lori itakun agbaye wọn, ijọ Satani ko ni ile ijọsin kankan, nitori pe ""o tako ilana ti ẹnikọọkan wa n gba lo igbeaye wa. Yatọ si ile oludasilẹ rẹ, ti wọn ti bẹrẹ ijọ naa, wọn ti fi igba kan ni awọn ẹka ile ijọsin , ṣugbọn wọn ti tu wọn ka, nigba ti wọn ro o pe ko ba oju mu. Koda, Olu ijọ naa ti kuro ni ile LaVey ni San Francisco, o si ti wa ni ilu New York. Wọn ko si fi  aaye silẹ fun ẹnikẹni lati ṣe abẹwo si ibẹ. Ida kọnkọ si ni wọn ti maa n ṣe awọn ayẹyẹ wọn. Ti alejo nile rẹ ba mu inu bi ọ, huwa si i laini aanu Ma ṣe ni ibalopọ ti ẹni naa ko ba fi ami han pe, oun fẹ ẹ ba ọ lopọ Ma ṣe pa awọn ọmọde lara Ma ṣe pa ẹranko, ayafi fun ounjẹ rẹ tabi ti o ba doju ija kọ ọ Ma ṣe wa ija ẹnikẹni, ṣugbọn o le pa ẹni to ba wa ija rẹ run, lẹyin ti o ba ti kilọ fun. Awọn nkan ti wọn ka si ẹṣẹ ni jijẹ omugọ, imọ tara ẹni nikan, ki eeyan o ma a dibọn, titan ara ẹni jẹ, aini Ijọ naa tako lilo, ati katakara oogun oloro. Wọn gbagbọ pe ọmọ ijọ to ba tako ofin to de oogun oloro ni orilẹ-ede rẹ, ṣe e si iparun ara rẹ. Ijọ Satani kii ṣe fun talika: Igba ati marundinlọgbọn Dọla (N81,000) ni ọmọ ẹgbẹ tuntun ma n san lati darapọ. Eyi si da lori bi ẹni naa ba ṣe le dahun awọn ibeere ti wọn ba bi i. Igbakuugba si ni wọn le fi opin si jijẹ ọmọ ẹgbẹ fun ẹni naa."	https://www.bbc.com/yoruba/afrika-53536774
health	Coronavirus in Nigeria: Buhari buwọ́lu bílíọ̀nù N6.45b láti dá ibùdó afẹ́fẹ́ gáàsì sílẹ̀ fún ìtójú àwọn alárùn covid-19	Aarẹ Muhammadu Buhari ti buwọlu owo to le ni biliọnu mẹfa naira N6.45bn fun ibudo idasilẹ afẹfẹ gaasi fun itọju awọn to larun coronavirus lorilẹede Naijiria. Ibudo mejidinlogoji kaakiri Naijiria ni awọn ibudo naa yoo wa. Ṣaaju akoko yii ni ajọ amuṣẹya PTF ti sọ lọjọ karun un oṣu kinni pe ijọba apapọ yoo da ibudo gaasi silẹ kaakiri gbogbo ipinlẹ mẹrindinlọgbọn ni Naijiria. Ninu atẹjade kan ti ijọba fi sita l'Ọjọbọ, ijọba ya $671,000 sọtọ fu atunṣe awọn ibudo afẹfẹ gaasi lawọn ile iwosan kan ni Naijiria. Ijọba ko sọ gbedeke nigba ti awọn ibudo gaasi naa yoo pari. Minisita eto iṣuna, Zainab Ahmed sọ fun igbimọ NEC to n ri si eto ọrọ-aje pe igbesẹ ijọba naa ṣe pataki fun itọju awọn ọmọ Naijiria ti ọwọja ẹlẹẹkeji covid-19 n ba finra. Ẹwẹ, eeyan 1964 lo lugbadi coronavirus l'Ọjọbọ ni Naijiria eyi to tii pọ julọ lọjọ kan ṣoṣo. Ko si ẹni to le sọ pato iye awọn alarun coronavirus to nilo afẹfẹ eemi kaakiri ile iwosan ni Naijiria. Amọ, ijọba sọ pe ki ọrọ naa pe ninu irora ni ọpọ eeyan to larun coronavirus wa.	https://www.bbc.com/yoruba/afrika-55761933
entertainment	"Tope Alabi: Ẹni tó kọ orin ""Oniduro Mi E se o"" fèsì"	"Olorin to kọ ""Oniduro Mi ẹ ṣe o"" eyi to jẹ orin to ti gba ẹnu ọpọlọpọ kaakiri lati fi mọ riri ore Ọlọrun, Tolu Adelegan ti fesi lori fidio ti gbajugbaja Olorin Tope Alabi ti ni orin to kọ ko pọn Ọlọrun le. Ninu fidio kan nibi ti Ajihinrere Tope Alabi ti n ṣe iṣẹ iranṣẹ orin lọwọ ninu ijọ nla kan lo ti kẹnu bọ ọrọ to ni Ọlọrun ju keeyan dede maa pe ni Oniduro lọ. Alaseyori kọ́ ló ni orin ""Oniduro Mi"", àmọ́ ìdí tí mi ò  ṣe bá a jà pé ó jí orin mi kọ nìyìí - Tolu Adelegan ""Ọlọrun kọja Oniduro sir, emi naa fẹran orin yẹn amọ ọjọ ti mo fẹ kọ ọ ẹmi mimọ ni gbẹnu ẹ sọhun"". Tope ni kii ṣe pe oun n sọ pe orin kan o dara amọ o ni iru aṣaro ti eeyan maa n ṣe pẹlu ẹmi mimọ to ba ti fun eeyan ni imisi. ""To ba jẹ bi ẹmi mimọ ṣe n gbe e wa ni eeyan n sọ  ni, onikaluku a kan maa sọ isọkusọ ni, o ni lati tun un da ro daadaa koo to gbe orin yẹn jade"". Olorin Tope Alabi ni oun funra oun ti kọ orin ri ti oun si tun yi i pada. O ni ""Jesu ko duro fun wa, o ku fun wa ni tori naa o kọja pe eeyan n duro fun eeyan, ẹni to lọ sori agbelebu lati ku, wọn na a lẹgba, a tut si i lara, a gun un lọkọ lẹgbẹ, a fiya jẹ ẹ, a pe e ni ẹlẹ́ṣẹ ti kii ṣe, ẹ wa sọ pe oniduro ni... Ẹ ma maa fi nkan ti ko dara we Ọlọrun, Ọlọrun pọ ju bẹẹ lọ"". Tope Alabi ṣe afiwe ẹni ti baba rẹ ku ti awọn kan si n fọwọ sọya lati ṣe oniduro gẹgẹ bii baba amọ to kan jẹ ẹta lasan. Nigba to di owurọ oni ọjọ Aiku, ọjọ kẹtala oṣu kẹfa ni Arabinrin Tolu Adelegan Ayonitemi naa fi atẹjade si oju opo rẹ pe oun pinu lati ma sọrọ amọ o dupẹ lọwọ gbogbo awn eeyan to ti n fesi lori ọrọ naa lati ṣe atilẹyin fun un. ""Si ogo Ọlọrun, gẹgẹ bi if Ọlọrun ni mo fi maa n kọ awọn orin mi ati nipasẹ ọrọ Ọlọrun, iyẹ Bibeli mi, ẹlomiran le maa gba imisi lọdọ awọn ọlọrun kekeke o tabi nibomiran amọ Jesu Krisiti nikan lemi gbojule"". O ṣalaye pe oun o ni oke mii lẹyin Ọlọrun toripe Jesu ni igbẹkẹle, baba, oludari, oloore, ireti oun kii ṣe Ọlọrun miran. Ọdun 2014 ni Adelegan ni Ọlrun fun oun ni imisi orin naa eyi to jẹ orin ikeji to kọ ninu awo orin ""Ikede Ẹẹkeji"". O fi atẹjade sita pe laipẹ, ifọrọwanilẹnuwo yoo jade nipa orin naa ọkan ninu eyi ti BBC Yoruba n ṣewadii lati gbe jade laarin ọjọ diẹ. Ẹwẹ, awọn eeyan ti n fi ero, iwoye ati itumọ tiwọn sita lori ọrọ yii ti olorin naa si n fi atẹjade idaniloju rẹ sita pe oun ko gba orin yii nilana okunkun tabi ọna ti ko mọ ju ọdọ ẹmi mimọ lọ."	https://www.bbc.com/yoruba/57294356
politics	Buhari: Ọwọ́ fẹ́rẹ̀ tẹ àwọn agbébọn lókè Ọya	"Irọ ati arumọjẹ ni gbogbo awọn agbebọn ti wọn n paayan tan, ti wọn wa n pariwo Allahu Akbar n pa. Aarẹ Muhammadu Buhari ni ko tọ si ọmọ ole ko maa pariwo ọlọpaa n bọ. Aarẹ Buhari sọ ọrọ yii lasiko to ṣe abẹwo si ibudo awọn atipo eeyan ti eeyan bii ẹgbẹrun kan le aadọta, ti ogun agbebọn Boko haram le kuro nile wa, eyi to wa ni ipinlẹ Katsina. Aarẹ si ti fi da wọn loju pe, oun yoo dẹkun awọn agbebọn to n dun mọhurumọhuru mọ awọn ọmọ orilẹede Naijiria. Buhari ni awọn to n fi orukọ ọlọrun boju pa eniyan, kii ṣe ẹlẹsin tootọ. O ni o ṣeeṣe o ko jẹ pe wọn ko mọ Ọlọrun ni, abi ko jẹ pe ọrọ wọn ati Ọlọrun ko wọ. ""Gbogbo awọn eeyan to jẹ pe iṣẹ ti wọn mọ ni ṣiṣe ko ju ki wọn pa eeyan lọ, ki wọn si maa pariwo ""Allahu Akbar"", n pa irọ ni nitori Ọlọrun o ṣe ibi. O ko lee gbe ibọn tabi ado oloro, ida tabi ọbẹ lati pa alaiṣẹ, ki o si maa pariwo ""Allahu Akbar"". Ohun ti eyi tumọ si ni pe o ṣeeṣe ki o maa mọ Ọlọrun tabi ki o maa ni igbagbọ ninu rẹ."" ""Bakan naa lo tun rọ awọn eeyan agbegbe naa lati joye oju lalakana fii n ṣọ ori nitori pe gbogbo igbesẹ ti awọn agbebọn naa n gbe ko ṣẹyin alami ti awọn kan lara araalu n ṣe fun wọn."""	https://www.bbc.com/yoruba/afrika-49354869
sports	AFCON 2019: Idíje Egypt ati Zimbabwe, ọ̀rọ̀ kọ sísọ	Idije AFCON fawọn agbabọọlu ilẹ̀ Adulawọ lo bẹrẹ ni ana ni orilẹ-ede Egypt. Ikọ agbabọọlu Egypt ati Zimbabwe ni wọn koju ara wọn ninu idije iṣide ni Cairo. Ninu idije naa ni Egypt ti na Zimbabwe pẹlu ami ayo kan si odo nipa kọju si mi koo gba a sile. Awọn orilẹ-ede mẹrinlelogun ni wọn jọ maa woju ara wọn ninu idije AFCON tọdun 2019 fun igba akọkọ. Opolopo eeyan ni wọn ni eto iṣide naa dun daadaa nibi ti Femi Kuti atawọn olorin miran ti da awọn eniyan lara ya. Mahmoud Trezeguet lo gba ami ayo kan ṣoṣo naa si awọn ikọ Zimbabwe. Agbabọọlu Liverpool, Mo Salah fẹẹ gba goolu keji wọle sawọn ṣugbọn Edmore Sibanda to jẹ aṣọle Zimbabwe sọ pe oni kọ. Awọn agbabọọlu Zimbabwe bii Ovidy Karuru naa gbiyanju ṣugbọn ẹ̀pa ko boro titi idije naa fi pari. Eyi kọ wa pé ko si ohun daradara to wu ilẹ Adulawọ lati ṣe ti a ko le ṣe. Eto iṣide idije naa ni awọn eniyan gba pé o dun bii ti iṣide ife ẹyẹ agbaye Russia 2018 O fẹrẹ tó ẹgbẹrun lọna marundinlọgọrin ero ti wọn peju si papa iṣere ni Cairo wa wo idije iṣide naa. Ẹkọ pataki ti awọn eniyan n sọ ni pe ki ikọ kankan ma gbojule ẹnikan ṣoṣo fun ogo idije wọn. Opolopo lo fi Mohammed Salah ṣe apẹẹrẹ ninu idije yii nitori oun kọ lo pada gbogo fun Egypt. Ẹnikẹni lo le jẹ koriya fun awọn akẹgbẹ rẹ lasiko idije. Awọn eniyan ni ki Naijiria fi ti Egypt kẹkọọ pé ko si ẹni ti ko le jẹ koriya fun awọn akẹgbẹ rẹ lasiko idije bii ti Sallah ti Liverpool. Nitootọ ni ariwo ero pọ fun Mohamed Salah to n gba bọọlu fun Liverpool ṣugbọn o kan gbiyanju ti ara rẹ lasan ni. ọpọlọpọ gba pe idije Egypt to ku lẹyin tun maa dun ju eyi lọ pẹlu ero pe Salah a da bira pẹlu bọọlu.	https://www.bbc.com/yoruba/ere-idaraya-48729462
sports	AfroBasketWomen: Buhari kí D'Tigress lẹ́yìn tí wọ́n ṣíná ìyà fún Senegal gba ife	Aarẹ Muhammadu Buhari ti gboriyin fun awọn ikọ agbabọọlu alapẹrẹ Naijiria, D'Tigress pe wọn ku iṣẹ. Lọjọ Aiku, ọjọ kejidinlogun ni awọn agbabọọlu obinrin ọmọ Naijiria yii fakọyọ ti wọn tun gbe ife ẹyẹ Afrobasket lọ. Awọn naa ni wọn gba a lọdun 2017 ti wọn gbogo wale fun Naijiria. 60 -55 ni wọn fi fagbahan ikọ Senegal to gbalejo idije naa nibi ti o le ni ẹgbẹrun mẹẹdogun oluworan ti kopa. Aare Muhammadu Buhari to n tukọ orilẹ-ede Naijiria naa ti gboṣuba rabandẹ fawọn olu ọmọ wọnyii pe wọn gba ife ẹyẹ naa lẹẹkan sii. Otis Hughley to je akọnimọọgba ikọ awọn obinrin yii fi idunnu rẹ han lasiko to n ba BBC sọrọ. O ni inu oun dun pupọ pe idije bọọlu alapẹrẹ ti ni idagbasoke to yẹ laisko yii. O tun gboriyin fawọn agbabọọlu obinrin ti Naijiria ti o n kọ pe pe wọn fakọyọ daadaa. Ọpọ awọn ọmọ Naijiria lo ni iṣẹ takuntakun ni awọn obinrin n ṣe ninu ogo ere idaraya Naijiria lasiko yii.	https://www.bbc.com/yoruba/49392590
