health	ከኮሮናቫይረስ በእጅጉ እያተረፉ ያሉት ትልልቅ ድርጅቶች	የኮሮናቫይረስ ወረርሽኝ የበርካታ አገራት ኢኮኖሚ ላይ ከባድ ጫና እያደረሰ ቢሆንም ትልልቅ የሚባሉት የዓለማችን የቴክኖሎጂ ኩባንያዎች ግን ጥሩ የሚባል ትርፍ እየሰበሰቡ ነው። በበይነ መረብ አማካይነት የተለያዩ አይት መገልገያዎችን የሚሸጠው አማዞን ከኮሮናቫይረስ ወረርሽኝ ማግስት ባሉት ሶስት ወራት ብቻ ሽያጩ 40 በመቶ ከፍ እንዳለለት ያስታወቀ ሲሆን ታዋቂው የስልክና የላፕቶፕ  አምራች አፕል ደግሞ የአይፎንና ሌሎች መቀየሪያ መሳሪያዎች በደንብ እንደተቸበቸቡለት ገልጿል። ፌስቡክ ደግሞ በስሬ በማስተዳድራቸው እንደ ዋትስአፕና ኢንስታግራም ባሉ ማህበራዊ ሚዲያዎች የተጠቃሚዎች ቁጥር 15 በመቶ ከፍ ብሎልኛል ብሏል። • በኮሮናቫይረስ ወረርሽኝ ምክንያት ትርፉ መጨመሩን ሳምሰንግ አስታወቀ • ኮሮናቫይረስ የቀሰቀሳቸው የአና የሚበሉ ሥዕሎች • ከኮሮናቫይረስ የትኞቹ ድርጅቶች አተረፉ? እነማንስ ከሰሩ? የአማዞን የሩብ ዓመት ትርፍ 5.2 ቢሊየን ዶላር ሲሆን ድርጅቱ ከተቋቋመበት ከአውሮፓውያኑ 1994  ጀምሮ ይህ ከፍተኛው ነው ተብሏል። ድርጅቱ እንደውም ከኮሮናቫይረስ መከሰት በኋላ ለሰራተⶉቹ መከላከያ መሳሪያዎችን ለመግዛትና የመከላከያ ጥንቃቄዎችን ለማድረግ ከፍተኛ ወጪ ማውጣቱ ትርፉን ዝቅ ያደርገዋል ተብሎ ተፈርቶ ነበር። በአጠቃላይ በበይነ መረብ የሚካሄዱ ንግዶች የሽያጭ መጠኑ 40 በመቶ ከፍ ብሏል። እስከ ሰኔ ወር መጨረሻ ባሉት ሶስት ወራት ደግሞ በአጠቃላይ 88.9 ቢሊየን ዶላር አንቀሳቅሷል። ትርፍም ቢሆን በአስገራሚ ሁኔታ ባለፈው ዓመት ከነበረበት 2.6 ቢሊየን ዶላር ወደ 5.2 ቢሊየን ዶላር ከፍ ብሏል። በሚሊየኖች የሚቆጠሩ ሰዎች በወረርሽኙ ምክንያት ቤት ውስጥ ብዙ ጊዜያቸውን ማሳለፋቸውን ተከትሎ የበይነ መረብ ሽያጭ በእጅጉ ተጧጡፏል። አማዞንም ቢሆን የደንበኞቹን ፍላጎት ለማሟላት በሩብ ዓመቱ ብቻ ተጨማሪ 175 ሺ ሰራተኞችን ቀጥሯል። ፍላጎቱ በዚሁ መቀጠሉ ስለማይቀር በርካታ መጋዘኖችንና ሰራተኞችን ለመጨመርም እያሰበ ነው። የአፕል የሩብ ዓመት ትርፍ ደግሞ ባለፈው ዓመት ከነበረበት 11 በመቶ በመጨመር 59.7 ቢሊየን ደርሷል። ሰዎች ስራቸውን ከቤታቸው ሆነው መስራታቸው የተለያዩ መገልገያዎችን እንዲጠቀሙ አድርጓቸዋል። በዚህም ምክንያት የማክ ላፕቶፖችና አይፓዶች በእጅጉ ተፈላጊ ነበሩ። ሁለቱም የአፕል ምርቶች ከወረርሽኙ መከሰት በኋላ  ገበያቸው እንደደራ ድርጅቱ አስታውቋል። በዚህም ምክንያት ባለፈው ከነበረው 10 ቢሊየን ዶላር ትርፍ ወደ 11.25 ቢሊየን ዶላር ከፍ ብሏል። ፌስቡክ ደግሞ ከኮሮናቫይረስ በኋላ ትርፉ በእጅጉ እንደሚቀንስ ቢጠበቅም እንደውም የ 11 በመቶ ጭማሪ አሳይቷል። አነስተኛ ድርጅቶች ያሏቸው ሰዎች ለማስታወቂያ ወደ ፌስቡክ ላይሄዱ እንደሚችሉ ባለሙያዎች ተንብየው ነበር። ነገር ግን ወረርሽኙን ተከትሎ የፌስቡክ ተጠቃሚዎች ቁጥር በእጅጉ በመጨመሩ ምክንያት ለማስታወቂያ የሚመጡ ድርጅቶችም ቁጥር አብሮ ከፍ ብሏል። በዚህም ምክንያት የድርጅቱ የሩብ ዓመት ትርፍ 5.2 ቢሊየን ዶላር እንዲደርስ ሆኗል። ፌስቡክ እንደሚለው ባለፈው ሰኔ ወር ብቻ በሁሉም የማህበራዊ ሚዲያዎቸ ላይ 2.4 ቢሊየን ተጠቃሚዎች የነበሩ ሲሆን ይህም የ15 በመቶ ጭማሪ አለው። ከአራቱ ትልልቅ የቴክኖሎጂ ኩባንያዎች አንዱ የሆነው አልፋቤትም ቢሆን እንደ ሌሎቹ ባይሆንም ትርፋማ ሆኗል። ድርጅቱ በስሩ ጉግልና ዩቲዩብን የያዘ ሲሆን እስካሁን ያገኘሁት ትርፍ 38.3 ቢሊየን ዶላር ነው ብሏል። ይህ ደግሞ ከባለፈው ዓመት ጋር ሲነጻጸር የሁለት በመቶ ቅናሽ ያሳያል።	https://www.bbc.com/amharic/news-53605349
health	ክብደትዎን መቀነስ ይፈልጋሉ? ቁርስ እንዴት መመገብ እንዳለብዎ እንንገርዎ	ቁርስዎን በደንብ መመገብ እና ቀለል ያለ እራት መብላት የረሃብ ስሜት እንዳይኖር በማድረግ ክብደትን ለመቀነስ ይረዳል ይላሉ ተመራማሪዎች። ሳይንቲስቶች ከበድ ያለ ቁርስ ወይም ከበድ ያለ እራት በሰዎች ክብደት ላይ የሚያመጣውን ተፅእኖ ለማነፃፀር ሞክረዋል። የቀኑን ዋነኛ ምግብ በየትኛው ሰዓት ቢመገቡ ሰዎች የሚያቃጥሉት ካሎሪ ተመሳሳይ ሆኖ እንደሚሆን የአበርዲን ዩኒቨርስቲ ተመራማሪዎች ደርሰውበታል። ነገር ግን በደንብ ቁርሳቸውን የተመገቡ ሰዎች በቀን ውስጥ ያላቸው የምግብ ፍላጎት አነስተኛ ሆኖ ታይቷል፤ ይህም ማለት የሚፈልጉትን አመጋገብ ለመከተል ቀላል ያደርገዋል። አጥኚዎቹ በዚህ ምርምራቸው ‘ክሮኖ ኒውትሪሽን’ የተሰኘው ፅንሰ ሃሳብን በጥልቀት ለማየት ሞክረዋል። [ክሮኖ ኒውትሪሽን በየትኛው ሰዓት ምግብ መመገብ የበለጠ ውጤታማ ያደርገናል የሚለውን የሚመረምር ሳይንስ ነው። የሰውነትዎን አካላዊ፣ አዕምሯዊ እና ስሜታዊ ዑደቶችን የሚቆጣጠረው ክፍል ምግብ ጋር ያለውንም ዝምድና ይገመግማል። ] ከመሸ በኋላ መመገብ ለሰውነታችን መጥፎ ጊዜ ነው፣ ምክንያቱም የሰውነታችን ሰዓት ምግብን ወደ ኃይል የሚለውጠውን (ሜታቦሊዝም) ወደ እንቅልፍ ስለሚቀይረው ነው። ተመራማሪዎቹ ያሳተፏቸው 30 በጎ ፈቃደኞች ከሁለት ወራት በላይ ቁርስ፣ ምሳ እና እራት በቀን በአጠቃላይ እስከ 1 ሺህ 700 ካሎሪ የሚሆን ምግብ ተዘጋጅቶላቸው ነበር። በአንደኛው ወር ለቀን የሚያስፈልገውን የካሎሪ መጠን ግማሹን ለቁርስ እንዲበሉ እና ምሳ እና እራት ደግሞ አነስ ያለ ምግብ እንዲመገቡ ተደርገዋል። በሁለተኛው ወር እነዚህ በጎ ፈቃደኞች ከቁርስ ይልቅ እራት ላይ ከበድ ያለ ምግብ እንዲበሉ ተደረጉ። ሴል ሜታቦሊዝም በተሰኘው ጆርናል ላይ በታተመው ውጤት መሰረት የቀኑን ከባድ ምግብ በየትኛውም ሰዓት መመገብ ሰውነታችን በቀን ምን ያህል ካሎሪ ያቃጥላል የሚለው ላይ ምንም ልዩነት የለውም። ዋነኛው ልዩነት ግን የታየው በምግብ ፍላጎት ወይም የረሃብ ስሜት ላይ ነው። ከፍተኛ ቁርስ የሚመገቡ ሰዎች በቀን ውስጥ አነስተኛ የምግብ ፍላጎት እንዲኖራቸው ማድረግና የረሃብ ስሜትንም እንዲቆጣጠሩ ያደርጋል። ፕሮፌሰር አሌክሳንድራ ጆንስተን እንደሚሉት በርካቶች የሚመገቡትን የምግብ መጠን በማይቆጣጠሩበት ሁኔታ ውስጥ ጥናቱ ወሳኝ ሊሆን ይችላል። “ጥናቶቹ እንደሚጠቁሙት የምግብ ፍላጎትን ለመቆጣጠር በደንብ ቁርስ መመገብ መሠረታዊ ነው” ይላሉ። “ቀንዎን በጤናማ እና በትልቅ ቁርስ መጀመር ከቻሉ የአካል ብቃት እንቅስቃሴ ለማድረግ እንዲሁም በተቀሩት ሰዓታት ያለውን የምግብ ፋላጎትን ለመቆጣጠር ከፍተኛ ዕድል ይሰጣል” በማለት ያስረዳሉ። በጥናቱ ውስጥ የተካተቱት የቁርስ ዓይነቶች የፍራፍሬ ጭማቂ፣ እርጎ፣ እንቁላል፣ ቋሊማ (ሶሴጅ) እና እንጉዳይ የያዘ ሲሆን፣ ይህም ሁሉም ሰዎች ጥጋብ እንዲሰማቸው የሚያደርግ ከፍተኛ የፕሮቲን ይዘት ያለው ነው። ከፍተኛ ቁርስ መመገብ ለምን የምግብ ፍላጎትን እንደሚቀንስ ግልፅ አይደለም። ነገር ግን ፕሮፌሰር ጆንስተን እንደሚሉት ይህ ሁኔታ ከአዕምሯችን የምግብ ፍላጎት ጋር የተያያዘ እንደሆነ ሃሳቦች አሉ ይላሉ። “የአዕምሯችን የምግብ ፍላጎት የሌሊቱን ጾም የምንፈታበትና የመጀመሪያ ምግብ ጋር የበለጠ የተጣጠመ ነው” ይላሉ። ነገር ግን ይህ ውጤት ከበርካቶች የአመጋገብ ልምድ ጋር ተቃራኒ ነው። “በርካቶች የሚተኙበትን ሰዓታት ለመጨመር እየሞከሩ ባለበት ወቅት በማለዳ ተነስተው ምግብ ለማዘጋጀትም ሆነ ተቀምጠው በደንብ ለመብላት ጊዜ አይኖራቸውም። ይህ ማለት በርካቶች በደንብ የሚበሉት እራት ነው” ይላሉ ፕሮፌሰር ጆንስተን። በአሁኑ ወቅት ሳይንቲስቶች በፈረቃ የሚሰሩ ሠራተኞች እኩለ ሌሊት ላይ ሲመገቡ ምን እንደሚፈጠር እየመረመሩ ነው። በተጨማሪም ግለሰቦች እንደ ባህርያቸው የጠዋት ሰዎች ከሆኑ ጠዋት፣ ወይም ደግሞ የማታ ሰዎች ከሆኑ ማታ መብላት ይኖርባቸው ይሆን? የሚለውን ለማየት እየሞከሩ ነው። “አመጋገብዎን ለመለወጥ እያሰቡ ከሆነና የሚራቡበትን ወይም ተጨማሪ መክሰስ ሰውነትዎት የሚፈልግበትን ወቅት ያስቡ” በማለት የሚናገሩት የአስተን ዩኒቨርስቲ የአመጋገብ ባለሙያ ዶክተር ዱዋን ሜሎር ናቸው። “ረሃብ የሚሰማዎት ጠዋት ከሆነ በደንብ ቁርስ መመገብ ሊረዳዎት ይችላል። በተመሳሳይም የምሽት ተመጋቢ ከሆኑም በቀን ውስጥ አነስተኛ ምግቦችን ተመግበው እራት ላይ በደንብ መመገብ ሊጠቅምዎ ይችላል” ይላሉ።	https://www.bbc.com/amharic/articles/c4n0dgyddg8o
health	ኮሮናቫይረስ፡ በኢትዮጵያ ለኮቪድ-19 ጽኑ ህሙማን የኦክስጂንና የቬንትሌተር እጥረት ማጋጠሙ ተነገረ	"በኢትዮጵያ በኮሮናቫይረስ የሚያዙና የጽኑ ህሙማን ህክምናና ክትትል የሚያስፈልጋቸው ሰዎች ቁጥር እየጨመረ በመምጣቱ የሰው ሰራሽ መተንፈሻ መሳሪያና የኦክስጂን እጥረት እያጋጠመ መሆኑ የሕብረተሰብ ጤና ኢንስቲትዩት ገለጸ። ተቋሙ በአሁኑ ጊዜ በአገሪቱ ውስጥ በኮቪድ-19 የሚያዙ ሰዎች ቁጥር ከዕለት ዕለት በከፍተኛ ደረጃ እየጨመረ በመምጣቱ የባለሙያ ድጋፍና እንክብካቤ የሚሹ ሰዎች ቁጥር ""የህክምና ማዕከላት ማስተናገድ ከሚችሉት አቅም በላይ"" እየሆነ መምጣቱን ጨምሮ ገልጿል። በዚህም ሳቢያ በኮሮናቫይረስ በጽኑ ታምመው በህክምና ተቋማት ድጋፍ ለማግኘት ለሚመጡ ህሙማን አገልግሎት የሚውሉ ""የሰው ሰራሽ የመተንፈሻ መሳሪያ (ቬንትሌተር) እና የኦክስጅን እጥረት እያጋጠመ ነው"" ሲል ገልጿል። በኢትዮጵያ እስከ ትናንት እሁድ ድረስ በተደረገ የላብራቶሪ ምርመራ 175,467 ሰዎች በኮሮናቫይረስ መያዛቸው ሲረጋገጥ፣ 2,550 ሰዎች ደግሞ ህይወታቸው አልፏል። የኮሮናቫይረስ የመተንፈሻ አካላትን በተለይም ሳንባን የሚያጠቃ ሲሆን በበሽታው ክፉኛ ለተጠቁ ጽኑ ህሙማን ሰው ሰራሽ የመተንፈሻ መርጃ (ቬንትሌተር) እና ኦክስጂን ህይወታቸውን ለመታደግ ለሚደረገው ጥረት በእጅጉ አስፈላጊ ናቸው። በኢትዮጵያ በኮሮናቫይረስ በጽኑ የታመሙ ሰዎችን ህይወት ለመታደግ በአሁኑ ወቅት በአገልግሎት ላይ የሚገኙት የሰው ሰራሽ የመተንፈሻ መርጃ ቬንትሌተሮች ቁጥር ከ500 ብዙም የበለጠ አይደለም። ስለዚህም በበሽታው የሚያዙት ሰዎች ቁጥር በከፍተኛ ደረጃ መጨመሩ የህክምና ድጋፍ የሚፈልጉ ሰዎችን መጠን በመጨመር በህክምና ተቋማቱ ላይና በባለሙያዎች ላይ ጫናን በመፍጠር ከአቅም በላይ ሊሆን እንደሚችል ተሰግቷል። በተለይም በወረርሽኙ በጽኑ ታምመው የቬንትሌተርና የኦክስጂን ድጋፍ የሚያስፈልጋቸው ህሙማን ቁጥር እየጨመረ በመሆኑ የነፍስ አድን አገልግሎቱን መስጠት ከማይቻልበት ደረጃ ላይ ከደረሰ የሚሞቱ ሰዎች ቁጥር በከፍተኛ ደረጃ ሊያሻቅብ ይችላል። በአሁኑ ወቅት በመላው አገሪቱ በየዕለቱ የሚመዘገበው በኮሮናቫይረስ የተያዙ ሰዎች ቁጥር እየጨመረ መሆኑን የገለጸው ኢንስቲትዩቱ፤ ከዚሁ ጋር ተያይዞም በወረርሽኙ ሳቢያ የጽኑ ህሙማን የህክምና አገልግሎት የሚፈልጉ ህሙማንና ህይወታቸውን የሚያጡ ሰዎች ቁጥር ""አስደንጋጭ በሆነ ሁኔታ እየጨመረ ይገኛል"" ይገኛል ብሏል። የኮሮናቫይረስ በኢትዮጵያ ውስጥ መገኘቱ ይፋ ከተደረገ ባለፈው ቅዳሜ አንድ ዓመት የሞላው ሲሆን፣ በዚህ ጊዜ እስካሁን ድረስ በወረርሽኙ ሳቢያ ህይወታቸውን ያጡ ሰዎች ቁጥር 2550 ደርሷል። በኮቪድ-19 ለሞት ከተዳረጉት ሰዎች መካከል 74 በመቶ የሚሆኑት በህክምና ማዕከላት ውስጥ ሲሆን 24 በመቶዎቹ ደግሞ በአስክሬን ላይ ከተወሰደ ናሙና ላይ በተደረገ ምርመራ የተገኘ መሆኑ ተገልጿል። ኢንስቲቲዩቱ እንደሚለው ባለፉት ጥቂት ቀናት እየተመዘገበ ያለው የሟቾች ቁጥር በከፍተኛ ደረጃ እየጨመረ ነው። እስካሁን ድረስ በየዕለቱ ከተመዘገቡት ሞቶች ሁሉ ከፍተኛው በእነዚህ ቀናት ውስጥ ተመዝግቧል። በወረርሽኙ ምክንያት የሞቱ ሰዎች ቁጥር በተለያዩ የአገሪቱ ከፍሎች የተመዘገቡ ሲሆን በዋና ከተማዋ አዲስ አበባ ውስጥ የተመዘገበው የሟቾች ቁጥር ከሌሎቹ ቦታዎች አንጻር በእጅጉ ከፍተኛ ነው። በዚህም መሠረት በአዲስ አበባ 1,852 ሰዎች በኮቪድ-19 ሳቢያ ለህልፈት ሲዳረጉ ይህም ከአጠቃላዩ የሟቾች ቁጥር 73 በመቶውን ይይዛል። በተከታይነት በኦሮሚያ ክልል 256 ሰዎች (10 በመቶ)፣ በአማራ ክልል 105 ሰዎች (4 በመቶ)፣ በሲዳማ ክልል 75 ሰዎች (3 በመቶ) የሚሆኑት በበሸውታው ህይወታቸው አልፏል። በየዕለቱ በሚደረገው ምርመራ ቫይረሱ የሚገኝባቸው ሰዎች ቁጥርም በፍጥነት እየጨመረ መሆኑ ተገልጿል። ቬንትሌተር ምንድን ነው? ቬንትሌተር የሰውነታችንን የአተነፋፈስ ሥርዓት ተክቶ የሚሠራ ማሽን ነው። የህሙማን ሳምባ እክል ሲገጥመው ቬንትሌተር የመተንፈስ ተግባር ስለሚያከናውን ህይወትን ይታደጋል። በኮቪድ-19 በጽኑ ከታመሙ ስድስት ህሙማን መካከል ቢያንስ አንዱ የመተንፈስ ችግር ይገጥመዋል። ይህም የሚሆነው ቫይረሱ ሳምባን ስለሚያውክ ነው። በዚህ ወቅት ቬንትሌተር ከሌለ ግለሰቡን ማዳን አዳጋች ነው። ሁለት ዓይነት የመተንፈሻ መርጃ መሣሪያዎች (ቬንትሌተር) አሉ። አንዱ መካኒካል ቬንትሌተር ሲሆን ሌላኛው ደግሞ ቱቦ-አልባ ቬንትሌተር ይባላል። መካኒካል ቬንትሌተር የአየር ቱቦ በአፍ በኩል እንዲገባ ተደርጎ ታማሚው ካርቦንዳይኦክሳይድ እንዲያስወጣና ኦክስጂን እንዲያስገባ የሚያደርግ ነው። ቱቦ-አልባው ቬንትሌተር ወይም በእንግሊዝኛው ግን ወደ ሳምባ የሚወርድ ቧንቧ ሳይኖረው አፍና አፍንጫ ላይ በሚደረግ ጭምብል ብቻ የሚሰራ ነው። ቬንትሌተሮቹ ሂሙዲፋየር [እርጥበት የሚፈጥር] ክፍል አላቸው። ይህም ማለት ወደ ሰውነት የሚገባን ሙቀትና እርጥበት የሚቆጣጠርና ህመምተኛው የሚተነፍሰው አየር ለሰውነት ሙቀት ተስማሚ በሆነ መጠን እንዲሆን የሚያደርግ ነው። በዚህ ወቅት በሽተኞች የመተንፈሻ አካል ጡንቻዎች ዘና እንዲሉላቸው የሚያስችል መድኃኒት ይሰጣቸዋል። መጠነኛ የኮሮናቫይረስ ምልክቶችን የሚያሳዩ በሽተኞች ግን የፊት ጭምብል ቬንትሌተር ብቻ ሊሰጣቸው ይችላል። ይህም በአፍና አፍንጫ በኩል በግፊት አየር ወደ ሳምባ እንዲገባ የማድረግ ዘዴ ነው።"	https://www.bbc.com/amharic/news-56359828
