business	5 ጥያቄዎች ለስድስት ኢትዮጵያውያን የሳይንስና ቴክኖሎጂ ባለሙያ ሴቶች	አዲሱን ዓመት 2015 ዓ.ም. ምክንያት አድርገን በተለያየ የሳይንስ ዘርፍ ያሉ ስድስት ኢትዮጵያውያን ሴቶችን አምስት ጥያቄዎች ጠይቀናል። ዶ/ር ሶስና ኃይሌ- በአሜሪካ፣ ኢሊኖይ ግዛት፣ በኖርዝዌስተርን ዩኒቨርስቲ የማቴሪያልስ ሳይንስ እና ኢንጂነሪንግ ፕሮፌሰር እንዲሁም ኬሚስት በ2014 ዓ. ም. ባንቺ ሙያ ከተፈጠሩ ወይም ከተሠሩ መካከል ያስደነቀሽ የቱ ነው? ለምን? ሥራዬ ከኢነርጂ ሳይንስ ጋር ይገናኛል። ዋናው ትኩረቴ ደግሞ ኤሌክትሮኬሚካል ኢነርጂ ትራንስፎርመሮች ናቸው። በሙያዬ እጅግ ያስገረመኝ ታላቁ የኢትዮጵያ ሕዳሴ ግድብ ነው። ይህም አሜሪካ የሰው ልጅን ጨረቃ ላይ ከላከችበት የስኬት ታሪክ ጋር ተመሳሳይ ነው። የሕዳሴ ግድቡን ጨረቃ ላይ ከመውጣት የሚለየው ዓለምን በሳይንስ ከማሳመን አልፎ የአየር ንብረት ቀውስን ሳያባብስ በአፍሪካ ቀንድ በሚሊዮኖች የሚቆጠሩ ሰዎችን ከኃይል ድህነት (Energy Poverty) መንጭቆ ማውጣቱ ነው። በ2014 ዓ. ም. ካደረግሻቸው መካከል ትልቁ ስኬቴ የምትይው የቱን ነው? ያለፈው ዓመት ትልቁ ስኬቴ ከአሜሪካ የኢነርጂ ክፍል በተመደበ ገንዘብ የጥናት ቡድን አሰባስቤ ‘ኢነርጂ ፍሮንቲርስ ሪሰርች ሴንተር’ የተባለ የጥናት ማዕከል መቋቋሙ ነው። ሥራችን፣ ሀይድሮጅን ከጠጣር አካሎች ጋር ስለሚያደርገው ግንኙነት የዓለምን መረዳት የሚያሳድግ ነው። ለአራት ዓመት 10 ሚሊዮን ዶላር አግኝተናል። ጥናታችን፣ በኤሌክትሪካል ኢነርጂ አማካይነት ውሃን በመክፈል ሃይድሮጅን ለማምረት መሠረት ይጥላል። ለ2015 ዓ. ም. ምን አቅደሻል? ኧረ ዕቅዶቼ ብዙ ናቸው! ያለው ጊዜም አጭር ነው! ዕቅዶችሽን ያለ ተጨባጭ ግብ በአደባባይ መናገር ደግሞ ወደ ውድቀት ሊያመራም ይችላል። እኔና የጥናት ቡድኔ፣ ኤሌክትሪሲቲ በመጠቀም ውሃን ለመክፈል የሚደረገውን ጥረት የሚያደናቅፉ መሰናክሎችን መፍታት ነው ዕቅዳችን። ልክ እንደ ሕዳሴ ግድቡ፣ የኤሌክትሪክ ኃይልን ከካርበን ነጻ ከሆኑ ምንጮች ማመንጨት ነው ሐሳቡ። ኤሌክትሪኩን ኋላ ላይ ለመጠቀም ሀይድሮጅን ማምረት ቁልፉ ነው። በ2014 ዓ. ም. አንብበሻቸው ከወደዳቸው መጻሕፍት መካከል ሰዎች ቢያነቧቸው የምትያቸው ሦስት መጻሕፍት የትኞቹ ናቸው? ሦሰት ቢታዩ የምትያቸው ፊልሞችስ? አይ ምንም የለኝም! የዳንኤል ካህንማን “Thinking, Fast and Slow” ማንበብ ፈልጌ ነበር ግን ገና ጊዜ አግኝቼ አልጀመርኩትም። ካጠቃላይ ሳይንሳዊ ፈጠራዎች ወይም ግኝቶች የቱ ያስገርምሻል? ለምን? የዌብ ስፔስ ቴሌስኮፕ ምሥሎች እጹብ ድንቅ ናቸው። አስትሮፊዚሲስቶች 13.7 ቢሊዮን ዓመታት ወደኋላ ተጉዘው ማየት ችለዋል። እንዴት ወደዚች ምድር እንደመጣን ለማወቅ መመራመራችን ከሌሎች የምድራችን ፍጡራን የተለየን ያደርገናል። እነዚህ ስለጋላክሲዎች አፈጣጠር የሚነግሩን ምሥሎች አንዳች መንፈሳዊ ኃይል አላቸው። ምድራችንን ጠብቀን ለልጅ ልጆቻችን እንደምናወርስ ተስፋ አደርጋለሁ። ቤተልሔም ደሴ- የአይኮግ ኤኒዋን ካን ኮድ ዋና ኃላፊትና ኮምፒውተር ሳይንቲስት በ2014 ዓ. ም. ባንቺ ሙያ ከተፈጠሩ ወይም ከተሠሩ መካከል ያስደነቀሽ የቱ ነው? ለምን? ቃላት፣ ሐረግና ዓረፍተ ነገር ተሰጥቶት ወደ ምሥል የሚቀይረው አርቴፊሻል ኢንተለጀንስ (ሰው ሠራሽ ልኅቀት) አስደናቂ ነው። ኤአይ የሥዕል ውድድርም አሸንፏል። ይህ እውን ሆኖ ስናይ፣ ሳናስበው ወዴት እየሄድን ነው? የሚል ጥያቄም ያጭራል። በ2014 ዓ. ም. ካደረግሻቸው መካከል ትልቁ ስኬቴ የምትይው የቱን ነው? የ2014 ዓ. ም. ከፍታዬ ‘Rebel Girls’ የተባለው መጽሐፍ ላይ መውጣቴ ነው። ከድሮም የልጆች መጽሐፍ ላይ መውጣት አልም ነበር። እኔ ባለሁበት መጽሐፍ እነ ቢሊ አይሊሽ፣ እነ ቴይለር ስዊፊት አሉበት። ስለዚህ ይገዙታል ማለት ነው። ሲገዙት ደግሞ እነሱ ጋር ደረስኩ ማለት ነው። መጽሐፉ እስካሁን 5 ሚሊዮን ኮፒ ተሸጧል። ትልቁ የሰው ልጅ ከፍታ ሌሎች ሰዎችን ማነሳሳት ነው። ለ2015 ዓ. ም. ምን አቅደሻል? የ2015 ዓ. ም. ዕቅዴ ከ13 ዓመቴ ጀምሮ ያለምኩትን ማሳካት ነው። ይህም ተንቀሳቃሽ የኮምፒውተር ማዕከል  ነው። ‘ዲጂ ትራክ ኢትዮጵያ’ ይባላል። ይህም 40 ጫማ ኮንቴነር ሲሆን በፀሐይ ይሠራል። በየከተማው እየዞረ ኮዲንግ እና ሮቦቲክስ ያስተምራል። በጣም በጣም በጉጉት የምጠብቀው እሱን ነው። በ2014 ዓ. ም. አንብበሻቸው ከወደዳቸው መጻሕፍት መካከል ሰዎች ቢያነቧቸው የምትያቸው ሦስት መጻሕፍት የትኞቹ ናቸው? ሦሰት ቢታዩ የምትያቸው ፊልሞችስ? ቢነበቡ የምላቸው መጻሕፍት፡ Shoe Dog [ፊል ናይት] 21 Lessons for the 21st Century [ዮቫል ኖሀ ሀሪሪ] The Thing Around Your Neck [ቺማማንዳ ንጎዚ አዲቺ] ቢታዩ የምላቸው ፊልሞች ደግሞ The Gentlemen፣ Rick and Morty እና Love, Death & Robots ካጠቃላይ ሳይንሳዊ ፈጠራዎች ወይም ግኝቶች የቱ ያስገርምሸል? ለምን? ኢንተርኔት! ምንም ጥያቄ የለውም። ኢንተርኔትን የመሰለ ፈጠራኮ የለም። ሕይወት ለውጧል። የዕውቀት ሽግግርን አስችሏል። ተደራሽነቱ በመስፋቱና በመላው ዓለም በመዳረሱ በተለይም በወጣቶች ላይ ትልቅ ተጽዕኖ አለው። ዶ/ር ሩት ድሪባ- የላስት ማይል ኸልዝ ቴክኒካል አማካሪና የሕክምና ባለሙያ በ2014 ዓ. ም. ባንቺ ሙያ ከተፈጠሩ ወይም ከተሠሩ መካከል ያስደነቀሽ የቱ ነው? ለምን? ከመቶ ዓመታት በላይ ለወባ በሽታ ክትባት ለማግኘት ሲሞከር ነበር። ክትባቱ ተገኝቶ በቅርቡ ይፋ ተደርጓል። እስከ 80 በመቶ የወባ በሽታን የመከላከል አቅም ስላለው በበሽታው ሕይወታቸውን የሚያጡ ሕጻናትን ሞት ለመቀነስ ተስፋ ሰጥቷል። በ2014 ዓ. ም. በጣም ያስገረመኝ እና ተስፋ የሰጠኝም ግኝት ነው። በ2014 ዓ. ም. ካደረግሻቸው መካከል ትልቁ ስኬቴ የምትይው የቱን ነው? ትልቁ ስኬቴ፣ በዓይነቱ ልዩ ሆኖ ለመጀመሪያ ጊዜ በጤና ጥበቃ እንዲሁም በላስት ማይል ኸልዝ የተተገበረው ለጤና ኤክስቴንሽን ባለሙያዎች በዲጂታል ቴክኖሎጂ ሥልጠና የሚሰጥበት (Blended Learning) ዲዛይን እና ትግበራ ላይ መሳተፌ ነው። ለ2015 ዓ. ም. ምን አቅደሻል? እንደ እግዚአብሔር ፈቃድ፣ በ2015 ዓ. ም. የሕጻናትን ጤና የሚያሻሽል ሥራ ላይ የመሳተፍ፣ ማኅበረሰቡን እንዲሁም የጤና ኤክስቴንሽን ባለሙያዎችን ያማከለ ሥራም የመሥራት እቅድ አለኝ። በ2014 ዓ. ም. አንብበሻቸው ከወደዳቸው መጻሕፍት መካከል ሰዎች ቢያነቧቸው የምትያቸው ሦስት መጻሕፍት የትኞቹ ናቸው? ሦሰት ቢታዩ የምትያቸው ፊልሞችስ? ቢነበቡ የምላቸው መጻሕፍት፡ Winning with People [ጆን ማክስዌል] The Checklist Manifesto [በአቱል ጋውንዴ] Our Iceberg is Melting [ሆልገር ራታግበር እና ጆን ኮተር] ቢታዩ የምላቸው ፊልሞች ደግሞ Fractured፣ Unforgivable እና Sweet girl ካጠቃላይ ሳይንሳዊ ፈጠራዎች ወይም ግኝቶች የቱ ያስገርምሻል? ለምን? የሚደንቀኝ ፈጠራ ክትባት ነው። በሽታን፣ በበሽታ አምጭ ተሕዋስ ወይም ባለው ንጥረ ነገር ሰውነትን አለማምዶ በሽታን እንዲከላከል ቀድሞ ማዘጋጀት እና ስቃይን ብሎም ሞትን መቀነስ በጣም ትልቅ ፈጠራ ነው። ብርሃን ታዬ- የቴክኖሎጂ ፖሊሲ አጥኚ እና ተንታኝ በ2014 ዓ. ም. ባንቺ ሙያ ከተፈጠሩ ወይም ከተሠሩ መካከል ያስደነቀሽ የቱ ነው? ለምን? ያስገረመኝ ዶትፕሎት (DotPlot) መተግበሪያ ነው። ይሄ መተግበሪያ ስልክ ላይ ተጭኖ ሴቶች የጡት ካንሰርን ቀድመው ማወቅ እንዲችሉ ጡታቸው ላይ የሚታይ ለውጥን ይከታተሉበታል። ገና በሕክምና ፈቃድ ሰጪዎች ይሁንታ እስከሚሰጠው እየጠበቀ ቢሆንም፣ እንዲህ ያለ መተግበሪያ አነስተኛ ገቢ ያላቸው ሴቶች የጡት ካንሰርን እንዲከላከሉ ይረዳል። በ2014 ዓ. ም. ካደረግሻቸው መካከል ትልቁ ስኬቴ የምትይው የቱን ነው? ትልቁ የ2014 ዓ. ም. ስኬቴ በቋሚነት የአካል ብቃት እየሠራሁ 10 ኪሎ ሜትር መሮጤ ነው። ለ2015 ዓ. ም. ምን አቅደሻል? ዕቅዴ ዋጋ ከምሰጣቸው ሰዎች ጋር ውብ ጊዜ ማሳለፍና በበይነ መረብ ላይ የማሳልፈውን ጊዜ ቀንሼ ከሰዎች ጋር የበለጠ መነጋገር ነው። በ2014 ዓ. ም. አንብበሻቸው ከወደዳቸው መጻሕፍት መካከል ሰዎች ቢያነቧቸው የምትያቸው ሦስት መጻሕፍት የትኞቹ ናቸው? ሦሰት ቢታዩ የምትያቸው ፊልሞችስ? ቢነበቡ የምላቸው መጻሕፍት፡ Do Not Disturb: The Story of a Political Murder and an African Regime Gone Bad [ሚሼላ ሮንግ] Seven and a half Lessons about the Brain [ሊሳ ፌልድማን] Race after Technology [ሩሀ ቤንጃሚን] ፊቸር ፊልም እንኳን ብዙ አላይም። ግን ተከታታይ ፊልሞች ልጠቁም። እነዚህም Paper Girls፣ Veep እና The office ናቸው። ካጠቃላይ ሳይንሳዊ ፈጠራዎች ወይም ግኝቶች የቱ ያስገርምሻል? ለምን? ኅትመትን የሚበልጥ ፈጠራ ያለ አይመስለኝም። ሕይወት የሰጠን ኅትመት ነው። ቤተልሔም ላቀው- የሊሄም ኒውትሪሽን መሥራች፣ የቤኑ ፉድስ አጋር መሥራችና ኃላፊት፣ የአክት ፎር ፉድ አክት ፎር ቼንጅ ንቅናቄ መሪ እንዲሁም ኒውትሪሽኒስት በ2014 ዓ. ም. ባንቺ ሙያ ከተፈጠሩ ወይም ከተሠሩ መካከል ያስደነቀሽ የቱ ነው? ለምን? ኢትዮጵያ ውስጥ ስብ መምጠጥ [Fat Removal] ተጀምሯል። ይሄ ሂደት እኛ አገር እንዲህ በቅርብ ጊዜ ይገባል ብዬ አልገመትኩም ነበር። በጣም ነው ያስደነቀኝ። በ2014 ዓ. ም. ካደረግሻቸው መካከል ትልቁ ስኬቴ የምትይው የቱን ነው? የዓለም አቀፉ ‘አክት ፎር ፉድ አክት ፎር ቼንጅ’ ንቅናቄ የኢትዮጵያ ወጣቶች ተወካይ ሆኜ የተለያዩ ሥራዎችን እሠራ ነበር። 2014 ዓ. ም. በጣም ስኬታማ የሆንበት ነው። ለ2015 ዓ. ም. ምን አቅደሻል? ሊሄም በትንሽ ደረጃ ነበር የሚሠራው። በ2014 ዓ. ም. ግን አድጎ፣ ቢሮ ተከራይተን መሥራት ጀምረናል። ቢዝነሱ ከተጀመረ እንኳን ቆይቷል። እና በ2015 ዓ. ም. ከአጋሮቻችን ጋር ተጣምረን ወደ ክሊኒክ የማሳደግ ዕቅድ ይዘናል። በ2014 ዓ. ም. አንብበሻቸው ከወደዳቸው መጻሕፍት መካከል ሰዎች ቢያነቧቸው የምትያቸው ሦስት መጻሕፍት የትኞቹ ናቸው? ሦሰት ቢታዩ የምትያቸው ፊልሞችስ? ቢነበቡ የምላቸው መጻሕፍት፡ ትንሿ ቤተክርስቲያን [ገብረእግዚአብሔር ኪዳን] Zero to One [ፒተር ታይል] ሕክምና በቤታችን [በቀለች ቶላ] ፊልም እንኳን አላይም። በምትኩ ቢጎበኙ ብዬ የማስባቸውን ሦስት ቦታዎች ልንገርሽ። ላሊበላ፣ አክሱም እና የሩዋንዳው ‘ኪጋሊ ጄኖሳይድ ሜሞሪያል’ ካጠቃላይ ሳይንሳዊ ፈጠራዎች ወይም ግኝቶች የቱ ያስገርምሻል? ለምን? የኢንዶስኮፒ ምርመራ መደረግ መቻሉ ያስገርመኛል። በእርግጥ ውስብስብ ሳይንስ አይደለም። አሁን ባለው መሣሪያ በቀላሉ የትኛውም ሆስፒታል ውስጥ ሊሠራ ይችላል። አንድን ግለሰብ ሳናፈርሰው ስላለበት ሂደት እንድናውቅ ያስችላል። የላብራቶሪ ምርመራና የደም ሕዋስ ማየት መቻል አሁን ላለንበት ዘመን ትልቅ ግኝት ነው። ሕሊና ኃይሉ ንጋቱ- በአሜሪካ ዩኒቨርስቲ ኦፍ ካሊፎርኒያ፣ በርክሌ የኮምፒውተር ሳይንስ የፒኤችዲ ሁለተኛ ዓመት ተማሪ በ2014 ዓ. ም. ባንቺ ሙያ ከተፈጠሩ ወይም ከተሠሩ መካከል ያስደነቀሽ የቱ ነው? ለምን? በ2014 ዓ. ም. ካስደመሙኝ ፈጠራዎች አንዱ በኤአይ ሞዴል የሚፈጠሩ ምሥሎች የጥራት ደረጃ ነው። እነዚህ ሞዴሎች በስፋት ጥቅም ላይ ይውላሉ። በአንድ በኩል እንደ ቤኖ ሳሙኤል ያሉ ባለሙያዎች በቴክኖሎጂ የታገዘ ሥነ ጥበብ ሲሠሩ ያስገርመኛል። በሌላ በኩል ደግሞ ተገቢው ቁጥጥር ያልተደረገበት ቴክኖሎጂ ጉዳቱ ያሰጋኛል። በ2014 ዓ. ም. ካደረግሻቸው መካከል ትልቁ ስኬቴ የምትይው የቱን ነው? ትልቁ ስኬቴ በአሶሴሽን ፎር ኮምፒውቲንግ ማሽነሪ ተቋም የኮምፒውቴሽናል እና ዳታ ሳይንስ ፌሎሺፕ ማሸነፌ ነው። ለ2015 ዓ. ም. ምን አቅደሻል? በ2015 ዓ. ም. በዩሲ በርክሌይ ዩኒቨርስቲ ሁለተኛ ዓመት ፒኤችዲ ትምህርቴን እከታተላለሁ። ዕቅዴም ከአፍሪካውያን አጋሮቼ ጋር ተጣምሬ ማኅበረሰባችንን የሚጠቅም ሥራ ማከናወን ነው። በ2014 ዓ. ም. አንብበሻቸው ከወደዳቸው መጻሕፍት መካከል ሰዎች ቢያነቧቸው የምትያቸው ሦስት መጻሕፍት የትኞቹ ናቸው? ሦሰት ቢታዩ የምትያቸው ፊልሞችስ? ቢነበቡ የምላቸው መጻሕፍት፡ All about Love [ቤል ሁክስ] Race After Technology [ሩሀ ቤንጃሚን] Shadow King [መዓዛ መንግሥቴ ] ቢታዩ የምላቸው ፊልሞች Queen of Katwe፣ Us እና እረኛዬ ካጠቃላይ ሳይንሳዊ ፈጠራዎች ወይም ግኝቶች የቱ ያስገርምሻል? ለምን? አንድ ፈጠራ መምረጥ ካለብኝ፣ የተለያዩ የሰውነት አካላትን በቀዶ ሕክምና መለወጥ (Organ Transplant) ይደንቀኛል። ለምን? የሚለው ግልጽ ነው። የሰዎችን ሕይወት ስለሚያተርፍ።	https://www.bbc.com/amharic/articles/c0wzew2yx90o
politics	የጂቡቲው ፕሬዝዳንት ኢስማኢል ኦማር ጊሌ ለ5ኛ ጊዜ ምርጫ አሸነፉ	የጂቡቲው ፕሬዝዳንት ኢስማኤል ኦማር ጊሌ ለ5ኛ ጊዜ ለፕሬዝዳንትነት ተወዳድረው ከመራጩ ሕዝብ 98 ከመቶ ድምጽ በማግኘት አሸነፉ። ብቸኛው ተፎካካሪያቸው የነበሩት ዛካሪያ ኢስማኢል ፋራህ 1.59 በመቶ ብቻ የመራጮችን ድምጽ ሊያገኙ መቻላቸው ተነግሯል። የዋነኛው ተቃዋሚ መሪው ዕጩ ባለፈው አርብ የምርጫ ቅስቀሳ ቡድኔ በምርጫ ጣቢያዎች አካባቢ እንግልት ደርሶበታል በሚል ድምጽ ሳይሰጡ ራሳቸው ከውድድሩ አግልለው ነበር። ምርጫውን በበላይነት የመሩት የአገር ውስጥ ሚኒስትሩ ሙሚን አሕመድ ሼክ አርብ ዕለት 177 ሺህ መራጮች ድምጽ መስጠታቸውን ተናግረዋል። በመጀመሪያ ላይ በፕሬዝዳንታዊ ምርጫው ላይ ድምጽ ለመስጠት የተመዘገቡት ሰዎች ድምር 200 ሺህ እንደነበር ተዘግቧል። ኤስማኤል ጊሌ አሁን የ73 ዓመት አዛውንት ሲሆኑ እንደ አውሮፓውያን ከ1999 ጀምሮ በጂቡቲ የፕሬዝዳንተንት የሥልጣን መንበር ላይ ቆይተዋል። የዘንድሮውን ምርጫም በከፍተኛ የበላይነት በማሸነፋቸው ለሚቀጥሉት 5 ዓመታት ጂቡቲን እንዲመሩ ያስችላቸዋል ተብሏል። በቆዳ ስፋት አነስተኛ ሆና ነገር ግን በአፍሪካ ቀንድ ቁልፍ አካባቢያዊና ወታደራዊ ቦታ የያዘችው ጂቡቲ ጠቅላላ የሕዝብ ብዛቷ  ከአንድ ሚሊዮን ያነሰ ነው። አሜሪካ፣ ቻይናና ፈረንሳይ በጂቡቲ ወታደራዊ ጦር ሰፈር ገንብተዋል። የዓለም ባንክ በቅርብ ያወጣው አንድ መረጃ ከ14 ከመቶ በላይ የሚሆኑ ጂቡቲያዊያን በከፍተኛ የድህነት ውስጥ ነው የሚኖሩት ይላል።	https://www.bbc.com/amharic/news-56702735
health	ኮሮናቫይረስ፡ የኦክስፎርድ-አስትራዜኔካ ክትባት በህጻናት ላይ ሊሞከር ነው	የኦክስፎርድ-አስትራዜኔካ ክትባት በህጻናት ላይ ምን ያህል ውጤታማ ይሆናል የሚለውን ለማጣራት አዲስ የክትባት ሙከራ መጀመሩ ተገልጿል። የመጀመሪያዎቹ ዙር የክትባት ሙከራዎች በያዝነው ወር መጨረሻ አካባቢ የሚጀመሩ ሲሆን በነዚህ ሙከራዎችም እስከ 300 የሚደርሱ በጎ ፈቃደኛ ህጻናት ይሳተፋሉ ተብሏል። ተመራማሪዎቹ እንደሚሉት ይህ ሙከራ እድሜያቸው ከ6 እስከ 17 የሆኑ ህጻናት የኦክስፎርድ-አስትራዜኔካ ክትባትን ከወሰዱ በኋላ ምን ያህል የመከላከል አቅማቸው ይጠነክራል የሚለውን ለማወቅ ወሳኝ ነው። ይህ ክትባት ዩናይትድ ኪንግደም ውስጥ በኮሮረናቫይረስ ምክንያት የሚከሰት ከፍተኛ ህመምን አልያም ሞትን ለመቀነስ ጥቅም ላይ እየዋለ ሲሆን የፋይዘር-ባዮንቴክ ክትባትም ቢሆን ለተመሳሳይ አገልግሎት ጥቅም ላይ እየዋለ ነው። በህጻናቱ ላይ በሚደረገው ሙከራ እስከ 240 የሚደርሱት ተሳታፉዎች የኦክስፎርድ-አስትራዜኔካ ክትባትን እንዲወስዱ የሚደረግ ሲሆን ቀሪዎቹ ደግሞ የማጅራት ገትር መድሀኒት በተመጠነ መልኩ እንዲወስዱ ይደረጋሉ ተብሏል። የክትባት ሙከራው በሚደረግባቸው አራት ማዕከላት፤ ዩኒርሲቲ ኦፈ ኦክስፎርድ፣ ሴንት ጆርጅ ዩኒቨርሲቲ ሆስፒታል፣ ለንደን፣ ሳውዝሀም[ፕተን ዩኒቨርሲቲተ ሆስፒታል እና ብሪስቶል የህጻናት ሆስፒታል አቅራቢያ የሚኖሩ በጎ ፈቃደኞች በቶሎ እንዲመዘገቡ ተጠይቀዋል። ለመሳተፍ በጎ ፈቃደኛ የሆኑት ህጻናት ሙከራው ከመጀመሩ በፊት ግን ለይቶ ማቆያ መግባት ግዴታ እንደሆነ ተነግሯል። በዩናይትድ ኪንግደም እስካሁን  የኦክስፎርድ-አስትራዜኔካ ክትባትን ለህጻናት ለመስጠት ምንም የታሰበ ነገር እንደሌለ የተገለጸ ሲሆን ለጊዜው ግን እድሜያቸው ከ28 ዓመት በላይ የሆኑ ሰዎች ብቻ ናቸው ክትባቱን እየወሰዱ የሚገኙት። የፋይዘር-ባዮንቴክ ክትባት ደግሞ እድሜያቸው ከ16 ዓመት በላይ ለሆኑ ሰዎች ተፈቅዷል። በክትባቱ አሰጣጥ ስርአት መሰረት እድሜያቸው ከ16 ዓመት በታች የሆኑ ታዳጊዎችና ህጻናት በጠና ቢታመሙ እንኳን ክትባቱ አይሰጣቸውም። የኦክስፎርድ ዩኒቨርሲቲ በበኩሉ እድሜያቸው ከ6 እስከ 17 ለሆኑ ህጻናት ክትባቱን መስጠት ምን አይነት አሉታዊና አዎንታዊ ተጽዕኖዎች እንደሚኖሩት ለማወቅ የሚደረገው ይህ ሙከራ የመጀመሪያው ይሁን እንጂ ከዚህ በኋላ በርካታ ሙከራዎች እንደሚደረጉ አስታውቋል።	https://www.bbc.com/amharic/news-56059659
