health	የካንሰር ህዋስን የሚገድለው ቫይረስ ለካንሰር ሕሙማን ተስፋ እንደሚሰጥ ተገለጸ	ቫይረስ በመጠቀም የካንሰር ሕዋሳትን የሚገድለው ሕክምና ለካንሰር ሕሙማን ተስፋ ሰጪ እንደሆነ ተገለጸ። የዩናይትድ ኪንግደም ሳይንቲስቶች እንደሚሉት፣ በዚህ ሕክምና አንድ ካንሰር ታማሚ ሲፈወስ ሌላ ታማሚ ደግሞ ከፍተኛ ማገገም አሳይቷል። ለሕክምና የዋለው ቫይረስ በዋናነት የጉሮሮ መከርከር የሚያስከትለው ኸርፕስ ሲምፕሊክስ ሲሆን፣ ቫይረሱ እንዲዳከም ተደርጎ ነው ጥቅም ላይ የዋለው። በሕክምናው ዙሪያ ተጨማሪ ጥናቶች ቢያስፈልጉም፣ ለካንሰር ሕሙማን ተጨማሪ ዕድሜ የመስጠት ተስፋ እንዳለው ሳይንቲስቶች ገልጸዋል። የ39 ዓመቱ ክሪስቶፍ ዎጂኮስኪ በሕክምናው የሙከራ ደረጃ ከተሳተፉ አንዱ ነው። ምዕራብ ለንደን የሚኖረው ክሪስቶፍ በሮያል ማርስደን ኤንኤችኤስ ፋውንዴሽን ትረስት በሚገኘው የካንሰር ምርምር ማዕከል ለምርምር በጎ ፈቃደኛ ሆኗል። እአአ በ2017 ነበር የምራቅ አመንጪ ሕዋስ ካንሰር እንዳለበት የተነገረው። ቀዶ ሕክምና ቢደረግለትም አልተሻለውም። “የመኖር ተስፋ የለህም ተብዬ ነበር። የሕይወት ማገባደጃ እንክብካቤ እየተደረገልኝ ነበር። እጅግ ልብ ይሰብራል። አሁን ግን ተስፋ የሚሰጥ ምርምር ውስጥ መግባቴ ተስፋ አጭሮብኛል” ብሏል። የካንሰር ሕዋሳትን የሚገድለው ቫይረስ ሙከራ ከተደረገለት በኋላ ክሪስቶፍ ካንሰሩ ጠፍቶለታል። ለተከታታይ አምስት ሳምንታት በየሁለት ሳምንቱ መርፌ ይሰጠው ነበር። ሰውነቱ ውስጥ ያለው በካንሰር የተጎዳ ሕዋስ ላይ አነጣጥሮ ነው ቫይረሱ የሚሠራው። ይህም በሽታ የመከላከል አቅሙ እንዲዳብር አግዟል። በሙከራ ደረጃ አርፒ2 የተባለውን ቫይረስ በመርፌ ይወስዱ የነበሩት 40 ሰዎች ናቸው። ከመካከላቸው ከመርፌው በተጨማሪ ኒቮሎማብ የተባለ የካንሰር መድኃኒት በተጨማሪ ሲሰጣቸው የነበሩም ይገኙበታል። ክሪስቶፍን ጨምሮ አርፒ2 ከተሰጣቸው ዘጠኝ ሕሙማን ሦስቱ ሰውነታቸው ውስጥ ያለው ካንሰር ተመናምኗል። አርፒ2 መርፌን ከኒቮሎማብ መድኃኒት ጋር አጣምረው ከወሰዱ 30 ሰዎች ሰባቱም አገግመዋል። እንደ ድካም ያሉ የጎንዮሽ ጉዳቶች ውስን ነበሩ። ዋና ተመራማሪው ፕሮፌሰር ኬቨን ሀሪንግተን ለቢቢሲ እንደገለጹት፣ የምርምሩ ውጤት “እጅግ አስደናቂ” ነው። በተለያየ የካንሰር ደረጃ ላይ ላሉ ሕሙማን ተስፋ ሰጭ እንደሆነ አክለዋል። ሕክምናው እምብዛም ለማይታየው የዐይን ካንሰር እና የኢሶፎገስ ካንሰር እንደሚውልም ተመራማሪው ተናግረዋል። “በሕክምና ምርምር የመጀመሪያ ደረጃ እንዲህ ያለ ተስፋ ሰጭ ውጤት ማግኘት አልተለመደም። በርካታ የካንሰር ሕሙማንን ማከም ስንጀምር ምን ውጤት ልናገኝ እንደምንችል እስከማይ ጓጉቻለሁ” ብለዋል። ዶ/ር ማሪን ቤከር የተባሉት የካንሰር ተመራማሪ፣ የካንሰር ሕክምና አንድ ደረጃ ከፍ እንዲል ያገዘ ጥናት መሆኑን ተናግረዋል። “ሳይንቲስቶች ቫይረስን ተጠቅመው ካንሰርን መዋጋት እንደሚችሉ የደረሱበት ከ100 ዓመታት በፊት ነበር። ነገር ግን ደኅንነቱ በተጠበቀና በውጤታማ መንገድ ሕክምናውን ማስኬድ ቀላል አልሆነም። ይህ አዲሱ ሕክምና በጥቂት ሰዎች ሲመረመር ተስፋ ፈንጥቋል። ወደ ሰፊ ምርምር ማደግ አለበት” ሲሉ አስረድተዋል። ሳይንቲስቶች ቫይረስ ተጠቅመው ካንሰርን ለመዋጋት ሲሞክሩ ይህ የመጀመሪያቸው አይደለም። ከዚህ ቀደም የቆዳ ካንሰርን ለማከም ቫይረስ ጥቅም ላይ የሚውልበት ሕክምና ፈቃድ ተሰጥቶታል።	https://www.bbc.com/amharic/articles/c19jrd08nl2o
sports	ኢትዮጵያ ለአፍሪካ እግር ኳስ ዋንጫ አለፈች	ኢትዮጵያ በዚህ ዓመት የምእራብ አፍሪካ አገሯ ካሜሮን ለምታዘጋጀው የአፍሪካ እግረ ኳስ ዋንጫ ማለፏ አረጋገጠች። ኢትዯጵያ ለአፍኮን 2021 ያለፈችው ከስምንት ዓመት በኋላ ነው። የኢትዮጵያ ብሔራዊ ቡድን የሚገኝበት ምድብ ወስጥ ያሉት የኒጀርና የማዳጋስካር አቻ መውጣታቸውን ተከትሎ ነው 9 ነጥብ በመያዝ ወደ አፍሪካ ዋንጫ መቀላቀሉን ያረጋገጠው። ዛሬ በምድብ ኬ የሚገኙት ኢትዮጵያ ኮትዲቯርና ማዳጋስካር ኒጀር የመጨረሻ ቀሪ ጨዋታቸውን አካሄደው ነበር። በዚህ ውጤት መሰረት ኢትዮጵያና ኮትዲቯር ባደረጉት ጨዋታ ኮትዲቯር ሦስት ለአንድ ኢትዮጵያን እየመራች ሳለ በዳኛው ሕመም ምክንያት ጨዋታው ተቋርጧል። ይሁን እንጂ ኢትዮጵያ ማለፏን ያረጋገጠችው በተመሳሳይ ምድብ የሚገኙት ማዳጋስካርና ኒጀር ባዶ ለባዶ መለያየታቸውን ተከትሎ ነው። ሰባት ነጥብ የነበራት ማዳጋስካር ለአፍሪካ ዋንጫ ለማለፍ ኒጀርን አሸንፋ 9 ነጥብ ያላትን ኢትዮጵያን መብለጥ ይጠበቅባት ነበር። የዋሊያዎቹን ድል ተከትሎ ጠቅላይ ሚኒስትር ዐቢይ አህመድም የእንኳን ደስ አላችሁ መልዕክት አስተላልፈዋል። በሚቀጥለው ዓመት ታኅሣሥ ወር ላይ በካሜሮን አዘጋጅነት በሚካሄደው የአፍሪካ እግር ኳስ ዋንጫ ውድድር ላይ 24 አገራት ተሳታፊ ይሆናሉ። እስካሁን ድረስ ከኢትዮጵያ በተጨማሪ ጊኒ፣ አልጄሪያ፣ ዚምባብዌ፣ ሴኔጋል፣ ቱኒዚያ፣ ማሊ፣ ግብጽ፣ ኮሞሮስ፣ ቡርኪናፋሶ፣ ማላዊ፣ጋና ፣ሱዳን ፣ጋምብቢ፣ ሞሮኮ እና ጋቦን ማለፋቸውን አረጋግጠዋል።	https://www.bbc.com/amharic/news-56582175
health	"ኮሮናቫይረስ ፡ በአውሮፓ ከተሞች ""ኮቪድ-19 ውሸት ነው"" የሚሉ ተቃውሞዎች እየተካሄዱ ነው"	"ከአርብ ጀምሮ እየተካሄዱ ያሉ ሰልፎች መልከ ብዙ ቢሆኑም 'ጭራሽ ኮሮና የሚባል ቫይረስ ብሎ ነገር የለም፣ እየተጭበረበርን ነው' ብለው የሚያምኑ ሰልፈኞችም የተገኙበት ሆኗል፡፡ የብዙዎቹ ሰልፈኞች ጥያቄ ግን በኮሮና ምክንያት የተጣሉ ገደቦች ይነሱ የሚሉ ናቸው፡፡ በጀርመን በርሊን ሰፊ ተቃውሞ የተካሄደ ሲሆን ከዚሁ ጋር ተያይዞ 300 ሰዎች በቁጥጥር ሥር ውለዋል፡፡ የጀርመን ሰልፈኞች ያነሱት ተቃውሞ በዋናነት 'በኮሮናቫይረስ ምክንያት ጥብቅ የተደረጉ መመሪያዎች ይነሱልን መረረን' የሚል ነው፡፡ በጀርመን ለተቃውሞው 40ሺ የሚጠጉ ሰዎች አደባባይ ወጥተዋል፡፡ በአመዛኙ ሰላማዊ ሆኖ የቆየው ተቃውሞ በነጭ አክራሪዎች ነውጥ ምክንያት መልኩን እየቀየረ መጥቷል፡፡ ድንጋይና ጠርሙስ መወራወርም ተጀምሯል፡፡ በበርሊን ብቻ ሳይሆን በሌሎችም የአውሮፓ ከተሞች ተመሳሳይ ሰልፎች ተደርገዋል፡፡ በለንደን በዝነኛው ትራፋልጋር አደባባይ የወጡ ሰልፈኞች ብዙዎቹ ""ኮሮናቫይረስ ብሎ ነገር የለም፤ እየተጭበረበርን ነው"" የሚል ይዘት ያላቸው መፈክሮችን ይዘው ታይተዋል፡፡ በፓሪስ፣ በቪየና እንዲሁም በዙሪክ ይኸው ተቃውሞ በተመሳሳይ መንፈስ ቀጥሏል፡፡ በጀርመን የተካሄደው ተቃውሞ ፍትጊያ የበዛበትና ማኅበራዊ ርቀትን ለማስጠበቅ አስቸጋሪ እንደነበር ፖሊስ አምኗል፡፡ ""ምንም ማድረግ አንችልም፡፡ የሚቻለውን ለማድረግ ሙክረናል፡፡ በሰልፈኞች መሀል የኮሮናቫይረስ ደንቦችን ማስጠበቅ ግን አልቻልንም"" ብሏል ፖሊስ በትዊተር ገጹ፡፡ ፖሊስ በቁጥጥር ካዋላቸው ሰዎች መሀል አንዱ ""ኮሮናቫይረስ ብሎ ነገር የለም፣ ዉሸት ነው የሚለውን መላምት በማራገብ የሚታወቀው አቲላ ሂልድማን"" ይገኝበታል፡፡ ሂልድማን ለሰልፈኞች ድምጽ ማጉያ ይዞ ተከታታይ ንግግር ሲያደርግ ነበር፡፡ ሂልድማን በጀርመን እውቅ የምግብ አብሳይ ባለሙያ ሲሆን ከቅርብ ጊዜ ወዲህ የነጭ አክራሪዎችን አስተሳሰብ በመጋራት ከፍተኛ ተጽእኖ ፈጣሪ ሆኗል፡፡ ""ኮሮናቫይረስ የሚባል ነገር የለም፤ ጀርመን ከቢልጌትስ መወገኗን ታቁም"" የሚሉ አስተሳሰቦችን ማራመድ በመጀመሩ ብዙ ተከታዮችን አፍርቷል፡፡ ብዙዎቹ ሰልፈኞቹ ጭምብል ማጥለቅና ሌሎች ኮሮናቫይረስን ለመከላከል የሚወሰዱ መመርያዎች የሰብአዊ መብት ጥሰቶች ስለሆኑ እንዳሻን እንሁን የሚል ጥያቄ ነው ያነሱት፡፡ ከሰልፈኞቹ መሀል እውቅ ሰዎችም ተገኝተውበታል፡፡ ለምሳሌ ሮበርት የጆን ኤፍ ኬኔዲ ልጅ ለሰልፉ ድጋፍ ከሰጡት መሀል ይገኝበታል፡፡ ሮበርት ኬኔዲ ጁንየር  በሰው እጅ የተገደሉት የዝነኛው የቀድሞው የአሜሪካ ፕሬዝዳንት ጆን ኤፍ ኬኔዲ የወንድም ልጅ ሲሆን ክትባትን በመቃወም ከፍተኛ ተከታይ ያፈራ ሰው ነው፡፡ ሮበርት ኬኔዲ በርሊን ድረስ በመምጣት ሰልፉን ተቀላቅሏል፡፡ ጀርመን እስካሁን  242,000 ሰዎች በኮቪድ-19 እንደተጠቁባት እና ከ10ሺ ሰዎች በታች እንደሞቱባት ይታወቃል፡፡"	https://www.bbc.com/amharic/news-53963766
politics	የሩሲያ እና ዩክሬን ፍጥጫ በመባባሱ የነዳጅ ዋጋ እያሻቀበ ነው	"የዩክሬን እና ሩሲያ ቀውስ በዓለም ዙሪያ የነዳጅ አቅርቦትን ያደናቅፋል በሚል ስጋት የነዳጅ ዋጋ እየጨመረ ነው። የዓለም አቀፍ የገበያ መለኪያ በሆነው የብሬንት የድፍድፍ ነዳጅ ዋጋ ዛሬ ማክሰኞ በበርሜል 97.76 ዶላር ደርሷል። ይህም በሰባት ዓመት ውስጥ ከፍተኛው ነው ተብሏል። ሩሲያ በምሥራቅ ዩክሬን በአማፅያን ቁጥጥር ስር ለሚገኙ ሁለት ክልሎች እውቅና ከመስጠት ባለፈ ወታደሮቿ ወደ አካባቢዎቹ እንዲገቡ ፈቅዳለች። የእስያ የአክሲዮን ገበያዎች ዝቅተኛ ሲሆኑ የአሜሪካ እና የአውሮፓ የአክሲዮን ሽያጮች ለኪሳራ ተጋልጠዋል። ከሳዑዲ አረቢያ ቀጥላ ሁለተኛዋ ከፍተኛ የነዳጅ ዘይት ላኪ በሆነችው ሩሲያ ላይ ዩናይትድ ኪንግደም እና በርካታ የምዕራባውያን አገሮች ማዕቀብ ሊጥሉ እንደሚችሉ እየዛቱ ነው። ሩሲያ በተፈጥሮ ጋዝን ምርት ደግሞ ቀዳሚ ናት። ሩሲያ ወታደሮቿ ራሳቸውን የዶኔስክ እና ሉሃንስክ ሕዝቦች ሪፐብሊኮች ብለው ባወጁት አካባቢዎች ""የሠላም ማስከበር"" እንደሚሰማሩ አስታውቃለች። አሜሪካ ደግሞ የሠላም አስከባሪ መባላቸውን ""ከንቱ"" ስትል ገልጻ፣ ሩሲያ ለጦርነት ሰበብ እየፈጠረች ነው ስትል ተናግራለች። የማኑላይፍ ኢንቬስትሜንት ማኔጅመንት ባልደረባ የሆኑት ሱ ትሪን የዩክሬን እና የሩሲያ ቀውስ በነዳጅ ዋጋ ላይ ""ከፍተኛ እንድምታ"" አለው ብለዋል። ሩሲያ አነስተኛ ድፍድፍ ወይም የተፈጥሮ ጋዝ እንድታቀርብ የሚያስገድድ ማዕቀብ ""በዓለም ኢኮኖሚ ላይ ጉልህ ተጽዕኖ ይኖረዋል"" ሲሉ አክለዋል። በፊደልቲ ኢንተርናሽናል የኢንቨስትመንት ዳይሬክተር የሆኑት ማይኪ ከሪ በበኩላቸው በዩክሬን ቀውስ፣ በአሜሪካ ያለው ቀዝቃዛ ክረምት እና በዓለም ዙሪያ በነዳጅ እና ጋዝ አቅርቦቶች ላይ ባለው የኢንቨስትመንት እጥረት ምክንያት ነዳጅ በበርሜል ከ100 ዶላር በላይ ሊወጣ ይችላል ብለዋል። ""ሩሲያ በዓለም አቀፍ ደረጃ ጥቅም ላይ ከሚውለው 10 በርሜል ነዳጅ ዘይት አንዱን ታቀርባለች። በመሆኑም በነዳጅ ዋጋ ላይ ዋና ተዋናይ በመሆኗ የነዳጅ ተጠቃሚዎችን ይጎዳል"" ይላሉ። አሜሪካ እና አውሮፓ ሕብረት ሩሲያ ላይ ጥለውት ለዓመታት የዘለቁት ማዕቀቦች በሩሲያ ኢኮኖሚ ላይ ትልቅ ተጽዕኖ አሳድረዋል። በገንዘብ ተቋማት፣ በቴክኖሎጂዎች እና በግለሰቦች ላይ የሚጣሉ ማዕቀቦች ""ሊጠናከሩ"" እንደሚችሉ ከሪ ተናግረዋል።"	https://www.bbc.com/amharic/news-60476512
politics	ምርጫ ቦርድ ብልፅግናን ጨምሮ በርካታ ፓርቲዎችን አሳሰበ	የኢትዮጵያ ምርጫ ቦርድ ገዢው ፓርቲ ብልፅግናን ጨምሮ በርካታ ፓርቲዎች በአንድ ወር ጊዜ ውስጥ ጠቅላላ ጉባዔያቸውን እንዲያደርጉ አሳስቧል። የኢትዮጵያ ብሔራዊ ምርጫ ቦርድ ህዳር 23/ 2014 ዓ.ም ከፓርቲዎች ጋር ባደረገው ውይይት ከስድስተኛው አገራዊ ምርጫ መጠናቀቅ በኋላ ጠቅላላ ጉባኤ እንዲያካሂዱ ገልጦላቸው ነበር። ነገር ግን ፓርቲዎቹ የሚጠበቅባቸውን አጠናቀው ባለማቅረባቸው የአስቸኳይ ጊዜ አዋጁ በተነሳ በአንድ ወር ውስጥ ጠቅላላ ጉባኤያቸውን እንዲያከናውኑ እና ለቦርዱ እንዲያስገቡ መወሰኑ ይታወሳል ሲል ቦርዱ ያወጣው መግለጫ ያትታል። አሁን የሕዝብ እንደራሴዎች ምክር ቤት የአስቸኳይ ጊዜ አዋጁን በማንሳቱ ፓርቲዎቹ በአንድ ወር ጊዜ ውስጥ ጠቅላላ ጉባዔያቸውን እንዲያደርጉ እንዲሁም የሰነድ ማሻሻያ እንዲከውኑ አሳስቧል። ካለፈው ሃገራዊ ምርጫ በኋላ ጠቅላላ ጉባዔ አላደረጉም፤ አልፎም የሰነድ ማሻሻያ አላከናወኑም ተብሎ በቦርዱ የተጠቀሱት 26 ፓርቲዎች ናቸው። ገዢው ብልፅግናን ጨምሮ 13 ሃገራዊና 13 ክልላዊ የፖለቲካ ፓርቲዎች ቦርዱ ባወጣው መግለጫ ላይ ስማቸው ተጠቅሷል። ቦርዱ በማሕበራዊ ድር አምባ ገፆቹ በለጠፈው መግለጫ ስማቸው ከተጠቀሰ ፓርቲዎች መካከል የኦሮሞ ፌዴራሊስት ኮንግረስና የአማራ ብሔራዊ ንቅናቄ ይገኙበታል። በኮሮናቫይረስ ወረርሽኝ ምክንያት ተራዝሞ የነበረው ሃገራዊው ምርጫ ባለፈው ዓመት ተካሂዶ ገዢው ፓርቲ አብዛኛውን የሕዝብ ተወካዮች ምክር ቤት መቀመጫ ማግኘቱ ይታወሳል።	https://www.bbc.com/amharic/news-60413352
sports	በአንድ ቀን የተወለዱ ልጆች በስሟ እንዲጠሩ ስለተደረገላት አትሌት ያውቃሉ?	ናዋል ኤል ሞውታዋኬል ሞሮኳዊት አትሌት ናት። እንደ ጎርጎሮሳውያኑ አቆጣጠር ነሐሴ 8፣ 1984 በሎስ አንጀለስ ኦሎምፒክ ድል ተቀዳጅታለች። ማሸነፏ እጅግ ያስደሰታቸው ሞሮኳዊው ንጉሥ ሐሰን በእለቱ የተወለዱ ሴቶች ባጠቃላይ ናዋል ተብለው እንዲጠሩ ውሳኔ አስተላልፈዋል። ሰሞኑን 36ኛ ዓመት ልደታቸውን የሚያከብሩ የሞሮኮ ሴቶች ስማቸው ናዋል የመሆን እድሉ ሰፊ ነው። ናዋል በኦሎምፒክ ወርቅ ሜዳልያ ያገኘች የመጀመሪያዋ ሞሮኳዊት ናት። በ400 ሜትር የመሰናክል ዝላይ ያሸነፈች የመጀመሪያዋ ሴትም ናት። በሎስ አንጀለሱ ኦሎምፒክ ላይ የተገኘች ብቸኛዋ ሞሮኳዊት ሴት ናዋል ነበረች። በኦሎምፒክ ታሪክ ድል የተቀዳጀች የመጀመሪያዋ ሴት አረብ አፍሪካዊትም ናት። የውድድሩ ተካፋይ የነበረው ሰዒድ አዊታ በ500 ሜትር ሩጫ ያሸነፈው ምናልባትም በናዋል ድል ተነሳስቶ ይሆናል። “ስለውድድሩ ሳስብ ሌሊቱን በሙሉ እንቅልፍ አልወሰደኝም” ናዋል ከውድድሩ አንድ ቀን በፊት ሲያቃዣት ነበር። መሰናክል ዘላ አንዳች ጉድጓድ ውስጥ እንደምትገባ ይሰማት እንደነበር ታስታውሳለች። “በጣም ፈርቼ ነበር። ብቸኛዋ ሞሮኳዊት ሴት ስለነበርኩ ሁሉም የቡድኑ አባላት ተስፋ ጥለውብኝ ነበር።” ውድድሩን ከማሸነፏ በፊት የነበረውን ምሽት እንዲህ ታስታውሰዋለች። “ስለ ውድድሩ ሳስብ ሌሊቱን በሙሉ እንቅልፍ አልወሰደኝም ነበር። ሲያቃዠኝ፣ ሲያልበኝ ስለነበር መተኛት አልቻልኩም። ዝግ ብዬ ስሮጥ ይታየኝ ነበር።” በችሎታዋ አምና በውድድሩ ጥሩ ውጤት ማስመዝገብ ትፈልግ ነበር። “ያሰብኩት ከመጨረሻዎቹ ስምንት ተወዳዳሪዎች አንዷ እንደምሆን ነበር። አሰልጣኞቼ እንደማሸንፍ ስላሰቡ በራሴ እንድተማመን ደጋግመው ይነግሩኝ ነበር።” ናዋል እና አሰልጣኞቿ ከመጨረሻው ውድድር በፊት የሷና የተፎካካሪዎቿን ያለፉ ውድድሮች ቪድዮ ይመለከቱ እንደነበር ታስታውሳለች። የሷን ደካማና ጠንካራ ጎኖች ከተፎካካሪዎቿ ጋር ያነጻጽሩም ነበር። “ላሸንፍ ስለምችል ከመጀመሪያው እስከ መጨረሻው ጠንካራ መሆን እንዳለብኝ ይነግሩኝ ነበር” ትላለች። ናዋል እንደምታሸንፍ ማመኗ የስኬቷ ሚስጥር ነበር። እራሷን “ያንቺ ጊዜ ነው። ድል ሊያመልጥሽ አይገባም” እያለችም ነበር። የናዋል አሜሪካዊት ጓደና ጁዲ ብራውንም የውድድሩ ተሳታፊ ነበረች። በእርግጥ የውድድሩ ተመልካቾች የ22 ዓመቷ ናዋል ደጋፊ አልነበሩም። ጋዜጠኞች ውድድሩን በአንክሮ ይከታተላሉ ነበር። ውድድሩ በይፋ ከመከፈቱ በፊት ናዋል በስህተት የጀመረች መስሏት ተደናግጣ ነበር። ኋላ ላይ ግን ተረጋጋች። “የመጀሪያውን፣ ሁለተኛውንና ሦስተኛውን መሰናክል በግራ እግሬ ዘለልኩ። ከዛ እስከ መጨረሻው ድረስ ቀኝና ግራ እግሬን መለዋወጥ ጀመርኩ።” ተፎካካሪዎቿን በቅርብ ርቀት ማየት ስላልቻለች ግራ ተጋብታ እንደነበር ታስታውሳለች። “ሌሎቹ ሯጮች የት ገቡ? ብዬ አሰብኩ። ለካ በጣም ቀድሜያቸዋለሁ። የመጨረሻውን ነጥብ ከማለፌ በፊት እኔ ብቻ እያለፍኩ መሆኑን ለማረጋገጥ ወደ ግራና ቀኝ ተመለከትኩ።” “አባቴ በቦታው ባለመኖሩ ከፍቶኝ ነበር” ናዋል ወርቅ ስታገኝ ጓደኛዋ ጁዲ ብራውን ብር አግኝታለች። “ሳሸንፍ በጣም ነው ደስ ያለኝ። ግን አባቴ በቦታው ባለመኖሩ ከፍቶኝ ነበር። ሁሌም ይደግፈኝ የነበረው አባቴ ከውድድሩ ከወራት በፊት ሕይወቱ አልፏል።” የናዋል ቤተሰቦች ስፖርት ወዳጅ ናቸው። አባቷ የጁዶካ ተጫዋች (እንደ ማርሻል አርት አይነት ውድድር) እናቷ ደግሞ መረብ ኳስ ተጫዋች ነበሩ። ናዋል ህልሟን እንድታሳካ ቤተሰቦቿ ይደግፏት ነበር። “ማሸነፌ ለአገሬ ትልቅ ዜና ነበር። ማንም ያልጠበቀው ድል ነው። አንዲት ታዳጊ ሞሮኳዊት ከምርጥ አትሌቶች ጋር ተፎካክራ አሸንፋ ወርቅ ታገኛለች ብሎ ማንም አላሰበም። በልቤና በአዕምሮዬ እስከወዲያኛው የሚኖር ታሪካዊ ቅጽበት ነው።” የናዋል ድል በወግ አጥባቂ አረብና ሙስሊም አገሮች ለሚኖሩ ብዙ ሴቶች በር ከፍቷል። “ከዛ በኋላ ብዙ ሞሮኳዊ ሴቶች አሸንፈዋል። በአልጄሪያ፣ ቱኒዚያ፣ ግብፅ እና ባህሬን የሚኖሩ ሴቶችም እንዲሁ። በኦሎምፒክስ ላይ ሴቶች አሳትፈው የማያውቁ አገሮች፤ ሴቶችን ለተሳትፎ ብቻ በቡድናቸው ከማካተት አልፈዋል። ሴቶች የሚካተቱት ለተሳትፎ ሳይሆን ለማሸነፍ ሆኗል” ትላለች አትሌቷ።	https://www.bbc.com/amharic/news-53740809
