religion	Afghanistan: Vilio na maandamano huku Taliban ikifunga vyuo vikuu kwa wanawake	"Ni agizo ambalo wasichana na wanawake wa Afghanistan wamekuwa wakiogopa tangu Wataliban waliporejea. Siku ya Jumatano, wasichana waliovalia hijabu walifika kwenye maeneo yao ya chuo kikuu ila wakazuiwa na walinzi wa Taliban. Kanda za video zinaonesha wasichana hao katika makundi wakilia huku wakifukuzwa. Baada ya kuwazuia wasichana wasisome katika shule nyingi za sekondari kwa miezi 16 iliyopita, wiki hii pia Taliban ilipiga marufuku elimu ya chuo kikuu kwa wanawake. ""Wameharibu daraja pekee ambalo linaweza kuniunganisha na maisha yangu ya baadaye,"" mwanafunzi mmoja wa Chuo Kikuu cha Kabul aliambia BBC. ""Ninawezaje kukabiliana na hili? Niliamini kwamba ningeweza kusoma na kubadili maisha yangu ya baadaye au kuleta mwanga kwenye maisha yangu lakini wameharibu."" Mamlaka zilitoa agizo hilo siku ya Jumanne - na kufikia siku iliyofuata maeneo mengine ya kusomea, ikiwa ni pamoja na shule za dini ya Kiislamu na vyuo vya kibinafsi katika majimbo kadhaa, pia yalikuwa yakitekeleza uamuzi huo. Vyanzo kutoka majimbo matatu - Takhar kaskazini, Ghazni kusini-mashariki na mji mkuu Kabul - vilithibitishia BBC kwamba Taliban imewazuia wasichana kuhudhuria vituo vya elimu ya kibinafsi. Njia zote za elimu rasmi kwa wanawake zinafungwa, inaonekana. Ilipelekea baadhi ya wanawake kuthubutu kuandamana siku ya Jumatano mitaani mjini Kabul - kitendo cha hatari kutokana na rekodi ya Taliban ya kuwaweka kizuizini waandamanaji. Maandamano hayo madogo yalifungwa haraka na maafisa wa Taliban. Kizazi hiki kilifikiri wao ndio waliobahatika - kupata elimu iliyonyimwa kwa mama zao, dada zao wakubwa na binamu zao. Badala yake, wanaona maisha yao ya baadaye yanaharibika. Kundi la Taliban, ambalo lilianza kama kundi la wapiganaji wa Kiislamu lenye msimamo mkali, liliahidi kuheshimu haki za wanawake waliporejea madarakani mwezi Agosti mwaka jana - baada ya kusitisha utawala uliokuepo, wao awali walitawala kutoka mwaka 1996-2001 wakati wanawake hawakuweza kufanya kazi au kusoma. Lakini amri yao ya hivi karibuni inaondoa uhuru na haki ndogo zozote walizopewa wanawake baada ya majeshi yanayoongozwa na Marekani kuondoka Afghanistan na Taliban kurejea. Hata hivyo miezi mitatu tu iliyopita, Taliban walikuwa wamekubali kuruhusu mitihani ya kujiunga na chuo kikuu kuendelea. Maelfu ya wasichana na wanawake walifanya majaribio katika majimbo kote nchini. Wengi walikuwa wamesoma kwa siri - nyumbani au kuhatarisha kujitosa kwenye vyuo vya ualimu vilivyofichwa vilivyowekwa kwa ajili ya wasichana. Hatari ilikuwepo kila wakati. Wakati baadhi ya mitihani washambuliaji walilenga shule na kuua wanafunzi. Lakini bado wasichana waliendelea kusoma. Hata wakati Taliban mwezi Novemba walipoleta vikwazo vya dakika za mwisho kwa masomo - kuwazuia wasichana kutoka katika masomo kama vile uchumi, uhandisi na uandishi wa habari - waliendelea kujaribu, wengi wakiomba kufundisha na udaktari. Kama mwanafunzi mwingine wa kike alivyoiambia BBC: ""Kwa nini tuwe wahanga kila wakati? Afghanistan ni nchi maskini. Lakini wanawake katika nchi hii wamekubali umaskini pamoja na kila tatizo lingine na bado wanapaswa kuteseka."" Masomo ya wasichana kwa muda mrefu yamekuwa suala la mzozo kati ya vikundi vya kihafidhina na vya wastani zaidi katika Taliban. Marufuku ya chuo kikuu sasa yanaonesha ushindi wa mtu mwenye msimamo mkali zaidi katika Taliban, ambaye kiongozi wake mkuu Hibatullah Akhundzada anaamini kuwa elimu ya kisasa - hasa kwa wanawake na wasichana - sio sahihi katika mafundisho ya Kiislamu. Hata hivyo si kila mtu katika chama tawala anafikiri kama yeye - na kulikuwa na ripoti zaidi ya maafisa wenye msimamo wa wastani katika miji kama vile Kabul walitaka wasichana wenye umri wa zaidi ya miaka 12 kupata elimu. Kama watetezi wa haki wameonya, uamuzi huo una athari kwa mustakabali wa nchi nzima. ""Hakuna nchi inayoweza kustawi wakati nusu ya wakazi wake wamezuiliwa,"" Waziri wa Mambo ya Nje wa Marekani Anthony Blinken alionya. Nchi za Magharibi zilisisitiza juu ya elimu ya wanawake kama sharti ambalo Taliban wangehitaji kutimiza ikiwa wanataka kutambuliwa kimataifa. Hata hivyo Taliban wamepuuza ukosoaji huo hadi sasa.  Kwa familia za Afghanistan, ndani ya nchi na duniani kote, kuona mustakabali wa binti zao kurudi katika ""zama za giza"" kumezua hofu na hasira. Habari za kupigwa marufuku kwa chuo kikuu zilisababisha baadhi ya wanaharakati wanawake wa Afghanistan kuchapisha hadithi za siku zao za kuhitimu chuo kikuu - wakiwa wamevalia kofia na majoho. Msukumo dhidi ya Taliban tangu wachukue mamlaka tena haujatosha, wanasema. Na ni sehemu ya wimbi linaloongezeka la vizuizi kwa maisha ya kila siku ya wanawake katika wiki za hivi karibuni. Mnamo Novemba, wanawake huko Kabul pia walizuiwa kuingia katika maeneo ya umma kama vile bustani na ukumbi wa michezo. Wanawake wanazidi kuzuiliwa majumbani mwao katika sera sawa na kifungo, inasema UN. 'Matendo si ya Uislamu' Kwa mwanafunzi mmoja wa sheria, elimu yake ya juu inaonekana imekwisha sasa. Muda wake wa chuo kikuu ulikuwa umeisha kwa mapumziko ya msimu wa baridi na haukutarajiwa kuanza tena hadi Machi. Lakini sasa haruhusiwi kurudi chuo - ""amepoteza kila kitu"". Akiwa msomi wa sheria za Sharia, aliiambia BBC kuwa anajitahidi kuelewa jambo hilo kulingana na mafundisho ya Kiislamu. ""Taliban wamechukua haki ambazo Uislamu na Mwenyezi Mungu ametupa,"" aliiambia BBC. ""Lazima waende katika nchi nyingine za Kiislamu na kuona kwamba matendo yao si ya Kiislamu. Kulingana na wanachosema hii ni Sharia. Lakini kwa nini wanataka kuitekeleza kwa wanawake pekee? Kwa nini hawaitumii kwa wanaume?"" Wasomi wengine wa kidini wanaunga mkono hoja yake. Nawida Khurasani, mmoja wa wanawake wachache wasomi wa kidini wa Afghanistan, anasema amri hiyo inakiuka maadili ya Kiislamu. ""Haina nafasi katika Uislamu - kwa sababu Uislamu unaamuru wanaume na wanawake kupata elimu,"" alisema Bi Nawida, ambaye sasa anaishi Canada. Msomi mwingine wa kidini ambaye BBC ilizungumza naye - imamu wa kiume anayeishi ndani ya Afghanistan - alikubali kwamba wanaume na wanawake wanapaswa kuelimishwa chini ya Uislamu. Kwa watazamaji wengi wa Afghanistan hata hivyo - hakuna maana katika kujaribu kuelezea vitendo vya Taliban chini ya mafundisho ya Kiislamu. Wanasema marufuku ya chuo kikuu ni mwendelezo tu wa malengo ya vuguvugu hilo kuwakandamiza kabisa wanawake na kufuta uhuru waliokuwa nao katika miaka kati ya kipindi cha utawala wa Taliban. Kufunga mlango wa elimu ya chuo kikuu ni Taliban kukamilisha udhibiti wao juu ya wanawake. ""Afghanistan si nchi ya wanawake bali ni ngome ya wanawake,"" alisema mwanachuoni na mwanaharakati wa Afghanistan Humaira Qaderi, ambaye anaishi Marekani. ""Hakuna maisha ya kijamii yaliyosalia kwa wanawake wa Afghanistan. Mitaa sasa imetawaliwa na wanaume. ""Hili lilikuwa jambo la mwisho ambalo Taliban wangeweza kufanya. Lakini walifanya hivyo."""	https://www.bbc.com/swahili/articles/c2qn09llz1do
business	Sabuni za Magadi zinavyowapa ajira vijana wa Kigoma	Baadhi ya vijana mjini kigoma wanajikwamua kiuchumi kwa kutengeneza sabuni za magadi ambazo wanaziuza ndani na nje ya nchi. Sabuni ambazo zinasifika kwa povu jingi hutumia malighafi za ndani kama vile mafuta ya mawese. Mwandishi wa BBC Hamphrey Mgonja aliwatembelea na kuzungumza nao. Picha: Eagan Salla	https://www.bbc.com/swahili/habari-60930864
business	Benki Kuu Zimbabwe imeshindwa kutoa fedha mpya kama ilivyotarajiwa	Benki kuu ya Zimbabwe imeshindwa kutoa noti mpya za benki kama ilivyotarajiwa , ambazo zitasaidia kupambana na upungufu wa fedha nchini humo pamoja na  kukabiliwa na matatizo makubwa ya kiuchumi. Ilitangaza ingetoa noti za dola mbili na sarafu za dola tano, noti za kwanza za sarafu za kweli katika miaka 10. Nchi hiyo ilipiga marufuku dola ya Marekani mnamo mwezi Juni mwaka huu lakini imekuwa ikitumia pesa za kienyeji, barua ya dhamana ambayo imekuwa ikipatikana kwa muda mfupi. Hata hivyo benki hiyo imejawa na hofu kwa sababu kitendo hiki kitachangia kuongezeka kwa mfumuko wa bei, na kusisitiza fedha hizi hazitoongeza usambazaji wa pesa kwa ujumla. Mwanzo huu unaonyesha hatua ya mwisho ya marudisho ya dola ya Zimbabwe. Mwezi Juni benki kuu ilipiga marufuku matumizi ya dola za kimarekani, zilizoanza kutumika mwaka 2009 kama njia mbadala ya fedha za ndani, kusaidia hali ya kiuchumi kurudi kawaida. Serikali inasema fedha hizi mpya itapunguza upungufu wa fedha ambayo imesababisha watu wengi kutoweza kutoa hela zao zilizopo benki. Hofu kubwa hapa ni uletwaji wa fedha hizi katikati ya matatizo ya kiuchumi itazidi kuchochea mfumuko wa bei. Mkate uliokuwa unauzwa dola  moja mwezi January, kwa sasa unauzwa kwa dola 15 za kizimbabwe. Tangu kurudishwa kwa fedha hizi, mfumuko wa bei umeongezeka mara tatu zaidi. Serikali ya Zimbabwe imeacha kuchapisha takwimu rasmi, ila kwa sasa inasemakana kuwa inakiwango cha asilimia 300. Benki kuu imeiambia BBC kuwa baadhi ya benki zimeanza kukusanya fedha mpya na zitaanza kusambazwa siku ya Jumanne.	https://www.bbc.com/swahili/habari-50374586
technology	Je mitandao ina msukumo gani katika maandalizi ya harusi?	Utafiti uliofanyika nchini Uingereza unaonyesha namna gani mitandao ya kijamii kama hasa zaidi Instagram na facebook inavyowasukuma wengi kutumia maelfu na hata mamilioni ya pesa  kugharimia picha na video zilizo na mvuto. Utafiti huu mpya wa mwaka 2019 unaonesha kuwa gharama ya kuandaa na kupiga picha za harusi imeongezeka kwa wastani wa paundi thelathini na mbili elfu huko Uingereza. Mpangaji wa harusi  nchini Gabriel Kudaka na mpigaji picha za harusi Imani Insamila kutoka Tanzania wameieleza BBC ni kwanini msukumo huu umekuwepo...	https://www.bbc.com/swahili/habari-49644580
entertainment	Miss World: Sheria zinawazuia akinamama kushiriki ni za 'kibaguzi '	"''Masharti ya kuingia katika mashindano ya Mrembo wa Dunia yana ubaguzi …hakuna nafasi yake katika karne hii ya 21'' Mrembo Veronika Didusenko mwenye umri wa miaka 24, alishinda taji la mrembo wa Ukraine (Miss Ukraine) mwaka 2018 lakini alinyang'anywa taji hilo pale waandaaji walipogundua kuwa ni mama. Sheria za shindano zinapiga marufuku mrembo yoyote kushiriki katika mashindano yatakayoruhusu kushiriki katika mashindano ya mrembo wa dunia kama wakiwa na watoto. Na sasa Veronika, ambaye ana mtoto mwenye umri wa miaka 5, ameamua kuchukua hatua za kisheria kwa waandaji wa mashindano hayo kuhusu sheria zao. ''Nataka niwabadilishe, na kuwapa changamoto. Nataka nihakikishe sheria  za kushiriki mashindano ya urembo wa dunia zibadilike na zilingane sawa sawa na wakati huu.'' Aliiambia Radio  1 Newsbeat. ''Nataka niwaweke sawa kutokana kwa maisha ya sasa na kuangalia maisha halisi ya wanake kwa nyanza hizi, na kutambua kuwa wanaweza kufanya kazi na vile vile mambo mengine nje ya kazi.'' Veronika anadai aliamua kushiriki Taji la ''Miss Ukraine'' kukuza kituo chake cha kusaidia watu na alishangaa alipopewa ushindi wa shindano hilo. Angeenda kuiwakilisha nchi yake katika mashindano ya urembo wa dunia lakini siku nne baadae alinyang'anywa taji hilo. '' Ilikuwa ni jambo la aibu na la kufedhehesha kwangu,'' alisema. ''Nilijisikia vibaya kwasababu sio mimi peke yangu ninayofanyiwa haya, ni kitu ambacho wanawake wengi duniani wanakabaliana nacho, ambao labda wanataka kushiriki lakini hawaruhusiwi kushiriki kwasababu tu wana watoto.'' Veronika amekubali kuiona shetia hiyo kwenye fomu ya kuomba kushiriki, lakini alishauriwa kushiriki na waandaji hao. ''Kwanini mwanamke akataliwe kushiriki kwasababu tu ni mama? Haitii maanani kabisa'' ''Kuwa mama haileti madhara yanayomzuia mshiriki kufanya kazi au kuwa mwanamitindo au kufanya kazi  zangu.'' ''Kwahiyo sheria  hizo hazikuleta maana yoyote kwangu.'' Mwenyekiti na mkurugenzi mkuu wa shirika la ''Miss World'' Julia Morley, aliulizwa kuhusu sheria hiyo katika mahojiano mwaka jana. ''Unapojaribu shirika la kimataifa likubaliane na wewe, inabidi uangalie kila mtu na wanapiga kura kulinagana na yale yaliyoruhusiwa.'' Aliiambia Good Morning Britain. ''Chochote ninacho hisi mimi au unachohisihisi umoja wa ulaya  ni kitu kingine kabisa kulingana na kile sehemu zingine za dunia wanazo kubaliana nayo, inabidi waangalie sheria zao za kidini na mambo mengine kadhaa.'' ''Kama unanielewa vizuri hatuna hisia zetu pekee, inabidi tuzingatie na hisisa za wengine. Kwahiyo tunalolifanya sisi ni kutafuta usawa kwa pande zote mbili.'' Ndani ya mwaka 2014, kiongozi wa shindano la urembo nchini Uingereza lijulikanalo kama 'Miss England competition'  Angie Beasley, alisema itakuwa ngumu sana kwa washindi kugawanya muda wao kwa kazii hii ya urembo na kuwa mama. Akizungumza na kituo cha habari cha ITV Bi Angie alisema ''Kitendo cha mama kusafiri sehemu mbali mbali duniani akisaidia vituo vya kutoa misaada kwa watoto kwa mwaka mmoja, ni jambo halimtendei haki mtoto pamoja na familia nzima.'' ''Inaleta matatizo pale linapokuja swala la nani atamlea mtoto au watoto wa mama yule aliyeshinda.'' Lakini Veronika anasema mtoto wake yupo vizuri kwasababu smekuwa akisafiri nae kwaajili ya kazi zake. ''Ameona nchi nyingi sana kwa umri wake. Kwa mwangalio wangu naona ni mtoto ambaye anauwezo wa kufikiri mkubwa kuliko watoto wengine.'' ''Kwahiyo 'Miss World' kusema wanahofia kuhusu mtoto...Ni jambo la kipuuzi sana kwangu'' Veronika anasema anatumaini kuwa kitendo cha yeye kuchukua hatua ya kisheria kutawafanya 'Miss World' kubadilisha sheria hiyo. Shindano hilo linaanza mwaka huu mjini London tarehe 14 Disemba. Anawakilishwa na mwanasheria wa kutetea haki za kibinadamu Ravi Naik ambaye anadai chini ya sheria ya haki swa ya mwaka 2010, sheria hiyo ya kuingilia shindano hilo ni ya ubaguzi. ''Nataka 'Miss World' ibadilishe sheria zake kufanya mashindano haya kuwa wazi kwa watu wote'' amesema  Veronika. ''Kwasababu mashindano yanayoruhusu mtu yoyote kushiriki yanaweza kusaidia ubaguzi wa kijinsia, na kutengeneza nafasi za kazi kwa washiriki na kuweza kuwainua wanawake. ''Kwa mfano, nyumba za mitindo nyingi huruhusu wanawake wajawazito, wanawake wenye umbo kubwa na warembo wa umri wowote, kwa ajili ya hafla zao za mitindo. ''Kwahiyo mashindano ya warembo yanahitaji  kufuata uongozi wao na kuwasherekea wanawake wote kwa usawa.'' Mashindano ya ulimbwende nchini Tanzania mwaka 2014 yaliingia dosari la namna hiyohiyo kwa madai ya udanganyifu wa kuwa na mtoto na hivyo kuvuliwa taji la Tanzania kwa mwaka huo. Bi Basila Mwanukuzi ambaye aliwahi kuwa Mlimbwende wa Tanzania 1998 na sasa ni muandaaji wa mashindano hayo hakutaka kuzungumzia suala hilo la kuwa kile kilichotokea Ukraine kiliwahi kutokea nchini mwake, ""sikuwa kiongozi wakati huo hivyo sijui chochote, "" Aliongeza kusema kuwa , ''Tunafahamu kwamba kila mashindano yanakuwa na sheria na kanuni na taratibu zake ambazo kila mshiriki anatakiwa kuzifuata na katika dunia hii vitu vinasheria zake.'' ''Inafahamika wazi kuwa hata sisi hapa Tanzania tunafuata vigezo vya mashindani ya Miss World, kwa sababu Miss Tanzania iwapo hatatimiza vigezo basi akifika mbele ataondolewa, kisheria inatakiwa usidanganye kwa sababu mwisho wa siku ukweli utajulikana.'' Hata hivyo bi Basila ameona kuwa madai kuwa  kumuondoa mama katika mashindano ya Mlimbwende wa Dunia kwa kigezo kuwa ana mtoto ni uonevu na ubaguzi ni jambo sahihi. ''Mimi kama mama na nina watoto, ukishakua mama unafanya majukumu ya mama... Miss anakua na majukumu mengi, anazunguka duniani. Ni vigumu sana kupata muda wa kumlea mtoto. Vigezo vikiwekwa vinakua na sababu zake na ni lazima vifuatwe"", Basila anasema. Newsbeat imewasiliana na shirika la miss world, kuona kama wanalolote la kuzungumza kuhusu swala hili."	https://www.bbc.com/swahili/50629240
entertainment	Mpiga picha aliyehatarisha maisha yake kutengeneza makala kuhusu Boko Haram	Mpiga picha wa Nigeria Nelly Ating, ametengeneza makala ya wahanga wa Boko Haram tangu mwaka 2014. Angalia baadhi ya picha alizoweza kuzikusanya katika makala yake.	https://www.bbc.com/swahili/55172438
religion	Illuminati: Mambo kumi na mbili kuhusu jamii ya kisiri kuwahi kuonekana duniani	"Illuminati ni jina lililopatiwa jamii iliobuniwa miaka 245 iliopita. Jamii hiyo ilizua nadharia kwa miaka mingi , huku watu wakidai kwamba ni shirika moja la kisiri ambalo nia yake ni kuteka uuongozi wa dunia. Mbali na kuwa chanzo cha mapinduzi makubwa duniani na mauaji. Lakini Illimunati ni akina nani na je ni kweli walidhibiti ulimwengu? Hi ki ndicho tunachokijua kuhusu mojawapo ya jamii za siri zinazovutia zaid katika historia. Jamii ya iluminati ilikuwa jamii ya siri iliobuniwa nchini Bavaria kwa sasa Ujerumani ambapo ilikuwepo kuanzia 1776 hadi 1785 ambapo wanachama wake walikuwa wakijiita wakamilifu. Kundi hilo lilianzishwa na Profesa wa sheria Adam Weishaupt. Alitaka kukuza elimu ya fikra ili kupinga uchawi  na ushawishi wa kidni katika jamii. Weishaupt alitaka kubadilisha jinsi serikali zilivyoendeshwa barani ulaya , akiondoa ushawishi wa kidini katika serikali na kuwapatia walimwengu muongozo mpya . Inaaminika kwamba mkutano wa kwanza wa iluminati  huko Bavarian ulifanyika katika msitu karibu na Ingolstadt mwezi Mei  tarehe mosi 1776. Wakati huo, watu watano walianzisha sheria ambazo zingetawala siri ya utawala wa Iluminati. Kwa muda sasa, lengo la kundi hilo liliangazia kuhusu kushawishi maamuzi ya kisiasa na kumaliza taasisi kama zile za kifalme  na kanisa. Baadhi ya wanachama wa Iluminati walijiunga na kundi la Freemasons  ili kusajili wanachama wapya. Ndege mmoja anayejulikana kama Minerva Owl alitumika kuwa nembo yake. 2.Je iluminati wanahusiana vipi na Freemasons? Masoni ni agizo la kindugu ambalo lilikua kutoka kwa vikundi vya waashi wa mawe na wajenzi wa kanisa kuu la zama za Kati. Katika nchi zingine, haswa Marekani, kihistoria kumekuwa na hisia fulani kuhusu Freemason; Mnamo 1828, harakati moja ya kisiasa inayojulikana kama Chama cha Kupambana na Mason ilianzishwa . Kwa sababu awali Illuminati iliwasajili Freemason, vikundi hivyo viwili mara nyingi vilishukiwa kuwa na uhusiano. 3.Je unawezaje kujiunga na illuminati? Kujiunga na Illuminati, ilibidi uwe na idhini kamili ya washiriki wengine, umiliki mali, na uwe na sifa nzuri ndani ya familia yenye sifa. Kwa kuongezea, kulikuwa na mfumo wa ngazi ya juu kwa ushirika wa Illuminati. Baada ya kuingia kama 'chipukizi', ungehitimu kama ""minerval"" na kisha ""kupanda ngazi ya minerval mkuu"", Ingawa muundo huu ulikuwa mgumu zaidi, mtu alihitaji takriban digrii 13 za kuwa mwanachama. 4.Je illuminati ilitumia matambiko haya? Walitumia matambiko - ingawa mengi hayajulikani - na walitumia majina bandia kuweka vitambulisho vya wanachama siri. Walakini, kwa sababu ya nyaraka za siri zilizopatikana, inajulikana jinsi chipukizi wa kundi hilo walivyoweza kupanda hadi nyadhfa za juu ndani ya uongozi wa Illuminati: ilibidi wakusanye ripoti kuhusu vitabu vyote walivyomiliki, na kuandika orodha ya udhaifu wao,na kufunua majina ya maadui waliokuwa nao. Chipukizi hao baadaye waliahidi kuweka maslahi yao na yale ya kibinafsi nyuma na kujitolea kuhudumia jamii hiyo. 5.Je jicho linalotumiwa na illuminati lina maana gani? ""Jicho la majaliwa,"" ni ishara inayofanana na jicho ndani ya pembetatu, ambalo linaonekana kwenye makanisa kote ulimwenguni, na vile vile kwenye majengo ya Masoni na kwenye noti ya sarafu ya  dola ya Marekani . Mbali na kuhusishwa na Freemasonry, pia imehusishwa na Illuminati kama ishara ya udhibiti wa kikundi na kufuatilia ulimwengu. Ni nembo ya Kikristo, ""jicho ambalo linaona kila kitu"" limetumika katika picha za kuchorwa kuwakilisha umakini wa Mungu juu ya ubinadamu. Hakuna uhusiano rasmi kati ya jicho linaloona yote na Illuminati; uhusiano uliopo pengine ni kwa sababu ya ukweli kwamba kikundi cha asili kilishirikiana  na Masoni, ambao walitumia picha hiyo kama ishara ya Mungu. Baadhi ya watu wanaamini kuwa Illuminati inaiongoza dunia hii leo, ambapo ni sawa na kusema kuwa wanachama wao ni wameficha siri yao kwa nguvu zote kiasi cha kwamba ni watu wachache sana wanaijua. Jinsi wanachama wengi wa Illuminati walivyojiingiza kisiri ndani ya Freemason na wale wa Freemason kujiingiza katika Illuminati, ni kazi ngumu sana kupima mafanikio ya Illuminati, lakini wanahistoria wengi wanaamini kundi la asili kabisa la Iluminati liliweza kuwa na ushawishi wa kadri. Kufikia mwaka 1782, Illuminati ilifikia kuwa na wanachama  600, ikiwemo mabwanyenye wa Kijerumani kama Baron Adolph von Knigge, ambaye akiwa mwanachama wa zamani wa Freemason, alisaidia Illuminati mikakati na kutapakaa kwa jumuiya hiyo. Awali, wanafunzi wa Weishaupt walikuwa ndiyo wanachama pekee wa Illuminati, lakini baadaye madaktari, wanasheria na wanazuoni wakajiunga. Kufikia mwaka 1784 kulikuwa na wanachama baina ya 2,000 na 3,000 wa Illuminati. Baadhi ya vyanzo vinadai kuwa mwandishi maarufu Johann Wolfgang von Goethe pia alijiunga na Illuminati, japo suala hilo bado lina utata. Mwaka 1784, Karl Theodor, Mtawala wa Bavaria, alipiga marufuku uanzishwaji wa chama chochote ambacho hakikutambuliwa kisheria na mwaka uliofuata akapitisha amri mahususi wa kuzuia Illuminati. Wakati wa kamatakamata ya washukiwa wa uanachama wa Illuminati, walikutwa na nyaraka kadhaa ambazo zilikuwa zikipiga chapuo masuala yaliyokuwa yakipigwa vita kama vile kutokuamini katika uwepo wa Mungu, kujiua na namna ya kutoa mimba. Nyaraka hizo zikapigilia msumari imani ya kwamba Illuminati ilikuwa ni jumuiya ya tishio dhidi ya serikali na kanisa. Baada ya hapo, jumuiya ya Illuminati inaaminika kuwa ilipotea, japo baadhi ya watu wanaamini jumuiya hiyo iliendelea kudumu. Adam Weishaupt hatimaye aliondoshwa katika Chuo Kikuu cha Ingolstadt. Baada ya kutimuliwa Bavaria, aliishi siku zake za mwisho huko Gotha, Thuringia, na kufariki dunia mwaka 1830. Toka kipindi ambacho kundi hilo lilipigwa marufuku, Imani za uwongo kuwahusu zimepata umaarifu sana na kusambaa kama moto wa nyika. Mwaka 1797, padre maarufu kutoka Ufaransa Jesuit Abbé Augustin Barruel alidai kuwa jumuiya za siri kama Illuminati zilichochea mapinduzi ya Ufaransa. Rais wa kwanza wa Marekani, George Washington, aliandika barua mwaka mmoja baadaye akisema naamini tishio la Illuminati lilikuwa limedhibitiwa. Barua hiyo ilichangia Imani ya kuwa kundi hilo bado lilikuwa hai. Baadaye vitabu na hotuba za kulishutumu kundi hilo vilitapakaa, huku rais wa tatu wa Marekani Thomas Jefferson, akituhumiw kimakosa kuwa mwanachama wa kundi hilo. Dhana ya Illuminati kuitawala dunia haikuwahi kuzima nab ado ingali inaigizwa katika filamu na kuimbwa katika muziki. Mwaka 1963, Makala iliyoitwa ""Principia Discordia"" ilichapishwa, ambayo ilipigia chapuo aina mpya na tofauti ya fikra ambayo ikiitwa 'Discordianism'. Mrengo huo ulikuwa ukipigia chapuo ghasia za kupinga mamlaka na kuaminisha watu nadharia za uongo, moja ya wafuasi wake akiwa mwandishi maarufu Robert Anton Wilson. Baadhi ya wafuasi wa  Discordianism walituma barua za uongo kwenye majirida wakidai matukio kama kuuawa kwa rais wa Marekani John F Kennedy ilikuwa ni kazi ya Illuminati. Wilson baadaye akaandika kitabu pamoja na mwandishi Robert Shea, "" The Illuminatus! Trilogy "", ambacho kikachochea dhana mpya juu ya uandishi wa vitabu kuhusu kundi hilo, pamoja na kitabu maarufu cha Dan Brown (ambacho pia kikazaa filamu ""Angels & Demons "". Illuminati pia walihusishwa na 'kuabudu shetani' pamoja na dhana nyengine ambazo ni tofauti kabisa na asili ya kundi hilo la karne ya 18 kutoka Bavaria. Wale ambao wanaamini katika nadharia ya New World Order wanadai kuwa kuna kundi la watu wenye nguvu ambao wanajaribu kuiongoza dunia. Ukiachana na marais kadhaa wa Marekani, wasanii nyota kadhaa kama Beyoncé na  Jay-Z wamehusishwa kuwa wanachama wa kundi hilo, japo nyota hao wawili wote wamekanusha."	https://www.bbc.com/swahili/habari-57473906
