sports	Tetesi za soka Ulaya Jumapili 17.07.2022	Mkurugenzi wa michezo wa Bayern Munich Hasan Salihamidzic amesisitiza tena msimamo wa klabu hiyo ya Ujerumani kuhusu Cristiano Ronaldo, 37, kwa kukataa uwezekano wa kumnunua mshambuliaji huyo wa Manchester United na Ureno. (SPORT1 via Mail on Sunday) Manchester City hawana nia ya kumuuza kiungo wa kati wa Ureno Bernardo Silva kwa Barcelona msimu huu wa joto, huku meneja Pep Guardiola bado akimtazama mchezaji huyo mwenye umri wa miaka 27 kama sehemu muhimu ya mipango yake msimu ujao. (Sunday Mirror) Arsenal wamekubali mkataba wa pauni milioni 30 kumsaini beki wa kushoto wa Ukraine Oleksandr Zinchenko, 25, kutoka Manchester City, huku masharti ya kibinafsi bado hayajakamilika. . (Fabrizio Romano) Chelsea itamnunua beki wa kati wa Sevilla na Ufaransa Jules Kounde, 23, baada ya kushindwa kuafikiana na Manchester City kwa ajili ya kumnunua mlinzi wa Uholanzi Nathan Ake, 27.  (Times - subscription required) Meneja wa Manchester United Erik ten Hag ameuambia uongozi wa klabu hiyo kuendelea na majaribio yao ya kumsajili kiungo wa kati Mholanzi Frenkie de Jong mwenye umri wa miaka 25 kutoka Barcelona - hata kama hajajiunga nao mwanzoni mwa msimu wao tarehe 7 Agosti.  (Guardian) Everton wameanza mazungumzo juu ya mkataba mpya na mshambuliaji wa Uingereza Anthony Gordon, baada ya kukataa ofa ya pauni milioni 35 kwa mchezaji huyo mwenye umri wa miaka 21 kutoka Newcastle United. . (Football Insider) AC Milan wako kwenye mazungumzo na Tottenham kuhusu kumsajili beki wao Muingereza Japhet Tanganga, 23(Calciomercato in Italian) Barcelona wamemtaja De Jong kwenye kikosi chao kwa ajili ya ziara ya kujiandaa na msimu mpya nchini Marekani. (Manchester Evening News) Juventus wanawasiliana na Atletico Madrid kuhusu kumsajili mshambuliaji wa Uhispania Alvaro Morata, 29, ambaye alirejea katika klabu hiyo ya Uhispania msimu wa joto baada ya kumalizika kwa muda wa mkopo wa miaka miwili katika klabu hiyo ya Serie A. (Calciomercato - in Italian) Paris St-Germain wameungana na Barcelona katika mawindo ya kumsajili kiungo Mwingereza Carney Chukwuemeka kutoka Aston Villa. Mchezaji huyo mwenye umri wa miaka 18 aliachwa nje ya kikosi cha meneja Steven Gerrard kwa ajili ya maandalizi ya msimu mpya nchini Australia huku kukiwa na mvutano wa kandarasi. (Sunday People) Beki wa Manchester United Muingereza Phil Jones, 30, analengwa na mchezaji mwenzake wa zamani na mkufunzi mpya wa DC United Wayne Rooney. (Daily Star Sunday) Leeds United wako katika hatua ya juu katika mazungumzo na mshambuliaji wa Uingereza Joe Gelhardt mwenye umri wa miaka 20 kuhusu kuongezwa kwa mkataba. (Football Insider) Marseille wanajaribu kumsajili beki wa pembeni wa Lens Jonathan Clauss huku Chelsea na Manchester United wakimtaka mchezaji huyo mwenye umri wa miaka 29. Atletico Madrid pia wanamtaka mchezaji huyo wa kimataifa wa Ufaransa. (90 Min) Nottingham Forest wametoa pauni milioni 10 kwa Middlesbrough kwa winga Marcus Tavernier, wakati Bournemouth pia wamewasilisha ombi la kumnunua Mwingereza huyo mwenye umri wa miaka 23. (Mail on Sunday)	https://www.bbc.com/swahili/articles/cgx1q18301ko
entertainment	"Caitríona Lagan: ""Nacheza vyombo vyote katika bendi yangu ya muziki ya Ireland"""	Caitríona Lagan alianza kuweka mtandaoni video zake akicheza ala tano za muziki - banjo, mandolin, fiddle, guitar na mandola – kwa pamoja, wakati wa Lockdown. Msichana huyo mwenye umri wa miaka 15 kutoka Londonderry, Kaskazini mwa Ireland,alikuwa akitarajia video zake zitawafurahisha watu wakati wa janga la corona na zimepokelewa vizuri.	https://www.bbc.com/swahili/habari-57606945
business	Jinsi wakazi wa Mlima Elgon walivyobadili kilimo chao kutokana na mabadiliko ya tabia nchi	Migomba mirefu, miti ya matunda na mimea maridadi ndiyo inayokukaribisha katika shamba la Bwana Muneria Joseph ambaye ni mkulima katika wilaya ya Kapchorwa, mashariki mwa Uganda. Ni taswira maridadi, picha ya mkulima anayetarajia kuvuna mazao mengi ikiwa kila kitu kitasalia kama ilivyo sasa. Na hiyo ndiyo taswira unayokumbana nayo katika maeneo mengi wilayani Kapchorwa na eneo zima la Mlima Elgon, mashariki mwa Uganda. Mashamba yaliyojaa mimea ambayo yanaonekana kuwa maridadi na yanayopendeza sana. Lakini hali haikuwa hivi miaka kadhaa iliyopita. Eneo hili la Kapchorwa na Mlima Elgon kwa ujumla lilipitia hali mbaya ya mabadiliko ya tabia nchi. Kwanza mvua ilibadili taratibu ya kunyesha, na kisha wakati iliponyesha kukawa na mafuriko makubwa na maporomoko ya ardhi. Aidha wengi wa wale waliokuwa wakitegemea mvua kwa ajili ya kilimo wanasema mabadiliko ya tabia nchi yaliwaathiri pakubwa. 'Zamani mvua ilikuwa inanyesha vizuri, lakini mabadiliko ya hali ya anga yameathiri kabisa kilimo chetu,' anasema Bwana Muneria. 'Siku hizi hakuna mvua kama ilivyokuwa ikinyesha zamani, tunaweza kwenda hata mwaka bila kuona mvua. Bwana Muneria sawia na wakulima wengi katika eneo hili la Kapchorwa amelazimika kubadili njia yake ya kilimo ili kupata mazao. 'Sasa inatulazimu kufanya kilimo cha kunyunyizia mashamba maji. Nimeanza kutumia mbinu hiyo takriban miaka mitano iliyopita. Nimeweka mabomba katika shamba langu ili angalau nifurahie kilimo.', anasema Muneria. Wakulima wengi mashariki mwa Uganda sasa wamekumbatia mbinu za kisasa za kilimo ili kuweza kukabiliana na mabadiliko ya tabia nchi na kujiendeleza katika kilimo. Bwana Joseph Kishare, afisa wa kilimo katika eneo la Kapchorwa anasema bila mabadiliko hayo, kilimo kilikuwa kimefifia kabisa. 'Wakulima wa kahawa walijipata wana magonjwa mengi kwa mazao yao yanayosababishwa na mabadiliko ya hali ya anga. Kahawa zikaanza kukauka na wakulima wakapata hasara kubwa,' anasimulia Bwana Kishare. Aidha hali hii ya magonjwa kwa mimea ilisababisha bei ya kahawa katika eneo hili kupungua kabisa. Ni changamoto ambayo iliilazimu idadi ya kilimo katika eneo hili la Kapchorwa kuanza kutoa mafunzo kwa wakulima ili kutumia mbinu za kisasa za kilimo. Na hiyo imekuwa na mchango mkubwa katika kuboresha hali ya kilimo mashariki mwa Uganda. 'Tumeanza kwa kuwaelimisha wakulima jinsi ya kulima kwa kunyunyiza maji mashambani, na pia jinsi ya kutumia madawa ya kisasa ili kuzuia wadudu wanaosababishwa na mabadiliko ya tabia nchi,' anaeleza Bwana Joseph Kishare, afisa wa kilimo katika eneo la Kapchorwa. Utafiti wa hivi majuzi uliopewa jina la Kustahimili Mabadiliko ya Tabia Nchi Mlima Elgon: Athari za Sera na Mapendekezo, uliofanywa na Daniel Olago, John P. Owino na Eric Odada unaonyesha baadhi ya mabadiliko yaliyofanywa ili kukuza kilimo katika eneo la Mlima Elgon. Ni pamoja na kupanda mazao yenye mavuno mengi na yanayostahimili ukame, kufanya mzunguko wa mazao na pia uzalishaji wa vyakula vya mifugo ili kupunguza shinikizo kwenye malisho ya milimani. Kwa hivyo mifumo ya kitamaduni inakabiliwa na mbinu kali zaidi za kilimo. Na hapa Kapchorwa hilo liko dhahiri kutokana na mashamba na mazao unayokutana nayo hapa. Sasa badala ya kuwa na shamba kubwa lililopandwa aina moja pekee ya mazao, unakuta mashamba ambayo yana mchanganyiko wa mazao ili kuendeleza kilimo stahimili kwa hali ya anga inayobadilika. Pia wakulima wengi sasa wanatumia maji ya mabomba kunyunyizia mashamba yao, na dawa za kisasa ili kuzuia wadudu wanaoshambulia mimea. Lakini wakulima hawa wanasema bado mengi yanahitaji kufanywa ili kukabiliana vyema na mabadiliko ya tabia nchi.	https://www.bbc.com/swahili/habari-59210345
business	Kwanini matumizi ya maziwa na Ngamia yanaongezeka duniani?	"Maziwa ya ngamia yametumika na binaadamu kwa zaidi ya miaka 6000, na mahitaji yake yanaonekana kuongezeka katika miaka ya hivi karibuni duniani licha ya gharama yake kubwa. Mara nyingi maziwa ya ngamia hutumiwa na jamii za wafugaji na wahamiaji katika ukanda wa Afrika mashariki na pembezoni. Jamii za Wasomali, WaBorana WaRendile na hata WaTurkana zinazopatikana katika maeneo hayo hutumia pakubwa maziwa ya ngamia kutokana na faida kama vile kusafisha mwili na kushinikiza afya ya watoto  wanapokuwa. Kadhalika kuna baadhi ambao wanaamini kuwa maziwa hayo husaidia katika kumfanya mtu kuwa hodari, mchangamfu na kushinikiza nguvu za kiume, licha ya kwamba haya hayajathibitishwa rasmi kisayansi. Ni kutokana na faida kama hizi ambazo zimechangia wengi duniani kutafuta na kuanza kutumia maziwa ya ngamia. Faida 7 za maziwa ya Ngamia: Katika eneo la mashariki ya kati ni kinywaji muhimu cha kitamaduni. Kiliisaidia waarabu wa kuhama hama wa jamii ya  Bedouin kwa karne kadhaa. Marekani, India, China na Urusi ni mataifa yanaytajwa kuwa masoko makuu ya ukuwaji a maziwa hayo kwa mujibu wa wataalamu. Licha ya kwamba maziwa haya hutumika sana sana katika mataifa ya Kaskazini na mashariki mwa Afrika na enoe la mashariki ya kati, ripoti ya mwaka 2016 ya serikali ya Australia imetabiri kwamba ""miaka mitano kuelekea 2021 kunatarajiwa kushuhudiwa ongezeko la uzalishaji maziwa ya ngamia nchini humo"". Soko la maziwa ya ngamia linazidi kuwa kubwa kutokana na ongezeko la mahitaji ndani na hata nje ya nchi. Meghan Williams na mumewe Chris walianzisha ufugaji wa ngamia mnamo 2014 waiwa na ngamia watatu ambao iliwabidi wawafunze kukamuliwa maziwa. Miaka mitano baadaye biashara yao - The Camel Milk Co Australia - imeshamiri mara dufu na sasa wana ngamia 300, 60 katiyao wakitumika kwa kukamiliwa maziwa. ""mara nyingi huwa tunafuatwa na wateja wa kimataifa na masoko yao. Jambo moja tunalojivunia Australia dhidi ya mataifa mengine duniani ni kwamba ngamia wetu hawana magonjwa."" Ngamia alitumika Australia mara ya kwanza katika miaka ya 1840 kusaidia katika kusafiri katika sehemu kubwa ya nchi hiyo. Inakisiwa kwamba kuna ngamia milioni 1.2 jangwani. Baadhi wakiwa ni wa asili ya kiarabu, walio na nundu moja mgongoni na ndio wanaotumika kukamiliwa maziwa."	https://www.bbc.com/swahili/habari-48946945
health	Njia 7 za kula vizuri na kubana matumizi ya chakula wakati wa mfumuko wa bei	"Kwa wastani Familia moja ya Amerika Kusini hutumia kati ya 25% na 40% ya bajeti yake ya kila mwezi kwa chakula, kulingana na takwimu rasmi kutoka kwa kila nchi. Sekta maskini zaidi zinatenga asilimia kubwa zaidi. Amerika ya Kusini ni eneo ambalo ili kula kwa afya ni gharama  pamoja na Afrika, kulingana na Shirika la Chakula na Kilimo la Umoja wa Mataifa (FAO). Ili kuweza kula, kila mtu anahitaji kiasi cha $4.25 kwa siku hii ni kwa  mwaka  2019 hizi ndio takwimu mwisho zilizopo. Hiyo ni mara tatu zaidi ya watu wangeweza kumudu. Kiasi kilichosahihishwa kitakuwa kikubwa zaidi, anakadiria naibu mkurugenzi mkuu wa FAO na mwakilishi wa Amerika ya Kusini na Karibea, Julio Berdegué, katika mazungumzo na BBC Mundo. Shirika la chakula duniani FAO hukokotoa orodha ya  bei ya chakula na sasa ndio wakati ambapo kula ni ghali zaidi  angalau tangu kuanza kwa kuhifadhi. Hii husababisha lishe duni na viwango vya juu vya utapiamlo na hata njaa. Kwa hiyo, katika wakati wa mfumuko wa bei wa juu na kupanda kwa bei ya vyakula, jambo rahisi zaidi linaweza kuwa ni kubadilisha bidhaa za bei nafuu lakini ambazo si lazima ziwe na afya au kuwa na usawa wa lishe ambayo mwili wetu unahitaji. ""Kutokana na kwamba katika Amerika ya Kusini ni ghali zaidi vyakua vyenye afya, tunahamia zaidi kwenye wanga, sukari na mafuta. Yote hayo ni ya bei nafuu, ""anasema Berdegué. Kula vizuri na wakati huo huo kutumia kidogo ni changamoto. Hizi ni hatua 7 unazoweza kuchukua ili kuifanikisha. Labda ni dhahiri zaidi, lakini ni muhimu. Kununua chakula nje, mitaani au katika duka, mara nyingi ni haraka zaidi, lakini sio rahisi zaidi mfukoni. Kwa kuongeza, tunaponunua chakula kilichopikwa tayari hatujui ubora wa viungo vilivyotumiwa ni nini, au hata ni viungo gani vilivyotumiwa kutengeneza. Vile vile hufanyika kwa vyakula vilivyotayarishwa tayari ambavyo huuzwa kwenye maduka makubwa, bidhaa zinazojulikana kama ultra-processed. Hizi zina ziada ya mafuta mabaya, sodiamu na sukari mbavyo vinaongezwa ili kuipa ladha bora lakini sio vizuri kiafya. Kupika nyumbani kunamaanisha kwamba tunajua hasa tunachokula na kwamba tunalipa kidogo kwa hiyo. 2.Kula kwa kiwango ambacho mwili unahitaji tu Asilimia kubwa ya watu hula chakula zaidi ya mwili unavyohitaji Kupunguza kiwango cha chakula tuachojipakulia wenyewe  kwa kiasi kinachopendekezwa kwa utendaji wa binadamu kusaidia mifuko yetu na, wakati huo huo, kusaidia kujisikia vizuri zaidi kimwili. ""Kiasi ambacho hutolewa katika nchi zetu nyingi ni kikubwa mno. Ununuzi sokoni umepanda sana na, zaidi ya hayo, ziada hii ya chakula husababisha uzito kupita kiasi,"" mtaalamu wa lishe wa Venezuela Ariana Araujo anaiambia BBC Mundo. Lishe ya kati ya kilocalories 2,000 na 2,500 ni idadi ya kutosha ya ulaji wa kila siku. Kubadilisha viungo au vyakula vyote ni mojawapo ya njia za kupunguza gharama za chakula. Baadhi ya bidhaa za kimsingi kama vile mafuta, kahawa, baadhi ya matunda na mboga, nyama ya ng'ombe, mkate (na unga wa ngano kwa ujumla), mayai na baadhi ya kunde ziliongezeka kwa bei zaidi ya ongezeko la wastani la vyakula na vinywaji. vileo katika nchi nyingi za Amerika ya Kusini, kulingana na habari iliyochapishwa na taasisi rasmi ambazo zina jukumu la kupima mfumuko wa bei. tortilla, sehemu kuu ya lishe ya Mexico, ziligharimu watumiaji katika nchi hiyo 17.7% zaidi sasa kuliko mwaka mmoja uliopita. Unga wa mahindi, bidhaa muhimu ya kupikia chapati za arepas bei imepanda katika eneo lote. Unaweza kutafuta mbadala ambazo ni sawa na lishe, lakini hazijawa ghali au hata kupatikana kwa  bei ya chini. Kwa hili ni muhimu kujua ni bidhaa gani zinaweza kubadilishana. Mlo kamili unapaswa kujumuisha nusu ya matunda na mboga, robo ya protini, na robo nyingine ya wanga, anasema Araujo. Katika kundi la protini ni nyama ya ng'ombe na nguruwe, kuku, samaki, maziwa, jibini, mayai, maharagwe, dengu, na mbaazi. Nyama ya nguruwe ndiyo ambayo, kwa ujumla, ilipanda bei ya chini zaidi katika miezi 12 iliyopita katika Amerika ya Kusini, wakati kuku na samaki vikiambatana na kupanda kwa ujumla, ambayo ilikuwa chini ya ongezeko la bei ya nyama ya ng'ombe. Maharage, kwa upande mwingine, hayakuwa na ongezeko hilo la bei na ni nafuu zaidi kuliko mwaka mmoja uliopita katika baadhi ya nchi. ""Tumepunguza sana matumizi ya kunde, maharagwe, njegere, dengu, wakati ni bidhaa zinazoweza kufikiwa ambazo hutoa kiwango kizuri cha protini,"" anasema Berdegué. Wanga ni pamoja na mchele, mkate, mahindi, pasta, ndizi na mizizi -viazi, mihogo na  viazi vitamu Mchele na mizizi ikawa chini ya gharama kubwa kuliko ngano na mahindi, hivyo kuchagua kwa zamani itasaidia kufanya orodha ya bei nafuu. Kufanya mpango wa kile tunachopaswa kununua kabla ya kwenda sokoni ni muhimu katika kupunguza matumizi. Jambo la kwanza ni kujua tunataka kununua nini na kisha kuamua wapi. Kununua matunda na mboga mboga, jibini au nyama kwenye maeneo ya kawaida ni nafuu kuliko katika maduka makubwa. Unapoenda kwenye maduka makubwa, kulingana na Araujo, ni kuzunguka kuta tatu za duka, pembeni na nyuma kutengeneza ""U"" iliyopinduliwa. ""Huwezi kwenda dukani ukiwa na njaa, kwa sababu nikipungukiwa na pesa na zaidi ya hayo nahisi njaa, naona matangazo ya bidhaa zilizosindikwa kabisa ambazo napenda sana na ninashawishika kuinunua,"" Anasema Kialbania. Kuwa wazi juu ya kile kitakachopikwa katika siku zifuatazo husaidia kuhesabu vizuri kiasi na sio kununua zaidi, kitu muhimu katika vyakula vinavyoharibika ili usivitupe baadaye kwa sababu vimeharibika. Ushauri wa Kialbania ni kununua kwa kiasi kikubwa, kwa familia moja au kati ya watu kadhaa ili kuokoa pesa. Pendekezo moja kutoka kwa Araujo ni kuangalia rafu za chini, ambapo bidhaa zisizochakatwa huwa ziko na ni za bei nafuu. Matunda na mboga ni hubadilishana kwa kila moja; cha muhimu ni kutofautisha baina yao. ""Wanatoa nyuzinyuzi, vitamini na madini ambayo ni vigumu sana kupatikana katika vyakula vingine,"" anasema Baalbania. Ili kupunguza gharama za chakula, wanachoshauri wataalam ni kununua bidhaa za msimu, kulingana na nchi na hali ya hewa yake. Kujaribu kula nyanya nje ya msimu kunazifanya kuwa ghali zaidi kwa sababu wale wanaoziuza wameamua kutumia ili kuziweka kwa miezi kadhaa au kuzizalisha kwenye greenhouses, mifumo yote inayofanya chakula kuwa ghali zaidi. Kinyume chake, katika bidhaa za msimu hupatikana kwa wingi, kwa bei ya chini, na ndio wakati ambao chakula huwa kitamu zaidi na cha lishe. Njia mbadala ni kununua wakati ni nafuu na kutumia mbinu fulani ya uhifadhi. Rahisi zaidi ni kuweka chakula kwenye friji. Zinaweza kuwa na nyama na mboga nyingi - mradi hutaki kuzila mbichi baadaye- na matunda. Unaweza pia kupika kiasi kikubwa kuliko utakachokula mara moja na kuhifadhi sehemu kwenye friji kwa ajili ya baadaye, au kupika viungo vilivyolegea na kuvigandisha kwa matumizi ya baadaye katika matayarisho. ""Hiyo huhifadhi zaidi ya 90% ya virutubisho,"" anasema Araujo, akiongeza kuwa yeye hufanya hivyo nyumbani. 7. Usinunue chapa maarufu za vyakula, lakini soma kwanza maelezo yake Kwa sababu ya uuzaji, mara nyingi tunaamini kuwa bidhaa ya chapa maarufu - pia inaitwa chapa ya kwanza- ni bora kuliko zingine. Hii si lazima iwe hivyo. ""Ni muhimu kusoma orodha ya viambato, badala ya chati ya lishe, na kutambua sukari na mafuta yenye ubora duni,"" anasema Balbanian. Araujo anasema kwamba wakati mwingine chapa za pili au hata lebo binafsi - zile  kutoka kwa mnyororo wa maduka makubwa - huwa na afya bora kwa sababu ili kupunguza bei hawatumii mafuta fulani au sukari ambayo chapa za kwanza hutumia kuzipa bidhaa ladha nyingine. Kwa wengine, sio bora, lakini sio mbaya zaidi. ""Mapendekezo yangu ni kusoma lebo na kulinganisha. Karibu kila mara zinafanana kabisa na kuna akiba kubwa,"" anasema Araujo."	https://www.bbc.com/swahili/habari-61482952
technology	Maandamano ya wakulima: Fahamu kwanini ujumbe wa Twitter wa Rihanna ulizua hisia kali India	"Saa chache baada ya ujumbe wa Rihanna katika mtandao wa twitter kuzua hisia kali duniani baada ya kuwaunga mkono wakulima waliokuwa wakiandamana , serikali ya India ilimshutumu sana mwimbaji huyo wa Marekani. Wizara ya masuala ya kigeni ilitoa taarifa rasmi ikiwakosoa watu maarufu na wengine kwa matamshi yao yasio sawa huku mawaziri na watu maarufu nchini humo nao wakalazimika kuchapisha jumbe dhidi ya propaganda ambayo inatishia umoja wa India. Baadhi ya vyombo vya habari viliangazia sana taarifa hiyo ya serikali: Mmoja ya waigizaji wa kike wa Boollywood  ambaye amekuwa akiunga mkono serikali alimuita Rihanna 'nyota wa ngono' na baadhi ya watu wakimuunga mkono mpenzi wake wa zamani Chris Brown kwa kumshambulia 2009. Ujumbe wa Rihanna siku ya Jumanne unaohusishwa na habari moja kuhusu kuzimwa kwa mtandao  katika eneo ambalo wakulima hao walikuwa wakiandamana na mara moja ukasambaa kwa haraka , ukipata likes 700,000. Kwanini hatuzungumzi kuhusu hili? aliandika msanii huyo ambaye ana wafuasi milioni 100 duniani katika mtandao huo wa kijamii. Hatua ya serikali kukabiliana na ujumbe huo ilikuwa ya haraka sana , ikiongozwa na waziri wa masuala ya ndani Amit Shah aliyetuma ujumbe wa twitter  siku ya Jumatano usiku na neno #IndiaAgainstPropaganda and #IndiaTogether. ""hakuna Propaganda zinazoweza kutishia Umoja wa India! ''Propaganda haziwezi kuamua hatma ya India .....ni maenedeleo pekee. India itaendelea kuwa na mshikamano  na kwa pamoja itaafikia maendeleo'', aliandika. Muda mfupi baadaye , mawaziri na nyota wa Bollywood na wachezaji kriketi pia walianza kutuma ujumbe katika twitter , wakitumia maeneo yaliotumiwa na bwana Shah. Uhuru wa India hauwezi kuigiliwa. Nguvu za kutoka nje zinaweza kutazama lakini haziwezi kushiriki. India inawatambua Wahindi na wanapaswa kuiamulia India. Tusalie watu wamoja kama taifa , aliandika nyota wa Kriketi Sachin Tendulkar. Maandamano hayo yamekuwa changamoto kubwa  kwa serikali ya Waziri Mkuu Narendra Modi. Makumi ya maelfu ya wakulima wamekuwa wakiandamana katika mipaka ya Delhi kupinga sheria tatu mpya za mashamba kwa zaidi ya miezi miwili. Waandamanaji hao, wakiwemo wanaume wanawake, wazee na watoto , wamekataa katakata kusitisha maandamano hayo hata wakati wa majira ya baridi, wakipiga kambi katika maeneo yalio wazi, ambapo wamekuwa wakiishi na kulala barabarani. Wengi wao wakifariki. Serikali imejitolea kusimamisha sheria hizo kwa miezi 18, lakini wakulima wanasema lazima zifutwe. Wiki iliyopita, maandamano hayo yaligonga vichwa vya habari ulimwenguni wakati maandamano ya matingatinga ya wakulima yalipomalizika kwa mapigano makali, na kusababisha mwandamanaji mmoja kupoteza maisha yake huku mamia ya polisi na waandamanaji wakijeruhiwa. Waandamanaji wengine walivamia jumba la kumbukumbu la Red Fort mjini Delhi na kusalia hapo hadi polisi walipowafukuza. Huku Ujumbe wa Rihanna ukisambaa na kuvutia maelfu ya majibu , wengi walimpongeza kwa kuliangazia suala hilo muhimu. Lakini wengi pia walimkosoa kwa kuingilia maandamano ambayo ni kinyume na sheria ambayo imetetewa na serikali na wafuasi wake. Vituo vingine vya habari vinavyounga mkono serikali vilikuwa na vichwa vya habari ambavyo vilimuelezea Rihanna kama ""mgeni asiye na habari"" ambaye alikuwa sehemu ya ""njama ya kugawanya India"" na kuapa kwamba ""propaganda hazitashinda"". Mtangazaji mmoja wa habari - kwa kile kilichoonekana kama maoni ya Waislamu - aliuliza ikiwa mwimbaji huyo wa Barbadia aliitwa Rihanna au Rehana? Waliokuwa wakimpinga walitoa picha za zamani za shambulio dhidi ya mwimbaji huyo na mpenzi wake wa zamani, wakimzidishia unyanyasaji dhidi yake. Wengine walionyesha jinsi ambavyo  wanaume wa India huamua kuwanyanyasa na kuwazima wanawake walio na maoni huru Lakini moja ya pingamizi ya kushangaza dhidi ya  mwimbaji huyo  ilitoka kwa mwigizaji wa  Kangana Ranaut, ambaye amekuwa akiunga mkono chama cha  BJP. Katika msururu wa jumbe zake za twitter, alikosoa kazi ya Rihanna, muziki wake, muonekano wake  na hata rangi yake ya ngozi. Alichapisha picha za nyota huyo wa pop akiwa amevalia vazi la bikini, na kumwita ""nyota wa ponografia"" na ""mwimbaji wa ponografia"", na akasisitiza kwamba alikuwa amelipwa  kuandika ujumbe huo. Lakini ujumbe wa Rihanna, ambao uliwaongezea sauti wakulima wanaoandamana, haungeweza kufikia serikali wakati mwafaka zaidi ya huo. Wakulima hao wametangaza mipango ya kufunga barabara kuu zinazoingia mji mkuu Jumamosi na serikali inapeleka rasilimali nyingi kuwazuia. Misumari ya chuma, fimbo, waya zenye miba, mawe na kuta za muda zimewekwa na mitaro kuchimbwa kwenye mipaka ya Delhi - huku wakulima na wakosoaji wakiishutumu serikali kwa kufanya maandalizi ""kuwa vita"" dhidi ya raia wake. Mamlaka pia inajaribu kupigana vita dhidi ya muonekani wa India ughaibuni kuhusu jinsia inavyokabliana na wakulima wake."	https://www.bbc.com/swahili/habari-55934189
religion	Familia ya Kiislamu yauawa katika shambulio la chuki 'ya kukusudia'	"Watu wanne wa familia ya Kiislamu wameuawa ""kimakusudi"" katika shambulio la gari siku ya Jumapili, polisi wa Canada wanasema. Shambulio hilo lilitokea katika mji wa London, mkoa wa Ontario. Mvulana wa miaka tisa, wa familia hiyo aliyenusurika amelazwa hospitali akiwa na majeraha mabaya. Mwanamume wa miaka 20 raia wa Canada amefunguliwa mashtaka manne ya jaribio la mauaji. Shambulio hilo lilikuwa baya zaidi kufanywa dhidi ya jamii ya Waislamu wa Canada tangu watu sita walipouawa katika msikiti mmoja mjini  Quebec mwaka 2017. ""Inaaminiwa wahasiriwa walilengwa kwa sababu walikuwa Waislamu,"" Det Supt Paul Waight aliwaambia waandishi wa habari siku ya Jumatatu. Polisi wanatafakari uwezekano wa kufungua mashtaka ya ugaidi, alisema, akiongeza inaaminiwa kuwa uhalifu wa chuki. Tunafahamu nini? Wahasiriwa ni wanawake wawili- walio na umri wa 74 na 44 - mwanamume wa miaka 46-na msichana wa miaka 15. Majina yao hayajatolewa kufuatia ombi la familia. Mvulana wa miaka tisa yuko hospitali baada ya kujeruhiwa katika shambulio hilo, polisi walisema. Polisi wamemtaja mtuhumiwa ni Nathanial Veltman, 20, wa London, Ontario. Alikamatwa bila visa vyo vyote vya ghasia karibu kilomita sita kutoka eneo la tukio. Bado haijabainishwa ikiwa mshukiwa ana uhusiano na makundi yoyote ya chuki, alisema Det Supt Waight. ""Hakuna uhusiano wowote wa hapo awali kati ya mtuhumiwa na wahasiriwa,"" Det Supt Waight alisema, akiongeza kuwa mtuhumiwa alikuwa amevalia fulana ambayo inaonekana kama ""nguo ya kujikinga mwili"". Polisi wanasema Bw. Veltman hajawahi kushtakiwa siku zilizopita. Mmoja wa mashuhuda aliaimbia CTV News kwamba alimfumba macho binti yake mdogo asione miili ya wahasiriwa. Mwingine aliimbia CTV kwamba hali katika eneo hilo ilikuwa ya ""taharuki"". ""Watu walionekana wakikimbia kila mahali anaokimbia,"" alisema Paige Martin. ""Raia walikuwa wakijaribu kuelekeza magari ya huduma za dharura pakwenda."" Sensa ya mwaka 2016 ilibaini kuwa London - mji uliopo karibu kilo mita 200 kusini magharibi mwa mwa  Toronto - unaendelea kuwa na watu kutoka jamii mbali mali. Mmoja wa watu watano alizaliwa nje ya Canada, Waarabu ndio jamii kubwa ya wachache, wakifuatiwa na jamii kutoa Asia Kusini. Shambulio hilo limepokelewaje? Waziri Mkuu wa Canada Justin Trudeau aliandika katika Twitter yake akisema ilikuwa taarifa ya  ""kuogofya"". ""Kwa wapendwa wa wale ambao walitishwa na kitendo cha jana cha chuki, tuko hapa kwa ajili yenu,"" aliandika. ""Hiki kilikuwa kitendo cha mauaji ya watu wengi, kilichotekelezwa dhidi ya Waislamu, dhidi ya wakazi wa London, kilichotokana na chuki,"" alisema Meya wa  London Ed Holder. Katika taarifa, Meya Holder alisema anazungumza na ""kwa niaba ya wakazi wote wa London ninaposema nyoyo zetu zimevunjika"". ""Tunaomboleza familia, vizazi vitatu ambavyo sasa vimekufa."" Taarifa ya Meya iliongeza kuwa ameagiza bendera zote kupeperushwa nusu mlingoti nje ya ofisi za baraza la jiji la London kwa ajili ya maombolezo ya siku tatu."	https://www.bbc.com/swahili/habari-57395418
