sports	Tetesi za soka Ulaya Jumatano 04.08.2021:Grealish, Maddison, Kane, Lukaku, Abraham, Ibrahimovic, Coady, Kounde	"Manchester City inakaribia  kumsajili  nahodha wa Aston Villa  Jack Grealish kwa pauni milioni 100 . Mkataba unaweza kuhitimishwa kwa wakati kwa kiungo huyo wa England kucheza kwenye mechi yao ya community shield dhidi ya  Leicester City Jumamosi. Hatua ya nyota huyo wa  miaka 25  kufanikisha  uhamisho huo itavunja rekodi ya Uingereza Ada yake itazidi pauni milioni 89 ambazo Manchester United ililipa kumsajili tena kiungo wa Ufaransa Paul Pogba kutoka Juventus mnamo 2016. Grealish yuko tayari kuhama  baada ya kurudi kwenye mazoezi ya kabla ya msimu na Aston Villa baada ya Euro 2020. Manchester City wako tayari kulipa pauni milioni 130 kwa ajili ya mshambuliaji wa Tottenham  na England Harry Kane, 27, na wamesalia kuwa na matumaini kwamba wanaweza kusaini mkataba naye. (Athletic, subscription required) Arsenal  wamependekeza mkataba wa nyongeza ya pesa kwa ajili ya kiungo wa kati wa  Leicester City na  England James Maddison. Inasemekana The Gunners wanasita kulipa pauni milioni 60, malipo yanayotakikana kwa ajili ya mchezaji huyo mwenye umri wa miaka 24, kwa hiyo watatoa ofa ya mchezaji kama sehemu ya dau hilo. (football.london) Inter Milan watakubali kwa shingo upande dau la takriban pauni milioni 100 kutoka kwa mshambuliaji wa Chelsea Mbelgiji Romelu Lukaku, 28,  baada ya maafisa katika klabu hiyo kukubali kibinafsi kuwa wanahitaji kumtoa mmoja wa wachezaji mashuhuri msimu huu ili kuweka sawa mahesabu yao ya pesa. (Metro) Lukaku anasemekana kutaka kurejea Chelsea lakinii anahisi kuna mambo ambayo hajayajakamilika katika Stamford Bridge. (Sun) Mlinzi wa Uhispania Aymeric Laporte ameieleza wazi Manchester City kwamba anahitaji kuhamia  La Liga msimu huu, huku  Barcelona  na  Real Madrid zikiwa makini kusaini mkataba na mchezaji huyo mwenye umri wa miaka 27. (90min) Southampton na West Ham zinamtaka mlinzi wa kikosi cha vijana wenye umri wa miaka 21 wa  Nice na  Austria-21 Flavius Daniliuc, 20. (Mail) Liverpool,  pamoja na timu zisizojulikana  za Primia ligi, wanataka kusaini mkataba na mshambuliajii  wa Bournemouth Mholanzi Arnaut Danjuma, 24, ambaye tayari anatakiwa kwa dau na timu ya Villarreal. The Cherries  wanasemekana kumtaka kwa mkataba huru wa pauni milioni 21.5. (Marca - in Spanish) Aston Villa  wana matumaini ya kusaini mkataba na mshambuliaji  wa Chelsea  na England  Tammy Abraham, 23,  na mlinzi wa  Manchester United  Axel Tuanzebe, 23. Wote walicheza kwa mkataba wa mkopo katika klabu ya  Villa Park na waliisaidia klabu hiyo kupandishwa daraja na kuingia katika Primia Ligi  katika 2018-19. (Telegraph - subscription required) Chelsea wamemtoa kama ofa winga Mbrazili  Kenedy  kwa  klabu ya Sevilla ikiwa ni kama sehemu ya mkataba wao na Jules Kounde,22, baada ya mlinzi mwenzake Mfaransa  Kurt Zouma, 26, kutolewa awali katika sehemu ya kubadilishana wachezaji na  the Blues. (Sun) Mshambuliaji wa Ureno Cristiano Ronaldo atataka bado kuondoka   Juventus  kuelekea Real Madrid, lakini mchezaji huyo mwenye umri wa miaka 36, anafahamu kuwa fursa zake za kurejea Bernabeu zinategemea iwapo klabu hiyo ya Uhispania itafanikiwa katika harakati zake za kumtaka mshambuliaji wa  Paris St-Germain,  22 Mfaransa Kylian Mbappe. (AS - in Spanish) Wageni wa Primia Ligi  Brentford  wanakamilisha mkataba kwa ajili ya kiungo wa kati wa  Midtjylland Msweden Swedenn 21,  Jens Cajuste, ambaye amehusishwa na taarifa za kuhamia katika klabu ya Rennes. (Sportbladet - in Swedish) Mshambuliaji Msweden Zlatan Ibrahimovic, 39, ""alijaribu bahati yake"" kuhusu uwezekano wa kurejea  Paris St-Germain kabla ya kukubali mkataba mpya wa mwaka mmoja katika AC Milan. (Le Parisien - in French) Leeds United  wana ushindani katika dau la kusaini mkataba na mchezaji wa kikosi cha vijana walio china ya umri wa miaka 21 cha Uholanzi  Noa Lang. Kulingana na ripoti klabu ya ligi ya Uhispania Sevilla pia wanamtaka winga huyo mwenye umri wa miaka 22. (El Desmarque - in Spanish) West Ham wanaamini wana asilimia 10 pekee ya uwezekano wa kusaini tena mkataba na mchezaji wa kimataifa wa  England Jesse Lingard  kutoka  Manchester United. Mchezaji huyo mwenye umri wa miaka 28,  ambaye mkataba wake katika  Old Trafford unaisha msimu ujao wa kiangazi, amerejea katika mazoezi kabla ya msimu na The Red Devils. (Sky Sports) West Brom wanaangalia uwezekano wa kumhamisha mshambuliaji wa klabu ya  Derby County kutoka  Wales Tom Lawrence mwenye umri wa miaka 27. (Mail)"	https://www.bbc.com/swahili/habari-58082436
politics	Watu kadhaa wauawa katika shambulio la wanamgambo wa Kiislamu Msumbiji	"Watu kadhaa wameuawa kufuatia shambulio lililotokea mjini Palma, kaskazini mwa Msumbiji, kwa mujibu wa msemaji wa idara ya usalama. Watu saba wameuawa wakati wakijaribu kutoroka mapigano hayo katika hoteli moja, amesema Omar Saranga. Mamia ya wengine wageni na wenyeji waliripotiwa kuokolewa. Eneo hilo limevamiwa na wapiganaji tangu Jumatano. Watu walioshuhudia wameelezea jinsi walivyokuwa wakijificha ili waweze kuokolewe kwa njia ya boti, katika fukwe walikokutana na miili iliyotenganishwa na vichwa. Katika tovuti ya askari wa majini inaonesha boti kubwa zikiwa maeneo ya Palma, na katika fukwe ya Pemba mpaka eneo la kusini ambapo watu walikuwa wanajaribu kutorokea huko kwa namna yeyote - boti za mizigo, meli za abiria na aina nyingine za boti. Mkandarasi mmoja aliiambia BBC kuwa watu wengi walitoroka katika hoteli hiyo kwa makundi kwa kujificha pembezoni mwa ufukwe majira ya usiku waliweza kufanikiwa kutoroka na boti siku ya Jumamosi asubuhi. Alisema watu wengi waliweza kufika salama na boti zilirudi Jumapili kuokoa wengine. Alisema raia ambao walikuwa wanafanyakazi na kuishi katika eneo hilo walionekana kusaidia katika shughuli za uokoaji. ""Wauzaji wa bidhaa za ndani na makampuni, walikuwa mashujaa katika zoezi zima la uakoji. Kwa muda mfupi walifanikiwa kuratibu namna ya kuwaokoa wahanga kwa kutumia boti na kufanikisha kuwaondoa wakiwa usalama."" ""Sijui msaada kutoka makampuni makubwa ulikuwa wapi au hata kutoka nje ya nchi?"" aliuliza. Raia wa Afrika Kusini, Adrian Nel aliuliwa wakati akijaribu kutoroka wanamgambo hao, mama yake Bi. Meryl Knox aliiambia BBC. Mume wake, Gregory, alifanikiwa kutoroka katika mji huo wa Palma - ingawa aliiambia AFP kuwa ilimbidi kubeba mwili wa marehemu mtoto wake mmoja wa kiume mpaka alipookolewa. Ingawa mtoto wake mwingine aliweza kutoroka. Lakini walipoondoka, Bi Knox aliiambia BBC hakukuwa na jeshi linalowalinda, ilikuwa ni mtu tu kukimbia na kuokoa maisha yake. ""Hili suala lingeweza kuzuilika,"" aliongeza. ""Mtoto wangu angekuwa hai mpaka sasa."" Pia unaweza kutazama: Chanzo kimoja cha habari ambacho kilikuwa karibu na uokoaji kimeiambia AFP kuwa katika boti moja watu wapatao 1,400 waliwasili katika bandari ya mji wa Pemba, ambao ni karibu kilomita  250 (155 miles) kusini mwa Palma, Jumapili mchana. Mashirika ya kutoa msaada yalisema boti ndogo kadhaa ambazo zilikuwa zimejaza watu zinategemewa kuwasili Jumatatu asubuhi. Kampuni kubwa ya nishati ya Ufaransa Total ilisema ililazimika kusitisha shughuli katika mradi mkubwa wa gesi ulio karibu na eneo lenye mapigano. Total iliongeza kuwa inaamini vikosi vya usalama vya Msumbiji, ambavyo vilikuwa vikifanya kazi ili kudhibiti eneo hilo. Human Rights Watch ilisema kwamba mashuhuda walielezea kuwa waliona ""miili barabarani na wakazi wakitoroka baada ya wapiganaji kufyatulia risasi kiholela watu na majengo"". Eneo la Kaskazini mwa Msumbiji limekumbwa na uasi tangu mwaka 2017. Wapiganaji wanaohusishwa na kundi la Islamic State (IS) ndio wanaosababisha mzozo katika eneo lenye Waislamu wengi la Cabo Delgado. Mapigano hayo yamesababisha vifo vya zaidi ya watu 2,500 na watu 700,000 wamehama makazi yao. Kuna taarifa ambazo hazijathibitishwa za raia wa Uingereza kunasa katika hoteli. Msemaji wa ofisi ya mambo ya nje, Jumuia ya madola na Maendeleo ameiambia BBC: ''Ofisi yetu ya ubalozi mjini Maputo iko kwenye mawasiliano ya moja kwa moja na mamlaka za Cabo Delgado ili kupata taarifa zaidi kuhusu ripoti hizi.'' Waasi walianzisha shambulio la kushtukiza Palma mapema wiki hii wakishambulia maduka, benki na kambi za jeshi. Mamia ya watu walitoroka mapigano, wakikimbilia misituni, mikoko au vijiji vya karibu. Karibu wafanyikazi wa kigeni 180 wa kampuni ya uzalishaji gesi na wazawa walitoroka katika hoteli ya Amarula Palma. Wengine walijaribu kutoroka hoteli hiyo wakiwa na msafara wa magari Ijumaa, wakielekea pwani iliyo karibu, shirika la habari la Reuters lilimnukuu Lionel Dyck akisema. Bwana Dyck anaongoza kampuni ya usalama ya kibinafsi ya Afrika Kusini inayofanya kazi na serikali ya Msumbiji. Lakini walivamiwa nje ya hoteli hiyo, Bw Dyck alisema, akiongeza kuwa watu wasiopungua 20 hapo awali walisafirishwa kwa usalama kwenye helikopta. Mtu huyo wa Afrika Kusini aliyethibitishwa kuuawa alidhaniwa alikuwa akiendesha moja ya magari yaliyotumika kutorosha watu. Chanzo kimoja kiliiambia BBC watu kadhaa walifanikiwa kuhamishwa na kufika mji wa Pemba, umbali wa kilometa 420 Kusini mwa Palma. Pia unaweza kutazama:"	https://www.bbc.com/swahili/habari-56561185
sports	Tetesi za Soka Ulaya Jumamosi 03.09.2022	Paris St-Germain ilimtoa Neymar kwa Manchester City kabla tu ya tarehe ya mwisho ya dirisha la usajili kufungwa - lakini mabingwa hao wa Ligi Kuu ya Uingereza walikataa ofa hiyo ya kumsajili mshambuliaji huyo wa Brazil, 30. (Marca - in Spanish) Manchester United ilishindwa katika ombi la siku ya mwisho la kumsajili mshambuliaji wa Uhispania Raul de Tomas, 27, kutoka Espanyol. (Football Insider) Mshambuliaji wa Uholanzi Cody Gakpo, 23, atatia saini kandarasi mpya kabisa katika klabu ya PSV Eindhoven baada ya kuwindwa na Manchester United, Leeds United na Southampton msimu huu.(Eindhovens Dagblad - in Dutch) Gakpo alidhani anaondoka PSV kwenda Manchester United hadi wiki ya mwisho ya kufungwa kwa dirisha la usajili. (90min) Tottenham walitafuta kumsajili mshambuliaji wa Ivory Coast Wilfried Zaha, 29, kutoka Crystal Palace kabla ya tarehe ya mwisho usajili. (Athletic - subscription required) Leeds United walifanikiwa kumsajili mshambuliaji wa Italia Wilfried Gnonto kwa £4m pekee baada ya kukataa kufikia bei ya FC Zurich ya pauni milioni 7 kwa ajili ya mchezaji huyo mwenye umri wa miaka 18. (Football Insider) Rais wa Las Palmas Miguel Angel Ramirez anasema alikataa ofa ya euro 25m (£21.6m) kwa mshambuliaji wa Uhispania Alberto Moleiro, 18, ambaye alihusishwa na Barcelona na Manchester City mapema msimu huu. (Marca - in Spanish) Mkurugenzi wa kandanda wa Manchester United John Murtough amekubali klabu hiyo ingeachana na mazungumzo ya kumsajili kiungo wa kati wa Uholanzi Frenkie de Jong, 25, kutoka Barcelona mapema zaidi kuliko walivyofanya. (ESPN, via Express) Bodi ya Manchester United ilipiga kura ya turufu kwa winga wa Chelsea kutoka Morocco Hakim Ziyech, 29. (Manchester Evening News) Newcastle na Aston Villa waliwasiliana na Tottenham siku ya mwisho kuhusu kumsajili kiungo wa kati wa Brazil Lucas Moura, 30. (Fabrizio Romano). Winga wa Uhispania Bryan Gil, 21, amedokeza kuwa hana furaha Tottenham baada ya uhamisho wa pili wa mkopo kwenda Valencia kutofanikiwa siku ya mwisho ya usajili huku Spurs wakishindwa kupata mbadala wake. (Sun) Kocha wa Atletico Madrid Diego Simeone anakiri kuwa anafuata maagizo ya klabu kwa kumtumia mshambuliaji wa Ufaransa Antoine Griezmann kidogo ili kuepuka kuanzisha kipengele cha euro 40m (£34.5m) katika mkataba huo ambao ulimfanya mchezaji huyo wa miaka 31 kurudi kwa mkopo kutoka Barcelona. (Sport - in Spanish) Chelsea wanatazamia kumpa kandarasi mpya beki wa Uingereza Reece James, 22, na mshambuliaji wa Uingereza Mason Mount, 23. (90min).	https://www.bbc.com/swahili/articles/cmmj118vg25o
religion	Evelyn Joshua: Mfahamu mke wa muhubiri maarufu wa Nigeria TB Joshua	Nabii Evelyn Joshua  aliyekuwa mke wa Temitope  Balogun Joshua , ametuma ujumbe wake kwenye ukurasa wa Twitter akimuomboleza mume wake ulioonekana kuwatia moyo waomboleza, kufuatia kifo cha mumewe. Amesema:''Kumpoteza mpendwa wako sio rahisi, iwe ghafla au kwa kifo kilichotarajiwa inaumiza kila mara. Kifo kinaweza kusambaratisha maisha yetu. Ndio maana ni muhimu  kuwaendelea kuwa na  Mungu. Yeye pekee ndiye anayeweza kupunguza maumivu yetu na kutufariji katika nyakati hizi. Kimbilia kwake'', uliandikwa ujumbe huo. Nabii Evelyn Joshua ni mke wa TB Joshua, Mhubiri wa televisheni tajiri na mwanzilishi wa kanisa la Synagogue, Church of All Nations. Alizaliwa tarehe 17 Disemba 1968 katika eneo la  Okala Okpumo, Jimbo la Delta  nchini , Nigeria, kwa wazazi wake Bwana  na  Bibi  Nicholas Akobundo. Kwa hivyo basi mwezi Juni, 2021 Evelyn Joshua anatimiza umri wa miaka 52. Evelyn Joshua alianza masomo yake katika Shule ya Msingi ya  St Emecheta iliyopo katika mji wa  Ezi,  katika jimbo la Delta nchini  Nigeria. Mwaka 1977, alihamia katika mji wa Lagos na kuendelea na masomo yake katika shule ya msingi ya  Orile na baadaye akaendelea na masomo ya sekondari. Alipohitimu, alipata fursa ya kufanya kazi katika  kampuni ya  Nigerian Distilleries  Ota, iliyopo katika jimbo la Ogun. Evelyn Joshua amekuwa Muhimiri katika maisha ya mumewe na huduma yake ya kanisa. Japo alionekana nadra sana kando ya mumewe wakati wa mahubiri ya mikusanyiko ya watu , Bi Evelyn ndiye Mkuu wa pili wa Kanisa la The Synagogue, Church of All Nations, na anasemekana amechangia pakubwa  katika shughuli za  huduma na maendeleo ya  kanisa hilo. Evelyn Joshua anaaminiwa kuwa ndiye mtu wa pili mwenye ushawishi zaidi katika kanisa la Synagogue baada ya mume wake. Mara kwa mara amekuwa akikutana na kuwapa ushauri nasaha watu binafsi ambao hawakuweza kukutana na TB Joshua. Pia huhubiri kanisani. Evelyne alikutana na Temitope Balogun Joshua wakati alipokuwa katika kazi zake na baadaye akawa mtu maarufu. Manamo mwaka  1990, Evelyn alisafiri katika eneo la Egbe kumtembelea dada yake, wakati alipokuwa huko alikutana na mchungaji   TB Joshua, ambaye alimzidi umri wa miaka miatano. Alikuwa amekwenda kukutana naye kwa ajili ya kupata ushauri nasaha na muongozo wa kiroho , na mkutano wao ambao ulidumu kwa muda wa dakika arobaini na tano, ulikua chanzo cha safari yao ya ndoa. Kulingana na marehemu nabii TB Joshua, kukutana na mke wake kulipangwa na Mungu, na alimuomba amuoe siku hiyo hiyo. Evelyn alikuwa na hofu juu ya ombi la ndoa ambayo haijui, licha ya kwamba alisema ndio, na wakaoana kwa miaka 30  kabla ya kufariki kwa Muinjilisti huyo tarehe 5 Juni, 2021. Ndoa yao inasemekana kukabiliwa na misukosuko na changamoto kutokana na tofauti za tamaduni zao, lakini waliweza kuzishinda changamoto hizo na kuendelea na maisha yao ya ndoa. Ndoa ya Mchungaji TB Joshua na Evelyn Joshua ilizaa matunda, kwani waliweza kubarikiwa na watoto watatu, wawili miongoni mwao wakiwa maarufu. Kulingana na Bi Evelyne TB Joshua, mume wake, hakujali sana suala la jinsia ya watoto wake licha ya kwamba watoto wa kiume huangaliwa kwa namna ya kipekee katika utamaduni wa jamii yake. Serah Joshua Serah, mwanae mkubwa kati ya mabinti zake watatu, ni muhitimu wa mafunzo ya sheria katika Chuo Kikuu cha masuala ya kiuchumi  London School of Economics na kwa sasa anasomea Shahada yake ya  uzamifu (PhD). Alisajiliwa katika baraza la mawakili nchini Nigeria kama mwanasheria anayefanya kazi hiyo mwezi Disemba 2015. Serah aliolewa na mwanaume wa Kitanzania mjini Arusha mwaka 2021. Mwanae Promise pia ni mwanafunzi wa Chuo Kikuu cha London School of Economics akisomea masomo ya mahusiano ya kimataifa na siasa . Promise kwa sasa anasomea Shahada ya uzamili. Mtoto wa mwisho mdogo kati ya watoto wa Evelyne hafahamiki, kwani hakuna taarifa zinazomuhusu.	https://www.bbc.com/swahili/habari-57395887
health	Je kuna hatari gani ya kupata mtoto baada ya kutimu  umri wa miaka 40 na zaidi?	"Shangazi yangu alijifungua mtoto akiwa na umri wa miaka 45, rafiki yangu alijifungua akiwa na umri wa miaka 47, jirani yangu akiwa na umri wa miaka 43, hii ndio misemo inayozunguka miongoni mwa wanawake na katika kanda nchi za kiarabu Licha ya hili, kauli  hizi haziwezi hazitengani na onyo kwa wanawake dhidi ya kuchelewa kupata ujauzito, "" hawataweza kuwa na uwezo wa kuwa na watoto baada ya umri fulani, lakini wanaume wanawza kupata watoto katika umri wowote ."" Je ni upi usahihi wa  wa onyo hili? Je umri wa miaka arobaini ndio wa mwisho kwa wanawake katika maisha ya wanawake pekee? Dokta Hind Abdel Salam aliiambia BBC kwamba wanawake wengi wanatarajia kwamba iwapo watafikia  umri huu hawataweza kuwa na uwezo wa kuwa na watoto, na wakati mwingine hutishwa na wale wanaowazingira  kwamba fursa za ujauzito hazipo, na hili sio kweli kabisa , kwani ukweli ni kwamba inategemea mwanamke mwenyewe, kuna wanawake wanaoweza kupata ujauzito katika umri wa miaka arobaini na minane na baadaye . Kuna tofauti katika uwezo wa kuzaa wa wanawake na wanaume, jambo muhimu  ambalo linahusiana na uwezo wa kuzaa. Kwa wanawake, kuna kupungua taratibu kwa uwezo wake wa kuzaa kuanzia umri wa miaka 35. Sababu  ya hili ni kwamba mwanamke huzaliwa na mayai yake yote ambayo anaweza kuyatengeneza katika kipindi chake chote cha maisha  na idadi hii hupungua kadri miaka ya umri wake inavyokwenda . Mwanamke huzaliwa na zaidi ya mayai ya uzazi milioni na hupungua hadi 400,000 katika umri wa kubarehe  na kufikia hadi  25,000 wakati anapofikia umri wa miaka 37, kwani wanawake wengi hupoteza  90% ya mayai ya uzazi katika umri huu, hadi mwanamke anapotimiza umei wa miaka  51 huwa na mayai 1000. Hivyo basi fursa ya kupata ujauzito hupungua taratibu kila mwezi, na kufikia %5 miongoni mwa wanawake wenye umri wa miaka 40 na zaidi, ikimaanisha kuwa fursa ya mimba bado ipo, lakini kwa kiwango cha chini. Hii pia inatofautiana kwa mwanamke na mwanamke. kwa upande mwingine, viwango vya uwezo wa kuzalisha kwa wanaume hupungua saw ana inavyotokea kwa wanawake , kinyume na inavyofahamika kwa wengi, lakini hupun gua baadaye na kwa utaratibu zaidi kuliko wanawake. Uwezo wa kuzalisha wa mwanaume hupungua kati ya umri wa miaka  40  na 45. Tofauti na mayai katika wanawake, mbegu za uzazi za mwanaume hutengenezwa katika kipindi chote cha maisha yake, lakini ubora wa mbegu hizi hupungua kadri mwanaume anapoendelea kuku ana kuwa mtu mzima na uzazi wa mtoto huhusiana na ubora way ai na mbegu ya uzazi kwa pamoja. Doaa Al-Saft aliiambia BBC  BBC, ""Baada ya kufikia umri wa miaka 40 yapata miezi sita, nilibaini kuwa ’’ Nilikuwa mjamzito na sikutarajia kabisa  ."" nilipatwa  nilipigwa na  mshangao’’  Doaa alimficha kila mtu taarifa ya ujauzito wake kwasababu aliogopa kauli za maoni ya watu kwamba "" wakati mwingine zinaweza kutofurahisha, ambapo wakati mwingine huwa wanasema bado una nguvu ya kuwa na watoto, au unapaswa kufikiria  kuhusu kuwaoza watoto wako badala ya wewe kufikiria   kupata watoto. Kutokana na hayo Duaa alikuwa akivaa mavazi makubwa katika kipindi chote cha ujauzito. Familia yake ilimuunga mkono na kumsaidia na kumpatia ushauri na kumwambia kuhusu wanawake wengine waliojifungua wakiwa na umri wa miaka 40 na wana afya njema na watoto wao wana afya njema , lakini baadhi ya marafiki madaktari walichangia katika kumtisha Duaa .  Duaa aliniambia kuhusu safari ndefu na ya kuchosha akili aliyopitia katika kumtafuta daktari ambaye angemsaidia, na anasema: ‘’Daktari niliyemuona  wa kwanza aliniambia kwamba wewe una umri mkubwa na kwamba unapaswa kuzalishwa kabla ya kuingia katika mwei wat isa wa ujauzito kutokana na hofu ya matatizo unayoweza kuyapata. Mwingine aliniandikia madawa mengi  ya kuimarisha ujauzito wangu, akidai kuwa  mimba yangu una uwezekano wa kuharibika kawababu mimi nina umri mkubwa,na ninapaswa pia kupewa dawa ya kuifanya damu iyeyuke  ""Niliogopa sana. Ninafahamu kwamba baada baada ya miaka arobaini, ubora wa mayai ya uzazi hupungua kwa kiwango kikubwa, jambo linaloweza kuathiri afya ya kijusi , kama vile kuzaliwa kwa mtoto mwenye hali   Down syndrome, kuzaliwa na kasoro za viungo, au kuwa matatizo mengine’’ Hofu kuhusu kijusin haikuwa pekee iliyotawala uzoefu wa  Dua’a, lakini piaalijihofia binafsi, hususan kutokana na msisitizo wa daktari  ambaye ’’alimtisha  kwamba anakabiliwa na uwezekano wa kupata kisukari na shinikizo la damu’’ Doaa alijifungua mtoto wake wa tano, Ammar, mapema mwaka huu, n ani mwenye afya nzuri. Doaa  ana afya njema. Anasema, ""Hakuna umri fulani wa kujifungua, lakini kuna matayarisho mazuri kwa ajili ya kujifungua. Nilijifungua mara nne kabla ya  Ammar, lakini mara hii ni tofauti kabisa. ‘’Ninahisi kukomaa zaidi na mwenye uzoefu kuliko awali . Mara hii licha ya hofu zote, Ninafurahia uzoefu sana’’."" Wakati mwingine  Doaa huhisi kwamba  Ammar anabahati na uzoefu wake na uzoefu wa awali, lakini wakati mwingine anamhurumia  , ""Ninapokwenda kwake mpangilio wa muda wake unakuwa ni kwenda  kwenye chanjo, ninahisi kuwa nimekuwa mtu mzima zaidi ya wanawake wengine wanaonizingira . Ninaogopa kumuacha mapema, lakini wakati huo ninihisi kuwa niko katika nafasi bora ya kumtunza kuliko wengine’’. Tuliwauliza wanawake na wanaume katika nchi kadhaa za kiarabu kuhusu umri unaofaa kupata mtoto , na wote walizungumzia kuhusu miaka 20 na ushee kwa mwanamke . Na wote wakaafiki kuwa mwanamke hawezi kupata mroro akiwa na zaidi ya umri wa miaka thelethini na mitano, jambo ambalo zio kweli. Daktari Hind Abdel Salam anasema, hakula chochote cha kuhofia  katika umri huu , unayohitaji ni huduma bora za matibabu  , “Iwapo kuna tabia kama vile uvutaji wa sigara au unywaji wa vilevi, mama anapaswa kuzisitisha , pamoja na kuimarisha kiwango cha sukari na uzito ili view vya kawaida. Dokta Hind anawashauri wanawake wenye umri wa miaka 40 kuendelea na mazoezi ya mwili , kupata virutubisho sahihi vya mwili na wanahitaji kuendelea kutumia vitamini muhimu wakati wa ujauzito , na kumeza  folic acid ili kuepuka matatizo yoyote ya kiafya au kuwa na vijusi vyenye kasoro. Madaktari wanasisistiza kuwa wanaweke wenye umri wa zaidi ya miaka 40 wana uwezekano mkubwa wa mimba zao kuharibika baada ya  kupata uzazi kwa njia ya IVF wakilingangishwa na wanawake wenzao waliopata watoto wakiwa na umri wa miaka  thelathini na ushee au miaka ishirini na ushee waliopata watoto kwa njia ya upandikizaji au hata kwa njia ya kawaida. Hayo pia hutokea inapokuja katika uwezo wa kunyonyesha, ambao wanawake wanaendelea kuwa nao, sawa na uwezo wa kuzaa inategemea mwanamke mmoja na mwingine, uwezo wa kutunga mimba unategemea mwanamke na mwanamke."	https://www.bbc.com/swahili/articles/cw8py37jn48o
