business	Fahamu jinsi Wakenya wanavyotumika kufanya udanganyifu Ulaya	"Mwanafunzi wa London au New York akienda mtandaoni kumlipa mtu amfanyie uandishi wa kitaaluma, kuna uwezekano mkubwa wa kazi hiyo  kufanywa na mtu kutoka nchini Kenya. Ripoti ya BBC Trending kutoka Nairobi inaangazia kuhusu waandishi wanaowasaidia wanafunzi wa kigeni kudanganya katika masomo yao. Kennedy alikuwa mwalimu lakini katika kipindi cha miaka mitano amejikwamua kimaisha kupitia njia tofauti. ""Nafanya uandishi wa kitaaluma,"" anasema. Yeye ni sehemu ya tasnia ya kimataifa mtandaoni, ambayo ni biashara kubwa nchini Kenya. Lakini kile anachofanya Kennedy na Wakenya wengine wengi wanaita ""uandishi wa kitaaluma"", kwengine duniani kinaitwa udanganyifu. Ikiwa wewe ni mwanafunzi wa Chuo Kikuu au mwanafunzi wa shule ya upili ambaye anasumbuka kufanya zoezi la masomo, basi Kennedy na timu yake ya waandishi watakufanyia- kwa ada stahiki. Wakimaliza watakupa uwasilishe zoezi hilo kana kwamba umefanya mwenyewe bora usijulikane. Wale wanaondesha biashara hiyo wanafahamika kama ""essay mill"" Tovuti, ambazo zinatumiwa na wanafunzi wanaofanya udanganyifu kutuma kazi zao wanazotaka kufanyiwa. Baadhi ya tovuti hizo ziko Marekani na Ulaya Mashariki na wale wanazoziendesha wanaweza kujipatia faida ya hadi nusu ya ada inayotozwa wateja. Kiwango anachotozwa mteja kinategemea zoezi analotaka kufanyiwa. Zoezi  likiwa rahisi ada ni kidogo lakini likiwa gumu kama vile kufanyiwa nadharia nzima ya PHD bila shaka ada anayotozwa mteja ni ya juu. Kennedy na waandishi wake alio waajiri wanakamilisha hadi insha 200 au mitihani ya mtandaoni  kwa mwezi. ""Unajiunga na mtandao kwa kutumia nambari ya usajili ya mwanafunzi na kumfanyia mtihani"" anaongezea. Watafiti ambao husoma biashara ya kile kinachoitwa ""udanganyifu wa mkataba"" wanasema Kenya ni kitovu muhimu. Sababu ni rahisi: Kenya ni nchi inayozungumza na mfumo mzuri wa elimu ambapo mara nyingi kuna fursa duni za kiuchumi, haswa kwa vijana. Njia pekee ya vijana kujikimu kimaisha ni kutumia elimu yao kuwasaidia raia wa kigeni kufikia malengo yao. Picha za wasifu wa waandishi wa kukodisha kwenye tovuti zinazotoa huduma ya uandishi wa kitaaluma zinaashiria kuwa waandishi wote ni wazungu. Lakini ukweli ni kwamba ukiomba kufanyiwa uandishi wa kitaaluma mtandaoni kuna uwezekano wa kazi hiyo kufanywa na Mkenya. Kwa Kennedy, kujiunga na tasnia hiyo ilikuwa wazo zuri. Kennedy aliye na umri wa miaka 30 anajipatia karibu shilingi elfu 150 za Kenya (karib £1000) kwa mwezi- kiwango kikubwa kidogo  kuliko mashahara wa wastani - na karibu mara nne ya mshahara aliyokuwa akipokea alipokuwa mwalimu. Lakini anajihisi vipi kwamba anasaidia kudhoofisha uadilifu wa elimu kote duniani? Kama mwalimu wa zamani anajihisi ""kuathiriwa kimaadili"" lakini anasema kwamba anafanya kwa ajili ya kujipatia kipato. ""Ninajali, lakini najali nini zaidi ya maisha yangu mwenyewe - wakati mwingine lazima uishi kwanza kufikiria maadili, ""anasema. Kennedy anajua vizuri kuwa kazi yake inaweza kumsaidia mteja kudanganya hadi wakapata shahada ambayo itawapatia ajira itakayowalipa.""Halafu unatambua sio mashindano dhidi yao. Wakati mwingine ni mashindano dhidi ya umaskini."" Ijapokuwa kuna waandishi wa kitaaluma wa kukodishwa katika nchi zingine, wale wa Kenya wamebuni mbinu yao binafsi ya kuendesha kufanya kazi hizo. Kuna makundi ya ""waandishi wa kitaaluma"" katika mitandao ya kijamii ya Facebook na Telegram ambapo kazi na programu tumishi zinauzwa.  Baadhi ya makundi hayo yana maelfu ya wanachama. Zinajumuisha wataalamu wa kiwango cha wastani ambao wanafanya kazi huku wakiendelea na masomo. David ni mmoja wa watu 10 walio katika mwaka wao wa mwisho katika Chuo Kikuu ambaye anajifadhili mweyewe kupitia njia hiyo. ""Wazazi wangu hawana uwezo wa kugharamia maisha yangu chuoni,""anasema. ""Kwa hivyo nimejiunga na tasnia hii kama njia ya kujikimu kimasomo na hata kusaidia familia yangu ."" Katika kipindi cha miaka miwili iliyopita, David amekuwa akiwaandikia wanafunzi wa Uingereza na Marekani ambao ni wateja wake karibu insha 360. Anaandika kurasa 15 kwa siku kwa ada ya shilingi 250 kw(£1.65) kwa kila ukurasa. ""Naweza kufany akazi kutoka Jumatatu hadi Ijumaa usiku na mchana, lakini natenga wikendi kuangazia masomo yangu"" Kazi hiyo imemwezesha kukunua kipande cha ardhi kijijini kwao na kuwaajiri watu wa kumfanyia shughuli ya kilimo -ambayo anasema ni uwekezaji wa siku za usoni. David amepewa kandarasi na mtu mwandamizi zaidi katika tasnia hiyo ambaye ana akaunti ya uandishi kwenye moja ya tovuti kubwa ya waandishi wa kitaaluma wa kigeni. Lakini kupata akaunti si rahisi. Kampuni zingine zinasisitiza juu ya waombaji kuwa uthibitisho wa kupita mitihani ya masomo. Akaunti zilizo na hakiki nyingi za wateja kwa nyota tano ni bidhaa muhimu na hununuliwa na kuuzwa katika vikundi vya uandishi wa kitaaluma. Hivyo ndivyo wanafunzi huhadaiwa. Huenda wakafikiria wanafanyiwa uandishi wao wa kitaaluma na mwandishi ambaye anaujuzi mkubwa. Lakini kwa kweli huenda ni mtu ambaye alinunua akaunti kutokana na sifa nzuri ""Nimenunua zaidi ya akaunti 10,"" anasema Kennedy. ""Baadhi ya akaunti hizo zinagharimu shilingi 500,000 za Kenya sawa na (£3,300). Hakuna njia nyingine ya kupata wateja."" Kuwa na akauntu ni kitu ambacho David anatazamia baada ya kuhutimu masomo yake. Akiwa na miaka 23 tu tayari ameanza kukuza kizazi kijacho. Anawapa mafunzo waandishi wa kimasomo na kuwapitishia kazi rahisi waanze kupata uzoefu. ""Kutokana na hilo  tulijenga usuhuba na kusaidiana. Kwa hivyo ni tasnia ambayo inakua."" Wengine hawavutiwi na taaluma hiyo. John alijiingiza katika uandishi wa masomo baada ya kuhitimu. Anatarajia kuachana nayo baada ya kupata kazi ya uandishi katika vyombo vya Habari. ""Kuna watu hufanyiwa kazi ya uuguzi. Singelipenda kwenda hospitali kutibiwa na mtu ambaye alimlipa mtu mwingine kumfanyia mitihani. Unajua ni hatari sana. Kwa kweli inanitia hofu sana,""anasema. ""Iinastahili kufutiliwa mbali."" Dkt Gladys Nyachieo, mhadhiri wa sosholojia katika Chuo Kikuu cha Multimedia jijini Nairobi, anaamini jukumu la kukabiliana na udanganyifu chuoni liko kwa nchi Tajiri ambazo wanafunzi wao ndio wateja wakuu. Bila mahitaji kama hayo hakungekuwa na usambazaji. ""Ikiwa wangeweza kuchukua hatua kwa mfano kupiga marufuku husuma ya uandishi wa kitaaluma upande mmoja,basi udanganyifu unaweza kupunguzwa,""anasema. Baadhi ya nchi zinachukua hatua. Mwaka jana, Australia ilipiga marufuku huduma ya kuuza insha. Sheria kama hiyo pia inazingatiwa nchini Uingereza. Lakini bado haijabainika jinsi sheria hiyo itakavyotumika kukomesha biashara ambayo inavuka mipaka ya kimataifa kwa urahisi. Kwa sasa Dkt Nyachieo anajaribu kushughukia suala hili kadri ya uwezo wake. ""Nawaambia wanafunzi wangu hayo sio maadili. Sio sawa,"" anasema. ""Lakini tunaweza kufanya hilo tu. Ndio njia ya kuishi kwa watu wengine. Kwa hivyo ni tatizo kubwa."" Baadhi ya majina katika taarifa hii yamebadilishwa"	https://www.bbc.com/swahili/habari-58497021
technology	Washawishi walemavu wanaoacha historia kwenye mitandao	"""Lazima ufanye kazi kwa bidi ili kuwa wewe uanetaka kuwa mkweli  na kuamini nembo unayoinadi."" Maneno ya ushauri kutoka kwa mshawishi mwenye ulemavu mwenye umri wa miaka 32  Tess Daly kutoka  Sheffield, ambaye hutumia wafuasi wake zaidi ya  200,000-kwenye mtandao wa kijamii wa Instagram kunadi  mafunzo yake ya vipodozi na pia nembo za urembo. Tess ambaye ni mlemavu anatumia kiti cha umeme, na ambaye ana ulemavu wa uti wa mgongo, amefanya kazi kama afisa masoko katika mitandao ya kijamii akinadi bidhaa za makampuni utrembo  kama  Boohoo  Pretty Little Thing,  pamoja nembo nyingine za vipodozi. Anafurahia neno ""mshawishi wa mitandao ya kijamii "", lakini anasema anatamani kungekuwa na watu wengi  kama yeye wakati alipokuwa akikua. ""Watu wengi sana wenye ulemavu wameniambia kuwa nimewapa ujasiri wa kujiamini, sio tu kwa kuukubali ulemavu wao, lakini pia kuweza kujipodoa wenyewe,""anasema. Tess ni mmoja washawishi walemavu ambao idadi yao inaendelea kuongezeka wanaofanya kazi katika kampuni ya  Martyn Sibley  na shirika lake la masoko ya kimtandao linalofahamika kama Purple Goat, ambalo lilizinduliwa mwanzoni mwa maagizo ya kukaa nyumbani (lockdown) mwaka jana. Tess Daly anasema anapenda neno  ""mshawishi wa mitandao ya kijamii"", licha ya kuwa wa aina yake Martyn, ambaye alizaliwa na ulemavu, alianza shirika lake kama sehemu ya mpango wake wa kujumuisha dunia nzima ""Ninaamini kwa kusaidia biashara kubwa kupata faida zaidi kupitia wanunuzi wenye ulemavu kupitia walemavu wenye ushawishi, tutaweza kujumuisha watu wote haraka,"" alisema. ""Kwa njia hii kila mtu ananufaika ."" Purple Goat imefanya kazi na watu wenye ushawishi zaidi ya 75 hadi sasa, lakini Martyn yuko makini kusema kuwa kuwa sio shirika la vipaji ambalo lina watu binafsi liliowapanga kufanya kazi nao. ""Tunafanya kazi kwa ajili ya wateja na kutafuta washawishi wanaofaa kwa kila anaeleza. Takriban watu milioni 14.1 nchini Uingereza wana aina fulani ya ulemavu, na  idadi hiyo ya watu inakuwa ni kubwa inapokuja katika soko la biashara. Hii ilikuwa ni sababu kubwa iliyomfanya Martyn afungue kampuni ya Purple Goat. Anadhani kuwa dunia ya masoko na utangazaji wa biashara sasa inatambua zaidi jamii, na iko tayari  kwa mabadiliko. "" Ninaamini kuwa  kwa sehemu ni njia ya maoni ya umma ambayo yameboreshwa kuhusiana na ujumuishwaji wa watu mbali mbali  ,"" anasema. ""Nembo zimekuwa na hofu ya kufany amakosa katika kuwazungumzia walemavu, lakini sasa wanahofu ya kuitwa kwa kutofanya chochote."" Tess ameshuhudia kuongezeka kwa idadi ya watu wenye ulemavu kuajiriwa na kuwa maarufu katika mitandao ya kijamii . Hadi mwaka jana, lilikuwa ni jambo alilofanya kama kazi ya ziada, lakini kufikia mwishoni mwa mwaka 2020, alichukua jukumu kamili la kuwa mshawishi katika mitandao ya kijamii  na sasa nafanya kazi na wakala kumpunguzia kazi nyingi. Haikuwa rahisi kama watu wanavyoweza kufikiria, anasema. ""Huwezi tu kuamka siku moja na kuamua unataka kuwa mshawishi wa mitandao ya kijamii ."" 'Kudai kuonekana' Mwaka jana  nembo ya viatu vya thamani ya mjini London-  Kurt Geiger  ilianza kufanya kazi na mwanamitindo na mshawishi mlemavu  ambaye hana baadhi ya viungo wa  Ireland Kaskazini   Bernadette Hagans. Mtendaji mkuu wa kampuni, Neil Clifford, anafikiria kwamba kuongezeka kwa washawishi walemavu kumetokana na mabadiliko ya umma. ""Maendeleo ya mitandao ya kijamii yamefanya wale ambao awali walikuwa hawawakilishwi machoni mwa umma kupaza sauti na kwa na sasa hivi ndio wanataka kuonekana hasa,"" alisema. Kujitokeza kwa makampuni makubwa makubwa na kuonesha kuunga mkono hatua hii, ni jambo ambalo wanahisi kuwa jukumu lao ili kuepuka ukosaji, amesema. Ameongeza kuwa: ""Washawishi walemavu wanahitaji kuwa na uhusiano na kile wanachokihamasisha ili kuwa na maana. Kuwa na msemaji mwenye ulemavu pia kunaongeza kiwango cha uaminifu katika kampuni."" Caroline Casey ni muasisi wa kampuni ya Valuable 500, ambayo kote duniani inahamasisha makampuni kupigania mahitaji ya watu walemavu katika kiwango cha bodi. Bernadette Hagans, aliyefanyakazi na Kurt Geiger, pamoja na Ellie Goldstein, mwanamitindo aliyezaliwa na tatizo la kasoro katika vinasaba yaani 'Down syndrome', mwaka jana picha yake ilikuwa iliyopendwa zaidi katika mtandao wa Instagram wa kampuni ya vipodozi ya Gucci. Laura anasema wameshuhudia ongezeko la makampuni makubwa makubwa yanayotumia washawishi walemavu kufikia walengwa mbalimbali katika biashara zao."	https://www.bbc.com/swahili/habari-56211192
sports	Diego Maradona: Misemo mitano ya kukumbukwa kutoka kwa nyota wa Argentina	"Diego Armando Maradona, ambaye alifariki Jumatano akiwa na umri wa miaka 60, alikuwa na uwezo mkubwa uwanjani, lakini pia alikuwa kwenye vichwa vya habari ulimwenguni kote na taarifa zake ziliandikwa sana. Nyota huyo wa soka alifariki huko Buenos Aires wakati akipata tiba ya kujizuia kunywa pombe mara baada ya kutoka kwenye operesheni ya kichwa ambayo ilifanywa wiki kadhaa zilizopita. BBC  tunakukumbusha baadhi ya misemo yake maarufu ya mhusika wa michezo, ambaye ameacha alama yake ndani na nje ya uwanja wa mpira Labda msemo mashuhuri zaidi wa Maradona ni ule alioutamka katikati ya Kombe la Dunia la 1994 huko Marekani, wakati aliposimamishwa kutoka katika mashindano baada ya kupimwa akiwa na changamoto ya kupambana na dawa za kulevya: ""Sikutumia dawa za kulevya, walikata miguu yangu, ""alisema. Maneno hayo baadae yaliingia kwenye taarifa za kila siku za Waargentina. Maradona mnamo Novemba 10, 2001 kwenye sherehe yake ya kuaga kucheza soka. Maneno haya mashuhuri, ambayo yalikua karibu kauli mbiu ya maisha yake, yalitamkwa wakati wa mechi yake ya kuaga, ambayo ilifanyika kwenye uwanja wa La Bombonera, nyumbani kwa kilabu cha Boca Juniors, ambapo alimaliza miaka yake kama mchezaji wa mpira wa miguu mnamo Novemba 10, 2001 . Baada ya mchezo, na akiwa amevaa jezi ya bluu na dhahabu, aliwaambia umati uliojaza uwanja huo alasiri: ""Soka ndio mchezo mzuri zaidi na wenye afya zaidi ulimwenguni. Nilikuwa nimekosea na nililipa. Lakini mpira haujawa na rangi "". Hadithi ya soka ya Argentina, ambaye aliongoza nchi yake kushinda Kombe la Dunia la 1986, alikufa Jumatano ya kukamatwa kwa moyo. Mabao 34 katika michezo 91 iliyochezewa Argentina. Wakati mwingine alikuwa kama nahodha wa timu ya Argentina kwenye fainali za  Kombe la Dunia . Ilikuwa Juni 22, 1986, Robo Fainali ya Kombe la Dunia huko Mexico. Maradona aliangaza kama hakuna mchezaji mwingine kwenye viwanja vya Mexico. Mchezo mmoja wapo wa kukumbukwa zaidi katika historia ya mpira wa miguu, haswa kwa michezo yake miwili. Ya kwanza ilitokea kwa dakika 6 ya nusu ya pili. Maradona anaepuka wapinzani kadhaa, anajaribu kuipeleka kwa mwenzake Jorge Valdano, lakini beki Hodge anaikataa kuelekea kipa wake, Peter Shilton. Wakati kipa anapokaribia kuudaka mpira, Maradona anaruka juu na kugusa mpira kwa hila kwa mkono wake. Licha ya madai ya Waingereza, mwamuzi wa Tunisia Ali Bin Nasser alithibitisha bao hilo. Mchezo uliendelea, Dakika ya 10 ya kipindi cha pili, Maradona aliuchukua tena mpira na kuwakwepa wapinzani sita na kufunga bao la pili. Alama hii iliitwa ""lengo la karne. Wakati waandishi wa habari walimwuliza nyota huyo wa Argentina ikiwa lengo la kwanza lilikuwa na mkono wake, jibu lake liliingia kwenye historia: ""Nilifanya hivyo kwa kichwa cha Maradona, lakini kwa mkono wa Mungu."" Kwa mchezo wa mwisho wa kufuzu kwa Kombe la Dunia la 2010 huko Afrika Kusini, Julio Grondona, mkuu wa wakati huo wa Chama cha Soka cha Argentina (AFA), aliamua kuwa chaguo bora kuongoza timu hiyo ni Maradona. Diego Armando Maradona amefariki akiwa  zaidi ya mwanasoka mkubwa katika historia ya Argentina. Ilikuwa uainishaji wa uvumilivu, ambao ulifanikiwa tu baada ya mechi ya Epic dhidi ya Uruguay tarehe ya mwisho, Oktoba 14, 2009. Maradona alikuwa mkufunzi wa Argentina kati ya 2009 na 2010. Ukosoaji kutoka kwa waandishi wa habari ulikuwa bila kuchoka kwa jinsi albiceleste alicheza na Maradona alikuwa tayari kurudisha neema kwenye mkutano wa waandishi wa habari baada ya mechi. ""Kwa wale ambao hawakuamini, kwa wale ambao hawakuamini, na msamaha wa wanawake, wamuonyeshe, waendelee kumnyonya. Mimi ni mweusi au mweupe, sitakuwa mvi (milele) maishani mwangu. Mh? Je! Ulinitenda vile ulivyonitenda? Endelea kunyonya, ""alisema na furaha na kwa lugha ya porini. Lakini ilikuwa zamu ya kumuuliza mwandishi wa habari Juan Carlos Pasman, ambaye pia alikuwa amepinga usimamizi wa nyota huyo wa Argentina. Na hapo ndipo Maradona alipojitolea sura tofauti kwake. Athari ya msemo huo ilikuwa kubwa sana hivi kwamba mwandishi wa habari mwenyewe baadaye alichapisha kitabu kilicho na kichwa ""Unacho ndani."" Mwerevu ndani na nje ya uwanja, Maradona alikufa Jumatano hii huko Buenos Aires. ""Ilikuwa ni kama kuiba mkoba wa Waingereza"" Kama nyota kubwa aliyokuwa, Maradona pia aliandika kumbukumbu zake. Kitabu hicho kiliitwa ""Yo soy el Diego"". Katika kitabu anachorejelea, kwa kweli, kwenye mkutano huo maarufu dhidi ya Waingereza, ambao ulikuwa na muktadha wa kisiasa uliopita: vita vya Malvinas / Falklands, ambavyo viligombanisha Argentina dhidi ya Uingereza kudhibiti visiwa vya jina moja, mnamo Aprili 1982 . Karibu Waargentina 650 walikufa katika vita hivyo. Maradona: Miongo 6 ya mpira wa miguu 1960 Diego alizaliwa huko Lanús na kukulia katika Villa Fiorito, Buenos Aires. Mnamo 1976 alianza kucheza kwa Wajerumani wa Juniors. 1979 Ushindi wa kwanza wa Kombe la Dunia na timu ya soka ya U-20 ya Argentina. 1986 ""Mkono wa Mungu"" maarufu dhidi ya England huko Mexico 86. Argentina inashinda Kombe la Dunia kwa kuishinda Ujerumani Magharibi. 1997   Ana 37 anastaafu kama mchezaji wa kitaalam, baada ya mtihani wa tatu  wa dawa . 2000 alishinda tuzo ya FIFA mchezaji wa karne. 2008 Yeye ndiye mkufunzi wa timu ya kitaifa ya Argentina kwa miaka miwili na anaendelea kusimamia timu hadi kifo chake mnamo Novemba 2020. Katika kitabu hicho, Maradona anakiri kwamba kweli alifunga bao hilo kwa mkono wake, lakini akafafanua. ""Wakati mwingine nahisi kwamba nilipenda wa kwanza zaidi, ule wa mkono. Sasa naweza kusema kile ambacho sikuweza wakati huo, kile nilichofafanua wakati huo kama mkono wa Mungu. Ni mkono gani wa Mungu, ulikuwa mkono wa Diego! Na ilikuwa kama kuiba mkoba wa Waingereza, pia, ""aliandika. Na katika hafla nyingine, alikubali kwamba mechi hii ilikuwa maalum kutoka dakika ya 1. ""Wakati mpira wa England uliruka, haikuepukika kutofikiria juu ya wavulana wa Malvinas."" Maradona anatabasamu. Mtu ambaye alikuwa na utata nje ya uwanja. Maneno ambayo yamekwenda mbali katika mitaa ya Argentina. Nyota huyo wa Argentina aliitangaza baada ya kupata habari ya kushangaza. Mnamo 1993, balozi wa Marekani huko Argentina ilisemekana alikuwa akitafuta kobe ambaye alikuwa amepotea kwa mtoto wake wa miaka 11. Polisi wa ujasusi wa Argentina walihusika katika operesheni hiyo. Kwa kweli, Maradona hakukosa nafasi ya kutoa maoni juu ya hali hiyo, ambayo hata iliripotiwa katika magazeti ya nchi hiyo. Alipoulizwa juu ya kesi hiyo, alisema: ""Kobe alimtoroka. Huwezi kutoroka kobe, kaka. Wantembea mita 100 kwa siku 15."" Msemo sasa unatumiwa na Waargentina wengi kuelezea watu ambao huitikia polepole."	https://www.bbc.com/swahili/55084882
technology	Grace Omutoni: WhatsApp yamuunganisha 'kimiujiza' yatima wa mauaji ya kimbari na familia yake Rwanda	"Msichana aliyekuwa yatima akiwa na umri wa miaka miwili wakati wa mauaji ya kimbari ya Rwanda ya 1994 hivi karibuni amepatana na jamaa zake kupitia  ""miujiza"" ya mtandao wa kijamii. Grace Umutoni, ambaye hakujua jina lake la kuzaliwa, aliweka picha zake  kadhaa katika makundi ya WhatsApp, Facebook na Twitter mwezi Aprili kuona kama zinaweza kumsaidia kutafuta watu wa familia yake - baada ya kushindwa katika juhudi za kuwatafuta kupitia njia rasmi. Kile anachofahamu muuguzi huyo mwenye umri wa miaka 28 - kuhusu maisha yake ni kwamba alilelewa katika makazi ya watoto yatima katika mji mkuu wa Kigali, mtaa wa Nyamirambo akiwa na ndugu yake wa kiume aliyekuwa na miaka minne wakati huo na ambaye baadae alifariki dunia. Kuna maelfu ya watoto kama Bi Utomoni, ambao waliwapoteza ama kutenganishwa na wazazi wao wakati wa ghasia zilizogeuka mauaji ya kimbari na kusababisha kuuawa kwa zaidi ya watu 800,000 kutoka jamii ya Tutsi na Wahutu waliokuwa na msimamo wa kadri ndani ya siku 100. Baadhi yao bado wanawatafuta jamaa zao - hali ambayo wakati mwingine huwa vigumu kwa sababu kitamaduni familia hazitumii jina moja. Baada ya kuweka picha zake mtandaoni, watu wachache walidai kuwa jamaa zake - lakini miezi kadhaa baadae kuna mtu aliyemfanya awe na hisia kwamba bila shaka ni mtu wa familia yake. Antoine Rugagi baada ya kuona picha yake kwenye kundi la WhatsApp aliwasiliana naye na kumwambia anafanana sana na dada yake anayeitwa Liliose Kamukama, ambaye aliuawa siku za kwanza za mauaji ya kimbari ya Aprili 1994. ""Nilipomuona, niliona jinsi tulivyofanana,"" Bi Umutoni aliambia BBC Idhaa ya Great Lakes kumhusu mtu huyo ambaye huenda ni mjomba yake. ""Lakini ni uchunguzi wa chembechembe za vinasaba vya (DNA) ndio ambao utathibitisha ikiwa tuna uhusiano. Kwa hivyo tulienda kufanya uchunguzi huo Kigali mwezi Julai."" Bi Umutoni alisafiri kutoka kusini mwa wilaya ya Gakenke ambako anafanya kazi naye Bwana Rugagi alikuja kutoka nyumbani kwake Gisenyi eneo la magharibi kuja kuchukua matokeo ya DNA pamoja. Ilikuwa siku kubwa sana kwao kwa sababu matokeo yalionesha kuwa asilimia 82 huenda wanahusiana. ""Nilishtuka sana, sikuamini kilichotokea na mpaka leo inanikalia kama ndoto, ni miujiza niliyokuwa nikiomba,"" anasema Umutoni. Mjomba wake waliyepatana upya alimwambia jina lake alilopewa na wazazi wake Watutsi lilikuwa Yvette Mumporeze. Pia alimkutanisha na familia yake upande wa baba. Miongoni mwao Shangazi yake Marie Josée Tanner Bucura, ambaye amekwama  Switzerland kwa miezi kadhaa kutokana na janga la virusi vya corona. Hata kabla ya matokeo ya uchunguzi wa DNA kutolewa, alikuwa na uhakika Grace Umutoni ni mtoto wa kaka yake kwa kumlinganisha na picha katika albamu ya zamani ya familia. ""Msichana huyu bila shaka ni binti ya kaka yangu Aprice Jean Marie Vianney na mke wake Liliose Kamukama. Wote wawili waliuawa katika mauaji ya kimbari."" Bi Bucura pia alimwambia jina la ndugu yake aliyempeleka katika makazi ya watoto yatima ni Yves Mucyo - alikumbuka jina la kwanza tu - ambaye pia alikuwa na ndugu mmoja wa kiume kwa jina Fabrice. Mauaji ya kimbari yalianza baada ya ndege iliyokuwa imewabeba marais wa Rwanda na Burundi - wote kutoka jamii ya Hutu - kudunguliwa usiku wa Aprili tarehe sita 1994, mauaji yakaanza siku iliyofuata. Wanamgambo wa Kihutu waliambiwa kuwasaka na kuwaangamiza watu kutoka jamii ya Watutsi walio wachache - mtaa wa  Nyamirambo viungani mwa Kigali ukiwa moja ya maeneo yaliyolengwa kwanza. Watu waliuawa kwa kukatwa mapanga majumbani mwao au katika vizuizi vya barabarani vilivyowekwa kuwakagua wale waliokuwa wakitoroka  - baadhi yao walifanikiwa kukimbilia maeneo salama Kanisani na Misikitini ghasia za Nyamirambo zilipozidi. Bi Bucura anasema kuna mtu alimuona mwanamke akimshika mkono Yves na kutoroka naye - lakini hakufanikiwa kupata taarifa zozote kumhusu. Hakuna kilichojulikana kumhusu dada yake. Mauaji ya kimbari yalimalizika July 1994 baada ya waasi wa kundi la Tutsi,  Rwandan Patriotic Front (RPF) wakiongozwa na Rais Paul Kagame, kuchukua madaraka. ""Tulidhani hakuna mtu aliyenusurika, na tumekuwa tukiwaomboleza kila mwezi April wakati wa ukumbusho wa mauaji ya kimbari,"" Bi Bucura alielezea. PICHA.....MAP Alipokuwa akikuwa, Bi. Umutoni hakuweza kupata maelezo zaidi kuhusu familia yake kwasababu Yves alifariki muda mfupi baada ya kufika katika makazi ya watoto yatima. Aliambiwa alifariki kutokana na majeraha ya risasi aliyopata akitoroka mashambulio ya waasi wa Kihutu. Akiwa na miaka minne alisaidiwa na kulelewa na familia moja ya Tutsi kusini mwa nchi, ambayo ilimpatia jina la Grace Umutoni. ""Akiwa shule ya upili maafisa walimsaidia kurudi katika makazi ya mayatima mjini  Kigali kuulizia kama kuna maelezo yoyote kuhusu alikotoka, lakini hakufanikiwa,"" anasema. ""Nimekuwa nikiishi kwa majozsi kwa kuwa mtu asiyekuwa na jamaa zake, lakini niliendelea kuomba Mungu nipate muujiza. ""Japo wazazi wangu wa kunilea walinitunza vizuri, sikuweza kamwe kuwafikiria wazazi wangu halisi. Nilichokifahamu kuhusu jamaa zangu ni jina la Yves na Nyamirambo -maelezo kidogo sana kuanza kufanya uchunguzi."" Anasubiri kwa hamu kujua mengi kuhusu wazazi wake - na hafla itakayozikutanisha familia inayopangwa nchini Rwanda na kwengineko, japo janga la corona limechelewesha mpango huo. Kwa sasa, amekuwa akitambulishwa kwa familia yake kupitia WhatsApp - na sasa amegundua kuwa ana ndugu wa kambo anayeishi Kigali. Baba yake alimzaa alipokuwa kwenye mahusiano kabla ya ndoa."	https://www.bbc.com/swahili/habari-54275719
